create schema identity_schema;
set current_schema = identity_schema;
drop table if exists t1;
NOTICE:  table "t1" does not exist, skipping
create table t1(id serial primary key,name varchar(10));
NOTICE:  CREATE TABLE will create implicit sequence "t1_id_seq" for serial column "t1.id"
NOTICE:  CREATE TABLE / PRIMARY KEY will create implicit index "t1_pkey" for table "t1"
insert into t1(name) values('zhangsan');
insert into t1(name) values('lisi');
insert into t1(name) values('wangwu');
select SCOPE_IDENTITY();
 scope_identity 
----------------
               
(1 row)

select ident_current('t1');
 ident_current 
---------------
              
(1 row)

drop table t1;
CREATE TABLE book(bookId int IDENTITY, bookname NVARCHAR(50), author NVARCHAR(50));
NOTICE:  CREATE TABLE will create implicit sequence "book_bookid_seq_identity" for serial column "book.bookid"
INSERT INTO book VALUES('book1','author1'),('book2','author2');
INSERT INTO book(bookname,author) VALUES('book3','author3'),('book4','author4');
INSERT INTO book VALUES(3,'book5','author5');
ERROR:  INSERT has more expressions than target columns
LINE 1: INSERT INTO book VALUES(3,'book5','author5');
                                          ^
select * from book;
 bookid | bookname | author  
--------+----------+---------
      1 | book1    | author1
      2 | book2    | author2
      3 | book3    | author3
      4 | book4    | author4
(4 rows)

ALTER table book add column id int identity;
ERROR:  multiple identity specifications for column "bookid" of table "book"
ALTER table book alter bookId type text;
ERROR:  Identity column 'bookid' data type invalid.
drop table if exists book;
CREATE TABLE book(id int identity, bookId int IDENTITY, bookname NVARCHAR(50), author NVARCHAR(50));
NOTICE:  CREATE TABLE will create implicit sequence "book_id_seq_identity" for serial column "book.id"
ERROR:  table can only have one identity column
CREATE TABLE book
(
    bookId int NOT NULL PRIMARY KEY IDENTITY, 
    bookname NVARCHAR(50), 
    author NVARCHAR(50)
);
NOTICE:  CREATE TABLE will create implicit sequence "book_bookid_seq_identity" for serial column "book.bookid"
NOTICE:  CREATE TABLE / PRIMARY KEY will create implicit index "book_pkey" for table "book"
INSERT INTO book VALUES('book1','author1'),('book2','author2');
select * from book;
 bookid | bookname | author  
--------+----------+---------
      1 | book1    | author1
      2 | book2    | author2
(2 rows)

drop table if exists book;
CREATE TABLE book
(
    bookId int NOT NULL PRIMARY KEY IDENTITY(3,5), 
    bookname NVARCHAR(50), 
    author NVARCHAR(50)
);
NOTICE:  CREATE TABLE will create implicit sequence "book_bookid_seq_identity" for serial column "book.bookid"
NOTICE:  CREATE TABLE / PRIMARY KEY will create implicit index "book_pkey" for table "book"
INSERT INTO book VALUES('book1','author1'),('book2','author2');
select * from book;
 bookid | bookname | author  
--------+----------+---------
      3 | book1    | author1
      8 | book2    | author2
(2 rows)

delete book where bookId=8;
select * from book;
 bookid | bookname | author  
--------+----------+---------
      3 | book1    | author1
(1 row)

INSERT INTO book(bookname,author) VALUES('book3','author3'),('book4','author4');
select * from book;
 bookid | bookname | author  
--------+----------+---------
      3 | book1    | author1
     13 | book3    | author3
     18 | book4    | author4
(3 rows)

drop table if exists book;
CREATE TABLE book
(
    bookId tinyint NOT NULL PRIMARY KEY IDENTITY(3,5), 
    bookname NVARCHAR(50), 
    author NVARCHAR(50)
);
NOTICE:  CREATE TABLE will create implicit sequence "book_bookid_seq_identity" for serial column "book.bookid"
NOTICE:  CREATE TABLE / PRIMARY KEY will create implicit index "book_pkey" for table "book"
drop table if exists book;
CREATE TABLE book
(
    bookId smallint NOT NULL PRIMARY KEY IDENTITY(3,5), 
    bookname NVARCHAR(50), 
    author NVARCHAR(50)
);
NOTICE:  CREATE TABLE will create implicit sequence "book_bookid_seq_identity" for serial column "book.bookid"
NOTICE:  CREATE TABLE / PRIMARY KEY will create implicit index "book_pkey" for table "book"
drop table if exists book;
CREATE TABLE book
(
    bookId bigint NOT NULL PRIMARY KEY IDENTITY(3,5), 
    bookname NVARCHAR(50), 
    author NVARCHAR(50)
);
NOTICE:  CREATE TABLE will create implicit sequence "book_bookid_seq_identity" for serial column "book.bookid"
NOTICE:  CREATE TABLE / PRIMARY KEY will create implicit index "book_pkey" for table "book"
drop table if exists book;
CREATE TABLE book
(
    bookId numeric NOT NULL PRIMARY KEY IDENTITY(3,5), 
    bookname NVARCHAR(50), 
    author NVARCHAR(50)
);
NOTICE:  CREATE TABLE will create implicit sequence "book_bookid_seq_identity" for serial column "book.bookid"
NOTICE:  CREATE TABLE / PRIMARY KEY will create implicit index "book_pkey" for table "book"
drop table if exists book;
CREATE TABLE book
(
    bookId decimal NOT NULL PRIMARY KEY IDENTITY(3,5), 
    bookname NVARCHAR(50), 
    author NVARCHAR(50)
);
NOTICE:  CREATE TABLE will create implicit sequence "book_bookid_seq_identity" for serial column "book.bookid"
NOTICE:  CREATE TABLE / PRIMARY KEY will create implicit index "book_pkey" for table "book"
drop table if exists book;
CREATE TABLE book
(
    bookname NVARCHAR(50),
    author NVARCHAR(50)
);
ALTER TABLE book add bookId int not null primary key identity;
NOTICE:  ALTER TABLE will create implicit sequence "book_bookid_seq_identity" for serial column "book.bookid"
NOTICE:  ALTER TABLE / ADD PRIMARY KEY will create implicit index "book_pkey" for table "book"
INSERT INTO book VALUES('book1','author1'),('book2','author2');
select * from book;
 bookname | author  | bookid 
----------+---------+--------
 book1    | author1 |      1
 book2    | author2 |      2
(2 rows)

delete book where bookId=8;
select * from book;
 bookname | author  | bookid 
----------+---------+--------
 book1    | author1 |      1
 book2    | author2 |      2
(2 rows)

INSERT INTO book(bookname,author) VALUES('book3','author3'),('book4','author4');
select * from book;
 bookname | author  | bookid 
----------+---------+--------
 book1    | author1 |      1
 book2    | author2 |      2
 book3    | author3 |      3
 book4    | author4 |      4
(4 rows)

drop table if exists book;
CREATE TABLE book
(
    bookId int NOT NULL PRIMARY KEY IDENTITY(100,100),
    bookname NVARCHAR(50),
    author NVARCHAR(50)
);
NOTICE:  CREATE TABLE will create implicit sequence "book_bookid_seq_identity" for serial column "book.bookid"
NOTICE:  CREATE TABLE / PRIMARY KEY will create implicit index "book_pkey" for table "book"
INSERT INTO book VALUES('book1','author1'),('book2','author2');
INSERT INTO book(bookname,author) VALUES('book3','author3'),('book4','author4');
select * from book;
 bookid | bookname | author  
--------+----------+---------
    100 | book1    | author1
    200 | book2    | author2
    300 | book3    | author3
    400 | book4    | author4
(4 rows)

drop table if exists book;
CREATE TABLE book
(
    bookId tinyint NOT NULL PRIMARY KEY IDENTITY(-1,1), 
    bookname NVARCHAR(50), 
    author NVARCHAR(50)
);
NOTICE:  CREATE TABLE will create implicit sequence "book_bookid_seq_identity" for serial column "book.bookid"
ERROR:  Identity column contains invalid SEED.
drop table if exists book;
NOTICE:  table "book" does not exist, skipping
CREATE TABLE book
(
    bookId tinyint NOT NULL PRIMARY KEY IDENTITY(0,-1), 
    bookname NVARCHAR(50), 
    author NVARCHAR(50)
);
NOTICE:  CREATE TABLE will create implicit sequence "book_bookid_seq_identity" for serial column "book.bookid"
ERROR:  Identity column contains invalid INCREMENT.
drop table if exists book;
NOTICE:  table "book" does not exist, skipping
CREATE TABLE book
(
    bookId tinyint NOT NULL PRIMARY KEY IDENTITY(255,256), 
    bookname NVARCHAR(50), 
    author NVARCHAR(50)
);
NOTICE:  CREATE TABLE will create implicit sequence "book_bookid_seq_identity" for serial column "book.bookid"
ERROR:  Identity column contains invalid INCREMENT.
drop table if exists book;
NOTICE:  table "book" does not exist, skipping
CREATE TABLE book
(
    bookId smallint NOT NULL PRIMARY KEY IDENTITY(32767,32768), 
    bookname NVARCHAR(50), 
    author NVARCHAR(50)
);
NOTICE:  CREATE TABLE will create implicit sequence "book_bookid_seq_identity" for serial column "book.bookid"
ERROR:  Identity column contains invalid INCREMENT.
drop table if exists book;
NOTICE:  table "book" does not exist, skipping
CREATE TABLE book
(
    bookId bigint NOT NULL PRIMARY KEY IDENTITY(-9223372036854775808,1),
    bookname NVARCHAR(50), 
    author NVARCHAR(50)
);
NOTICE:  CREATE TABLE will create implicit sequence "book_bookid_seq_identity" for serial column "book.bookid"
NOTICE:  CREATE TABLE / PRIMARY KEY will create implicit index "book_pkey" for table "book"
drop table if exists book;
CREATE TABLE book
(
    bookId text NOT NULL PRIMARY KEY IDENTITY, 
    bookname NVARCHAR(50), 
    author NVARCHAR(50)
);
ERROR:  Identity column 'bookid' data type invalid.
drop table if exists book;
NOTICE:  table "book" does not exist, skipping
CREATE TABLE book
(
    bookId numeric(4,2) NOT NULL PRIMARY KEY IDENTITY, 
    bookname NVARCHAR(50), 
    author NVARCHAR(50)
);
ERROR:  Identity column 'bookid' data type invalid.
CREATE TABLE book(id serial, bookId int identity default 5, bookname char(20));
NOTICE:  CREATE TABLE will create implicit sequence "book_id_seq" for serial column "book.id"
NOTICE:  CREATE TABLE will create implicit sequence "book_bookid_seq_identity" for serial column "book.bookid"
ERROR:  multiple default values specified for column "bookid" of table "book"
CREATE TABLE t_identity(id serial, col int identity(5,10), col2 text)
partition by range(col)(
partition p1 VALUES LESS THAN (10),
partition p2 VALUES LESS THAN (20),
partition p3 VALUES LESS THAN (30),
partition p4 VALUES LESS THAN (MAXVALUE)
);
NOTICE:  CREATE TABLE will create implicit sequence "t_identity_id_seq" for serial column "t_identity.id"
NOTICE:  CREATE TABLE will create implicit sequence "t_identity_col_seq_identity" for serial column "t_identity.col"
insert into t_identity(col2) values('abc');
insert into t_identity(col2) values('def');
insert into t_identity(col2) values('ghi');
insert into t_identity(col2) values('jkl');
select * from t_identity partition(p1);
 id | col | col2 
----+-----+------
  1 |   5 | abc
(1 row)

select * from t_identity partition(p2);
 id | col | col2 
----+-----+------
  2 |  15 | def
(1 row)

select * from t_identity partition(p3);
 id | col | col2 
----+-----+------
  3 |  25 | ghi
(1 row)

select * from t_identity partition(p4);
 id | col | col2 
----+-----+------
  4 |  35 | jkl
(1 row)

drop table t_identity;
create table t_identity_0020(id int identity, name varchar(10));
NOTICE:  CREATE TABLE will create implicit sequence "t_identity_0020_id_seq_identity" for serial column "t_identity_0020.id"
insert into t_identity_0020(name) values('zhangsan');
select scope_identity();
 scope_identity 
----------------
              1
(1 row)

alter table t_identity_0020 drop column id;
select scope_identity();
 scope_identity 
----------------
              1
(1 row)

drop table t_identity_0020;
create table t_identity_0032(id int identity(1,2), name varchar(10));
NOTICE:  CREATE TABLE will create implicit sequence "t_identity_0032_id_seq_identity" for serial column "t_identity_0032.id"
insert into t_identity_0032(name) values('zhangsan');
select SCOPE_IDENTITY();
 scope_identity 
----------------
              1
(1 row)

drop table t_identity_0032;
select SCOPE_IDENTITY();
 scope_identity 
----------------
              1
(1 row)

create table t_identity_0020(id int identity, name varchar(10));
NOTICE:  CREATE TABLE will create implicit sequence "t_identity_0020_id_seq_identity" for serial column "t_identity_0020.id"
insert into t_identity_0020(name) values('zhangsan');
insert into t_identity_0020(name) values('lisi');
insert into t_identity_0020(name) values('wangwu');
insert into t_identity_0020(name) values('zhaoliu');
select scope_identity();
 scope_identity 
----------------
              4
(1 row)

drop table t_identity_0020;
select scope_identity();
 scope_identity 
----------------
              4
(1 row)

create table t_identity_0021(id int identity, name varchar(10));
NOTICE:  CREATE TABLE will create implicit sequence "t_identity_0021_id_seq_identity" for serial column "t_identity_0021.id"
insert into t_identity_0021(name) values('zhangsan');
insert into t_identity_0021(name) values('lisi');
insert into t_identity_0021(name) values('wangwu');
insert into t_identity_0021(name) values('zhaoliu');
insert into t_identity_0021(name) values('qianqi');
select scope_identity();
 scope_identity 
----------------
              5
(1 row)

drop table t_identity_0021;
select scope_identity();
 scope_identity 
----------------
              5
(1 row)

CREATE TABLE t_identity(id decimal(12) not null identity(1,1), col text);
NOTICE:  CREATE TABLE will create implicit sequence "t_identity_id_seq_identity" for serial column "t_identity.id"
insert into t_identity values('aaa');
select * from t_identity;
 id | col 
----+-----
  1 | aaa
(1 row)

drop table if exists t_identity;
CREATE TABLE t_identity(id decimal(12,2) not null identity(1,1), col text);
ERROR:  Identity column 'id' data type invalid.
create schema sch_1130412;
create table sch_1130412.tab_1130412(a1 sql_variant);
insert into sch_1130412.tab_1130412 values('aa'::char(8)),('cc'::char(8));
select * from sch_1130412.tab_1130412 order by a1;
    a1    
----------
 aa      
 cc      
(2 rows)

drop table sch_1130412.tab_1130412;
drop schema sch_1130412;
drop table if exists t_identity_0020;
NOTICE:  table "t_identity_0020" does not exist, skipping
create table t_identity_0020(id int identity(1,50), name varchar(10));
NOTICE:  CREATE TABLE will create implicit sequence "t_identity_0020_id_seq_identity" for serial column "t_identity_0020.id"
DO $$ 
DECLARE last_id date; 
BEGIN 
INSERT INTO t_identity_0020 (name) VALUES ('示例'); 
last_id := scope_identity(); 
RAISE NOTICE 'NOTICE:新插入记录的 ID 为: %', last_id; 
END; $$;
ERROR:  invalid input syntax for type date: "1"
CONTEXT:  PL/pgSQL function inline_code_block line 5 at assignment
DO $$ 
DECLARE last_id time; 
BEGIN 
INSERT INTO t_identity_0020 (name) VALUES ('示例'); 
last_id := scope_identity(); 
RAISE NOTICE 'NOTICE:新插入记录的 ID 为: %', last_id; 
END; $$;
ERROR:  invalid input syntax for type time: "51"
CONTEXT:  PL/pgSQL function inline_code_block line 5 at assignment
DO $$ DECLARE last_id timestamp; 
BEGIN 
INSERT INTO t_identity_0020 (name) VALUES ('示例'); 
last_id := scope_identity(); 
RAISE NOTICE 'NOTICE:新插入记录的 ID 为: %', last_id; 
END; $$;
ERROR:  invalid input syntax for type timestamp: "101"
CONTEXT:  PL/pgSQL function inline_code_block line 4 at assignment
DO $$ DECLARE last_id varchar2(2); 
BEGIN 
INSERT INTO t_identity_0020 (name) VALUES ('示例'); 
last_id := scope_identity(); 
RAISE NOTICE 'NOTICE:新插入记录的 ID 为: %', last_id; 
END; $$;
ERROR:  value too long for type character varying(2)
CONTEXT:  PL/pgSQL function inline_code_block line 4 at assignment
DO $$ 
DECLARE last_id date; 
BEGIN 
last_id := ident_current('t_identity_0020'); 
RAISE NOTICE 'NOTICE:新插入记录的 ID 为: %', last_id; 
END; $$;
ERROR:  invalid input syntax for type date: "151"
CONTEXT:  PL/pgSQL function inline_code_block line 4 at assignment
DO $$ 
DECLARE last_id time; 
BEGIN 
last_id := ident_current('t_identity_0020'); 
RAISE NOTICE 'NOTICE:新插入记录的 ID 为: %', last_id; 
END; $$;
ERROR:  invalid input syntax for type time: "151"
CONTEXT:  PL/pgSQL function inline_code_block line 4 at assignment
DO $$ 
DECLARE last_id timestamp;
BEGIN 
last_id := ident_current('t_identity_0020'); 
RAISE NOTICE 'NOTICE:新插入记录的 ID 为: %', last_id; 
END; $$;
ERROR:  invalid input syntax for type timestamp: "151"
CONTEXT:  PL/pgSQL function inline_code_block line 4 at assignment
DO $$ 
DECLARE last_id varchar2(2); 
BEGIN 
last_id := ident_current('t_identity_0020'); 
RAISE NOTICE 'NOTICE:新插入记录的 ID 为: %', last_id; 
END; $$;
ERROR:  value too long for type character varying(2)
CONTEXT:  PL/pgSQL function inline_code_block line 4 at assignment
drop table t_identity_0020;
create table t_identity_0013(id int identity, name varchar(10));
NOTICE:  CREATE TABLE will create implicit sequence "t_identity_0013_id_seq_identity" for serial column "t_identity_0013.id"
insert into t_identity_0013(name) values('zhangsan');
insert into t_identity_0013(name) values('lisi');
insert into t_identity_0013(name) values('wangwu');
--error
update t_identity_0013 set id=4 where name='zhangsan';
ERROR:  Cannot update identity column "id"
LINE 1: update t_identity_0013 set id=4 where name='zhangsan';
                                   ^
drop table t_identity_0013;
-- ident_current after truncate table. expected: success.
create table t_identity_0021(id int identity(100,1), name varchar(10));
NOTICE:  CREATE TABLE will create implicit sequence "t_identity_0021_id_seq_identity" for serial column "t_identity_0021.id"
insert into t_identity_0021(name) values('zhangsan');
insert into t_identity_0021(name) values('lisi');
select ident_current('t_identity_0021');
 ident_current
---------------
           101
(1 row)

truncate table t_identity_0021;
select ident_current('t_identity_0021');
 ident_current
---------------
           100
(1 row)

insert into t_identity_0021(name) values('zhangsan');
select ident_current('t_identity_0021');
 ident_current
---------------
           100
(1 row)

insert into t_identity_0021(name) values('lisi');
select ident_current('t_identity_0021');
 ident_current
---------------
           101
(1 row)

drop table t_identity_0021;
-- ## create table like, copy identity attr, but no data.
create table t_identity_0023(id int identity(100,1), name varchar(10));
NOTICE:  CREATE TABLE will create implicit sequence "t_identity_0023_id_seq_identity" for serial column "t_identity_0023.id"
insert into t_identity_0023(name) values('x1');
insert into t_identity_0023(name) values('x2');
insert into t_identity_0023(name) values('x3');
select ident_current('t_identity_0023');
 ident_current 
---------------
           102
(1 row)

select scope_identity();
 scope_identity 
----------------
            102
(1 row)

-- no option.
create table t_identity_0023_1 (like t_identity_0023);
NOTICE:  CREATE TABLE will create implicit sequence "t_identity_0023_1_id_seq_identity" for serial column "t_identity_0023_1.id"
\d+ t_identity_0023_1
                                                    Table "identity_schema.t_identity_0023_1"
 Column |         Type          |                                Modifiers                                | Storage  | Stats target | Description 
--------+-----------------------+-------------------------------------------------------------------------+----------+--------------+-------------
 id     | integer               | not null default nextval('t_identity_0023_1_id_seq_identity'::regclass) | plain    |              | 
 name   | character varying(10) |                                                                         | extended |              | 
Has OIDs: no
Options: orientation=row, compression=no

select ident_current('t_identity_0023_1');
 ident_current 
---------------
           100
(1 row)

insert t_identity_0023_1 (name) values('xxx1');
insert t_identity_0023_1 (name) values('xxx1');
select ident_current('t_identity_0023_1');
 ident_current 
---------------
           101
(1 row)

select scope_identity();
 scope_identity 
----------------
            101
(1 row)

truncate table t_identity_0023_1;
select ident_current('t_identity_0023_1');
 ident_current 
---------------
           100
(1 row)

insert t_identity_0023_1 (name) values('xxx1');
insert t_identity_0023_1 (name) values('xxx1');
select ident_current('t_identity_0023_1');
 ident_current 
---------------
           101
(1 row)

select * from t_identity_0023_1 order by id;
 id  | name 
-----+------
 100 | xxx1
 101 | xxx1
(2 rows)

-- including DEFAULTS.
create table t_identity_0023_2 (like t_identity_0023 INCLUDING DEFAULTS);
NOTICE:  CREATE TABLE will create implicit sequence "t_identity_0023_2_id_seq_identity" for serial column "t_identity_0023_2.id"
\d+ t_identity_0023_2
                                                    Table "identity_schema.t_identity_0023_2"
 Column |         Type          |                                Modifiers                                | Storage  | Stats target | Description 
--------+-----------------------+-------------------------------------------------------------------------+----------+--------------+-------------
 id     | integer               | not null default nextval('t_identity_0023_2_id_seq_identity'::regclass) | plain    |              | 
 name   | character varying(10) |                                                                         | extended |              | 
Has OIDs: no
Options: orientation=row, compression=no

insert t_identity_0023_2 (name) values('xxx1');
insert t_identity_0023_2 (name) values('xxx1');
select ident_current('t_identity_0023_2');
 ident_current 
---------------
           101
(1 row)

select scope_identity();
 scope_identity 
----------------
            101
(1 row)

drop table t_identity_0023;
drop table t_identity_0023_1;
drop table t_identity_0023_2;
-- ## can't insert identity column, expected error.
drop table if exists t_identity;
NOTICE:  table "t_identity" does not exist, skipping
create table t_identity(id int identity, col text);
NOTICE:  CREATE TABLE will create implicit sequence "t_identity_id_seq_identity" for serial column "t_identity.id"
-- expected error.
insert into t_identity(id, col) values(2,'zshan');
ERROR:  Cannot insert identity column "id"
LINE 1: insert into t_identity(id, col) values(2,'zshan');
                               ^
select ident_current('t_identity');
 ident_current 
---------------
             1
(1 row)

-- expected success.
set identity_insert = on;
insert into t_identity(id, col) values(2,'zshan');
select ident_current('t_identity');
 ident_current 
---------------
             1
(1 row)

select * from t_identity order by id;
 id |  col  
----+-------
  2 | zshan
(1 row)

set identity_insert = off;
drop table if exists t_identity;
create table t_identity(id int identity(100, 1), col text);
NOTICE:  CREATE TABLE will create implicit sequence "t_identity_id_seq_identity" for serial column "t_identity.id"
select ident_current('t_identity');
 ident_current 
---------------
           100
(1 row)

-- expected success.
insert into t_identity(col) select 'test';
insert into t_identity(col) select 'test';
-- expected error.
insert into t_identity(id, col) select 1, 'test';
ERROR:  Cannot insert identity column "id"
LINE 1: insert into t_identity(id, col) select 1, 'test';
                               ^
-- expected success.
set identity_insert = on;
insert into t_identity(id, col) select 1, 'test';
set identity_insert = off;
-- expected error.
insert into t_identity(col) select 1, 'test';
ERROR:  INSERT has more expressions than target columns
LINE 1: insert into t_identity(col) select 1, 'test';
                                              ^
-- expected error.
insert into t_identity select 1, 'test';
ERROR:  INSERT has more expressions than target columns
LINE 1: insert into t_identity select 1, 'test';
                                         ^
select ident_current('t_identity');
 ident_current 
---------------
           101
(1 row)

select * from t_identity order by id;
 id  | col  
-----+------
   1 | test
 100 | test
 101 | test
(3 rows)

-- expected error.
insert into t_identity(id, col) values(100, 'newtest')
    on duplicate key update col = VALUES(col);
ERROR:  Cannot insert identity column "id"
LINE 1: insert into t_identity(id, col) values(100, 'newtest')
                               ^
-- expected error.
insert into t_identity(col) values(100, 'newtest')
    on duplicate key update col = VALUES(col);
ERROR:  INSERT has more expressions than target columns
LINE 1: insert into t_identity(col) values(100, 'newtest')
                                                ^
select ident_current('t_identity');
 ident_current 
---------------
           101
(1 row)

drop table t_identity;
drop table if exists target_table;
NOTICE:  table "target_table" does not exist, skipping
create table target_table (
    id int identity(1,1) PRIMARY KEY,
    name varchar(50), 
    age int
);
NOTICE:  CREATE TABLE will create implicit sequence "target_table_id_seq_identity" for serial column "target_table.id"
NOTICE:  CREATE TABLE / PRIMARY KEY will create implicit index "target_table_pkey" for table "target_table"
drop table if exists source_table;
NOTICE:  table "source_table" does not exist, skipping
create table source_table (id int, name varchar(50), age int);
insert into source_table values (10, 'zliu', 28), (11, 'sqi', 30);
-- expected: success. let id generated by system.
merge into target_table AS t using source_table AS s ON t.id = s.id
when not matched then
    insert (name, age) values (s.name, s.age); -- no identity column.
-- expected: success. let id generated by system.
merge into target_table AS t using source_table AS s ON t.id = s.id
when not matched then
    insert values (s.name, s.age);
-- expected error.
merge into target_table AS t using source_table AS s ON t.id = s.id
when not matched then
    insert (id, name, age) values (s.id, s.name, s.age);
ERROR:  Cannot insert identity column "id"
LINE 3:     insert (id, name, age) values (s.id, s.name, s.age);
                    ^
-- expected success.
set identity_insert = on;
merge into target_table AS t using source_table AS s ON t.id = s.id
when not matched then
    insert (id, name, age) values (s.id, s.name, s.age);
set identity_insert = off;
-- expected error.
merge into target_table AS t using source_table AS s ON t.id = s.id
when not matched then
    insert values (s.id, s.name, s.age);
ERROR:  INSERT has more expressions than target columns
LINE 3:     insert values (s.id, s.name, s.age);
                                         ^
select * from target_table order by id;
 id | name | age 
----+------+-----
  1 | zliu |  28
  2 | sqi  |  30
  3 | zliu |  28
  4 | sqi  |  30
 10 | zliu |  28
 11 | sqi  |  30
(6 rows)

drop table source_table;
drop table target_table;
-- ## SELECT INTO, copy identity attr of single source table.
create table t_identity_0024(id int identity(100, 1), name varchar(10), age int);
NOTICE:  CREATE TABLE will create implicit sequence "t_identity_0024_id_seq_identity" for serial column "t_identity_0024.id"
insert into t_identity_0024 (name, age) values('xx', 11);
insert into t_identity_0024 (name, age) values('xxx', 12);
create table t_identity_0025(id1 int, name varchar(10));
-- expected: successs
select name, age into t_identity_0024_01 from t_identity_0024;
\d+ t_identity_0024_01
                     Table "identity_schema.t_identity_0024_01"
 Column |         Type          | Modifiers | Storage  | Stats target | Description 
--------+-----------------------+-----------+----------+--------------+-------------
 name   | character varying(10) |           | extended |              | 
 age    | integer               |           | plain    |              | 
Has OIDs: no
Options: orientation=row, compression=no

-- expected: success
set identity_insert = on;
select id into t_identity_0024_02 from t_identity_0024;
NOTICE:  CREATE TABLE will create implicit sequence "t_identity_0024_02_id_seq_identity" for serial column "t_identity_0024_02.id"
select id as id_alias into t_identity_0024_02_1 from t_identity_0024;
NOTICE:  CREATE TABLE will create implicit sequence "t_identity_0024_02_1_id_alias_seq_identity" for serial column "t_identity_0024_02_1.id_alias"
\d+ t_identity_0024_02_1
                                                 Table "identity_schema.t_identity_0024_02_1"
  Column  |  Type   |                                    Modifiers                                     | Storage | Stats target | Description 
----------+---------+----------------------------------------------------------------------------------+---------+--------------+-------------
 id_alias | integer | not null default nextval('t_identity_0024_02_1_id_alias_seq_identity'::regclass) | plain   |              | 
Has OIDs: no
Options: orientation=row, compression=no

select ident_current('t_identity_0024_02_1');
 ident_current 
---------------
           100
(1 row)

select * into t_identity_0024_03 from t_identity_0024;
NOTICE:  CREATE TABLE will create implicit sequence "t_identity_0024_03_id_seq_identity" for serial column "t_identity_0024_03.id"
\d+ t_identity_0024_03
                                                    Table "identity_schema.t_identity_0024_03"
 Column |         Type          |                                Modifiers                                 | Storage  | Stats target | Description 
--------+-----------------------+--------------------------------------------------------------------------+----------+--------------+-------------
 id     | integer               | not null default nextval('t_identity_0024_03_id_seq_identity'::regclass) | plain    |              | 
 name   | character varying(10) |                                                                          | extended |              | 
 age    | integer               |                                                                          | plain    |              | 
Has OIDs: no
Options: orientation=row, compression=no

select ident_current('t_identity_0024_03');
 ident_current 
---------------
           100
(1 row)

select id, age as alias_age into t_identity_0024_04 from t_identity_0024;
NOTICE:  CREATE TABLE will create implicit sequence "t_identity_0024_04_id_seq_identity" for serial column "t_identity_0024_04.id"
\d+ t_identity_0024_04
                                              Table "identity_schema.t_identity_0024_04"
  Column   |  Type   |                                Modifiers                                 | Storage | Stats target | Description 
-----------+---------+--------------------------------------------------------------------------+---------+--------------+-------------
 id        | integer | not null default nextval('t_identity_0024_04_id_seq_identity'::regclass) | plain   |              | 
 alias_age | integer |                                                                          | plain   |              | 
Has OIDs: no
Options: orientation=row, compression=no

select * from t_identity_0024_04 order by id;
 id  | alias_age 
-----+-----------
 100 |        11
 101 |        12
(2 rows)

select ident_current('t_identity_0024_04');
 ident_current 
---------------
           100
(1 row)

insert into t_identity_0024_04(alias_age) values (23);
select * from t_identity_0024_04 order by id;
 id  | alias_age 
-----+-----------
 100 |        11
 100 |        23
 101 |        12
(3 rows)

set identity_insert = off;
-- expected: error
insert into t_identity_0024_04(id, alias_age) values (1000, 22);
ERROR:  Cannot insert identity column "id"
LINE 1: insert into t_identity_0024_04(id, alias_age) values (1000, ...
                                       ^
set identity_insert = on;
-- expected: success
insert into t_identity_0024_04(id, alias_age) values (1000, 22);
set identity_insert = off;
select ident_current('t_identity_0024_04');
 ident_current 
---------------
           100
(1 row)

select * from t_identity_0024_04 order by id;
  id  | alias_age 
------+-----------
  100 |        11
  100 |        23
  101 |        12
 1000 |        22
(4 rows)

-- expected: success, multiple tables no need to copy identity, thus not to set identity_insert.
select i1.id, i2.id1, i1.age as alias_age into t_identity_0024_05 from t_identity_0024 i1, t_identity_0025 i2 where i1.id = i2.id1;
\d+ t_identity_0024_05
               Table "identity_schema.t_identity_0024_05"
  Column   |  Type   | Modifiers | Storage | Stats target | Description 
-----------+---------+-----------+---------+--------------+-------------
 id        | integer |           | plain   |              | 
 id1       | integer |           | plain   |              | 
 alias_age | integer |           | plain   |              | 
Has OIDs: no
Options: orientation=row, compression=no

-- same to serial.
-- expected: success
create table t_serial_001(id serial, name varchar(10));
NOTICE:  CREATE TABLE will create implicit sequence "t_serial_001_id_seq" for serial column "t_serial_001.id"
select * into t_serial_001_1 from t_serial_001;
NOTICE:  CREATE TABLE will create implicit sequence "t_serial_001_1_id_seq" for serial column "t_serial_001_1.id"
\d+ t_serial_001_1
                                                Table "identity_schema.t_serial_001_1"
 Column |         Type          |                          Modifiers                          | Storage  | Stats target | Description 
--------+-----------------------+-------------------------------------------------------------+----------+--------------+-------------
 id     | integer               | not null default nextval('t_serial_001_1_id_seq'::regclass) | plain    |              | 
 name   | character varying(10) |                                                             | extended |              | 
Has OIDs: no
Options: orientation=row, compression=no

-- expected: success
create table t_serial_002(id serial, id1 serial, name varchar(10));
NOTICE:  CREATE TABLE will create implicit sequence "t_serial_002_id_seq" for serial column "t_serial_002.id"
NOTICE:  CREATE TABLE will create implicit sequence "t_serial_002_id1_seq" for serial column "t_serial_002.id1"
select * into t_serial_002_1 from t_serial_002;
NOTICE:  CREATE TABLE will create implicit sequence "t_serial_002_1_id_seq" for serial column "t_serial_002_1.id"
NOTICE:  CREATE TABLE will create implicit sequence "t_serial_002_1_id1_seq" for serial column "t_serial_002_1.id1"
\d+ t_serial_002_1
                                                Table "identity_schema.t_serial_002_1"
 Column |         Type          |                          Modifiers                           | Storage  | Stats target | Description 
--------+-----------------------+--------------------------------------------------------------+----------+--------------+-------------
 id     | integer               | not null default nextval('t_serial_002_1_id_seq'::regclass)  | plain    |              | 
 id1    | integer               | not null default nextval('t_serial_002_1_id1_seq'::regclass) | plain    |              | 
 name   | character varying(10) |                                                              | extended |              | 
Has OIDs: no
Options: orientation=row, compression=no

create table t_serial_identity_001(id int identity(200, 2), id1 serial, name varchar(10));
NOTICE:  CREATE TABLE will create implicit sequence "t_serial_identity_001_id_seq_identity" for serial column "t_serial_identity_001.id"
NOTICE:  CREATE TABLE will create implicit sequence "t_serial_identity_001_id1_seq" for serial column "t_serial_identity_001.id1"
-- expected: error
select * into t_serial_identity_001_1 from t_serial_identity_001;
NOTICE:  CREATE TABLE will create implicit sequence "t_serial_identity_001_1_id_seq_identity" for serial column "t_serial_identity_001_1.id"
NOTICE:  CREATE TABLE will create implicit sequence "t_serial_identity_001_1_id1_seq" for serial column "t_serial_identity_001_1.id1"
ERROR:  Cannot insert identity column "id"
LINE 1: ...t * into t_serial_identity_001_1 from t_serial_identity_001;
                                                                 ^
set identity_insert = on;
-- expected: success
select * into t_serial_identity_001_1 from t_serial_identity_001;
NOTICE:  CREATE TABLE will create implicit sequence "t_serial_identity_001_1_id_seq_identity" for serial column "t_serial_identity_001_1.id"
NOTICE:  CREATE TABLE will create implicit sequence "t_serial_identity_001_1_id1_seq" for serial column "t_serial_identity_001_1.id1"
set identity_insert = off;
\d+ t_serial_identity_001_1
                                                    Table "identity_schema.t_serial_identity_001_1"
 Column |         Type          |                                   Modifiers                                   | Storage  | Stats target | Description 
--------+-----------------------+-------------------------------------------------------------------------------+----------+--------------+-------------
 id     | integer               | not null default nextval('t_serial_identity_001_1_id_seq_identity'::regclass) | plain    |              | 
 id1    | integer               | not null default nextval('t_serial_identity_001_1_id1_seq'::regclass)         | plain    |              | 
 name   | character varying(10) |                                                                               | extended |              | 
Has OIDs: no
Options: orientation=row, compression=no

drop table t_identity_0024;
drop table t_identity_0024_01;
drop table t_identity_0024_02;
drop table t_identity_0024_02_1;
drop table t_identity_0024_03;
drop table t_identity_0024_04;
drop table t_identity_0024_05;
drop table t_identity_0025;
drop table t_serial_001;
drop table t_serial_001_1;
drop table t_serial_002;
drop table t_serial_002_1;
drop table t_serial_identity_001;
drop table t_serial_identity_001_1;
-- numeric identity test.
---- select into
-- max/min value
create table t_identity_numeric_t1(id numeric(25, 0) identity(200, 2), id1 serial, name varchar(10));
NOTICE:  CREATE TABLE will create implicit sequence "t_identity_numeric_t1_id_seq_identity" for serial column "t_identity_numeric_t1.id"
NOTICE:  CREATE TABLE will create implicit sequence "t_identity_numeric_t1_id1_seq" for serial column "t_identity_numeric_t1.id1"
set identity_insert = on;
select id, name into t_identity_numeric_t1_1 from t_identity_numeric_t1;
NOTICE:  CREATE TABLE will create implicit sequence "t_identity_numeric_t1_1_id_seq_identity" for serial column "t_identity_numeric_t1_1.id"
\d+ t_identity_numeric_t1_1
                                                    Table "identity_schema.t_identity_numeric_t1_1"
 Column |         Type          |                                   Modifiers                                   | Storage  | Stats target | Description 
--------+-----------------------+-------------------------------------------------------------------------------+----------+--------------+-------------
 id     | numeric(25,0)         | not null default nextval('t_identity_numeric_t1_1_id_seq_identity'::regclass) | main     |              | 
 name   | character varying(10) |                                                                               | extended |              | 
Has OIDs: no
Options: orientation=row, compression=no

insert into t_identity_numeric_t1_1(id, name) values(987654321098765432109876, 'xxx'); -- over int64
select * from t_identity_numeric_t1_1 order by id;
            id            | name 
--------------------------+------
 987654321098765432109876 | xxx
(1 row)

set identity_insert = off;
drop table t_identity_numeric_t1;
drop table t_identity_numeric_t1_1;
-- start
create table t_identity_numeric_t2(id numeric(25, 0) identity(987654321098765432100000, 2), id1 serial, name varchar(10));
NOTICE:  CREATE TABLE will create implicit sequence "t_identity_numeric_t2_id_seq_identity" for serial column "t_identity_numeric_t2.id"
NOTICE:  CREATE TABLE will create implicit sequence "t_identity_numeric_t2_id1_seq" for serial column "t_identity_numeric_t2.id1"
set identity_insert = on;
select id, name into t_identity_numeric_t2_1 from t_identity_numeric_t2;
NOTICE:  CREATE TABLE will create implicit sequence "t_identity_numeric_t2_1_id_seq_identity" for serial column "t_identity_numeric_t2_1.id"
set identity_insert = off;
\d+ t_identity_numeric_t2_1
                                                    Table "identity_schema.t_identity_numeric_t2_1"
 Column |         Type          |                                   Modifiers                                   | Storage  | Stats target | Description 
--------+-----------------------+-------------------------------------------------------------------------------+----------+--------------+-------------
 id     | numeric(25,0)         | not null default nextval('t_identity_numeric_t2_1_id_seq_identity'::regclass) | main     |              | 
 name   | character varying(10) |                                                                               | extended |              | 
Has OIDs: no
Options: orientation=row, compression=no

insert into t_identity_numeric_t2_1(name) values('xxx'); -- over int64
select * from t_identity_numeric_t2_1 order by id;
            id            | name 
--------------------------+------
 987654321098765432100000 | xxx
(1 row)

drop table t_identity_numeric_t2;
drop table t_identity_numeric_t2_1;
-- increment
create table t_identity_numeric_t3(id numeric(25, 0) identity(2, 987654321098765432100000), id1 serial, name varchar(10));
NOTICE:  CREATE TABLE will create implicit sequence "t_identity_numeric_t3_id_seq_identity" for serial column "t_identity_numeric_t3.id"
NOTICE:  CREATE TABLE will create implicit sequence "t_identity_numeric_t3_id1_seq" for serial column "t_identity_numeric_t3.id1"
set identity_insert = on;
select id, name into t_identity_numeric_t3_1 from t_identity_numeric_t3;
NOTICE:  CREATE TABLE will create implicit sequence "t_identity_numeric_t3_1_id_seq_identity" for serial column "t_identity_numeric_t3_1.id"
set identity_insert = off;
\d+ t_identity_numeric_t3_1
                                                    Table "identity_schema.t_identity_numeric_t3_1"
 Column |         Type          |                                   Modifiers                                   | Storage  | Stats target | Description 
--------+-----------------------+-------------------------------------------------------------------------------+----------+--------------+-------------
 id     | numeric(25,0)         | not null default nextval('t_identity_numeric_t3_1_id_seq_identity'::regclass) | main     |              | 
 name   | character varying(10) |                                                                               | extended |              | 
Has OIDs: no
Options: orientation=row, compression=no

insert into t_identity_numeric_t3_1(name) values('xxx'); -- over int64
insert into t_identity_numeric_t3_1(name) values('xxx1');
select * from t_identity_numeric_t3_1 order by id;
            id            | name 
--------------------------+------
                        2 | xxx
 987654321098765432100002 | xxx1
(2 rows)

drop table t_identity_numeric_t3;
drop table t_identity_numeric_t3_1;
---- create table like.
-- max/min value
create table t_identity_numeric_t4(id numeric(38, 0) identity, name varchar(10));
NOTICE:  CREATE TABLE will create implicit sequence "t_identity_numeric_t4_id_seq_identity" for serial column "t_identity_numeric_t4.id"
create table t_identity_numeric_t4_1 (like t_identity_numeric_t4);
NOTICE:  CREATE TABLE will create implicit sequence "t_identity_numeric_t4_1_id_seq_identity" for serial column "t_identity_numeric_t4_1.id"
\d+ t_identity_numeric_t4_1;
                                                    Table "identity_schema.t_identity_numeric_t4_1"
 Column |         Type          |                                   Modifiers                                   | Storage  | Stats target | Description 
--------+-----------------------+-------------------------------------------------------------------------------+----------+--------------+-------------
 id     | numeric(38,0)         | not null default nextval('t_identity_numeric_t4_1_id_seq_identity'::regclass) | main     |              | 
 name   | character varying(10) |                                                                               | extended |              | 
Has OIDs: no
Options: orientation=row, compression=no

set identity_insert = on;
insert into t_identity_numeric_t4_1(id, name) values(987654321098765432109876543210, 'xxx'); -- over int64
set identity_insert = off;
select * from t_identity_numeric_t4_1 order by id;
               id               | name 
--------------------------------+------
 987654321098765432109876543210 | xxx
(1 row)

drop table t_identity_numeric_t4;
drop table t_identity_numeric_t4_1;
-- start
create table t_identity_numeric_t5(id numeric(38, 0) identity(987654321098765432100000, 2), id1 serial, name varchar(10));
NOTICE:  CREATE TABLE will create implicit sequence "t_identity_numeric_t5_id_seq_identity" for serial column "t_identity_numeric_t5.id"
NOTICE:  CREATE TABLE will create implicit sequence "t_identity_numeric_t5_id1_seq" for serial column "t_identity_numeric_t5.id1"
create table t_identity_numeric_t5_1 (like t_identity_numeric_t5);
NOTICE:  CREATE TABLE will create implicit sequence "t_identity_numeric_t5_1_id_seq_identity" for serial column "t_identity_numeric_t5_1.id"
NOTICE:  CREATE TABLE will create implicit sequence "t_identity_numeric_t5_1_id1_seq" for serial column "t_identity_numeric_t5_1.id1"
insert into t_identity_numeric_t5_1(name) values('xxx'); -- over int64
select * from t_identity_numeric_t5_1 order by id;
            id            | id1 | name 
--------------------------+-----+------
 987654321098765432100000 |   1 | xxx
(1 row)

drop table t_identity_numeric_t5;
drop table t_identity_numeric_t5_1;
-- increment
create table t_identity_numeric_t6(id numeric(38, 0) identity(2, 987654321098765432100000), id1 serial, name varchar(10));
NOTICE:  CREATE TABLE will create implicit sequence "t_identity_numeric_t6_id_seq_identity" for serial column "t_identity_numeric_t6.id"
NOTICE:  CREATE TABLE will create implicit sequence "t_identity_numeric_t6_id1_seq" for serial column "t_identity_numeric_t6.id1"
create table t_identity_numeric_t6_1 (like t_identity_numeric_t6);
NOTICE:  CREATE TABLE will create implicit sequence "t_identity_numeric_t6_1_id_seq_identity" for serial column "t_identity_numeric_t6_1.id"
NOTICE:  CREATE TABLE will create implicit sequence "t_identity_numeric_t6_1_id1_seq" for serial column "t_identity_numeric_t6_1.id1"
\d+ t_identity_numeric_t6_1
                                                    Table "identity_schema.t_identity_numeric_t6_1"
 Column |         Type          |                                   Modifiers                                   | Storage  | Stats target | Description 
--------+-----------------------+-------------------------------------------------------------------------------+----------+--------------+-------------
 id     | numeric(38,0)         | not null default nextval('t_identity_numeric_t6_1_id_seq_identity'::regclass) | main     |              | 
 id1    | integer               | not null default nextval('t_identity_numeric_t6_1_id1_seq'::regclass)         | plain    |              | 
 name   | character varying(10) |                                                                               | extended |              | 
Has OIDs: no
Options: orientation=row, compression=no

insert into t_identity_numeric_t6_1(name) values('xxx'); -- over int64
insert into t_identity_numeric_t6_1(name) values('xxx1');
select * from t_identity_numeric_t6_1 order by id;
            id            | id1 | name 
--------------------------+-----+------
                        2 |   1 | xxx
 987654321098765432100002 |   2 | xxx1
(2 rows)

drop table t_identity_numeric_t6;
drop table t_identity_numeric_t6_1;
-- column storage
create table t_ident (id int identity, col text) with (orientation=column);
NOTICE:  CREATE TABLE will create implicit sequence "t_ident_id_seq_identity" for serial column "t_ident.id"
\d+ t_ident;
                                             Table "identity_schema.t_ident"
 Column |  Type   |                           Modifiers                           | Storage  | Stats target | Description 
--------+---------+---------------------------------------------------------------+----------+--------------+-------------
 id     | integer | not null default nextval('t_ident_id_seq_identity'::regclass) | plain    |              | 
 col    | text    |                                                               | extended |              | 
Has OIDs: no
Options: orientation=column, compression=low

insert into t_ident(col) values('column1');
insert into t_ident(col) values('column2');
select SCOPE_IDENTITY();
 scope_identity 
----------------
              2
(1 row)

select ident_current('t_ident');
 ident_current 
---------------
             2
(1 row)

drop table t_ident;
-- ### test internal sequence name used by identity column
-- create table like
create sequence identity_t2_id_seq_identity;
create table identity_t2(id numeric(38, 0) identity(10, 2), b int);
NOTICE:  CREATE TABLE will create implicit sequence "identity_t2_id_seq_identity1" for serial column "identity_t2.id"
create table identity_t2_1 (like identity_t2);
NOTICE:  CREATE TABLE will create implicit sequence "identity_t2_1_id_seq_identity" for serial column "identity_t2_1.id"
insert into identity_t2_1(b) values (10);
insert into identity_t2_1(b) values (10);
select id, b from identity_t2_1;
 id | b
----+----
 10 | 10
 12 | 10
(2 rows)

drop sequence identity_t2_id_seq_identity;
drop table identity_t2;
drop table identity_t2_1;
-- select into
create sequence identity_t3_id_seq_identity;
create table identity_t3(id numeric(38, 0) identity(10, 3), b int);
NOTICE:  CREATE TABLE will create implicit sequence "identity_t3_id_seq_identity1" for serial column "identity_t3.id"
set identity_insert = on;
select id, b into identity_t3_1 from identity_t3;
NOTICE:  CREATE TABLE will create implicit sequence "identity_t3_1_id_seq_identity" for serial column "identity_t3_1.id"
insert into identity_t3_1(b) values (10);
insert into identity_t3_1(b) values (10);
select id, b from identity_t3_1;
 id | b
----+----
 10 | 10
 13 | 10
(2 rows)

drop sequence identity_t3_id_seq_identity;
drop table identity_t3;
drop table identity_t3_1;
reset current_schema;
drop schema identity_schema;
