DROP SCHEMA IF EXISTS index_pcr_ustore_smp_back CASCADE;
NOTICE:  schema "index_pcr_ustore_smp_back" does not exist, skipping
CREATE SCHEMA index_pcr_ustore_smp_back;
SET CURRENT_SCHEMA TO index_pcr_ustore_smp_back;
DROP TABLE IF EXISTS t1;
NOTICE:  table "t1" does not exist, skipping
CREATE TABLE t1 (a INT, b INT, c INT) WITH (STORAGE_TYPE = USTORE);
CREATE INDEX i_t1 on t1(b) with (index_type=pcr);
-- backward scan
--without analyze
SET QUERY_DOP = 1002;
-- 1 page
TRUNCATE t1;
INSERT INTO t1 VALUES(GENERATE_SERIES(1,100), GENERATE_SERIES(1,100), GENERATE_SERIES(1,100));
EXPLAIN (COSTS OFF) SELECT COUNT(*) FROM (SELECT /*+indexonlyscan(t1 i_t1)*/ b FROM t1 ORDER BY b DESC);
--?.*                          
--?.*
 Aggregate
   ->  Sort
         Sort Key: t1.b DESC
         ->  Streaming(type: LOCAL GATHER dop: 1/2)
               ->  Index Only Scan Backward using i_t1 on t1
(5 rows)

SELECT COUNT(*) FROM (SELECT /*+indexonlyscan(t1 i_t1)*/ b FROM t1 ORDER BY b DESC);
 count 
--?.*
   100
(1 row)

EXPLAIN (COSTS OFF) SELECT COUNT(*) FROM (SELECT /*+indexonlyscan(t1 i_t1)*/ b FROM t1 WHERE b < 30 ORDER BY b DESC);
--?.*                          
--?.*
 Aggregate
   ->  Sort
         Sort Key: t1.b DESC
         ->  Streaming(type: LOCAL GATHER dop: 1/2)
               ->  Index Only Scan Backward using i_t1 on t1
                     Index Cond: (b < 30)
(6 rows)

SELECT COUNT(*) FROM (SELECT /*+indexonlyscan(t1 i_t1)*/ b FROM t1 WHERE b < 30 ORDER BY b DESC);
 count 
--?.*
    29
(1 row)

EXPLAIN (COSTS OFF) SELECT COUNT(*) FROM (SELECT /*+indexscan(t1 i_t1)*/ a FROM t1 WHERE b < 30 ORDER BY b DESC);
--?.*                       
--?.*
 Aggregate
   ->  Sort
         Sort Key: t1.b DESC
         ->  Streaming(type: LOCAL GATHER dop: 1/2)
               ->  Index Scan Backward using i_t1 on t1
                     Index Cond: (b < 30)
(6 rows)

SELECT COUNT(*) FROM (SELECT /*+indexscan(t1 i_t1)*/ a FROM t1 WHERE b < 30 ORDER BY b DESC);
 count 
--?.*
    29
(1 row)

 
-- with analyze
SET QUERY_DOP = 1002;
-- 1 page
TRUNCATE t1;
INSERT INTO t1 VALUES(GENERATE_SERIES(1,600), GENERATE_SERIES(1,600), GENERATE_SERIES(1,600));
EXPLAIN (COSTS OFF) SELECT COUNT(*) FROM (SELECT /*+indexonlyscan(t1 i_t1)*/ b FROM t1 ORDER BY b DESC);
--?.*                          
--?.*
 Aggregate
   ->  Sort
         Sort Key: t1.b DESC
         ->  Streaming(type: LOCAL GATHER dop: 1/2)
               ->  Index Only Scan Backward using i_t1 on t1
(5 rows)

SELECT COUNT(*) FROM (SELECT /*+indexonlyscan(t1 i_t1)*/ b FROM t1 ORDER BY b DESC);
 count 
--?.*
   600
(1 row)

EXPLAIN (COSTS OFF) SELECT COUNT(*) FROM (SELECT /*+indexonlyscan(t1 i_t1)*/ b FROM t1 WHERE b < 200 ORDER BY b DESC);
--?.*                          
--?.*
 Aggregate
   ->  Sort
         Sort Key: t1.b DESC
         ->  Streaming(type: LOCAL GATHER dop: 1/2)
               ->  Index Only Scan Backward using i_t1 on t1
                     Index Cond: (b < 200)
(6 rows)

SELECT COUNT(*) FROM (SELECT /*+indexonlyscan(t1 i_t1)*/ b FROM t1 WHERE b < 200 ORDER BY b DESC);
 count 
--?.*
   199
(1 row)

EXPLAIN (COSTS OFF) SELECT COUNT(*) FROM (SELECT /*+indexscan(t1 i_t1)*/ a FROM t1 WHERE b < 200 ORDER BY b DESC);
--?.*                       
--?.*
 Aggregate
   ->  Sort
         Sort Key: t1.b DESC
         ->  Streaming(type: LOCAL GATHER dop: 1/2)
               ->  Index Scan Backward using i_t1 on t1
                     Index Cond: (b < 200)
(6 rows)

SELECT COUNT(*) FROM (SELECT /*+indexscan(t1 i_t1)*/ a FROM t1 WHERE b < 200 ORDER BY b DESC);
 count 
--?.*
   199
(1 row)

 
SET QUERY_DOP = 1002;
-- 2 page
TRUNCATE t1;
INSERT INTO t1 VALUES(GENERATE_SERIES(1,200), GENERATE_SERIES(1,200), GENERATE_SERIES(1,200));
ANALYZE t1;
EXPLAIN (COSTS OFF) SELECT COUNT(*) FROM (SELECT /*+indexonlyscan(t1 i_t1)*/ b FROM t1 ORDER BY b DESC);
--?.*                          
--?.*
 Aggregate
   ->  Sort
         Sort Key: t1.b DESC
         ->  Streaming(type: LOCAL GATHER dop: 1/2)
               ->  Index Only Scan Backward using i_t1 on t1
(5 rows)

SELECT COUNT(*) FROM (SELECT /*+indexonlyscan(t1 i_t1)*/ b FROM t1 ORDER BY b DESC);
 count 
--?.*
   200
(1 row)

EXPLAIN (COSTS OFF) SELECT COUNT(*) FROM (SELECT /*+indexonlyscan(t1 i_t1)*/ b FROM t1 WHERE b < 60 ORDER BY b DESC);
--?.*                          
--?.*
 Aggregate
   ->  Sort
         Sort Key: t1.b DESC
         ->  Streaming(type: LOCAL GATHER dop: 1/2)
               ->  Index Only Scan Backward using i_t1 on t1
                     Index Cond: (b < 60)
(6 rows)

SELECT COUNT(*) FROM (SELECT /*+indexonlyscan(t1 i_t1)*/ b FROM t1 WHERE b < 60 ORDER BY b DESC);
 count 
--?.*
    59
(1 row)

EXPLAIN (COSTS OFF) SELECT COUNT(*) FROM (SELECT /*+indexscan(t1 i_t1)*/ a FROM t1 WHERE b < 60 ORDER BY b DESC);
--?.*                       
--?.*
 Aggregate
   ->  Sort
         Sort Key: t1.b DESC
         ->  Streaming(type: LOCAL GATHER dop: 1/2)
               ->  Index Scan Backward using i_t1 on t1
                     Index Cond: (b < 60)
(6 rows)

SELECT COUNT(*) FROM (SELECT /*+indexscan(t1 i_t1)*/ a FROM t1 WHERE b < 60 ORDER BY b DESC);
 count 
--?.*
    59
(1 row)

 
SET QUERY_DOP = 1002;
-- 4 page
TRUNCATE t1;
INSERT INTO t1 VALUES(GENERATE_SERIES(1,600), GENERATE_SERIES(1,600), GENERATE_SERIES(1,600));
ANALYZE t1;
EXPLAIN (COSTS OFF) SELECT COUNT(*) FROM (SELECT /*+indexonlyscan(t1 i_t1)*/ b FROM t1 ORDER BY b DESC);
--?.*                          
--?.*
 Aggregate
   ->  Sort
         Sort Key: t1.b DESC
         ->  Streaming(type: LOCAL GATHER dop: 1/2)
               ->  Index Only Scan Backward using i_t1 on t1
(5 rows)

SELECT COUNT(*) FROM (SELECT /*+indexonlyscan(t1 i_t1)*/ b FROM t1 ORDER BY b DESC);
 count 
--?.*
   600
(1 row)

EXPLAIN (COSTS OFF) SELECT COUNT(*) FROM (SELECT /*+indexonlyscan(t1 i_t1)*/ b FROM t1 WHERE b < 200 ORDER BY b DESC);
--?.*                          
--?.*
 Aggregate
   ->  Sort
         Sort Key: t1.b DESC
         ->  Streaming(type: LOCAL GATHER dop: 1/2)
               ->  Index Only Scan Backward using i_t1 on t1
                     Index Cond: (b < 200)
(6 rows)

SELECT COUNT(*) FROM (SELECT /*+indexonlyscan(t1 i_t1)*/ b FROM t1 WHERE b < 200 ORDER BY b DESC);
 count 
--?.*
   199
(1 row)

EXPLAIN (COSTS OFF) SELECT COUNT(*) FROM (SELECT /*+indexscan(t1 i_t1)*/ a FROM t1 WHERE b < 200 ORDER BY b DESC);
--?.*                       
--?.*
 Aggregate
   ->  Sort
         Sort Key: t1.b DESC
         ->  Streaming(type: LOCAL GATHER dop: 1/2)
               ->  Index Scan Backward using i_t1 on t1
                     Index Cond: (b < 200)
(6 rows)

SELECT COUNT(*) FROM (SELECT /*+indexscan(t1 i_t1)*/ a FROM t1 WHERE b < 200 ORDER BY b DESC);
 count 
--?.*
   199
(1 row)

 
SET QUERY_DOP = 1003;
-- 4 page
TRUNCATE t1;
INSERT INTO t1 VALUES(GENERATE_SERIES(1,600), GENERATE_SERIES(1,600), GENERATE_SERIES(1,600));
ANALYZE t1;
EXPLAIN (COSTS OFF) SELECT COUNT(*) FROM (SELECT /*+indexonlyscan(t1 i_t1)*/ b FROM t1 ORDER BY b DESC);
--?.*                          
--?.*
 Aggregate
   ->  Sort
         Sort Key: t1.b DESC
         ->  Streaming(type: LOCAL GATHER dop: 1/3)
               ->  Index Only Scan Backward using i_t1 on t1
(5 rows)

SELECT COUNT(*) FROM (SELECT /*+indexonlyscan(t1 i_t1)*/ b FROM t1 ORDER BY b DESC);
 count 
--?.*
   600
(1 row)

EXPLAIN (COSTS OFF) SELECT COUNT(*) FROM (SELECT /*+indexonlyscan(t1 i_t1)*/ b FROM t1 WHERE b < 200 ORDER BY b DESC);
--?.*                          
--?.*
 Aggregate
   ->  Sort
         Sort Key: t1.b DESC
         ->  Streaming(type: LOCAL GATHER dop: 1/3)
               ->  Index Only Scan Backward using i_t1 on t1
                     Index Cond: (b < 200)
(6 rows)

SELECT COUNT(*) FROM (SELECT /*+indexonlyscan(t1 i_t1)*/ b FROM t1 WHERE b < 200 ORDER BY b DESC);
 count 
--?.*
   199
(1 row)

EXPLAIN (COSTS OFF) SELECT COUNT(*) FROM (SELECT /*+indexscan(t1 i_t1)*/ a FROM t1 WHERE b < 200 ORDER BY b DESC);
--?.*                       
--?.*
 Aggregate
   ->  Sort
         Sort Key: t1.b DESC
         ->  Streaming(type: LOCAL GATHER dop: 1/3)
               ->  Index Scan Backward using i_t1 on t1
                     Index Cond: (b < 200)
(6 rows)

SELECT COUNT(*) FROM (SELECT /*+indexscan(t1 i_t1)*/ a FROM t1 WHERE b < 200 ORDER BY b DESC);
 count 
--?.*
   199
(1 row)

 
SET QUERY_DOP = 1004;
-- 4 page
TRUNCATE t1;
INSERT INTO t1 VALUES(GENERATE_SERIES(1,600), GENERATE_SERIES(1,600), GENERATE_SERIES(1,600));
ANALYZE t1;
EXPLAIN (COSTS OFF) SELECT COUNT(*) FROM (SELECT /*+indexonlyscan(t1 i_t1)*/ b FROM t1 ORDER BY b DESC);
--?.*                          
--?.*
 Aggregate
   ->  Sort
         Sort Key: t1.b DESC
         ->  Streaming(type: LOCAL GATHER dop: 1/4)
               ->  Index Only Scan Backward using i_t1 on t1
(5 rows)

SELECT COUNT(*) FROM (SELECT /*+indexonlyscan(t1 i_t1)*/ b FROM t1 ORDER BY b DESC);
 count 
--?.*
   600
(1 row)

EXPLAIN (COSTS OFF) SELECT COUNT(*) FROM (SELECT /*+indexonlyscan(t1 i_t1)*/ b FROM t1 WHERE b < 200 ORDER BY b DESC);
--?.*                          
--?.*
 Aggregate
   ->  Sort
         Sort Key: t1.b DESC
         ->  Streaming(type: LOCAL GATHER dop: 1/4)
               ->  Index Only Scan Backward using i_t1 on t1
                     Index Cond: (b < 200)
(6 rows)

SELECT COUNT(*) FROM (SELECT /*+indexonlyscan(t1 i_t1)*/ b FROM t1 WHERE b < 200 ORDER BY b DESC);
 count 
--?.*
   199
(1 row)

EXPLAIN (COSTS OFF) SELECT COUNT(*) FROM (SELECT /*+indexscan(t1 i_t1)*/ a FROM t1 WHERE b < 200 ORDER BY b DESC);
--?.*                       
--?.*
 Aggregate
   ->  Sort
         Sort Key: t1.b DESC
         ->  Streaming(type: LOCAL GATHER dop: 1/4)
               ->  Index Scan Backward using i_t1 on t1
                     Index Cond: (b < 200)
(6 rows)

SELECT COUNT(*) FROM (SELECT /*+indexscan(t1 i_t1)*/ a FROM t1 WHERE b < 200 ORDER BY b DESC);
 count 
--?.*
   199
(1 row)

 
SET QUERY_DOP = 1064;
-- 4 page
TRUNCATE t1;
INSERT INTO t1 VALUES(GENERATE_SERIES(1,600), GENERATE_SERIES(1,600), GENERATE_SERIES(1,600));
ANALYZE t1;
EXPLAIN (COSTS OFF) SELECT COUNT(*) FROM (SELECT /*+indexonlyscan(t1 i_t1)*/ b FROM t1 ORDER BY b DESC);
--?.*                          
--?.*
 Aggregate
   ->  Sort
         Sort Key: t1.b DESC
         ->  Streaming(type: LOCAL GATHER dop: 1/64)
               ->  Index Only Scan Backward using i_t1 on t1
(5 rows)

SELECT COUNT(*) FROM (SELECT /*+indexonlyscan(t1 i_t1)*/ b FROM t1 ORDER BY b DESC);
 count 
--?.*
   600
(1 row)

EXPLAIN (COSTS OFF) SELECT COUNT(*) FROM (SELECT /*+indexonlyscan(t1 i_t1)*/ b FROM t1 WHERE b < 200 ORDER BY b DESC);
--?.*                          
--?.*
 Aggregate
   ->  Sort
         Sort Key: t1.b DESC
         ->  Streaming(type: LOCAL GATHER dop: 1/64)
               ->  Index Only Scan Backward using i_t1 on t1
                     Index Cond: (b < 200)
(6 rows)

SELECT COUNT(*) FROM (SELECT /*+indexonlyscan(t1 i_t1)*/ b FROM t1 WHERE b < 200 ORDER BY b DESC);
 count 
--?.*
   199
(1 row)

EXPLAIN (COSTS OFF) SELECT COUNT(*) FROM (SELECT /*+indexscan(t1 i_t1)*/ a FROM t1 WHERE b < 200 ORDER BY b DESC);
--?.*                       
--?.*
 Aggregate
   ->  Sort
         Sort Key: t1.b DESC
         ->  Streaming(type: LOCAL GATHER dop: 1/64)
               ->  Index Scan Backward using i_t1 on t1
                     Index Cond: (b < 200)
(6 rows)

SELECT COUNT(*) FROM (SELECT /*+indexscan(t1 i_t1)*/ a FROM t1 WHERE b < 200 ORDER BY b DESC);
 count 
--?.*
   199
(1 row)

 
-- insert after analyze
SET QUERY_DOP = 1002;
TRUNCATE t1;
INSERT INTO t1 VALUES(GENERATE_SERIES(1,600), GENERATE_SERIES(1,600), GENERATE_SERIES(1,600));
ANALYZE t1;
INSERT INTO t1 VALUES(GENERATE_SERIES(1,600), GENERATE_SERIES(1,600), GENERATE_SERIES(1,600));
EXPLAIN (COSTS OFF) SELECT COUNT(*) FROM (SELECT /*+indexonlyscan(t1 i_t1)*/ b FROM t1 ORDER BY b DESC);
--?.*                          
--?.*
 Aggregate
   ->  Sort
         Sort Key: t1.b DESC
         ->  Streaming(type: LOCAL GATHER dop: 1/2)
               ->  Index Only Scan Backward using i_t1 on t1
(5 rows)

SELECT COUNT(*) FROM (SELECT /*+indexonlyscan(t1 i_t1)*/ b FROM t1 ORDER BY b DESC);
 count 
--?.*
  1200
(1 row)

EXPLAIN (COSTS OFF) SELECT COUNT(*) FROM (SELECT /*+indexonlyscan(t1 i_t1)*/ b FROM t1 WHERE b < 200 ORDER BY b DESC);
--?.*                          
--?.*
 Aggregate
   ->  Sort
         Sort Key: t1.b DESC
         ->  Streaming(type: LOCAL GATHER dop: 1/2)
               ->  Index Only Scan Backward using i_t1 on t1
                     Index Cond: (b < 200)
(6 rows)

SELECT COUNT(*) FROM (SELECT /*+indexonlyscan(t1 i_t1)*/ b FROM t1 WHERE b < 200 ORDER BY b DESC);
 count 
--?.*
   398
(1 row)

EXPLAIN (COSTS OFF) SELECT COUNT(*) FROM (SELECT /*+indexscan(t1 i_t1)*/ a FROM t1 WHERE b < 200 ORDER BY b DESC);
--?.*                       
--?.*
 Aggregate
   ->  Sort
         Sort Key: t1.b DESC
         ->  Streaming(type: LOCAL GATHER dop: 1/2)
               ->  Index Scan Backward using i_t1 on t1
                     Index Cond: (b < 200)
(6 rows)

SELECT COUNT(*) FROM (SELECT /*+indexscan(t1 i_t1)*/ a FROM t1 WHERE b < 200 ORDER BY b DESC);
 count 
--?.*
   398
(1 row)

 
-- delete after analyze
SET QUERY_DOP = 1002;
TRUNCATE t1;
INSERT INTO t1 VALUES(GENERATE_SERIES(1,600), GENERATE_SERIES(1,600), GENERATE_SERIES(1,600));
ANALYZE t1;
DELETE FROM t1 WHERE b <= 500;
EXPLAIN (COSTS OFF) SELECT COUNT(*) FROM (SELECT /*+indexonlyscan(t1 i_t1)*/ b FROM t1 ORDER BY b DESC);
--?.*                          
--?.*
 Aggregate
   ->  Sort
         Sort Key: t1.b DESC
         ->  Streaming(type: LOCAL GATHER dop: 1/2)
               ->  Index Only Scan Backward using i_t1 on t1
(5 rows)

SELECT COUNT(*) FROM (SELECT /*+indexonlyscan(t1 i_t1)*/ b FROM t1 ORDER BY b DESC);
 count 
--?.*
   100
(1 row)

EXPLAIN (COSTS OFF) SELECT COUNT(*) FROM (SELECT /*+indexonlyscan(t1 i_t1)*/ b FROM t1 WHERE b < 550 ORDER BY b DESC);
--?.*                          
--?.*
 Aggregate
   ->  Sort
         Sort Key: t1.b DESC
         ->  Streaming(type: LOCAL GATHER dop: 1/2)
               ->  Index Only Scan Backward using i_t1 on t1
                     Index Cond: (b < 550)
(6 rows)

SELECT COUNT(*) FROM (SELECT /*+indexonlyscan(t1 i_t1)*/ b FROM t1 WHERE b < 550 ORDER BY b DESC);
 count 
--?.*
    49
(1 row)

EXPLAIN (COSTS OFF) SELECT COUNT(*) FROM (SELECT /*+indexscan(t1 i_t1)*/ a FROM t1 WHERE b < 550 ORDER BY b DESC);
--?.*                       
--?.*
 Aggregate
   ->  Sort
         Sort Key: t1.b DESC
         ->  Streaming(type: LOCAL GATHER dop: 1/2)
               ->  Index Scan Backward using i_t1 on t1
                     Index Cond: (b < 550)
(6 rows)

SELECT COUNT(*) FROM (SELECT /*+indexscan(t1 i_t1)*/ a FROM t1 WHERE b < 550 ORDER BY b DESC);
 count 
--?.*
    49
(1 row)

 
-- vacuum
SET QUERY_DOP = 1002;
TRUNCATE t1;
INSERT INTO t1 VALUES(GENERATE_SERIES(1,600), GENERATE_SERIES(1,600), GENERATE_SERIES(1,600));
ANALYZE t1;
DELETE FROM t1 WHERE b <= 500;
VACUUM FULL t1;
EXPLAIN (COSTS OFF) SELECT COUNT(*) FROM (SELECT /*+indexonlyscan(t1 i_t1)*/ b FROM t1 ORDER BY b DESC);
--?.*                          
--?.*
 Aggregate
   ->  Sort
         Sort Key: t1.b DESC
         ->  Streaming(type: LOCAL GATHER dop: 1/2)
               ->  Index Only Scan Backward using i_t1 on t1
(5 rows)

SELECT COUNT(*) FROM (SELECT /*+indexonlyscan(t1 i_t1)*/ b FROM t1 ORDER BY b DESC);
 count 
--?.*
   100
(1 row)

EXPLAIN (COSTS OFF) SELECT COUNT(*) FROM (SELECT /*+indexonlyscan(t1 i_t1)*/ b FROM t1 WHERE b < 550 ORDER BY b DESC);
--?.*                          
--?.*
 Aggregate
   ->  Sort
         Sort Key: t1.b DESC
         ->  Streaming(type: LOCAL GATHER dop: 1/2)
               ->  Index Only Scan Backward using i_t1 on t1
                     Index Cond: (b < 550)
(6 rows)

SELECT COUNT(*) FROM (SELECT /*+indexonlyscan(t1 i_t1)*/ b FROM t1 WHERE b < 550 ORDER BY b DESC);
 count 
--?.*
    49
(1 row)

EXPLAIN (COSTS OFF) SELECT COUNT(*) FROM (SELECT /*+indexscan(t1 i_t1)*/ a FROM t1 WHERE b < 550 ORDER BY b DESC);
--?.*                       
--?.*
 Aggregate
   ->  Sort
         Sort Key: t1.b DESC
         ->  Streaming(type: LOCAL GATHER dop: 1/2)
               ->  Index Scan Backward using i_t1 on t1
                     Index Cond: (b < 550)
(6 rows)

SELECT COUNT(*) FROM (SELECT /*+indexscan(t1 i_t1)*/ a FROM t1 WHERE b < 550 ORDER BY b DESC);
 count 
--?.*
    49
(1 row)

 
-- function
SET QUERY_DOP = 1002;
TRUNCATE t1;
INSERT INTO t1 VALUES(GENERATE_SERIES(1,600), GENERATE_SERIES(1,600), GENERATE_SERIES(1,600));
ANALYZE t1;
CREATE OR REPLACE FUNCTION select_one_table(out1 OUT bigint)
AS 'SELECT COUNT(*) FROM (SELECT /*+indexonlyscan(t1 i_t1)*/ b FROM t1 ORDER BY b DESC)'
LANGUAGE SQL;
SELECT select_one_table();
 select_one_table 
--?.*
              600
(1 row)

CREATE OR REPLACE FUNCTION select_one_table1(out1 OUT bigint)
AS 'SELECT COUNT(*) FROM (SELECT /*+indexonlyscan(t1 i_t1)*/ b FROM t1 WHERE b < 200 ORDER BY b DESC)'
LANGUAGE SQL;
SELECT select_one_table1();
 select_one_table1 
--?.*
               199
(1 row)

CREATE OR REPLACE FUNCTION select_one_table2(out1 OUT bigint)
AS 'SELECT COUNT(*) FROM (SELECT /*+indexscan(t1 i_t1)*/ a FROM t1 WHERE b < 200 ORDER BY b DESC)'
LANGUAGE SQL;
SELECT select_one_table2();
 select_one_table2 
--?.*
               199
(1 row)

--pbe
PREPARE p5 as SELECT COUNT(*) FROM (SELECT /*+indexonlyscan(t1 i_t1)*/ b FROM t1 ORDER BY b DESC);
EXECUTE p5;
 count 
--?.*
   600
(1 row)

PREPARE p6 as SELECT COUNT(*) FROM (SELECT /*+indexonlyscan(t1 i_t1)*/ b FROM t1 WHERE b < 200 ORDER BY b DESC);
EXECUTE p6;
 count 
--?.*
   199
(1 row)

PREPARE p7 as SELECT COUNT(*) FROM (SELECT /*+indexscan(t1 i_t1)*/ a FROM t1 WHERE b < 200 ORDER BY b DESC);
EXECUTE p7;
 count 
--?.*
   199
(1 row)

RESET ENABLE_SEQSCAN;
RESET QUERY_DOP;
drop table t1;
drop function select_one_table();
drop function select_one_table1();
drop function select_one_table2();
SET CURRENT_SCHEMA=PUBLIC;
DROP SCHEMA index_pcr_ustore_smp_back CASCADE;