\! gs_ktool -d all
DELETE ALL

\! gs_ktool -g
GENERATE
1
CREATE CLIENT MASTER KEY MyCMK WITH ( KEY_STORE = gs_ktool , KEY_PATH = "gs_ktool/1" , ALGORITHM = AES_256_CBC);
CREATE COLUMN ENCRYPTION KEY MyCEK770 WITH VALUES (CLIENT_MASTER_KEY = MyCMK, ALGORITHM = AEAD_AES_256_CBC_HMAC_SHA256);
CREATE TABLE IF NOT EXISTS tr1(
i INT,
ii INT,
i1 INT1,
i2 INT2,
i4 INT4,
i8 INT8,
f4 FLOAT4,
f8 FLOAT8,
c  CHAR,
c8 CHAR(8),
v  VARCHAR,
v8 VARCHAR(8),
b  BYTEA,
n1 NUMERIC,
n2 NUMERIC (5),
n3 NUMERIC (5,2)
);
CREATE TABLE IF NOT EXISTS tr2(
i INT,
ii INT,
i1 INT1       ENCRYPTED WITH (COLUMN_ENCRYPTION_KEY = MyCEK770, ENCRYPTION_TYPE = DETERMINISTIC),
i2 INT2       ENCRYPTED WITH (COLUMN_ENCRYPTION_KEY = MyCEK770, ENCRYPTION_TYPE = DETERMINISTIC),
i4 INT4       ENCRYPTED WITH (COLUMN_ENCRYPTION_KEY = MyCEK770, ENCRYPTION_TYPE = DETERMINISTIC),
i8 INT8       ENCRYPTED WITH (COLUMN_ENCRYPTION_KEY = MyCEK770, ENCRYPTION_TYPE = DETERMINISTIC),
f4 FLOAT4     ENCRYPTED WITH (COLUMN_ENCRYPTION_KEY = MyCEK770, ENCRYPTION_TYPE = DETERMINISTIC),
f8 FLOAT8     ENCRYPTED WITH (COLUMN_ENCRYPTION_KEY = MyCEK770, ENCRYPTION_TYPE = DETERMINISTIC),
c  CHAR       ENCRYPTED WITH (COLUMN_ENCRYPTION_KEY = MyCEK770, ENCRYPTION_TYPE = DETERMINISTIC),
c8 CHAR(8)    ENCRYPTED WITH (COLUMN_ENCRYPTION_KEY = MyCEK770, ENCRYPTION_TYPE = DETERMINISTIC),
v  VARCHAR    ENCRYPTED WITH (COLUMN_ENCRYPTION_KEY = MyCEK770, ENCRYPTION_TYPE = DETERMINISTIC),
v8 VARCHAR(8) ENCRYPTED WITH (COLUMN_ENCRYPTION_KEY = MyCEK770, ENCRYPTION_TYPE = DETERMINISTIC),
b  BYTEA      ENCRYPTED WITH (COLUMN_ENCRYPTION_KEY = MyCEK770, ENCRYPTION_TYPE = DETERMINISTIC),
n1 NUMERIC    ENCRYPTED WITH (COLUMN_ENCRYPTION_KEY = MyCEK770, ENCRYPTION_TYPE = DETERMINISTIC),
n2 NUMERIC (5) ENCRYPTED WITH (COLUMN_ENCRYPTION_KEY = MyCEK770, ENCRYPTION_TYPE = DETERMINISTIC),
n3 NUMERIC (5,2) ENCRYPTED WITH (COLUMN_ENCRYPTION_KEY = MyCEK770, ENCRYPTION_TYPE = DETERMINISTIC)
);
INSERT INTO tr1 VALUES ( 1, 1, 1, 1, 1, 1, 3.14, 3.14,'C','IDO'       ,'Ido''s'    , 'Shlomo'    , '\x1234', 540.50, 540.50, 540.50);
INSERT INTO tr2 VALUES ( 1, 1, 1, 1, 1, 1, 3.14, 3.14,'C','IDO'       ,'Ido''s'    , 'Shlomo'    , '\x1234', 540.50, 540.50, 540.50);
BEGIN;
DECLARE select_all_tr1 CURSOR FOR SELECT * from tr1 ORDER BY i;
DECLARE select_all_tr2 CURSOR FOR SELECT * from tr2 ORDER BY i;
FETCH 5 from select_all_tr1;
 i | ii | i1 | i2 | i4 | i8 |  f4  |  f8  | c |    c8    |   v   |   v8   |   b    |   n1   | n2  |   n3   
---+----+----+----+----+----+------+------+---+----------+-------+--------+--------+--------+-----+--------
 1 |  1 | 1  |  1 |  1 |  1 | 3.14 | 3.14 | C | IDO      | Ido's | Shlomo | \x1234 | 540.50 | 541 | 540.50
(1 row)

FETCH 5 from select_all_tr2;
 i | ii | i1 | i2 | i4 | i8 |  f4  |  f8  | c |    c8    |   v   |   v8   |   b    |   n1   | n2  |   n3   
---+----+----+----+----+----+------+------+---+----------+-------+--------+--------+--------+-----+--------
 1 |  1 | 1  |  1 |  1 |  1 | 3.14 | 3.14 | C | IDO      | Ido's | Shlomo | \x1234 | 540.50 | 541 | 540.50
(1 row)

CLOSE select_all_tr1;
CLOSE select_all_tr2;
END;
BEGIN;
DECLARE select_all_tr1 CURSOR FOR SELECT * from tr1 ORDER BY i;
DECLARE select_all_tr2 CURSOR FOR SELECT * from tr2 ORDER BY i;
FETCH 5 from select_all_tr1;
 i | ii | i1 | i2 | i4 | i8 |  f4  |  f8  | c |    c8    |   v   |   v8   |   b    |   n1   | n2  |   n3   
---+----+----+----+----+----+------+------+---+----------+-------+--------+--------+--------+-----+--------
 1 |  1 | 1  |  1 |  1 |  1 | 3.14 | 3.14 | C | IDO      | Ido's | Shlomo | \x1234 | 540.50 | 541 | 540.50
(1 row)

FETCH 5 from select_all_tr2;
 i | ii | i1 | i2 | i4 | i8 |  f4  |  f8  | c |    c8    |   v   |   v8   |   b    |   n1   | n2  |   n3   
---+----+----+----+----+----+------+------+---+----------+-------+--------+--------+--------+-----+--------
 1 |  1 | 1  |  1 |  1 |  1 | 3.14 | 3.14 | C | IDO      | Ido's | Shlomo | \x1234 | 540.50 | 541 | 540.50
(1 row)

CLOSE select_all_tr1;
CLOSE select_all_tr2;
END;
INSERT INTO tr1 VALUES ( 0, 0, 0, 0, 0, 0, 0.14, 0.14,'z','ELI'       ,'Eli''s'    , 'Shemer'    , '\x09',3490.65,3490.65,3490.65);
ERROR:  numeric field overflow
DETAIL:  A field with precision 5, scale 2 must round to an absolute value less than 10^3.
CONTEXT:  referenced column: n3
INSERT INTO tr2 VALUES ( 0, 0, 0, 0, 0, 0, 0.14, 0.14,'z','ELI'       ,'Eli''s'    , 'Shemer'    , '\x09',3490.65,3490.65,3490.65);
ERROR(CLIENT): numeric field overflow, A field with precision 5 , scale 2 must round to an absolute value less than 10^3

BEGIN;
DECLARE select_all_tr1 CURSOR FOR SELECT * from tr1 ORDER BY i;
DECLARE select_all_tr2 CURSOR FOR SELECT * from tr2 ORDER BY i;
FETCH 5 from select_all_tr1;
 i | ii | i1 | i2 | i4 | i8 |  f4  |  f8  | c |    c8    |   v   |   v8   |   b    |   n1   | n2  |   n3   
---+----+----+----+----+----+------+------+---+----------+-------+--------+--------+--------+-----+--------
 1 |  1 | 1  |  1 |  1 |  1 | 3.14 | 3.14 | C | IDO      | Ido's | Shlomo | \x1234 | 540.50 | 541 | 540.50
(1 row)

FETCH 5 from select_all_tr2;
 i | ii | i1 | i2 | i4 | i8 |  f4  |  f8  | c |    c8    |   v   |   v8   |   b    |   n1   | n2  |   n3   
---+----+----+----+----+----+------+------+---+----------+-------+--------+--------+--------+-----+--------
 1 |  1 | 1  |  1 |  1 |  1 | 3.14 | 3.14 | C | IDO      | Ido's | Shlomo | \x1234 | 540.50 | 541 | 540.50
(1 row)

CLOSE select_all_tr1;
CLOSE select_all_tr2;
END;
INSERT INTO tr1 VALUES ( 4, 4, 0, 0, 0, 0,-0.14,-0.14,'z','A A       ','A a       ', 'A a       ', '\xababababababababababababababababababababab',43543.01,43543.01,43543.01);
ERROR:  numeric field overflow
DETAIL:  A field with precision 5, scale 2 must round to an absolute value less than 10^3.
CONTEXT:  referenced column: n3
INSERT INTO tr2 VALUES ( 4, 4, 0, 0, 0, 0,-0.14,-0.14,'z','A A       ','A a       ', 'A a       ', '\xababababababababababababababababababababab',43543.01,43543.01,43543.01);
ERROR(CLIENT): numeric field overflow, A field with precision 5 , scale 2 must round to an absolute value less than 10^3

BEGIN;
DECLARE select_all_tr1 CURSOR FOR SELECT * from tr1 ORDER BY i;
DECLARE select_all_tr2 CURSOR FOR SELECT * from tr2 ORDER BY i;
FETCH 5 from select_all_tr1;
 i | ii | i1 | i2 | i4 | i8 |  f4  |  f8  | c |    c8    |   v   |   v8   |   b    |   n1   | n2  |   n3   
---+----+----+----+----+----+------+------+---+----------+-------+--------+--------+--------+-----+--------
 1 |  1 | 1  |  1 |  1 |  1 | 3.14 | 3.14 | C | IDO      | Ido's | Shlomo | \x1234 | 540.50 | 541 | 540.50
(1 row)

FETCH 5 from select_all_tr2;
 i | ii | i1 | i2 | i4 | i8 |  f4  |  f8  | c |    c8    |   v   |   v8   |   b    |   n1   | n2  |   n3   
---+----+----+----+----+----+------+------+---+----------+-------+--------+--------+--------+-----+--------
 1 |  1 | 1  |  1 |  1 |  1 | 3.14 | 3.14 | C | IDO      | Ido's | Shlomo | \x1234 | 540.50 | 541 | 540.50
(1 row)

CLOSE select_all_tr1;
CLOSE select_all_tr2;
END;
BEGIN;
DECLARE select_one_tr1 CURSOR FOR SELECT * from tr1 WHERE i1=1 AND ii=1;
DECLARE select_one_tr2 CURSOR FOR SELECT * from tr2 WHERE i1=1 AND ii=1;
FETCH 5 from select_one_tr1;
 i | ii | i1 | i2 | i4 | i8 |  f4  |  f8  | c |    c8    |   v   |   v8   |   b    |   n1   | n2  |   n3   
---+----+----+----+----+----+------+------+---+----------+-------+--------+--------+--------+-----+--------
 1 |  1 | 1  |  1 |  1 |  1 | 3.14 | 3.14 | C | IDO      | Ido's | Shlomo | \x1234 | 540.50 | 541 | 540.50
(1 row)

FETCH 5 from select_one_tr2;
 i | ii | i1 | i2 | i4 | i8 |  f4  |  f8  | c |    c8    |   v   |   v8   |   b    |   n1   | n2  |   n3   
---+----+----+----+----+----+------+------+---+----------+-------+--------+--------+--------+-----+--------
 1 |  1 | 1  |  1 |  1 |  1 | 3.14 | 3.14 | C | IDO      | Ido's | Shlomo | \x1234 | 540.50 | 541 | 540.50
(1 row)

CLOSE select_one_tr1;
CLOSE select_one_tr2;
END;
UPDATE tr1 SET ii=5,i2=5 WHERE i1=1 AND ii=1;
UPDATE tr2 SET ii=5,i2=5 WHERE i1=1 AND ii=1;
BEGIN;
DECLARE select_one_tr1 CURSOR FOR SELECT * from tr1 WHERE i1=1 AND ii=5;
DECLARE select_one_tr2 CURSOR FOR SELECT * from tr2 WHERE i1=1 AND ii=5;
FETCH 5 from select_one_tr1;
 i | ii | i1 | i2 | i4 | i8 |  f4  |  f8  | c |    c8    |   v   |   v8   |   b    |   n1   | n2  |   n3   
---+----+----+----+----+----+------+------+---+----------+-------+--------+--------+--------+-----+--------
 1 |  5 | 1  |  5 |  1 |  1 | 3.14 | 3.14 | C | IDO      | Ido's | Shlomo | \x1234 | 540.50 | 541 | 540.50
(1 row)

FETCH 5 from select_one_tr2;
 i | ii | i1 | i2 | i4 | i8 |  f4  |  f8  | c |    c8    |   v   |   v8   |   b    |   n1   | n2  |   n3   
---+----+----+----+----+----+------+------+---+----------+-------+--------+--------+--------+-----+--------
 1 |  5 | 1  |  5 |  1 |  1 | 3.14 | 3.14 | C | IDO      | Ido's | Shlomo | \x1234 | 540.50 | 541 | 540.50
(1 row)

CLOSE select_one_tr1;
CLOSE select_one_tr2;
END;
DELETE from tr1 WHERE i1=1 AND ii=5;
DELETE from tr2 WHERE i1=1 AND ii=5;
BEGIN;
DECLARE select_one_tr1 CURSOR FOR SELECT * from tr1 WHERE i1=1 AND ii=5;
DECLARE select_one_tr2 CURSOR FOR SELECT * from tr2 WHERE i1=1 AND ii=5;
FETCH 5 from select_one_tr1;
 i | ii | i1 | i2 | i4 | i8 | f4 | f8 | c | c8 | v | v8 | b | n1 | n2 | n3 
---+----+----+----+----+----+----+----+---+----+---+----+---+----+----+----
(0 rows)

FETCH 5 from select_one_tr2;
 i | ii | i1 | i2 | i4 | i8 | f4 | f8 | c | c8 | v | v8 | b | n1 | n2 | n3 
---+----+----+----+----+----+----+----+---+----+---+----+---+----+----+----
(0 rows)

CLOSE select_one_tr1;
CLOSE select_one_tr2;
END;
BEGIN;
DECLARE select_all_tr1 CURSOR FOR SELECT * from tr1 ORDER BY i;
DECLARE select_all_tr2 CURSOR FOR SELECT * from tr2 ORDER BY i;
FETCH 5 from select_all_tr1;
 i | ii | i1 | i2 | i4 | i8 | f4 | f8 | c | c8 | v | v8 | b | n1 | n2 | n3 
---+----+----+----+----+----+----+----+---+----+---+----+---+----+----+----
(0 rows)

FETCH 5 from select_all_tr2;
 i | ii | i1 | i2 | i4 | i8 | f4 | f8 | c | c8 | v | v8 | b | n1 | n2 | n3 
---+----+----+----+----+----+----+----+---+----+---+----+---+----+----+----
(0 rows)

CLOSE select_all_tr1;
CLOSE select_all_tr2;
END;
DELETE from tr1;
DELETE from tr2;
BEGIN;
DECLARE select_all_tr1 CURSOR FOR SELECT * from tr1 ORDER BY i;
DECLARE select_all_tr2 CURSOR FOR SELECT * from tr2 ORDER BY i;
FETCH 5 from select_all_tr1;
 i | ii | i1 | i2 | i4 | i8 | f4 | f8 | c | c8 | v | v8 | b | n1 | n2 | n3 
---+----+----+----+----+----+----+----+---+----+---+----+---+----+----+----
(0 rows)

FETCH 5 from select_all_tr2;
 i | ii | i1 | i2 | i4 | i8 | f4 | f8 | c | c8 | v | v8 | b | n1 | n2 | n3 
---+----+----+----+----+----+----+----+---+----+---+----+---+----+----+----
(0 rows)

CLOSE select_all_tr1;
CLOSE select_all_tr2;
END;
DROP TABLE tr1;
DROP TABLE tr2;
DROP CLIENT MASTER KEY mycmk CASCADE;
NOTICE:  drop cascades to column encryption key: mycek770
\! gs_ktool -d all
DELETE ALL
 1
