set enable_global_stats = true;
/*
 * This file is used to test the function of ExecVecUnique()
 */
----
--- Create Table and Insert Data
----
create schema vector_delete_engine;
set current_schema = vector_delete_engine;
create table vector_delete_engine.ROW_DELETE_TABLE_01
(
	col_int0	int4
   ,col_int		int
   ,col_bint	bigint
   ,col_serial	bigint
   ,col_char	char(25)
   ,col_vchar	varchar(35)
   ,col_text	text
   ,col_num		numeric(10,4)
   ,col_decimal	decimal
   ,col_float	float
   ,col_date	date
   ,col_time	time
   ,col_timetz	timetz
   ,col_interval	interval
)distribute by hash(col_int);
create table vector_delete_engine.VECTOR_DELETE_TABLE_01
(
	col_int0	int4
   ,col_int		int
   ,col_bint	bigint
   ,col_serial	bigint
   ,col_char	char(25)
   ,col_vchar	varchar(35)
   ,col_text	text
   ,col_num		numeric(10,4)
   ,col_decimal	decimal
   ,col_float	float
   ,col_date	date
   ,col_time	time
   ,col_timetz	timetz
   ,col_interval	interval
)with(orientation=orc) tablespace hdfs_ts distribute by hash(col_int);
insert into ROW_DELETE_TABLE_01 values(1, 10, 100, 2147483647, 'aa', 'aaaaaa', 'lkjhggdh', 0.01, 10.01, 1100.01, '2015-02-14', '16:00:38', '1996-2-6 01:00:30+8', '2 day 13:24:56');
insert into ROW_DELETE_TABLE_01 values(11, 20, 100, -2147483647, 'aa', 'gggggg', 'ljghjagh', 0.01, 10.01, 1100.01, '2015-03-14', '16:02:38', '1996-2-8 01:00:30+8', '2 day 13:56:56');
insert into ROW_DELETE_TABLE_01 values(1, 30, 100, -2146483647, 'bb', 'aaaaaa', 'jgdajhgdj', 0.01, 10.01, 100.01, '2015-04-15', '16:02:38', '1996-2-6 01:00:30+8', '2 day 13:24:56');
insert into ROW_DELETE_TABLE_01 values(11, 40, 100, 2147483647, 'bb', 'aaaaaa', 'ahgdjheien', 0.04, 10.01, 100.01, '2015-05-16', '16:00:38', '1996-2-8 01:00:30+8', '2 day 13:24:56');
insert into ROW_DELETE_TABLE_01 values(1, 50, 200, 2119483647, 'cc', 'aaaaaa', 'dgadgdgh', 0.01, 10.11, 100.01, '2015-02-18', '16:00:38', '1996-2-6 01:00:30+8', '2 day 13:56:56');
insert into ROW_DELETE_TABLE_01 values(11, 10, 100, 2105788455, 'dd', 'hhhhhh', 'dkjjgkdjao', 0.01, 10.01, 100.01, '2015-08-09', '16:00:38', '1996-2-8 01:00:30+8', '2 day 13:24:56');
insert into ROW_DELETE_TABLE_01 values(1, 20, 100, 1158745898, 'dd', 'aaaaaa', 'dakjgdkjae', 0.01, 10.01, 100.01, '2015-10-06', '16:05:38', '1996-2-6 01:00:30+8', '8 day 13:24:56');
insert into ROW_DELETE_TABLE_01 values(11, 30, 100, 1198754521, 'ee', 'ffffff', 'ajgeaaghgd', 0.08, 10.01, 1100.01, '2015-12-02', '16:05:38', '1996-2-6 01:30:30+8', '2 day 13:24:56');
insert into ROW_DELETE_TABLE_01 values(1, 40, 200, -1246521526, 'ee', 'aaaaaa', 'ajkgeajkjkdj', 0.08, 10.01, 1100.01, '2015-06-16', '16:00:38', '1996-2-8 01:00:30+8', '10 day 13:24:56');
insert into ROW_DELETE_TABLE_01 values(11, 50, 100, 2024856154, 'gg', 'ffffff', 'akjgiejj', 0.01, 10.11, 100.01, '2015-05-20', '16:00:38', '1996-2-6 01:00:30+8', '2 day 13:24:56');
insert into vector_delete_table_01 select * from row_delete_table_01;
create table vector_delete_engine.VECTOR_DELETE_TABLE_02
(
   col_int	int
  ,col_date	date
)with(orientation = orc) tablespace hdfs_ts distribute by hash(col_int);
create table vector_delete_engine.VECTOR_DELETE_TABLE_03
(
   col_int	int
  ,col_date	date
)with(orientation = orc) tablespace hdfs_ts distribute by hash(col_int);
COPY VECTOR_DELETE_TABLE_02(col_int, col_date) FROM stdin;
COPY VECTOR_DELETE_TABLE_03(col_int, col_date) FROM stdin;
analyze vector_delete_table_01;
analyze vector_delete_table_02;
analyze vector_delete_table_03;
----
--- case 1: Bascic Test
----
select * from vector_delete_table_01 order by 1, 2, 3;
 col_int0 | col_int | col_bint | col_serial  |         col_char          | col_vchar |   col_text   | col_num | col_decimal | col_float |         col_date         | col_time | col_timetz  |            col_interval            
----------+---------+----------+-------------+---------------------------+-----------+--------------+---------+-------------+-----------+--------------------------+----------+-------------+------------------------------------
        1 |      10 |      100 |  2147483647 | aa                        | aaaaaa    | lkjhggdh     |   .0100 |       10.01 |   1100.01 | Sat Feb 14 00:00:00 2015 | 16:00:38 | 01:00:30+08 | @ 2 days 13 hours 24 mins 56 secs
        1 |      20 |      100 |  1158745898 | dd                        | aaaaaa    | dakjgdkjae   |   .0100 |       10.01 |    100.01 | Tue Oct 06 00:00:00 2015 | 16:05:38 | 01:00:30+08 | @ 8 days 13 hours 24 mins 56 secs
        1 |      30 |      100 | -2146483647 | bb                        | aaaaaa    | jgdajhgdj    |   .0100 |       10.01 |    100.01 | Wed Apr 15 00:00:00 2015 | 16:02:38 | 01:00:30+08 | @ 2 days 13 hours 24 mins 56 secs
        1 |      40 |      200 | -1246521526 | ee                        | aaaaaa    | ajkgeajkjkdj |   .0800 |       10.01 |   1100.01 | Tue Jun 16 00:00:00 2015 | 16:00:38 | 01:00:30+08 | @ 10 days 13 hours 24 mins 56 secs
        1 |      50 |      200 |  2119483647 | cc                        | aaaaaa    | dgadgdgh     |   .0100 |       10.11 |    100.01 | Wed Feb 18 00:00:00 2015 | 16:00:38 | 01:00:30+08 | @ 2 days 13 hours 56 mins 56 secs
       11 |      10 |      100 |  2105788455 | dd                        | hhhhhh    | dkjjgkdjao   |   .0100 |       10.01 |    100.01 | Sun Aug 09 00:00:00 2015 | 16:00:38 | 01:00:30+08 | @ 2 days 13 hours 24 mins 56 secs
       11 |      20 |      100 | -2147483647 | aa                        | gggggg    | ljghjagh     |   .0100 |       10.01 |   1100.01 | Sat Mar 14 00:00:00 2015 | 16:02:38 | 01:00:30+08 | @ 2 days 13 hours 56 mins 56 secs
       11 |      30 |      100 |  1198754521 | ee                        | ffffff    | ajgeaaghgd   |   .0800 |       10.01 |   1100.01 | Wed Dec 02 00:00:00 2015 | 16:05:38 | 01:30:30+08 | @ 2 days 13 hours 24 mins 56 secs
       11 |      40 |      100 |  2147483647 | bb                        | aaaaaa    | ahgdjheien   |   .0400 |       10.01 |    100.01 | Sat May 16 00:00:00 2015 | 16:00:38 | 01:00:30+08 | @ 2 days 13 hours 24 mins 56 secs
       11 |      50 |      100 |  2024856154 | gg                        | ffffff    | akjgiejj     |   .0100 |       10.11 |    100.01 | Wed May 20 00:00:00 2015 | 16:00:38 | 01:00:30+08 | @ 2 days 13 hours 24 mins 56 secs
(10 rows)

select * from vector_delete_table_01 where col_num = 0.01 order by 1,2,3,4,5;
 col_int0 | col_int | col_bint | col_serial  |         col_char          | col_vchar |  col_text  | col_num | col_decimal | col_float |         col_date         | col_time | col_timetz  |           col_interval            
----------+---------+----------+-------------+---------------------------+-----------+------------+---------+-------------+-----------+--------------------------+----------+-------------+-----------------------------------
        1 |      10 |      100 |  2147483647 | aa                        | aaaaaa    | lkjhggdh   |   .0100 |       10.01 |   1100.01 | Sat Feb 14 00:00:00 2015 | 16:00:38 | 01:00:30+08 | @ 2 days 13 hours 24 mins 56 secs
        1 |      20 |      100 |  1158745898 | dd                        | aaaaaa    | dakjgdkjae |   .0100 |       10.01 |    100.01 | Tue Oct 06 00:00:00 2015 | 16:05:38 | 01:00:30+08 | @ 8 days 13 hours 24 mins 56 secs
        1 |      30 |      100 | -2146483647 | bb                        | aaaaaa    | jgdajhgdj  |   .0100 |       10.01 |    100.01 | Wed Apr 15 00:00:00 2015 | 16:02:38 | 01:00:30+08 | @ 2 days 13 hours 24 mins 56 secs
        1 |      50 |      200 |  2119483647 | cc                        | aaaaaa    | dgadgdgh   |   .0100 |       10.11 |    100.01 | Wed Feb 18 00:00:00 2015 | 16:00:38 | 01:00:30+08 | @ 2 days 13 hours 56 mins 56 secs
       11 |      10 |      100 |  2105788455 | dd                        | hhhhhh    | dkjjgkdjao |   .0100 |       10.01 |    100.01 | Sun Aug 09 00:00:00 2015 | 16:00:38 | 01:00:30+08 | @ 2 days 13 hours 24 mins 56 secs
       11 |      20 |      100 | -2147483647 | aa                        | gggggg    | ljghjagh   |   .0100 |       10.01 |   1100.01 | Sat Mar 14 00:00:00 2015 | 16:02:38 | 01:00:30+08 | @ 2 days 13 hours 56 mins 56 secs
       11 |      50 |      100 |  2024856154 | gg                        | ffffff    | akjgiejj   |   .0100 |       10.11 |    100.01 | Wed May 20 00:00:00 2015 | 16:00:38 | 01:00:30+08 | @ 2 days 13 hours 24 mins 56 secs
(7 rows)

explain (verbose on, costs off) delete from vector_delete_table_01 where col_num = 0.01;
                                                                                                                      QUERY PLAN                                                                                                                      
------------------------------------------------------------------------------------------------------------------------------------------------------------------------------------------------------------------------------------------------------
 Streaming (type: GATHER)
   Node/s: All datanodes
   ->  Append
         ->  Row Adapter
               ->  Vector Delete on vector_delete_engine.vector_delete_table_01
                     ->  Dfs Scan on vector_delete_engine.vector_delete_table_01
                           Output: vector_delete_engine.vector_delete_table_01.col_num, vector_delete_engine.vector_delete_table_01.ctid, vector_delete_engine.vector_delete_table_01.xc_node_id, vector_delete_engine.vector_delete_table_01.col_int
                           Distribute Key: vector_delete_engine.vector_delete_table_01.col_int
                           Pushdown Predicate Filter: (vector_delete_engine.vector_delete_table_01.col_num = .01)
         ->  Delete on cstore.pg_delta_vector_delete_engine_vector_delete_table_01 vector_delete_table_01
               ->  Seq Scan on cstore.pg_delta_vector_delete_engine_vector_delete_table_01 vector_delete_table_01
                     Output: cstore.vector_delete_table_01.col_num, cstore.vector_delete_table_01.ctid, cstore.vector_delete_table_01.xc_node_id, cstore.vector_delete_table_01.col_int
                     Distribute Key: cstore.vector_delete_table_01.col_int
                     Filter: (cstore.vector_delete_table_01.col_num = .01)
(14 rows)

delete from vector_delete_table_01 where col_num = 0.01;
select count(*) from vector_delete_table_01;
 count 
-------
     3
(1 row)

delete from vector_delete_table_01 where col_timetz = '1996-2-6 01:00:30+8';
select * from vector_delete_table_01 where col_timetz = '1996-2-6 01:00:30+8' order by 1,2,3,4,5;
 col_int0 | col_int | col_bint | col_serial | col_char | col_vchar | col_text | col_num | col_decimal | col_float | col_date | col_time | col_timetz | col_interval 
----------+---------+----------+------------+----------+-----------+----------+---------+-------------+-----------+----------+----------+------------+--------------
(0 rows)

delete from vector_delete_table_01 where col_vchar = 'ffffff' and col_time = '16:05:38';
select * from vector_delete_table_01 where col_vchar = 'ffffff' and col_time = '16:05:38' order by 1,2,3,4,5;
 col_int0 | col_int | col_bint | col_serial | col_char | col_vchar | col_text | col_num | col_decimal | col_float | col_date | col_time | col_timetz | col_interval 
----------+---------+----------+------------+----------+-----------+----------+---------+-------------+-----------+----------+----------+------------+--------------
(0 rows)

----
--- case 2: With Null
----
delete from vector_delete_table_01;
insert into ROW_DELETE_TABLE_01 values(1, NULL, 200, -1246521526, NULL, 'aaaaaa', 'ajkgeajkjkdj', 0.08, 10.01, 1100.01, '2015-06-16', '16:00:38', '1996-2-8 01:00:30+8', NULL);
insert into ROW_DELETE_TABLE_01 values(11, 50, -1246521526,100, 'gg', 'ffffff', 'akjgiejj',NULL, 10.11, 100.01, '2015-05-20', '16:00:38', NULL, '2 day 13:24:56');
insert into ROW_DELETE_TABLE_01 values(1, 20, 100, 1158745898, 'dd', 'aaaaaa', NULL, 0.01, 10.01, 100.01, NULL, '16:05:38', '1996-2-6 01:00:30+8', '8 day 13:24:56');
insert into ROW_DELETE_TABLE_01 values(NULL, 30, 100, 1198754521, 'ee', 'ffffff', 'ajgeaaghgd', 0.08, NULL, 1100.01, '2015-12-02', '16:05:38', '1996-2-6 01:00:30+8', '2 day 13:24:56');
insert into ROW_DELETE_TABLE_01 values(NULL,NULL,NULL,1198754521,NULL,NULL,NULL,NULL,NULL,NULL,NULL,NULL,NULL,NULL);
insert into vector_delete_table_01 select * from row_delete_table_01;
analyze vector_delete_table_01;
delete from vector_delete_table_01 where col_int0=1 and col_date='2015-04-15';
select count(*) from  vector_delete_table_01 where col_int0=1 and col_date='2015-04-15';
 count 
-------
     0
(1 row)

delete from vector_delete_table_01 where col_date is NULL ;
delete from vector_delete_table_01 where col_decimal is not NULL; 
delete from vector_delete_table_01;
select count(*) from  vector_delete_table_01;
 count 
-------
     0
(1 row)

----
--- case 3: With Big Amount
----
CREATE OR REPLACE PROCEDURE func_insert_tbl_delete_01()
AS
BEGIN
    FOR I IN 0..2000 LOOP
        insert into ROW_DELETE_TABLE_01 values(11, 50, 100, 2024856154, 'gg', 'ffffff', 'testdelete'||i, 0.01, 10.11, 100.01, '2015-05-20', '16:00:38', '1996-2-6 01:00:30+8', '2 day 13:24:56');     
    END LOOP;
END;
/
CALL func_insert_tbl_delete_01();
 func_insert_tbl_delete_01 
---------------------------
 
(1 row)

insert into vector_delete_table_01 select * from row_delete_table_01;
delete from vector_delete_table_01 where col_char = 'gg' and col_vchar = 'ffffff';
select count(*) from  vector_delete_table_01;
 count 
-------
    13
(1 row)

----
--- case 4: non-correlated subquery
----
explain (verbose on, costs off) delete from vector_delete_table_03 where exists(select col_date from vector_delete_table_02);
                                                                                              QUERY PLAN                                                                                               
-------------------------------------------------------------------------------------------------------------------------------------------------------------------------------------------------------
 Streaming (type: GATHER)
   Node/s: All datanodes
   InitPlan 1 (returns $0)
     ->  Row Adapter
           Output: ('Dummy')
           ->  Vector Streaming(type: BROADCAST)
                 Output: ('Dummy')
                 Spawn on: All datanodes
                 Consumer Nodes: All datanodes
                 ->  Vector Result
                       Output: ('Dummy')
                       ->  Vector Append
                             ->  Dfs Scan on vector_delete_engine.vector_delete_table_02
                                   Output: 'Dummy'
                                   Distribute Key: vector_delete_engine.vector_delete_table_02.col_int
                             ->  Vector Adapter
                                   Output: ('Dummy')
                                   ->  Seq Scan on cstore.pg_delta_vector_delete_engine_vector_delete_table_02 vector_delete_table_02
                                         Output: 'Dummy'
                                         Distribute Key: cstore.vector_delete_table_02.col_int
   ->  Append
         ->  Row Adapter
               ->  Vector Delete on vector_delete_engine.vector_delete_table_03
                     ->  Vector Result
                           Output: vector_delete_engine.vector_delete_table_03.ctid, vector_delete_engine.vector_delete_table_03.xc_node_id, vector_delete_engine.vector_delete_table_03.col_int
                           One-Time Filter: $0
                           ->  Dfs Scan on vector_delete_engine.vector_delete_table_03
                                 Output: vector_delete_engine.vector_delete_table_03.ctid, vector_delete_engine.vector_delete_table_03.xc_node_id, vector_delete_engine.vector_delete_table_03.col_int
                                 Distribute Key: vector_delete_engine.vector_delete_table_03.col_int
         ->  Delete on cstore.pg_delta_vector_delete_engine_vector_delete_table_03 vector_delete_table_03
               ->  Row Adapter
                     Output: cstore.vector_delete_table_03.ctid, cstore.vector_delete_table_03.xc_node_id, cstore.vector_delete_table_03.col_int
                     ->  Vector Result
                           Output: cstore.vector_delete_table_03.ctid, cstore.vector_delete_table_03.xc_node_id, cstore.vector_delete_table_03.col_int
                           One-Time Filter: $0
                           ->  Vector Adapter
                                 Output: cstore.vector_delete_table_03.ctid, cstore.vector_delete_table_03.xc_node_id, cstore.vector_delete_table_03.col_int
                                 ->  Seq Scan on cstore.pg_delta_vector_delete_engine_vector_delete_table_03 vector_delete_table_03
                                       Output: cstore.vector_delete_table_03.ctid, cstore.vector_delete_table_03.xc_node_id, cstore.vector_delete_table_03.col_int
                                       Distribute Key: cstore.vector_delete_table_03.col_int
(40 rows)

delete from vector_delete_table_03 where exists(select col_date from vector_delete_table_02);
----
--- Clean Table and Resource
----
drop schema vector_delete_engine cascade;
NOTICE:  drop cascades to 5 other objects
DETAIL:  drop cascades to table row_delete_table_01
drop cascades to table vector_delete_table_01
drop cascades to table vector_delete_table_02
drop cascades to table vector_delete_table_03
drop cascades to function func_insert_tbl_delete_01()
