-- workload_transaction
\d+ DBE_PERF.workload_transaction 
              View "dbe_perf.workload_transaction"
       Column        |  Type  | Modifiers | Storage | Description 
---------------------+--------+-----------+---------+-------------
 workload            | name   |           | plain   | 
 commit_counter      | bigint |           | plain   | 
 rollback_counter    | bigint |           | plain   | 
 resp_min            | bigint |           | plain   | 
 resp_max            | bigint |           | plain   | 
 resp_avg            | bigint |           | plain   | 
 resp_total          | bigint |           | plain   | 
 bg_commit_counter   | bigint |           | plain   | 
 bg_rollback_counter | bigint |           | plain   | 
 bg_resp_min         | bigint |           | plain   | 
 bg_resp_max         | bigint |           | plain   | 
 bg_resp_avg         | bigint |           | plain   | 
 bg_resp_total       | bigint |           | plain   | 
View definition:
 SELECT pg_user.respool AS workload, 
    sum(w.commit_counter)::bigint AS commit_counter, 
    sum(w.rollback_counter)::bigint AS rollback_counter, 
    min(w.resp_min) AS resp_min, max(w.resp_max) AS resp_max, 
    (sum(w.resp_total) / GREATEST(sum(w.commit_counter), 1::numeric))::bigint AS resp_avg, 
    sum(w.resp_total)::bigint AS resp_total, 
    sum(w.bg_commit_counter)::bigint AS bg_commit_counter, 
    sum(w.bg_rollback_counter)::bigint AS bg_rollback_counter, 
    min(w.bg_resp_min) AS bg_resp_min, max(w.bg_resp_max) AS bg_resp_max, 
    (sum(w.bg_resp_total) / GREATEST(sum(w.bg_commit_counter), 1::numeric))::bigint AS bg_resp_avg, 
    sum(w.bg_resp_total)::bigint AS bg_resp_total
   FROM pg_user
   LEFT JOIN dbe_perf.user_transaction w ON pg_user.usename = w.usename
  GROUP BY pg_user.respool;

\d+ DBE_PERF.global_workload_transaction
           View "dbe_perf.global_workload_transaction"
       Column        |  Type  | Modifiers | Storage | Description 
---------------------+--------+-----------+---------+-------------
 node_name           | name   |           | plain   | 
 workload            | name   |           | plain   | 
 commit_counter      | bigint |           | plain   | 
 rollback_counter    | bigint |           | plain   | 
 resp_min            | bigint |           | plain   | 
 resp_max            | bigint |           | plain   | 
 resp_avg            | bigint |           | plain   | 
 resp_total          | bigint |           | plain   | 
 bg_commit_counter   | bigint |           | plain   | 
 bg_rollback_counter | bigint |           | plain   | 
 bg_resp_min         | bigint |           | plain   | 
 bg_resp_max         | bigint |           | plain   | 
 bg_resp_avg         | bigint |           | plain   | 
 bg_resp_total       | bigint |           | plain   | 
View definition:
 SELECT  *
   FROM dbe_perf.get_global_workload_transaction() get_global_workload_transaction(node_name, workload, commit_counter, rollback_counter, resp_min, resp_max, resp_avg, resp_total, bg_commit_counter, bg_rollback_counter, bg_resp_min, bg_resp_max, bg_resp_avg, bg_resp_total);

\d+ DBE_PERF.user_transaction
                View "dbe_perf.user_transaction"
       Column        |  Type  | Modifiers | Storage | Description 
---------------------+--------+-----------+---------+-------------
 usename             | name   |           | plain   | 
 commit_counter      | bigint |           | plain   | 
 rollback_counter    | bigint |           | plain   | 
 resp_min            | bigint |           | plain   | 
 resp_max            | bigint |           | plain   | 
 resp_avg            | bigint |           | plain   | 
 resp_total          | bigint |           | plain   | 
 bg_commit_counter   | bigint |           | plain   | 
 bg_rollback_counter | bigint |           | plain   | 
 bg_resp_min         | bigint |           | plain   | 
 bg_resp_max         | bigint |           | plain   | 
 bg_resp_avg         | bigint |           | plain   | 
 bg_resp_total       | bigint |           | plain   | 
View definition:
 SELECT pg_user.usename, giwi.commit_counter, giwi.rollback_counter, 
    giwi.resp_min, giwi.resp_max, giwi.resp_avg, giwi.resp_total, 
    giwi.bg_commit_counter, giwi.bg_rollback_counter, giwi.bg_resp_min, 
    giwi.bg_resp_max, giwi.bg_resp_avg, giwi.bg_resp_total
   FROM pg_user
   LEFT JOIN get_instr_workload_info(0) giwi(user_oid, commit_counter, rollback_counter, resp_min, resp_max, resp_avg, resp_total, bg_commit_counter, bg_rollback_counter, bg_resp_min, bg_resp_max, bg_resp_avg, bg_resp_total) ON pg_user.usesysid = giwi.user_oid::oid;

\d+ DBE_PERF.global_user_transaction
             View "dbe_perf.global_user_transaction"
       Column        |  Type  | Modifiers | Storage | Description 
---------------------+--------+-----------+---------+-------------
 node_name           | name   |           | plain   | 
 usename             | name   |           | plain   | 
 commit_counter      | bigint |           | plain   | 
 rollback_counter    | bigint |           | plain   | 
 resp_min            | bigint |           | plain   | 
 resp_max            | bigint |           | plain   | 
 resp_avg            | bigint |           | plain   | 
 resp_total          | bigint |           | plain   | 
 bg_commit_counter   | bigint |           | plain   | 
 bg_rollback_counter | bigint |           | plain   | 
 bg_resp_min         | bigint |           | plain   | 
 bg_resp_max         | bigint |           | plain   | 
 bg_resp_avg         | bigint |           | plain   | 
 bg_resp_total       | bigint |           | plain   | 
View definition:
 SELECT  *
   FROM dbe_perf.get_global_user_transaction() get_global_user_transaction(node_name, usename, commit_counter, rollback_counter, resp_min, resp_max, resp_avg, resp_total, bg_commit_counter, bg_rollback_counter, bg_resp_min, bg_resp_max, bg_resp_avg, bg_resp_total);

-- workload transaction
create table temp_info_before as select * from dbe_perf.workload_transaction ;
begin;
select 1;
 ?column? 
----------
        1
(1 row)

commit;
begin;
select 1;
 ?column? 
----------
        1
(1 row)

rollback;
create table temp_info_after as select * from dbe_perf.workload_transaction ;
select a.commit_counter - b.commit_counter > 0 as commit, a.rollback_counter - b.rollback_counter > 0 as rollback from temp_info_before b join temp_info_after a on b.workload = a.workload;
 commit | rollback 
--------+----------
 t      | t
(1 row)

select workload, commit_counter >=0, rollback_counter >=0, resp_min >=0, resp_max >=0, resp_avg >=0, resp_total >=0
from dbe_perf.workload_transaction  order by workload;
   workload   | ?column? | ?column? | ?column? | ?column? | ?column? | ?column? 
--------------+----------+----------+----------+----------+----------+----------
 default_pool | t        | t        | t        | t        | t        | t
(1 row)

select node_name, workload, commit_counter >=0, rollback_counter >=0, resp_min >= 0, resp_max >= 0, resp_avg >= 0, resp_total >= 0
from DBE_PERF.global_workload_transaction order by node_name, workload;
  node_name   |   workload   | ?column? | ?column? | ?column? | ?column? | ?column? | ?column? 
--------------+--------------+----------+----------+----------+----------+----------+----------
 coordinator1 | default_pool | t        | t        | t        | t        | t        | t
 coordinator2 | default_pool | t        | t        | t        | t        | t        | t
 coordinator3 | default_pool | t        | t        | t        | t        | t        | t
(3 rows)

drop table temp_info_before;
drop table temp_info_after;
-- user transaction
create user workload_u1 password 'qwe123!@#';
create user workload_u2 password 'qwe123!@#';
create user workload_u3 password 'qwe123!@#';
select usename from DBE_PERF.user_transaction where usename like 'workload_u%' order by usename;
   usename   
-------------
 workload_u1
 workload_u2
 workload_u3
(3 rows)

select node_name, usename from DBE_PERF.global_user_transaction where usename like 'workload_u%' order by node_name, usename;
  node_name   |   usename   
--------------+-------------
 coordinator1 | workload_u1
 coordinator1 | workload_u2
 coordinator1 | workload_u3
 coordinator2 | workload_u1
 coordinator2 | workload_u2
 coordinator2 | workload_u3
 coordinator3 | workload_u1
 coordinator3 | workload_u2
 coordinator3 | workload_u3
(9 rows)

drop user workload_u1;
drop user workload_u2;
drop user workload_u3;
select usename from DBE_PERF.user_transaction where usename like 'workload_u%'  order by usename;
 usename 
---------
(0 rows)

select node_name, usename from DBE_PERF.global_user_transaction where usename like 'workload_u%' order by node_name, usename;
 node_name | usename 
-----------+---------
(0 rows)

-- workload sql
show track_sql_count;
 track_sql_count 
-----------------
 off
(1 row)

SET track_sql_count=on;
start transaction;
create table t1_workload_sql(id int, num int) distribute by hash(id);
insert into t1_workload_sql values(1,1);
update t1_workload_sql set num = 2 where id = 1;
select * from t1_workload_sql;
 id | num 
----+-----
  1 |   2
(1 row)

delete from t1_workload_sql;
drop table t1_workload_sql;
commit;
select workload, ddl_count>=2, dml_count>=4, dcl_count>=2 from DBE_PERF.workload_sql_count;
   workload   | ?column? | ?column? | ?column? 
--------------+----------+----------+----------
 default_pool | t        | t        | t
(1 row)

select workload, ddl_count>=2, dml_count>=4, dcl_count>=2 from DBE_PERF.summary_workload_sql_count where node_name='coordinator1';
   workload   | ?column? | ?column? | ?column? 
--------------+----------+----------+----------
 default_pool | t        | t        | t
(1 row)

select workload, total_select_elapse>0, total_update_elapse>0, total_insert_elapse>0, total_delete_elapse>0 from DBE_PERF.workload_sql_elapse_time;
   workload   | ?column? | ?column? | ?column? | ?column? 
--------------+----------+----------+----------+----------
 default_pool | t        | t        | t        | t
(1 row)

select workload, max_select_elapse>0, max_update_elapse>0, max_insert_elapse>0, max_delete_elapse>0 from DBE_PERF.workload_sql_elapse_time;
   workload   | ?column? | ?column? | ?column? | ?column? 
--------------+----------+----------+----------+----------
 default_pool | t        | t        | t        | t
(1 row)

select workload, min_select_elapse>=0, min_update_elapse>=0, min_insert_elapse>=0, min_delete_elapse>=0 from DBE_PERF.workload_sql_elapse_time;
   workload   | ?column? | ?column? | ?column? | ?column? 
--------------+----------+----------+----------+----------
 default_pool | t        | t        | t        | t
(1 row)

select workload, avg_select_elapse>0, avg_update_elapse>0, avg_insert_elapse>0, avg_delete_elapse>0 from DBE_PERF.workload_sql_elapse_time;
   workload   | ?column? | ?column? | ?column? | ?column? 
--------------+----------+----------+----------+----------
 default_pool | t        | t        | t        | t
(1 row)

select workload, total_select_elapse>0, total_update_elapse>0, total_insert_elapse>0, total_delete_elapse>0 from DBE_PERF.summary_workload_sql_elapse_time where node_name='coordinator1';
   workload   | ?column? | ?column? | ?column? | ?column? 
--------------+----------+----------+----------+----------
 default_pool | t        | t        | t        | t
(1 row)

select workload, max_select_elapse>0, max_update_elapse>0, max_insert_elapse>0, max_delete_elapse>0 from DBE_PERF.summary_workload_sql_elapse_time where node_name='coordinator1';
   workload   | ?column? | ?column? | ?column? | ?column? 
--------------+----------+----------+----------+----------
 default_pool | t        | t        | t        | t
(1 row)

select workload, min_select_elapse>=0, min_update_elapse>=0, min_insert_elapse>=0, min_delete_elapse>=0 from DBE_PERF.summary_workload_sql_elapse_time where node_name='coordinator1';
   workload   | ?column? | ?column? | ?column? | ?column? 
--------------+----------+----------+----------+----------
 default_pool | t        | t        | t        | t
(1 row)

select workload, avg_select_elapse>0, avg_update_elapse>0, avg_insert_elapse>0, avg_delete_elapse>0 from DBE_PERF.summary_workload_sql_elapse_time where node_name='coordinator1';
   workload   | ?column? | ?column? | ?column? | ?column? 
--------------+----------+----------+----------+----------
 default_pool | t        | t        | t        | t
(1 row)

