-- test for ignore error of no partition matched
create database sql_ignore_no_matched_partition_test dbcompatibility 'B';
\c sql_ignore_no_matched_partition_test;
-- sqlbypass
set enable_opfusion = on;
set enable_partition_opfusion = on;
drop table if exists t_ignore;
NOTICE:  table "t_ignore" does not exist, skipping
CREATE TABLE t_ignore
(
    col1 integer NOT NULL,
    col2 character varying(60)
) PARTITION BY RANGE (col1)
(
    PARTITION P1 VALUES LESS THAN(5000),
    PARTITION P2 VALUES LESS THAN(10000),
    PARTITION P3 VALUES LESS THAN(15000)
)
ENABLE ROW MOVEMENT;
insert into t_ignore values(20000, 'abc');
ERROR:  inserted partition key does not map to any table partition
insert into t_ignore values(3000, 'abc');
update t_ignore set col1 = 20000 where col1 = 3000;
ERROR:  fail to update partitioned table "t_ignore"
DETAIL:  new tuple does not map to any table partition
select * from t_ignore;
 col1 | col2 
------+------
 3000 | abc
(1 row)

explain(costs off) insert /*+ ignore_error */ into t_ignore values(20000, 'abc');
     QUERY PLAN     
--------------------
 [Bypass]
 Insert on t_ignore
   ->  Result
(3 rows)

insert /*+ ignore_error */ into t_ignore values(20000, 'abc');
WARNING:  inserted partition key does not map to any table partition
update /*+ ignore_error */ t_ignore set col1 = 20000 where col1 = 3000;
WARNING:  fail to update partitioned table "t_ignore".new tuple does not map to any table partition.
select * from t_ignore;
 col1 | col2 
------+------
 3000 | abc
(1 row)

drop table if exists t_from;
NOTICE:  table "t_from" does not exist, skipping
create table t_from (num int, content character varying(60));
-- -- insert ignore from other tables with unmatchable rows
insert into t_from values(1000, 'valid row from t_from');
insert into t_from values(20000, 'INVALID row from t_from');
insert /*+ ignore_error */ into t_ignore select * from t_from;
WARNING:  inserted partition key does not map to any table partition
select * from t_ignore;
 col1 |         col2          
------+-----------------------
 3000 | abc
 1000 | valid row from t_from
(2 rows)

-- no sqlbypass
set enable_opfusion = off;
set enable_partition_opfusion = off;
insert into t_ignore values(1000, 'abc');
insert into t_ignore values(30000, 'abc');
ERROR:  inserted partition key does not map to any table partition
update t_ignore set col1 = 30000 where col1 = 1000;
ERROR:  fail to update partitioned table "t_ignore"
DETAIL:  new tuple does not map to any table partition
select * from t_ignore;
 col1 |         col2          
------+-----------------------
 3000 | abc
 1000 | valid row from t_from
 1000 | abc
(3 rows)

explain(costs off) insert /*+ ignore_error */ into t_ignore values(30000, 'abc');
     QUERY PLAN     
--------------------
 Insert on t_ignore
   ->  Result
(2 rows)

insert /*+ ignore_error */ into t_ignore values(30000, 'abc');
WARNING:  inserted partition key does not map to any table partition
update /*+ ignore_error */ t_ignore set col1 = 30000 where col1 = 1000;
WARNING:  fail to update partitioned table "t_ignore".new tuple does not map to any table partition.
WARNING:  fail to update partitioned table "t_ignore".new tuple does not map to any table partition.
select * from t_ignore;
 col1 |         col2          
------+-----------------------
 3000 | abc
 1000 | valid row from t_from
 1000 | abc
(3 rows)

-- insert ignore from other tables with unmatchable rows
insert /*+ ignore_error */ into t_ignore select * from t_from;
WARNING:  inserted partition key does not map to any table partition
select * from t_ignore;
 col1 |         col2          
------+-----------------------
 3000 | abc
 1000 | valid row from t_from
 1000 | abc
 1000 | valid row from t_from
(4 rows)

-- test for subpartition table
drop table if exists ignore_range_range;
NOTICE:  table "ignore_range_range" does not exist, skipping
CREATE TABLE ignore_range_range
(
    month_code VARCHAR2 ( 30 ) NOT NULL ,
    dept_code  VARCHAR2 ( 30 ) NOT NULL ,
    user_no    VARCHAR2 ( 30 ) NOT NULL ,
    sales_amt  int
)
PARTITION BY RANGE (month_code) SUBPARTITION BY RANGE (dept_code)
(
  PARTITION p_201901 VALUES LESS THAN( '201901' )
  (
    SUBPARTITION p_201901_a VALUES LESS THAN( '2' ),
    SUBPARTITION p_201901_b VALUES LESS THAN( '3' )
  ),
  PARTITION p_201902 VALUES LESS THAN( '201902' )
  (
    SUBPARTITION p_201902_a VALUES LESS THAN( '2' ),
    SUBPARTITION p_201902_b VALUES LESS THAN( '3' )
  )
);
set enable_partition_opfusion = on;
insert /*+ ignore_error */ into ignore_range_range values('201901', '1', '1', 1);
insert /*+ ignore_error */  into ignore_range_range values('201901', '4', '1', 1);
WARNING:  inserted partition key does not map to any table partition
select * from ignore_range_range;
 month_code | dept_code | user_no | sales_amt 
------------+-----------+---------+-----------
 201901     | 1         | 1       |         1
(1 row)

update /*+ ignore_error */ ignore_range_range set dept_code = '4' where dept_code = '1';
WARNING:  fail to update partitioned table "ignore_range_range"
DETAIL:  new tuple does not map to any table partition
select * from ignore_range_range;
 month_code | dept_code | user_no | sales_amt 
------------+-----------+---------+-----------
 201901     | 1         | 1       |         1
(1 row)

delete from ignore_range_range;
set enable_partition_opfusion = off;
insert /*+ ignore_error */  into ignore_range_range values('201901', '1', '1', 1);
insert /*+ ignore_error */  into ignore_range_range values('201901', '4', '1', 1);
WARNING:  inserted partition key does not map to any table partition
select * from ignore_range_range;
 month_code | dept_code | user_no | sales_amt 
------------+-----------+---------+-----------
 201901     | 1         | 1       |         1
(1 row)

update /*+ ignore_error */ ignore_range_range set dept_code = '4' where dept_code = '1';
WARNING:  fail to update partitioned table "ignore_range_range"
DETAIL:  new tuple does not map to any table partition
select * from ignore_range_range;
 month_code | dept_code | user_no | sales_amt 
------------+-----------+---------+-----------
 201901     | 1         | 1       |         1
(1 row)

drop table if exists t_specified_partition;
NOTICE:  table "t_specified_partition" does not exist, skipping
-- test for table with specified partition/subpartition provided
create table t_specified_partition(
  month_code VARCHAR2(30) primary key,
  dept_code VARCHAR2(30) NOT NULL,
  user_no VARCHAR2(30) NOT NULL,
  sales_amt int
)
PARTITION BY RANGE(month_code) SUBPARTITION BY LIST(dept_code)
(
    PARTITION p_201901 VALUES LESS THAN('201906')
    (
        SUBPARTITION p_201901_a values('1'),
        SUBPARTITION p_201901_b values('2')
    ),
    PARTITION p_201902 VALUES LESS THAN('201910')
    (
        SUBPARTITION p_201902_a values('1'),
        SUBPARTITION p_201902_b values('2')
    )
);
NOTICE:  CREATE TABLE / PRIMARY KEY will create implicit index "t_specified_partition_pkey" for table "t_specified_partition"
set enable_opfusion = on;
set enable_partition_opfusion = on;
insert /*+ ignore_error */ into t_specified_partition partition(p_201901) values('201906', '1', '1', 1);
WARNING:  inserted partition key does not map to the table partition
DETAIL:  N/A.
insert /*+ ignore_error */ into t_specified_partition subpartition(p_201901_a) values('201905', '2', '1', 1);
WARNING:  inserted subpartition key does not map to the table subpartition
DETAIL:  N/A.
insert /*+ ignore_error */ into t_specified_partition partition(p_201901) values('201904', '1', '1', 1);
select * from t_specified_partition;
 month_code | dept_code | user_no | sales_amt 
------------+-----------+---------+-----------
 201904     | 1         | 1       |         1
(1 row)

set enable_opfusion = off;
set enable_partition_opfusion = off;
insert /*+ ignore_error */ into t_specified_partition partition(p_201901) values('201906', '1', '1', 1);
WARNING:  inserted partition key does not map to the table partition
DETAIL:  N/A.
insert /*+ ignore_error */ into t_specified_partition subpartition(p_201901_a) values('201905', '2', '1', 1);
WARNING:  inserted subpartition key does not map to the table subpartition
DETAIL:  N/A.
insert /*+ ignore_error */ into t_specified_partition subpartition(p_201901_a) values('201903', '1', '1', 1);
select * from t_specified_partition;
 month_code | dept_code | user_no | sales_amt 
------------+-----------+---------+-----------
 201904     | 1         | 1       |         1
 201903     | 1         | 1       |         1
(2 rows)

-- test for ustore table
drop table if exists t_ignore;
CREATE TABLE t_ignore
(
    col1 integer NOT NULL,
    col2 character varying(60)
) WITH(storage_type=ustore) PARTITION BY RANGE (col1)
(
    PARTITION P1 VALUES LESS THAN(5000),
    PARTITION P2 VALUES LESS THAN(10000),
    PARTITION P3 VALUES LESS THAN(15000)
)
ENABLE ROW MOVEMENT;
-- test for ustore table, opfusion: on
set enable_opfusion = on;
set enable_partition_opfusion = on;
explain (costs off) insert /*+ ignore_error */ into t_ignore values(20000, 'abc');
     QUERY PLAN     
--------------------
 [Bypass]
 Insert on t_ignore
   ->  Result
(3 rows)

insert /*+ ignore_error */ into t_ignore values(20000, 'abc');
WARNING:  inserted partition key does not map to any table partition
select * from t_ignore;
 col1 | col2 
------+------
(0 rows)

insert into t_ignore values(3000, 'abc');
update /*+ ignore_error */ t_ignore set col1 = 20000 where col1 = 3000;
WARNING:  fail to update partitioned table "t_ignore".new tuple does not map to any table partition.
select * from t_ignore;
 col1 | col2 
------+------
 3000 | abc
(1 row)

-- test for ustore table, opfusion: off
delete from t_ignore;
set enable_opfusion = off;
set enable_partition_opfusion = off;
explain (costs off) insert /*+ ignore_error */ into t_ignore values(20000, 'abc');
     QUERY PLAN     
--------------------
 Insert on t_ignore
   ->  Result
(2 rows)

insert /*+ ignore_error */ into t_ignore values(20000, 'abc');
WARNING:  inserted partition key does not map to any table partition
select * from t_ignore;
 col1 | col2 
------+------
(0 rows)

insert into t_ignore values(3000, 'abc');
update /*+ ignore_error */ t_ignore set col1 = 20000 where col1 = 3000;
WARNING:  fail to update partitioned table "t_ignore".new tuple does not map to any table partition.
select * from t_ignore;
 col1 | col2 
------+------
 3000 | abc
(1 row)

-- test for segment table
drop table if exists t_ignore;
CREATE TABLE t_ignore
(
    col1 integer NOT NULL,
    col2 character varying(60)
) WITH(segment = on) PARTITION BY RANGE (col1)
(
    PARTITION P1 VALUES LESS THAN(5000),
    PARTITION P2 VALUES LESS THAN(10000),
    PARTITION P3 VALUES LESS THAN(15000)
)
ENABLE ROW MOVEMENT;
-- test for segment table, opfusion: on
set enable_partition_opfusion = on;
explain(costs off) insert /*+ ignore_error */ into t_ignore values(20000, 'abc');
     QUERY PLAN     
--------------------
 Insert on t_ignore
   ->  Result
(2 rows)

insert /*+ ignore_error */ into t_ignore values(20000, 'abc');
WARNING:  inserted partition key does not map to any table partition
select * from t_ignore;
 col1 | col2 
------+------
(0 rows)

insert into t_ignore values(3000, 'abc');
update /*+ ignore_error */ t_ignore set col1 = 20000 where col1 = 3000;
WARNING:  fail to update partitioned table "t_ignore".new tuple does not map to any table partition.
select * from t_ignore;
 col1 | col2 
------+------
 3000 | abc
(1 row)

-- test for segment table, opfusion: off
set enable_partition_opfusion = off;
delete from t_ignore;
explain(costs off) insert /*+ ignore_error */ into t_ignore values(20000, 'abc');
     QUERY PLAN     
--------------------
 Insert on t_ignore
   ->  Result
(2 rows)

insert /*+ ignore_error */ into t_ignore values(20000, 'abc');
WARNING:  inserted partition key does not map to any table partition
select * from t_ignore;
 col1 | col2 
------+------
(0 rows)

insert into t_ignore values(3000, 'abc');
update /*+ ignore_error */ t_ignore set col1 = 20000 where col1 = 3000;
WARNING:  fail to update partitioned table "t_ignore".new tuple does not map to any table partition.
select * from t_ignore;
 col1 | col2 
------+------
 3000 | abc
(1 row)

-- test for interval partition table
drop table if exists t_interval_partition cascade;
NOTICE:  table "t_interval_partition" does not exist, skipping
create table t_interval_partition
(
    id1 integer primary key,
    id3 integer,
    c_3 date
)
PARTITION BY RANGE (c_3) INTERVAL('1 year')
(
    PARTITION P1 values less than ('2018-03-16 16:27:04'),
    PARTITION P2 values less than ('2020-03-16 16:27:04'),
    PARTITION P4 values less than ('2022-03-16 16:27:04')
) ENABLE ROW MOVEMENT;
NOTICE:  CREATE TABLE / PRIMARY KEY will create implicit index "t_interval_partition_pkey" for table "t_interval_partition"
-- test for interval partition table, opfusion: on
set enable_partition_opfusion = on;
insert into t_interval_partition values (1, 1, null);
ERROR:  inserted partition key does not map to any partition
DETAIL:  inserted partition key cannot be NULL for interval-partitioned table
insert /*+ ignore_error */ into t_interval_partition values (1, 1, null);
WARNING:  inserted partition key does not map to any table partition
select * from t_interval_partition;
 id1 | id3 | c_3 
-----+-----+-----
(0 rows)

insert into t_interval_partition values (1, 1, '2023-02-01 00:00:00');
update t_interval_partition set c_3 = null where id1 = 1;
ERROR:  inserted partition key does not map to any partition
DETAIL:  inserted partition key cannot be NULL for interval-partitioned table
update /*+ ignore_error */ t_interval_partition set c_3 = null where id1 = 1;
WARNING:  fail to update partitioned table "t_interval_partition".new tuple does not map to any table partition.
select * from t_interval_partition;
 id1 | id3 |    c_3     
-----+-----+------------
   1 |   1 | 02-01-2023
(1 row)

-- test for interval partition table, opfusion: off
delete from t_interval_partition;
set enable_partition_opfusion = off;
insert into t_interval_partition values (1, 1, null);
ERROR:  inserted partition key does not map to any partition
DETAIL:  inserted partition key cannot be NULL for interval-partitioned table
insert /*+ ignore_error */ into t_interval_partition values (1, 1, null);
WARNING:  inserted partition key does not map to any table partition
select * from t_interval_partition;
 id1 | id3 | c_3 
-----+-----+-----
(0 rows)

insert into t_interval_partition values (1, 1, '2023-02-01 00:00:00');
update t_interval_partition set c_3 = null where id1 = 1;
ERROR:  inserted partition key does not map to any partition
DETAIL:  inserted partition key cannot be NULL for interval-partitioned table
update /*+ ignore_error */ t_interval_partition set c_3 = null where id1 = 1;
WARNING:  fail to update partitioned table "t_interval_partition".new tuple does not map to any table partition.
select * from t_interval_partition;
 id1 | id3 |    c_3     
-----+-----+------------
   1 |   1 | 02-01-2023
(1 row)

set enable_opfusion = on;
set enable_partition_opfusion = off;
drop table t_ignore;
drop table t_from;
\c postgres
drop database if exists sql_ignore_no_matched_partition_test;
