create database sql_ignore_type_transform_test dbcompatibility 'B';
\c sql_ignore_type_transform_test;
-- test for tinyint
drop table if exists t;
NOTICE:  table "t" does not exist, skipping
create table t(num tinyint);
insert into t values(10000);
ERROR:  tinyint out of range
CONTEXT:  referenced column: num
insert into t values(-10000);
ERROR:  tinyint out of range
CONTEXT:  referenced column: num
insert into t values(100);
insert into t values(-100);
ERROR:  tinyint out of range
CONTEXT:  referenced column: num
insert /*+ ignore_error */ into t values(10000);
WARNING:  tinyint out of range
CONTEXT:  referenced column: num
insert /*+ ignore_error */ into t values(-10000);
WARNING:  tinyint out of range
CONTEXT:  referenced column: num
insert /*+ ignore_error */ into t values(100);
insert /*+ ignore_error */ into t values(-100);
WARNING:  tinyint out of range
CONTEXT:  referenced column: num
select * from t;
 num 
-----
 100
 255
 0
 100
 0
(5 rows)

update /*+ ignore_error */ t set num = 100000 where num = 100;
WARNING:  tinyint out of range
CONTEXT:  referenced column: num
select * from t;
 num 
-----
 255
 0
 0
 255
 255
(5 rows)

-- insert numeric table into tinyint table
drop table if exists t_tinyint;
NOTICE:  table "t_tinyint" does not exist, skipping
drop table if exists t_numeric;
NOTICE:  table "t_numeric" does not exist, skipping
create table t_tinyint(num tinyint);
create table t_numeric(num numeric);
insert into t_numeric values (38764378634891278678324089237898634298778923472389687.123874);
insert into t_numeric values (-38764378634891278678324089237898634298778923472389687.123874);
insert /*+ ignore_error */ into t_tinyint select num from t_numeric;
WARNING:  value out of range
CONTEXT:  referenced column: num
WARNING:  tinyint out of range
CONTEXT:  referenced column: num
WARNING:  value out of range
CONTEXT:  referenced column: num
WARNING:  tinyint out of range
CONTEXT:  referenced column: num
select * from t_tinyint;
 num 
-----
 255
 0
(2 rows)

-- test for smallint
drop table if exists t;
create table t(num smallint);
insert into t values(100000);
ERROR:  smallint out of range
CONTEXT:  referenced column: num
insert into t values(-100000);
ERROR:  smallint out of range
CONTEXT:  referenced column: num
insert into t values(10000);
insert into t values(-10000);
insert /*+ ignore_error */ into t values(100000);
WARNING:  smallint out of range
CONTEXT:  referenced column: num
insert /*+ ignore_error */ into t values(-100000);
WARNING:  smallint out of range
CONTEXT:  referenced column: num
insert /*+ ignore_error */ into t values(10000);
insert /*+ ignore_error */ into t values(-10000);
select * from t;
  num   
--------
  10000
 -10000
  32767
 -32768
  10000
 -10000
(6 rows)

update /*+ ignore_error */ t set num = 1000000 where num = 10000;
WARNING:  smallint out of range
CONTEXT:  referenced column: num
select * from t;
  num   
--------
 -10000
  32767
 -32768
 -10000
  32767
  32767
(6 rows)

-- insert numeric table into smallint table
drop table if exists t_smallint;
NOTICE:  table "t_smallint" does not exist, skipping
drop table if exists t_numeric;
create table t_smallint(num smallint);
create table t_numeric(num numeric);
insert into t_numeric values (38764378634891278678324089237898634298778923472389687.123874);
insert into t_numeric values (-38764378634891278678324089237898634298778923472389687.123874);
insert /*+ ignore_error */ into t_smallint select num from t_numeric;
WARNING:  value out of range
CONTEXT:  referenced column: num
WARNING:  smallint out of range
CONTEXT:  referenced column: num
WARNING:  value out of range
CONTEXT:  referenced column: num
WARNING:  smallint out of range
CONTEXT:  referenced column: num
select * from t_smallint;
  num   
--------
  32767
 -32768
(2 rows)

-- test for int
drop table if exists t;
create table t(num int);
insert into t values(10000000000);
ERROR:  integer out of range
CONTEXT:  referenced column: num
insert into t values(-10000000000);
ERROR:  integer out of range
CONTEXT:  referenced column: num
insert into t values(1000000);
insert into t values(-1000000);
insert /*+ ignore_error */ into t values(10000000000);
WARNING:  integer out of range
CONTEXT:  referenced column: num
insert /*+ ignore_error */ into t values(-10000000000);
WARNING:  integer out of range
CONTEXT:  referenced column: num
insert /*+ ignore_error */ into t values(1000000);
insert /*+ ignore_error */ into t values(-1000000);
select * from t;
     num     
-------------
     1000000
    -1000000
  2147483647
 -2147483648
     1000000
    -1000000
(6 rows)

update /*+ ignore_error */ t set num = 99999999999999999999 where num = 1000000;
WARNING:  value out of range
CONTEXT:  referenced column: num
WARNING:  integer out of range
CONTEXT:  referenced column: num
select * from t;
     num     
-------------
    -1000000
  2147483647
 -2147483648
    -1000000
  2147483647
  2147483647
(6 rows)

-- insert numeric table into int table
drop table if exists t_int;
NOTICE:  table "t_int" does not exist, skipping
drop table if exists t_numeric;
create table t_int(num int);
create table t_numeric(num numeric);
insert into t_numeric values (38764378634891278678324089237898634298778923472389687.123874);
insert into t_numeric values (-38764378634891278678324089237898634298778923472389687.123874);
insert /*+ ignore_error */ into t_int select num from t_numeric;
WARNING:  value out of range
CONTEXT:  referenced column: num
WARNING:  integer out of range
CONTEXT:  referenced column: num
WARNING:  value out of range
CONTEXT:  referenced column: num
WARNING:  integer out of range
CONTEXT:  referenced column: num
select * from t_int;
     num     
-------------
  2147483647
 -2147483648
(2 rows)

-- test for bigint
drop table if exists t;
create table t(num bigint);
insert into t values(847329847839274398574389574398579834759384504385094386073456058984);
ERROR:  bigint out of range
CONTEXT:  referenced column: num
insert into t values(-439058439498375898437567893745893275984375984375984375984345498759438);
ERROR:  bigint out of range
CONTEXT:  referenced column: num
insert into t values(10000000::numeric);
insert into t values(-10000000::numeric);
insert /*+ ignore_error */ into t values(847329847839274398574389574398579834759384504385094386073456058984);
WARNING:  value out of range
CONTEXT:  referenced column: num
insert /*+ ignore_error */ into t values(-439058439498375898437567893745893275984375984375984375984345498759438);
WARNING:  value out of range
CONTEXT:  referenced column: num
insert /*+ ignore_error */ into t values(10000000::numeric);
insert /*+ ignore_error */ into t values(-10000000::numeric);
select * from t;
         num          
----------------------
             10000000
            -10000000
  9223372036854775807
 -9223372036854775808
             10000000
            -10000000
(6 rows)

update /*+ ignore_error */ t set num = 99999999999999999999999999999999999999999999999999999999999999999999999999 where num = 10000000;
WARNING:  value out of range
CONTEXT:  referenced column: num
select * from t;
         num          
----------------------
            -10000000
  9223372036854775807
 -9223372036854775808
            -10000000
  9223372036854775807
  9223372036854775807
(6 rows)

-- insert numeric table into bigint table
drop table if exists t_bigint;
NOTICE:  table "t_bigint" does not exist, skipping
drop table if exists t_numeric;
create table t_bigint(num bigint);
create table t_numeric(num numeric);
insert into t_numeric values (38764378634891278678324089237898634298778923472389687.123874);
insert into t_numeric values (-38764378634891278678324089237898634298778923472389687.123874);
insert /*+ ignore_error */ into t_bigint select num from t_numeric;
WARNING:  value out of range
CONTEXT:  referenced column: num
WARNING:  value out of range
CONTEXT:  referenced column: num
select * from t_bigint;
         num          
----------------------
  9223372036854775807
 -9223372036854775808
(2 rows)

-- insert int table into tinyint table
drop table if exists t_int;
drop table if exists t_tinyint;
create table t_int(num int);
create table t_tinyint(num tinyint);
insert into t_int values(10000);
insert into t_int values(-10000);
insert /*+ ignore_error */ into t_tinyint select num from t_int;
WARNING:  tinyint out of range
CONTEXT:  referenced column: num
WARNING:  tinyint out of range
CONTEXT:  referenced column: num
select * from t_tinyint;
 num 
-----
 255
 0
(2 rows)

-- insert int table into smallint table
drop table if exists t_int;
drop table if exists t_smallint;
create table t_int(num int);
create table t_smallint(num smallint);
insert into t_int values(1000000);
insert into t_int values(-1000000);
insert /*+ ignore_error */ into t_smallint select num from t_int;
WARNING:  smallint out of range
CONTEXT:  referenced column: num
WARNING:  smallint out of range
CONTEXT:  referenced column: num
select * from t_smallint;
  num   
--------
  32767
 -32768
(2 rows)

-- test for float4 to tinyint
drop table if exists t_tinyint;
create table t_tinyint(num tinyint);
insert into t_tinyint values (10000.023::float4);
ERROR:  tinyint out of range
CONTEXT:  referenced column: num
insert into t_tinyint values (-10000.023::float4);
ERROR:  tinyint out of range
CONTEXT:  referenced column: num
insert into t_tinyint values (123.023::float4);
insert into t_tinyint values (-123.023::float4);
ERROR:  tinyint out of range
CONTEXT:  referenced column: num
insert /*+ ignore_error */ into t_tinyint values (10000.023::float4);
WARNING:  tinyint out of range
CONTEXT:  referenced column: num
insert /*+ ignore_error */ into t_tinyint values (-10000.023::float4);
WARNING:  tinyint out of range
CONTEXT:  referenced column: num
insert /*+ ignore_error */ into t_tinyint values (123.023::float4);
insert /*+ ignore_error */ into t_tinyint values (-123.023::float4);
WARNING:  tinyint out of range
CONTEXT:  referenced column: num
select * from t_tinyint;
 num 
-----
 123
 255
 0
 123
 0
(5 rows)

-- test for float4 to smallint
drop table if exists t_smallint;
create table t_smallint(num smallint);
insert into t_smallint values (1000000.023::float4);
ERROR:  smallint out of range
CONTEXT:  referenced column: num
insert into t_smallint values (-1000000.023::float4);
ERROR:  smallint out of range
CONTEXT:  referenced column: num
insert into t_smallint values (10000.023::float4);
insert into t_smallint values (-10000.023::float4);
insert /*+ ignore_error */ into t_smallint values (1000000.023::float4);
WARNING:  smallint out of range
CONTEXT:  referenced column: num
insert /*+ ignore_error */ into t_smallint values (-1000000.023::float4);
WARNING:  smallint out of range
CONTEXT:  referenced column: num
insert /*+ ignore_error */ into t_smallint values (10000.023::float4);
insert /*+ ignore_error */ into t_smallint values (-10000.023::float4);
select * from t_smallint;
  num   
--------
  10000
 -10000
  32767
 -32768
  10000
 -10000
(6 rows)

-- test for float4 to int
drop table if exists t_int;
create table t_int(num int);
insert into t_int values (72348787598743985743895.023::float4);
ERROR:  integer out of range
CONTEXT:  referenced column: num
insert into t_int values (-72348787598743985743895.023::float4);
ERROR:  integer out of range
CONTEXT:  referenced column: num
insert into t_int values (123123.023::float4);
insert into t_int values (-123123.023::float4);
insert /*+ ignore_error */ into t_int values (72348787598743985743895.023::float4);
WARNING:  integer out of range
CONTEXT:  referenced column: num
insert /*+ ignore_error */ into t_int values (-72348787598743985743895.023::float4);
WARNING:  integer out of range
CONTEXT:  referenced column: num
insert /*+ ignore_error */ into t_int values (123123.023::float4);
insert /*+ ignore_error */ into t_int values (-123123.023::float4);
select * from t_int;
     num     
-------------
      123123
     -123123
  2147483647
 -2147483648
      123123
     -123123
(6 rows)

-- test for float4 to bigint
drop table if exists t_bigint;
create table t_bigint(num bigint);
insert into t_bigint values (238947289573489758943455436587549686.023::float4);
ERROR:  bigint out of range
CONTEXT:  referenced column: num
insert into t_bigint values (-238947289573489758943455436587549686.023::float4);
ERROR:  bigint out of range
CONTEXT:  referenced column: num
insert into t_bigint values (100000.023::float4);
insert into t_bigint values (-100000.023::float4);
insert /*+ ignore_error */ into t_bigint values (238947289573489758943455436587549686.023::float4);
WARNING:  bigint out of range
CONTEXT:  referenced column: num
insert /*+ ignore_error */ into t_bigint values (-238947289573489758943455436587549686.023::float4);
WARNING:  bigint out of range
CONTEXT:  referenced column: num
insert /*+ ignore_error */ into t_bigint values (100000.023::float4);
insert /*+ ignore_error */ into t_bigint values (-100000.023::float4);
select * from t_bigint;
         num          
----------------------
               100000
              -100000
  9223372036854775807
 -9223372036854775808
               100000
              -100000
(6 rows)

-- test for float8 to tinyint
drop table if exists t_tinyint;
create table t_tinyint(num tinyint);
insert into t_tinyint values (238947289573489758943455436587549686.023::float8);
ERROR:  tinyint out of range
CONTEXT:  referenced column: num
insert into t_tinyint values (-238947289573489758943455436587549686.023::float8);
ERROR:  tinyint out of range
CONTEXT:  referenced column: num
insert into t_tinyint values (100.123::float8);
insert into t_tinyint values (-100.123::float8);
ERROR:  tinyint out of range
CONTEXT:  referenced column: num
insert /*+ ignore_error */ into t_tinyint values (238947289573489758943455436587549686.023::float8);
WARNING:  tinyint out of range
CONTEXT:  referenced column: num
insert /*+ ignore_error */ into t_tinyint values (-238947289573489758943455436587549686.023::float8);
WARNING:  tinyint out of range
CONTEXT:  referenced column: num
insert /*+ ignore_error */ into t_tinyint values (100.123::float8);
insert /*+ ignore_error */ into t_tinyint values (-100.123::float8);
WARNING:  tinyint out of range
CONTEXT:  referenced column: num
select * from t_tinyint;
 num 
-----
 100
 255
 0
 100
 0
(5 rows)

-- test for float8 to smallint
drop table if exists t_smallint;
create table t_smallint(num smallint);
insert into t_smallint values (238947289573489758943455436587549686.023::float8);
ERROR:  smallint out of range
CONTEXT:  referenced column: num
insert into t_smallint values (-238947289573489758943455436587549686.023::float8);
ERROR:  smallint out of range
CONTEXT:  referenced column: num
insert into t_smallint values (100.023::float8);
insert into t_smallint values (-100.023::float8);
insert /*+ ignore_error */ into t_smallint values (238947289573489758943455436587549686.023::float8);
WARNING:  smallint out of range
CONTEXT:  referenced column: num
insert /*+ ignore_error */ into t_smallint values (-238947289573489758943455436587549686.023::float8);
WARNING:  smallint out of range
CONTEXT:  referenced column: num
insert /*+ ignore_error */ into t_smallint values (100.023::float8);
insert /*+ ignore_error */ into t_smallint values (-100.023::float8);
select * from t_smallint;
  num   
--------
    100
   -100
  32767
 -32768
    100
   -100
(6 rows)

-- test for float8 to int
drop table if exists t_int;
create table t_int(num int);
insert into t_int values (23894728957345798437986755479865476509486804965449876953489758943455436587549686.023::float8);
ERROR:  integer out of range
CONTEXT:  referenced column: num
insert into t_int values (-23894728957345798437986755479865476509486804965449876953489758943455436587549686.023::float8);
ERROR:  integer out of range
CONTEXT:  referenced column: num
insert into t_int values (123.023::float8);
insert into t_int values (-123.023::float8);
insert /*+ ignore_error */ into t_int values (23894728957345798437986755479865476509486804965449876953489758943455436587549686.023::float8);
WARNING:  integer out of range
CONTEXT:  referenced column: num
insert /*+ ignore_error */ into t_int values (-23894728957345798437986755479865476509486804965449876953489758943455436587549686.023::float8);
WARNING:  integer out of range
CONTEXT:  referenced column: num
insert /*+ ignore_error */ into t_int values (123.023::float8);
insert /*+ ignore_error */ into t_int values (-123.023::float8);
select * from t_int;
     num     
-------------
         123
        -123
  2147483647
 -2147483648
         123
        -123
(6 rows)

-- test for float8 to bigint
drop table if exists t_bigint;
create table t_bigint(num bigint);
insert into t_bigint values (238947289573457984379867554798658438574983768504985454690874578759765898798798709854353476509486804965449876953489758943455436587549686.023::float8);
ERROR:  bigint out of range
CONTEXT:  referenced column: num
insert into t_bigint values (-238947289573457984379867554798658438574983768504985454690874578759765898798798709854353476509486804965449876953489758943455436587549686.023::float8);
ERROR:  bigint out of range
CONTEXT:  referenced column: num
insert into t_bigint values (123.123::float8);
insert into t_bigint values (-123.123::float8);
insert /*+ ignore_error */ into t_bigint values (238947289573457984379867554798658438574983768504985454690874578759765898798798709854353476509486804965449876953489758943455436587549686.023::float8);
WARNING:  bigint out of range
CONTEXT:  referenced column: num
insert /*+ ignore_error */ into t_bigint values (-238947289573457984379867554798658438574983768504985454690874578759765898798798709854353476509486804965449876953489758943455436587549686.023::float8);
WARNING:  bigint out of range
CONTEXT:  referenced column: num
insert /*+ ignore_error */ into t_bigint values (123.123::float8);
insert /*+ ignore_error */ into t_bigint values (-123.123::float8);
select * from t_bigint;
         num          
----------------------
                  123
                 -123
  9223372036854775807
 -9223372036854775808
                  123
                 -123
(6 rows)

-- test for float8 to float4
drop table if exists t_float4;
NOTICE:  table "t_float4" does not exist, skipping
create table t_float4(num float4);
insert into t_float4 values (1892038097432987589432759843769348605436304758493758943758943758943759843756983760945860948605948765487689547893475893475918920380974329875894327598437693486054363047584937589437589437589437598437569837609458609486059487654876895478934758934759627346378267863475863875648365843734895749837589437589473988.18920380974329875894327598437693486054363047584937589437589437589437598437569837609458609486059487654876895478934758934759189203809743298758943275984376934860543630475849375894375894375894375984375698376094586094860594876548768954789347589347593874894375984::float8);
ERROR:  value out of range: overflow
CONTEXT:  referenced column: num
insert into t_float4 values (-1892038097432987589432759843769348605436304758493758943758943758943759843756983760945860948605948765487689547893475893475918920380974329875894327598437693486054363047584937589437589437589437598437569837609458609486059487654876895478934758934759627346378267863475863875648365843734895749837589437589473988.18920380974329875894327598437693486054363047584937589437589437589437598437569837609458609486059487654876895478934758934759189203809743298758943275984376934860543630475849375894375894375894375984375698376094586094860594876548768954789347589347593874894375984::float8);
ERROR:  value out of range: overflow
CONTEXT:  referenced column: num
insert into t_float4 values(123.123::float8);
insert into t_float4 values(-123.123::float8);
insert /*+ ignore_error */ into t_float4 values (1892038097432987589432759843769348605436304758493758943758943758943759843756983760945860948605948765487689547893475893475918920380974329875894327598437693486054363047584937589437589437589437598437569837609458609486059487654876895478934758934759627346378267863475863875648365843734895749837589437589473988.18920380974329875894327598437693486054363047584937589437589437589437598437569837609458609486059487654876895478934758934759189203809743298758943275984376934860543630475849375894375894375894375984375698376094586094860594876548768954789347589347593874894375984::float8);
WARNING:  value out of range: overflow
CONTEXT:  referenced column: num
insert /*+ ignore_error */ into t_float4 values (-1892038097432987589432759843769348605436304758493758943758943758943759843756983760945860948605948765487689547893475893475918920380974329875894327598437693486054363047584937589437589437589437598437569837609458609486059487654876895478934758934759627346378267863475863875648365843734895749837589437589473988.18920380974329875894327598437693486054363047584937589437589437589437598437569837609458609486059487654876895478934758934759189203809743298758943275984376934860543630475849375894375894375894375984375698376094586094860594876548768954789347589347593874894375984::float8);
WARNING:  value out of range: overflow
CONTEXT:  referenced column: num
insert /*+ ignore_error */ into t_float4 values(123.123::float8);
insert /*+ ignore_error */ into t_float4 values(-123.123::float8);
select * from t_float4;
     num      
--------------
      123.123
     -123.123
  3.40282e+38
 -3.40282e+38
      123.123
     -123.123
(6 rows)

-- test for numeric to float4
drop table if exists t_numeric;
drop table if exists t_float4;
create table t_numeric(num numeric);
create table t_float4(num float4);
insert into t_numeric values(1892038097432987589432759843769348605436304758493758943758943758943759843756983760945860948605948765487689547893475893475918920380974329875894327598437693486054363047584937589437589437589437598437569837609458609486059487654876895478934758934759627346378267863475863875648365843734895749837589437589473988.18920380974329875894327598437693486054363047584937589437589437589437598437569837609458609486059487654876895478934758934759189203809743298758943275984376934860543630475849375894375894375894375984375698376094586094860594876548768954789347589347593874894375984);
insert into t_numeric values(-1892038097432987589432759843769348605436304758493758943758943758943759843756983760945860948605948765487689547893475893475918920380974329875894327598437693486054363047584937589437589437589437598437569837609458609486059487654876895478934758934759627346378267863475863875648365843734895749837589437589473988.18920380974329875894327598437693486054363047584937589437589437589437598437569837609458609486059487654876895478934758934759189203809743298758943275984376934860543630475849375894375894375894375984375698376094586094860594876548768954789347589347593874894375984);
insert /*+ ignore_error */ into t_float4 select num from t_numeric;
WARNING:  value out of range: overflow
CONTEXT:  referenced column: num
WARNING:  value out of range: overflow
CONTEXT:  referenced column: num
select * from t_float4;
     num      
--------------
  3.40282e+38
 -3.40282e+38
(2 rows)

-- test for char(n) converting
drop table if exists t_char;
NOTICE:  table "t_char" does not exist, skipping
drop table if exists t_text;
NOTICE:  table "t_text" does not exist, skipping
create table t_char(cont char(6));
create table t_text(cont text);
insert into t_text values('abcdef');
insert into t_text values('abcdefghj');
insert into t_text values(123456789123456789);
insert /*+ ignore_error */ into t_char select cont from t_text;
WARNING:  value too long for type character(6)
CONTEXT:  referenced column: cont
WARNING:  value too long for type character(6)
CONTEXT:  referenced column: cont
select * from t_char;
  cont  
--------
 abcdef
 abcdef
 123456
(3 rows)

-- test for varchar(n) converting
drop table if exists t_varchar;
NOTICE:  table "t_varchar" does not exist, skipping
drop table if exists t_text;
create table t_varchar(cont varchar(6));
create table t_text(cont text);
insert into t_text values('abcdef');
insert into t_text values('abcdefghj');
insert into t_text values(123456789123456789);
insert /*+ ignore_error */ into t_varchar select cont from t_text;
WARNING:  value too long for type character varying(6)
CONTEXT:  referenced column: cont
WARNING:  value too long for type character varying(6)
CONTEXT:  referenced column: cont
select * from t_varchar;
  cont  
--------
 abcdef
 abcdef
 123456
(3 rows)

-- test for character(n) converting
drop table if exists t_character;
NOTICE:  table "t_character" does not exist, skipping
drop table if exists t_text;
create table t_character(cont character(6));
create table t_text(cont text);
insert into t_text values('abcdef');
insert into t_text values('abcdefghj');
insert into t_text values(123456789123456789);
insert /*+ ignore_error */ into t_character select cont from t_text;
WARNING:  value too long for type character(6)
CONTEXT:  referenced column: cont
WARNING:  value too long for type character(6)
CONTEXT:  referenced column: cont
select * from t_character;
  cont  
--------
 abcdef
 abcdef
 123456
(3 rows)

-- test for nchar(n) converting
drop table if exists t_nchar;
NOTICE:  table "t_nchar" does not exist, skipping
drop table if exists t_text;
create table t_nchar(cont nchar(6));
create table t_text(cont text);
insert into t_text values('abcdef');
insert into t_text values('abcdefghj');
insert into t_text values(123456789123456789);
insert /*+ ignore_error */ into t_nchar select cont from t_text;
WARNING:  value too long for type character(6)
CONTEXT:  referenced column: cont
WARNING:  value too long for type character(6)
CONTEXT:  referenced column: cont
select * from t_nchar;
  cont  
--------
 abcdef
 abcdef
 123456
(3 rows)

-- test for character converting
drop table if exists t_character;
drop table if exists t_text;
create table t_character(cont character);
create table t_text(cont text);
insert into t_text values('abcdef');
insert into t_text values('abcdefghj');
insert into t_text values(123456789123456789);
insert /*+ ignore_error */ into t_character select cont from t_text;
WARNING:  value too long for type character(1)
CONTEXT:  referenced column: cont
WARNING:  value too long for type character(1)
CONTEXT:  referenced column: cont
WARNING:  value too long for type character(1)
CONTEXT:  referenced column: cont
select * from t_character;
 cont 
------
 a
 a
 1
(3 rows)

-- test for varchar2(n) converting
drop table if exists t_varchar2;
NOTICE:  table "t_varchar2" does not exist, skipping
drop table if exists t_text;
create table t_varchar2(cont varchar2(6));
create table t_text(cont text);
insert into t_text values('abcdef');
insert into t_text values('abcdefghj');
insert into t_text values(123456789123456789);
insert /*+ ignore_error */ into t_varchar2 select cont from t_text;
WARNING:  value too long for type character varying(6)
CONTEXT:  referenced column: cont
WARNING:  value too long for type character varying(6)
CONTEXT:  referenced column: cont
select * from t_varchar2;
  cont  
--------
 abcdef
 abcdef
 123456
(3 rows)

-- test for nvarchar2(n) converting
drop table if exists t_nvarchar2;
NOTICE:  table "t_nvarchar2" does not exist, skipping
drop table if exists t_text;
create table t_nvarchar2(cont nvarchar2(6));
create table t_text(cont text);
insert into t_text values('abcdef');
insert into t_text values('abcdefghj');
insert into t_text values(123456789123456789);
insert /*+ ignore_error */ into t_nvarchar2 select cont from t_text;
WARNING:  value too long for type nvarchar2(6)
CONTEXT:  referenced column: cont
WARNING:  value too long for type nvarchar2(6)
CONTEXT:  referenced column: cont
select * from t_nvarchar2;
  cont  
--------
 abcdef
 abcdef
 123456
(3 rows)

-- test for nvarchar2 converting
drop table if exists t_nvarchar2;
drop table if exists t_text;
create table t_nvarchar2(cont nvarchar2);
create table t_text(cont text);
insert into t_text values('abcdef');
insert into t_text values('abcdefghj');
insert into t_text values(123456789123456789);
insert /*+ ignore_error */ into t_nvarchar2 select cont from t_text;
select * from t_nvarchar2;
        cont        
--------------------
 abcdef
 abcdefghj
 123456789123456789
(3 rows)

-- test for integer-string-mixed value in
drop table if exists t_int;
create table t_int(num int);
insert /*+ ignore_error */ into t_int values('12a34');
select * from t_int;
 num 
-----
  12
(1 row)

-- test for inconvertible type transform.
drop table if exists t_int;
create table t_int(num int);
insert /*+ ignore_error */ into t_int values('2011-8-2'::timestamp);
WARNING:  column "num" is of type integer but expression is of type timestamp without time zone. Data truncated automatically.
CONTEXT:  referenced column: num
select * from t_int;
 num 
-----
   0
(1 row)

delete from t_int;
drop table if exists t_timestamp;
NOTICE:  table "t_timestamp" does not exist, skipping
create table t_timestamp(val timestamp);
insert into t_timestamp values('2011-8-2');
insert /*+ ignore_error */ into t_int select val from t_timestamp;
WARNING:  column "num" is of type integer but expression is of type timestamp without time zone. Data truncated automatically.
CONTEXT:  referenced column: num
select * from t_int;
 num 
-----
   0
(1 row)

delete from t_int;
insert into t_int values(999);
update /*+ ignore_error */ t_int set num = '2011-8-2'::timestamp;
WARNING:  column "num" is of type integer but expression is of type timestamp without time zone. Data truncated automatically.
CONTEXT:  referenced column: num
select * from t_int;
 num 
-----
   0
(1 row)

drop table if exists t_multi;
NOTICE:  table "t_multi" does not exist, skipping
create table t_multi(c1 int unique, c2 int);
NOTICE:  CREATE TABLE / UNIQUE will create implicit index "t_multi_c1_key" for table "t_multi"
insert /*+ ignore_error */ into t_multi values('2011-8-2'::timestamp, 1);
WARNING:  column "c1" is of type integer but expression is of type timestamp without time zone. Data truncated automatically.
CONTEXT:  referenced column: c1
insert /*+ ignore_error */ into t_multi values(0, 0) on duplicate key update c2 = 2;
select * from t_multi;
 c1 | c2 
----+----
  0 |  2
(1 row)

insert /*+ ignore_error */ into t_multi values('2011-8-2'::timestamp , 3) on duplicate key update c2 = 3;
WARNING:  column "c1" is of type integer but expression is of type timestamp without time zone. Data truncated automatically.
CONTEXT:  referenced column: c1
select * from t_multi;
 c1 | c2 
----+----
  0 |  3
(1 row)

drop table if exists t_float8;
NOTICE:  table "t_float8" does not exist, skipping
create table t_float8(num float8);
insert /*+ ignore_error */ into t_float8 values('2011-8-2'::timestamp);
WARNING:  column "num" is of type double precision but expression is of type timestamp without time zone. Data truncated automatically.
CONTEXT:  referenced column: num
select * from t_float8;
 num 
-----
   0
(1 row)

delete from t_float8;
insert into t_float8 values(123.999);
update /*+ ignore_error */ t_float8 set num = '2011-8-2'::timestamp;
WARNING:  column "num" is of type double precision but expression is of type timestamp without time zone. Data truncated automatically.
CONTEXT:  referenced column: num
select * from t_float8;
 num 
-----
   0
(1 row)

drop table if exists t_uuid;
NOTICE:  table "t_uuid" does not exist, skipping
create table t_uuid(val uuid);
insert /*+ ignore_error */ into t_uuid values(0);
WARNING:  column "val" is of type uuid but expression is of type integer. Data truncated automatically.
CONTEXT:  referenced column: val
select * from t_uuid;
                 val                  
--------------------------------------
 00000000-0000-0000-0000-000000000000
(1 row)

drop table if exists t_date;
NOTICE:  table "t_date" does not exist, skipping
create table t_date(val date);
insert /*+ ignore_error */ into t_date values(0);
WARNING:  column "val" is of type date but expression is of type integer. Data truncated automatically.
CONTEXT:  referenced column: val
select * from t_date;
    val     
------------
 01-01-1970
(1 row)

delete from t_date;
insert into t_date values('2011-8-2');
update /*+ ignore_error */ t_date set val = 0;
WARNING:  column "val" is of type date but expression is of type integer. Data truncated automatically.
CONTEXT:  referenced column: val
select * from t_date;
    val     
------------
 01-01-1970
(1 row)

\c postgres
drop database if exists sql_ignore_type_transform_test;
