create database sql_ignore_unique_test dbcompatibility 'B';
\c sql_ignore_unique_test;
drop table if exists t_ignore;
NOTICE:  table "t_ignore" does not exist, skipping
create table t_ignore(col1 int, col2 int unique, col3 int unique);
NOTICE:  CREATE TABLE / UNIQUE will create implicit index "t_ignore_col2_key" for table "t_ignore"
NOTICE:  CREATE TABLE / UNIQUE will create implicit index "t_ignore_col3_key" for table "t_ignore"
-- sqlbypass
set enable_opfusion = on;
insert into t_ignore values(1,1,1);
insert into t_ignore values(2,2,2);
update t_ignore set col2 = 1 where col1 = 2;
ERROR:  duplicate key value violates unique constraint "t_ignore_col2_key"
DETAIL:  Key (col2)=(1) already exists.
insert /*+ ignore_error */ into t_ignore values (2,1,2);
WARNING:  duplicate key value violates unique constraint in table "t_ignore"
select * from t_ignore;
 col1 | col2 | col3 
------+------+------
    1 |    1 |    1
    2 |    2 |    2
(2 rows)

update /*+ ignore_error */ t_ignore set col2 = 1 where col1 = 2;
WARNING:  duplicate key value violates unique constraint in table "t_ignore"
select * from t_ignore;
 col1 | col2 | col3 
------+------+------
    1 |    1 |    1
    2 |    2 |    2
(2 rows)

-- insert ignore from other tables with duplicate keys
create table t_from (col1 int, col2 int, col3 int);
insert into t_from values(9,9,9);
insert into t_from values(1,1,1);
insert into t_from values(2,2,2);
insert into t_ignore select * from t_from;
ERROR:  duplicate key value violates unique constraint "t_ignore_col2_key"
DETAIL:  Key (col2)=(1) already exists.
select * from t_ignore;
 col1 | col2 | col3 
------+------+------
    1 |    1 |    1
    2 |    2 |    2
(2 rows)

-- no sqlbypass
set enable_opfusion = off;
insert into t_ignore values(2,1,2);
ERROR:  duplicate key value violates unique constraint "t_ignore_col2_key"
DETAIL:  Key (col2)=(1) already exists.
update t_ignore set col2 = 1 where col1 = 2;
ERROR:  duplicate key value violates unique constraint "t_ignore_col2_key"
DETAIL:  Key (col2)=(1) already exists.
insert /*+ ignore_error */ into t_ignore values(2,1,2);
WARNING:  duplicate key value violates unique constraint in table "t_ignore"
update /*+ ignore_error */ t_ignore set col2 = 1 where col1 = 2;
WARNING:  duplicate key value violates unique constraint in table "t_ignore"
select * from t_ignore;
 col1 | col2 | col3 
------+------+------
    1 |    1 |    1
    2 |    2 |    2
(2 rows)

-- insert ignore from other tables with duplicate keys
insert into t_ignore select * from t_from;
ERROR:  duplicate key value violates unique constraint "t_ignore_col2_key"
DETAIL:  Key (col2)=(1) already exists.
select * from t_ignore;
 col1 | col2 | col3 
------+------+------
    1 |    1 |    1
    2 |    2 |    2
(2 rows)

drop table t_ignore;
set enable_opfusion = on;
drop table t_from;
-- test for integrity of UPSERT
drop table if exists t_unique_upsert;
NOTICE:  table "t_unique_upsert" does not exist, skipping
create table t_unique_upsert(id int unique, cont text);
NOTICE:  CREATE TABLE / UNIQUE will create implicit index "t_unique_upsert_id_key" for table "t_unique_upsert"
set enable_opfusion = on;
insert into t_unique_upsert values(1, 'a');
insert into t_unique_upsert values(2, 'b');
insert /*+ ignore_error */ into t_unique_upsert values(1, 'x') on duplicate key update cont = 'on dup';
select * from t_unique_upsert;
 id |  cont  
----+--------
  2 | b
  1 | on dup
(2 rows)

delete from t_unique_upsert;
set enable_opfusion = off;
insert into t_unique_upsert values(1, 'a');
insert into t_unique_upsert values(2, 'b');
insert /*+ ignore_error */ into t_unique_upsert values(1, 'x') on duplicate key update cont = 'on dup';
select * from t_unique_upsert;
 id |  cont  
----+--------
  2 | b
  1 | on dup
(2 rows)

-- test for partition table with unique key
-- opfusion: on
set enable_opfusion = on;
set enable_partition_opfusion = on;
drop table if exists t_unique_key_partition;
NOTICE:  table "t_unique_key_partition" does not exist, skipping
CREATE TABLE t_unique_key_partition
(
    num     integer UNIQUE NOT NULL,
    ca_city character varying(60)
) PARTITION BY RANGE (num)
(
    PARTITION P1 VALUES LESS THAN(5000),
    PARTITION P2 VALUES LESS THAN(10000),
    PARTITION P3 VALUES LESS THAN(15000),
    PARTITION P4 VALUES LESS THAN(20000),
    PARTITION P5 VALUES LESS THAN(25000),
    PARTITION P6 VALUES LESS THAN(30000),
    PARTITION P7 VALUES LESS THAN(40000)
);
NOTICE:  CREATE TABLE / UNIQUE will create implicit index "t_unique_key_partition_num_key" for table "t_unique_key_partition"
insert into t_unique_key_partition values(1, 'shenzhen');
insert into t_unique_key_partition values(2, 'beijing');
select * from t_unique_key_partition;
 num | ca_city  
-----+----------
   1 | shenzhen
   2 | beijing
(2 rows)

explain(costs off) insert /*+ ignore_error */ into  t_unique_key_partition values (1);
            QUERY PLAN            
----------------------------------
 [Bypass]
 Insert on t_unique_key_partition
   ->  Result
(3 rows)

insert /*+ ignore_error */ into  t_unique_key_partition values (1);
WARNING:  duplicate key value violates unique constraint in table "t_unique_key_partition"
select * from t_unique_key_partition;
 num | ca_city  
-----+----------
   1 | shenzhen
   2 | beijing
(2 rows)

update /*+ ignore_error */ t_unique_key_partition set num = 1 where num = 2;
WARNING:  duplicate key value violates unique constraint in table "t_unique_key_partition"
select * from t_unique_key_partition;
 num | ca_city  
-----+----------
   1 | shenzhen
   2 | beijing
(2 rows)

-- opfusion: off
set enable_opfusion = off;
set enable_partition_opfusion = off;
explain(costs off) insert /*+ ignore_error */ into  t_unique_key_partition values (1);
            QUERY PLAN            
----------------------------------
 Insert on t_unique_key_partition
   ->  Result
(2 rows)

insert /*+ ignore_error */ into  t_unique_key_partition values (1);
WARNING:  duplicate key value violates unique constraint in table "t_unique_key_partition"
select * from t_unique_key_partition;
 num | ca_city  
-----+----------
   1 | shenzhen
   2 | beijing
(2 rows)

update /*+ ignore_error */ t_unique_key_partition set num = 1 where num = 2;
WARNING:  duplicate key value violates unique constraint in table "t_unique_key_partition"
select * from t_unique_key_partition;
 num | ca_city  
-----+----------
   1 | shenzhen
   2 | beijing
(2 rows)

-- test for subpartition table
drop table if exists ignore_range_range;
NOTICE:  table "ignore_range_range" does not exist, skipping
CREATE TABLE ignore_range_range
(
    month_code VARCHAR2 ( 30 ) NOT NULL ,
    dept_code  VARCHAR2 ( 30 ) UNIQUE ,
    user_no    VARCHAR2 ( 30 ) NOT NULL ,
    sales_amt  int
)
    PARTITION BY RANGE (month_code) SUBPARTITION BY RANGE (dept_code)
(
  PARTITION p_201901 VALUES LESS THAN( '201901' )
  (
    SUBPARTITION p_201901_a VALUES LESS THAN( '2' ),
    SUBPARTITION p_201901_b VALUES LESS THAN( '3' )
  ),
  PARTITION p_201902 VALUES LESS THAN( '201902' )
  (
    SUBPARTITION p_201902_a VALUES LESS THAN( '2' ),
    SUBPARTITION p_201902_b VALUES LESS THAN( '3' )
  )
);
NOTICE:  CREATE TABLE / UNIQUE will create implicit index "ignore_range_range_dept_code_tableoid_key" for table "ignore_range_range"
set enable_opfusion = on;
set enable_partition_opfusion = on;
insert /*+ ignore_error */ into ignore_range_range values('201901', '1', '1', 1);
insert /*+ ignore_error */  into ignore_range_range values('201901', '1', '1', 1);
WARNING:  duplicate key value violates unique constraint in table "ignore_range_range"
select * from ignore_range_range;
 month_code | dept_code | user_no | sales_amt 
------------+-----------+---------+-----------
 201901     | 1         | 1       |         1
(1 row)

insert into ignore_range_range values('201901', '2', '1', 1);
update /*+ ignore_error */ ignore_range_range set dept_code = '1' where dept_code = '2';
WARNING:  duplicate key value violates unique constraint in table "ignore_range_range"
select * from ignore_range_range;
 month_code | dept_code | user_no | sales_amt 
------------+-----------+---------+-----------
 201901     | 1         | 1       |         1
 201901     | 2         | 1       |         1
(2 rows)

delete from ignore_range_range;
set enable_opfusion = off;
set enable_partition_opfusion = off;
insert /*+ ignore_error */  into ignore_range_range values('201901', '1', '1', 1);
insert /*+ ignore_error */  into ignore_range_range values('201901', '1', '1', 1);
WARNING:  duplicate key value violates unique constraint in table "ignore_range_range"
select * from ignore_range_range;
 month_code | dept_code | user_no | sales_amt 
------------+-----------+---------+-----------
 201901     | 1         | 1       |         1
(1 row)

insert into ignore_range_range values('201901', '2', '1', 1);
update /*+ ignore_error */ ignore_range_range set dept_code = '1' where dept_code = '2';
WARNING:  duplicate key value violates unique constraint in table "ignore_range_range"
select * from ignore_range_range;
 month_code | dept_code | user_no | sales_amt 
------------+-----------+---------+-----------
 201901     | 1         | 1       |         1
 201901     | 2         | 1       |         1
(2 rows)

-- test for ustore table
drop table if exists t_ignore;
NOTICE:  table "t_ignore" does not exist, skipping
create table t_ignore(num int unique) with(storage_type=ustore);
NOTICE:  CREATE TABLE / UNIQUE will create implicit index "t_ignore_num_key" for table "t_ignore"
-- test for ustore table, opfusion: on
set enable_opfusion = on;
insert into t_ignore values(1);
explain(costs off) insert /*+ ignore_error */ into t_ignore values(1);
     QUERY PLAN     
--------------------
 [Bypass]
 Insert on t_ignore
   ->  Result
(3 rows)

select * from t_ignore;
 num 
-----
   1
(1 row)

insert into t_ignore values(2);
update /*+ ignore_error */ t_ignore set num = 1 where num = 2;
WARNING:  duplicate key value violates unique constraint in table "t_ignore"
select * from t_ignore;
 num 
-----
   1
   2
(2 rows)

-- test for ustore table, opfusion: off
set enable_opfusion = off;
delete from t_ignore;
insert into t_ignore values(1);
explain(costs off) insert /*+ ignore_error */ into t_ignore values(1);
     QUERY PLAN     
--------------------
 Insert on t_ignore
   ->  Result
(2 rows)

insert /*+ ignore_error */ into t_ignore values(1);
WARNING:  duplicate key value violates unique constraint in table "t_ignore"
select * from t_ignore;
 num 
-----
   1
(1 row)

insert into t_ignore values(2);
update /*+ ignore_error */ t_ignore set num = 1 where num = 2;
WARNING:  duplicate key value violates unique constraint in table "t_ignore"
select * from t_ignore;
 num 
-----
   1
   2
(2 rows)

-- test for segment table
drop table if exists t_ignore;
create table t_ignore(num int unique) with(segment = on);
NOTICE:  CREATE TABLE / UNIQUE will create implicit index "t_ignore_num_key" for table "t_ignore"
-- test for segment table, opfusion: on
set enable_opfusion = on;
insert into t_ignore values(1);
insert /*+ ignore_error */ into t_ignore values(1);
WARNING:  duplicate key value violates unique constraint in table "t_ignore"
select * from t_ignore;
 num 
-----
   1
(1 row)

insert into t_ignore values(2);
update /*+ ignore_error */ t_ignore set num = 1 where num = 2;
WARNING:  duplicate key value violates unique constraint in table "t_ignore"
select * from t_ignore;
 num 
-----
   1
   2
(2 rows)

-- test for segment table, opfusion: off
delete from t_ignore;
set enable_opfusion = off;
insert into t_ignore values(1);
insert /*+ ignore_error */ into t_ignore values(1);
WARNING:  duplicate key value violates unique constraint in table "t_ignore"
select * from t_ignore;
 num 
-----
   1
(1 row)

insert into t_ignore values(2);
update /*+ ignore_error */ t_ignore set num = 1 where num = 2;
WARNING:  duplicate key value violates unique constraint in table "t_ignore"
select * from t_ignore;
 num 
-----
   1
   2
(2 rows)

-- test for insert table with primary key
drop table if exists t_pri_key_insert;
NOTICE:  table "t_pri_key_insert" does not exist, skipping
create table t_pri_key_insert(id int primary key);
NOTICE:  CREATE TABLE / PRIMARY KEY will create implicit index "t_pri_key_insert_pkey" for table "t_pri_key_insert"
insert /*+ ignore_error */ into t_pri_key_insert values(null);
WARNING:  null value in column "id" violates not-null constraint
DETAIL:  Failing row contains (null).
insert /*+ ignore_error */ into t_pri_key_insert values(1);
insert /*+ ignore_error */ into t_pri_key_insert values(1);
WARNING:  duplicate key value violates unique constraint in table "t_pri_key_insert"
select * from t_pri_key_insert;
 id 
----
  1
(1 row)

drop table t_pri_key_insert;
-- test for update table with primary key
drop table if exists t_pri_key_update;
NOTICE:  table "t_pri_key_update" does not exist, skipping
create table t_pri_key_update(c1 int primary key, c2 int);
NOTICE:  CREATE TABLE / PRIMARY KEY will create implicit index "t_pri_key_update_pkey" for table "t_pri_key_update"
insert into t_pri_key_update values(1, 101), (2, 201);
update /*+ ignore_error */ t_pri_key_update set c2 = 999 where c1 = 2;
update /*+ ignore_error */ t_pri_key_update set c1 = null where c1 = 2;
WARNING:  null value in column "c1" violates not-null constraint
DETAIL:  Failing row contains (null, 999).
select * from t_pri_key_update;
 c1 | c2  
----+-----
  1 | 101
  2 | 999
(2 rows)

drop table t_pri_key_update;
create table t_pri_key_update_partition (c1 int primary key, c2 int)
    partition by list(c2)
(
partition p1 values (1),
partition p2 values (10),
partition p3 values (100),
partition p4 values (500)
);
NOTICE:  CREATE TABLE / PRIMARY KEY will create implicit index "t_pri_key_update_partition_pkey" for table "t_pri_key_update_partition"
insert into t_pri_key_update_partition values (1, 1), (10, 10), (100, 100);
select * from t_pri_key_update_partition;
 c1  | c2  
-----+-----
   1 |   1
  10 |  10
 100 | 100
(3 rows)

update /*+ ignore_error */ t_pri_key_update_partition set c2 = 500 where c1 = 10;
select * from t_pri_key_update_partition;
 c1  | c2  
-----+-----
   1 |   1
 100 | 100
  10 | 500
(3 rows)

-- test for column orientation table: not supported
drop table if exists t_column_orien cascade;
NOTICE:  table "t_column_orien" does not exist, skipping
create table t_column_orien(c1 int primary key) with (orientation=column);
NOTICE:  CREATE TABLE / PRIMARY KEY will create implicit index "t_column_orien_pkey" for table "t_column_orien"
insert into t_column_orien values(1), (2);
insert /*+ ignore_error */ into t_column_orien values(1);
ERROR:  IGNORE is not supported on INSERT column orientated table.
insert /*+ ignore_error */ into t_column_orien values(null);
ERROR:  IGNORE is not supported on INSERT column orientated table.
update /*+ ignore_error */ t_column_orien set c1 = null where c1 = 2;
ERROR:  IGNORE is not supported on UPDATE column orientated table.
update /*+ ignore_error */ t_column_orien set c1 = 1 where c1 = 2;
ERROR:  IGNORE is not supported on UPDATE column orientated table.
\c postgres
drop database if exists sql_ignore_unique_test;
