--prepare
create table t1(c1 int, c2 int) 
with(orientation = column)
distribute by hash (c1) 
PARTITION BY RANGE (c2)
(
	partition p0 values less than (10),
	partition p1 values less than (20),
	partition p2 values less than (30),
	partition p3 values less than (maxvalue)
)
ENABLE ROW MOVEMENT;
;
create schema data_redis;
CREATE TABLE data_redis.data_redis_tmp_12345 (LIKE t1 INCLUDING STORAGE INCLUDING RELOPTIONS INCLUDING DISTRIBUTION INCLUDING PARTITION INCLUDING CONSTRAINTS, nodeid int,partitionoid int,tupleblocknum bigint,tupleoffset int);
create table source_table(c1 int, c2 int);
insert into source_table values(generate_series(1,100),10);
CREATE OR REPLACE FUNCTION pg_get_redis_rel_start_ctid(text,name) RETURNS tid AS '@abs_bindir@/../lib/postgresql/gsredistribute.so', 'pg_get_redis_rel_start_ctid' LANGUAGE C STABLE not fenced;
CREATE OR REPLACE FUNCTION pg_get_redis_rel_end_ctid(text,name) RETURNS tid AS '@abs_bindir@/../lib/postgresql/gsredistribute.so', 'pg_get_redis_rel_end_ctid' LANGUAGE C STABLE not fenced;
create unlogged table data_redis.pg_delete_delta_12345
(
	xcnodeid int,
	dnrelid int,
	block_number bigint,
	block_offset int
)
distribute by hash(xcnodeid,dnrelid,block_number,block_offset);
create view ctid_view as 
select * from t1 partition (p0)
where ctid between pg_get_redis_rel_start_ctid('t1','p0') and pg_get_redis_rel_end_ctid('t1','p0')
UNION ALL
select * from t1 partition (p1)
where ctid between pg_get_redis_rel_start_ctid('t1','p1') and pg_get_redis_rel_end_ctid('t1','p1')
UNION ALL
select * from t1 partition (p2)
where ctid between pg_get_redis_rel_start_ctid('t1','p2') and pg_get_redis_rel_end_ctid('t1','p2')
UNION ALL
select * from t1 partition (p3)
where ctid between pg_get_redis_rel_start_ctid('t1','p3') and pg_get_redis_rel_end_ctid('t1','p3')
;
--ut1 UT2 TEST empty table
ALTER TABLE t1 SET(append_mode=on, rel_cn_oid=12345);   
select count(*) from ctid_view;
 count 
-------
     0
(1 row)

ALTER TABLE t1 SET(append_mode=on, rel_cn_oid=12345);
select count(*) from ctid_view;
 count 
-------
     0
(1 row)

--UT3 TEST SELECT FROM INSERT 
ALTER TABLE t1 SET(append_mode=on, rel_cn_oid=12345);
insert into t1 select * from source_table;
ALTER TABLE t1 SET(append_mode=on, rel_cn_oid=12345);
select count(*) from ctid_view;
 count 
-------
   100
(1 row)

ALTER TABLE t1 SET(append_mode=on, rel_cn_oid=12345);
select count(*) from ctid_view;
 count 
-------
     0
(1 row)

--UT4 insert several values
ALTER TABLE t1 SET(append_mode=on, rel_cn_oid=12345);
insert into t1 values(11,11);
insert into t1 values(12,12);
insert into t1 values(13,13);
insert into t1 values(14,14);
insert into t1 values(15,15);
ALTER TABLE t1 SET(append_mode=on, rel_cn_oid=12345);
select count(*) from ctid_view;
 count 
-------
     5
(1 row)

--UT5 test delete  
 ALTER TABLE t1 SET(append_mode=on, rel_cn_oid=12345);
 delete from t1 where c1 < 50;
 insert into t1 values(16,16),(17,17),(18,18);
 insert into t1 select * from source_table where c1 < 50;
 ALTER TABLE t1 SET(append_mode=on, rel_cn_oid=12345);
 select count(*) from data_redis.pg_delete_delta_12345;
 count 
-------
    54
(1 row)

 select min(c1),max(c1),count(*) from ctid_view;
 min | max | count 
-----+-----+-------
   1 |  49 |    52
(1 row)

 select * from ctid_view where c1 = 17 order by c2;
 c1 | c2 
----+----
 17 | 10
 17 | 17
(2 rows)

 --UT6 test update
 truncate data_redis.pg_delete_delta_12345;
 truncate t1;
 insert into t1 select * from source_table;
 ALTER TABLE t1 SET(append_mode=on, rel_cn_oid=12345);
 update t1 set c2 = 20 where c1 < 50;
 ALTER TABLE t1 SET(append_mode=on, rel_cn_oid=12345);
 select count(*) from data_redis.pg_delete_delta_12345;
 count 
-------
    49
(1 row)

 select min(c1),max(c1),count(*) from ctid_view;
 min | max | count 
-----+-----+-------
   1 |  49 |    49
(1 row)

 
--UT7 insert null values
 ALTER TABLE t1 SET(append_mode=on, rel_cn_oid=12345);
 insert into t1 values(NULL,NULL);
 insert into t1 values(NULL,NULL);
 ALTER TABLE t1 SET(append_mode=on, rel_cn_oid=12345);
 select min(c1),max(c1),count(*) from ctid_view;
 min | max | count 
-----+-----+-------
     |     |     2
(1 row)

--UT8 check copy
 truncate data_redis.pg_delete_delta_12345;
 truncate t1;
 ALTER TABLE t1 SET(append_mode=on, rel_cn_oid=12345);
 COPY t1 FROM '@abs_srcdir@/data/ft1.data';
 ALTER TABLE t1 SET(append_mode=on, rel_cn_oid=12345);
 select min(c1),max(c1),count(*) from ctid_view;
 min | max | count 
-----+-----+-------
   1 |  19 |    19
(1 row)

 --UT9 delete after insert 
 truncate table data_redis.pg_delete_delta_12345;
 truncate table t1;
 ALTER TABLE t1 SET(append_mode=on, rel_cn_oid=12345);
 insert into t1 values(100,100);
 delete from t1 where c1 = 100;
 ALTER TABLE t1 SET(append_mode=on, rel_cn_oid=12345);
 select count(*) from data_redis.pg_delete_delta_12345; 
 count 
-------
     1
(1 row)

 select min(c1),max(c1),count(*) from ctid_view;
 min | max | count 
-----+-----+-------
     |     |     0
(1 row)

 --UT10 insert then truncate
 truncate table data_redis.pg_delete_delta_12345;
 ALTER TABLE t1 SET(append_mode=on, rel_cn_oid=12345);
 insert into t1 select * from source_table;
 truncate table t1;
 ALTER TABLE t1 SET(append_mode=on, rel_cn_oid=12345);
 select count(*) from data_redis.pg_delete_delta_12345; 
 count 
-------
     0
(1 row)

 select min(c1),max(c1),count(*) from ctid_view;
 min | max | count 
-----+-----+-------
     |     |     0
(1 row)

 
 --UT11 truncate then insert 
 truncate table data_redis.pg_delete_delta_12345;
 
 ALTER TABLE t1 SET(append_mode=on, rel_cn_oid=12345);
 insert into t1 select * from source_table;
 truncate table t1;
 insert into t1 values(100,100),(200,200);
 delete from t1 where c1 = 200;
 ALTER TABLE t1 SET(append_mode=on, rel_cn_oid=12345);
 select count(*) from data_redis.pg_delete_delta_12345; 
 count 
-------
     1
(1 row)

 select min(c1),max(c1),count(*) from ctid_view;
 min | max | count 
-----+-----+-------
 100 | 100 |     1
(1 row)

 
 --UT11 test vacuum full
 truncate table data_redis.pg_delete_delta_12345;
 truncate table t1;
 insert into t1 select * from source_table;
 ALTER TABLE t1 SET(append_mode=on, rel_cn_oid=12345);
 --do some udpate and delete
 delete from t1 where c1 < 50;
 update t1 set c2 = 20 where c1 > 50;
 vacuum full t1;
ERROR:  Unsupport 'VACUUM FULL' command during online expansion on 't1'
 ALTER TABLE t1 SET(append_mode=on, rel_cn_oid=12345);
 select count(*) from data_redis.pg_delete_delta_12345; 
 count 
-------
    99
(1 row)

 select min(c1),max(c1),count(*) from ctid_view; 
 min | max | count 
-----+-----+-------
  51 | 100 |    50
(1 row)

 --clear 
drop view ctid_view;
drop function pg_get_redis_rel_start_ctid;
drop function pg_get_redis_rel_end_ctid; 
drop table t1;
drop table source_table;
drop table data_redis.pg_delete_delta_12345;
drop table data_redis.data_redis_tmp_12345;
drop schema data_redis;
