--
-- checksum table column and the whole talbe
--
drop table if exists zktt1;
NOTICE:  table "zktt1" does not exist, skipping
drop table if exists zktt2;
NOTICE:  table "zktt2" does not exist, skipping
drop table if exists zktt3;
NOTICE:  table "zktt3" does not exist, skipping
create table zktt1 (
	c1 			tinyint, 
	c2 			smallint, 
	c3 			integer, 
	c4 			bigint, 
	c5 			numeric, 
	c6 			text, 
	c7 			varchar(10), 
	c8 			char, 
	c9 			smalldatetime, 
	c10 		timestamp, 
	c11 		timestamptz, 
	c12 		date, 
	c13 		money, 
	c14 		bool
);
create table zktt2 (
	a 			int, 
	b 			text
);
create table zktt3 (
	a 			int, 
	b 			text
) 
with (orientation = column);
--
-- insert values
--
insert into zktt1 values (1, 2, 3, 4, 5.6, '789', '1112', '1', smalldatetime '2010-01-10 08:08:08', timestamp '2010-01-10 08:08:08',timestamptz '2010-01-10 08:08:08',date '2010-08-08', money '234234.90', true);
insert into zktt1 values (4, 3, 2, 1, 6.5, '432', '2222', '2', smalldatetime '2012-01-10 08:08:08', timestamp '2011-12-10 08:08:08',timestamptz '2011-12-10 08:08:08',date '1234-05-06', money '1234.56', false);
insert into zktt2 values (1, '');
insert into zktt2 values (2, null);
insert into zktt2 values (3, 3);
insert into zktt3 select * from zktt2;
--
-- checksum for given date types
--
select checksum(c1) from zktt1;
  checksum  
------------
 7720654853
(1 row)

select checksum(c2) from zktt1; 
  checksum  
------------
 6599398362
(1 row)

select checksum(c3) from zktt1; 
  checksum  
------------
 6599398362
(1 row)

select checksum(c4) from zktt1; 
  checksum  
------------
 7720654853
(1 row)

select checksum(c5) from zktt1; 
  checksum  
------------
 6120234457
(1 row)

select checksum(c6) from zktt1; 
  checksum  
------------
 2534214519
(1 row)

select checksum(c7) from zktt1; 
  checksum  
------------
 4666980434
(1 row)

select checksum(c8) from zktt1; 
  checksum  
------------
 7863610619
(1 row)

select checksum(c9) from zktt1; 
  checksum  
------------
 3058455888
(1 row)

select checksum(c11) from zktt1; 
  checksum  
------------
 3272714743
(1 row)

select checksum(c12) from zktt1; 
  checksum  
------------
 3851931629
(1 row)

select checksum(c13) from zktt1; 
ERROR:  function checksum(money) does not exist
LINE 1: select checksum(c13) from zktt1;
               ^
HINT:  No function matches the given name and argument types. You might need to add explicit type casts.
CONTEXT:  referenced column: checksum
select checksum(c13::text) from zktt1;
  checksum  
------------
 4456394973
(1 row)

select checksum(c14) from zktt1;       
ERROR:  function checksum(boolean) does not exist
LINE 1: select checksum(c14) from zktt1;
               ^
HINT:  No function matches the given name and argument types. You might need to add explicit type casts.
CONTEXT:  referenced column: checksum
select checksum(c14::text) from zktt1;
  checksum  
------------
 2453092036
(1 row)

--
-- checksum for null values
--
select checksum(b) from zktt2 where a < 3;
 checksum 
----------
         
(1 row)

select checksum(b) from zktt2;
  checksum  
------------
 2399621592
(1 row)

select checksum(b), checksum(b) from zktt2;
  checksum  |  checksum  
------------+------------
 2399621592 | 2399621592
(1 row)

--
-- checksum for group by order by
--
select checksum(a) from zktt2 group by a order by a;
  checksum  
------------
 3663833849
 4199776770
 2399621592
(3 rows)

--
-- checksum for join tables
--
select checksum(a) from zktt2 join zktt1 on zktt2.a=zktt1.c1;
  checksum  
------------
 3663833849
(1 row)

--
-- checksum for sub query and complex query
--
select checksum(a) from zktt2 where a in (select c1 from zktt1);
  checksum  
------------
 3663833849
(1 row)

select * from (select checksum(a) from zktt2 group by a order by a) order by checksum;
  checksum  
------------
 2399621592
 3663833849
 4199776770
(3 rows)

select checksum(tbl::text) from (select checksum(a) from zktt2 group by a) as tbl; 
  checksum  
------------
 6422751146
(1 row)

--
-- checksum for update table data
--
begin;
select checksum(zktt2::text) from zktt2;
  checksum  
------------
 1597748801
(1 row)

update zktt2 set b='4' where a=1;                
select checksum(zktt2::text) from zktt2;
  checksum  
------------
 3401890048
(1 row)

rollback;
--
-- checksum for insert table data
--
begin;
select checksum(zktt2::text) from zktt2;
  checksum  
------------
 1597748801
(1 row)

insert into zktt2 values (1,2);   
select checksum(zktt2::text) from zktt2;
  checksum  
------------
 3718678534
(1 row)

rollback;
--
-- checksum for delete table data
--
begin;
select checksum(zktt2::text) from zktt2;
  checksum  
------------
 1597748801
(1 row)

delete from zktt2 where a=1;   
select checksum(zktt2::text) from zktt2;
 checksum  
-----------
 614888204
(1 row)

rollback;
--
-- checksum for column-stored table 
--
select checksum(zktt3::text) from zktt3;
  checksum  
------------
 1597748801
(1 row)

DROP TABLE zktt1;
DROP TABLE zktt2;
DROP TABLE zktt3;
--
-- test pg_stat_get_activity_for_temptable
--
select * from pg_stat_get_activity_for_temptable() limit 1;
--? datid | timelineid | tempid | .*sessionid.*
--?-------+------------+--------+ .*
--?     0 |          0 |      0 | .*
(1 row)

