--
-- Tests for some likely failure cases with combo cmin/cmax mechanism
--
-- Enforce use of COMMIT instead of 2PC for temporary objects
CREATE TEMP TABLE combocidtest (foobar int) distribute by replication;
START TRANSACTION;
-- a few dummy ops to push up the CommandId counter
INSERT INTO combocidtest SELECT 1 LIMIT 0;
INSERT INTO combocidtest SELECT 1 LIMIT 0;
INSERT INTO combocidtest SELECT 1 LIMIT 0;
INSERT INTO combocidtest SELECT 1 LIMIT 0;
INSERT INTO combocidtest SELECT 1 LIMIT 0;
INSERT INTO combocidtest SELECT 1 LIMIT 0;
INSERT INTO combocidtest SELECT 1 LIMIT 0;
INSERT INTO combocidtest SELECT 1 LIMIT 0;
INSERT INTO combocidtest SELECT 1 LIMIT 0;
INSERT INTO combocidtest SELECT 1 LIMIT 0;
INSERT INTO combocidtest VALUES (1);
INSERT INTO combocidtest VALUES (2);
SELECT ctid,cmin,* FROM combocidtest ORDER BY ctid;
 ctid  | cmin | foobar 
-------+------+--------
 (0,1) |   10 |      1
 (0,2) |   11 |      2
(2 rows)

SAVEPOINT s1;
UPDATE combocidtest SET foobar = foobar + 10;
-- here we should see only updated tuples
SELECT ctid,cmin,* FROM combocidtest ORDER BY ctid;
 ctid  | cmin | foobar 
-------+------+--------
 (0,3) |   12 |     11
 (0,4) |   12 |     12
(2 rows)

ROLLBACK TO s1;
-- now we should see old tuples, but with combo CIDs starting at 0
SELECT ctid,cmin,* FROM combocidtest ORDER BY ctid;
 ctid  | cmin | foobar 
-------+------+--------
 (0,1) |    0 |      1
 (0,2) |    1 |      2
(2 rows)

COMMIT;
-- combo data is not there anymore, but should still see tuples
SELECT ctid,cmin,* FROM combocidtest;
 ctid  | cmin | foobar 
-------+------+--------
 (0,1) |    0 |      1
 (0,2) |    1 |      2
(2 rows)

-- Test combo cids with portals
START TRANSACTION;
INSERT INTO combocidtest VALUES (333);
CURSOR c FOR SELECT ctid,cmin,* FROM combocidtest ORDER BY ctid;
DELETE FROM combocidtest;
FETCH ALL FROM c;
 ctid  | cmin | foobar 
-------+------+--------
 (0,1) |    2 |      1
 (0,2) |    2 |      2
 (0,5) |    0 |    333
(3 rows)

ROLLBACK;
SELECT ctid,cmin,* FROM combocidtest ORDER BY ctid;
 ctid  | cmin | foobar 
-------+------+--------
 (0,1) |    2 |      1
 (0,2) |    2 |      2
(2 rows)

-- check behavior with locked tuples
START TRANSACTION;
-- a few dummy ops to push up the CommandId counter
INSERT INTO combocidtest SELECT 1 LIMIT 0;
INSERT INTO combocidtest SELECT 1 LIMIT 0;
INSERT INTO combocidtest SELECT 1 LIMIT 0;
INSERT INTO combocidtest SELECT 1 LIMIT 0;
INSERT INTO combocidtest SELECT 1 LIMIT 0;
INSERT INTO combocidtest SELECT 1 LIMIT 0;
INSERT INTO combocidtest SELECT 1 LIMIT 0;
INSERT INTO combocidtest SELECT 1 LIMIT 0;
INSERT INTO combocidtest SELECT 1 LIMIT 0;
INSERT INTO combocidtest SELECT 1 LIMIT 0;
INSERT INTO combocidtest VALUES (444);
SELECT ctid,cmin,* FROM combocidtest ORDER BY ctid;
 ctid  | cmin | foobar 
-------+------+--------
 (0,1) |    2 |      1
 (0,2) |    2 |      2
 (0,6) |   10 |    444
(3 rows)

SAVEPOINT s1;
-- this doesn't affect cmin
SELECT ctid,cmin,* FROM combocidtest FOR UPDATE;
 ctid  | cmin | foobar 
-------+------+--------
 (0,1) |    2 |      1
 (0,2) |    2 |      2
 (0,6) |   10 |    444
(3 rows)

SELECT ctid,cmin,* FROM combocidtest ORDER BY ctid;
 ctid  | cmin | foobar 
-------+------+--------
 (0,1) |    2 |      1
 (0,2) |    2 |      2
 (0,6) |   10 |    444
(3 rows)

-- but this does
UPDATE combocidtest SET foobar = foobar + 10;
SELECT ctid,cmin,* FROM combocidtest ORDER BY ctid;
 ctid  | cmin | foobar 
-------+------+--------
 (0,7) |   11 |     11
 (0,8) |   11 |     12
 (0,9) |   11 |    454
(3 rows)

ROLLBACK TO s1;
SELECT ctid,cmin,* FROM combocidtest ORDER BY ctid;
 ctid  | cmin | foobar 
-------+------+--------
 (0,1) |   11 |      1
 (0,2) |   11 |      2
 (0,6) |    0 |    444
(3 rows)

COMMIT;
