CREATE TABLE heap_modify_tuple_s (rf_a SERIAL PRIMARY KEY,
	b INT);
NOTICE:  CREATE TABLE will create implicit sequence "heap_modify_tuple_s_rf_a_seq" for serial column "heap_modify_tuple_s.rf_a"
NOTICE:  CREATE TABLE / PRIMARY KEY will create implicit index "heap_modify_tuple_s_pkey" for table "heap_modify_tuple_s"
CREATE TABLE heap_modify_tuple (a SERIAL PRIMARY KEY,
	b INT,
	c TEXT,
	d TEXT
	);
NOTICE:  CREATE TABLE will create implicit sequence "heap_modify_tuple_a_seq" for serial column "heap_modify_tuple.a"
NOTICE:  CREATE TABLE / PRIMARY KEY will create implicit index "heap_modify_tuple_pkey" for table "heap_modify_tuple"
CREATE INDEX heap_modify_tuple_b ON heap_modify_tuple (b);
CREATE INDEX heap_modify_tuple_c ON heap_modify_tuple (c);
CREATE INDEX heap_modify_tuple_c_b ON heap_modify_tuple (c,b);
CREATE INDEX heap_modify_tuple_b_c ON heap_modify_tuple (b,c);
INSERT INTO heap_modify_tuple_s (b) VALUES (0);
INSERT INTO heap_modify_tuple_s (b) SELECT b FROM heap_modify_tuple_s;
INSERT INTO heap_modify_tuple_s (b) SELECT b FROM heap_modify_tuple_s;
INSERT INTO heap_modify_tuple_s (b) SELECT b FROM heap_modify_tuple_s;
INSERT INTO heap_modify_tuple_s (b) SELECT b FROM heap_modify_tuple_s;
INSERT INTO heap_modify_tuple_s (b) SELECT b FROM heap_modify_tuple_s;
drop table heap_modify_tuple_s cascade;
-- CREATE TABLE clstr_tst_inh () INHERITS (heap_modify_tuple);
INSERT INTO heap_modify_tuple (b, c) VALUES (11, 'once');
INSERT INTO heap_modify_tuple (b, c) VALUES (10, 'diez');
INSERT INTO heap_modify_tuple (b, c) VALUES (31, 'treinta y uno');
INSERT INTO heap_modify_tuple (b, c) VALUES (22, 'veintidos');
INSERT INTO heap_modify_tuple (b, c) VALUES (3, 'tres');
INSERT INTO heap_modify_tuple (b, c) VALUES (20, 'veinte');
INSERT INTO heap_modify_tuple (b, c) VALUES (23, 'veintitres');
INSERT INTO heap_modify_tuple (b, c) VALUES (21, 'veintiuno');
INSERT INTO heap_modify_tuple (b, c) VALUES (4, 'cuatro');
INSERT INTO heap_modify_tuple (b, c) VALUES (14, 'catorce');
INSERT INTO heap_modify_tuple (b, c) VALUES (2, 'dos');
INSERT INTO heap_modify_tuple (b, c) VALUES (18, 'dieciocho');
INSERT INTO heap_modify_tuple (b, c) VALUES (27, 'veintisiete');
INSERT INTO heap_modify_tuple (b, c) VALUES (25, 'veinticinco');
INSERT INTO heap_modify_tuple (b, c) VALUES (13, 'trece');
INSERT INTO heap_modify_tuple (b, c) VALUES (28, 'veintiocho');
INSERT INTO heap_modify_tuple (b, c) VALUES (32, 'treinta y dos');
INSERT INTO heap_modify_tuple (b, c) VALUES (5, 'cinco');
INSERT INTO heap_modify_tuple (b, c) VALUES (29, 'veintinueve');
INSERT INTO heap_modify_tuple (b, c) VALUES (1, 'uno');
INSERT INTO heap_modify_tuple (b, c) VALUES (24, 'veinticuatro');
INSERT INTO heap_modify_tuple (b, c) VALUES (30, 'treinta');
INSERT INTO heap_modify_tuple (b, c) VALUES (12, 'doce');
INSERT INTO heap_modify_tuple (b, c) VALUES (17, 'diecisiete');
INSERT INTO heap_modify_tuple (b, c) VALUES (9, 'nueve');
INSERT INTO heap_modify_tuple (b, c) VALUES (19, 'diecinueve');
INSERT INTO heap_modify_tuple (b, c) VALUES (26, 'veintiseis');
INSERT INTO heap_modify_tuple (b, c) VALUES (15, 'quince');
INSERT INTO heap_modify_tuple (b, c) VALUES (7, 'siete');
INSERT INTO heap_modify_tuple (b, c) VALUES (16, 'dieciseis');
INSERT INTO heap_modify_tuple (b, c) VALUES (8, 'ocho');
-- This entry is needed to test that TOASTED values are copied correctly.
INSERT INTO heap_modify_tuple (b, c, d) VALUES (6, 'seis', repeat('xyzzy', 100000));
CLUSTER heap_modify_tuple_c ON heap_modify_tuple;
-- Verify that foreign key link still works
INSERT INTO heap_modify_tuple (b, c) VALUES (1111, 'this should fail');
-- Try changing indisclustered
ALTER TABLE heap_modify_tuple CLUSTER ON heap_modify_tuple_b_c;
-- Try turning off all clustering
ALTER TABLE heap_modify_tuple SET WITHOUT CLUSTER;
drop table heap_modify_tuple cascade;
-- Verify that clustering all tables does in fact cluster the right ones
CREATE USER clstr_user PASSWORD 'gauss@123';
CREATE TABLE heap_modify_tuple_1 (a INT PRIMARY KEY);
NOTICE:  CREATE TABLE / PRIMARY KEY will create implicit index "heap_modify_tuple_1_pkey" for table "heap_modify_tuple_1"
CREATE TABLE heap_modify_tuple_2 (a INT PRIMARY KEY);
NOTICE:  CREATE TABLE / PRIMARY KEY will create implicit index "heap_modify_tuple_2_pkey" for table "heap_modify_tuple_2"
CREATE TABLE heap_modify_tuple_3 (a INT PRIMARY KEY);
NOTICE:  CREATE TABLE / PRIMARY KEY will create implicit index "heap_modify_tuple_3_pkey" for table "heap_modify_tuple_3"
ALTER TABLE heap_modify_tuple_1 OWNER TO clstr_user;
ALTER TABLE heap_modify_tuple_3 OWNER TO clstr_user;
GRANT SELECT ON heap_modify_tuple_2 TO clstr_user;
INSERT INTO heap_modify_tuple_1 VALUES (2);
INSERT INTO heap_modify_tuple_1 VALUES (1);
INSERT INTO heap_modify_tuple_2 VALUES (2);
INSERT INTO heap_modify_tuple_2 VALUES (1);
INSERT INTO heap_modify_tuple_3 VALUES (2);
INSERT INTO heap_modify_tuple_3 VALUES (1);
-- "CLUSTER <tablename>" on a table that hasn't been clustered
CLUSTER slot_getattr_1_pkey ON heap_modify_tuple_1;
ERROR:  index "slot_getattr_1_pkey" for table "heap_modify_tuple_1" does not exist
CLUSTER heap_modify_tuple_2 USING slot_getattr_2_pkey;
ERROR:  index "slot_getattr_2_pkey" for table "heap_modify_tuple_2" does not exist
SELECT * FROM heap_modify_tuple_1 UNION ALL
  SELECT * FROM heap_modify_tuple_2 UNION ALL
  SELECT * FROM heap_modify_tuple_3
  ORDER BY 1;
 a 
---
 1
 1
 1
 2
 2
 2
(6 rows)

drop table heap_modify_tuple_1;
drop table heap_modify_tuple_2;
drop table heap_modify_tuple_3;
drop user clstr_user cascade;
CREATE SCHEMA regress_rls_schema;
GRANT CREATE ON SCHEMA regress_rls_schema to public;
GRANT USAGE ON SCHEMA regress_rls_schema to public;
-- reconnect
\c
SET search_path = regress_rls_schema;
CREATE TABLE regress_rls_schema.document_row(
    did     int primary key,
    cid     int,
    dlevel  int not null,
    dauthor name,
    dtitle  text
);
NOTICE:  CREATE TABLE / PRIMARY KEY will create implicit index "document_row_pkey" for table "document_row"
GRANT ALL ON regress_rls_schema.document_row TO public;
INSERT INTO regress_rls_schema.document_row VALUES
    ( 1, 11, 1, 'regress_rls_bob', 'my first novel'),
    ( 2, 11, 5, 'regress_rls_bob', 'my second novel'),
    ( 3, 22, 7, 'regress_rls_bob', 'my science fiction'),
    ( 4, 44, 9, 'regress_rls_bob', 'my first manga'),
    ( 5, 44, 3, 'regress_rls_bob', 'my second manga'),
    ( 6, 22, 2, 'regress_rls_peter', 'great science fiction'),
    ( 7, 33, 6, 'regress_rls_peter', 'great technology book'),
    ( 8, 44, 4, 'regress_rls_peter', 'great manga'),
    ( 9, 22, 5, 'regress_rls_david', 'awesome science fiction'),
    (10, 33, 4, 'regress_rls_david', 'awesome technology book'),
    (11, 55, 8, 'regress_rls_alice', 'great biography'),
    (12, 33, 10, 'regress_rls_admin', 'physical technology'),
    (13, 55, 5, 'regress_rls_single_user', 'Beethoven biography');
ANALYZE regress_rls_schema.document_row;
UPDATE document_row SET dlevel = dlevel + 1 - 1 WHERE did > 1;
INSERT INTO document_row VALUES (100, 49, 1, 'regress_rls_david', 'testing sorting of policies');
DELETE FROM document_row WHERE did = 100;
INSERT INTO document_row VALUES (100, 49, 1, 'regress_rls_david', 'testing sorting of policies');
DELETE FROM document_row WHERE did = 100 RETURNING dauthor, did;
      dauthor      | did 
-------------------+-----
 regress_rls_david | 100
(1 row)

CREATE TABLE regress_rls_schema.account_row(
    aid   int,
    aname varchar(100)
) WITH (ORIENTATION=row);
CREATE ROW LEVEL SECURITY POLICY p01 ON document_row AS PERMISSIVE
    USING (dlevel <= (SELECT aid FROM account_row WHERE aname = current_user));
ALTER POLICY p01 ON document_row USING (dauthor = current_user);
ALTER POLICY p01 ON document_row RENAME TO p12;
ALTER POLICY p12 ON document_row RENAME TO p13;
ALTER POLICY p13 ON document_row RENAME TO p01;
SELECT * FROM pg_rlspolicies ORDER BY tablename, policyname;
     schemaname     |  tablename   | policyname | policypermissive | policyroles | policycmd |          policyqual          
--------------------+--------------+------------+------------------+-------------+-----------+------------------------------
 regress_rls_schema | document_row | p01        | PERMISSIVE       | {public}    | ALL       | (dauthor = "current_user"())
(1 row)

drop schema regress_rls_schema cascade;
NOTICE:  drop cascades to 2 other objects
DETAIL:  drop cascades to table document_row
drop cascades to table account_row
reset search_path;
create schema pgaudit_audit_object;
alter schema pgaudit_audit_object rename to pgaudit_audit_object_1;
drop schema pgaudit_audit_object_1;
create role davide WITH PASSWORD 'jw8s0F411_1';
ALTER ROLE davide SET maintenance_work_mem = 100000;
alter role davide rename to davide1;
drop role davide1;
create table pgaudit_audit_object (a int, b int);
CREATE VIEW vista AS SELECT * from pgaudit_audit_object;
alter view vista rename to vista1;
drop view vista1;
drop table pgaudit_audit_object;
CREATE DATABASE lusiadas;
alter database lusiadas rename to lusiadas1;
drop database lusiadas1;
CREATE ROLE regress_rls_group2 NOLOGIN PASSWORD 'Gauss@123';
CREATE TABLE par_row_t1 (id int, a int, b text)partition by range (a)
(
	partition par_row_t1_p0 values less than(10),
	partition par_row_t1_p1 values less than(50),
	partition par_row_t1_p2 values less than(100),
	partition par_row_t1_p3 values less than (maxvalue)
);
CREATE TABLE par_col_t1(id int, a int, b text) with(orientation = column) /*distribute by hash (id)*/ PARTITION BY RANGE (a)
(
	partition par_col_t1_p0 values less than(10),
	partition par_col_t1_p1 values less than(50),
	partition par_col_t1_p2 values less than(100),
	partition par_col_t1_p3 values less than (maxvalue)
);
INSERT INTO par_row_t1 VALUES (generate_series(1, 150) % 24, generate_series(1, 150), 'huawei');
INSERT INTO par_col_t1 VALUES (generate_series(1, 150) % 24, generate_series(1, 150), 'huawei');
GRANT SELECT ON par_row_t1 TO PUBLIC;
GRANT SELECT ON par_col_t1 TO PUBLIC;
CREATE ROW LEVEL SECURITY POLICY par_row_t1_rls1 ON par_row_t1 AS PERMISSIVE TO public USING(a <= 20);
CREATE ROW LEVEL SECURITY POLICY par_row_t1_rls2 ON par_row_t1 AS RESTRICTIVE TO regress_rls_group2 USING(id < 30);
CREATE ROW LEVEL SECURITY POLICY par_col_t1_rls1 ON par_col_t1 AS PERMISSIVE TO public USING(a <= 20);
CREATE ROW LEVEL SECURITY POLICY par_col_t1_rls2 ON par_col_t1 AS RESTRICTIVE TO regress_rls_group2 USING(id < 30);
ALTER TABLE par_row_t1 ENABLE ROW LEVEL SECURITY;
ALTER TABLE par_col_t1 ENABLE ROW LEVEL SECURITY;
DROP POLICY par_row_t1_rls1 ON par_row_t1; 
DROP POLICY par_row_t1_rls2 ON par_row_t1; 
DROP POLICY par_col_t1_rls1 ON par_col_t1; 
DROP POLICY par_col_t1_rls2 ON par_col_t1;
drop table par_row_t1 cascade;
drop table par_col_t1 cascade;
drop role regress_rls_group2;
CREATE TABLE heap_modify_tuple_4 (col1 int PRIMARY KEY, col2 INT, col3 smallserial)  ;
NOTICE:  CREATE TABLE will create implicit sequence "heap_modify_tuple_4_col3_seq" for serial column "heap_modify_tuple_4.col3"
NOTICE:  CREATE TABLE / PRIMARY KEY will create implicit index "heap_modify_tuple_4_pkey" for table "heap_modify_tuple_4"
PREPARE p1 AS INSERT INTO heap_modify_tuple_4 VALUES($1, $2) ON DUPLICATE KEY UPDATE col2 = $1*100;
EXECUTE p1(5, 50);
SELECT * FROM heap_modify_tuple_4 WHERE col1 = 5;
 col1 | col2 | col3 
------+------+------
    5 |   50 |    1
(1 row)

EXECUTE p1(5, 50);
SELECT * FROM heap_modify_tuple_4 WHERE col1 = 5;
 col1 | col2 | col3 
------+------+------
    5 |  500 |    1
(1 row)

DELETE heap_modify_tuple_4 WHERE col1 = 5;
DEALLOCATE p1;
DROP TABLE heap_modify_tuple_4 CASCADE;
create table tGin122 (
        name varchar(50) not null, 
        age int, 
        birth date, 
        ID varchar(50) , 
        phone varchar(15),
        carNum varchar(50),
        email varchar(50), 
        info text, 
        config varchar(50) default 'english',
        tv tsvector,
        i varchar(50)[],
        ts tsquery);
insert into tGin122 values('Linda', 20, '1996-06-01', '140110199606012076', '13454333333', '京A QL666', 'linda20@sohu.com', 'When he was busy with teaching men the art of living, Prometheus had left a bigcask in the care of Epimetheus. He had warned his brother not to open the lid. Pandora was a curious woman. She had been feeling very disappointed that her husband did not allow her to take a look at the contents of the cask. One day, when Epimetheus was out, she lifted the lid and out it came unrest and war, Plague and sickness, theft and violence, grief, sorrow, and all the other evils. The human world was hence to experience these evils. Only hope stayed within the mouth of the jar and never flew out. So men always have hope within their hearts.
偷窃天火之后，宙斯对人类的敌意与日俱增。一天，他令儿子赫菲斯托斯用泥塑一美女像，并请众神赠予她不同的礼物。世上的第一个女人是位迷人女郎，因为她从每位神灵那里得到了一样对男人有害的礼物，因此宙斯称她为潘多拉。
', 'ngram', '', '{''brother'',''与日俱增'',''赫菲斯托斯''}',NULL);
insert into tGin122 values('张三', 20,  '1996-07-01', '140110199607012076', '13514333333', '鲁K QL662', 'zhangsan@163.com', '希腊北部国王阿塔玛斯有两个孩子，法瑞克斯和赫勒。当国王离
开第一个妻子和一个名叫伊诺的坏女人结婚后，两个孩子受到后母残忍虐待，整个王国也受到毁灭性瘟疫的侵袭。伊诺在爱轻信的丈夫耳边进谗言，终于使国王相信：他的儿子法瑞克斯是这次灾害的罪魁祸首，并要将他献给宙斯以结束
瘟疫。可怜的孩子被推上了祭坛，将要被处死。正在此时，上帝派了一只浑身上下长着金色羊毛的公羊来将两个孩子驮在背上带走了。当他们飞过隔开欧洲和亚洲的海峡时，赫勒由于看到浩瀚的海洋而头晕目眩，最终掉进大海淹死了。
这片海洋古时候的名称叫赫勒之海，赫勒拉旁海峡便由此而来。金色公羊驮着法瑞克斯继续向前飞去，来到了黑海东岸的科尔契斯。在那里，法瑞克斯将公羊献给了宙斯；而将金羊毛送给了埃厄忒斯国王。国王将羊毛钉在一棵圣树上，
并派了一条不睡觉的龙负责看护。', 'ngram', '',  '{''法瑞克斯和赫勒'',''王国'',''埃厄忒斯国王''}',NULL); 
insert into tGin122 values('Sara', 20,  '1996-07-02', '140110199607022076', '13754333333', '冀A QL661', 'sara20@sohu.com', '英语语言结构重形合（hypotaxis），汉语重义合（parataxis）>，也就是说，英语的句子组织通常通过连接词（connectives）和词尾的曲折变化（inflection）来实现，汉语则较少使用连接词和受语法规则约束。英语句子通过表示各种关系如因果、条件、逻辑、预设等形合手段组织，环环相扣，>可以形成像树枝一样包孕许多修饰成分和分句的长句和复杂句，而汉语则多用短句和简单句。此外，英语注重使用各种短语作为句子的构成单位，在修饰位置上可前可后、十分灵活，常习惯于后置语序。这些差异就形成了王力先生所谓
的英语“化零为整”而汉语则“化整为零”特点。此外，英语多用被动语态，这在科技英语中尤为如此。了解英语和汉语这些造句差异，就可在英语长句和复杂句的理解和翻译中有意识地将英语句子按照汉语造句特点进行转化处理，短从句结构变单独句子或相反，后置变前置，被动变主动。以下结合本人在教学中遇到的例子，说说如何对生物类专业英语长句和复杂句翻译进行翻译处理。', 'english', '',  '{''parataxis'',''后置变前置'',''差异''}',NULL);
insert into tGin122 values('Mira', 20,  '1996-08-01', '140110199608012076', '13654333333', '津A QL660', 'mm20@sohu.com', '[解析]第一个分句宜将被动语态译为主动语态，第二个分句如将定>语分句处理为汉语前置，“利用能在培养组织中迅速降解而无需提供第二种生根培养基的IAA则是克服这个问题的一种有用方法。”则会因修饰语太长，不易理解，也不符合汉语习惯，宜作为分句处理。[翻译]根发端所需的生长素水平抑制根的伸长，而利用IAA则是克服这个问题的一种有用方法，因为IAA能在培养组织中迅速降解而无需提供第二种生根培养基。', 'english', '',  '{''汉语前置'',''分句处理'',''生长素水平''}',NULL);
insert into tGin122 values('Amy', 20,  ' 1996-09-01', '140110199609012076', '13854333333', '吉A QL663', 'amy2008@163.com', '[解析]该句的理解的关键是要抓住主句的结构“Current concern focus on ……, and on……”，同时不要将第二个“on”的搭配（intrusionon）与主句中第一个和第三个“on”的搭配（focuson）混淆。翻译时，为了避免宾语的修补词过长，可用“目前公众对转基因植物的关注集中在这两点”来用“一方面……；另一方面……”来分述，这样处理更符合汉语习惯。', 'ngram', '',  '{''intrusionon'',''13854333333'',''140110199609012076''}',NULL);
insert into tGin122 values('汪玲沁 ', 20,  ' 1996-09-01', '44088319921103106X', '13854333333', '沈YWZJW0', 'si2008@163.com', '晨的美好就如青草般芳香，如河溪般清澈，如玻璃般透明，如>甘露般香甜。[解析]该句的主句结构为“This led to a whole new field of academic research”，后面有一个现在分词结构“including the milestone paper by Paterson and co-workers in 1988”之后为“the milestone pape长定语从句。在翻译时，宜将该定语从句分译成句，但要将表示方法手段的现在分词结构“using an approach that could be applied to dissect the genetic make-up of any physiological, morphological and behavioural trat in plants and animals”前置译出，这样更符合汉语的表达习惯。', 'ngram', '',  '{''44088319921103106X'',''分词结构'',''透明''}',NULL);
create index tgin122_idx1 on tgin122 (substr(email,2,5));
create index tgin122_idx2 on tgin122 (upper(info));
set default_statistics_target=-2;
analyze tGin122 ((tv, ts));
select * from pg_ext_stats where schemaname='distribute_stat_2' and tablename='tgin122' order by attname;
 schemaname | tablename | attname | inherited | null_frac | avg_width | n_distinct | n_dndistinct | most_common_vals | most_common_freqs | most_common_vals_null | most_common_freqs_null | histogram_bounds 
------------+-----------+---------+-----------+-----------+-----------+------------+--------------+------------------+-------------------+-----------------------+------------------------+------------------
(0 rows)

alter table tGin122 delete statistics ((tv, ts));
update tGin122 set tv=to_tsvector(config::regconfig, coalesce(name,'') || ' ' || coalesce(ID,'') || ' ' || coalesce(carNum,'') || ' ' || coalesce(phone,'') || ' ' || coalesce(email,'') || ' ' || coalesce(info,''));
update tGin122 set ts=to_tsquery('ngram', coalesce(phone,'')); 
analyze tGin122 ((tv, ts));
select * from pg_ext_stats where schemaname='distribute_stat_2' and tablename='tgin122' order by attname;
 schemaname | tablename | attname | inherited | null_frac | avg_width | n_distinct | n_dndistinct | most_common_vals | most_common_freqs | most_common_vals_null | most_common_freqs_null | histogram_bounds 
------------+-----------+---------+-----------+-----------+-----------+------------+--------------+------------------+-------------------+-----------------------+------------------------+------------------
(0 rows)

alter table tGin122 delete statistics ((tv, ts));
select * from pg_ext_stats where schemaname='distribute_stat_2' and tablename='tgin122' order by attname;
 schemaname | tablename | attname | inherited | null_frac | avg_width | n_distinct | n_dndistinct | most_common_vals | most_common_freqs | most_common_vals_null | most_common_freqs_null | histogram_bounds 
------------+-----------+---------+-----------+-----------+-----------+------------+--------------+------------------+-------------------+-----------------------+------------------------+------------------
(0 rows)

alter table tGin122 add statistics ((tv, ts));
analyze tGin122;
select * from pg_ext_stats where schemaname='distribute_stat_2' and tablename='tgin122' order by attname;
 schemaname | tablename | attname | inherited | null_frac | avg_width | n_distinct | n_dndistinct | most_common_vals | most_common_freqs | most_common_vals_null | most_common_freqs_null | histogram_bounds 
------------+-----------+---------+-----------+-----------+-----------+------------+--------------+------------------+-------------------+-----------------------+------------------------+------------------
(0 rows)

select * from pg_stats where tablename='tgin122' and attname = 'tv';
 schemaname | tablename | attname | inherited | null_frac | avg_width | n_distinct | n_dndistinct | most_common_vals | most_common_freqs | histogram_bounds | correlation |                                                                                                                                                                                                                                                                                                                                                                                                                                                                                                                                                                                                                                                                                                                                                                                                                                                                                                                                                                                                                                                                                                                                                                                                                                                                                                                                                                                                                                                                                                                                                                                                                                                                                                                                                                                                                                                                                                                                                                                                                                                                                                                                                                                                                                                                          most_common_elems                                                                                                                                                                                                                                                                                                                                                                                                                                                                                                                                                                                                                                                                                                                                                                                                                                                                                                                                                                                                                                                                                                                                                                                                                                                                                                                                                                                                                                                                                                                                                                                                                                                                                                                                                                                                                                                                                                                                                                                                                                                                                                                                                                                                                                                                           |                                                                                                                                                                                                                                                                                                                                                                                                                                                                                                                                                                                                                                                                                                                                                                                                                                                                                                                                                                                                                                                                                                                                                                                                                                                                                                                                                                                                                                                                                                                                                                                                                                                                                                                                                                                                                                                                                                                                                                                                                                                                                                                                                                                                                                                                                                                                                                                                                                                                                                                                                                                                                                                                                                                                                                                                                                                                                                                                                                                                                                                                                                                                                                                                            most_common_elem_freqs                                                                                                                                                                                                                                                                                                                                                                                                                                                                                                                                                                                                                                                                                                                                                                                                                                                                                                                                                                                                                                                                                                                                                                                                                                                                                                                                                                                                                                                                                                                                                                                                                                                                                                                                                                                                                                                                                                                                                                                                                                                                                                                                                                                                                                                                                                                                                                                                                                                                                                                                                                                                                                                                                                                                                                                                                                                                                                                                                                                                                                                                                                                                                                                                            | elem_count_histogram 
------------+-----------+---------+-----------+-----------+-----------+------------+--------------+------------------+-------------------+------------------+-------------+----------------------------------------------------------------------------------------------------------------------------------------------------------------------------------------------------------------------------------------------------------------------------------------------------------------------------------------------------------------------------------------------------------------------------------------------------------------------------------------------------------------------------------------------------------------------------------------------------------------------------------------------------------------------------------------------------------------------------------------------------------------------------------------------------------------------------------------------------------------------------------------------------------------------------------------------------------------------------------------------------------------------------------------------------------------------------------------------------------------------------------------------------------------------------------------------------------------------------------------------------------------------------------------------------------------------------------------------------------------------------------------------------------------------------------------------------------------------------------------------------------------------------------------------------------------------------------------------------------------------------------------------------------------------------------------------------------------------------------------------------------------------------------------------------------------------------------------------------------------------------------------------------------------------------------------------------------------------------------------------------------------------------------------------------------------------------------------------------------------------------------------------------------------------------------------------------------------------------------------------------------------------------------------------------------------------------------------------------------------------------------------------------------------------------------------------------------------------------------------------------------------------------------------------------------------------------------------------------------------------------------------------------------------------------------------------------------------------------------------------------------------------------------------------------------------------------------------------------------------------------------------------------------------------------------------------------------------------------------------------------------------------------------------------------------------------------------------------------------------------------------------------------------------------------------------------------------------------------------------------------------------------------------------------------------------------------------------------------------------------------------------------------------------------------------------------------------------------------------------------------------------------------------------------------------------------------------------------------------------------------------------------------------------------------------------------------------------------------------------------------------------------------------------------------------------------------------------------------------------------------------------------------------------------------------------------------------------------------------------------------------------------------------------------------------------------------------------------------------------------------------------------------------------------------------------------------------------------------------------------------------------------------------------------------------------------------------------------------------------------------------------------------------------------------------------------------------------------------------------------------------------------------------------------------------------------+----------------------------------------------------------------------------------------------------------------------------------------------------------------------------------------------------------------------------------------------------------------------------------------------------------------------------------------------------------------------------------------------------------------------------------------------------------------------------------------------------------------------------------------------------------------------------------------------------------------------------------------------------------------------------------------------------------------------------------------------------------------------------------------------------------------------------------------------------------------------------------------------------------------------------------------------------------------------------------------------------------------------------------------------------------------------------------------------------------------------------------------------------------------------------------------------------------------------------------------------------------------------------------------------------------------------------------------------------------------------------------------------------------------------------------------------------------------------------------------------------------------------------------------------------------------------------------------------------------------------------------------------------------------------------------------------------------------------------------------------------------------------------------------------------------------------------------------------------------------------------------------------------------------------------------------------------------------------------------------------------------------------------------------------------------------------------------------------------------------------------------------------------------------------------------------------------------------------------------------------------------------------------------------------------------------------------------------------------------------------------------------------------------------------------------------------------------------------------------------------------------------------------------------------------------------------------------------------------------------------------------------------------------------------------------------------------------------------------------------------------------------------------------------------------------------------------------------------------------------------------------------------------------------------------------------------------------------------------------------------------------------------------------------------------------------------------------------------------------------------------------------------------------------------------------------------------------------------------------------------------------------------------------------------------------------------------------------------------------------------------------------------------------------------------------------------------------------------------------------------------------------------------------------------------------------------------------------------------------------------------------------------------------------------------------------------------------------------------------------------------------------------------------------------------------------------------------------------------------------------------------------------------------------------------------------------------------------------------------------------------------------------------------------------------------------------------------------------------------------------------------------------------------------------------------------------------------------------------------------------------------------------------------------------------------------------------------------------------------------------------------------------------------------------------------------------------------------------------------------------------------------------------------------------------------------------------------------------------------------------------------------------------------------------------------------------------------------------------------------------------------------------------------------------------------------------------------------------------------------------------------------------------------------------------------------------------------------------------------------------------------------------------------------------------------------------------------------------------------------------------------------------------------------------------------------------------------------------------------------------------------------------------------------------------------------------------------------------------------------------------------------------------------------------------------------------------------------------------------------------------------------------------------------------------------------------------------------------------------------------------------------------------------------------------------------------------------------------------------------------------------------------------------------------------------------------------------------------------------------------------------------------------------------------------------------------------------------------------------------------------------------------------------------------------------------------------------------------------------------------------------------------------------------------------------------------------------------------------------------------------------------------------------------------------------------------------------------------------------------------------------------------------------------------------------------------+----------------------
 public     | tgin122   | tv      | f         |         0 |       138 |         -1 |            0 |                  |                   |                  |             | {a,-u,-w,00,01,03,06,07,08,09,0@,10,11,12,13,14,16,19,20,21,31,33,34,35,38,40,43,44,45,51,54,60,62,63,66,6x,70,76,83,85,88,8@,90,92,96,98,99,@1,@s,a2,ac,ad,ag,ak,al,am,an,ap,ar,as,at,av,ay,ba,be,bi,br,bu,by,ca,ce,ch,ck,cl,co,ct,cu,da,de,di,do,e-,ea,ec,ed,ee,ef,eh,ei,el,em,en,ep,er,es,et,eu,ev,ew,ex,fe,fi,fl,fo,ft,gc,ge,gi,gr,gs,gu,ha,he,hi,ho,hu,hy,i2,ic,id,ie,if,ig,il,im,in,io,ir,is,it,iv,ja,jw,ke,kn,l6,la,ld,le,li,ll,lo,ls,lu,lw,ly,ma,me,mi,mo,my,n@,nc,nd,ne,ng,ni,nl,no,nr,nt,ny,o-,oa,oc,of,og,oh,oi,ok,ol,om,on,oo,op,or,ot,ou,ow,pa,pe,ph,pi,pl,po,pp,pr,ql,ra,rc,re,ri,rk,rl,rn,ro,rp,rr,rs,rt,ru,ry,sa,sb,se,sh,si,sk,so,ss,st,sy,ta,te,th,ti,to,tr,ts,ud,ue,ul,um,un,up,ur,us,ut,ve,vi,w0,wa,wh,wi,wo,wz,xp,y2,ye,ys,yw,zh,zj,>甘,e长,mira,sara,京a,冀a,吉a,如>,沈y,津a,鲁k,ql660,ql661,一个,一只,一天,一方,一条,一样,一棵,一美,丈夫,三个,上下,上了,上帝,上带,上的,下长,不同,不睡,不要,与主,与日,世上,东岸,两个,两点,个名,个和,个女,个妻,个孩,个王,个现,中在,中第,为了,为她,为潘,主句,之后,之海,也受,习惯,了一,了埃,了宙,了祭,了避,了黑,予她,二个,于使,于看,亚洲,人女,人是,人有,人类,人结,从句,从每,他令,他们,他献,他的,令儿,以结,们飞,伊诺,众对,众神,但要,位神,位迷,住主,使国,侵袭,便由,信的,修补,俱增,候的,偷窃,儿子,克斯,免宾,公众,公羊,关注,关键,分词,分译,分述,到了,到后,到毁,到浩,前公,前置,前飞,勒之,勒拉,勒由,北部,厄忒,受到,古时,句中,句分,句的,句结,另一,只浑,叫伊,叫赫,可怜,可用,合汉,同时,同的,名叫,名称,后为,后母,后面,向前,和一,和亚,和第,和赫,因为,因植,因此,国也,国王,圣树,在一,在分,在此,在爱,在翻,在背,在这,在那,坏女,埃厄,基因,塑一,塔玛,处死,处理,多拉,大海,天火,夫耳,头晕,契斯,女人,女像,女郎,她不,她为,她从,好就,如河,如玻,如青,妻子,婚后,子受,子和,子法,子被,子赫,子驮,孩子,宙斯,定语,宜将,害的,宾语,对人,对男,对转,将两,将他,将公,将第,将羊,将表,将要,将该,将金,尔契,就如,岸的,峡便,峡时,希腊,帝派,带走,并派,并要,并请,开欧,开第,张三,当他,当国,得到,忍虐,忒斯,怜的,性瘟,意与,成句,手段,托斯,抓住,拉旁,掉进,推上,搭配,敌意,整个,斯以,斯和,斯国,斯对,斯将,斯托,斯是,斯有,斯用,斯称,斯继,方法,方面,旁海,日俱,时不,时候,是位,是要,是这,晕目,晨的,更符,最终,有一,有两,有害,条不,条件,来分,来到,来将,来用,构为,树上,样处,样对,样更,棵圣,植物,次灾,欧洲,正在,此外,此宙,此时,此而,死了,残忍,段的,毁灭,母残,每位,毛的,毛送,毛钉,汉语,汪玲,河溪,法手,法瑞,泥塑,注集,洋古,洋而,洲和,洲的,派了,浑身,浩瀚,海东,海峡,海洋,海淹,混淆,淹死,清澈,溪般,潘多,瀚的,火之,灭性,灵那,灾害,爱轻,片海,物的,特点,献给,王国,王将,王相,王离,王阿,玛斯,现在,玲沁,玻璃,理更,理解,瑞克,璃般,甘露,用泥,由于,由此,男人,疫的,瘟疫,的丈,的主,的侵,的修,的儿,的公,的关,的名,的坏,的孩,的搭,的敌,的海,的现,的理,的礼,的科,的第,的结,的罪,的美,的表,的龙,目前,目眩,相信,看到,看护,着法,着金,睡觉,示方,礼物,神灵,神赠,祭坛,祸首,科尔,称叫,称她,窃天,符合,第一,第三,第二,类的,终于,终掉,结婚,结束,结构,给了,给宙,继续,续向,罪魁,置译,羊来,羊毛,羊献,羊驮,美女,美好,翻译,而头,而将,而来,耳边,背上,腊北,般清,般芳,般透,般香,色公,色羊,芳香,草般,菲斯,虐待,补词,表示,表达,被处,被推,要将,要抓,要被,觉的,解析,解的,词结,词过,译出,译成,译时,该句,该定,语习,语从,语的,请众,诺在,诺的,谗言,负责,责看,赠予,赫勒,赫菲,走了,身上,转基,轻信,边进,达习,过长,过隔,这两,这样,这次,这片,进大,进谗,迷人,送给,透明,逻辑,避免,那里,部国,里得,金羊,金色,钉在,键是,长定,长着,阿塔,隔开,集中,露般,青草,面有,飞去,飞过,香甜,驮在,驮着,魁祸,黑海,龙负,connect,inflect,hypotaxi,parataxi,来实现,的英语,13654333333,13754333333,不易理解,也就是说,化整为零,化零为整,十分灵活,环环相扣,而汉语则,mm20@sohu.com,sara20@sohu.com,后置变前置,汉语重义合,被动变主动,140110199607022076,140110199608012076,宜作为分句处理,也不符合汉语习惯,则会因修饰语太长,和词尾的曲折变化,常习惯于后置语序,第二个分句如将定,英语多用被动语态,英语语言结构重形合,预设等形合手段组织,在修饰位置上可前可后,语分句处理为汉语前置,这在科技英语中尤为如此,而汉语则多用短句和简单句,了解英语和汉语这些造句差异,短从句结构变单独句子或相反,英语的句子组织通常通过连接词,这些差异就形成了王力先生所谓,以下结合本人在教学中遇到的例子,英语句子通过表示各种关系如因果,根发端所需的生长素水平抑制根的伸长,第一个分句宜将被动语态译为主动语态,汉语则较少使用连接词和受语法规则约束,而利用iaa则是克服这个问题的一种有用方法,英语注重使用各种短语作为句子的构成单位,说说如何对生物类专业英语长句和复杂句翻译进行翻译处理,可以形成像树枝一样包孕许多修饰成分和分句的长句和复杂句,因为iaa能在培养组织中迅速降解而无需提供第二种生根培养基,就可在英语长句和复杂句的理解和翻译中有意识地将英语句子按照汉语造句特点进行转化处理,利用能在培养组织中迅速降解而无需提供第二种生根培养基的iaa则是克服这个问题的一种有用方法} | {.333333,.166667,.166667,.333333,.5,.166667,.333333,.5,.333333,.166667,.166667,.666667,.666667,.5,.666667,.5,.5,.666667,.666667,.166667,.166667,.666667,.166667,.166667,.333333,.666667,.666667,.166667,.166667,.166667,.5,.5,.166667,.5,.5,.166667,.166667,.5,.166667,.333333,.166667,.333333,.166667,.166667,.5,.166667,.666667,.5,.166667,.166667,.333333,.333333,.166667,.333333,.333333,.333333,.666667,.333333,.333333,.166667,.333333,.333333,.166667,.166667,.333333,.166667,.166667,.166667,.166667,.333333,.333333,.333333,.166667,.166667,.666667,.166667,.333333,.166667,.166667,.333333,.166667,.166667,.333333,.166667,.333333,.166667,.166667,.166667,.166667,.333333,.166667,.5,.166667,.5,.333333,.333333,.166667,.166667,.333333,.166667,.166667,.166667,.166667,.166667,.166667,.166667,.166667,.166667,.166667,.166667,.166667,.5,.333333,.333333,.333333,.166667,.166667,.166667,.333333,.166667,.333333,.166667,.166667,.333333,.333333,.5,.5,.166667,.333333,.166667,.166667,.166667,.166667,.333333,.166667,.5,.333333,.333333,.333333,.333333,.166667,.333333,.333333,.166667,.166667,.166667,.333333,.166667,.166667,.333333,.166667,.166667,.5,.5,.333333,.5,.166667,.166667,.333333,.166667,.5,.166667,.166667,.166667,.166667,.333333,.166667,.166667,.166667,.166667,.333333,.666667,.5,.166667,.166667,.333333,.166667,.333333,.166667,.333333,.333333,.166667,.166667,.333333,.166667,.333333,.333333,.5,.333333,.166667,.5,.166667,.166667,.166667,.333333,.333333,.166667,.333333,.166667,.166667,.166667,.166667,.333333,.166667,.333333,.166667,.5,.166667,.5,.333333,.333333,.166667,.166667,.333333,.333333,.166667,.333333,.333333,.333333,.166667,.166667,.166667,.166667,.166667,.166667,.5,.5,.166667,.166667,.333333,.166667,.166667,.333333,.166667,.333333,.166667,.166667,.166667,.166667,.333333,.166667,.166667,.166667,.166667,.166667,.166667,.166667,.166667,.166667,.166667,.166667,.166667,.166667,.166667,.166667,.166667,.666667,.166667,.166667,.166667,.166667,.166667,.166667,.166667,.166667,.166667,.166667,.166667,.166667,.166667,.166667,.166667,.166667,.166667,.166667,.166667,.166667,.166667,.166667,.166667,.166667,.166667,.166667,.166667,.166667,.166667,.166667,.166667,.166667,.166667,.166667,.166667,.166667,.333333,.333333,.166667,.166667,.333333,.333333,.166667,.166667,.166667,.166667,.166667,.166667,.166667,.166667,.166667,.166667,.166667,.166667,.166667,.166667,.166667,.166667,.166667,.166667,.166667,.166667,.166667,.166667,.166667,.166667,.166667,.166667,.166667,.166667,.166667,.166667,.166667,.166667,.166667,.166667,.166667,.166667,.166667,.166667,.166667,.333333,.166667,.166667,.166667,.166667,.166667,.166667,.166667,.166667,.166667,.333333,.166667,.166667,.166667,.166667,.166667,.166667,.166667,.166667,.166667,.166667,.166667,.166667,.166667,.166667,.166667,.333333,.166667,.166667,.166667,.166667,.166667,.166667,.166667,.333333,.166667,.166667,.166667,.166667,.166667,.166667,.166667,.166667,.166667,.166667,.166667,.166667,.166667,.166667,.166667,.166667,.166667,.166667,.166667,.166667,.166667,.166667,.166667,.166667,.166667,.166667,.166667,.166667,.166667,.166667,.166667,.166667,.166667,.166667,.166667,.166667,.166667,.166667,.166667,.333333,.166667,.166667,.166667,.166667,.166667,.166667,.166667,.166667,.166667,.166667,.166667,.166667,.166667,.166667,.166667,.166667,.166667,.166667,.333333,.166667,.166667,.333333,.166667,.166667,.166667,.166667,.166667,.166667,.166667,.166667,.166667,.166667,.166667,.166667,.166667,.166667,.166667,.166667,.166667,.166667,.166667,.166667,.166667,.166667,.166667,.166667,.166667,.166667,.166667,.166667,.166667,.166667,.166667,.166667,.166667,.166667,.166667,.166667,.166667,.166667,.166667,.166667,.166667,.166667,.166667,.166667,.166667,.166667,.166667,.166667,.166667,.166667,.166667,.166667,.166667,.166667,.166667,.166667,.166667,.166667,.166667,.166667,.166667,.166667,.166667,.166667,.166667,.166667,.166667,.333333,.166667,.166667,.166667,.166667,.166667,.166667,.166667,.166667,.166667,.166667,.166667,.166667,.166667,.166667,.166667,.166667,.166667,.166667,.166667,.166667,.166667,.166667,.166667,.166667,.166667,.166667,.166667,.166667,.166667,.166667,.166667,.166667,.166667,.333333,.166667,.166667,.166667,.166667,.166667,.166667,.166667,.166667,.166667,.166667,.166667,.166667,.166667,.166667,.166667,.166667,.166667,.166667,.166667,.166667,.166667,.166667,.166667,.166667,.166667,.166667,.166667,.166667,.166667,.166667,.166667,.166667,.166667,.166667,.166667,.166667,.166667,.166667,.166667,.166667,.166667,.166667,.166667,.166667,.166667,.166667,.166667,.166667,.166667,.166667,.166667,.166667,.166667,.166667,.166667,.166667,.166667,.166667,.166667,.166667,.166667,.166667,.166667,.166667,.166667,.166667,.166667,.166667,.166667,.166667,.166667,.166667,.166667,.166667,.166667,.166667,.166667,.166667,.166667,.166667,.166667,.166667,.166667,.166667,.166667,.166667,.166667,.166667,.166667,.166667,.166667,.166667,.166667,.333333,.5,.166667,.166667,.166667,.166667,.166667,.166667,.166667,.333333,.166667,.166667,.166667,.166667,.166667,.166667,.166667,.166667,.166667,.166667,.166667,.166667,.5,.166667,.166667,.166667,.166667,.166667,.166667,.166667,.166667,.166667,.166667,.166667,.166667,.166667,.166667,.166667,.166667,.166667,.166667,.166667,.166667,.166667,.5,.166667,.166667,.166667,.5,.166667,.166667,.166667,.166667,.166667,.333333,.333333,.166667,.166667,.166667,.333333,.166667,.166667,.166667,.166667,.166667,.166667,.166667,.166667,.166667,.166667,.166667,.166667,.166667,.166667,.166667,.166667,.166667,.166667,.333333,.166667,.166667,.166667,.166667,.166667,.166667,.166667,.166667,.166667,.333333,.166667,.166667,.166667,.166667,.166667,.166667,.166667,.166667,.166667,.166667,.166667,.166667,.166667,.166667,.166667,.166667,.166667,.166667,.166667,.166667,.166667,.166667,.166667,.166667,.166667,.166667,.166667,.166667,.166667,.166667,.166667,.166667,.166667,.166667,.166667,.166667,.166667,.166667,.166667,.166667,.166667,.166667,.166667,.166667,.166667,.166667,.166667,.166667,.166667,.166667,.166667,.166667,.166667,.166667,.166667,.166667,.166667,.166667,.166667,.166667,.166667,.166667,.166667,.166667,.166667,.166667,.166667,.166667,.166667,.166667,.166667,.166667,.166667,.166667,.666667} | 
(1 row)

select attname,avg_width,n_distinct,histogram_bounds from pg_stats where tablename='tgin122_idx1';
 attname | avg_width | n_distinct |           histogram_bounds            
---------+-----------+------------+---------------------------------------
 substr  |         9 |         -1 | {ara20,hangs,i2008,inda2,m20@s,my200}
(1 row)

drop table tgin122 cascade;
set client_min_messages=FATAL;
CREATE ROLE account1 IDENTIFIED BY '1q2w3e4r!';
CREATE ROLE account2 IDENTIFIED BY '1q2w3e4r@';
ALTER ROLE account2 IDENTIFIED BY '1q2w3e4r#' REPLACE '1q2w3e4r@';
set client_min_messages=FATAL;
ALTER ROLE account2 ACCOUNT UNLOCK;
ALTER ROLE account2 ACCOUNT LOCK;
set client_min_messages=FATAL;
ALTER ROLE account2 ACCOUNT UNLOCK;
drop user account1;
drop user account2;
\c
CREATE VIEW street AS
   SELECT r.name, r.thepath, c.cname AS cname
   FROM ONLY road r, real_city c
   WHERE c.outline ## r.thepath;
ERROR:  relation "road" does not exist on datanode1
LINE 3:    FROM ONLY road r, real_city c
                     ^
CREATE VIEW iexit AS
   SELECT ih.name, ih.thepath,
	interpt_pp(ih.thepath, r.thepath) AS exit
   FROM ihighway ih, ramp r
   WHERE ih.thepath ## r.thepath;
ERROR:  relation "ihighway" does not exist on datanode1
LINE 4:    FROM ihighway ih, ramp r
                ^
CREATE VIEW toyemp AS
   SELECT name, age, location, 12*salary AS annualsal
   FROM emp;
ERROR:  relation "emp" does not exist on datanode1
LINE 3:    FROM emp;
                ^
-- Test comments
COMMENT ON VIEW noview IS 'no view';
ERROR:  relation "noview" does not exist
COMMENT ON VIEW toyemp IS 'is a view';
ERROR:  relation "toyemp" does not exist
COMMENT ON VIEW toyemp IS NULL;
ERROR:  relation "toyemp" does not exist
--
-- CREATE OR REPLACE VIEW
--
CREATE TABLE heap_modify_tuple_5 (a int, b int);
COPY heap_modify_tuple_5 FROM stdin;
CREATE OR REPLACE VIEW viewtest AS
	SELECT * FROM heap_modify_tuple_5;
CREATE OR REPLACE VIEW viewtest AS
	SELECT * FROM heap_modify_tuple_5 WHERE a > 10;
drop table heap_modify_tuple_5 cascade;
NOTICE:  drop cascades to view viewtest
create table test_comment_normal_view_column_t(id1 int,id2 int);
create or replace view test_comment_normal_view_column_v as select * from test_comment_normal_view_column_t;
create temp table test_comment_temp_view_column_t(id1 int,id2 int);
create or replace temp view test_comment_temp_view_column_v as select * from test_comment_temp_view_column_t;
comment on column test_comment_normal_view_column_t.id1 is 'this is normal table';
comment on column test_comment_normal_view_column_v.id1 is 'this is normal view';
comment on column test_comment_temp_view_column_t.id1 is 'this is temp table';
comment on column test_comment_temp_view_column_v.id1 is 'this is temp view';
\d+ test_comment_normal_view_column_t
               Table "public.test_comment_normal_view_column_t"
 Column |  Type   | Modifiers | Storage | Stats target |     Description      
--------+---------+-----------+---------+--------------+----------------------
 id1    | integer |           | plain   |              | this is normal table
 id2    | integer |           | plain   |              | 
Has OIDs: no
Options: orientation=row, compression=no

\d+ test_comment_normal_view_column_v
       View "public.test_comment_normal_view_column_v"
 Column |  Type   | Modifiers | Storage |     Description     
--------+---------+-----------+---------+---------------------
 id1    | integer |           | plain   | this is normal view
 id2    | integer |           | plain   | 
View definition:
 SELECT  *
   FROM test_comment_normal_view_column_t;

comment on column test_comment_normal_view_column_t.id1 is 'this is normal table too';
drop table test_comment_normal_view_column_t cascade;
NOTICE:  drop cascades to view test_comment_normal_view_column_v
CREATE USER regression_user1 PASSWORD 'gauss@123';
CREATE USER regression_user2 PASSWORD 'gauss@123';
GRANT ALL ON regression_user0.deptest1 TO regression_user1;
ERROR:  schema "regression_user0" does not exist
SET SESSION AUTHORIZATION regression_user1 PASSWORD 'gauss@123';
CREATE TABLE deptest (a int primary key, b text);
NOTICE:  CREATE TABLE / PRIMARY KEY will create implicit index "deptest_pkey" for table "deptest"
CREATE TABLE deptest2 (f1 int);
-- make a serial column the hard way
CREATE SEQUENCE ss1;
ALTER TABLE deptest2 ALTER f1 SET DEFAULT nextval('ss1');
ALTER SEQUENCE ss1 OWNED BY deptest2.f1;
drop table deptest cascade;
drop table deptest2 cascade;
RESET SESSION AUTHORIZATION;
REASSIGN OWNED BY regression_user1 TO regression_user2;
drop user regression_user1 cascade;
drop user regression_user2 cascade;
set work_mem = '3MB';
create function report_guc(text) returns text as
$$ select current_setting($1) $$ language sql
set work_mem = '1MB';
select report_guc('work_mem'), current_setting('work_mem');
 report_guc | current_setting 
------------+-----------------
 1MB        | 3MB
(1 row)

alter function report_guc(text) set work_mem = '2MB';
select report_guc('work_mem'), current_setting('work_mem');
 report_guc | current_setting 
------------+-----------------
 2MB        | 3MB
(1 row)

alter function report_guc(text) reset all;
select report_guc('work_mem'), current_setting('work_mem');
 report_guc | current_setting 
------------+-----------------
 3MB        | 3MB
(1 row)

drop function report_guc;
