set enable_opfusion = on;
SELECT DISTINCT typtype, typinput
FROM pg_type AS p1
WHERE p1.typtype not in ('b', 'p')
ORDER BY 1;
 typtype | typinput  
---------+-----------
 c       | record_in
 d       | domain_in
 r       | range_in
(3 rows)

create table slot_getattr_normal_view_column_t(id1 int,id2 int);
create or replace view slot_getattr_normal_view_column_v as select * from slot_getattr_normal_view_column_t;
create temp table slot_getattr_comment_view_column_t(id1 int,id2 int);
create or replace temp view slot_getattr_comment_view_column_v as select * from slot_getattr_comment_view_column_t;
comment on column slot_getattr_normal_view_column_t.id1 is 'this is normal table';
comment on column slot_getattr_normal_view_column_v.id1 is 'this is normal view';
comment on column slot_getattr_comment_view_column_t.id1 is 'this is temp table';
comment on column slot_getattr_comment_view_column_v.id1 is 'this is temp view';
\d+ slot_getattr_normal_view_column_t
               Table "public.slot_getattr_normal_view_column_t"
 Column |  Type   | Modifiers | Storage | Stats target |     Description      
--------+---------+-----------+---------+--------------+----------------------
 id1    | integer |           | plain   |              | this is normal table
 id2    | integer |           | plain   |              | 
Has OIDs: no
Options: orientation=row, compression=no

\d+ slot_getattr_normal_view_column_v
       View "public.slot_getattr_normal_view_column_v"
 Column |  Type   | Modifiers | Storage |     Description     
--------+---------+-----------+---------+---------------------
 id1    | integer |           | plain   | this is normal view
 id2    | integer |           | plain   | 
View definition:
 SELECT  *
   FROM slot_getattr_normal_view_column_t;

drop view slot_getattr_normal_view_column_v cascade;
drop table slot_getattr_normal_view_column_t cascade;
drop view slot_getattr_comment_view_column_v cascade;
drop table slot_getattr_comment_view_column_t cascade;
CREATE TABLE slot_getattr_s (rf_a SERIAL PRIMARY KEY,
	b INT);
NOTICE:  CREATE TABLE will create implicit sequence "slot_getattr_s_rf_a_seq" for serial column "slot_getattr_s.rf_a"
NOTICE:  CREATE TABLE / PRIMARY KEY will create implicit index "slot_getattr_s_pkey" for table "slot_getattr_s"
CREATE TABLE slot_getattr (a SERIAL PRIMARY KEY,
	b INT,
	c TEXT,
	d TEXT
	);
NOTICE:  CREATE TABLE will create implicit sequence "slot_getattr_a_seq" for serial column "slot_getattr.a"
NOTICE:  CREATE TABLE / PRIMARY KEY will create implicit index "slot_getattr_pkey" for table "slot_getattr"
CREATE INDEX slot_getattr_b ON slot_getattr (b);
CREATE INDEX slot_getattr_c ON slot_getattr (c);
CREATE INDEX slot_getattr_c_b ON slot_getattr (c,b);
CREATE INDEX slot_getattr_b_c ON slot_getattr (b,c);
INSERT INTO slot_getattr_s (b) VALUES (0);
INSERT INTO slot_getattr_s (b) SELECT b FROM slot_getattr_s;
INSERT INTO slot_getattr_s (b) SELECT b FROM slot_getattr_s;
INSERT INTO slot_getattr_s (b) SELECT b FROM slot_getattr_s;
INSERT INTO slot_getattr_s (b) SELECT b FROM slot_getattr_s;
INSERT INTO slot_getattr_s (b) SELECT b FROM slot_getattr_s;
drop table slot_getattr_s cascade;
INSERT INTO slot_getattr (b, c) VALUES (11, 'once');
INSERT INTO slot_getattr (b, c) VALUES (10, 'diez');
INSERT INTO slot_getattr (b, c) VALUES (31, 'treinta y uno');
INSERT INTO slot_getattr (b, c) VALUES (22, 'veintidos');
INSERT INTO slot_getattr (b, c) VALUES (3, 'tres');
INSERT INTO slot_getattr (b, c) VALUES (20, 'veinte');
INSERT INTO slot_getattr (b, c) VALUES (23, 'veintitres');
INSERT INTO slot_getattr (b, c) VALUES (21, 'veintiuno');
INSERT INTO slot_getattr (b, c) VALUES (4, 'cuatro');
INSERT INTO slot_getattr (b, c) VALUES (14, 'catorce');
INSERT INTO slot_getattr (b, c) VALUES (2, 'dos');
INSERT INTO slot_getattr (b, c) VALUES (18, 'dieciocho');
INSERT INTO slot_getattr (b, c) VALUES (27, 'veintisiete');
INSERT INTO slot_getattr (b, c) VALUES (25, 'veinticinco');
INSERT INTO slot_getattr (b, c) VALUES (13, 'trece');
INSERT INTO slot_getattr (b, c) VALUES (28, 'veintiocho');
INSERT INTO slot_getattr (b, c) VALUES (32, 'treinta y dos');
INSERT INTO slot_getattr (b, c) VALUES (5, 'cinco');
INSERT INTO slot_getattr (b, c) VALUES (29, 'veintinueve');
INSERT INTO slot_getattr (b, c) VALUES (1, 'uno');
INSERT INTO slot_getattr (b, c) VALUES (24, 'veinticuatro');
INSERT INTO slot_getattr (b, c) VALUES (30, 'treinta');
INSERT INTO slot_getattr (b, c) VALUES (12, 'doce');
INSERT INTO slot_getattr (b, c) VALUES (17, 'diecisiete');
INSERT INTO slot_getattr (b, c) VALUES (9, 'nueve');
INSERT INTO slot_getattr (b, c) VALUES (19, 'diecinueve');
INSERT INTO slot_getattr (b, c) VALUES (26, 'veintiseis');
INSERT INTO slot_getattr (b, c) VALUES (15, 'quince');
INSERT INTO slot_getattr (b, c) VALUES (7, 'siete');
INSERT INTO slot_getattr (b, c) VALUES (16, 'dieciseis');
INSERT INTO slot_getattr (b, c) VALUES (8, 'ocho');
-- This entry is needed to test that TOASTED values are copied correctly.
INSERT INTO slot_getattr (b, c, d) VALUES (6, 'seis', repeat('xyzzy', 100000));
CLUSTER slot_getattr_c ON slot_getattr;
INSERT INTO slot_getattr (b, c) VALUES (1111, 'this should fail');
ALTER TABLE slot_getattr CLUSTER ON slot_getattr_b_c;
-- Try turning off all clustering
ALTER TABLE slot_getattr SET WITHOUT CLUSTER;
drop table slot_getattr cascade;
CREATE USER clstr_user PASSWORD 'gauss@123';
CREATE TABLE slot_getattr_1 (a INT PRIMARY KEY);
NOTICE:  CREATE TABLE / PRIMARY KEY will create implicit index "slot_getattr_1_pkey" for table "slot_getattr_1"
CREATE TABLE slot_getattr_2 (a INT PRIMARY KEY);
NOTICE:  CREATE TABLE / PRIMARY KEY will create implicit index "slot_getattr_2_pkey" for table "slot_getattr_2"
CREATE TABLE slot_getattr_3 (a INT PRIMARY KEY);
NOTICE:  CREATE TABLE / PRIMARY KEY will create implicit index "slot_getattr_3_pkey" for table "slot_getattr_3"
ALTER TABLE slot_getattr_1 OWNER TO clstr_user;
ALTER TABLE slot_getattr_3 OWNER TO clstr_user;
GRANT SELECT ON slot_getattr_2 TO clstr_user;
INSERT INTO slot_getattr_1 VALUES (2);
INSERT INTO slot_getattr_1 VALUES (1);
INSERT INTO slot_getattr_2 VALUES (2);
INSERT INTO slot_getattr_2 VALUES (1);
INSERT INTO slot_getattr_3 VALUES (2);
INSERT INTO slot_getattr_3 VALUES (1);
-- "CLUSTER <tablename>" on a table that hasn't been clustered
CLUSTER slot_getattr_1_pkey ON slot_getattr_1;
CLUSTER slot_getattr_2 USING slot_getattr_2_pkey;
SELECT * FROM slot_getattr_1 UNION ALL
  SELECT * FROM slot_getattr_2 UNION ALL
  SELECT * FROM slot_getattr_3
  ORDER BY 1;
 a 
---
 1
 1
 1
 2
 2
 2
(6 rows)

drop table slot_getattr_1;
drop table slot_getattr_2;
drop table slot_getattr_3;
drop user clstr_user cascade;
create schema slot_getattr_5;
set current_schema = slot_getattr_5;
set time zone 'PRC';
set codegen_cost_threshold=0;
CREATE TABLE slot_getattr_5.LLVM_VECEXPR_TABLE_01(
    col_int	int,
    col_bigint	bigint,
    col_float	float4,
    col_float8	float8,
    col_char	char(10),
    col_bpchar	bpchar,
    col_varchar	varchar,
    col_text1	text,
    col_text2   text,
    col_num1	numeric(10,2),
    col_num2	numeric,
    col_date	date,
    col_time    timestamp
)with(orientation=column)
partition by range (col_int)
(
    partition llvm_vecexpr_table_01_01 values less than (0),
    partition llvm_vecexpr_table_01_02 values less than (100),
    partition llvm_vecexpr_table_01_03 values less than (500),
    partition llvm_vecexpr_table_01_04 values less than (maxvalue)
);
COPY LLVM_VECEXPR_TABLE_01(col_int, col_bigint, col_float, col_float8, col_char, col_bpchar, col_varchar, col_text1, col_text2, col_num1, col_num2, col_date, col_time) FROM stdin;
CREATE TABLE slot_getattr_5.LLVM_VECEXPR_TABLE_02(
    col_bool	bool,
    col_sint	int2,
    col_int	int,
    col_bigint	bigint,
    col_char	char(10),
    col_bpchar	bpchar,
    col_varchar	varchar,
    col_text	text,
    col_date	date,
    col_time    timestamp
)with(orientation=column);
create index llvm_index_01 on llvm_vecexpr_table_02(col_int);
create index llvm_index_02 on llvm_vecexpr_table_02(col_char);
create index llvm_index_03 on llvm_vecexpr_table_02(col_varchar);
create index llvm_index_04 on llvm_vecexpr_table_02(col_text);
create index llvm_index_05 on llvm_vecexpr_table_02(col_date);
COPY LLVM_VECEXPR_TABLE_02(col_bool, col_sint, col_int, col_bigint, col_char, col_bpchar, col_varchar, col_text, col_date, col_time) FROM stdin;
analyze llvm_vecexpr_table_01;
analyze llvm_vecexpr_table_02;
select A.col_int, A.col_bigint, A.col_num1, a.col_float8, A.col_num1, a.col_date, 
        (A.col_num1 - A.col_int)/A.col_float8 <= A.col_bigint
        and ( substr(A.col_date, 1, 4) in (select substr(B.col_date, 1, 4) 
                                                from llvm_vecexpr_table_02 as B 
                                                ))
    from llvm_vecexpr_table_01 as A 
    order by 1, 2, 3, 4, 5, 6, 7;
 col_int | col_bigint | col_num1 | col_float8 | col_num1 |         col_date         | ?column? 
---------+------------+----------+------------+----------+--------------------------+----------
    -700 |   58964785 |     9.36 |      1.458 |     9.36 |                          | 
    -505 |          1 |   147.00 |            |   147.00 | Sat Jan 01 01:01:01 2000 | 
     -16 | 1345971420 |    -4.24 |       2.15 |    -4.24 | Sun Nov 04 00:00:00 2012 | 
     -10 | 1345971420 |     4.24 |       2.15 |     4.24 | Sun Nov 04 00:00:00 2012 | 
       0 |          0 |    -2.50 |            |    -2.50 |                          | 
       0 |         26 |    -3.20 |      10.25 |    -3.20 |                          | 
       1 |        256 |     3.25 |       3.25 |     3.25 |                          | 
       3 |      12400 |     1.62 |    3.64755 |     1.62 | Mon Oct 09 19:45:37 2017 | t
       5 |      25685 |     7.00 |         25 |     7.00 | Fri Nov 02 00:00:00 2012 | t
       8 |       5879 |     2.58 |       1.36 |     2.58 | Sat Jan 01 00:00:00 2000 | t
       8 |            |          |      30.65 |          |                          | 
       9 |       -128 |     7.00 |     56.123 |     7.00 | Sat Dec 09 19:45:37 2017 | f
      18 |         65 |    24.00 |      78.96 |    24.00 | Sat Jan 01 00:00:00 2000 | t
      25 |          0 |     7.12 |       3.12 |     7.12 | Wed May 09 19:45:37 2018 | t
      27 |        256 |     2.10 |      63.27 |     2.10 | Fri Mar 09 19:45:37 2018 | t
      36 |         59 |     2.50 |            |     2.50 | Thu Feb 26 02:15:01 2015 | 
      36 |       5879 |     2.50 |            |     2.50 | Thu Feb 26 02:15:01 2015 | 
      64 |      -2566 |    65.00 |        2.7 |    65.00 | Sat Nov 03 00:00:00 2012 | f
      64 |          0 |    65.00 |        2.7 |    65.00 | Sat Nov 03 00:00:00 2012 | f
      81 |            |   145.00 |       3.65 |   145.00 | Tue Jan 09 19:45:37 2018 | 
     417 |          2 |    11.50 |       .256 |    11.50 |                          | 
     652 |      25489 |          |      1.365 |          | Fri Nov 02 00:00:00 2012 | 
    1001 |      78956 |     6.36 |      2.568 |     6.36 | Mon Oct 09 19:45:37 2017 | t
    2005 |      12400 | 12546.00 |        2.7 | 12546.00 | Sat Sep 09 19:45:37 2017 | t
         |        256 |    78.12 |       4.25 |    78.12 | Mon Oct 09 19:45:37 2017 | 
         |            |          |            |          |                          | 
(26 rows)

drop schema slot_getattr_5 cascade;
NOTICE:  drop cascades to 2 other objects
DETAIL:  drop cascades to table llvm_vecexpr_table_01
drop cascades to table llvm_vecexpr_table_02
reset search_path;
create type type_array as (
id int,
name varchar(50),
score decimal(5,2),
create_time timestamp
);
create table slot_getattr_7(a serial, b type_array[])
partition by range (a)
(partition p1 values less than(100),partition p2 values less than(maxvalue));
NOTICE:  CREATE TABLE will create implicit sequence "slot_getattr_7_a_seq" for serial column "slot_getattr_7.a"
create table slot_getattr_8(a serial, b type_array[]);
NOTICE:  CREATE TABLE will create implicit sequence "slot_getattr_8_a_seq" for serial column "slot_getattr_8.a"
insert into slot_getattr_7(b) values('{}');
insert into slot_getattr_7(b) values(array[cast((1,'test',12,'2018-01-01') as type_array),cast((2,'test2',212,'2018-02-01') as type_array)]);
analyze slot_getattr_7;
insert into slot_getattr_8(b) values('');
insert into slot_getattr_8(b) values(array[cast((1,'test',12,'2018-01-01') as type_array),cast((2,'test2',212,'2018-02-01') as type_array)]);
select * from slot_getattr_8 where b>array[cast((0,'test',12,'') as type_array),cast((1,'test2',212,'') as type_array)]
order by 1,2;
 a |                                                b                                                
---+-------------------------------------------------------------------------------------------------
 2 | {"(1,test,12.00,\"Mon Jan 01 00:00:00 2018\")","(2,test2,212.00,\"Thu Feb 01 00:00:00 2018\")"}
(1 row)

update slot_getattr_7 set b=array[cast((1,'test',12,'2018-01-01') as type_array),cast((2,'test2',212,'2018-02-01') as type_array)] where b='{}';
create index i_array on slot_getattr_7(b) local;
select * from slot_getattr_7 where b>array[cast((0,'test',12,'') as type_array),cast((1,'test2',212,'') as type_array)]
order by 1,2;
 a |                                                b                                                
---+-------------------------------------------------------------------------------------------------
 1 | {"(1,test,12.00,\"Mon Jan 01 00:00:00 2018\")","(2,test2,212.00,\"Thu Feb 01 00:00:00 2018\")"}
 2 | {"(1,test,12.00,\"Mon Jan 01 00:00:00 2018\")","(2,test2,212.00,\"Thu Feb 01 00:00:00 2018\")"}
(2 rows)

alter type type_array add attribute attr bool;
SELECT b, LISTAGG(a, ',') WITHIN GROUP(ORDER BY b DESC)
FROM slot_getattr_7 group by 1;
                                                 b                                                 | listagg 
---------------------------------------------------------------------------------------------------+---------
 {"(1,test,12.00,\"Mon Jan 01 00:00:00 2018\",)","(2,test2,212.00,\"Thu Feb 01 00:00:00 2018\",)"} | 2,1
(1 row)

drop type type_array cascade;
NOTICE:  drop cascades to 2 other objects
DETAIL:  drop cascades to table slot_getattr_7 column b
drop cascades to table slot_getattr_8 column b
drop table slot_getattr_7 cascade;
drop table  slot_getattr_8 cascade;
create schema sche1_slot_getallattrs;
set current_schema = sche1_slot_getallattrs;
create table function_table_01(f1 int, f2 float, f3 text);
insert into function_table_01 values(1,2.0,'abcde'),(2,4.0,'abcde'),(3,5.0,'affde');
insert into function_table_01 values(4,7.0,'aeede'),(5,1.0,'facde'),(6,3.0,'affde');
analyze function_table_01;
CREATE OR REPLACE FUNCTION test_function_immutable RETURNS BIGINT AS
$body$ 
BEGIN
RETURN 3;
END;
$body$
LANGUAGE 'plpgsql'
IMMUTABLE
CALLED ON NULL INPUT
SECURITY INVOKER
COST 100;
select f1,f3 from function_table_01 order by left(f3,test_function_immutable()::INT), f1 limit 3;
 f1 |  f3   
----+-------
  1 | abcde
  2 | abcde
  4 | aeede
(3 rows)

-- test the table with the same name with a pg_catalog table 
create schema sche2_slot_getallattrs;
create table sche2_slot_getallattrs.pg_class(id int);
set search_path=sche2_slot_getallattrs;
insert into pg_class values(1);
ERROR:  null value in column "relnamespace" violates not-null constraint
DETAIL:  Failing row contains (1, null, null, null, null, null, null, null, null, null, null, null, null, null, null, null, null, null, null, null, null, null, null, null, null, null, null, null, null, null, null, null, null, null, null, null, null, null, null).
select * from sche2_slot_getallattrs.pg_class;
 id 
----
(0 rows)

insert into sche2_slot_getallattrs.pg_class values(1);
select * from sche2_slot_getallattrs.pg_class;
 id 
----
  1
(1 row)

delete from sche2_slot_getallattrs.pg_class;
drop schema sche1_slot_getallattrs cascade;
NOTICE:  drop cascades to 2 other objects
DETAIL:  drop cascades to table sche1_slot_getallattrs.function_table_01
drop cascades to function sche1_slot_getallattrs.test_function_immutable()
drop schema sche2_slot_getallattrs cascade;
NOTICE:  drop cascades to table sche2_slot_getallattrs.pg_class
reset search_path;
CREATE TEMP TABLE y (
	col1 text,
	col2 text
);
INSERT INTO y VALUES ('Jackson, Sam', E'\\h');
INSERT INTO y VALUES ('It is "perfect".',E'\t');
INSERT INTO y VALUES ('', NULL);
COPY y TO stdout WITH CSV;
"Jackson, Sam",\h
"It is ""perfect"".",	
,
COPY y TO stdout WITH CSV QUOTE '''' DELIMITER '|';
Jackson, Sam|\h
It is "perfect".|	
|
COPY y TO stdout WITH CSV FORCE QUOTE col2 ESCAPE E'\\' ENCODING 'sql_ascii';
"Jackson, Sam","\\h"
"It is \"perfect\".","	"
,
COPY y TO stdout WITH CSV FORCE QUOTE *;
"Jackson, Sam","\h"
"It is ""perfect"".","	"
,
-- Repeat above tests with new 9.0 option syntax
COPY y TO stdout (FORMAT CSV);
"Jackson, Sam",\h
"It is ""perfect"".",	
,
COPY y TO stdout (FORMAT CSV, QUOTE '''', DELIMITER '|');
Jackson, Sam|\h
It is "perfect".|	
|
COPY y TO stdout (FORMAT CSV, FORCE_QUOTE (col2), ESCAPE E'\\');
"Jackson, Sam","\\h"
"It is \"perfect\".","	"
,
COPY y TO stdout (FORMAT CSV, FORCE_QUOTE *);
"Jackson, Sam","\h"
"It is ""perfect"".","	"
,
\copy y TO stdout (FORMAT CSV)
"Jackson, Sam",\h
"It is ""perfect"".",	
,
\copy y TO stdout (FORMAT CSV, QUOTE '''', DELIMITER '|')
Jackson, Sam|\h
It is "perfect".|	
|
\copy y TO stdout (FORMAT CSV, FORCE_QUOTE (col2), ESCAPE E'\\')
"Jackson, Sam","\\h"
"It is \"perfect\".","	"
,
\copy y TO stdout (FORMAT CSV, FORCE_QUOTE *)
"Jackson, Sam","\h"
"It is ""perfect"".","	"
,
CREATE TEMP TABLE testnl (a int, b text, c int);
COPY testnl FROM stdin CSV;
-- test end of copy marker
CREATE TABLE testeoc (a text);
COPY testeoc FROM stdin CSV;
drop table testnl cascade;
drop table testeoc cascade;
drop table y cascade;
CREATE SCHEMA sche1;
CREATE SCHEMA sche2;
CREATE TABLE sche1.t1(a int) /*distribute BY replication*/;
SET search_path = sche2;
CREATE OR REPLACE FUNCTION sche1.fun_001()
RETURNS setof sche1.t1
AS $$
DECLARE
        row_data t1%ROWTYPE;
        row_name RECORD;
        query_str text;
        BEGIN
                query_str := 'WITH t AS (
				INSERT INTO t1 VALUES (11),(12),(13) RETURNING *
			)
			SELECT * FROM t ORDER BY 1;';
                FOR row_data IN EXECUTE(query_str) LOOP
                      RETURN NEXT row_data;
                END LOOP;
                RETURN;
        END; $$
LANGUAGE 'plpgsql' NOT FENCED;
SELECT sche1.fun_001();
 fun_001 
---------
 (11)
 (12)
 (13)
(3 rows)

DROP SCHEMA sche1 CASCADE;
NOTICE:  drop cascades to 2 other objects
DETAIL:  drop cascades to table sche1.t1
drop cascades to function sche1.fun_001()
DROP SCHEMA sche2 CASCADE;
reset search_path;
CREATE TYPE type_array AS (
id int,
name varchar(50),
score decimal(5,2),
create_time timestamp
);
CREATE TABLE ExecClearTuple_5(a serial, b type_array[])
PARTITION BY RANGE (a)
(PARTITION p1 VALUES LESS THAN(100),PARTITION p2 VALUES LESS THAN(maxvalue));
NOTICE:  CREATE TABLE will create implicit sequence "execcleartuple_5_a_seq" for serial column "execcleartuple_5.a"
INSERT INTO ExecClearTuple_5(b) VALUES('{}');
INSERT INTO ExecClearTuple_5(b) VALUES(ARRAY[CAST((1,'test',12,'2018-01-01') AS type_array),CAST((2,'test2',212,'2018-02-01') AS type_array)]);
analyze ExecClearTuple_5;
UPDATE ExecClearTuple_5 SET b=ARRAY[CAST((1,'test',12,'2018-01-01') AS type_array),CAST((2,'test2',212,'2018-02-01') AS type_array)] WHERE b='{}';
CREATE INDEX i_array ON ExecClearTuple_5(b) local;
SELECT * FROM ExecClearTuple_5 WHERE b>ARRAY[CAST((0,'test',12,'') AS type_array),CAST((1,'test2',212,'') AS type_array)]
ORDER BY 1,2;
 a |                                                b                                                
---+-------------------------------------------------------------------------------------------------
 1 | {"(1,test,12.00,\"Mon Jan 01 00:00:00 2018\")","(2,test2,212.00,\"Thu Feb 01 00:00:00 2018\")"}
 2 | {"(1,test,12.00,\"Mon Jan 01 00:00:00 2018\")","(2,test2,212.00,\"Thu Feb 01 00:00:00 2018\")"}
(2 rows)

alter TYPE type_array add attribute attr bool;
SELECT b, LISTAGG(a, ',') WITHIN GROUP(ORDER BY b DESC)
FROM ExecClearTuple_5 GROUP BY 1;
                                                 b                                                 | listagg 
---------------------------------------------------------------------------------------------------+---------
 {"(1,test,12.00,\"Mon Jan 01 00:00:00 2018\",)","(2,test2,212.00,\"Thu Feb 01 00:00:00 2018\",)"} | 2,1
(1 row)

DROP TYPE type_array CASCADE;
NOTICE:  drop cascades to table execcleartuple_5 column b
DROP TABLE ExecClearTuple_5 CASCADE;
CREATE TABLE ExecClearTuple_6(col1 int, col2 int, col3 text);
CREATE INDEX iExecClearTuple_6 ON ExecClearTuple_6(col1,col2);
INSERT INTO ExecClearTuple_6 VALUES (0,0,'test_insert');
INSERT INTO ExecClearTuple_6 VALUES (0,1,'test_insert');
INSERT INTO ExecClearTuple_6 VALUES (1,1,'test_insert');
INSERT INTO ExecClearTuple_6 VALUES (1,2,'test_insert');
INSERT INTO ExecClearTuple_6 VALUES (0,0,'test_insert2');
INSERT INTO ExecClearTuple_6 VALUES (2,2,'test_insert2');
INSERT INTO ExecClearTuple_6 VALUES (0,0,'test_insert3');
INSERT INTO ExecClearTuple_6 VALUES (3,3,'test_insert3');
INSERT INTO ExecClearTuple_6(col1,col2) VALUES (1,1);
INSERT INTO ExecClearTuple_6(col1,col2) VALUES (2,2);
INSERT INTO ExecClearTuple_6(col1,col2) VALUES (3,3);
INSERT INTO ExecClearTuple_6 VALUES (null,null,null);
SELECT col1,col2 FROM ExecClearTuple_6 WHERE col1=0 AND col2=0 ORDER BY col1,col2 for UPDATE LIMIT 1;
 col1 | col2 
------+------
    0 |    0
(1 row)

-- DROP TABLE ExecClearTuple_6 CASCADE;
DROP TABLE ExecClearTuple_6 CASCADE;
SET current_schema=information_schema;
CREATE TABLE ExecClearTuple_8(a int, b int);
INSERT INTO ExecClearTuple_8 VALUES(1,2),(2,3),(3,4),(4,5);
\d+ ExecClearTuple_8
             Table "information_schema.execcleartuple_8"
 Column |  Type   | Modifiers | Storage | Stats target | Description 
--------+---------+-----------+---------+--------------+-------------
 a      | integer |           | plain   |              | 
 b      | integer |           | plain   |              | 
Has OIDs: no
Options: orientation=row, compression=no

\d+ sql_features
                        Table "information_schema.sql_features"
      Column      |      Type      | Modifiers | Storage  | Stats target | Description 
------------------+----------------+-----------+----------+--------------+-------------
 feature_id       | character_data |           | extended |              | 
 feature_name     | character_data |           | extended |              | 
 sub_feature_id   | character_data |           | extended |              | 
 sub_feature_name | character_data |           | extended |              | 
 is_supported     | yes_or_no      |           | extended |              | 
 is_verified_by   | character_data |           | extended |              | 
 comments         | character_data |           | extended |              | 
Has OIDs: no
Options: orientation=row, compression=no

explain (verbose ON, costs OFF, nodes OFF) SELECT COUNT(*) FROM sql_features;
                                                     QUERY PLAN                                                     
--------------------------------------------------------------------------------------------------------------------
 Aggregate
   Output: count(*)
   ->  Seq Scan on information_schema.sql_features
         Output: feature_id, feature_name, sub_feature_id, sub_feature_name, is_supported, is_verified_by, comments
(4 rows)

SELECT COUNT(*) FROM sql_features;
 count 
-------
   672
(1 row)

explain (verbose ON, costs OFF, nodes OFF) SELECT * FROM ExecClearTuple_8;
                   QUERY PLAN                    
-------------------------------------------------
 Seq Scan on information_schema.execcleartuple_8
   Output: a, b
(2 rows)

SELECT COUNT(*) FROM ExecClearTuple_8;
 count 
-------
     4
(1 row)

DROP TABLE ExecClearTuple_8;
reset current_schema;
CREATE USER clstr_user PASSWORD 'gauss@123';
CREATE TABLE clstr_1 (a INT PRIMARY KEY);
NOTICE:  CREATE TABLE / PRIMARY KEY will create implicit index "clstr_1_pkey" for table "clstr_1"
CREATE TABLE clstr_2 (a INT PRIMARY KEY);
NOTICE:  CREATE TABLE / PRIMARY KEY will create implicit index "clstr_2_pkey" for table "clstr_2"
CREATE TABLE clstr_3 (a INT PRIMARY KEY);
NOTICE:  CREATE TABLE / PRIMARY KEY will create implicit index "clstr_3_pkey" for table "clstr_3"
ALTER TABLE clstr_1 OWNER TO clstr_user;
ALTER TABLE clstr_3 OWNER TO clstr_user;
GRANT SELECT ON clstr_2 TO clstr_user;
INSERT INTO clstr_1 VALUES (2);
INSERT INTO clstr_1 VALUES (1);
INSERT INTO clstr_2 VALUES (2);
INSERT INTO clstr_2 VALUES (1);
INSERT INTO clstr_3 VALUES (2);
INSERT INTO clstr_3 VALUES (1);
CLUSTER clstr_2;
ERROR:  there is no previously clustered index for table "clstr_2"
CLUSTER clstr_1_pkey ON clstr_1;
CLUSTER clstr_2 USING clstr_2_pkey;
SELECT * FROM clstr_1 UNION ALL
  SELECT * FROM clstr_2 UNION ALL
  SELECT * FROM clstr_3
  ORDER BY 1;
 a 
---
 1
 1
 1
 2
 2
 2
(6 rows)

DROP TABLE clstr_1 CASCADE;
DROP TABLE clstr_2 CASCADE;
DROP TABLE clstr_3 CASCADE;
DROP user clstr_user CASCADE;
CREATE TABLE clustertest (KEY int PRIMARY KEY);
NOTICE:  CREATE TABLE / PRIMARY KEY will create implicit index "clustertest_pkey" for table "clustertest"
INSERT INTO clustertest VALUES (10);
INSERT INTO clustertest VALUES (20);
INSERT INTO clustertest VALUES (30);
INSERT INTO clustertest VALUES (40);
INSERT INTO clustertest VALUES (50);
-- Test UPDATE WHERE the old row version is found first in the scan
UPDATE clustertest SET KEY = 100 WHERE KEY = 10;
-- Test UPDATE WHERE the new row version is found first in the scan
UPDATE clustertest SET KEY = 35 WHERE KEY = 40;
-- Test longer UPDATE chain
UPDATE clustertest SET KEY = 60 WHERE KEY = 50;
UPDATE clustertest SET KEY = 70 WHERE KEY = 60;
UPDATE clustertest SET KEY = 80 WHERE KEY = 70;
DROP TABLE clustertest CASCADE;
CREATE TABLE ExecClearTuple_11 (col1 int PRIMARY KEY, col2 INT, col3 smallserial)  ;
NOTICE:  CREATE TABLE will create implicit sequence "execcleartuple_11_col3_seq" for serial column "execcleartuple_11.col3"
NOTICE:  CREATE TABLE / PRIMARY KEY will create implicit index "execcleartuple_11_pkey" for table "execcleartuple_11"
PREPARE p1 AS INSERT INTO ExecClearTuple_11 VALUES($1, $2) ON DUPLICATE KEY UPDATE col2 = $1*100;
EXECUTE p1(5, 50);
SELECT * FROM ExecClearTuple_11 WHERE col1 = 5;
 col1 | col2 | col3 
------+------+------
    5 |   50 |    1
(1 row)

EXECUTE p1(5, 50);
SELECT * FROM ExecClearTuple_11 WHERE col1 = 5;
 col1 | col2 | col3 
------+------+------
    5 |  500 |    1
(1 row)

DELETE ExecClearTuple_11 WHERE col1 = 5;
DEALLOCATE p1;
DROP TABLE ExecClearTuple_11 CASCADE;
create table tGin122 (
        name varchar(50) not null, 
        age int, 
        birth date, 
        ID varchar(50) , 
        phone varchar(15),
        carNum varchar(50),
        email varchar(50), 
        info text, 
        config varchar(50) default 'english',
        tv tsvector,
        i varchar(50)[],
        ts tsquery);
insert into tGin122 values('Linda', 20, '1996-06-01', '140110199606012076', '13454333333', '京A QL666', 'linda20@sohu.com', 'When he was busy with teaching men the art of living, Prometheus had left a bigcask in the care of Epimetheus. He had warned his brother not to open the lid. Pandora was a curious woman. She had been feeling very disappointed that her husband did not allow her to take a look at the contents of the cask. One day, when Epimetheus was out, she lifted the lid and out it came unrest and war, Plague and sickness, theft and violence, grief, sorrow, and all the other evils. The human world was hence to experience these evils. Only hope stayed within the mouth of the jar and never flew out. So men always have hope within their hearts.
偷窃天火之后，宙斯对人类的敌意与日俱增。一天，他令儿子赫菲斯托斯用泥塑一美女像，并请众神赠予她不同的礼物。世上的第一个女人是位迷人女郎，因为她从每位神灵那里得到了一样对男人有害的礼物，因此宙斯称她为潘多拉。
', 'ngram', '', '{''brother'',''与日俱增'',''赫菲斯托斯''}',NULL);
insert into tGin122 values('张三', 20,  '1996-07-01', '140110199607012076', '13514333333', '鲁K QL662', 'zhangsan@163.com', '希腊北部国王阿塔玛斯有两个孩子，法瑞克斯和赫勒。当国王离
开第一个妻子和一个名叫伊诺的坏女人结婚后，两个孩子受到后母残忍虐待，整个王国也受到毁灭性瘟疫的侵袭。伊诺在爱轻信的丈夫耳边进谗言，终于使国王相信：他的儿子法瑞克斯是这次灾害的罪魁祸首，并要将他献给宙斯以结束
瘟疫。可怜的孩子被推上了祭坛，将要被处死。正在此时，上帝派了一只浑身上下长着金色羊毛的公羊来将两个孩子驮在背上带走了。当他们飞过隔开欧洲和亚洲的海峡时，赫勒由于看到浩瀚的海洋而头晕目眩，最终掉进大海淹死了。
这片海洋古时候的名称叫赫勒之海，赫勒拉旁海峡便由此而来。金色公羊驮着法瑞克斯继续向前飞去，来到了黑海东岸的科尔契斯。在那里，法瑞克斯将公羊献给了宙斯；而将金羊毛送给了埃厄忒斯国王。国王将羊毛钉在一棵圣树上，
并派了一条不睡觉的龙负责看护。', 'ngram', '',  '{''法瑞克斯和赫勒'',''王国'',''埃厄忒斯国王''}',NULL); 
insert into tGin122 values('Sara', 20,  '1996-07-02', '140110199607022076', '13754333333', '冀A QL661', 'sara20@sohu.com', '英语语言结构重形合（hypotaxis），汉语重义合（parataxis）>，也就是说，英语的句子组织通常通过连接词（connectives）和词尾的曲折变化（inflection）来实现，汉语则较少使用连接词和受语法规则约束。英语句子通过表示各种关系如因果、条件、逻辑、预设等形合手段组织，环环相扣，>可以形成像树枝一样包孕许多修饰成分和分句的长句和复杂句，而汉语则多用短句和简单句。此外，英语注重使用各种短语作为句子的构成单位，在修饰位置上可前可后、十分灵活，常习惯于后置语序。这些差异就形成了王力先生所谓
的英语“化零为整”而汉语则“化整为零”特点。此外，英语多用被动语态，这在科技英语中尤为如此。了解英语和汉语这些造句差异，就可在英语长句和复杂句的理解和翻译中有意识地将英语句子按照汉语造句特点进行转化处理，短从句结构变单独句子或相反，后置变前置，被动变主动。以下结合本人在教学中遇到的例子，说说如何对生物类专业英语长句和复杂句翻译进行翻译处理。', 'english', '',  '{''parataxis'',''后置变前置'',''差异''}',NULL);
insert into tGin122 values('Mira', 20,  '1996-08-01', '140110199608012076', '13654333333', '津A QL660', 'mm20@sohu.com', '[解析]第一个分句宜将被动语态译为主动语态，第二个分句如将定>语分句处理为汉语前置，“利用能在培养组织中迅速降解而无需提供第二种生根培养基的IAA则是克服这个问题的一种有用方法。”则会因修饰语太长，不易理解，也不符合汉语习惯，宜作为分句处理。[翻译]根发端所需的生长素水平抑制根的伸长，而利用IAA则是克服这个问题的一种有用方法，因为IAA能在培养组织中迅速降解而无需提供第二种生根培养基。', 'english', '',  '{''汉语前置'',''分句处理'',''生长素水平''}',NULL);
insert into tGin122 values('Amy', 20,  ' 1996-09-01', '140110199609012076', '13854333333', '吉A QL663', 'amy2008@163.com', '[解析]该句的理解的关键是要抓住主句的结构“Current concern focus on ……, and on……”，同时不要将第二个“on”的搭配（intrusionon）与主句中第一个和第三个“on”的搭配（focuson）混淆。翻译时，为了避免宾语的修补词过长，可用“目前公众对转基因植物的关注集中在这两点”来用“一方面……；另一方面……”来分述，这样处理更符合汉语习惯。', 'ngram', '',  '{''intrusionon'',''13854333333'',''140110199609012076''}',NULL);
insert into tGin122 values('汪玲沁 ', 20,  ' 1996-09-01', '44088319921103106X', '13854333333', '沈YWZJW0', 'si2008@163.com', '晨的美好就如青草般芳香，如河溪般清澈，如玻璃般透明，如>甘露般香甜。[解析]该句的主句结构为“This led to a whole new field of academic research”，后面有一个现在分词结构“including the milestone paper by Paterson and co-workers in 1988”之后为“the milestone pape长定语从句。在翻译时，宜将该定语从句分译成句，但要将表示方法手段的现在分词结构“using an approach that could be applied to dissect the genetic make-up of any physiological, morphological and behavioural trat in plants and animals”前置译出，这样更符合汉语的表达习惯。', 'ngram', '',  '{''44088319921103106X'',''分词结构'',''透明''}',NULL);
create index tgin122_idx1 on tgin122 (substr(email,2,5));
create index tgin122_idx2 on tgin122 (upper(info));
set default_statistics_target=-2;
analyze tGin122 ((tv, ts));
select * from pg_ext_stats where schemaname='distribute_stat_2' and tablename='tgin122' order by attname;
 schemaname | tablename | attname | inherited | null_frac | avg_width | n_distinct | n_dndistinct | most_common_vals | most_common_freqs | most_common_vals_null | most_common_freqs_null | histogram_bounds 
------------+-----------+---------+-----------+-----------+-----------+------------+--------------+------------------+-------------------+-----------------------+------------------------+------------------
(0 rows)

alter table tGin122 delete statistics ((tv, ts));
update tGin122 set tv=to_tsvector(config::regconfig, coalesce(name,'') || ' ' || coalesce(ID,'') || ' ' || coalesce(carNum,'') || ' ' || coalesce(phone,'') || ' ' || coalesce(email,'') || ' ' || coalesce(info,''));
update tGin122 set ts=to_tsquery('ngram', coalesce(phone,'')); 
analyze tGin122 ((tv, ts));
select * from pg_ext_stats where schemaname='distribute_stat_2' and tablename='tgin122' order by attname;
 schemaname | tablename | attname | inherited | null_frac | avg_width | n_distinct | n_dndistinct | most_common_vals | most_common_freqs | most_common_vals_null | most_common_freqs_null | histogram_bounds 
------------+-----------+---------+-----------+-----------+-----------+------------+--------------+------------------+-------------------+-----------------------+------------------------+------------------
(0 rows)

alter table tGin122 delete statistics ((tv, ts));
select * from pg_ext_stats where schemaname='distribute_stat_2' and tablename='tgin122' order by attname;
 schemaname | tablename | attname | inherited | null_frac | avg_width | n_distinct | n_dndistinct | most_common_vals | most_common_freqs | most_common_vals_null | most_common_freqs_null | histogram_bounds 
------------+-----------+---------+-----------+-----------+-----------+------------+--------------+------------------+-------------------+-----------------------+------------------------+------------------
(0 rows)

alter table tGin122 add statistics ((tv, ts));
analyze tGin122;
select * from pg_ext_stats where schemaname='distribute_stat_2' and tablename='tgin122' order by attname;
 schemaname | tablename | attname | inherited | null_frac | avg_width | n_distinct | n_dndistinct | most_common_vals | most_common_freqs | most_common_vals_null | most_common_freqs_null | histogram_bounds 
------------+-----------+---------+-----------+-----------+-----------+------------+--------------+------------------+-------------------+-----------------------+------------------------+------------------
(0 rows)

select * from pg_stats where tablename='tgin122' and attname = 'tv';
 schemaname | tablename | attname | inherited | null_frac | avg_width | n_distinct | n_dndistinct | most_common_vals | most_common_freqs | histogram_bounds | correlation |                                                                                                                                                                                                                                                                                                                                                                                                                                                                                                                                                                                                                                                                                                                                                                                                                                                                                                                                                                                                                                                                                                                                                                                                                                                                                                                                                                                                                                                                                                                                                                                                                                                                                                                                                                                                                                                                                                                                                                                                                                                                                                                                                                                                                                                                          most_common_elems                                                                                                                                                                                                                                                                                                                                                                                                                                                                                                                                                                                                                                                                                                                                                                                                                                                                                                                                                                                                                                                                                                                                                                                                                                                                                                                                                                                                                                                                                                                                                                                                                                                                                                                                                                                                                                                                                                                                                                                                                                                                                                                                                                                                                                                                           |                                                                                                                                                                                                                                                                                                                                                                                                                                                                                                                                                                                                                                                                                                                                                                                                                                                                                                                                                                                                                                                                                                                                                                                                                                                                                                                                                                                                                                                                                                                                                                                                                                                                                                                                                                                                                                                                                                                                                                                                                                                                                                                                                                                                                                                                                                                                                                                                                                                                                                                                                                                                                                                                                                                                                                                                                                                                                                                                                                                                                                                                                                                                                                                                            most_common_elem_freqs                                                                                                                                                                                                                                                                                                                                                                                                                                                                                                                                                                                                                                                                                                                                                                                                                                                                                                                                                                                                                                                                                                                                                                                                                                                                                                                                                                                                                                                                                                                                                                                                                                                                                                                                                                                                                                                                                                                                                                                                                                                                                                                                                                                                                                                                                                                                                                                                                                                                                                                                                                                                                                                                                                                                                                                                                                                                                                                                                                                                                                                                                                                                                                                                            | elem_count_histogram 
------------+-----------+---------+-----------+-----------+-----------+------------+--------------+------------------+-------------------+------------------+-------------+----------------------------------------------------------------------------------------------------------------------------------------------------------------------------------------------------------------------------------------------------------------------------------------------------------------------------------------------------------------------------------------------------------------------------------------------------------------------------------------------------------------------------------------------------------------------------------------------------------------------------------------------------------------------------------------------------------------------------------------------------------------------------------------------------------------------------------------------------------------------------------------------------------------------------------------------------------------------------------------------------------------------------------------------------------------------------------------------------------------------------------------------------------------------------------------------------------------------------------------------------------------------------------------------------------------------------------------------------------------------------------------------------------------------------------------------------------------------------------------------------------------------------------------------------------------------------------------------------------------------------------------------------------------------------------------------------------------------------------------------------------------------------------------------------------------------------------------------------------------------------------------------------------------------------------------------------------------------------------------------------------------------------------------------------------------------------------------------------------------------------------------------------------------------------------------------------------------------------------------------------------------------------------------------------------------------------------------------------------------------------------------------------------------------------------------------------------------------------------------------------------------------------------------------------------------------------------------------------------------------------------------------------------------------------------------------------------------------------------------------------------------------------------------------------------------------------------------------------------------------------------------------------------------------------------------------------------------------------------------------------------------------------------------------------------------------------------------------------------------------------------------------------------------------------------------------------------------------------------------------------------------------------------------------------------------------------------------------------------------------------------------------------------------------------------------------------------------------------------------------------------------------------------------------------------------------------------------------------------------------------------------------------------------------------------------------------------------------------------------------------------------------------------------------------------------------------------------------------------------------------------------------------------------------------------------------------------------------------------------------------------------------------------------------------------------------------------------------------------------------------------------------------------------------------------------------------------------------------------------------------------------------------------------------------------------------------------------------------------------------------------------------------------------------------------------------------------------------------------------------------------------------------------------------------------------------+----------------------------------------------------------------------------------------------------------------------------------------------------------------------------------------------------------------------------------------------------------------------------------------------------------------------------------------------------------------------------------------------------------------------------------------------------------------------------------------------------------------------------------------------------------------------------------------------------------------------------------------------------------------------------------------------------------------------------------------------------------------------------------------------------------------------------------------------------------------------------------------------------------------------------------------------------------------------------------------------------------------------------------------------------------------------------------------------------------------------------------------------------------------------------------------------------------------------------------------------------------------------------------------------------------------------------------------------------------------------------------------------------------------------------------------------------------------------------------------------------------------------------------------------------------------------------------------------------------------------------------------------------------------------------------------------------------------------------------------------------------------------------------------------------------------------------------------------------------------------------------------------------------------------------------------------------------------------------------------------------------------------------------------------------------------------------------------------------------------------------------------------------------------------------------------------------------------------------------------------------------------------------------------------------------------------------------------------------------------------------------------------------------------------------------------------------------------------------------------------------------------------------------------------------------------------------------------------------------------------------------------------------------------------------------------------------------------------------------------------------------------------------------------------------------------------------------------------------------------------------------------------------------------------------------------------------------------------------------------------------------------------------------------------------------------------------------------------------------------------------------------------------------------------------------------------------------------------------------------------------------------------------------------------------------------------------------------------------------------------------------------------------------------------------------------------------------------------------------------------------------------------------------------------------------------------------------------------------------------------------------------------------------------------------------------------------------------------------------------------------------------------------------------------------------------------------------------------------------------------------------------------------------------------------------------------------------------------------------------------------------------------------------------------------------------------------------------------------------------------------------------------------------------------------------------------------------------------------------------------------------------------------------------------------------------------------------------------------------------------------------------------------------------------------------------------------------------------------------------------------------------------------------------------------------------------------------------------------------------------------------------------------------------------------------------------------------------------------------------------------------------------------------------------------------------------------------------------------------------------------------------------------------------------------------------------------------------------------------------------------------------------------------------------------------------------------------------------------------------------------------------------------------------------------------------------------------------------------------------------------------------------------------------------------------------------------------------------------------------------------------------------------------------------------------------------------------------------------------------------------------------------------------------------------------------------------------------------------------------------------------------------------------------------------------------------------------------------------------------------------------------------------------------------------------------------------------------------------------------------------------------------------------------------------------------------------------------------------------------------------------------------------------------------------------------------------------------------------------------------------------------------------------------------------------------------------------------------------------------------------------------------------------------------------------------------------------------------------------------------------------------------------------------------------------------------+----------------------
 public     | tgin122   | tv      | f         |         0 |       138 |         -1 |            0 |                  |                   |                  |             | {a,-u,-w,00,01,03,06,07,08,09,0@,10,11,12,13,14,16,19,20,21,31,33,34,35,38,40,43,44,45,51,54,60,62,63,66,6x,70,76,83,85,88,8@,90,92,96,98,99,@1,@s,a2,ac,ad,ag,ak,al,am,an,ap,ar,as,at,av,ay,ba,be,bi,br,bu,by,ca,ce,ch,ck,cl,co,ct,cu,da,de,di,do,e-,ea,ec,ed,ee,ef,eh,ei,el,em,en,ep,er,es,et,eu,ev,ew,ex,fe,fi,fl,fo,ft,gc,ge,gi,gr,gs,gu,ha,he,hi,ho,hu,hy,i2,ic,id,ie,if,ig,il,im,in,io,ir,is,it,iv,ja,jw,ke,kn,l6,la,ld,le,li,ll,lo,ls,lu,lw,ly,ma,me,mi,mo,my,n@,nc,nd,ne,ng,ni,nl,no,nr,nt,ny,o-,oa,oc,of,og,oh,oi,ok,ol,om,on,oo,op,or,ot,ou,ow,pa,pe,ph,pi,pl,po,pp,pr,ql,ra,rc,re,ri,rk,rl,rn,ro,rp,rr,rs,rt,ru,ry,sa,sb,se,sh,si,sk,so,ss,st,sy,ta,te,th,ti,to,tr,ts,ud,ue,ul,um,un,up,ur,us,ut,ve,vi,w0,wa,wh,wi,wo,wz,xp,y2,ye,ys,yw,zh,zj,>甘,e长,mira,sara,京a,冀a,吉a,如>,沈y,津a,鲁k,ql660,ql661,一个,一只,一天,一方,一条,一样,一棵,一美,丈夫,三个,上下,上了,上帝,上带,上的,下长,不同,不睡,不要,与主,与日,世上,东岸,两个,两点,个名,个和,个女,个妻,个孩,个王,个现,中在,中第,为了,为她,为潘,主句,之后,之海,也受,习惯,了一,了埃,了宙,了祭,了避,了黑,予她,二个,于使,于看,亚洲,人女,人是,人有,人类,人结,从句,从每,他令,他们,他献,他的,令儿,以结,们飞,伊诺,众对,众神,但要,位神,位迷,住主,使国,侵袭,便由,信的,修补,俱增,候的,偷窃,儿子,克斯,免宾,公众,公羊,关注,关键,分词,分译,分述,到了,到后,到毁,到浩,前公,前置,前飞,勒之,勒拉,勒由,北部,厄忒,受到,古时,句中,句分,句的,句结,另一,只浑,叫伊,叫赫,可怜,可用,合汉,同时,同的,名叫,名称,后为,后母,后面,向前,和一,和亚,和第,和赫,因为,因植,因此,国也,国王,圣树,在一,在分,在此,在爱,在翻,在背,在这,在那,坏女,埃厄,基因,塑一,塔玛,处死,处理,多拉,大海,天火,夫耳,头晕,契斯,女人,女像,女郎,她不,她为,她从,好就,如河,如玻,如青,妻子,婚后,子受,子和,子法,子被,子赫,子驮,孩子,宙斯,定语,宜将,害的,宾语,对人,对男,对转,将两,将他,将公,将第,将羊,将表,将要,将该,将金,尔契,就如,岸的,峡便,峡时,希腊,帝派,带走,并派,并要,并请,开欧,开第,张三,当他,当国,得到,忍虐,忒斯,怜的,性瘟,意与,成句,手段,托斯,抓住,拉旁,掉进,推上,搭配,敌意,整个,斯以,斯和,斯国,斯对,斯将,斯托,斯是,斯有,斯用,斯称,斯继,方法,方面,旁海,日俱,时不,时候,是位,是要,是这,晕目,晨的,更符,最终,有一,有两,有害,条不,条件,来分,来到,来将,来用,构为,树上,样处,样对,样更,棵圣,植物,次灾,欧洲,正在,此外,此宙,此时,此而,死了,残忍,段的,毁灭,母残,每位,毛的,毛送,毛钉,汉语,汪玲,河溪,法手,法瑞,泥塑,注集,洋古,洋而,洲和,洲的,派了,浑身,浩瀚,海东,海峡,海洋,海淹,混淆,淹死,清澈,溪般,潘多,瀚的,火之,灭性,灵那,灾害,爱轻,片海,物的,特点,献给,王国,王将,王相,王离,王阿,玛斯,现在,玲沁,玻璃,理更,理解,瑞克,璃般,甘露,用泥,由于,由此,男人,疫的,瘟疫,的丈,的主,的侵,的修,的儿,的公,的关,的名,的坏,的孩,的搭,的敌,的海,的现,的理,的礼,的科,的第,的结,的罪,的美,的表,的龙,目前,目眩,相信,看到,看护,着法,着金,睡觉,示方,礼物,神灵,神赠,祭坛,祸首,科尔,称叫,称她,窃天,符合,第一,第三,第二,类的,终于,终掉,结婚,结束,结构,给了,给宙,继续,续向,罪魁,置译,羊来,羊毛,羊献,羊驮,美女,美好,翻译,而头,而将,而来,耳边,背上,腊北,般清,般芳,般透,般香,色公,色羊,芳香,草般,菲斯,虐待,补词,表示,表达,被处,被推,要将,要抓,要被,觉的,解析,解的,词结,词过,译出,译成,译时,该句,该定,语习,语从,语的,请众,诺在,诺的,谗言,负责,责看,赠予,赫勒,赫菲,走了,身上,转基,轻信,边进,达习,过长,过隔,这两,这样,这次,这片,进大,进谗,迷人,送给,透明,逻辑,避免,那里,部国,里得,金羊,金色,钉在,键是,长定,长着,阿塔,隔开,集中,露般,青草,面有,飞去,飞过,香甜,驮在,驮着,魁祸,黑海,龙负,connect,inflect,hypotaxi,parataxi,来实现,的英语,13654333333,13754333333,不易理解,也就是说,化整为零,化零为整,十分灵活,环环相扣,而汉语则,mm20@sohu.com,sara20@sohu.com,后置变前置,汉语重义合,被动变主动,140110199607022076,140110199608012076,宜作为分句处理,也不符合汉语习惯,则会因修饰语太长,和词尾的曲折变化,常习惯于后置语序,第二个分句如将定,英语多用被动语态,英语语言结构重形合,预设等形合手段组织,在修饰位置上可前可后,语分句处理为汉语前置,这在科技英语中尤为如此,而汉语则多用短句和简单句,了解英语和汉语这些造句差异,短从句结构变单独句子或相反,英语的句子组织通常通过连接词,这些差异就形成了王力先生所谓,以下结合本人在教学中遇到的例子,英语句子通过表示各种关系如因果,根发端所需的生长素水平抑制根的伸长,第一个分句宜将被动语态译为主动语态,汉语则较少使用连接词和受语法规则约束,而利用iaa则是克服这个问题的一种有用方法,英语注重使用各种短语作为句子的构成单位,说说如何对生物类专业英语长句和复杂句翻译进行翻译处理,可以形成像树枝一样包孕许多修饰成分和分句的长句和复杂句,因为iaa能在培养组织中迅速降解而无需提供第二种生根培养基,就可在英语长句和复杂句的理解和翻译中有意识地将英语句子按照汉语造句特点进行转化处理,利用能在培养组织中迅速降解而无需提供第二种生根培养基的iaa则是克服这个问题的一种有用方法} | {.333333,.166667,.166667,.333333,.5,.166667,.333333,.5,.333333,.166667,.166667,.666667,.666667,.5,.666667,.5,.5,.666667,.666667,.166667,.166667,.666667,.166667,.166667,.333333,.666667,.666667,.166667,.166667,.166667,.5,.5,.166667,.5,.5,.166667,.166667,.5,.166667,.333333,.166667,.333333,.166667,.166667,.5,.166667,.666667,.5,.166667,.166667,.333333,.333333,.166667,.333333,.333333,.333333,.666667,.333333,.333333,.166667,.333333,.333333,.166667,.166667,.333333,.166667,.166667,.166667,.166667,.333333,.333333,.333333,.166667,.166667,.666667,.166667,.333333,.166667,.166667,.333333,.166667,.166667,.333333,.166667,.333333,.166667,.166667,.166667,.166667,.333333,.166667,.5,.166667,.5,.333333,.333333,.166667,.166667,.333333,.166667,.166667,.166667,.166667,.166667,.166667,.166667,.166667,.166667,.166667,.166667,.166667,.5,.333333,.333333,.333333,.166667,.166667,.166667,.333333,.166667,.333333,.166667,.166667,.333333,.333333,.5,.5,.166667,.333333,.166667,.166667,.166667,.166667,.333333,.166667,.5,.333333,.333333,.333333,.333333,.166667,.333333,.333333,.166667,.166667,.166667,.333333,.166667,.166667,.333333,.166667,.166667,.5,.5,.333333,.5,.166667,.166667,.333333,.166667,.5,.166667,.166667,.166667,.166667,.333333,.166667,.166667,.166667,.166667,.333333,.666667,.5,.166667,.166667,.333333,.166667,.333333,.166667,.333333,.333333,.166667,.166667,.333333,.166667,.333333,.333333,.5,.333333,.166667,.5,.166667,.166667,.166667,.333333,.333333,.166667,.333333,.166667,.166667,.166667,.166667,.333333,.166667,.333333,.166667,.5,.166667,.5,.333333,.333333,.166667,.166667,.333333,.333333,.166667,.333333,.333333,.333333,.166667,.166667,.166667,.166667,.166667,.166667,.5,.5,.166667,.166667,.333333,.166667,.166667,.333333,.166667,.333333,.166667,.166667,.166667,.166667,.333333,.166667,.166667,.166667,.166667,.166667,.166667,.166667,.166667,.166667,.166667,.166667,.166667,.166667,.166667,.166667,.166667,.666667,.166667,.166667,.166667,.166667,.166667,.166667,.166667,.166667,.166667,.166667,.166667,.166667,.166667,.166667,.166667,.166667,.166667,.166667,.166667,.166667,.166667,.166667,.166667,.166667,.166667,.166667,.166667,.166667,.166667,.166667,.166667,.166667,.166667,.166667,.166667,.166667,.333333,.333333,.166667,.166667,.333333,.333333,.166667,.166667,.166667,.166667,.166667,.166667,.166667,.166667,.166667,.166667,.166667,.166667,.166667,.166667,.166667,.166667,.166667,.166667,.166667,.166667,.166667,.166667,.166667,.166667,.166667,.166667,.166667,.166667,.166667,.166667,.166667,.166667,.166667,.166667,.166667,.166667,.166667,.166667,.166667,.333333,.166667,.166667,.166667,.166667,.166667,.166667,.166667,.166667,.166667,.333333,.166667,.166667,.166667,.166667,.166667,.166667,.166667,.166667,.166667,.166667,.166667,.166667,.166667,.166667,.166667,.333333,.166667,.166667,.166667,.166667,.166667,.166667,.166667,.333333,.166667,.166667,.166667,.166667,.166667,.166667,.166667,.166667,.166667,.166667,.166667,.166667,.166667,.166667,.166667,.166667,.166667,.166667,.166667,.166667,.166667,.166667,.166667,.166667,.166667,.166667,.166667,.166667,.166667,.166667,.166667,.166667,.166667,.166667,.166667,.166667,.166667,.166667,.166667,.333333,.166667,.166667,.166667,.166667,.166667,.166667,.166667,.166667,.166667,.166667,.166667,.166667,.166667,.166667,.166667,.166667,.166667,.166667,.333333,.166667,.166667,.333333,.166667,.166667,.166667,.166667,.166667,.166667,.166667,.166667,.166667,.166667,.166667,.166667,.166667,.166667,.166667,.166667,.166667,.166667,.166667,.166667,.166667,.166667,.166667,.166667,.166667,.166667,.166667,.166667,.166667,.166667,.166667,.166667,.166667,.166667,.166667,.166667,.166667,.166667,.166667,.166667,.166667,.166667,.166667,.166667,.166667,.166667,.166667,.166667,.166667,.166667,.166667,.166667,.166667,.166667,.166667,.166667,.166667,.166667,.166667,.166667,.166667,.166667,.166667,.166667,.166667,.166667,.166667,.333333,.166667,.166667,.166667,.166667,.166667,.166667,.166667,.166667,.166667,.166667,.166667,.166667,.166667,.166667,.166667,.166667,.166667,.166667,.166667,.166667,.166667,.166667,.166667,.166667,.166667,.166667,.166667,.166667,.166667,.166667,.166667,.166667,.166667,.333333,.166667,.166667,.166667,.166667,.166667,.166667,.166667,.166667,.166667,.166667,.166667,.166667,.166667,.166667,.166667,.166667,.166667,.166667,.166667,.166667,.166667,.166667,.166667,.166667,.166667,.166667,.166667,.166667,.166667,.166667,.166667,.166667,.166667,.166667,.166667,.166667,.166667,.166667,.166667,.166667,.166667,.166667,.166667,.166667,.166667,.166667,.166667,.166667,.166667,.166667,.166667,.166667,.166667,.166667,.166667,.166667,.166667,.166667,.166667,.166667,.166667,.166667,.166667,.166667,.166667,.166667,.166667,.166667,.166667,.166667,.166667,.166667,.166667,.166667,.166667,.166667,.166667,.166667,.166667,.166667,.166667,.166667,.166667,.166667,.166667,.166667,.166667,.166667,.166667,.166667,.166667,.166667,.166667,.333333,.5,.166667,.166667,.166667,.166667,.166667,.166667,.166667,.333333,.166667,.166667,.166667,.166667,.166667,.166667,.166667,.166667,.166667,.166667,.166667,.166667,.5,.166667,.166667,.166667,.166667,.166667,.166667,.166667,.166667,.166667,.166667,.166667,.166667,.166667,.166667,.166667,.166667,.166667,.166667,.166667,.166667,.166667,.5,.166667,.166667,.166667,.5,.166667,.166667,.166667,.166667,.166667,.333333,.333333,.166667,.166667,.166667,.333333,.166667,.166667,.166667,.166667,.166667,.166667,.166667,.166667,.166667,.166667,.166667,.166667,.166667,.166667,.166667,.166667,.166667,.166667,.333333,.166667,.166667,.166667,.166667,.166667,.166667,.166667,.166667,.166667,.333333,.166667,.166667,.166667,.166667,.166667,.166667,.166667,.166667,.166667,.166667,.166667,.166667,.166667,.166667,.166667,.166667,.166667,.166667,.166667,.166667,.166667,.166667,.166667,.166667,.166667,.166667,.166667,.166667,.166667,.166667,.166667,.166667,.166667,.166667,.166667,.166667,.166667,.166667,.166667,.166667,.166667,.166667,.166667,.166667,.166667,.166667,.166667,.166667,.166667,.166667,.166667,.166667,.166667,.166667,.166667,.166667,.166667,.166667,.166667,.166667,.166667,.166667,.166667,.166667,.166667,.166667,.166667,.166667,.166667,.166667,.166667,.166667,.166667,.166667,.666667} | 
(1 row)

select attname,avg_width,n_distinct,histogram_bounds from pg_stats where tablename='tgin122_idx1';
 attname | avg_width | n_distinct |           histogram_bounds            
---------+-----------+------------+---------------------------------------
 substr  |         9 |         -1 | {ara20,hangs,i2008,inda2,m20@s,my200}
(1 row)

drop table tgin122 cascade;
select count(*)>=0 from gs_os_run_info;
 ?column? 
----------
 t
(1 row)

select count(*)>=0 from gs_session_memory_detail;
 ?column? 
----------
 t
(1 row)

select count(*)>=0 from gs_shared_memory_detail;
 ?column? 
----------
 t
(1 row)

select count(*) from (select * from gs_session_time limit 1);
 count 
-------
     1
(1 row)

select count(*)>=0 from gs_file_stat;
 ?column? 
----------
 t
(1 row)

select * from gs_session_stat where statid = -1;
 sessid | statid | statname | statunit | value 
--------+--------+----------+----------+-------
(0 rows)

select count(*)>=0 from gs_session_memory;
 ?column? 
----------
 t
(1 row)

select count(*) from (select * from gs_total_memory_detail limit 1);
 count 
-------
     1
(1 row)

create table anothertab (atcol1 serial8, atcol2 boolean,
	constraint anothertab_chk check (atcol1 <= 3));;
NOTICE:  CREATE TABLE will create implicit sequence "anothertab_atcol1_seq" for serial column "anothertab.atcol1"
insert into anothertab (atcol1, atcol2) values (default, true);
insert into anothertab (atcol1, atcol2) values (default, false);
select * from anothertab order by atcol1, atcol2;
 atcol1 | atcol2 
--------+--------
      1 | t
      2 | f
(2 rows)

alter table anothertab alter column atcol1 type boolean;
drop table anothertab;
create type lockmodes as enum (
 'AccessShareLock'
,'RowShareLock'
,'RowExclusiveLock'
,'ShareUpdateExclusiveLock'
,'ShareLock'
,'ShareRowExclusiveLock'
,'ExclusiveLock'
,'AccessExclusiveLock'
);
create or replace view my_locks as
select case when c.relname like 'pg_toast%' then 'pg_toast' else c.relname end, max(mode::lockmodes) as max_lockmode
from pg_locks l join pg_class c on l.relation = c.oid
where virtualtransaction = (
        select virtualtransaction
        from pg_locks
        where transactionid = txid_current()::integer)
and locktype = 'relation'
and relnamespace != (select oid from pg_namespace where nspname = 'pg_catalog')
and c.relname != 'my_locks'
group by c.relname;
create table alterlock (f1 int primary key, f2 text);
NOTICE:  CREATE TABLE / PRIMARY KEY will create implicit index "alterlock_pkey" for table "alterlock"
start transaction; alter table alterlock cluster on alterlock_pkey;
select * from my_locks order by 1;
    relname     |    max_lockmode     
----------------+---------------------
 alterlock      | AccessExclusiveLock
 alterlock_pkey | AccessExclusiveLock
(2 rows)

commit;
drop view my_locks cascade;
drop type lockmodes cascade;
drop table alterlock cascade;
CREATE TYPE test_type3 AS (a int);
CREATE TABLE test_tbl3 (c) AS SELECT '(1)'::test_type3;
drop type test_type3 cascade;
NOTICE:  drop cascades to table test_tbl3 column c
drop table test_tbl3 cascade;
CREATE TABLE test_exists (a int, b text);
CREATE TEXT SEARCH DICTIONARY test_tsdict_exists (
        Template=ispell,
        DictFile=ispell_sample,
        AffFile=ispell_sample
);
DROP TEXT SEARCH DICTIONARY test_tsdict_exists;
CREATE TEXT SEARCH CONFIGURATION test_tsconfig_exists (COPY=english);
DROP TEXT SEARCH CONFIGURATION test_tsconfig_exists;
CREATE TRIGGER test_trigger_exists
    BEFORE UPDATE ON test_exists
    FOR EACH ROW EXECUTE PROCEDURE suppress_redundant_updates_trigger();
WARNING:  Trigger function with non-plpgsql type is not recommended.
DETAIL:  Non-plpgsql trigger function are not shippable by default.
HINT:  Unshippable trigger may lead to bad performance.
DROP TRIGGER test_trigger_exists ON test_exists;
drop table test_exists cascade;
select count(*) from pg_node_env;
 count 
-------
     1
(1 row)

select count(*) from pg_os_threads;
 count 
-------
    29
(1 row)

create table running_xacts_tbl(handle int4);
insert into running_xacts_tbl(select handle from pg_get_running_xacts());
drop table running_xacts_tbl;
create table pg_stat_get_redo_stat_tbl(a int8);
insert into pg_stat_get_redo_stat_tbl select phywrts from pg_stat_get_redo_stat();
drop table pg_stat_get_redo_stat_tbl;
create schema pgaudit_audit_object;
alter schema pgaudit_audit_object rename to pgaudit_audit_object_1;
drop schema pgaudit_audit_object_1;
create role davide WITH PASSWORD 'jw8s0F411_1';
ALTER ROLE davide SET maintenance_work_mem = 100000;
alter role davide rename to davide1;
drop role davide1;
create table pgaudit_audit_object (a int, b int);
CREATE VIEW vista AS SELECT * from pgaudit_audit_object;
alter view vista rename to vista1;
drop view vista1;
drop table pgaudit_audit_object;
CREATE DATABASE lusiadas;
alter database lusiadas rename to lusiadas1;
drop database lusiadas1;
create table base_table(a int,b int,c int);
insert into base_table values(1,1,1);
insert into base_table values(2,1,1);
insert into base_table values(2,1,2);
insert into base_table values(2,2,12);
insert into base_table values(3,5,7);
insert into base_table values(3,5,7);
insert into base_table values(1,1,10);
insert into base_table values(2,2,10);
insert into base_table values(3,3,5);
insert into base_table values(3,3,5);
insert into base_table values(4,6,8);
insert into base_table values(4,6,8);
create table col_rep_tb1(a int,b int,c int) with(orientation=column)  ;
insert into col_rep_tb1 select * from base_table;
delete from col_rep_tb1 where col_rep_tb1.a>1 and col_rep_tb1.c<10;
drop table col_rep_tb1 cascade;
drop table base_table cascade;
create table trans_base_table
(
	 a_tinyint tinyint ,
	 a_smallint smallint not null,
	 a_numeric numeric(18,2) , 
	 a_decimal decimal null,
	 a_real real null,
	 a_double_precision double precision null,
	 a_dec   dec ,
	 a_integer   integer default 100,
	 a_char char(5) not null,
	 a_varchar varchar(15) null,
	 a_nvarchar2 nvarchar2(10) null,
	 a_text text   null,
	 a_date date default '2015-07-07',
	 a_time time without time zone,
	 a_timetz time with time zone default '2013-01-25 23:41:38.8',
	 a_smalldatetime smalldatetime,
	 a_money  money not null,
	 a_interval interval
);
insert into trans_base_table (a_smallint,a_char,a_text,a_money) values(generate_series(1,500),'fkdll','65sdcbas',20);
insert into trans_base_table (a_smallint,a_char,a_text,a_money) values(100,'fkdll','65sdcbas',generate_series(1,400));
create table create_columnar_repl_trans_002
(
	 a_tinyint tinyint ,
	 a_smallint smallint not null,
	 a_numeric numeric(18,2) , 
	 a_decimal decimal null,
	 a_real real null,
	 a_double_precision double precision null,
	 a_dec   dec ,
	 a_integer   integer default 100,
	 a_char char(5) not null,
	 a_varchar varchar(15) null,
	 a_nvarchar2 nvarchar2(10) null,
	 a_text text   null,
	 a_date date default '2015-07-07',
	 a_time time without time zone,
	 a_timetz time with time zone default '2013-01-25 23:41:38.8',
	 a_smalldatetime smalldatetime,
	 a_money  money not null,
	 a_interval interval,
partial cluster key(a_smallint)) with (orientation=column, compression = high)  ;
create index create_index_repl_trans_002 on create_columnar_repl_trans_002(a_smallint,a_date,a_integer);
insert into create_columnar_repl_trans_002 select * from trans_base_table;
start transaction;
alter table  create_columnar_repl_trans_002 add column a_char_01 char(20) default '中国制造';
insert into  create_columnar_repl_trans_002 (a_smallint,a_char,a_money,a_char_01) values(generate_series(1,10),'li',21.1,'高斯部');
delete from create_columnar_repl_trans_002 where a_smallint>5 and a_char_01='高斯部';
rollback;
drop table create_columnar_repl_trans_002 cascade;
drop table trans_base_table cascade;
\c -
