-- test create type table of 
-- check compatibility --
show sql_compatibility; -- expect A --
 sql_compatibility 
-------------------
 A
(1 row)

-- create new schema --
drop schema if exists huge_clob;
NOTICE:  schema "huge_clob" does not exist, skipping
create schema huge_clob;
set current_schema = huge_clob;
drop table if exists cloblongtbl;
NOTICE:  table "cloblongtbl" does not exist, skipping
create table cloblongtbl (a int, b clob, c clob);
-- insert data less than 1G
insert into cloblongtbl values (generate_series(1,4),repeat('唐李白床前明月光，疑是地上霜，举头望明月，低头思故乡',5000000),repeat('唐李白床前明月光，疑是地上霜，举头望明月，低头思故乡',5000000));
update cloblongtbl set b = b||b;
update cloblongtbl set c = c||c;
-- b > 1G && c < 1G when a = 2
update cloblongtbl set b = b||b where a = 2;
-- b < 1G && c > 1G when a = 3
update cloblongtbl set c = c||c where a = 3;
-- b > 1G && c > 1G when a = 4
update cloblongtbl set b = b||b where a = 4;
update cloblongtbl set c = c||c where a = 4;
select a, length(b || c) from cloblongtbl order by 1;
 a |   length   
---+------------
 1 |  520000000
 2 |  780000000
 3 |  780000000
 4 | 1040000000
(4 rows)

-- reset data for other test
update cloblongtbl set b = b || b where a = 1;
update cloblongtbl set b = b || b where a = 3;
update cloblongtbl set c='cloblessthan1G' where a = 1;
update cloblongtbl set c='cloblessthan1G' where a = 2;
update cloblongtbl set c='cloblessthan1G' where a = 3;
update cloblongtbl set c='cloblessthan1G' where a = 4;
--I1.clob in
create or replace procedure pro_cb4_031(c1 clob,c2 clob)
is
v1 clob;
v2 clob;
begin
v1:=dbe_lob.substr(c1,10,1);
v2:=dbe_lob.substr(c2,10,1);
raise info 'c1 is %',v1;
raise info 'c2 is %',v2;
end;
/
create or replace procedure pro_cb4_031_1 is
v1 clob;
v2 clob;
begin
execute immediate 'select b from cloblongtbl where a=1' into v1;
execute immediate 'select c from cloblongtbl where a=1' into v2;
pro_cb4_031(v1,v2);
end;
/
call pro_cb4_031_1();
ERROR:  huge clob do not support as function in parameter
CONTEXT:  PL/pgSQL function pro_cb4_031(clob,clob) line 5 at assignment
SQL statement "CALL pro_cb4_031(v1,v2)"
PL/pgSQL function pro_cb4_031_1() line 7 at PERFORM
create or replace procedure pro_cb4_005 is
v1 clob;
v2 clob;
v3 clob;
v4 integer;
begin
execute immediate 'select b from cloblongtbl where a=1' into v1;
dbe_lob.read(v1,10,2,v2);
end;
/
call pro_cb4_005();
 pro_cb4_005 
-------------
 
(1 row)

--I2.clob > 1G out
create or replace procedure pro_cb4_031(c1 out clob,c2 out clob)
is
v1 clob;
v2 clob;
begin
execute immediate 'select b from cloblongtbl where a=1' into v1;
execute immediate 'select c from cloblongtbl where a=1' into v2;
c1:=v1;
c2:=v2;
end;
/
create or replace procedure pro_cb4_031_1 is
v1 clob;
v2 clob;
v3 clob;
v4 clob;
begin
pro_cb4_031(v1,v2);
v3:=dbe_lob.substr(v1,10,1);
v4:=dbe_lob.substr(v2,10,1);
raise info 'v3 is %',v3;
raise info 'v4 is %',v4;
end;
/
call pro_cb4_031_1();
ERROR:  clob from execute into do not support assign.
CONTEXT:  PL/pgSQL function pro_cb4_031() line 7 at assignment
SQL statement "CALL pro_cb4_031(v1,v2)"
PL/pgSQL function pro_cb4_031_1() line 7 at SQL statement
-- <1G out
create or replace procedure pro_cb4_031(c1 out clob,c2 out clob)
is
v1 clob;
v2 clob;
begin
execute immediate 'select c from cloblongtbl where a=1' into v1;
execute immediate 'select c from cloblongtbl where a=2' into v2;
c1:=v1;
c2:=v2;
end;
/
call pro_cb4_031_1();
ERROR:  clob from execute into do not support assign.
CONTEXT:  PL/pgSQL function pro_cb4_031() line 7 at assignment
SQL statement "CALL pro_cb4_031(v1,v2)"
PL/pgSQL function pro_cb4_031_1() line 7 at SQL statement
--I3.clob as inout
create or replace procedure pro_cb4_031(c1 inout clob,c2 inout clob)
is
v1 clob;
v2 clob;
begin
execute immediate 'select b from cloblongtbl where a=1' into v1;
execute immediate 'select c from cloblongtbl where a=1' into v2;
c1:=v1;
c2:=v2;
end;
/
create or replace procedure pro_cb4_031_1 is
v1 clob;
v2 clob;
v3 clob;
v4 clob;
begin
pro_cb4_031(v1,v2);
v3:=dbe_lob.substr(v1,10,1);
v4:=dbe_lob.substr(v2,10,1);
raise info 'v3 is %',v3;
raise info 'v4 is %',v4;
end;
/
call pro_cb4_031_1();
ERROR:  clob from execute into do not support assign.
CONTEXT:  PL/pgSQL function pro_cb4_031(clob,clob) line 7 at assignment
SQL statement "CALL pro_cb4_031(v1,v2)"
PL/pgSQL function pro_cb4_031_1() line 7 at SQL statement
--I4. < 1GB clob inout
create or replace procedure pro_cb4_031(c1 inout clob,c2 clob,c3 out clob)
is
v1 clob;
v2 clob;
v3 clob;
begin
execute immediate 'select c from cloblongtbl where a=1' into v1;
execute immediate 'select c from cloblongtbl where a=2' into v2;
execute immediate 'select c from cloblongtbl where a=3' into v3;
c1:=v1;
c2:=v2;
c3:=v3||'clobclobclobclob';
end;
/
create or replace procedure pro_cb4_031_1 is
v1 clob;
v2 clob;
v3 clob;
v4 clob;
v5 clob;
v6 clob;
begin
pro_cb4_031(v1,v2,v3);
v4:=dbe_lob.substr(v1,10,1);
v5:=dbe_lob.substr(v2,10,1);
v6:=dbe_lob.substr(v3,10,1);
raise info 'v4 is %',v4;
raise info 'v5 is %',v5;
raise info 'v6 is %',v6;
end;
/
call pro_cb4_031_1();
ERROR:  clob from execute into do not support assign.
CONTEXT:  PL/pgSQL function pro_cb4_031(clob,clob) line 9 at assignment
SQL statement "CALL pro_cb4_031(v1,v2,v3)"
PL/pgSQL function pro_cb4_031_1() line 9 at SQL statement
--I5. table of clob
create or replace procedure pro_cb4_031 is
type ty1 is table of clob;
v1 ty1;
begin
for i in 1..10 loop
execute immediate 'select b from cloblongtbl where a='||i into v1(i);
update cloblongtbl set c=v1(i)||v1(i) where a=i;
end loop;
end;
/
call pro_cb4_031();
ERROR:  huge clob do not support as table of element.
CONTEXT:  PL/pgSQL function pro_cb4_031() line 6 at EXECUTE statement
-- array 
create or replace procedure pro_cb4_031 is
type ty1 is varray(10) of clob;
v1 ty1;
begin
for i in 1..10 loop
execute immediate 'select b from cloblongtbl where a='||i into v1(i);
update cloblongtbl set c=v1(i)||v1(i) where a=i;
end loop;
end;
/
call pro_cb4_031();
ERROR:  huge clob do not support as array element.
CONTEXT:  PL/pgSQL function pro_cb4_031() line 6 at EXECUTE statement
select a,b,length(b),c,length(c) from cloblongtbl where a>5 and a<10 order by 1,2,3,4,5;
 a | b | length | c | length 
---+---+--------+---+--------
(0 rows)

update cloblongtbl set c='cloblessthan1G';
--I6.record 
create or replace procedure pro_cb4_031 is
type ty1 is record(c1 int,c2 clob);
v1 ty1;
begin
execute immediate 'select b from cloblongtbl where a=1' into v1.c2;
end;
/
call pro_cb4_031();
 pro_cb4_031 
-------------
 
(1 row)

--I7 fetch 
create or replace procedure pro_cb4_037 is
v1 clob;
v2 clob;
v3 clob;
v4 int;
cursor cor1 is select b from cloblongtbl where a=1;
begin
open cor1;
loop
fetch cor1 into v1;
fetch cor1 into v1;
fetch cor1 into v1;
fetch cor1 into v1;
fetch cor1 into v1;
exit when cor1%notfound;
end loop;
close cor1;
end;
/
call pro_cb4_037();
 pro_cb4_037 
-------------
 
(1 row)

create or replace procedure test_self_update is
v1 clob;
begin
execute immediate 'select b from cloblongtbl where a=1' into v1;
update cloblongtbl set b=v1 where a=1;
savepoint aaa;
update cloblongtbl set b=v1 where a=2;
rollback to aaa;
commit;
end;
/
call test_self_update();
 test_self_update 
------------------
 
(1 row)

create or replace procedure test_update_delete is
v1 clob;
begin
execute immediate 'select b from cloblongtbl where a=1' into v1;
update cloblongtbl set b=v1 where a=1;
rollback;
update cloblongtbl set b=v1 where a=2;
commit;
end;
/
call test_update_delete();
 test_update_delete 
--------------------
 
(1 row)

begin;
delete from cloblongtbl where a < 3;
rollback;
begin;
delete from cloblongtbl where a = 1;
delete from cloblongtbl where a = 2;
rollback;
drop table if exists cloblongtbl;
-- clean
drop schema if exists huge_clob cascade;
NOTICE:  drop cascades to 6 other objects
DETAIL:  drop cascades to function pro_cb4_005()
drop cascades to function pro_cb4_031_1()
drop cascades to function pro_cb4_031()
drop cascades to function pro_cb4_037()
drop cascades to function test_self_update()
drop cascades to function test_update_delete()
