--01--------------------------------------------------------------------
--syntax test ,  base update command
create table cstore_update_table
(
	c1 int ,
	c2 int
)with(orientation = column)
partition by range (c1)
(
	partition cstore_update_table_p0 values less than (5),
	partition cstore_update_table_p1 values less than (10),
	partition cstore_update_table_p2 values less than (15)
);
create index on cstore_update_table(c1,c2)local;
insert into cstore_update_table select generate_series(0,10), generate_series(0,10);
select * from cstore_update_table order by c1;
 c1 | c2 
----+----
  0 |  0
  1 |  1
  2 |  2
  3 |  3
  4 |  4
  5 |  5
  6 |  6
  7 |  7
  8 |  8
  9 |  9
 10 | 10
(11 rows)

--10 rows   1---10
update cstore_update_table set c2 = c2 + 10;
select * from cstore_update_table order by c1;
 c1 | c2 
----+----
  0 | 10
  1 | 11
  2 | 12
  3 | 13
  4 | 14
  5 | 15
  6 | 16
  7 | 17
  8 | 18
  9 | 19
 10 | 20
(11 rows)

--10 rows   10---20
drop table cstore_update_table;
--02--------------------------------------------------------------------
--where clause
create table cstore_update_table
(
	c1 int ,
	c2 int
)with(orientation = column)
partition by range (c1)
(
	partition cstore_update_table_p0 values less than (5),
	partition cstore_update_table_p1 values less than (10),
	partition cstore_update_table_p2 values less than (15)
);
create index on cstore_update_table(c1,c2)local;
insert into cstore_update_table select generate_series(0,10), generate_series(0,10);
select * from cstore_update_table order by c1;
 c1 | c2 
----+----
  0 |  0
  1 |  1
  2 |  2
  3 |  3
  4 |  4
  5 |  5
  6 |  6
  7 |  7
  8 |  8
  9 |  9
 10 | 10
(11 rows)

--10 rows   1---10
update cstore_update_table set c2 = c2 + 10  where c2 > 5;
select * from cstore_update_table order by 1, 2;
 c1 | c2 
----+----
  0 |  0
  1 |  1
  2 |  2
  3 |  3
  4 |  4
  5 |  5
  6 | 16
  7 | 17
  8 | 18
  9 | 19
 10 | 20
(11 rows)

--10 rows   1-5   16-20
drop table cstore_update_table;
--05--------------------------------------------------------------------
--update the non partition key column 
create table cstore_update_table
(
	c1 int ,
	c2 int ,
	c3 int
)with(orientation = column)
partition by range (c1, c2)
(
	partition cstore_update_table_p0 values less than (5,5),
	partition cstore_update_table_p1 values less than (10,10),
	partition cstore_update_table_p2 values less than (15,15)
);
create index on cstore_update_table(c1,c2)local;
insert into cstore_update_table select generate_series(0,10), generate_series(0,10), generate_series(0,10);
update cstore_update_table set c3 = 0 ;
select * from cstore_update_table order by 1, 2, 3;
 c1 | c2 | c3 
----+----+----
  0 |  0 |  0
  1 |  1 |  0
  2 |  2 |  0
  3 |  3 |  0
  4 |  4 |  0
  5 |  5 |  0
  6 |  6 |  0
  7 |  7 |  0
  8 |  8 |  0
  9 |  9 |  0
 10 | 10 |  0
(11 rows)

-- 11 rows ,  all 0
drop table cstore_update_table;
--06--------------------------------------------------------------------
--update the partition key ,but no row movenment 
create table cstore_update_table
(
	c1 int ,
	c2 int ,
	c3 int
)with(orientation = column)
partition by range (c1, c2 )
(
	partition cstore_update_table_p0 values less than (10,0),
	partition cstore_update_table_p1 values less than (20,0),
	partition cstore_update_table_p2 values less than (30,0)
);
create index on cstore_update_table(c1,c2)local;
insert into cstore_update_table select generate_series(0,29), generate_series(0,29), generate_series(0,29);
update cstore_update_table set c3 = 0 where c1 < 10 ;
select * from cstore_update_table order by 1, 2, 3;
 c1 | c2 | c3 
----+----+----
  0 |  0 |  0
  1 |  1 |  0
  2 |  2 |  0
  3 |  3 |  0
  4 |  4 |  0
  5 |  5 |  0
  6 |  6 |  0
  7 |  7 |  0
  8 |  8 |  0
  9 |  9 |  0
 10 | 10 | 10
 11 | 11 | 11
 12 | 12 | 12
 13 | 13 | 13
 14 | 14 | 14
 15 | 15 | 15
 16 | 16 | 16
 17 | 17 | 17
 18 | 18 | 18
 19 | 19 | 19
 20 | 20 | 20
 21 | 21 | 21
 22 | 22 | 22
 23 | 23 | 23
 24 | 24 | 24
 25 | 25 | 25
 26 | 26 | 26
 27 | 27 | 27
 28 | 28 | 28
 29 | 29 | 29
(30 rows)

-- 30 rows ,   c1 = 0 in first 10 rows  
drop table cstore_update_table;
--07--------------------------------------------------------------------
--row movement ,but no interval partition been created
create table cstore_update_table
(
	c1 int ,
	c2 int ,
	c3 int
)with(orientation = column)
partition by range (c1, c2 )
(
	partition cstore_update_table_p0 values less than (10,0),
	partition cstore_update_table_p1 values less than (20,0),
	partition cstore_update_table_p2 values less than (30,0)
)enable row movement;
create index on cstore_update_table(c1, c2)local;
insert into cstore_update_table select generate_series(0,29), generate_series(0,29), generate_series(0,29);
update cstore_update_table set c3 = c3 + 5 where c1 < 10 ;
select * from cstore_update_table order by c1;
 c1 | c2 | c3 
----+----+----
  0 |  0 |  5
  1 |  1 |  6
  2 |  2 |  7
  3 |  3 |  8
  4 |  4 |  9
  5 |  5 | 10
  6 |  6 | 11
  7 |  7 | 12
  8 |  8 | 13
  9 |  9 | 14
 10 | 10 | 10
 11 | 11 | 11
 12 | 12 | 12
 13 | 13 | 13
 14 | 14 | 14
 15 | 15 | 15
 16 | 16 | 16
 17 | 17 | 17
 18 | 18 | 18
 19 | 19 | 19
 20 | 20 | 20
 21 | 21 | 21
 22 | 22 | 22
 23 | 23 | 23
 24 | 24 | 24
 25 | 25 | 25
 26 | 26 | 26
 27 | 27 | 27
 28 | 28 | 28
 29 | 29 | 29
(30 rows)

-- 30 rows ,   c1 = 0 in first 10 rows  
drop table cstore_update_table;
--08--------------------------------------------------------------------
--update the partition key , has row movement ,and a new interval partition been created because of row movement
create table cstore_update_table
(
	c1 int ,
	c2 int ,
	c3 int
)with(orientation = column)
partition by range (c1)
(
	partition cstore_update_table_p0 values less than (10),
	partition cstore_update_table_p1 values less than (20),
	partition cstore_update_table_p2 values less than (30)
)enable row movement;
create index on cstore_update_table(c1,c2)local;
insert into cstore_update_table select generate_series(0,29), generate_series(0,29), generate_series(0,29);
update cstore_update_table set c3 = c3 + 5 where c1 < 30 ;
select * from cstore_update_table order by c1;
 c1 | c2 | c3 
----+----+----
  0 |  0 |  5
  1 |  1 |  6
  2 |  2 |  7
  3 |  3 |  8
  4 |  4 |  9
  5 |  5 | 10
  6 |  6 | 11
  7 |  7 | 12
  8 |  8 | 13
  9 |  9 | 14
 10 | 10 | 15
 11 | 11 | 16
 12 | 12 | 17
 13 | 13 | 18
 14 | 14 | 19
 15 | 15 | 20
 16 | 16 | 21
 17 | 17 | 22
 18 | 18 | 23
 19 | 19 | 24
 20 | 20 | 25
 21 | 21 | 26
 22 | 22 | 27
 23 | 23 | 28
 24 | 24 | 29
 25 | 25 | 30
 26 | 26 | 31
 27 | 27 | 32
 28 | 28 | 33
 29 | 29 | 34
(30 rows)

-- 30 rows ,   c1 = 0 in first 10 rows  
drop table cstore_update_table;
