--change datestyle to Postgres
SET Datestyle = 'Postgres,DMY';
--change datestyle to ISO mode which is default output style of GaussDB
set datestyle = iso,ymd;
create schema hw_datatype_3;
set search_path = hw_datatype_3;
--smalldatetime
CREATE TABLE SMALLDATETIME_TBL (d1 smalldatetime);
SELECT LOCALTIMESTAMP;
--?.*
--?.*
--?.*
(1 row)

INSERT INTO SMALLDATETIME_TBL VALUES ('now');
INSERT INTO SMALLDATETIME_TBL VALUES ('today');
SHOW TIMEZONE; 
 TimeZone 
----------
--?.*
(1 row)

SELECT * FROM SMALLDATETIME_TBL;
         d1          
---------------------
--?.*
--?.*
--?.*

INSERT INTO SMALLDATETIME_TBL VALUES ('yesterday');
INSERT INTO SMALLDATETIME_TBL VALUES ('tomorrow');
INSERT INTO SMALLDATETIME_TBL VALUES ('tomorrow EST');
INSERT INTO SMALLDATETIME_TBL VALUES ('tomorrow zulu');
SELECT * FROM SMALLDATETIME_TBL;
         d1          
---------------------
--?.*
--?.*
--?.*
--?.*
--?.*
--?.*
--?.*

EXPLAIN (VERBOSE on, COSTS on) SELECT count(*) AS One FROM SMALLDATETIME_TBL WHERE d1 = smalldatetime  'today';
                                      QUERY PLAN                                       
---------------------------------------------------------------------------------------
--? Aggregate  (cost=.* rows=1 width=8)
   Output: count(*)
--?   ->  Seq Scan on hw_datatype_3.smalldatetime_tbl  (cost=.* rows=11 width=0)
         Output: d1
--?         Filter: .*
(5 rows)

SELECT count(*) AS One FROM SMALLDATETIME_TBL WHERE d1 = smalldatetime  'today';
 one 
-----
   1
(1 row)

SELECT count(*) AS Three FROM SMALLDATETIME_TBL WHERE d1 = smalldatetime  'tomorrow';
 three 
-------
     3
(1 row)

SELECT count(*) AS One FROM SMALLDATETIME_TBL WHERE d1 = smalldatetime  'yesterday';
 one 
-----
   1
(1 row)

DELETE FROM SMALLDATETIME_TBL;
-- Special values
INSERT INTO SMALLDATETIME_TBL VALUES ('-infinity');
INSERT INTO SMALLDATETIME_TBL VALUES ('infinity');
INSERT INTO SMALLDATETIME_TBL VALUES ('epoch');
-- Obsolete special values
INSERT INTO SMALLDATETIME_TBL VALUES ('invalid');
ERROR:  date/time value "invalid" is no longer supported
LINE 1: INSERT INTO SMALLDATETIME_TBL VALUES ('invalid');
                                              ^
CONTEXT:  referenced column: d1
INSERT INTO SMALLDATETIME_TBL VALUES ('undefined');
ERROR:  date/time value "undefined" is no longer supported
LINE 1: INSERT INTO SMALLDATETIME_TBL VALUES ('undefined');
                                              ^
CONTEXT:  referenced column: d1
INSERT INTO SMALLDATETIME_TBL VALUES ('current');
ERROR:  date/time value "current" is no longer supported
LINE 1: INSERT INTO SMALLDATETIME_TBL VALUES ('current');
                                              ^
CONTEXT:  referenced column: d1
DROP TABLE SMALLDATETIME_TBL;
create table smalldatetime_test(i smalldatetime,k smalldatetime);
insert into smalldatetime_test values ('1997-01-01 03:04','1997-02-02 03:04');
insert into smalldatetime_test values ('1997-03-03 12:44','1997-02-02 07:44');
insert into smalldatetime_test values ('1997-03-03 11:04','1997-03-03 11:04');
insert into smalldatetime_test values ('1997-03-03 11:04:29','1997-03-03 11:04:12');
insert into smalldatetime_test values ('1997-03-03 11:59:29','1997-03-03 11:59:30');
insert into smalldatetime_test values ('1997-03-03 23:59:29','1997-03-03 11:59:31');
insert into smalldatetime_test values ('1997-03-03 23:59:56','1997-03-03 11:59:59');
insert into smalldatetime_test values ('1997-03-03 23:60:56','1997-03-03 11:60:59');
ERROR:  date/time field value out of range: "1997-03-03 23:60:56"
LINE 1: insert into smalldatetime_test values ('1997-03-03 23:60:56'...
                                               ^
CONTEXT:  referenced column: i
insert into smalldatetime_test values ('1997-03-03 23:60:01','1997-03-03 11:60:30');
ERROR:  date/time field value out of range: "1997-03-03 23:60:01"
LINE 1: insert into smalldatetime_test values ('1997-03-03 23:60:01'...
                                               ^
CONTEXT:  referenced column: i
select '' as one,* from smalldatetime_test where i < k ORDER BY i,k;
 one |          i          |          k          
-----+---------------------+---------------------
     | 1997-01-01 03:04:00 | 1997-02-02 03:04:00
     | 1997-03-03 11:59:00 | 1997-03-03 12:00:00
(2 rows)

select '' as one,* from smalldatetime_test where i = k ORDER BY i,k;
 one |          i          |          k          
-----+---------------------+---------------------
     | 1997-03-03 11:04:00 | 1997-03-03 11:04:00
     | 1997-03-03 11:04:00 | 1997-03-03 11:04:00
(2 rows)

select '' as one,* from smalldatetime_test where i > k ORDER BY i,k;
 one |          i          |          k          
-----+---------------------+---------------------
     | 1997-03-03 12:44:00 | 1997-02-02 07:44:00
     | 1997-03-03 23:59:00 | 1997-03-03 12:00:00
     | 1997-03-04 00:00:00 | 1997-03-03 12:00:00
(3 rows)

select '' as two,* from smalldatetime_test where i >= k ORDER BY i,k;
 two |          i          |          k          
-----+---------------------+---------------------
     | 1997-03-03 11:04:00 | 1997-03-03 11:04:00
     | 1997-03-03 11:04:00 | 1997-03-03 11:04:00
     | 1997-03-03 12:44:00 | 1997-02-02 07:44:00
     | 1997-03-03 23:59:00 | 1997-03-03 12:00:00
     | 1997-03-04 00:00:00 | 1997-03-03 12:00:00
(5 rows)

select '' as two,* from smalldatetime_test where i <= k ORDER BY i,k;
 two |          i          |          k          
-----+---------------------+---------------------
     | 1997-01-01 03:04:00 | 1997-02-02 03:04:00
     | 1997-03-03 11:04:00 | 1997-03-03 11:04:00
     | 1997-03-03 11:04:00 | 1997-03-03 11:04:00
     | 1997-03-03 11:59:00 | 1997-03-03 12:00:00
(4 rows)

select i - k as diff from smalldatetime_test where i >= k ORDER BY i,k;
        diff        
--------------------
 @ 0
 @ 0
 @ 29 days 5 hours
 @ 11 hours 59 mins
 @ 12 hours
(5 rows)

select '' as op ,i + interval '1 year' as three,i from smalldatetime_test order by i;
 op |         three          |          i          
----+------------------------+---------------------
    | 1998-01-01 03:04:00-08 | 1997-01-01 03:04:00
    | 1998-03-03 11:04:00-08 | 1997-03-03 11:04:00
    | 1998-03-03 11:04:00-08 | 1997-03-03 11:04:00
    | 1998-03-03 11:59:00-08 | 1997-03-03 11:59:00
    | 1998-03-03 12:44:00-08 | 1997-03-03 12:44:00
    | 1998-03-03 23:59:00-08 | 1997-03-03 23:59:00
    | 1998-03-04 00:00:00-08 | 1997-03-04 00:00:00
(7 rows)

select '' as op,i - interval '1 year' as three,i from smalldatetime_test order by i;
 op |         three          |          i          
----+------------------------+---------------------
    | 1996-01-01 03:04:00-08 | 1997-01-01 03:04:00
    | 1996-03-03 11:04:00-08 | 1997-03-03 11:04:00
    | 1996-03-03 11:04:00-08 | 1997-03-03 11:04:00
    | 1996-03-03 11:59:00-08 | 1997-03-03 11:59:00
    | 1996-03-03 12:44:00-08 | 1997-03-03 12:44:00
    | 1996-03-03 23:59:00-08 | 1997-03-03 23:59:00
    | 1996-03-04 00:00:00-08 | 1997-03-04 00:00:00
(7 rows)

select '' as op,i + interval '1 month' as three,i from smalldatetime_test order by i;
 op |         three          |          i          
----+------------------------+---------------------
    | 1997-02-01 03:04:00-08 | 1997-01-01 03:04:00
    | 1997-04-03 11:04:00-08 | 1997-03-03 11:04:00
    | 1997-04-03 11:04:00-08 | 1997-03-03 11:04:00
    | 1997-04-03 11:59:00-08 | 1997-03-03 11:59:00
    | 1997-04-03 12:44:00-08 | 1997-03-03 12:44:00
    | 1997-04-03 23:59:00-08 | 1997-03-03 23:59:00
    | 1997-04-04 00:00:00-08 | 1997-03-04 00:00:00
(7 rows)

select '' as op,i - interval '1 month' as three,i from smalldatetime_test order by i;
 op |         three          |          i          
----+------------------------+---------------------
    | 1996-12-01 03:04:00-08 | 1997-01-01 03:04:00
    | 1997-02-03 11:04:00-08 | 1997-03-03 11:04:00
    | 1997-02-03 11:04:00-08 | 1997-03-03 11:04:00
    | 1997-02-03 11:59:00-08 | 1997-03-03 11:59:00
    | 1997-02-03 12:44:00-08 | 1997-03-03 12:44:00
    | 1997-02-03 23:59:00-08 | 1997-03-03 23:59:00
    | 1997-02-04 00:00:00-08 | 1997-03-04 00:00:00
(7 rows)

select '' as op,i + interval '1 day' as three,i from smalldatetime_test order by i;
 op |         three          |          i          
----+------------------------+---------------------
    | 1997-01-02 03:04:00-08 | 1997-01-01 03:04:00
    | 1997-03-04 11:04:00-08 | 1997-03-03 11:04:00
    | 1997-03-04 11:04:00-08 | 1997-03-03 11:04:00
    | 1997-03-04 11:59:00-08 | 1997-03-03 11:59:00
    | 1997-03-04 12:44:00-08 | 1997-03-03 12:44:00
    | 1997-03-04 23:59:00-08 | 1997-03-03 23:59:00
    | 1997-03-05 00:00:00-08 | 1997-03-04 00:00:00
(7 rows)

select '' as op,i - interval '1 day' as three,i from smalldatetime_test order by i;
 op |         three          |          i          
----+------------------------+---------------------
    | 1996-12-31 03:04:00-08 | 1997-01-01 03:04:00
    | 1997-03-02 11:04:00-08 | 1997-03-03 11:04:00
    | 1997-03-02 11:04:00-08 | 1997-03-03 11:04:00
    | 1997-03-02 11:59:00-08 | 1997-03-03 11:59:00
    | 1997-03-02 12:44:00-08 | 1997-03-03 12:44:00
    | 1997-03-02 23:59:00-08 | 1997-03-03 23:59:00
    | 1997-03-03 00:00:00-08 | 1997-03-04 00:00:00
(7 rows)

select '' as op,i + interval '1 hour' as three,i from smalldatetime_test order by i;
 op |         three          |          i          
----+------------------------+---------------------
    | 1997-01-01 04:04:00-08 | 1997-01-01 03:04:00
    | 1997-03-03 12:04:00-08 | 1997-03-03 11:04:00
    | 1997-03-03 12:04:00-08 | 1997-03-03 11:04:00
    | 1997-03-03 12:59:00-08 | 1997-03-03 11:59:00
    | 1997-03-03 13:44:00-08 | 1997-03-03 12:44:00
    | 1997-03-04 00:59:00-08 | 1997-03-03 23:59:00
    | 1997-03-04 01:00:00-08 | 1997-03-04 00:00:00
(7 rows)

select '' as op,i - interval '1 hour' as three,i from smalldatetime_test order by i;
 op |         three          |          i          
----+------------------------+---------------------
    | 1997-01-01 02:04:00-08 | 1997-01-01 03:04:00
    | 1997-03-03 10:04:00-08 | 1997-03-03 11:04:00
    | 1997-03-03 10:04:00-08 | 1997-03-03 11:04:00
    | 1997-03-03 10:59:00-08 | 1997-03-03 11:59:00
    | 1997-03-03 11:44:00-08 | 1997-03-03 12:44:00
    | 1997-03-03 22:59:00-08 | 1997-03-03 23:59:00
    | 1997-03-03 23:00:00-08 | 1997-03-04 00:00:00
(7 rows)

select '' as op,i + interval '1 minute' as three,i from smalldatetime_test order by i;
 op |         three          |          i          
----+------------------------+---------------------
    | 1997-01-01 03:05:00-08 | 1997-01-01 03:04:00
    | 1997-03-03 11:05:00-08 | 1997-03-03 11:04:00
    | 1997-03-03 11:05:00-08 | 1997-03-03 11:04:00
    | 1997-03-03 12:00:00-08 | 1997-03-03 11:59:00
    | 1997-03-03 12:45:00-08 | 1997-03-03 12:44:00
    | 1997-03-04 00:00:00-08 | 1997-03-03 23:59:00
    | 1997-03-04 00:01:00-08 | 1997-03-04 00:00:00
(7 rows)

select '' as op,i - interval '1 minute' as three,i from smalldatetime_test order by i;
 op |         three          |          i          
----+------------------------+---------------------
    | 1997-01-01 03:03:00-08 | 1997-01-01 03:04:00
    | 1997-03-03 11:03:00-08 | 1997-03-03 11:04:00
    | 1997-03-03 11:03:00-08 | 1997-03-03 11:04:00
    | 1997-03-03 11:58:00-08 | 1997-03-03 11:59:00
    | 1997-03-03 12:43:00-08 | 1997-03-03 12:44:00
    | 1997-03-03 23:58:00-08 | 1997-03-03 23:59:00
    | 1997-03-03 23:59:00-08 | 1997-03-04 00:00:00
(7 rows)

select '' as years, extract(year from i),i from smalldatetime_test order by i,k;
 years | date_part |          i          
-------+-----------+---------------------
       |      1997 | 1997-01-01 03:04:00
       |      1997 | 1997-03-03 11:04:00
       |      1997 | 1997-03-03 11:04:00
       |      1997 | 1997-03-03 11:59:00
       |      1997 | 1997-03-03 12:44:00
       |      1997 | 1997-03-03 23:59:00
       |      1997 | 1997-03-04 00:00:00
(7 rows)

select '' as months, extract(month from i),i from smalldatetime_test order by i,k;
 months | date_part |          i          
--------+-----------+---------------------
        |         1 | 1997-01-01 03:04:00
        |         3 | 1997-03-03 11:04:00
        |         3 | 1997-03-03 11:04:00
        |         3 | 1997-03-03 11:59:00
        |         3 | 1997-03-03 12:44:00
        |         3 | 1997-03-03 23:59:00
        |         3 | 1997-03-04 00:00:00
(7 rows)

select '' as days, extract(day from i),i from smalldatetime_test order by i,k;
 days | date_part |          i          
------+-----------+---------------------
      |         1 | 1997-01-01 03:04:00
      |         3 | 1997-03-03 11:04:00
      |         3 | 1997-03-03 11:04:00
      |         3 | 1997-03-03 11:59:00
      |         3 | 1997-03-03 12:44:00
      |         3 | 1997-03-03 23:59:00
      |         4 | 1997-03-04 00:00:00
(7 rows)

select '' as hours, extract(hour from i),i from smalldatetime_test order by i,k;
 hours | date_part |          i          
-------+-----------+---------------------
       |         3 | 1997-01-01 03:04:00
       |        11 | 1997-03-03 11:04:00
       |        11 | 1997-03-03 11:04:00
       |        11 | 1997-03-03 11:59:00
       |        12 | 1997-03-03 12:44:00
       |        23 | 1997-03-03 23:59:00
       |         0 | 1997-03-04 00:00:00
(7 rows)

select '' as minutes, extract(minute from i),i from smalldatetime_test order by i;
 minutes | date_part |          i          
---------+-----------+---------------------
         |         4 | 1997-01-01 03:04:00
         |         4 | 1997-03-03 11:04:00
         |         4 | 1997-03-03 11:04:00
         |        59 | 1997-03-03 11:59:00
         |        44 | 1997-03-03 12:44:00
         |        59 | 1997-03-03 23:59:00
         |         0 | 1997-03-04 00:00:00
(7 rows)

select '' as seconds, extract(seconds from i),i from smalldatetime_test order by i;
 seconds | date_part |          i          
---------+-----------+---------------------
         |         0 | 1997-01-01 03:04:00
         |         0 | 1997-03-03 11:04:00
         |         0 | 1997-03-03 11:04:00
         |         0 | 1997-03-03 11:59:00
         |         0 | 1997-03-03 12:44:00
         |         0 | 1997-03-03 23:59:00
         |         0 | 1997-03-04 00:00:00
(7 rows)

select date_trunc( 'month', i) AS week_trunc from smalldatetime_test order by i;
       week_trunc       
------------------------
 1997-01-01 00:00:00-08
 1997-03-01 00:00:00-08
 1997-03-01 00:00:00-08
 1997-03-01 00:00:00-08
 1997-03-01 00:00:00-08
 1997-03-01 00:00:00-08
 1997-03-01 00:00:00-08
(7 rows)

select date_trunc( 'day', i) AS week_trunc from smalldatetime_test order by i;
       week_trunc       
------------------------
 1997-01-01 00:00:00-08
 1997-03-03 00:00:00-08
 1997-03-03 00:00:00-08
 1997-03-03 00:00:00-08
 1997-03-03 00:00:00-08
 1997-03-03 00:00:00-08
 1997-03-04 00:00:00-08
(7 rows)

select date_trunc( 'hour', i) AS week_trunc from smalldatetime_test order by i;
       week_trunc       
------------------------
 1997-01-01 03:00:00-08
 1997-03-03 11:00:00-08
 1997-03-03 11:00:00-08
 1997-03-03 11:00:00-08
 1997-03-03 12:00:00-08
 1997-03-03 23:00:00-08
 1997-03-04 00:00:00-08
(7 rows)

select date_trunc( 'minute', i) AS week_trunc from smalldatetime_test order by i;
       week_trunc       
------------------------
 1997-01-01 03:04:00-08
 1997-03-03 11:04:00-08
 1997-03-03 11:04:00-08
 1997-03-03 11:59:00-08
 1997-03-03 12:44:00-08
 1997-03-03 23:59:00-08
 1997-03-04 00:00:00-08
(7 rows)

drop table smalldatetime_test;
create table smalldatetime_test(id int,dates smalldatetime, primary key(id,dates));
NOTICE:  CREATE TABLE / PRIMARY KEY will create implicit index "smalldatetime_test_pkey" for table "smalldatetime_test"
insert into smalldatetime_test values(1,'1997-01-01 03:04:11');
insert into smalldatetime_test values(2,'1997-01-02 03:05:30');
insert into smalldatetime_test values(3,'1997-01-02 03:05:30');
insert into smalldatetime_test values(4,'2001-11-12 11:05:31');
insert into smalldatetime_test values(5,'2007-12-32 11:05:31');                                          
ERROR:  date/time field value out of range: "2007-12-32 11:05:31"
LINE 1: insert into smalldatetime_test values(5,'2007-12-32 11:05:31...
                                                ^
HINT:  Perhaps you need a different "datestyle" setting.
CONTEXT:  referenced column: dates
insert into smalldatetime_test values(6,'2007-13-30 11:05:31');                                              
ERROR:  date/time field value out of range: "2007-13-30 11:05:31"
LINE 1: insert into smalldatetime_test values(6,'2007-13-30 11:05:31...
                                                ^
HINT:  Perhaps you need a different "datestyle" setting.
CONTEXT:  referenced column: dates
insert into smalldatetime_test values(6,'2007-12-30 24:05:31');
ERROR:  date/time field value out of range: "2007-12-30 24:05:31"
LINE 1: insert into smalldatetime_test values(6,'2007-12-30 24:05:31...
                                                ^
CONTEXT:  referenced column: dates
insert into smalldatetime_test values(6,'2007-12-30 23:60:31');                                            ^
ERROR:  date/time field value out of range: "2007-12-30 23:60:31"
LINE 1: insert into smalldatetime_test values(6,'2007-12-30 23:60:31...
                                                ^
CONTEXT:  referenced column: dates
insert into smalldatetime_test values(6,'2007-12-30 23:20:60');
ERROR:  syntax error at or near "^"
LINE 1: ^
        ^
select * from smalldatetime_test order by 1,2;
 id |        dates        
----+---------------------
  1 | 1997-01-01 03:04:00
  2 | 1997-01-02 03:06:00
  3 | 1997-01-02 03:06:00
  4 | 2001-11-12 11:06:00
(4 rows)

select * from smalldatetime_test where dates BETWEEN '1997-01-02' AND '2038-01-01' order by 1,2;
 id |        dates        
----+---------------------
  2 | 1997-01-02 03:06:00
  3 | 1997-01-02 03:06:00
  4 | 2001-11-12 11:06:00
(3 rows)

select id,cast(dates as date) from smalldatetime_test order by 1,2;
 id |        dates        
----+---------------------
  1 | 1997-01-01 03:04:00
  2 | 1997-01-02 03:06:00
  3 | 1997-01-02 03:06:00
  4 | 2001-11-12 11:06:00
(4 rows)

select id,cast(dates as time) from smalldatetime_test order by 1,2;
 id |  dates   
----+----------
  1 | 03:04:00
  2 | 03:06:00
  3 | 03:06:00
  4 | 11:06:00
(4 rows)

select id,cast(dates as timestamp) from smalldatetime_test order by 1,2;
 id |        dates        
----+---------------------
  1 | 1997-01-01 03:04:00
  2 | 1997-01-02 03:06:00
  3 | 1997-01-02 03:06:00
  4 | 2001-11-12 11:06:00
(4 rows)

select id,cast(dates as timestamptz) from smalldatetime_test order by 1,2;
 id |         dates          
----+------------------------
  1 | 1997-01-01 03:04:00-08
  2 | 1997-01-02 03:06:00-08
  3 | 1997-01-02 03:06:00-08
  4 | 2001-11-12 11:06:00-08
(4 rows)

select id,cast(dates as abstime) from smalldatetime_test order by 1,2;
 id |         dates          
----+------------------------
  1 | 1997-01-01 03:04:00-08
  2 | 1997-01-02 03:06:00-08
  3 | 1997-01-02 03:06:00-08
  4 | 2001-11-12 11:06:00-08
(4 rows)

select id,cast(dates as text) from smalldatetime_test order by 1,2;
 id |        dates        
----+---------------------
  1 | 1997-01-01 03:04:00
  2 | 1997-01-02 03:06:00
  3 | 1997-01-02 03:06:00
  4 | 2001-11-12 11:06:00
(4 rows)

select id,cast(dates as varchar) from smalldatetime_test order by 1,2;
 id |        dates        
----+---------------------
  1 | 1997-01-01 03:04:00
  2 | 1997-01-02 03:06:00
  3 | 1997-01-02 03:06:00
  4 | 2001-11-12 11:06:00
(4 rows)

select id,cast(dates as varchar2) from smalldatetime_test order by 1,2;
 id |        dates        
----+---------------------
  1 | 1997-01-01 03:04:00
  2 | 1997-01-02 03:06:00
  3 | 1997-01-02 03:06:00
  4 | 2001-11-12 11:06:00
(4 rows)

select id,cast(dates as bpchar) from smalldatetime_test order by 1,2;
 id |        dates        
----+---------------------
  1 | 1997-01-01 03:04:00
  2 | 1997-01-02 03:06:00
  3 | 1997-01-02 03:06:00
  4 | 2001-11-12 11:06:00
(4 rows)

--smalldatetime to timestamp
create table timestamp_test(t timestamp);
insert into timestamp_test select dates from smalldatetime_test;
select * from timestamp_test order by 1;
          t          
---------------------
 1997-01-01 03:04:00
 1997-01-02 03:06:00
 1997-01-02 03:06:00
 2001-11-12 11:06:00
(4 rows)

drop table timestamp_test;
--smalldatetime to timestamptz
create table timestamptz_test(t timestamptz);
insert into timestamptz_test select dates from smalldatetime_test;
select * from timestamptz_test order by 1;
           t            
------------------------
 1997-01-01 03:04:00-08
 1997-01-02 03:06:00-08
 1997-01-02 03:06:00-08
 2001-11-12 11:06:00-08
(4 rows)

drop table timestamptz_test;
--smalldatetime to abstime
create table abstime_test(t abstime);
insert into abstime_test select dates from smalldatetime_test;
select * from abstime_test order by 1;
           t            
------------------------
 1997-01-01 03:04:00-08
 1997-01-02 03:06:00-08
 1997-01-02 03:06:00-08
 2001-11-12 11:06:00-08
(4 rows)

drop table abstime_test;
--smalldatetime to time
create table time_test(t time);
insert into time_test select dates from smalldatetime_test;
select * from time_test order by 1;
    t     
----------
 03:04:00
 03:06:00
 03:06:00
 11:06:00
(4 rows)

drop table time_test;
--smalldatetime to date
create table date_test(t date);
insert into date_test select dates from smalldatetime_test;
select * from date_test order by 1;
          t          
---------------------
 1997-01-01 03:04:00
 1997-01-02 03:06:00
 1997-01-02 03:06:00
 2001-11-12 11:06:00
(4 rows)

drop table date_test;
--smalldatetime to text
create table text_test(t text);
insert into text_test select dates from smalldatetime_test;
select * from text_test order by 1;
          t          
---------------------
 1997-01-01 03:04:00
 1997-01-02 03:06:00
 1997-01-02 03:06:00
 2001-11-12 11:06:00
(4 rows)

drop table text_test;
--smalldatetime to varchar2
create table smalldate_varchar(t varchar2);
insert into smalldate_varchar select dates from smalldatetime_test;
select * from smalldate_varchar order by 1;
          t          
---------------------
 1997-01-01 03:04:00
 1997-01-02 03:06:00
 1997-01-02 03:06:00
 2001-11-12 11:06:00
(4 rows)

drop table smalldate_varchar;
--varchar to smalldatetime
create table varchar_smalldate(t varchar);
insert into varchar_smalldate select dates from smalldatetime_test;
select * from varchar_smalldate order by 1;
          t          
---------------------
 1997-01-01 03:04:00
 1997-01-02 03:06:00
 1997-01-02 03:06:00
 2001-11-12 11:06:00
(4 rows)

drop table varchar_smalldate;
-- TO_CHAR()
SELECT '' AS to_char_1, to_char(dates, 'DAY Day day DY Dy dy MONTH Month month RM MON Mon mon')
   FROM smalldatetime_test order by 2;
 to_char_1 |                                         to_char                                          
-----------+------------------------------------------------------------------------------------------
           | MONDAY    Monday    monday    MON Mon mon NOVEMBER  November  november  XI   NOV Nov nov
           | THURSDAY  Thursday  thursday  THU Thu thu JANUARY   January   january   I    JAN Jan jan
           | THURSDAY  Thursday  thursday  THU Thu thu JANUARY   January   january   I    JAN Jan jan
           | WEDNESDAY Wednesday wednesday WED Wed wed JANUARY   January   january   I    JAN Jan jan
(4 rows)

SELECT '' AS to_char_2, to_char(dates, 'FMDAY FMDay FMday FMMONTH FMMonth FMmonth FMRM')
   FROM smalldatetime_test order by 2;
 to_char_2 |                         to_char                         
-----------+---------------------------------------------------------
           | MONDAY Monday monday NOVEMBER November november XI
           | THURSDAY Thursday thursday JANUARY January january I
           | THURSDAY Thursday thursday JANUARY January january I
           | WEDNESDAY Wednesday wednesday JANUARY January january I
(4 rows)

SELECT '' AS to_char_3, to_char(dates, 'Y,YYY YYYY YYY YY Y CC Q MM WW DDD DD D J')
   FROM smalldatetime_test order by 2;
 to_char_3 |                     to_char                     
-----------+-------------------------------------------------
           | 1,997 1997 997 97 7 20 1 01 01 001 01 4 2450450
           | 1,997 1997 997 97 7 20 1 01 01 002 02 5 2450451
           | 1,997 1997 997 97 7 20 1 01 01 002 02 5 2450451
           | 2,001 2001 001 01 1 21 4 11 46 316 12 2 2452226
(4 rows)

SELECT '' AS to_char_4, to_char(dates, 'FMY,YYY FMYYYY FMYYY FMYY FMY FMCC FMQ FMMM FMWW FMDDD FMDD FMD FMJ')
   FROM smalldatetime_test order by 2;
 to_char_4 |                   to_char                    
-----------+----------------------------------------------
           | 1,997 1997 997 97 7 20 1 1 1 1 1 4 2450450
           | 1,997 1997 997 97 7 20 1 1 1 2 2 5 2450451
           | 1,997 1997 997 97 7 20 1 1 1 2 2 5 2450451
           | 2,001 2001 1 1 1 21 4 11 46 316 12 2 2452226
(4 rows)

SELECT '' AS to_char_5, to_char(dates, 'HH HH12 HH24 MI')
   FROM smalldatetime_test order by 2;
 to_char_5 |   to_char   
-----------+-------------
           | 03 03 03 04
           | 03 03 03 06
           | 03 03 03 06
           | 11 11 11 06
(4 rows)

SELECT '' AS to_char_6, to_char(dates, E'"HH:MI is" HH:MI "\\"text between quote marks\\""')
   FROM smalldatetime_test order by 2;
 to_char_6 |                  to_char                  
-----------+-------------------------------------------
           | HH:MI is 03:04 "text between quote marks"
           | HH:MI is 03:06 "text between quote marks"
           | HH:MI is 03:06 "text between quote marks"
           | HH:MI is 11:06 "text between quote marks"
(4 rows)

SELECT '' AS to_char_7, to_char(dates, 'HH24--text--MI--text')
   FROM smalldatetime_test order by 2;
 to_char_7 |      to_char       
-----------+--------------------
           | 03--te.t--04--te.t
           | 03--te.t--06--te.t
           | 03--te.t--06--te.t
           | 11--te.t--06--te.t
(4 rows)

SELECT '' AS to_char_8, to_char(dates, 'YYYYTH YYYYth Jth')
   FROM smalldatetime_test order by 2;
 to_char_8 |         to_char         
-----------+-------------------------
           | 1997TH 1997th 2450450th
           | 1997TH 1997th 2450451st
           | 1997TH 1997th 2450451st
           | 2001ST 2001st 2452226th
(4 rows)

SELECT '' AS to_char_9, to_char(dates, 'YYYY A.D. YYYY a.d. YYYY bc HH:MI P.M. HH:MI p.m. HH:MI pm')
   FROM smalldatetime_test order by 2;
 to_char_9 |                          to_char                           
-----------+------------------------------------------------------------
           | 1997 A.D. 1997 a.d. 1997 ad 03:04 A.M. 03:04 a.m. 03:04 am
           | 1997 A.D. 1997 a.d. 1997 ad 03:06 A.M. 03:06 a.m. 03:06 am
           | 1997 A.D. 1997 a.d. 1997 ad 03:06 A.M. 03:06 a.m. 03:06 am
           | 2001 A.D. 2001 a.d. 2001 ad 11:06 A.M. 11:06 a.m. 11:06 am
(4 rows)

SELECT '' AS to_char_10, to_char(dates, 'IYYY IYY IY I IW IDDD ID')
   FROM smalldatetime_test order by 2;
 to_char_10 |        to_char         
------------+------------------------
            | 1997 997 97 7 01 003 3
            | 1997 997 97 7 01 004 4
            | 1997 997 97 7 01 004 4
            | 2001 001 01 1 46 316 1
(4 rows)

SELECT '' AS to_char_11, to_char(dates, 'FMIYYY FMIYY FMIY FMI FMIW FMIDDD FMID')
   FROM smalldatetime_test order by 2;
 to_char_11 |       to_char       
------------+---------------------
            | 1997 997 97 7 1 3 3
            | 1997 997 97 7 1 4 4
            | 1997 997 97 7 1 4 4
            | 2001 1 1 1 46 316 1
(4 rows)

 
drop table smalldatetime_test;
select smalldatetime '2012-12-16 10:11:12' = smalldatetime '2012-12-16 10:11:16' as result;
 result 
--------
 t
(1 row)

select smalldatetime '2012-12-16 10:11:30' > smalldatetime '2012-12-16 10:11:16' as result;
 result 
--------
 t
(1 row)

select smalldatetime '2012-12-16 10:11:15' < smalldatetime '2012-12-16 10:11:31' as result;
 result 
--------
 t
(1 row)

select smalldatetime '2012-12-16 10:11:30' >= smalldatetime '2012-12-16 10:11:16' as result;
 result 
--------
 t
(1 row)

select smalldatetime '2012-12-16 10:11:15' <= smalldatetime '2012-12-16 10:11:31' as result;
 result 
--------
 t
(1 row)

select smalldatetime '2012-12-16 10:59:30' <>  smalldatetime '2012-12-16 10:59:20' as result;
 result 
--------
 t
(1 row)

--text to smalldatetime
create table text_smalldate (t smalldatetime);
insert into text_smalldate values('hello'::text);
ERROR:  column "t" is of type smalldatetime but expression is of type text
LINE 1: insert into text_smalldate values('hello'::text);
                                          ^
HINT:  You will need to rewrite or cast the expression.
CONTEXT:  referenced column: t
insert into text_smalldate values('2013-12'::text);
ERROR:  column "t" is of type smalldatetime but expression is of type text
LINE 1: insert into text_smalldate values('2013-12'::text);
                                          ^
HINT:  You will need to rewrite or cast the expression.
CONTEXT:  referenced column: t
insert into text_smalldate values('2013'::text);
ERROR:  column "t" is of type smalldatetime but expression is of type text
LINE 1: insert into text_smalldate values('2013'::text);
                                          ^
HINT:  You will need to rewrite or cast the expression.
CONTEXT:  referenced column: t
insert into text_smalldate values('201203040506'::text);
ERROR:  column "t" is of type smalldatetime but expression is of type text
LINE 1: insert into text_smalldate values('201203040506'::text);
                                          ^
HINT:  You will need to rewrite or cast the expression.
CONTEXT:  referenced column: t
insert into text_smalldate values('2012030405060708'::text);
ERROR:  column "t" is of type smalldatetime but expression is of type text
LINE 1: insert into text_smalldate values('2012030405060708'::text);
                                          ^
HINT:  You will need to rewrite or cast the expression.
CONTEXT:  referenced column: t
insert into text_smalldate values('99990909'::text);
ERROR:  column "t" is of type smalldatetime but expression is of type text
LINE 1: insert into text_smalldate values('99990909'::text);
                                          ^
HINT:  You will need to rewrite or cast the expression.
CONTEXT:  referenced column: t
insert into text_smalldate values('99990909'::text);
ERROR:  column "t" is of type smalldatetime but expression is of type text
LINE 1: insert into text_smalldate values('99990909'::text);
                                          ^
HINT:  You will need to rewrite or cast the expression.
CONTEXT:  referenced column: t
drop table text_smalldate;
--date to smalldatetime
create table date_smalldate (t smalldatetime);
insert into date_smalldate values('1997-12-14 10:24:59'::date);
insert into date_smalldate values('1997-12-14 10:24'::date);
insert into date_smalldate values('1997-12-14 10:'::date);
insert into date_smalldate values('1997-12-14'::date);
insert into date_smalldate values('1997-12'::date);
ERROR:  invalid input syntax for type timestamp: "1997-12"
LINE 1: insert into date_smalldate values('1997-12'::date);
                                          ^
insert into date_smalldate values('199712'::date);
ERROR:  date/time field value out of range: "199712"
LINE 1: insert into date_smalldate values('199712'::date);
                                          ^
HINT:  Perhaps you need a different "datestyle" setting.
insert into date_smalldate values('199712'::date);
ERROR:  date/time field value out of range: "199712"
LINE 1: insert into date_smalldate values('199712'::date);
                                          ^
HINT:  Perhaps you need a different "datestyle" setting.
drop table date_smalldate;
--INTERAL TO NUMERIC
create table test_num(mynum numeric);
select to_date('2013-03-14 14:27:00','YYYY-MM-DD HH24:MI:SS') - to_date('2013-3-1 9:00:00','YYYY-MM-DD HH24:MI:SS');
         ?column?          
---------------------------
 @ 13 days 5 hours 27 mins
(1 row)

insert into test_num values(to_date('2013-03-14 14:27:00','YYYY-MM-DD HH24:MI:SS') - to_date('2013-3-1 9:00:00','YYYY-MM-DD HH24:MI:SS'));
select mynum from test_num order by 1;
      mynum       
------------------
 13.2270833333333
(1 row)

insert into test_num values(interval '2 days 09:33:00');
select mynum from test_num order by 1;
      mynum       
------------------
 2.39791666666667
 13.2270833333333
(2 rows)

select floor(mynum) from test_num order by 1;
 floor 
-------
     2
    13
(2 rows)

drop table test_num;
select floor(interval '2 days 09:33:00');
 floor 
-------
     2
(1 row)

create or replace procedure test_interval_to_num(my_num numeric)
as
begin
end;
/
call test_interval_to_num(interval '5 days 19:23:46');
 test_interval_to_num 
----------------------
 
(1 row)

drop procedure test_interval_to_num;
create table TIMEFORMAT_OUTPUTFORMAT_TIMESTAMP_000(COL timestamp with time zone);
set datestyle to german, ymd;
insert into TIMEFORMAT_OUTPUTFORMAT_TIMESTAMP_000 values('1999-01-23 07:37:16.00 PST');
select * from TIMEFORMAT_OUTPUTFORMAT_TIMESTAMP_000;
           col           
-------------------------
 23.01.1999 07:37:16 PST
(1 row)

set datestyle to german,dmy;
insert into TIMEFORMAT_OUTPUTFORMAT_TIMESTAMP_000 values('1999-11-23 07:37:16.00 PST');
select * from TIMEFORMAT_OUTPUTFORMAT_TIMESTAMP_000 order by 1;
           col           
-------------------------
 23.01.1999 07:37:16 PST
 23.11.1999 07:37:16 PST
(2 rows)

set datestyle to german,mdy;
insert into TIMEFORMAT_OUTPUTFORMAT_TIMESTAMP_000 values('1999-12-23 07:37:16.00 PST');
select * from TIMEFORMAT_OUTPUTFORMAT_TIMESTAMP_000 order by 1;
           col           
-------------------------
 23.01.1999 07:37:16 PST
 23.11.1999 07:37:16 PST
 23.12.1999 07:37:16 PST
(3 rows)

delete from TIMEFORMAT_OUTPUTFORMAT_TIMESTAMP_000;
set datestyle to SQL, ymd;
insert into TIMEFORMAT_OUTPUTFORMAT_TIMESTAMP_000 values('1999-01-23 07:37:16.00 PST');
select * from TIMEFORMAT_OUTPUTFORMAT_TIMESTAMP_000;
           col           
-------------------------
 01/23/1999 07:37:16 PST
(1 row)

set datestyle to SQL, dmy;
insert into TIMEFORMAT_OUTPUTFORMAT_TIMESTAMP_000 values('1999-12-23 07:37:16.00 PST');
select * from TIMEFORMAT_OUTPUTFORMAT_TIMESTAMP_000 order by 1;
           col           
-------------------------
 23/01/1999 07:37:16 PST
 23/12/1999 07:37:16 PST
(2 rows)

set datestyle to SQL, mdy;
insert into TIMEFORMAT_OUTPUTFORMAT_TIMESTAMP_000 values('1999-12-23 07:37:16.00 PST');
select * from TIMEFORMAT_OUTPUTFORMAT_TIMESTAMP_000 order by 1;
           col           
-------------------------
 01/23/1999 07:37:16 PST
 12/23/1999 07:37:16 PST
 12/23/1999 07:37:16 PST
(3 rows)

set datestyle to german, mdy;
insert into TIMEFORMAT_OUTPUTFORMAT_TIMESTAMP_000 values('01.23.1999 07:37:16.00');
select * from TIMEFORMAT_OUTPUTFORMAT_TIMESTAMP_000 order by 1;
           col           
-------------------------
 23.01.1999 07:37:16 PST
 23.01.1999 07:37:16 PST
 23.12.1999 07:37:16 PST
 23.12.1999 07:37:16 PST
(4 rows)

drop table TIMEFORMAT_OUTPUTFORMAT_TIMESTAMP_000;
--test BLOB AND RAW BI-DIRECTION CONVERSION
CREATE TABLE TEST_RAW(B BLOB, R RAW);
INSERT INTO TEST_RAW VALUES('ABCD','1234');
CREATE OR REPLACE PROCEDURE SP_TEST_3(R RAW)
AS
BEGIN
    DBMS_OUTPUT.PUT_LINE('BLOB TO RAW CONVERSION SUCCESSFULLY'); 
END;
/
ERROR:  schema "dbms_output" does not exist
CONTEXT:  compilation of PL/pgSQL function "sp_test_3" near line 1
CREATE OR REPLACE PROCEDURE SP_TEST_4(B BLOB)
AS
BEGIN
    DBMS_OUTPUT.PUT_LINE( 'RAW TO BLOB CONVERSION SUCCESSFULLY'); 
END;
/
ERROR:  schema "dbms_output" does not exist
CONTEXT:  compilation of PL/pgSQL function "sp_test_4" near line 1
CREATE OR REPLACE PROCEDURE SP_INVOKER
AS
    B BLOB;
    R RAW;
BEGIN
    SELECT * INTO B,R FROM TEST_RAW;
    SP_TEST_3(B);
    SP_TEST_4(R);
    B := R;
    R := B;
    DBMS_OUTPUT.PUT_LINE( 'BLOB AND RAW BI-DIRECTION CONVERSION SUCCESSFULLY'); 
 --   EXCEPTION
 --       WHEN OTHERS THEN
END;
/
ERROR:  function "sp_test_3" doesn't exist 
CONTEXT:  compilation of PL/pgSQL function "sp_invoker" near line 4
CALL SP_INVOKER();
ERROR:  function "sp_invoker" doesn't exist 
DROP TABLE TEST_RAW;
DROP PROCEDURE SP_TEST_3;
ERROR:  function sp_test_3 does not exist
DROP PROCEDURE SP_TEST_4;
ERROR:  function sp_test_4 does not exist
DROP PROCEDURE SP_INVOKER;
ERROR:  function sp_invoker does not exist
--test bool<-> int1,int2,int4,int8
select (1<2) + 1::int1;
 ?column? 
----------
        2
(1 row)

select (1<2) + 1::int2;
 ?column? 
----------
        2
(1 row)

select (1<2) + 1::int4;
 ?column? 
----------
        2
(1 row)

select (1<2) + 1::int8;
 ?column? 
----------
        2
(1 row)

select (1<2) - 1::int1;
 ?column? 
----------
        0
(1 row)

select (1<2) - 1::int2;
 ?column? 
----------
        0
(1 row)

select (1<2) - 1::int4;
 ?column? 
----------
        0
(1 row)

select (1<2) - 1::int8;
 ?column? 
----------
        0
(1 row)

select (1<2) * 1::int1;
 ?column? 
----------
        1
(1 row)

select (1<2) * 1::int2;
 ?column? 
----------
        1
(1 row)

select (1<2) * 1::int4;
 ?column? 
----------
        1
(1 row)

select (1<2) * 1::int8;
 ?column? 
----------
        1
(1 row)

select (1<2) / 1::int1;
        ?column?        
------------------------
 1.00000000000000000000
(1 row)

select (1<2) / 1::int2;
 ?column? 
----------
        1
(1 row)

select (1<2) / 1::int4;
 ?column? 
----------
        1
(1 row)

select (1<2) / 1::int8;
 ?column? 
----------
        1
(1 row)

select 1::int1 + (1<2);
 ?column? 
----------
        2
(1 row)

select 1::int2 + (1<2);
 ?column? 
----------
        2
(1 row)

select 1::int4 + (1<2);
 ?column? 
----------
        2
(1 row)

select 1::int8 + (1<2);
 ?column? 
----------
        2
(1 row)

select 1::int1 - (1<2);
 ?column? 
----------
        0
(1 row)

select 1::int2 - (1<2);
 ?column? 
----------
        0
(1 row)

select 1::int4 - (1<2);
 ?column? 
----------
        0
(1 row)

select 1::int8 - (1<2);
 ?column? 
----------
        0
(1 row)

select 1::int1 * (1<2);
 ?column? 
----------
        1
(1 row)

select 1::int2 * (1<2);
 ?column? 
----------
        1
(1 row)

select 1::int4 * (1<2);
 ?column? 
----------
        1
(1 row)

select 1::int8 * (1<2);
 ?column? 
----------
        1
(1 row)

select 1::int1 / (1<2);
        ?column?        
------------------------
 1.00000000000000000000
(1 row)

select 1::int2 / (1<2);
 ?column? 
----------
        1
(1 row)

select 1::int4 / (1<2);
 ?column? 
----------
        1
(1 row)

select 1::int8 / (1<2);
 ?column? 
----------
        1
(1 row)

CREATE OR REPLACE FUNCTION SP_BOOL_01(P1 INT1) RETURNS VOID AS $$BEGIN NULL; END;$$ LANGUAGE PLPGSQL; SELECT SP_BOOL_01(1<2);
 sp_bool_01 
------------
 
(1 row)

CREATE OR REPLACE FUNCTION SP_BOOL_02(P1 INT2) RETURNS VOID AS $$BEGIN NULL; END;$$ LANGUAGE PLPGSQL; SELECT SP_BOOL_02(1<2);
 sp_bool_02 
------------
 
(1 row)

CREATE OR REPLACE FUNCTION SP_BOOL_03(P1 INT4) RETURNS VOID AS $$BEGIN NULL; END;$$ LANGUAGE PLPGSQL; SELECT SP_BOOL_03(1<2);
 sp_bool_03 
------------
 
(1 row)

CREATE OR REPLACE FUNCTION SP_BOOL_04(P1 INT8) RETURNS VOID AS $$BEGIN NULL; END;$$ LANGUAGE PLPGSQL; SELECT SP_BOOL_04(1<2);
 sp_bool_04 
------------
 
(1 row)

CREATE OR REPLACE FUNCTION SP_BOOL_05(P1 BOOL) RETURNS VOID AS $$BEGIN NULL; END;$$ LANGUAGE PLPGSQL; SELECT SP_BOOL_05(1::INT1);
 sp_bool_05 
------------
 
(1 row)

CREATE OR REPLACE FUNCTION SP_BOOL_06(P1 BOOL) RETURNS VOID AS $$BEGIN NULL; END;$$ LANGUAGE PLPGSQL; SELECT SP_BOOL_06(1::INT2);
 sp_bool_06 
------------
 
(1 row)

CREATE OR REPLACE FUNCTION SP_BOOL_07(P1 BOOL) RETURNS VOID AS $$BEGIN NULL; END;$$ LANGUAGE PLPGSQL; SELECT SP_BOOL_07(1::INT4);
 sp_bool_07 
------------
 
(1 row)

CREATE OR REPLACE FUNCTION SP_BOOL_08(P1 BOOL) RETURNS VOID AS $$BEGIN NULL; END;$$ LANGUAGE PLPGSQL; SELECT SP_BOOL_08(1::INT8);
 sp_bool_08 
------------
 
(1 row)

DROP FUNCTION SP_BOOL_01;
DROP FUNCTION SP_BOOL_02;
DROP FUNCTION SP_BOOL_03;
DROP FUNCTION SP_BOOL_04;
DROP FUNCTION SP_BOOL_05;
DROP FUNCTION SP_BOOL_06;
DROP FUNCTION SP_BOOL_07;
DROP FUNCTION SP_BOOL_08;
CREATE OR REPLACE FUNCTION IMPLICIT_CONVERSION_064(tempdata nvarchar2) RETURNS VOID AS $$
BEGIN
 raise info'nvarchar2 type value is %',tempdata;  
END;
$$ LANGUAGE plpgsql;
CREATE OR REPLACE FUNCTION IMPLICIT_CONVERSION_064(tempdata bpchar) RETURNS VOID AS $$
BEGIN
 raise info'bpchar type value is %',tempdata;  
END;
$$ LANGUAGE plpgsql;
SELECT IMPLICIT_CONVERSION_064(cast('123' as clob));
INFO:  nvarchar2 type value is 123
CONTEXT:  referenced column: implicit_conversion_064
 implicit_conversion_064 
-------------------------
 
(1 row)

DROP FUNCTION IMPLICIT_CONVERSION_064(NVARCHAR2);
DROP FUNCTION IMPLICIT_CONVERSION_064(bpchar);
--new data type support PK
create table tinyint_pk(id tinyint primary key);
NOTICE:  CREATE TABLE / PRIMARY KEY will create implicit index "tinyint_pk_pkey" for table "tinyint_pk"
insert into tinyint_pk values(255);
create table smalldatetime_pk(id smalldatetime primary key);
NOTICE:  CREATE TABLE / PRIMARY KEY will create implicit index "smalldatetime_pk_pkey" for table "smalldatetime_pk"
insert into smalldatetime_pk values('19880130');
create table nvarchar2_pk(id nvarchar2(20) primary key);
NOTICE:  CREATE TABLE / PRIMARY KEY will create implicit index "nvarchar2_pk_pkey" for table "nvarchar2_pk"
insert into nvarchar2_pk values('come on');
create table raw_pk(id raw primary key);
NOTICE:  CREATE TABLE / PRIMARY KEY will create implicit index "raw_pk_pkey" for table "raw_pk"
insert into raw_pk values('abc');
drop table tinyint_pk;
drop table smalldatetime_pk;
drop table nvarchar2_pk;
drop table raw_pk;
--test priority of two-character compare operator
create table priority_t1 (c1 char(10),c2 char(10));
insert into priority_t1 values('100','200');
select * from priority_t1 where '1111' <= '1111' || '11111';
     c1     |     c2     
------------+------------
 100        | 200       
(1 row)

select * from priority_t1 where '1111' <= ('1111' || '11111');
     c1     |     c2     
------------+------------
 100        | 200       
(1 row)

select * from priority_t1 where '1111' >= '1111' || '11111';
 c1 | c2 
----+----
(0 rows)

select * from priority_t1 where '1111' >= ('1111' || '11111');
 c1 | c2 
----+----
(0 rows)

select * from priority_t1 where '1111' = '1111' || '11111';
 c1 | c2 
----+----
(0 rows)

select * from priority_t1 where '1111' <> '1111' || '11111';
     c1     |     c2     
------------+------------
 100        | 200       
(1 row)

select * from priority_t1 where '1111' != '1111' || '11111';
     c1     |     c2     
------------+------------
 100        | 200       
(1 row)

select * from priority_t1 where (select c2 || c1 from priority_t1) <= (select c2 from priority_t1) || (select c1 from priority_t1);
     c1     |     c2     
------------+------------
 100        | 200       
(1 row)

select * from priority_t1 where (select c2 || c1 from priority_t1) >= (select c2 from priority_t1) || (select c1 from priority_t1);
     c1     |     c2     
------------+------------
 100        | 200       
(1 row)

select * from priority_t1 where (select c2 || c1 from priority_t1) <> (select c2 from priority_t1) || (select c1 from priority_t1);
 c1 | c2 
----+----
(0 rows)

select * from priority_t1 where (select c2 || c1 from priority_t1) != (select c2 from priority_t1) || (select c1 from priority_t1);
 c1 | c2 
----+----
(0 rows)

select * from priority_t1 where (select c2 || c1 from priority_t1) = (select c2 from priority_t1) || (select c1 from priority_t1);
     c1     |     c2     
------------+------------
 100        | 200       
(1 row)

drop table priority_t1;
create table tbl_oidvector(a int, b oidvector);
insert into tbl_oidvector values(1, '23 1700');
select oidvectortypes(b) from tbl_oidvector;
  oidvectortypes  
------------------
 integer, numeric
(1 row)

drop table tbl_oidvector;
reset search_path;
