--
-- MERGE INTO 
--
-- initial
CREATE SCHEMA mergeinto;
SET current_schema = mergeinto;
CREATE TABLE products_base
(
product_id INTEGER DEFAULT 0,
product_name VARCHAR(60) DEFAULT 'null',
category VARCHAR(60) DEFAULT 'unknown',
total INTEGER DEFAULT '0'
);
INSERT INTO products_base VALUES (1501, 'vivitar 35mm', 'electrncs', 100);
INSERT INTO products_base VALUES (1502, 'olympus is50', 'electrncs', 100);
INSERT INTO products_base VALUES (1600, 'play gym', 'toys', 100);
INSERT INTO products_base VALUES (1601, 'lamaze', 'toys', 100);
INSERT INTO products_base VALUES (1666, 'harry potter', 'dvd', 100);
CREATE TABLE newproducts_base
(
product_id INTEGER DEFAULT 0,
product_name VARCHAR(60) DEFAULT 'null',
category VARCHAR(60) DEFAULT 'unknown',
total INTEGER DEFAULT '0'
);
INSERT INTO newproducts_base VALUES (1502, 'olympus camera', 'electrncs', 200);
INSERT INTO newproducts_base VALUES (1601, 'lamaze', 'toys', 200);
INSERT INTO newproducts_base VALUES (1666, 'harry potter', 'toys', 200);
INSERT INTO newproducts_base VALUES (1700, 'wait interface', 'books', 200);
ANALYZE products_base;
ANALYZE newproducts_base;
--
-- stream mode(MERGE can be pushed down), row table
--
CREATE TABLE products_row
(
product_id INTEGER DEFAULT 0,
product_name VARCHAR(60) DEFAULT 'null',
category VARCHAR(60) DEFAULT 'unknown',
total INTEGER DEFAULT '0'
);
CREATE TABLE newproducts_row
(
product_id INTEGER DEFAULT 0,
product_name VARCHAR(60) DEFAULT 'null',
category VARCHAR(60) DEFAULT 'unknown',
total INTEGER DEFAULT '0'
);
INSERT INTO products_row SELECT * FROM products_base;
INSERT INTO newproducts_row SELECT * FROM newproducts_base;
ANALYZE products_row;
ANALYZE newproducts_row;
-- explain verbose
EXPLAIN (VERBOSE on, COSTS off)
MERGE INTO products_row p
USING newproducts_row np
ON p.product_id = np.product_id
WHEN MATCHED THEN
  UPDATE SET product_name = np.product_name, category = np.category, total = np.total
WHEN NOT MATCHED THEN  
  INSERT VALUES (np.product_id, np.product_name, np.category, np.total);
                                                                                                                                       QUERY PLAN                                                                                                                                       
----------------------------------------------------------------------------------------------------------------------------------------------------------------------------------------------------------------------------------------------------------------------------------------
 Streaming (type: GATHER)
   Node/s: All datanodes
   ->  Merge on mergeinto.products_row p
         ->  Streaming(type: REDISTRIBUTE)
               Output: np.product_id, np.product_name, np.category, np.total, p.product_id, p.product_name, p.category, p.total, p.ctid, p.xc_node_id, np.product_id, np.product_name, np.category, np.total, (CASE WHEN (p.ctid IS NULL) THEN np.product_id ELSE p.product_id END)
               Distribute Key: (CASE WHEN (p.ctid IS NULL) THEN np.product_id ELSE p.product_id END)
               Spawn on: All datanodes
               ->  Nested Loop Left Join
                     Output: np.product_id, np.product_name, np.category, np.total, p.product_id, p.product_name, p.category, p.total, p.ctid, p.xc_node_id, np.product_id, np.product_name, np.category, np.total, CASE WHEN (p.ctid IS NULL) THEN np.product_id ELSE p.product_id END
                     Join Filter: (p.product_id = np.product_id)
                     ->  Seq Scan on mergeinto.newproducts_row np
                           Output: np.product_id, np.product_name, np.category, np.total
                     ->  Seq Scan on mergeinto.products_row p
                           Output: p.product_id, p.product_name, p.category, p.total, p.ctid, p.xc_node_id
(14 rows)

-- only MATCHED clause
MERGE INTO products_row p
USING newproducts_row np
ON p.product_id = np.product_id
WHEN MATCHED THEN
  UPDATE SET product_name = np.product_name, category = np.category, total = np.total;
SELECT * FROM products_row ORDER BY 1;
 product_id |  product_name  | category  | total 
------------+----------------+-----------+-------
       1501 | vivitar 35mm   | electrncs |   100
       1502 | olympus camera | electrncs |   200
       1600 | play gym       | toys      |   100
       1601 | lamaze         | toys      |   200
       1666 | harry potter   | toys      |   200
(5 rows)

-- only MATCHED clause, has expressions
TRUNCATE products_row;
INSERT INTO products_row SELECT * FROM products_base;
MERGE INTO products_row p
USING newproducts_row np
ON p.product_id = np.product_id
WHEN MATCHED THEN
  UPDATE SET product_name = np.product_name, category = np.category || 'ABC', total = np.total + 100;
SELECT * FROM products_row ORDER BY 1;
 product_id |  product_name  |   category   | total 
------------+----------------+--------------+-------
       1501 | vivitar 35mm   | electrncs    |   100
       1502 | olympus camera | electrncsABC |   300
       1600 | play gym       | toys         |   100
       1601 | lamaze         | toysABC      |   300
       1666 | harry potter   | toysABC      |   300
(5 rows)

-- only NOT MATCHED clause
TRUNCATE products_row;
INSERT INTO products_row SELECT * FROM products_base;
MERGE INTO products_row p
USING newproducts_row np
ON p.product_id = np.product_id
WHEN NOT MATCHED THEN  
  INSERT VALUES (np.product_id, np.product_name, np.category, np.total);
SELECT * FROM products_row ORDER BY 1;
 product_id |  product_name  | category  | total 
------------+----------------+-----------+-------
       1501 | vivitar 35mm   | electrncs |   100
       1502 | olympus is50   | electrncs |   100
       1600 | play gym       | toys      |   100
       1601 | lamaze         | toys      |   100
       1666 | harry potter   | dvd       |   100
       1700 | wait interface | books     |   200
(6 rows)

TRUNCATE products_row;
INSERT INTO products_row SELECT * FROM products_base;
MERGE INTO products_row p
USING newproducts_row np
ON p.product_id = np.product_id
WHEN NOT MATCHED THEN  
  INSERT VALUES (np.product_id, np.product_name, np.category);
SELECT * FROM products_row ORDER BY 1;
 product_id |  product_name  | category  | total 
------------+----------------+-----------+-------
       1501 | vivitar 35mm   | electrncs |   100
       1502 | olympus is50   | electrncs |   100
       1600 | play gym       | toys      |   100
       1601 | lamaze         | toys      |   100
       1666 | harry potter   | dvd       |   100
       1700 | wait interface | books     |     0
(6 rows)

-- only NOT MATCHED clause has insert targetlist
TRUNCATE products_row;
INSERT INTO products_row SELECT * FROM products_base;
MERGE INTO products_row p
USING newproducts_row np
ON p.product_id = np.product_id
WHEN NOT MATCHED THEN 
  INSERT (product_id, total) VALUES (np.product_id, np.total); --notice: we have 2 fields missing
SELECT * FROM products_row ORDER BY 1;
 product_id | product_name | category  | total 
------------+--------------+-----------+-------
       1501 | vivitar 35mm | electrncs |   100
       1502 | olympus is50 | electrncs |   100
       1600 | play gym     | toys      |   100
       1601 | lamaze       | toys      |   100
       1666 | harry potter | dvd       |   100
       1700 | null         | unknown   |   200
(6 rows)

TRUNCATE products_row;
INSERT INTO products_row SELECT * FROM products_base;
MERGE INTO products_row p
USING newproducts_row np
ON p.product_id = np.product_id
WHEN NOT MATCHED THEN  
  INSERT (product_id, total) VALUES (np.product_id, np.total); --notice: we have 2 fields missing
SELECT * FROM products_row ORDER BY 1;
 product_id | product_name | category  | total 
------------+--------------+-----------+-------
       1501 | vivitar 35mm | electrncs |   100
       1502 | olympus is50 | electrncs |   100
       1600 | play gym     | toys      |   100
       1601 | lamaze       | toys      |   100
       1666 | harry potter | dvd       |   100
       1700 | null         | unknown   |   200
(6 rows)

-- only NOT MATCHED clause has insert targetlist
TRUNCATE products_row;
INSERT INTO products_row SELECT * FROM products_base;
MERGE INTO products_row p
USING newproducts_row np
ON p.product_id = np.product_id
WHEN NOT MATCHED THEN 
  INSERT (total, product_id) VALUES (np.total, np.product_id); --notice: 2 fields missing and reversed
SELECT * FROM products_row ORDER BY 1;
 product_id | product_name | category  | total 
------------+--------------+-----------+-------
       1501 | vivitar 35mm | electrncs |   100
       1502 | olympus is50 | electrncs |   100
       1600 | play gym     | toys      |   100
       1601 | lamaze       | toys      |   100
       1666 | harry potter | dvd       |   100
       1700 | null         | unknown   |   200
(6 rows)

TRUNCATE products_row;
INSERT INTO products_row SELECT * FROM products_base;
MERGE INTO products_row p
USING newproducts_row np
ON p.product_id = np.product_id
WHEN NOT MATCHED THEN  
  INSERT (total, product_id) VALUES (np.total, np.product_id); --notice: 2 fields missing and reversed
SELECT * FROM products_row ORDER BY 1;
 product_id | product_name | category  | total 
------------+--------------+-----------+-------
       1501 | vivitar 35mm | electrncs |   100
       1502 | olympus is50 | electrncs |   100
       1600 | play gym     | toys      |   100
       1601 | lamaze       | toys      |   100
       1666 | harry potter | dvd       |   100
       1700 | null         | unknown   |   200
(6 rows)

-- only NOT MATCHED clause, has expressions
TRUNCATE products_row;
INSERT INTO products_row SELECT * FROM products_base;
MERGE INTO products_row p
USING newproducts_row np
ON p.product_id = np.product_id
WHEN NOT MATCHED THEN  
  INSERT VALUES (np.product_id, np.product_name, np.category || 'ABC', np.total + 100);
SELECT * FROM products_row ORDER BY 1;
 product_id |  product_name  | category  | total 
------------+----------------+-----------+-------
       1501 | vivitar 35mm   | electrncs |   100
       1502 | olympus is50   | electrncs |   100
       1600 | play gym       | toys      |   100
       1601 | lamaze         | toys      |   100
       1666 | harry potter   | dvd       |   100
       1700 | wait interface | booksABC  |   300
(6 rows)

-- both MATCHED and NOT MATCHED clause
TRUNCATE products_row;
INSERT INTO products_row SELECT * FROM products_base;
MERGE INTO products_row p
USING newproducts_row np
ON p.product_id = np.product_id
WHEN MATCHED THEN
  UPDATE SET product_name = np.product_name, category = np.category, total = np.total
WHEN NOT MATCHED THEN  
  INSERT VALUES (np.product_id, np.product_name, np.category, np.total);
SELECT * FROM products_row ORDER BY 1;
 product_id |  product_name  | category  | total 
------------+----------------+-----------+-------
       1501 | vivitar 35mm   | electrncs |   100
       1502 | olympus camera | electrncs |   200
       1600 | play gym       | toys      |   100
       1601 | lamaze         | toys      |   200
       1666 | harry potter   | toys      |   200
       1700 | wait interface | books     |   200
(6 rows)

-- both MATCHED and NOT MATCHED clause has constant qual
TRUNCATE products_row;
INSERT INTO products_row SELECT * FROM products_base;
MERGE INTO products_row p
USING newproducts_row np
ON p.product_id = np.product_id AND 1=1
WHEN MATCHED THEN
  UPDATE SET product_name = np.product_name, category = np.category, total = np.total
WHEN NOT MATCHED THEN  
  INSERT VALUES (np.product_id, np.product_name, np.category, np.total);
SELECT * FROM products_row ORDER BY 1,2,3,4;
 product_id |  product_name  | category  | total 
------------+----------------+-----------+-------
       1501 | vivitar 35mm   | electrncs |   100
       1502 | olympus camera | electrncs |   200
       1600 | play gym       | toys      |   100
       1601 | lamaze         | toys      |   200
       1666 | harry potter   | toys      |   200
       1700 | wait interface | books     |   200
(6 rows)

-- both MATCHED and NOT MATCHED clause has constant qual with subquery
TRUNCATE products_row;
INSERT INTO products_row SELECT * FROM products_base;
MERGE INTO products_row p
USING newproducts_row np
ON p.product_id = np.product_id AND 1=(select total from products_row order by 1 limit 1)
WHEN MATCHED THEN
  UPDATE SET product_name = np.product_name, category = np.category, total = np.total
WHEN NOT MATCHED THEN  
  INSERT VALUES (np.product_id, np.product_name, np.category, np.total);
SELECT * FROM products_row ORDER BY 1,2,3,4;
 product_id |  product_name  | category  | total 
------------+----------------+-----------+-------
       1501 | vivitar 35mm   | electrncs |   100
       1502 | olympus camera | electrncs |   200
       1502 | olympus is50   | electrncs |   100
       1600 | play gym       | toys      |   100
       1601 | lamaze         | toys      |   100
       1601 | lamaze         | toys      |   200
       1666 | harry potter   | dvd       |   100
       1666 | harry potter   | toys      |   200
       1700 | wait interface | books     |   200
(9 rows)

-- both MATCHED and NOT MATCHED clause, has expressions
TRUNCATE products_row;
INSERT INTO products_row SELECT * FROM products_base;
MERGE INTO products_row p
USING newproducts_row np
ON p.product_id = np.product_id
WHEN MATCHED THEN
  UPDATE SET product_name = np.product_name, category = np.category || 'ABC', total = np.total + 100
WHEN NOT MATCHED THEN  
  INSERT VALUES (np.product_id, np.product_name, np.category || 'ABC', np.total + 100);
SELECT * FROM products_row ORDER BY 1;
 product_id |  product_name  |   category   | total 
------------+----------------+--------------+-------
       1501 | vivitar 35mm   | electrncs    |   100
       1502 | olympus camera | electrncsABC |   300
       1600 | play gym       | toys         |   100
       1601 | lamaze         | toysABC      |   300
       1666 | harry potter   | toysABC      |   300
       1700 | wait interface | booksABC     |   300
(6 rows)

MERGE INTO products_row p
USING newproducts_row np
ON p.product_id = np.product_id
WHEN MATCHED THEN
  UPDATE SET product_name = p.product_name, category = p.category || 'ABC', total = p.total + 100
WHEN NOT MATCHED THEN  
  INSERT VALUES (np.product_id, np.product_name, np.category || 'ABC', np.total + 100);
SELECT * FROM products_row ORDER BY 1;
 product_id |  product_name  |    category     | total 
------------+----------------+-----------------+-------
       1501 | vivitar 35mm   | electrncs       |   100
       1502 | olympus camera | electrncsABCABC |   400
       1600 | play gym       | toys            |   100
       1601 | lamaze         | toysABCABC      |   400
       1666 | harry potter   | toysABCABC      |   400
       1700 | wait interface | booksABCABC     |   400
(6 rows)

-- both MATCHED and NOT MATCHED clause, has expressions, has WHERE conditions
TRUNCATE products_row;
INSERT INTO products_row SELECT * FROM products_base;
MERGE INTO products_row p
USING newproducts_row np
ON p.product_id = np.product_id
WHEN MATCHED THEN
  UPDATE SET product_name = np.product_name, category = np.category || 'ABC', total = np.total + 100 WHERE p.category = 'dvd'
WHEN NOT MATCHED THEN  
  INSERT VALUES (np.product_id, np.product_name, np.category || 'ABC', np.total + 100) WHERE np.category != 'books';
SELECT * FROM products_row ORDER BY 1;
 product_id | product_name | category  | total 
------------+--------------+-----------+-------
       1501 | vivitar 35mm | electrncs |   100
       1502 | olympus is50 | electrncs |   100
       1600 | play gym     | toys      |   100
       1601 | lamaze       | toys      |   100
       1666 | harry potter | toysABC   |   300
(5 rows)

-- both MATCHED and NOT MATCHED clause, has expressions, which WHERE conditions is constant
TRUNCATE products_row;
INSERT INTO products_row SELECT * FROM products_base;
MERGE INTO products_row p
USING newproducts_row np
ON p.product_id = np.product_id
WHEN MATCHED THEN
  UPDATE SET product_name = np.product_name, category = np.category || 'ABC', total = np.total + 100 WHERE true
WHEN NOT MATCHED THEN  
  INSERT VALUES (np.product_id, np.product_name, np.category || 'ABC', np.total + 100) WHERE false;
SELECT * FROM products_row ORDER BY 1;
 product_id |  product_name  |   category   | total 
------------+----------------+--------------+-------
       1501 | vivitar 35mm   | electrncs    |   100
       1502 | olympus camera | electrncsABC |   300
       1600 | play gym       | toys         |   100
       1601 | lamaze         | toysABC      |   300
       1666 | harry potter   | toysABC      |   300
(5 rows)

-- both MATCHED and NOT MATCHED clause, has expressions, has WHERE conditions
TRUNCATE products_row;
INSERT INTO products_row SELECT * FROM products_base;
MERGE INTO products_row p
USING newproducts_row np
ON p.product_id = np.product_id
WHEN MATCHED THEN
  UPDATE SET product_name = np.product_name, category = np.category || 'ABC', total = np.total + 100
  WHERE p.category = 'dvd' AND np.category = 'toys'
WHEN NOT MATCHED THEN  
  INSERT VALUES (np.product_id, np.product_name, np.category || 'DEF', np.total + 100)
  WHERE np.category != 'books' AND np.total > 100;
SELECT * FROM products_row ORDER BY 1;
 product_id | product_name | category  | total 
------------+--------------+-----------+-------
       1501 | vivitar 35mm | electrncs |   100
       1502 | olympus is50 | electrncs |   100
       1600 | play gym     | toys      |   100
       1601 | lamaze       | toys      |   100
       1666 | harry potter | toysABC   |   300
(5 rows)

-- partitioned table
CREATE TABLE products_part
(
product_id INTEGER,
product_name VARCHAR2(60),
category VARCHAR2(60),
total INTEGER
)
PARTITION BY RANGE (product_id)
(
  PARTITION P1 VALUES LESS THAN (1600),
  PARTITION P2 VALUES LESS THAN (1700),
  PARTITION P3 VALUES LESS THAN (1800)
) ENABLE ROW MOVEMENT;
INSERT INTO products_part SELECT * FROM products_base;
ANALYZE products_part;
MERGE INTO products_part p
USING newproducts_row np
ON p.product_id = np.product_id
WHEN MATCHED THEN
  UPDATE SET product_name = np.product_name, category = np.category || 'ABC', total = np.total + 100 WHERE p.category = 'dvd'
WHEN NOT MATCHED THEN  
  INSERT VALUES (np.product_id, np.product_name, np.category || 'ABC', np.total + 100) WHERE np.category != 'books';
SELECT * FROM products_part ORDER BY 1;
 product_id | product_name | category  | total 
------------+--------------+-----------+-------
       1501 | vivitar 35mm | electrncs |   100
       1502 | olympus is50 | electrncs |   100
       1600 | play gym     | toys      |   100
       1601 | lamaze       | toys      |   100
       1666 | harry potter | toysABC   |   300
(5 rows)

-- do a simple equivalent of an INSERT SELECT
TRUNCATE products_row;
INSERT INTO products_row SELECT * FROM products_base;
SELECT * FROM products_row ORDER BY 1;
 product_id | product_name | category  | total 
------------+--------------+-----------+-------
       1501 | vivitar 35mm | electrncs |   100
       1502 | olympus is50 | electrncs |   100
       1600 | play gym     | toys      |   100
       1601 | lamaze       | toys      |   100
       1666 | harry potter | dvd       |   100
(5 rows)

SELECT * FROM newproducts_row ORDER BY 1;
 product_id |  product_name  | category  | total 
------------+----------------+-----------+-------
       1502 | olympus camera | electrncs |   200
       1601 | lamaze         | toys      |   200
       1666 | harry potter   | toys      |   200
       1700 | wait interface | books     |   200
(4 rows)

MERGE INTO products_row p
USING newproducts_row np
ON p.product_id = np.product_id
WHEN NOT MATCHED THEN
    INSERT VALUES (np.product_id, np.product_name, np.category, np.total);
SELECT * FROM products_row ORDER BY 1;
 product_id |  product_name  | category  | total 
------------+----------------+-----------+-------
       1501 | vivitar 35mm   | electrncs |   100
       1502 | olympus is50   | electrncs |   100
       1600 | play gym       | toys      |   100
       1601 | lamaze         | toys      |   100
       1666 | harry potter   | dvd       |   100
       1700 | wait interface | books     |   200
(6 rows)

-- the classic merge
TRUNCATE products_row;
INSERT INTO products_row SELECT * FROM products_base;
SELECT * FROM products_row ORDER BY 1;
 product_id | product_name | category  | total 
------------+--------------+-----------+-------
       1501 | vivitar 35mm | electrncs |   100
       1502 | olympus is50 | electrncs |   100
       1600 | play gym     | toys      |   100
       1601 | lamaze       | toys      |   100
       1666 | harry potter | dvd       |   100
(5 rows)

SELECT * FROM newproducts_row ORDER BY 1;
 product_id |  product_name  | category  | total 
------------+----------------+-----------+-------
       1502 | olympus camera | electrncs |   200
       1601 | lamaze         | toys      |   200
       1666 | harry potter   | toys      |   200
       1700 | wait interface | books     |   200
(4 rows)

MERGE INTO products_row p
USING newproducts_row np
ON p.product_id = np.product_id
WHEN NOT MATCHED THEN
    INSERT VALUES (np.product_id, np.product_name, np.category, np.total)
WHEN MATCHED THEN
    UPDATE SET product_name = p.product_name ||' + '|| np.product_name,
	           category     = p.category ||' + ' || np.category,
			   total        = p.total + np.total;
SELECT * FROM products_row ORDER BY 1;
 product_id |         product_name          |       category        | total 
------------+-------------------------------+-----------------------+-------
       1501 | vivitar 35mm                  | electrncs             |   100
       1502 | olympus is50 + olympus camera | electrncs + electrncs |   300
       1600 | play gym                      | toys                  |   100
       1601 | lamaze + lamaze               | toys + toys           |   300
       1666 | harry potter + harry potter   | dvd + toys            |   300
       1700 | wait interface                | books                 |   200
(6 rows)

-- do a simple equivalent of an INSERT SELECT with targetlist
TRUNCATE products_row;
INSERT INTO products_row SELECT * FROM products_base;
SELECT * FROM products_row ORDER BY 1;
 product_id | product_name | category  | total 
------------+--------------+-----------+-------
       1501 | vivitar 35mm | electrncs |   100
       1502 | olympus is50 | electrncs |   100
       1600 | play gym     | toys      |   100
       1601 | lamaze       | toys      |   100
       1666 | harry potter | dvd       |   100
(5 rows)

SELECT * FROM newproducts_row ORDER BY 1;
 product_id |  product_name  | category  | total 
------------+----------------+-----------+-------
       1502 | olympus camera | electrncs |   200
       1601 | lamaze         | toys      |   200
       1666 | harry potter   | toys      |   200
       1700 | wait interface | books     |   200
(4 rows)

MERGE INTO products_row p
USING newproducts_row np
ON p.product_id = np.product_id
WHEN NOT MATCHED THEN
    INSERT (product_id, product_name, total) 
	VALUES (np.product_id, np.product_name, np.total);
SELECT * FROM products_row ORDER BY 1;
 product_id |  product_name  | category  | total 
------------+----------------+-----------+-------
       1501 | vivitar 35mm   | electrncs |   100
       1502 | olympus is50   | electrncs |   100
       1600 | play gym       | toys      |   100
       1601 | lamaze         | toys      |   100
       1666 | harry potter   | dvd       |   100
       1700 | wait interface | unknown   |   200
(6 rows)

-- the on clause is true
TRUNCATE products_row;
INSERT INTO products_row SELECT * FROM products_base;
SELECT * FROM products_row ORDER BY 1;
 product_id | product_name | category  | total 
------------+--------------+-----------+-------
       1501 | vivitar 35mm | electrncs |   100
       1502 | olympus is50 | electrncs |   100
       1600 | play gym     | toys      |   100
       1601 | lamaze       | toys      |   100
       1666 | harry potter | dvd       |   100
(5 rows)

SELECT * FROM newproducts_row ORDER BY 1;
 product_id |  product_name  | category  | total 
------------+----------------+-----------+-------
       1502 | olympus camera | electrncs |   200
       1601 | lamaze         | toys      |   200
       1666 | harry potter   | toys      |   200
       1700 | wait interface | books     |   200
(4 rows)

MERGE INTO products_row p
USING newproducts_row np
ON (select true)
WHEN NOT MATCHED THEN
    INSERT (product_id, product_name, total) 
	VALUES (np.product_id, np.product_name, np.total);
SELECT * FROM products_row ORDER BY 1;
 product_id | product_name | category  | total 
------------+--------------+-----------+-------
       1501 | vivitar 35mm | electrncs |   100
       1502 | olympus is50 | electrncs |   100
       1600 | play gym     | toys      |   100
       1601 | lamaze       | toys      |   100
       1666 | harry potter | dvd       |   100
(5 rows)

--subquery
TRUNCATE products_row;
INSERT INTO products_row SELECT * FROM products_base;
MERGE INTO products_row p
USING (select * from newproducts_row ) np
ON p.product_id = np.product_id
WHEN MATCHED THEN 
	UPDATE SET product_name = p.product_name, category = p.category || 'ABC', total = p.total + 100
WHEN NOT MATCHED THEN
	INSERT VALUES (np.product_id, np.product_name, np.category || 'DEF', np.total + 200);
SELECT * FROM products_row ORDER BY 1;
 product_id |  product_name  |   category   | total 
------------+----------------+--------------+-------
       1501 | vivitar 35mm   | electrncs    |   100
       1502 | olympus is50   | electrncsABC |   200
       1600 | play gym       | toys         |   100
       1601 | lamaze         | toysABC      |   200
       1666 | harry potter   | dvdABC       |   200
       1700 | wait interface | booksDEF     |   400
(6 rows)

--subquery with expression
TRUNCATE products_row;
INSERT INTO products_row SELECT * FROM products_base;
MERGE INTO products_row p
USING (select * from newproducts_row ) np
ON p.product_id = np.product_id
WHEN MATCHED THEN 
	UPDATE SET product_name = p.product_name, category = p.category || 'ABC', total = p.total + 100 WHERE np.product_name ='lamaze'
WHEN NOT MATCHED THEN
	INSERT VALUES (np.product_id, np.product_name, np.category || 'DEF', np.total + 200) WHERE np.product_name = 'wait interface';
SELECT * FROM products_row order by 1;
 product_id |  product_name  | category  | total 
------------+----------------+-----------+-------
       1501 | vivitar 35mm   | electrncs |   100
       1502 | olympus is50   | electrncs |   100
       1600 | play gym       | toys      |   100
       1601 | lamaze         | toysABC   |   200
       1666 | harry potter   | dvd       |   100
       1700 | wait interface | booksDEF  |   400
(6 rows)

--subquery with expression
TRUNCATE products_row;
INSERT INTO products_row SELECT * FROM products_base;
MERGE INTO products_row p
USING (select sp.product_id, sp.product_name, snp.category, snp.total from newproducts_row snp, products_row sp where sp.product_id = snp.product_id) np
ON p.product_id = np.product_id
WHEN MATCHED THEN 
	UPDATE SET product_name = p.product_name, category = p.category || 'ABC', total = p.total + 100 WHERE product_name ='lamaze'
WHEN NOT MATCHED THEN
	INSERT VALUES (np.product_id, np.product_name, np.category || 'DEF', np.total + 200) WHERE np.product_name = 'wait interface';
SELECT * FROM products_row order by 1;
 product_id | product_name | category  | total 
------------+--------------+-----------+-------
       1501 | vivitar 35mm | electrncs |   100
       1502 | olympus is50 | electrncs |   100
       1600 | play gym     | toys      |   100
       1601 | lamaze       | toysABC   |   200
       1666 | harry potter | dvd       |   100
(5 rows)

--subquery has constant
TRUNCATE products_row;
INSERT INTO products_row SELECT * FROM products_base;
MERGE INTO products_row p
USING (
select 1501 as product_id, 'vivitar 35mm' as product_name, 'electrncs' as category, 100 as total union all
select 1502 as product_id, 'olympus is50' as product_name, 'electrncs' as category, 100 as total union all
select 1600 as product_id, 'play gym' as product_name, 'toys' as category, 100 as total union all
select 1601 as product_id, 'lamaze' as product_name, 'toys' as category, 100 as total union all
select 1666 as product_id, 'harry potter' as product_name, 'dvd' as category, 100 as total
 ) np
ON p.product_id = np.product_id
WHEN MATCHED THEN 
	UPDATE SET product_name = p.product_name, category = p.category || 'ABC', total = p.total + 100
WHEN NOT MATCHED THEN
	INSERT VALUES (np.product_id, np.product_name, np.category || 'DEF', np.total + 200);
SELECT * FROM products_row ORDER BY 1;
 product_id | product_name |   category   | total 
------------+--------------+--------------+-------
       1501 | vivitar 35mm | electrncsABC |   200
       1502 | olympus is50 | electrncsABC |   200
       1600 | play gym     | toysABC      |   200
       1601 | lamaze       | toysABC      |   200
       1666 | harry potter | dvdABC       |   200
(5 rows)

--subquery has aggeration
TRUNCATE products_row;
INSERT INTO products_row SELECT * FROM products_base;
MERGE INTO products_row p
USING (
select product_id, product_name, category, sum(total) as total from newproducts_row group by product_id, product_name, category
 ) np
ON p.product_id = np.product_id
WHEN MATCHED THEN 
	UPDATE SET product_name = p.product_name, category = p.category || 'ABC', total = p.total + 100
WHEN NOT MATCHED THEN
	INSERT VALUES (np.product_id, np.product_name, np.category || 'DEF', np.total + 200);
SELECT * FROM products_row ORDER BY 1;
 product_id |  product_name  |   category   | total 
------------+----------------+--------------+-------
       1501 | vivitar 35mm   | electrncs    |   100
       1502 | olympus is50   | electrncsABC |   200
       1600 | play gym       | toys         |   100
       1601 | lamaze         | toysABC      |   200
       1666 | harry potter   | dvdABC       |   200
       1700 | wait interface | booksDEF     |   400
(6 rows)

--subquery has aggeration
TRUNCATE products_row;
INSERT INTO products_row SELECT * FROM products_base;
MERGE INTO products_row p
USING (
select product_id, product_name, category, sum(total) as total
from newproducts_row
group by product_id, product_name, category
having sum(total)>100
order by total
 ) np
ON p.product_id = np.product_id
WHEN MATCHED THEN 
	UPDATE SET product_name = p.product_name, category = p.category || 'ABC', total = p.total + 100
WHEN NOT MATCHED THEN
	INSERT VALUES (np.product_id, np.product_name, np.category || 'DEF', np.total + 200);
SELECT * FROM products_row ORDER BY 1;
 product_id |  product_name  |   category   | total 
------------+----------------+--------------+-------
       1501 | vivitar 35mm   | electrncs    |   100
       1502 | olympus is50   | electrncsABC |   200
       1600 | play gym       | toys         |   100
       1601 | lamaze         | toysABC      |   200
       1666 | harry potter   | dvdABC       |   200
       1700 | wait interface | booksDEF     |   400
(6 rows)

--source table have a view
TRUNCATE products_row;
INSERT INTO products_row SELECT * FROM products_base;
CREATE VIEW v AS (SELECT * FROM newproducts_row WHERE total > 100);
MERGE INTO products_row p
USING v np
ON p.product_id = np.product_id
WHEN MATCHED THEN 
	UPDATE SET product_name = p.product_name, category = p.category || 'ABC', total = p.total + 100
WHEN NOT MATCHED THEN
	INSERT VALUES (np.product_id, np.product_name, np.category || 'DEF', np.total + 200);
SELECT * FROM products_row ORDER BY 1;
 product_id |  product_name  |   category   | total 
------------+----------------+--------------+-------
       1501 | vivitar 35mm   | electrncs    |   100
       1502 | olympus is50   | electrncsABC |   200
       1600 | play gym       | toys         |   100
       1601 | lamaze         | toysABC      |   200
       1666 | harry potter   | dvdABC       |   200
       1700 | wait interface | booksDEF     |   400
(6 rows)

--self merge
TRUNCATE products_row;
INSERT INTO products_row SELECT * FROM products_base;
BEGIN;
MERGE INTO products_row p
USING products_row np
ON p.product_id = np.product_id
WHEN MATCHED THEN 
	UPDATE SET product_name = p.product_name, category = p.category || 'ABC', total = p.total + 100
WHEN NOT MATCHED THEN
	INSERT VALUES (np.product_id, np.product_name, np.category || 'DEF', np.total + 200);
SELECT * FROM products_row ORDER BY 1;
 product_id | product_name |   category   | total 
------------+--------------+--------------+-------
       1501 | vivitar 35mm | electrncsABC |   200
       1502 | olympus is50 | electrncsABC |   200
       1600 | play gym     | toysABC      |   200
       1601 | lamaze       | toysABC      |   200
       1666 | harry potter | dvdABC       |   200
(5 rows)

ROLLBACK;
-- Function scans
CREATE TABLE fs_target (a int, b int, c text);
MERGE INTO fs_target t
USING generate_series(1,100,1) AS id
ON t.a = id
WHEN MATCHED THEN
    UPDATE SET b = b + id
WHEN NOT MATCHED THEN
    INSERT VALUES (id, -1);
MERGE INTO fs_target t
USING generate_series(1,100,2) AS id
ON t.a = id
WHEN MATCHED THEN
    UPDATE SET b = b + id, c = 'updated '|| id.*::text
WHEN NOT MATCHED THEN
    INSERT VALUES (id, -1, 'inserted ' || id.*::text);
SELECT count(*) FROM fs_target;
 count 
-------
   100
(1 row)

DROP TABLE fs_target;
--default values for insert values
BEGIN;
MERGE INTO products_row p
USING newproducts_row np
ON p.product_id = np.product_id
WHEN NOT MATCHED THEN
  INSERT VALUES (DEFAULT);
MERGE INTO products_row p
USING newproducts_row np
ON p.product_id = np.product_id
WHEN NOT MATCHED THEN
  INSERT VALUES (DEFAULT, np.product_name, np.category, DEFAULT);
MERGE INTO products_row p
USING newproducts_row np
ON p.product_id = np.product_id
WHEN NOT MATCHED THEN
  INSERT DEFAULT VALUES;
select * from  products_row order by 1,2,3,4;
 product_id |  product_name  | category  | total 
------------+----------------+-----------+-------
          0 | null           | unknown   |     0
          0 | null           | unknown   |     0
          0 | wait interface | books     |     0
       1501 | vivitar 35mm   | electrncs |   100
       1502 | olympus is50   | electrncs |   100
       1600 | play gym       | toys      |   100
       1601 | lamaze         | toys      |   100
       1666 | harry potter   | dvd       |   100
(8 rows)

ROLLBACK;
--default values for update values
BEGIN;
MERGE INTO products_row p
USING newproducts_row np
ON p.product_id = np.product_id
WHEN MATCHED THEN
  UPDATE SET product_name = DEFAULT, category = DEFAULT, total = DEFAULT 
WHEN NOT MATCHED THEN
  INSERT VALUES (DEFAULT);
select * from  products_row order by 1;  
 product_id | product_name | category  | total 
------------+--------------+-----------+-------
          0 | null         | unknown   |     0
       1501 | vivitar 35mm | electrncs |   100
       1502 | null         | unknown   |     0
       1600 | play gym     | toys      |   100
       1601 | null         | unknown   |     0
       1666 | null         | unknown   |     0
(6 rows)

ROLLBACK;
----------------------plpgsql-----------------------------------
BEGIN;
DO LANGUAGE plpgsql $$
BEGIN
MERGE INTO products_row p
USING newproducts_row np
ON p.product_id = np.product_id
WHEN MATCHED THEN
  UPDATE SET product_name = np.product_name, category = np.category , total = np.total
WHEN NOT MATCHED THEN
  INSERT VALUES (np.product_id, np.product_name, np.category, np.total);
END;
$$;
SELECT * FROM products_row order by 1;
 product_id |  product_name  | category  | total 
------------+----------------+-----------+-------
       1501 | vivitar 35mm   | electrncs |   100
       1502 | olympus camera | electrncs |   200
       1600 | play gym       | toys      |   100
       1601 | lamaze         | toys      |   200
       1666 | harry potter   | toys      |   200
       1700 | wait interface | books     |   200
(6 rows)

ROLLBACK;
--NON ANOYBLOCK 
BEGIN;
BEGIN
MERGE INTO products_row p
USING newproducts_row np
ON p.product_id = np.product_id
WHEN MATCHED THEN
  UPDATE SET product_name = np.product_name, category = np.category , total = np.total
WHEN NOT MATCHED THEN
  INSERT VALUES (np.product_id, np.product_name, np.category, np.total);
END;
/
SELECT * FROM products_row order by 1;
 product_id |  product_name  | category  | total 
------------+----------------+-----------+-------
       1501 | vivitar 35mm   | electrncs |   100
       1502 | olympus camera | electrncs |   200
       1600 | play gym       | toys      |   100
       1601 | lamaze         | toys      |   200
       1666 | harry potter   | toys      |   200
       1700 | wait interface | books     |   200
(6 rows)

ROLLBACK;
--stored procedure
create or replace procedure p1()
AS
BEGIN
	MERGE INTO products_row p
	USING newproducts_row np
	ON p.product_id = np.product_id
	WHEN MATCHED THEN
	  UPDATE SET product_name = np.product_name, category = np.category , total = np.total
	WHEN NOT MATCHED THEN
	  INSERT VALUES (np.product_id, np.product_name, np.category, np.total);
END;
/
BEGIN;
select p1();
 p1 
----
 
(1 row)

SELECT * FROM products_row order by 1;
 product_id |  product_name  | category  | total 
------------+----------------+-----------+-------
       1501 | vivitar 35mm   | electrncs |   100
       1502 | olympus camera | electrncs |   200
       1600 | play gym       | toys      |   100
       1601 | lamaze         | toys      |   200
       1666 | harry potter   | toys      |   200
       1700 | wait interface | books     |   200
(6 rows)

ROLLBACK;
--stored procedure with params in insert targetlist
create or replace procedure p2( param1 IN text)
AS
BEGIN
	MERGE INTO products_row p
	USING newproducts_row np
	ON p.product_id = np.product_id
	WHEN MATCHED THEN
	  UPDATE SET product_name = np.product_name, category = np.category , total = np.total
	WHEN NOT MATCHED THEN
	  INSERT VALUES (np.product_id, 'inserted by proc', param1, np.total);
END;
/
BEGIN;
select p2('param1');
 p2 
----
 
(1 row)

SELECT * FROM products_row order by 1;
 product_id |   product_name   | category  | total 
------------+------------------+-----------+-------
       1501 | vivitar 35mm     | electrncs |   100
       1502 | olympus camera   | electrncs |   200
       1600 | play gym         | toys      |   100
       1601 | lamaze           | toys      |   200
       1666 | harry potter     | toys      |   200
       1700 | inserted by proc | param1    |   200
(6 rows)

ROLLBACK;
BEGIN;
select p2('param2');
 p2 
----
 
(1 row)

SELECT * FROM products_row order by 1;
 product_id |   product_name   | category  | total 
------------+------------------+-----------+-------
       1501 | vivitar 35mm     | electrncs |   100
       1502 | olympus camera   | electrncs |   200
       1600 | play gym         | toys      |   100
       1601 | lamaze           | toys      |   200
       1666 | harry potter     | toys      |   200
       1700 | inserted by proc | param2    |   200
(6 rows)

ROLLBACK;
--stored procedure with params in update targetlist
create or replace procedure p3( param1 IN text)
AS
BEGIN
	MERGE INTO products_row p
	USING newproducts_row np
	ON p.product_id = np.product_id
	WHEN MATCHED THEN
	  UPDATE SET product_name = np.product_name, category = param1 , total = np.total
	WHEN NOT MATCHED THEN
	  INSERT VALUES (np.product_id, 'inserted by proc', np.category, np.total);
END;
/
BEGIN;
select p3('param1');
 p3 
----
 
(1 row)

SELECT * FROM products_row order by 1;
 product_id |   product_name   | category  | total 
------------+------------------+-----------+-------
       1501 | vivitar 35mm     | electrncs |   100
       1502 | olympus camera   | param1    |   200
       1600 | play gym         | toys      |   100
       1601 | lamaze           | param1    |   200
       1666 | harry potter     | param1    |   200
       1700 | inserted by proc | books     |   200
(6 rows)

ROLLBACK;
BEGIN;
select p3('param2');
 p3 
----
 
(1 row)

SELECT * FROM products_row order by 1;
 product_id |   product_name   | category  | total 
------------+------------------+-----------+-------
       1501 | vivitar 35mm     | electrncs |   100
       1502 | olympus camera   | param2    |   200
       1600 | play gym         | toys      |   100
       1601 | lamaze           | param2    |   200
       1666 | harry potter     | param2    |   200
       1700 | inserted by proc | books     |   200
(6 rows)

ROLLBACK;
--stored procedure with params in where conditions
create or replace procedure p4( param1 IN text)
AS
BEGIN
	MERGE INTO products_row p
	USING newproducts_row np
	ON p.product_id = np.product_id
	WHEN MATCHED THEN
	  UPDATE SET product_name = np.product_name, category = np.category || 'DEF' , total = np.total
	  WHERE category = param1
	WHEN NOT MATCHED THEN
	  INSERT VALUES (np.product_id, 'inserted by proc', np.category, np.total);
END;
/
BEGIN;
select p4('toys'); --only update toys
 p4 
----
 
(1 row)

SELECT * FROM products_row order by 1;
 product_id |   product_name   | category  | total 
------------+------------------+-----------+-------
       1501 | vivitar 35mm     | electrncs |   100
       1502 | olympus is50     | electrncs |   100
       1600 | play gym         | toys      |   100
       1601 | lamaze           | toysDEF   |   200
       1666 | harry potter     | dvd       |   100
       1700 | inserted by proc | books     |   200
(6 rows)

ROLLBACK;
BEGIN;
select p4('dvd'); --only update dvd
 p4 
----
 
(1 row)

SELECT * FROM products_row order by 1;
 product_id |   product_name   | category  | total 
------------+------------------+-----------+-------
       1501 | vivitar 35mm     | electrncs |   100
       1502 | olympus is50     | electrncs |   100
       1600 | play gym         | toys      |   100
       1601 | lamaze           | toys      |   100
       1666 | harry potter     | toysDEF   |   200
       1700 | inserted by proc | books     |   200
(6 rows)

ROLLBACK;
BEGIN;
select p4('electrncs'); --only update electrncs
 p4 
----
 
(1 row)

SELECT * FROM products_row order by 1;
 product_id |   product_name   |   category   | total 
------------+------------------+--------------+-------
       1501 | vivitar 35mm     | electrncs    |   100
       1502 | olympus camera   | electrncsDEF |   200
       1600 | play gym         | toys         |   100
       1601 | lamaze           | toys         |   100
       1666 | harry potter     | dvd          |   100
       1700 | inserted by proc | books        |   200
(6 rows)

ROLLBACK;
--update index
create table src(a bigint, b bigint, c varchar(1000));
create table des(a bigint, b bigint, c varchar(1000));
create index src_i on src(b);
create index des_i on des(b);
insert into des values(generate_series(1,10), generate_series(1,10), 'des');
insert into src values(generate_series(1,10), generate_series(1,10), 'src');
insert into src (select a+100, b+100, c from src);
insert into src (select a+1000, b+1000, c from src);
insert into src (select a+10000, b+10000, c from src);
insert into src (select a+100000, b+100000, c from src);
insert into src (select a+1000000, b+1000000, c from src);
insert into src (select a+10000000, b+10000000, c from src);
insert into src (select a+100000000, b+100000000, c from src);
insert into src (select a+1000000000, b+100000000, c from src);
insert into src (select a+10000000000, b+100000000, c from src);
insert into des (select a+100, b+100, c from des);
insert into des (select a+1000, b+1000, c from des);
insert into des (select a+10000, b+10000, c from des);
insert into des (select a+100000, b+100000, c from des);
insert into des (select a+1000000, b+1000000, c from des);
insert into des (select a+10000000, b+10000000, c from des);
insert into des (select a+100000000, b+100000000, c from des);
insert into des (select a+1000000000, b+1000000000, c from des);
insert into des (select a+10000000000, b+1000000000, c from des);
MERGE INTO des d
USING src s
ON d.a = s.a
WHEN MATCHED THEN
  UPDATE SET b = s.b + 10, c = s.c
WHEN NOT MATCHED THEN
  INSERT VALUES (s.a, s.b);
--rows shall be the same
select count(*) from src;
 count 
-------
  5120
(1 row)

select count(*) from des;
 count 
-------
  5120
(1 row)

--column b of des is 10 bigger than src
select * from src where a = 105;
  a  |  b  |  c  
-----+-----+-----
 105 | 105 | src
(1 row)

select * from des where b = 115;
  a  |  b  |  c  
-----+-----+-----
 105 | 115 | src
(1 row)

drop table des;
drop table src;
--dropped column and add column
BEGIN;
ALTER TABLE products_row DROP COLUMN category;
MERGE INTO products_row p
USING newproducts_row np
ON p.product_id = np.product_id
WHEN NOT MATCHED THEN
    INSERT VALUES (np.product_id, np.product_name, np.total)
WHEN MATCHED THEN
    UPDATE SET product_name = p.product_name ||' + '|| np.product_name,
			   total        = p.total + np.total;
SELECT * FROM products_row ORDER BY 1;
 product_id |         product_name          | total 
------------+-------------------------------+-------
       1501 | vivitar 35mm                  |   100
       1502 | olympus is50 + olympus camera |   300
       1600 | play gym                      |   100
       1601 | lamaze + lamaze               |   300
       1666 | harry potter + harry potter   |   300
       1700 | wait interface                |   200
(6 rows)

TRUNCATE products_row;
ALTER TABLE products_row ADD COLUMN category VARCHAR;
INSERT INTO products_row SELECT product_id,product_name,total,category FROM products_base;
MERGE INTO products_row p
USING newproducts_row np
ON p.product_id = np.product_id
WHEN NOT MATCHED THEN
    INSERT VALUES (np.product_id, np.product_name, np.total)
WHEN MATCHED THEN
    UPDATE SET product_name = p.product_name ||' + '|| np.product_name,
			   total        = p.total + np.total;
SELECT * FROM products_row ORDER BY 1;
 product_id |         product_name          | total | category  
------------+-------------------------------+-------+-----------
       1501 | vivitar 35mm                  |   100 | electrncs
       1502 | olympus is50 + olympus camera |   300 | electrncs
       1600 | play gym                      |   100 | toys
       1601 | lamaze + lamaze               |   300 | toys
       1666 | harry potter + harry potter   |   300 | dvd
       1700 | wait interface                |   200 | 
(6 rows)

ROLLBACK;
--join key diffs from distribute key
BEGIN;
MERGE INTO products_row p
USING newproducts_row np
ON p.total = np.product_id
WHEN NOT MATCHED THEN
    INSERT VALUES (np.product_id, np.product_name, np.category, np.total);
SELECT * FROM products_row ORDER BY 1,2,3,4;
 product_id |  product_name  | category  | total 
------------+----------------+-----------+-------
       1501 | vivitar 35mm   | electrncs |   100
       1502 | olympus camera | electrncs |   200
       1502 | olympus is50   | electrncs |   100
       1600 | play gym       | toys      |   100
       1601 | lamaze         | toys      |   100
       1601 | lamaze         | toys      |   200
       1666 | harry potter   | dvd       |   100
       1666 | harry potter   | toys      |   200
       1700 | wait interface | books     |   200
(9 rows)

ROLLBACK;
BEGIN;
MERGE INTO products_row p
USING newproducts_row np
ON p.total = np.product_id
WHEN MATCHED THEN
    UPDATE SET product_name = p.product_name ||' + '|| np.product_name;
SELECT * FROM products_row ORDER BY 1;
 product_id | product_name | category  | total 
------------+--------------+-----------+-------
       1501 | vivitar 35mm | electrncs |   100
       1502 | olympus is50 | electrncs |   100
       1600 | play gym     | toys      |   100
       1601 | lamaze       | toys      |   100
       1666 | harry potter | dvd       |   100
(5 rows)

ROLLBACK;
BEGIN;
MERGE INTO products_row p
USING newproducts_row np
ON p.total = np.product_id
WHEN NOT MATCHED THEN
    INSERT VALUES (np.product_id, np.product_name, np.category, np.total)
WHEN MATCHED THEN
    UPDATE SET product_name = p.product_name ||' + '|| np.product_name;
SELECT * FROM products_row ORDER BY 1,2,3,4;
 product_id |  product_name  | category  | total 
------------+----------------+-----------+-------
       1501 | vivitar 35mm   | electrncs |   100
       1502 | olympus camera | electrncs |   200
       1502 | olympus is50   | electrncs |   100
       1600 | play gym       | toys      |   100
       1601 | lamaze         | toys      |   100
       1601 | lamaze         | toys      |   200
       1666 | harry potter   | dvd       |   100
       1666 | harry potter   | toys      |   200
       1700 | wait interface | books     |   200
(9 rows)

ROLLBACK;
BEGIN;
MERGE INTO products_row p
USING newproducts_row np
ON p.total = np.total
WHEN NOT MATCHED THEN
    INSERT VALUES (np.product_id, np.product_name, np.category, np.total);
SELECT * FROM products_row ORDER BY 1,2,3,4;
 product_id |  product_name  | category  | total 
------------+----------------+-----------+-------
       1501 | vivitar 35mm   | electrncs |   100
       1502 | olympus camera | electrncs |   200
       1502 | olympus is50   | electrncs |   100
       1600 | play gym       | toys      |   100
       1601 | lamaze         | toys      |   100
       1601 | lamaze         | toys      |   200
       1666 | harry potter   | dvd       |   100
       1666 | harry potter   | toys      |   200
       1700 | wait interface | books     |   200
(9 rows)

ROLLBACK;
BEGIN;
MERGE INTO products_row p
USING newproducts_row np
ON p.total = np.total
WHEN MATCHED THEN
    UPDATE SET product_name = p.product_name ||' + '|| np.product_name;
SELECT * FROM products_row ORDER BY 1;
 product_id | product_name | category  | total 
------------+--------------+-----------+-------
       1501 | vivitar 35mm | electrncs |   100
       1502 | olympus is50 | electrncs |   100
       1600 | play gym     | toys      |   100
       1601 | lamaze       | toys      |   100
       1666 | harry potter | dvd       |   100
(5 rows)

ROLLBACK;
BEGIN;
MERGE INTO products_row p
USING newproducts_row np
ON p.total = np.total
WHEN NOT MATCHED THEN
    INSERT VALUES (np.product_id, np.product_name, np.category, np.total)
WHEN MATCHED THEN
    UPDATE SET product_name = p.product_name ||' + '|| np.product_name;
SELECT * FROM products_row ORDER BY 1,2,3,4;
 product_id |  product_name  | category  | total 
------------+----------------+-----------+-------
       1501 | vivitar 35mm   | electrncs |   100
       1502 | olympus camera | electrncs |   200
       1502 | olympus is50   | electrncs |   100
       1600 | play gym       | toys      |   100
       1601 | lamaze         | toys      |   100
       1601 | lamaze         | toys      |   200
       1666 | harry potter   | dvd       |   100
       1666 | harry potter   | toys      |   200
       1700 | wait interface | books     |   200
(9 rows)

ROLLBACK;
--target table distributed by multiple columns, and then test dropped column and added column
CREATE TABLE products_row_multi
(
product_id INTEGER,
product_name VARCHAR(60),
category VARCHAR(60),
total INTEGER
)
DISTRIBUTE BY HASH(product_id, category);
INSERT INTO products_row_multi SELECT * FROM products_base;
ANALYZE products_row_multi;
BEGIN;
MERGE INTO products_row_multi p
USING newproducts_row np
ON p.product_id = np.product_id
WHEN MATCHED THEN
  UPDATE SET product_name = p.product_name || 'ABC', total = p.total + 100
WHEN NOT MATCHED THEN  
  INSERT VALUES (np.product_id, np.product_name, np.category || 'ABC', np.total + 100);
SELECT * FROM products_row_multi ORDER BY 1;
 product_id |  product_name   | category  | total 
------------+-----------------+-----------+-------
       1501 | vivitar 35mm    | electrncs |   100
       1502 | olympus is50ABC | electrncs |   200
       1600 | play gym        | toys      |   100
       1601 | lamazeABC       | toys      |   200
       1666 | harry potterABC | dvd       |   200
       1700 | wait interface  | booksABC  |   300
(6 rows)

ROLLBACK;
BEGIN;
UPDATE products_row_multi SET total = 100; --generate some dead rows
MERGE INTO products_row_multi p
USING newproducts_row np
ON p.product_id = np.product_id
WHEN MATCHED THEN
  UPDATE SET product_name = p.product_name || 'ABC', total = p.total + 100
WHEN NOT MATCHED THEN  
  INSERT VALUES (np.product_id, np.product_name, np.category || 'ABC', np.total + 100);
SELECT * FROM products_row_multi ORDER BY 1;
 product_id |  product_name   | category  | total 
------------+-----------------+-----------+-------
       1501 | vivitar 35mm    | electrncs |   100
       1502 | olympus is50ABC | electrncs |   200
       1600 | play gym        | toys      |   100
       1601 | lamazeABC       | toys      |   200
       1666 | harry potterABC | dvd       |   200
       1700 | wait interface  | booksABC  |   300
(6 rows)

ROLLBACK;
ALTER TABLE products_row_multi DROP COLUMN product_name; --dropped column
BEGIN;
MERGE INTO products_row_multi p
USING newproducts_row np
ON p.product_id = np.product_id
WHEN MATCHED THEN
  UPDATE SET total = p.total + 100
WHEN NOT MATCHED THEN  
  INSERT VALUES (np.product_id, np.category || 'ABC', np.total + 100);
SELECT * FROM products_row_multi ORDER BY 1;
 product_id | category  | total 
------------+-----------+-------
       1501 | electrncs |   100
       1502 | electrncs |   200
       1600 | toys      |   100
       1601 | toys      |   200
       1666 | dvd       |   200
       1700 | booksABC  |   300
(6 rows)

ROLLBACK;
ALTER TABLE products_row_multi ADD COLUMN product_name VARCHAR;  --added column
TRUNCATE products_row_multi;
INSERT INTO products_row_multi SELECT product_id,category,total,product_name FROM products_base;
BEGIN;
MERGE INTO products_row_multi p
USING newproducts_row np
ON p.product_id = np.product_id
WHEN MATCHED THEN
  UPDATE SET product_name = p.product_name || 'ABC', total = p.total + 100;
SELECT * FROM products_row_multi ORDER BY 1;
 product_id | category  | total |  product_name   
------------+-----------+-------+-----------------
       1501 | electrncs |   100 | vivitar 35mm
       1502 | electrncs |   200 | olympus is50ABC
       1600 | toys      |   100 | play gym
       1601 | toys      |   200 | lamazeABC
       1666 | dvd       |   200 | harry potterABC
(5 rows)

ROLLBACK;
BEGIN;
MERGE INTO products_row_multi p
USING newproducts_row np
ON p.product_id = np.product_id
WHEN NOT MATCHED THEN  
  INSERT VALUES (np.product_id, np.category || 'ABC', np.total + 100, np.product_name);
SELECT * FROM products_row_multi ORDER BY 1;
 product_id | category  | total |  product_name  
------------+-----------+-------+----------------
       1501 | electrncs |   100 | vivitar 35mm
       1502 | electrncs |   100 | olympus is50
       1600 | toys      |   100 | play gym
       1601 | toys      |   100 | lamaze
       1666 | dvd       |   100 | harry potter
       1700 | booksABC  |   300 | wait interface
(6 rows)

ROLLBACK;
BEGIN;
MERGE INTO products_row_multi p
USING newproducts_row np
ON p.product_id = np.product_id
WHEN MATCHED THEN
  UPDATE SET product_name = p.product_name || 'ABC', total = p.total + 100
WHEN NOT MATCHED THEN  
  INSERT VALUES (np.product_id, np.category || 'ABC', np.total + 100, np.product_name);
SELECT * FROM products_row_multi ORDER BY 1;
 product_id | category  | total |  product_name   
------------+-----------+-------+-----------------
       1501 | electrncs |   100 | vivitar 35mm
       1502 | electrncs |   200 | olympus is50ABC
       1600 | toys      |   100 | play gym
       1601 | toys      |   200 | lamazeABC
       1666 | dvd       |   200 | harry potterABC
       1700 | booksABC  |   300 | wait interface
(6 rows)

ROLLBACK;
drop table products_row;
drop table products_new;
ERROR:  table "products_new" does not exist
create table products_row(product_id int, total int);
create table products_new(product_id int, total int);
insert into products_row values(1502, 101);
insert into products_new values(1502, 102);
insert into products_new values(1502, 101);
MERGE INTO products_row p
USING products_new np
ON (p.product_id = np.product_id)
WHEN MATCHED THEN
  UPDATE SET  total = np.total
WHEN NOT MATCHED THEN
INSERT VALUES (np.product_id, np.total);
ERROR:  unable to get a stable set of rows in the source tables
set behavior_compat_options='merge_update_multi';
MERGE INTO products_row p
USING products_new np
ON (p.product_id = np.product_id)
WHEN MATCHED THEN
  UPDATE SET  total = np.total;
reset behavior_compat_options;
--partition table
create table test_partition_source
( c_smallint smallint, c_numeric numeric)
 partition by range (c_numeric)
(partition TBL_1  values less than (-1) ,
 partition TBL_2  values less than (30) ,
 partition TBL_3  values less than (60) ,
 partition TBL_4  values less than (100)  
 ) disable row movement;
 insert into test_partition_source values(-1,5);
 
 create table test_partition(a int, b numeric);
  insert into test_partition values(-1,10);
  insert into test_partition values(-1,10);
  merge into test_partition_source t1 using test_partition t2 on (t1.c_smallint = t2.a)
  when matched then
	update set t1.c_numeric = t2.b;
ERROR:  unable to get a stable set of rows in the source tables
set behavior_compat_options='merge_update_multi';
  merge into test_partition_source t1 using test_partition t2 on (t1.c_smallint = t2.a)
  when matched then
	update set t1.c_numeric = t2.b
  when not matched then
    insert values(1,10);
reset behavior_compat_options;
	
alter table test_partition_source  enable row movement;
update test_partition_source set c_numeric = -5;
merge into test_partition_source t1 using test_partition t2 on (t1.c_smallint = t2.a)
  when matched then
	update set t1.c_numeric = t2.b;
ERROR:  unable to get a stable set of rows in the source tables
set behavior_compat_options='merge_update_multi';
merge into test_partition_source t1 using test_partition t2 on (t1.c_smallint = t2.a)
  when matched then
	update set t1.c_numeric = t2.b
 when not matched then
	insert values (1,10);
reset behavior_compat_options;
-- clean up
DROP SCHEMA mergeinto CASCADE;
NOTICE:  drop cascades to 14 other objects
DETAIL:  drop cascades to table products_base
drop cascades to table newproducts_base
drop cascades to table newproducts_row
drop cascades to table products_part
drop cascades to view v
drop cascades to function p1()
drop cascades to function p2(text)
drop cascades to function p3(text)
drop cascades to function p4(text)
drop cascades to table products_row_multi
drop cascades to table products_row
drop cascades to table products_new
drop cascades to table test_partition_source
drop cascades to table test_partition
