CREATE SCHEMA merge_concurrent_update_delete_1;
SET current_schema = merge_concurrent_update_delete_1;
-- test merge with concurrent update/delete
CREATE TABLE merge_1(a int, b int, c int);
CREATE TABLE merge_2(a int);
insert into merge_1 values(1,1,1);
insert into merge_2 values(1);
-- concurrent update on join condition row, after update, the row doesn't match, so the merge should go to not match condition
\parallel on 2
begin
    update merge_1 set a=22 where a=1;
    perform pg_sleep(3);
end;
/
begin
    perform pg_sleep(1);
    merge INTO merge_1 p1 using (select * from merge_2) p2 on (p1.a=p2.a) when matched then update set p1.b=66 when NOT MATCHED THEN INSERT (a,b,c) values(8,8,8);
end;
/
\parallel off
select * from merge_1 order by a; -- two rows(merge not matched)
 a  | b | c 
----+---+---
  8 | 8 | 8
 22 | 1 | 1
(2 rows)

delete from merge_1;
insert into merge_1 values(1,1,1);
-- concurrent update on non-join condition row, after update, the row still match, so the merge should go to match condition
\parallel on 2
begin
    update merge_1 set b=22 where a=1;
    perform pg_sleep(3);
end;
/
begin
    perform pg_sleep(1);
    merge INTO merge_1 p1 using (select * from merge_2) p2 on (p1.a=p2.a) when matched then update set p1.b=66 when NOT MATCHED THEN INSERT (a,b,c) values(8,8,8);
end;
/
\parallel off
select * from merge_1 order by a; -- one rows(merge matched)
 a | b  | c 
---+----+---
 1 | 66 | 1
(1 row)

delete from merge_1;
insert into merge_1 values(1,1,1);
-- concurrent delete on join condition row, after delete, the merge should go to not match condition
\parallel on 2
begin
    delete from merge_1;
    perform pg_sleep(3);
end;
/
begin
    perform pg_sleep(1);
    merge INTO merge_1 p1 using (select * from merge_2) p2 on (p1.a=p2.a) when matched then update set p1.b=66 when NOT MATCHED THEN INSERT (a,b,c) values(8,8,8);
end;
/
\parallel off
select * from merge_1 order by a; -- one new rows(merge not matched)
 a | b | c 
---+---+---
 8 | 8 | 8
(1 row)

drop schema merge_concurrent_update_delete_1 cascade;
NOTICE:  drop cascades to 2 other objects
DETAIL:  drop cascades to table merge_1
drop cascades to table merge_2
