--create trigger
-- test mysql compatibility trigger 
drop database if exists db_mysql;
NOTICE:  database "db_mysql" does not exist, skipping
create database db_mysql dbcompatibility 'B';
drop database if exists db_td;
NOTICE:  database "db_td" does not exist, skipping
create database db_td dbcompatibility='C';
\c db_td
create table animals (id int, name char(30));
create table food (id int, foodtype varchar(32), remark varchar(32), time_flag timestamp);
create trigger animal_trigger1
after insert on animals
for each row
begin
    insert into food(id, foodtype, remark, time_flag) values (1,'ice cream', 'sdsdsdsd', now());
end;
/
ERROR:  Current syntax is supported only in B compatibility database
create or replace trigger animal_trigger1
after insert on animals
for each row
begin
    insert into food(id, foodtype, remark, time_flag) values (1,'ice cream', 'sdsdsdsd', now());
end;
/
ERROR:  or replace is not supported here.
LINE 1: create or replace trigger animal_trigger1
               ^
\c db_mysql
create table t (id int);
create table t1 (id int);
create table animals (id int, name char(30));
create table food (id int, foodtype varchar(32), remark varchar(32), time_flag timestamp);
--definer test 
create definer=d_user1 trigger animal_trigger1
after insert on t
for each row
begin 
    insert into t1 values(3);
end;
/
ERROR:  role "d_user1" is not exists
/*
create user test with sysadmin password 'Gauss@123';
create user test1 password 'Gauss@123';

grant all on t ,t1 to test;
grant all on t ,t1 to test1;
set role test password 'Gauss@123';

create definer = test1 trigger animal_trigger1
after insert on t
for each row
begin 
    insert into t1 values(3);
end;
/
insert into t values(3);
set role d_user1 password 'Aa123456';
alter role d_user1 identified by '123456Aa' replace 'Aa123456';
insert into t values(3);
select * from t1;

reset role;
drop trigger animal_trigger1 on t;
*/
-- trigger_order{follows|precedes} && begin ... end test
create trigger animal_trigger1
after insert on animals
for each row
begin
    insert into food(id, foodtype, remark, time_flag) values (1,'ice cream', 'sdsdsdsd', now());
end;
/
create or replace trigger animal_trigger1
after insert on animals
for each row
begin
    insert into food(id, foodtype, remark, time_flag) values (1,'ice cream', 'sdsdsdsd', now());
end;
/
ERROR:  or replace is not supported here.
LINE 1: create or replace trigger animal_trigger1
               ^
--different type trigger follows|precedes
create trigger animal_trigger2
before insert on animals
for each row
follows animal_trigger1
begin
    insert into food(id, foodtype, remark, time_flag) values (2,'chocolate', 'sdsdsdsd', now());
end;
/
ERROR:  trigger "animal_trigger1" type is not same as current trigger
create trigger animal_trigger2
after insert on animals
for each row
follows animal_trigger1
begin
    insert into food(id, foodtype, remark, time_flag) values (2,'chocolate', 'sdsdsdsd', now());
end;
/
create trigger animal_trigger3
after insert on animals
for each row
follows animal_trigger1
begin
    insert into food(id, foodtype, remark, time_flag) values (3,'cake', 'sdsdsdsd', now());
end;
/
create trigger animal_trigger4
after insert on animals
for each row
follows animal_trigger1
begin
    insert into food(id, foodtype, remark, time_flag) values (4,'sausage', 'sdsdsdsd', now());
end;
/
insert into animals (id, name) values(1,'lion');
select id, foodtype, remark from food;
 id | foodtype  |  remark  
----+-----------+----------
  1 | ice cream | sdsdsdsd
  4 | sausage   | sdsdsdsd
  3 | cake      | sdsdsdsd
  2 | chocolate | sdsdsdsd
(4 rows)

delete from food;
create trigger animal_trigger5
after insert on animals
for each row
precedes animal_trigger3
begin
    insert into food(id, foodtype, remark, time_flag) values (5,'milk', 'sdsds', now());
end;
/
create trigger animal_trigger6
after insert on animals
for each row
precedes animal_trigger2
begin
    insert into food(id, foodtype, remark, time_flag) values (6,'strawberry', 'sdsds', now());
end;
/
insert into animals (id, name) values (2, 'dog');
select id, foodtype, remark from food;
 id |  foodtype  |  remark  
----+------------+----------
  1 | ice cream  | sdsdsdsd
  4 | sausage    | sdsdsdsd
  5 | milk       | sdsds
  3 | cake       | sdsdsdsd
  6 | strawberry | sdsds
  2 | chocolate  | sdsdsdsd
(6 rows)

delete from food;
create trigger animal_trigger7
after insert on animals
for each row
follows animal_trigger5
begin
    insert into food(id, foodtype, remark, time_flag) values (7,'jelly', 'sdsds', now());
end;
/
insert into animals (id,name) values(3,'cat');
select id, foodtype, remark from food;
 id |  foodtype  |  remark  
----+------------+----------
  1 | ice cream  | sdsdsdsd
  4 | sausage    | sdsdsdsd
  5 | milk       | sdsds
  7 | jelly      | sdsds
  3 | cake       | sdsdsdsd
  6 | strawberry | sdsds
  2 | chocolate  | sdsdsdsd
(7 rows)

-- if not exists test
create trigger animal_trigger1
after insert on animals
for each row
begin
    insert into food(id, foodtype, remark, time_flag) values (1,'ice cream', 'sdsdsdsd', now());
end;
/
ERROR:  trigger "animal_trigger1" already exists
create trigger if not exists animal_trigger1
after insert on animals
for each row
begin
    insert into food(id, foodtype, remark, time_flag) values (1,'ice cream', 'sdsdsdsd', now());
end;
/
NOTICE:  trigger "animal_trigger1" already exists, skipping
CREATE OR REPLACE FUNCTION tri_insert_func() RETURNS TRIGGER AS
$$
DECLARE
BEGIN
INSERT INTO food(id, foodtype, remark, time_flag) values (1,'ice cream', 'sdsdsdsd', now());
RETURN NEW;
END
$$ LANGUAGE PLPGSQL;
create trigger trigger_rename_test
after insert on animals
for each row
EXECUTE PROCEDURE tri_insert_func();
create trigger trigger_rename_test
after insert on food
for each row
EXECUTE PROCEDURE tri_insert_func();
drop trigger trigger_rename_test;
ERROR:  trigger named "trigger_rename_test" has more than one trigger, please use drop trigger on syntax
-- drop trigger test
drop trigger animal_trigger1;
drop trigger animal_trigger1;
ERROR:  trigger "animal_trigger1" does not exist
drop trigger if exists animal_trigger1;
NOTICE:  trigger "animal_trigger1" does not exist, skipping
drop table food;
drop table animals;
DROP TABLE t_trigger cascade;
ERROR:  table "t_trigger" does not exist
CREATE TABLE t_trigger(
id int primary key,
name varchar(20) not null
)partition by hash(id)
(partition p1 ,
partition p2,
partition p3);
NOTICE:  CREATE TABLE / PRIMARY KEY will create implicit index "t_trigger_pkey" for table "t_trigger"
INSERT INTO t_trigger values(1,'liuyi');
INSERT INTO t_trigger values(2,'chener');
DROP TABLE t_func_trigger;
ERROR:  table "t_func_trigger" does not exist
CREATE TABLE t_func_trigger(rep text);
create user vbadmin password 'Aa@111111';
CREATE definer=vbadmin TRIGGER trigger_insert
AFTER insert
ON t_trigger
FOR EACH ROW
BEGIN 
insert into t_func_trigger(rep) values('after insert');END;
/
drop trigger trigger_insert on t_trigger;
drop user vbadmin;
-- test declare cursor
create table company(name varchar(100), loc varchar(100), no integer);
insert into company values ('macrosoft',    'usa',          001);
insert into company values ('oracle',       'usa',          002);
insert into company values ('backberry',    'canada',       003);
create or replace procedure test_cursor_1 
as
    company_name    varchar(100);
    company_loc varchar(100);
    company_no  integer;

begin 
    declare c1_all cursor is --cursor without args 
        select name, loc, no from company order by 1, 2, 3;
    if not c1_all%isopen then
        open c1_all;
    end if;
    loop
        fetch c1_all into company_name, company_loc, company_no;
        exit when c1_all%notfound;
        raise notice '% : % : %',company_name,company_loc,company_no;
    end loop;
    if c1_all%isopen then
        close c1_all;
    end if;
end;
/
call test_cursor_1();
NOTICE:  backberry : canada : 3
NOTICE:  macrosoft : usa : 1
NOTICE:  oracle : usa : 2
 test_cursor_1 
---------------
 
(1 row)

create or replace procedure test_cursor_1 
as
    company_name    varchar(100);
    company_loc varchar(100);
    company_no  integer;

begin 
    declare c1_all cursor is --cursor without args 
        select name, loc, no from company order by 1, 2, 3;
    declare c1_all cursor is --cursor without args 
        select name, loc, no from company order by 1, 2, 3;
    if not c1_all%isopen then
        open c1_all;
    end if;
    loop
        fetch c1_all into company_name, company_loc, company_no;
        exit when c1_all%notfound;
        raise notice '% : % : %',company_name,company_loc,company_no;
    end loop;
    if c1_all%isopen then
        close c1_all;
    end if;
end;
/
ERROR:  duplicate declaration at or near "c1_all"
LINE 8:     declare c1_all cursor is --cursor without args 
                    ^
QUERY:   DECLARE company_name    varchar(100);
    company_loc varchar(100);
    company_no  integer;

begin 
    declare c1_all cursor is --cursor without args 
        select name, loc, no from company order by 1, 2, 3;
    declare c1_all cursor is --cursor without args 
        select name, loc, no from company order by 1, 2, 3;
    if not c1_all%isopen then
        open c1_all;
    end if;
    loop
        fetch c1_all into company_name, company_loc, company_no;
        exit when c1_all%notfound;
        raise notice '% : % : %',company_name,company_loc,company_no;
    end loop;
    if c1_all%isopen then
        close c1_all;
    end if;
end
-- mysql fetch 自动退出
show b_format_behavior_compat_options;
 b_format_behavior_compat_options 
----------------------------------
 
(1 row)

set b_format_behavior_compat_options = 'fetch';
create or replace procedure test_cursor_1 
as
    company_name    varchar(100);
    company_loc varchar(100);
    company_no  integer;

begin 
    declare c1_all cursor is --cursor without args 
        select name, loc, no from company order by 1, 2, 3;
    if not c1_all%isopen then
        open c1_all;
    end if;
    loop
        fetch c1_all into company_name, company_loc, company_no;
        raise notice '% : % : %',company_name,company_loc,company_no;
    end loop;
    if c1_all%isopen then
        close c1_all;
    end if;
end;
/
call test_cursor_1();
NOTICE:  backberry : canada : 3
NOTICE:  macrosoft : usa : 1
NOTICE:  oracle : usa : 2
ERROR:  No data - zero rows fetched, selected, or processed
CONTEXT:  PL/pgSQL function test_cursor_1() line 12 at FETCH
set b_format_behavior_compat_options = '';
show b_format_behavior_compat_options;
 b_format_behavior_compat_options 
----------------------------------
 
(1 row)

-- test declare condition
create or replace procedure test_condition_1 as
declare
    a int;
BEGIN
    declare DIVISION_ZERO condition for SQLSTATE '22012';
    a := 1/0;
exception
    when DIVISION_ZERO then
    BEGIN
        RAISE NOTICE 'SQLSTATE = %, SQLERRM = %', SQLSTATE,SQLERRM;
    END;
END;
/
call test_condition_1();
NOTICE:  SQLSTATE = 22012, SQLERRM = division by zero
 test_condition_1 
------------------
 
(1 row)

-- test rename condition
create or replace procedure test_condition_2 as
declare
    a int;
BEGIN
    declare DIVISION_ZERO condition for SQLSTATE '22012';
    declare DIVISION_ZERO_two condition for SQLSTATE '22012';
    a := 1/0;
exception
    when DIVISION_ZERO then
    BEGIN
        RAISE NOTICE 'SQLSTATE = %, SQLERRM = %', SQLSTATE,SQLERRM;
    END;
END;
/
call test_condition_2();
NOTICE:  SQLSTATE = 22012, SQLERRM = division by zero
 test_condition_2 
------------------
 
(1 row)

-- test reuse condition name
create or replace procedure test_condition_3 as
declare
    a int;
BEGIN
    declare DIVISION_ZERO condition for SQLSTATE '22012';
    declare DIVISION_ZERO condition for SQLSTATE '22005';
    a := 1/0;
exception
    when DIVISION_ZERO then
    BEGIN
        RAISE NOTICE 'SQLSTATE = %, SQLERRM = %', SQLSTATE,SQLERRM;
    END;
END;
/
ERROR:  duplicate declaration
DETAIL:  condition "division_zero" already defined
CONTEXT:  compilation of PL/pgSQL function "test_condition_3" near line 5
-- declare condition sqlcode
create or replace procedure test_condition_4 as
BEGIN
    declare DIVISION_ZERO condition for 1;
    RAISE NOTICE 'declare condition successed';
END;
/
call test_condition_4();
NOTICE:  declare condition successed
 test_condition_4 
------------------
 
(1 row)

-- declare condition sqlcode 0
create or replace procedure test_condition_5 as
BEGIN
    declare DIVISION_ZERO condition for 0;
    RAISE NOTICE 'declare condition successed';
END;
/
ERROR:  Incorrect CONDITION value: '0'
CONTEXT:  compilation of PL/pgSQL function "test_condition_5" near line 2
-- declare condition sqlstate begin with '00'
create or replace procedure test_condition_6 as
BEGIN
    declare DIVISION_ZERO condition for sqlstate '00000';
    RAISE NOTICE 'declare condition successed';
END;
/
ERROR:  bad SQLSTATE '00000'
CONTEXT:  compilation of PL/pgSQL function "test_condition_6" near line 2
create or replace procedure test_condition_1 as
declare
    a int;
BEGIN
    declare DIVISION_ZERO condition for SQLSTATE value '22012';
    a := 1/0;
exception
    when DIVISION_ZERO then
    BEGIN
        RAISE NOTICE 'SQLSTATE = %, SQLERRM = %', SQLSTATE,SQLERRM;
    END;
END;
/
call test_condition_1();
NOTICE:  SQLSTATE = 22012, SQLERRM = division by zero
 test_condition_1 
------------------
 
(1 row)

create or replace procedure test_condition_1 as
declare
    a int;
BEGIN
    declare DIVISION_ZERO condition for SQLSTATE "22012";
    a := 1/0;
exception
    when DIVISION_ZERO then
    BEGIN
        RAISE NOTICE 'SQLSTATE = %, SQLERRM = %', SQLSTATE,SQLERRM;
    END;
END;
/
call test_condition_1();
NOTICE:  SQLSTATE = 22012, SQLERRM = division by zero
 test_condition_1 
------------------
 
(1 row)

-- test other values compilte with condition name
create or replace procedure test_condition_7 as
declare
    a int;
BEGIN
    declare a condition for SQLSTATE '22012';
    a := 1/0;
exception
    when a then
    BEGIN
        RAISE NOTICE 'SQLSTATE = %, SQLERRM = %', SQLSTATE,SQLERRM;
    END;
END;
/
call test_condition_7();
NOTICE:  SQLSTATE = 22012, SQLERRM = division by zero
 test_condition_7 
------------------
 
(1 row)

\c regression
drop trigger animal_trigger1;
ERROR:  drop trigger without table name only support in B-format database
drop trigger if exists animal_trigger1;
ERROR:  drop trigger without table name only support in B-format database
drop database db_mysql;
drop database db_td;
-- test declare condition in other compatibility
create or replace procedure test_condition_1 as
declare
    a int;
BEGIN
    declare DIVISION_ZERO condition for SQLSTATE '22012';
    a := 1/0;
exception
    when DIVISION_ZERO then
    BEGIN
        RAISE NOTICE 'SQLSTATE = %, SQLERRM = %', SQLSTATE,SQLERRM;
    END;
END;
/
ERROR:  syntax error at or near "SQLSTATE"
LINE 4:     declare DIVISION_ZERO condition for SQLSTATE '22012';
                                  ^
QUERY:  declare
    a int;
BEGIN
    declare DIVISION_ZERO condition for SQLSTATE '22012';
    a := 1/0;
exception
    when DIVISION_ZERO then
    BEGIN
        RAISE NOTICE 'SQLSTATE = %, SQLERRM = %', SQLSTATE,SQLERRM;
    END;
END
CONTEXT:  invalid type name "condition for SQLSTATE '22012'"
