CREATE SCHEMA IF NOT EXISTS test_ddl;
SET current_schema = test_ddl;
drop table if exists online_ddl_test_error;
NOTICE:  table "online_ddl_test_error" does not exist, skipping
create table online_ddl_test_error (id int, value1 varchar, value2 int);
-- case 1: alter column type in transaction block
begin;
alter table concurrently online_ddl_test_error alter column value1 type int; --error
ERROR:  ALTER TABLE CONCURRENTLY cannot run inside a transaction block
rollback;
-- case 2: alter set column not null in transaction block
begin;
alter table concurrently online_ddl_test_error alter column value2 set not null; --error
ERROR:  ALTER TABLE CONCURRENTLY cannot run inside a transaction block
rollback;
-- case 3: alter column type in subtransaction block
begin;
savepoint sp1;
alter table concurrently online_ddl_test_error alter column value1 type int; --error
ERROR:  ALTER TABLE CONCURRENTLY cannot run inside a transaction block
rollback;
-- case 4: alter set column not null in subtransaction block
begin;
savepoint sp1;
alter table concurrently online_ddl_test_error alter column value2 set not null; --error
ERROR:  ALTER TABLE CONCURRENTLY cannot run inside a transaction block
rollback;
-- case 5: alter command with no concurrently gram
alter table concurrently online_ddl_test_error rename column value1 to value_1; --error
ERROR:  syntax error at or near "rename"
LINE 1: alter table concurrently online_ddl_test_error rename column...
                                                       ^
alter table concurrently online_ddl_test_error rename column value_1 to value1; --error
ERROR:  syntax error at or near "rename"
LINE 1: alter table concurrently online_ddl_test_error rename column...
                                                       ^
drop table if exists online_ddl_test_error;
-- case 6: alter column type with invalid value
drop table if exists online_ddl_test_invalid;
NOTICE:  table "online_ddl_test_invalid" does not exist, skipping
-- case 7: alter column set not null with null value
create table online_ddl_test_not_null (id int, value1 varchar, value2 int);
insert into online_ddl_test_not_null select generate_series(1, 10), 'test', 111;
insert into online_ddl_test_not_null values (11, 'test_null', null);
alter table concurrently online_ddl_test_not_null alter column value2 set not null; --error
NOTICE:  Online DDL instance init finish, start to copy baseline data.
NOTICE:  Online DDL rewrite catalogs finish, start to copy baseline data.
ERROR:  column "value2" contains null values
drop table if exists online_ddl_test_not_null;
-- case 8: alter column set range constraint with out of range value
create table online_ddl_test_range (id int, value1 varchar, value2 int);
insert into online_ddl_test_range select generate_series(1, 10), 'test', 9;
insert into online_ddl_test_range values (11, 'test_out_of_range', 11);
alter table concurrently online_ddl_test_range
add constraint ck_online_ddl_test_range check (value2 > 1 and value2 < 10); --error
NOTICE:  Online DDL instance init finish, start to copy baseline data.
NOTICE:  Online DDL rewrite catalogs finish, start to copy baseline data.
ERROR:  check constraint "ck_online_ddl_test_range" is violated by some row
drop table if exists online_ddl_test_range;
drop table if exists online_ddl_test_skip;
NOTICE:  table "online_ddl_test_skip" does not exist, skipping
create table online_ddl_test_skip (id int, value1 varchar, value2 int);
-- case 9: alter command no need to rewrite table
-- add column and drop column
alter table concurrently online_ddl_test_skip alter column id set default 100; --skip
NOTICE:  Current command doestn't need to rewrite table.
alter table concurrently online_ddl_test_skip add column value3 int; --skip
NOTICE:  Current command doestn't need to rewrite table.
alter table concurrently online_ddl_test_skip drop column value3; --skip
NOTICE:  Current command doestn't need to rewrite table.
alter table concurrently online_ddl_test_skip add column value3 int, add column value4 varchar(20); --skip
NOTICE:  Current command doestn't need to rewrite table.
alter table concurrently online_ddl_test_skip drop column value3, drop column value4; --skip
NOTICE:  Current command doestn't need to rewrite table.
-- add column with default and not null
alter table concurrently online_ddl_test_skip add column register_time int not null default 10; --skip
NOTICE:  Current command doestn't need to rewrite table.
alter table concurrently online_ddl_test_skip drop column register_time; --skip
NOTICE:  Current command doestn't need to rewrite table.
-- rename column
alter table concurrently online_ddl_test_skip rename column value1 to value_1; --error
ERROR:  syntax error at or near "rename"
LINE 1: alter table concurrently online_ddl_test_skip rename column ...
                                                      ^
alter table concurrently online_ddl_test_skip rename column value_1 to value1; --error
ERROR:  syntax error at or near "rename"
LINE 1: alter table concurrently online_ddl_test_skip rename column ...
                                                      ^
-- add constraint unique
alter table concurrently online_ddl_test_skip add constraint uq_online_ddl_test_skip unique (value2); --skip
NOTICE:  Online DDL operation is not supported for command types, type: 18, do it without online ddl.
NOTICE:  ALTER TABLE / ADD UNIQUE will create implicit index "uq_online_ddl_test_skip" for table "online_ddl_test_skip"
alter table concurrently online_ddl_test_skip drop constraint uq_online_ddl_test_skip; --skip
NOTICE:  Current command doestn't need to rewrite table.
-- add primary key
alter table concurrently online_ddl_test_skip add constraint pk_online_ddl_test_skip primary key (id); --skip
NOTICE:  Online DDL operation is not supported for command types, type: 18, do it without online ddl.
NOTICE:  ALTER TABLE / ADD PRIMARY KEY will create implicit index "pk_online_ddl_test_skip" for table "online_ddl_test_skip"
alter table concurrently online_ddl_test_skip drop constraint pk_online_ddl_test_skip; --skip
NOTICE:  Current command doestn't need to rewrite table.
-- case 10: alter column add constraint with valid data
create table online_ddl_test_valid (id int, value1 varchar, value2 int);
insert into online_ddl_test_valid select generate_series(1, 10), 'test', 5;
alter table concurrently online_ddl_test_valid  alter column value2 set not null; --success
NOTICE:  Online DDL instance init finish, start to copy baseline data.
NOTICE:  Online DDL rewrite catalogs finish, start to copy baseline data.
NOTICE:  Online DDL baseline data check completed, start to check incremental data.
NOTICE:  Online DDL relation online_ddl_test_valid get AccessExclusiveLock before commit, start to append for the last time.
NOTICE:  drop cascades to 2 other objects
--?DETAIL:  drop cascades to table online_ddl_temp_schema_.*.online_ddl_delta_log
--?drop cascades to table online_ddl_temp_schema_.*.ctid_map
\d+ online_ddl_test_valid
                     Table "test_ddl.online_ddl_test_valid"
 Column |       Type        | Modifiers | Storage  | Stats target | Description 
--------+-------------------+-----------+----------+--------------+-------------
 id     | integer           |           | plain    |              | 
 value1 | character varying |           | extended |              | 
 value2 | integer           | not null  | plain    |              | 
Has OIDs: no
Options: orientation=row, compression=no

select * from online_ddl_test_valid order by id;
 id | value1 | value2 
----+--------+--------
  1 | test   |      5
  2 | test   |      5
  3 | test   |      5
  4 | test   |      5
  5 | test   |      5
  6 | test   |      5
  7 | test   |      5
  8 | test   |      5
  9 | test   |      5
 10 | test   |      5
(10 rows)

drop table if exists online_ddl_test_valid;
create table online_ddl_test_valid (id int, value1 varchar, value2 int);
insert into online_ddl_test_valid select generate_series(1, 10), 'test', 5;
alter table concurrently online_ddl_test_valid
add constraint ck_online_ddl_test_valid check (value2 > 1 and value2 < 10); --success
NOTICE:  Online DDL instance init finish, start to copy baseline data.
NOTICE:  Online DDL rewrite catalogs finish, start to copy baseline data.
NOTICE:  Online DDL baseline data check completed, start to check incremental data.
NOTICE:  Online DDL relation online_ddl_test_valid get AccessExclusiveLock before commit, start to append for the last time.
NOTICE:  drop cascades to 2 other objects
--?DETAIL:  drop cascades to table online_ddl_temp_schema_.*.online_ddl_delta_log
--?drop cascades to table online_ddl_temp_schema_.*.ctid_map
\d+ online_ddl_test_valid
                     Table "test_ddl.online_ddl_test_valid"
 Column |       Type        | Modifiers | Storage  | Stats target | Description 
--------+-------------------+-----------+----------+--------------+-------------
 id     | integer           |           | plain    |              | 
 value1 | character varying |           | extended |              | 
 value2 | integer           |           | plain    |              | 
Check constraints:
    "ck_online_ddl_test_valid" CHECK (value2 > 1 AND value2 < 10)
Has OIDs: no
Options: orientation=row, compression=no

select * from online_ddl_test_valid order by id;
 id | value1 | value2 
----+--------+--------
  1 | test   |      5
  2 | test   |      5
  3 | test   |      5
  4 | test   |      5
  5 | test   |      5
  6 | test   |      5
  7 | test   |      5
  8 | test   |      5
  9 | test   |      5
 10 | test   |      5
(10 rows)

drop table if exists online_ddl_test_valid;
-- case 11: alter table concurrently set row compression
-- no need to rewrite table
create table online_ddl_test_compress (id int, value1 varchar, value2 int);
insert into online_ddl_test_compress select generate_series(1, 10), 'test', 5;
alter table concurrently online_ddl_test_compress set (compress_level=0); --skip
NOTICE:  Current command doestn't need to rewrite table.
\d+ online_ddl_test_compress
                   Table "test_ddl.online_ddl_test_compress"
 Column |       Type        | Modifiers | Storage  | Stats target | Description 
--------+-------------------+-----------+----------+--------------+-------------
 id     | integer           |           | plain    |              | 
 value1 | character varying |           | extended |              | 
 value2 | integer           |           | plain    |              | 
Has OIDs: no
Options: orientation=row, compression=no, compress_level=0

drop table if exists online_ddl_test_compress;
create table online_ddl_test_compress (id int, value1 varchar, value2 int) with (compresstype = 2, compress_level = 15);
insert into online_ddl_test_compress select generate_series(1, 10), 'test', 5;
alter table concurrently online_ddl_test_compress set (compresstype=2, compress_level = 15); --skip
NOTICE:  Current command doestn't need to rewrite table.
\d+ online_ddl_test_compresss
drop table if exists online_ddl_test_compress;
-- no compress to compress
create table online_ddl_test_compress (id int, value1 varchar, value2 int);
insert into online_ddl_test_compress select generate_series(1, 10), 'test', 5;
alter table concurrently online_ddl_test_compress set (compresstype=2, compress_level = 15); --success
NOTICE:  Online DDL instance init finish, start to copy baseline data.
NOTICE:  Online DDL rewrite catalogs finish, start to copy baseline data.
NOTICE:  Online DDL baseline data copy completed, start to append incremental data.
NOTICE:  Online DDL get AccessExclusiveLock for relation online_ddl_test_compress before commit, append data for the last time.
NOTICE:  drop cascades to 2 other objects
--?DETAIL:  drop cascades to table online_ddl_temp_schema_.*.online_ddl_delta_log
--?drop cascades to table online_ddl_temp_schema_.*.ctid_map
\d+ online_ddl_test_compress
                   Table "test_ddl.online_ddl_test_compress"
 Column |       Type        | Modifiers | Storage  | Stats target | Description 
--------+-------------------+-----------+----------+--------------+-------------
 id     | integer           |           | plain    |              | 
 value1 | character varying |           | extended |              | 
 value2 | integer           |           | plain    |              | 
Has OIDs: no
Options: orientation=row, compression=no, compresstype=2, compress_level=15

drop table if exists online_ddl_test_compress;
-- indexed table no compress to compress
create table online_ddl_test_compress (id int, value1 varchar, value2 int);
create index idx_online_ddl_test_compress_value1 on online_ddl_test_compress using btree (value1);
create index idx_online_ddl_test_compress_value2 on online_ddl_test_compress using hash (value2);
insert into online_ddl_test_compress select generate_series(1, 10), 'test', 5;
alter table concurrently online_ddl_test_compress set (compresstype=2, compress_level = 15); --success
NOTICE:  Online DDL instance init finish, start to copy baseline data.
NOTICE:  Online DDL rewrite catalogs finish, start to copy baseline data.
NOTICE:  Online DDL baseline data copy completed, start to append incremental data.
NOTICE:  Online DDL get AccessExclusiveLock for relation online_ddl_test_compress before commit, append data for the last time.
NOTICE:  drop cascades to 2 other objects
--?DETAIL:  drop cascades to table online_ddl_temp_schema_.*.online_ddl_delta_log
--?drop cascades to table online_ddl_temp_schema_.*.ctid_map
\d+ online_ddl_test_compress
                   Table "test_ddl.online_ddl_test_compress"
 Column |       Type        | Modifiers | Storage  | Stats target | Description 
--------+-------------------+-----------+----------+--------------+-------------
 id     | integer           |           | plain    |              | 
 value1 | character varying |           | extended |              | 
 value2 | integer           |           | plain    |              | 
Indexes:
    "idx_online_ddl_test_compress_value1" btree (value1) TABLESPACE pg_default
    "idx_online_ddl_test_compress_value2" hash (value2) TABLESPACE pg_default
Has OIDs: no
Options: orientation=row, compression=no, compresstype=2, compress_level=15

drop table if exists online_ddl_test_compress;
-- compress to no compress
create table online_ddl_test_compress (id int, value1 varchar, value2 int) with (compresstype = 2, compress_level = 15);
insert into online_ddl_test_compress select generate_series(1, 10), 'test', 5;
alter table concurrently online_ddl_test_compress reset (compresstype, compress_level); --success
NOTICE:  Online DDL instance init finish, start to copy baseline data.
NOTICE:  Online DDL rewrite catalogs finish, start to copy baseline data.
NOTICE:  Online DDL baseline data copy completed, start to append incremental data.
NOTICE:  Online DDL get AccessExclusiveLock for relation online_ddl_test_compress before commit, append data for the last time.
NOTICE:  drop cascades to 2 other objects
--?DETAIL:  drop cascades to table online_ddl_temp_schema_.*.online_ddl_delta_log
--?drop cascades to table online_ddl_temp_schema_.*.ctid_map
\d+ online_ddl_test_compress
                   Table "test_ddl.online_ddl_test_compress"
 Column |       Type        | Modifiers | Storage  | Stats target | Description 
--------+-------------------+-----------+----------+--------------+-------------
 id     | integer           |           | plain    |              | 
 value1 | character varying |           | extended |              | 
 value2 | integer           |           | plain    |              | 
Has OIDs: no
Options: orientation=row

drop table if exists online_ddl_test_compress;
--index table compress to no compress
create table online_ddl_test_compress (id int, value1 varchar, value2 int) with (compresstype = 2, compress_level = 15);
create index idx_online_ddl_test_compress_value1 on online_ddl_test_compress using btree (value1);
create index idx_online_ddl_test_compress_value2 on online_ddl_test_compress using hash (value2);
insert into online_ddl_test_compress select generate_series(1, 10), 'test', 5;
alter table concurrently online_ddl_test_compress reset (compresstype, compress_level); --success
NOTICE:  Online DDL instance init finish, start to copy baseline data.
NOTICE:  Online DDL rewrite catalogs finish, start to copy baseline data.
NOTICE:  Online DDL baseline data copy completed, start to append incremental data.
NOTICE:  Online DDL get AccessExclusiveLock for relation online_ddl_test_compress before commit, append data for the last time.
NOTICE:  drop cascades to 2 other objects
--?DETAIL:  drop cascades to table online_ddl_temp_schema_.*.online_ddl_delta_log
--?drop cascades to table online_ddl_temp_schema_.*.ctid_map
\d+ online_ddl_test_compress    
                   Table "test_ddl.online_ddl_test_compress"
 Column |       Type        | Modifiers | Storage  | Stats target | Description 
--------+-------------------+-----------+----------+--------------+-------------
 id     | integer           |           | plain    |              | 
 value1 | character varying |           | extended |              | 
 value2 | integer           |           | plain    |              | 
Indexes:
    "idx_online_ddl_test_compress_value1" btree (value1) TABLESPACE pg_default
    "idx_online_ddl_test_compress_value2" hash (value2) TABLESPACE pg_default
Has OIDs: no
Options: orientation=row

drop table if exists online_ddl_test_compress;
-- alter compress level
create table online_ddl_test_compress (id int, value1 varchar, value2 int) with (compresstype = 2, compress_level = 10);
insert into online_ddl_test_compress select generate_series(1, 10), 'test', 5;
alter table concurrently online_ddl_test_compress set (compress_level = 5); --success
NOTICE:  Online DDL instance init finish, start to copy baseline data.
NOTICE:  Online DDL rewrite catalogs finish, start to copy baseline data.
NOTICE:  Online DDL baseline data copy completed, start to append incremental data.
NOTICE:  Online DDL get AccessExclusiveLock for relation online_ddl_test_compress before commit, append data for the last time.
NOTICE:  drop cascades to 2 other objects
--?DETAIL:  drop cascades to table online_ddl_temp_schema_.*.online_ddl_delta_log
--?drop cascades to table online_ddl_temp_schema_.*.ctid_map
\d+ online_ddl_test_compress
                   Table "test_ddl.online_ddl_test_compress"
 Column |       Type        | Modifiers | Storage  | Stats target | Description 
--------+-------------------+-----------+----------+--------------+-------------
 id     | integer           |           | plain    |              | 
 value1 | character varying |           | extended |              | 
 value2 | integer           |           | plain    |              | 
Has OIDs: no
Options: orientation=row, compresstype=2, compress_level=5

drop table if exists online_ddl_test_compress;
--indexed table alter compress level
create table online_ddl_test_compress (id int, value1 varchar, value2 int) with (compresstype = 2, compress_level = 10);
create index idx_online_ddl_test_compress_value1 on online_ddl_test_compress using btree (value1);
create index idx_online_ddl_test_compress_value2 on online_ddl_test_compress using hash (value2);
insert into online_ddl_test_compress select generate_series(1, 10), 'test', 5;
alter table concurrently online_ddl_test_compress set (compress_level = 5); --success
NOTICE:  Online DDL instance init finish, start to copy baseline data.
NOTICE:  Online DDL rewrite catalogs finish, start to copy baseline data.
NOTICE:  Online DDL baseline data copy completed, start to append incremental data.
NOTICE:  Online DDL get AccessExclusiveLock for relation online_ddl_test_compress before commit, append data for the last time.
NOTICE:  drop cascades to 2 other objects
--?DETAIL:  drop cascades to table online_ddl_temp_schema_.*.online_ddl_delta_log
--?drop cascades to table online_ddl_temp_schema_.*.ctid_map
\d+ online_ddl_test_compress
                   Table "test_ddl.online_ddl_test_compress"
 Column |       Type        | Modifiers | Storage  | Stats target | Description 
--------+-------------------+-----------+----------+--------------+-------------
 id     | integer           |           | plain    |              | 
 value1 | character varying |           | extended |              | 
 value2 | integer           |           | plain    |              | 
Indexes:
    "idx_online_ddl_test_compress_value1" btree (value1) TABLESPACE pg_default
    "idx_online_ddl_test_compress_value2" hash (value2) TABLESPACE pg_default
Has OIDs: no
Options: orientation=row, compresstype=2, compress_level=5

drop table if exists online_ddl_test_compress;
-- case 12: alter table concurrently alter column type with valid data
-- int to varchar and varchar to int
create table online_ddl_test_alter_type (id int, value1 varchar, value2 int);
insert into online_ddl_test_alter_type select generate_series(1, 10), 'test', 5;
alter table concurrently online_ddl_test_alter_type alter column value2 type varchar; --success
NOTICE:  Online DDL instance init finish, start to copy baseline data.
NOTICE:  Online DDL rewrite catalogs finish, start to copy baseline data.
NOTICE:  Online DDL baseline data copy completed, start to append incremental data.
NOTICE:  Online DDL get AccessExclusiveLock for relation online_ddl_test_alter_type before commit, append data for the last time.
NOTICE:  drop cascades to 2 other objects
--?DETAIL:  drop cascades to table online_ddl_temp_schema_.*.online_ddl_delta_log
--?drop cascades to table online_ddl_temp_schema_.*.ctid_map
\d+ online_ddl_test_alter_type
                  Table "test_ddl.online_ddl_test_alter_type"
 Column |       Type        | Modifiers | Storage  | Stats target | Description 
--------+-------------------+-----------+----------+--------------+-------------
 id     | integer           |           | plain    |              | 
 value1 | character varying |           | extended |              | 
 value2 | character varying |           | extended |              | 
Has OIDs: no
Options: orientation=row, compression=no

select * from online_ddl_test_alter_type order by id;
 id | value1 | value2 
----+--------+--------
  1 | test   | 5
  2 | test   | 5
  3 | test   | 5
  4 | test   | 5
  5 | test   | 5
  6 | test   | 5
  7 | test   | 5
  8 | test   | 5
  9 | test   | 5
 10 | test   | 5
(10 rows)

drop table if exists online_ddl_test_alter_type;
create table online_ddl_test_alter_type (id int, value1 varchar, value2 varchar);
insert into online_ddl_test_alter_type select generate_series(1, 10), 'test', '1000';
alter table concurrently online_ddl_test_alter_type alter column value2 type int; --success
NOTICE:  Online DDL instance init finish, start to copy baseline data.
NOTICE:  Online DDL rewrite catalogs finish, start to copy baseline data.
NOTICE:  Online DDL baseline data copy completed, start to append incremental data.
NOTICE:  Online DDL get AccessExclusiveLock for relation online_ddl_test_alter_type before commit, append data for the last time.
NOTICE:  drop cascades to 2 other objects
--?DETAIL:  drop cascades to table online_ddl_temp_schema_.*.online_ddl_delta_log
--?drop cascades to table online_ddl_temp_schema_.*.ctid_map
\d+ online_ddl_test_alter_type
                  Table "test_ddl.online_ddl_test_alter_type"
 Column |       Type        | Modifiers | Storage  | Stats target | Description 
--------+-------------------+-----------+----------+--------------+-------------
 id     | integer           |           | plain    |              | 
 value1 | character varying |           | extended |              | 
 value2 | integer           |           | plain    |              | 
Has OIDs: no
Options: orientation=row, compression=no

select * from online_ddl_test_alter_type order by id;
 id | value1 | value2 
----+--------+--------
  1 | test   |   1000
  2 | test   |   1000
  3 | test   |   1000
  4 | test   |   1000
  5 | test   |   1000
  6 | test   |   1000
  7 | test   |   1000
  8 | test   |   1000
  9 | test   |   1000
 10 | test   |   1000
(10 rows)

drop table if exists online_ddl_test_alter_type;
-- indexed table varchar to int
create table online_ddl_test_alter_type (id int, value1 varchar, value2 varchar(10));
create index idx_online_ddl_test_alter_type_value2 on online_ddl_test_alter_type using btree (value1);
create index idx_online_ddl_test_alter_type_value2_hash on online_ddl_test_alter_type using hash (value1);
insert into online_ddl_test_alter_type select generate_series(1, 10), 'test', '1000';
alter table concurrently online_ddl_test_alter_type alter column value2 type int; --success
NOTICE:  Online DDL instance init finish, start to copy baseline data.
NOTICE:  Online DDL rewrite catalogs finish, start to copy baseline data.
NOTICE:  Online DDL baseline data copy completed, start to append incremental data.
NOTICE:  Online DDL get AccessExclusiveLock for relation online_ddl_test_alter_type before commit, append data for the last time.
NOTICE:  drop cascades to 2 other objects
--?DETAIL:  drop cascades to table online_ddl_temp_schema_.*.online_ddl_delta_log
--?drop cascades to table online_ddl_temp_schema_.*.ctid_map
\d+ online_ddl_test_alter_type
                  Table "test_ddl.online_ddl_test_alter_type"
 Column |       Type        | Modifiers | Storage  | Stats target | Description 
--------+-------------------+-----------+----------+--------------+-------------
 id     | integer           |           | plain    |              | 
 value1 | character varying |           | extended |              | 
 value2 | integer           |           | plain    |              | 
Indexes:
    "idx_online_ddl_test_alter_type_value2" btree (value1) TABLESPACE pg_default
    "idx_online_ddl_test_alter_type_value2_hash" hash (value1) TABLESPACE pg_default
Has OIDs: no
Options: orientation=row, compression=no

drop table if exists online_ddl_test_alter_type;
-- int to bigint and bigint to int
create table online_ddl_test_alter_type (id int, value1 varchar, value2 int);
insert into online_ddl_test_alter_type select generate_series(1, 10), 'test', 5;
alter table concurrently online_ddl_test_alter_type alter column value2 type bigint; --success
NOTICE:  Online DDL instance init finish, start to copy baseline data.
NOTICE:  Online DDL rewrite catalogs finish, start to copy baseline data.
NOTICE:  Online DDL baseline data copy completed, start to append incremental data.
NOTICE:  Online DDL get AccessExclusiveLock for relation online_ddl_test_alter_type before commit, append data for the last time.
NOTICE:  drop cascades to 2 other objects
--?DETAIL:  drop cascades to table online_ddl_temp_schema_.*.online_ddl_delta_log
--?drop cascades to table online_ddl_temp_schema_.*.ctid_map
\d+ online_ddl_test_alter_type
                  Table "test_ddl.online_ddl_test_alter_type"
 Column |       Type        | Modifiers | Storage  | Stats target | Description 
--------+-------------------+-----------+----------+--------------+-------------
 id     | integer           |           | plain    |              | 
 value1 | character varying |           | extended |              | 
 value2 | bigint            |           | plain    |              | 
Has OIDs: no
Options: orientation=row, compression=no

drop table if exists online_ddl_test_alter_type;
create table online_ddl_test_alter_type (id int, value1 varchar, value2 bigint);
insert into online_ddl_test_alter_type select generate_series(1, 10), 'test', 1000;
alter table concurrently online_ddl_test_alter_type alter column value2 type int; --success
NOTICE:  Online DDL instance init finish, start to copy baseline data.
NOTICE:  Online DDL rewrite catalogs finish, start to copy baseline data.
NOTICE:  Online DDL baseline data copy completed, start to append incremental data.
NOTICE:  Online DDL get AccessExclusiveLock for relation online_ddl_test_alter_type before commit, append data for the last time.
NOTICE:  drop cascades to 2 other objects
--?DETAIL:  drop cascades to table online_ddl_temp_schema_.*.online_ddl_delta_log
--?drop cascades to table online_ddl_temp_schema_.*.ctid_map
\d+ online_ddl_test_alter_type
                  Table "test_ddl.online_ddl_test_alter_type"
 Column |       Type        | Modifiers | Storage  | Stats target | Description 
--------+-------------------+-----------+----------+--------------+-------------
 id     | integer           |           | plain    |              | 
 value1 | character varying |           | extended |              | 
 value2 | integer           |           | plain    |              | 
Has OIDs: no
Options: orientation=row, compression=no

drop table if exists online_ddl_test_alter_type;
-- indexed table bigint to int
create table online_ddl_test_alter_type (id int, value1 varchar, value2 bigint);
create index idx_online_ddl_test_alter_type_value2 on online_ddl_test_alter_type using btree (value1);
create index idx_online_ddl_test_alter_type_value2_hash on online_ddl_test_alter_type using hash (value1);
insert into online_ddl_test_alter_type select generate_series(1, 10), 'test', 1000;
alter table concurrently online_ddl_test_alter_type alter column value2 type int; --success
NOTICE:  Online DDL instance init finish, start to copy baseline data.
NOTICE:  Online DDL rewrite catalogs finish, start to copy baseline data.
NOTICE:  Online DDL baseline data copy completed, start to append incremental data.
NOTICE:  Online DDL get AccessExclusiveLock for relation online_ddl_test_alter_type before commit, append data for the last time.
NOTICE:  drop cascades to 2 other objects
--?DETAIL:  drop cascades to table online_ddl_temp_schema_.*.online_ddl_delta_log
--?drop cascades to table online_ddl_temp_schema_.*.ctid_map
\d+ online_ddl_test_alter_type
                  Table "test_ddl.online_ddl_test_alter_type"
 Column |       Type        | Modifiers | Storage  | Stats target | Description 
--------+-------------------+-----------+----------+--------------+-------------
 id     | integer           |           | plain    |              | 
 value1 | character varying |           | extended |              | 
 value2 | integer           |           | plain    |              | 
Indexes:
    "idx_online_ddl_test_alter_type_value2" btree (value1) TABLESPACE pg_default
    "idx_online_ddl_test_alter_type_value2_hash" hash (value1) TABLESPACE pg_default
Has OIDs: no
Options: orientation=row, compression=no

drop table if exists online_ddl_test_alter_type;
-- indexed table huge number of rows
create table online_ddl_test_alter_type (id int, value1 varchar, value2 varchar(10));
create index idx_online_ddl_test_alter_type_value2 on online_ddl_test_alter_type using btree (value1);
create index idx_online_ddl_test_alter_type_value2_hash on online_ddl_test_alter_type using hash (value1);
insert into online_ddl_test_alter_type select generate_series(1, 3000), 'testtesttesttestesttesttesttest', '1000';
alter table concurrently online_ddl_test_alter_type alter column value2 type int; --success
NOTICE:  Online DDL instance init finish, start to copy baseline data.
NOTICE:  Online DDL rewrite catalogs finish, start to copy baseline data.
NOTICE:  Online DDL baseline data copy completed, start to append incremental data.
NOTICE:  Online DDL get AccessExclusiveLock for relation online_ddl_test_alter_type before commit, append data for the last time.
NOTICE:  drop cascades to 2 other objects
--?DETAIL:  drop cascades to table online_ddl_temp_schema_.*.online_ddl_delta_log
--?drop cascades to table online_ddl_temp_schema_.*.ctid_map
\d+ online_ddl_test_alter_type
                  Table "test_ddl.online_ddl_test_alter_type"
 Column |       Type        | Modifiers | Storage  | Stats target | Description 
--------+-------------------+-----------+----------+--------------+-------------
 id     | integer           |           | plain    |              | 
 value1 | character varying |           | extended |              | 
 value2 | integer           |           | plain    |              | 
Indexes:
    "idx_online_ddl_test_alter_type_value2" btree (value1) TABLESPACE pg_default
    "idx_online_ddl_test_alter_type_value2_hash" hash (value1) TABLESPACE pg_default
Has OIDs: no
Options: orientation=row, compression=no

select count(*) from online_ddl_test_alter_type;
 count 
-------
  3000
(1 row)

drop table if exists online_ddl_test_alter_type;
-- indexed table with toast data
create table online_ddl_test_alter_type_toast (id int, value1 varchar, value2 int, value3 varchar);
create index idx_online_ddl_test_alter_type_toast_value2 on online_ddl_test_alter_type_toast using btree (value2);
create index idx_online_ddl_test_alter_type_toast_value2_hash on online_ddl_test_alter_type_toast using hash (value2);
alter table online_ddl_test_alter_type_toast alter value3 set storage external;
insert into online_ddl_test_alter_type_toast select generate_series(1, 10), '112', 1234, 'aaaaaasfsfsfsfsdfsfsfsfsfsdfsd
sfsfffffffffffffffffffffffffffffffffffffffffffffffffffffffffffffffffffffffffffffffffffffffffffffffffffffffffffffffffffff
fffffffffffffffffffffffffffffffffffffffffffffffffffffffffffffffssssssssssssssssssssssssssssfffffffffffffffffffffffffffff
fffffffffffffffffffffffffffffffffffffffffffffffffffffffffffffffffffffffssssssssssssssssssssssssssssfffffffffffffffffffff
fffffffffffffffffffffffffffffffffffffffffffffffffffffffffffffffffffffffffffffffssssssssssssssssssssssssssssfffffffffffff
fffffffffffffffffffffffffffffffffffffffffffffffffffffffffffffffffffffffffffffffffffffffssssssssssssssssssssssssssssfffff
fffffffffffffffffffffffffffffffffffffffffffffffffffffffffffffffffffffffffffffffffffffffffffffffsssssssssssssssssssssssss
sssffffffffffffffffffffffffffffffffffffffffffffffffffffffffffffffffffffffffffffffffffffffffffffffffffffsssssssssssssssss
sssssssssssffffffffffffffffffffffffffffffffffffffffffffffffffffffffffffffffffffffffffffffffffffffffffffffffffffsssssssss
ssssssssssssssssssssssssssssssssssssssssssssssssssssssssssssssssssssssssssssssssssssssssssssssssssssssssssssssssssssssss
ssssssssssssssssssssssssssssssssssssssssssssssssssssssssssssssssssssssssssssssssssssssssssssssssssssssssssssssssssssssss
ssssssssssssssssssssssssssssssssssssssssssssssssssssssssssssssssssssssssssssssssssssssssssssssssssssssssssssssssssssssss
ssssssssssssssssssssssssssssssssssssssssssssssssssssssssssssssssssssssssssssssssssssssssssssssssssssssssssssssssssssssss
ssssssssssssssssssssssssssssssssssssssssssssssssssssssssssssssssssssssssssssssssssssssssssssssssssssssssssssssssssssssss
ssssssssssssssssssssssssssssssssssssssssssssssssssssssssssssssssssssssssssssssssssssssssssssssssssssssssssssssssssssssss
ssssssssssssssssssssssssssssssssssssssssssssssssssssssssssssssssssssssssssssssssssssssssssssssssssssssssssssssssssssssss
ssssssssssssssssssssssssssssssssssssssssssssssssssssssssssssssssssssssssssssssssssssssssssssssssssssssssssssssssssssssss
ssssssssssssssssssssssssssssssssssssssssssssssssssssssssssssssssssssssssssssssssssssssssssssssssssssssssssssssssssssssss
ssssssssssssssssssssssssssssssssssssssssffffffffffffffffffffsfsfsfsssssssssssss';
select count(*) from pg_class where oid = (select reltoastrelid from pg_class where
relname = 'online_ddl_test_alter_type_toast');
 count 
-------
     1
(1 row)

alter table concurrently online_ddl_test_alter_type_toast alter column value1 type int; --success
NOTICE:  Online DDL instance init finish, start to copy baseline data.
NOTICE:  Online DDL rewrite catalogs finish, start to copy baseline data.
NOTICE:  Online DDL baseline data copy completed, start to append incremental data.
NOTICE:  Online DDL get AccessExclusiveLock for relation online_ddl_test_alter_type_toast before commit, append data for the last time.
NOTICE:  drop cascades to 2 other objects
--?DETAIL:  drop cascades to table online_ddl_temp_schema_.*.online_ddl_delta_log
--?drop cascades to table online_ddl_temp_schema_.*.ctid_map
\d+ online_ddl_test_alter_type_toast
               Table "test_ddl.online_ddl_test_alter_type_toast"
 Column |       Type        | Modifiers | Storage  | Stats target | Description 
--------+-------------------+-----------+----------+--------------+-------------
 id     | integer           |           | plain    |              | 
 value1 | integer           |           | plain    |              | 
 value2 | integer           |           | plain    |              | 
 value3 | character varying |           | external |              | 
Indexes:
    "idx_online_ddl_test_alter_type_toast_value2" btree (value2) TABLESPACE pg_default
    "idx_online_ddl_test_alter_type_toast_value2_hash" hash (value2) TABLESPACE pg_default
Has OIDs: no
Options: orientation=row, compression=no

drop table if exists online_ddl_test_alter_type_toast;
-- case 13: alter table concurrently alter column type with invalid data
create table online_ddl_test_alter_type (id int, value1 varchar, value2 varchar);
insert into online_ddl_test_alter_type select generate_series(1, 10), 'test', 'not number';
alter table concurrently online_ddl_test_alter_type alter column value2 type int; --error
NOTICE:  Online DDL instance init finish, start to copy baseline data.
NOTICE:  Online DDL rewrite catalogs finish, start to copy baseline data.
ERROR:  invalid input syntax for integer: "not number"
\d+ online_ddl_test_alter_type
                  Table "test_ddl.online_ddl_test_alter_type"
 Column |       Type        | Modifiers | Storage  | Stats target | Description 
--------+-------------------+-----------+----------+--------------+-------------
 id     | integer           |           | plain    |              | 
 value1 | character varying |           | extended |              | 
 value2 | character varying |           | extended |              | 
Has OIDs: no
Options: orientation=row, compression=no, append_mode=online_ddl, append_mode_internal=6

drop table if exists online_ddl_test_alter_type;
-- case 14: vacuum full concurrently for ordinary table
set client_min_messages = warning;
create table online_ddl_vacuum_t (id int, grp int, note text);
create index online_ddl_vacuum_t_idx on online_ddl_vacuum_t (id);
insert into online_ddl_vacuum_t select generate_series(1, 20), 1, 'before vacuum';
update online_ddl_vacuum_t set note = 'updated before vacuum' where id <= 5;
delete from online_ddl_vacuum_t where id between 6 and 10;
vacuum full concurrently online_ddl_vacuum_t;
select count(*) as row_count, min(id) as min_id, max(id) as max_id from online_ddl_vacuum_t;
 row_count | min_id | max_id 
-----------+--------+--------
        15 |      1 |     20
(1 row)

select count(*) as index_count from pg_indexes where schemaname = 'test_ddl' and tablename = 'online_ddl_vacuum_t';
 index_count 
-------------
           1
(1 row)

select count(*) from online_ddl_status();
 count 
-------
     3
(1 row)

drop table if exists online_ddl_vacuum_t;
-- case 15: cluster concurrently for ordinary table
create table online_ddl_cluster_t (id int, note text);
create index online_ddl_cluster_t_idx on online_ddl_cluster_t (id);
insert into online_ddl_cluster_t select generate_series(20, 1, -1), 'before cluster';
cluster concurrently online_ddl_cluster_t using online_ddl_cluster_t_idx;
select count(*) as row_count, min(id) as min_id, max(id) as max_id, sum(id) as sum_id from online_ddl_cluster_t;
 row_count | min_id | max_id | sum_id 
-----------+--------+--------+--------
        20 |      1 |     20 |    210
(1 row)

select indisclustered from pg_index where indexrelid = 'online_ddl_cluster_t_idx'::regclass;
 indisclustered 
----------------
 t
(1 row)

drop table if exists online_ddl_cluster_t;
-- case 16: vacuum full concurrently for partitioned table
create table online_ddl_vacuum_part (
    id int not null,
    grp int,
    note text
) partition by range (id)
(
    partition p1 values less than (10),
    partition p2 values less than (20),
    partition p3 values less than (maxvalue)
);
create index online_ddl_vacuum_part_idx on online_ddl_vacuum_part (id) local;
insert into online_ddl_vacuum_part select generate_series(1, 25), 1, 'before partition vacuum';
delete from online_ddl_vacuum_part where id in (2, 12, 22);
vacuum full concurrently online_ddl_vacuum_part;
select count(*) as row_count, min(id) as min_id, max(id) as max_id from online_ddl_vacuum_part;
 row_count | min_id | max_id 
-----------+--------+--------
        22 |      1 |     25
(1 row)

drop table if exists online_ddl_vacuum_part;
-- case 17: cluster concurrently for partitioned table
create table online_ddl_cluster_part (
    id int not null,
    grp int,
    note text
) partition by range (id)
(
    partition p1 values less than (10),
    partition p2 values less than (20),
    partition p3 values less than (maxvalue)
);
create index online_ddl_cluster_part_idx on online_ddl_cluster_part (id) local;
insert into online_ddl_cluster_part select generate_series(18, 1, -1), 1, 'before partition cluster';
cluster concurrently online_ddl_cluster_part using online_ddl_cluster_part_idx;
select count(*) as row_count, min(id) as min_id, max(id) as max_id, sum(id) as sum_id from online_ddl_cluster_part;
 row_count | min_id | max_id | sum_id 
-----------+--------+--------+--------
        18 |      1 |     18 |    171
(1 row)

drop table if exists online_ddl_cluster_part;
set client_min_messages = notice;
DROP SCHEMA IF EXISTS test_ddl CASCADE;
NOTICE:  drop cascades to table online_ddl_test_skip
