create database test_pg_identity dbcompatibility 'A';
\c test_pg_identity
--## create table
-- error
CREATE TABLE test_t1 (a serial GENERATED ALWAYS AS IDENTITY, b text);
NOTICE:  CREATE TABLE will create implicit sequence "test_t1_a_seq" for serial column "test_t1.a"
ERROR:  conflicting serial/identity declarations for column "a" of table "test_t1"
LINE 1: CREATE TABLE test_t1 (a serial GENERATED ALWAYS AS IDENTITY,...
                                       ^
-- error
CREATE TABLE test_t1 (a int GENERATED ALWAYS AS IDENTITY default 3, b text);
NOTICE:  CREATE TABLE will create implicit sequence "test_t1_a_seq" for serial column "test_t1.a"
ERROR:  multiple default values specified for column "a" of table "test_t1"
LINE 1: ...TABLE test_t1 (a int GENERATED ALWAYS AS IDENTITY default 3,...
                                                             ^
-- error
CREATE TABLE test_t1 (id int1 GENERATED ALWAYS AS IDENTITY (START WITH 44) NULL); 
NOTICE:  CREATE TABLE will create implicit sequence "test_t1_id_seq" for serial column "test_t1.id"
ERROR:  conflicting NULL/NOT NULL declarations for column "id" of table "test_t1"
LINE 1: ...(id int1 GENERATED ALWAYS AS IDENTITY (START WITH 44) NULL);
                                                                 ^
CREATE TABLE test_t1 (id int1 NULL GENERATED ALWAYS AS IDENTITY (START WITH 44)); 
ERROR:  conflicting NULL/NOT NULL declarations for column "id" of table "test_t1"
LINE 1: CREATE TABLE test_t1 (id int1 NULL GENERATED ALWAYS AS IDENT...
                                           ^
-- error
CREATE TABLE par_row_t1 (a int GENERATED ALWAYS AS IDENTITY, b text) partition by range (a)
(
    partition par_row_t1_p0 values less than(10),
    partition par_row_t1_p3 values less than (maxvalue)
);
NOTICE:  CREATE TABLE will create implicit sequence "par_row_t1_a_seq" for serial column "par_row_t1.a"
ERROR:  identity column currently not supported partitioned table "par_row_t1"
-- success
CREATE TABLE test_t1 (a int GENERATED ALWAYS AS IDENTITY, b text);
NOTICE:  CREATE TABLE will create implicit sequence "test_t1_a_seq" for serial column "test_t1.a"
CREATE TABLE test_t2 (a int GENERATED BY DEFAULT AS IDENTITY, b text);
NOTICE:  CREATE TABLE will create implicit sequence "test_t2_a_seq" for serial column "test_t2.a"
CREATE TABLE test_t3 (id int1 NOT NULL GENERATED ALWAYS AS IDENTITY (START WITH 44));
NOTICE:  CREATE TABLE will create implicit sequence "test_t3_id_seq" for serial column "test_t3.id"
CREATE temp TABLE test_t4 (a int GENERATED ALWAYS AS IDENTITY, b text);
NOTICE:  CREATE TABLE will create implicit sequence "test_t4_a_seq" for serial column "test_t4.a"
\d+ test_t1
                                      Table "public.test_t1"
 Column |  Type   |               Modifiers               | Storage  | Stats target | Description 
--------+---------+---------------------------------------+----------+--------------+-------------
 a      | integer | not null generated always as identity | plain    |              | 
 b      | text    |                                       | extended |              | 
Has OIDs: no
Options: orientation=row, compression=no

\d+ test_t2
                                        Table "public.test_t2"
 Column |  Type   |                 Modifiers                 | Storage  | Stats target | Description 
--------+---------+-------------------------------------------+----------+--------------+-------------
 a      | integer | not null generated by default as identity | plain    |              | 
 b      | text    |                                           | extended |              | 
Has OIDs: no
Options: orientation=row, compression=no

select pg_get_tabledef('test_t3'::regclass);
                   pg_get_tabledef                    
------------------------------------------------------
 SET search_path = public;                           +
 CREATE TABLE test_t3 (                              +
     id tinyint GENERATED ALWAYS AS IDENTITY NOT NULL+
 )                                                   +
 WITH (orientation=row, compression=no);
(1 row)

-- identity sequence options
CREATE TABLE test_t5 (a int2 GENERATED ALWAYS AS IDENTITY (START WITH 10 MAXVALUE 30 MINVALUE 12), b text); -- error
NOTICE:  CREATE TABLE will create implicit sequence "test_t5_a_seq" for serial column "test_t5.a"
ERROR:  START value (10) cannot be less than MINVALUE (12)
CREATE TABLE test_t5 (a int2 GENERATED ALWAYS AS IDENTITY (START WITH 10 MAXVALUE 30 MINVALUE 9), b text); -- success
NOTICE:  CREATE TABLE will create implicit sequence "test_t5_a_seq" for serial column "test_t5.a"
\d+ test_t5;
                                      Table "public.test_t5"
 Column |   Type   |               Modifiers               | Storage  | Stats target | Description 
--------+----------+---------------------------------------+----------+--------------+-------------
 a      | smallint | not null generated always as identity | plain    |              | 
 b      | text     |                                       | extended |              | 
Has OIDs: no
Options: orientation=row, compression=no

select start_value, max_value, min_value, increment_by from test_t5_a_seq;
 start_value | max_value | min_value | increment_by 
-------------+-----------+-----------+--------------
          10 |        30 |         9 |            1
(1 row)

INSERT INTO test_t5 DEFAULT VALUES; -- success
INSERT INTO test_t5 OVERRIDING SYSTEM VALUE VALUES(8, 'xxxx'); -- success
SELECT * FROM test_t5 order by 1, 2;
 a  |  b   
----+------
  8 | xxxx
 10 | 
(2 rows)

CREATE TABLE test_t6 (a int2 GENERATED ALWAYS AS IDENTITY (START WITH 11 NOMAXVALUE MINVALUE 9), b text); -- success
NOTICE:  CREATE TABLE will create implicit sequence "test_t6_a_seq" for serial column "test_t6.a"
\d+ test_t6;
                                      Table "public.test_t6"
 Column |   Type   |               Modifiers               | Storage  | Stats target | Description 
--------+----------+---------------------------------------+----------+--------------+-------------
 a      | smallint | not null generated always as identity | plain    |              | 
 b      | text     |                                       | extended |              | 
Has OIDs: no
Options: orientation=row, compression=no

select start_value, max_value, min_value, increment_by from test_t6_a_seq;
 start_value |      max_value      | min_value | increment_by 
-------------+---------------------+-----------+--------------
          11 | 9223372036854775807 |         9 |            1
(1 row)

CREATE TABLE test_t7 (a int2 GENERATED ALWAYS AS IDENTITY (START WITH 12 MAXVALUE 15 INCREMENT 2 NOMINVALUE), b text); -- success
NOTICE:  CREATE TABLE will create implicit sequence "test_t7_a_seq" for serial column "test_t7.a"
\d+ test_t7;
                                      Table "public.test_t7"
 Column |   Type   |               Modifiers               | Storage  | Stats target | Description 
--------+----------+---------------------------------------+----------+--------------+-------------
 a      | smallint | not null generated always as identity | plain    |              | 
 b      | text     |                                       | extended |              | 
Has OIDs: no
Options: orientation=row, compression=no

select start_value, max_value, min_value, increment_by from test_t7_a_seq;
 start_value | max_value | min_value | increment_by 
-------------+-----------+-----------+--------------
          12 |        15 |         1 |            2
(1 row)

INSERT INTO test_t7 DEFAULT VALUES; -- success
INSERT INTO test_t7 DEFAULT VALUES; -- success
INSERT INTO test_t7 DEFAULT VALUES; -- error
ERROR:  nextval: reached maximum value of sequence "test_t7_a_seq" (15)
CONTEXT:  referenced column: a
ALTER TABLE test_t7 ALTER COLUMN a RESTART;
select start_value, max_value, min_value, increment_by from test_t7_a_seq;
 start_value | max_value | min_value | increment_by 
-------------+-----------+-----------+--------------
          12 |        15 |         1 |            2
(1 row)

INSERT INTO test_t7 DEFAULT VALUES; -- success
select * from test_t7 order by 1, 2;
 a  | b 
----+---
 12 | 
 12 | 
 14 | 
(3 rows)

DROP TABLE test_t1, test_t2, test_t3, test_t5, test_t6, test_t7;
CREATE TABLE itest1 (a int generated by default as identity, b text);
NOTICE:  CREATE TABLE will create implicit sequence "itest1_a_seq" for serial column "itest1.a"
CREATE TABLE itest2 (a bigint generated always as identity, b text);
NOTICE:  CREATE TABLE will create implicit sequence "itest2_a_seq" for serial column "itest2.a"
CREATE TABLE itest3 (a smallint generated by default as identity (start with 7 increment by 5), b text);
NOTICE:  CREATE TABLE will create implicit sequence "itest3_a_seq" for serial column "itest3.a"
ALTER TABLE itest3 ALTER COLUMN a ADD GENERATED ALWAYS AS IDENTITY;  -- error
NOTICE:  ALTER TABLE will create implicit sequence "itest3_a_seq1" for serial column "itest3.a"
ERROR:  column "a" of relation "itest3" is already an identity column
SELECT table_name, column_name, column_default, is_nullable, is_identity, identity_generation FROM information_schema.columns WHERE table_name LIKE 'itest_' ORDER BY 1, 2;
 table_name | column_name | column_default | is_nullable | is_identity | identity_generation 
------------+-------------+----------------+-------------+-------------+---------------------
 itest1     | a           |                | NO          | YES         | BY DEFAULT
 itest1     | b           |                | YES         | NO          | 
 itest2     | a           |                | NO          | YES         | ALWAYS
 itest2     | b           |                | YES         | NO          | 
 itest3     | a           |                | NO          | YES         | BY DEFAULT
 itest3     | b           |                | YES         | NO          | 
(6 rows)

-- internal sequences should not be shown here
SELECT sequence_name FROM information_schema.sequences WHERE sequence_name LIKE 'itest%';
 sequence_name 
---------------
(0 rows)

-- invalid column type
CREATE TABLE itest_err_1 (a text generated by default as identity);
ERROR:  Identity column 'a' data type invalid.
-- duplicate identity
CREATE TABLE itest_err_2 (a int generated always as identity generated by default as identity);
NOTICE:  CREATE TABLE will create implicit sequence "itest_err_2_a_seq" for serial column "itest_err_2.a"
ERROR:  multiple identity specifications for column "a" of table "itest_err_2"
LINE 1: ...E itest_err_2 (a int generated always as identity generated ...
                                                             ^
-- cannot have default and identity
CREATE TABLE itest_err_3 (a int default 5 generated by default as identity);
ERROR:  Defaults cannot be created on columns with an IDENTITY attribute.Table 'itest_err_3', column 'a'
LINE 1: CREATE TABLE itest_err_3 (a int default 5 generated by defau...
                                                  ^
-- cannot combine serial and identity
CREATE TABLE itest_err_4 (a serial generated by default as identity);
NOTICE:  CREATE TABLE will create implicit sequence "itest_err_4_a_seq" for serial column "itest_err_4.a"
ERROR:  conflicting serial/identity declarations for column "a" of table "itest_err_4"
LINE 1: CREATE TABLE itest_err_4 (a serial generated by default as i...
                                           ^
--## insert/update OVERRIDING tests
INSERT INTO itest1 DEFAULT VALUES;
INSERT INTO itest1 DEFAULT VALUES;
INSERT INTO itest2 DEFAULT VALUES;
INSERT INTO itest2 DEFAULT VALUES;
INSERT INTO itest3 DEFAULT VALUES;
INSERT INTO itest3 DEFAULT VALUES;
SELECT * FROM itest1 order by a;
 a | b 
---+---
 1 | 
 2 | 
(2 rows)

SELECT * FROM itest2 order by a;
 a | b 
---+---
 1 | 
 2 | 
(2 rows)

SELECT * FROM itest3 order by a;
 a  | b 
----+---
  7 | 
 12 | 
(2 rows)

INSERT INTO itest1 VALUES (10, 'xyz');
INSERT INTO itest1 OVERRIDING USER VALUE VALUES (10, 'xyz');
SELECT * FROM itest1 order by a;
 a  |  b  
----+-----
  1 | 
  2 | 
  3 | xyz
 10 | xyz
(4 rows)

INSERT INTO itest2 VALUES (10, 'xyz'); -- error
ERROR:  cannot insert a non-DEFAULT value into column "a"
DETAIL:  Column "a" is an identity column defined as "GENERATED ALWAYS".
HINT:  Use OVERRIDING SYSTEM VALUE to override.
INSERT INTO itest2 OVERRIDING SYSTEM VALUE VALUES (10, 'xyz');
SELECT * FROM itest2;
 a  |  b  
----+-----
  1 | 
  2 | 
 10 | xyz
(3 rows)

CREATE TABLE test_t1 (a int GENERATED ALWAYS AS IDENTITY, b text);
NOTICE:  CREATE TABLE will create implicit sequence "test_t1_a_seq" for serial column "test_t1.a"
INSERT INTO test_t1 VALUES('xxxx'); -- error
ERROR:  invalid input syntax for integer: "xxxx"
LINE 1: INSERT INTO test_t1 VALUES('xxxx');
                                   ^
CONTEXT:  referenced column: a
INSERT INTO test_t1(b) VALUES('xxxx'); -- success
INSERT INTO test_t1(a, b) VALUES(1, 'xxxx'); -- error
ERROR:  cannot insert a non-DEFAULT value into column "a"
DETAIL:  Column "a" is an identity column defined as "GENERATED ALWAYS".
HINT:  Use OVERRIDING SYSTEM VALUE to override.
INSERT INTO test_t1 VALUES(1, 'xxxx'); -- error
ERROR:  cannot insert a non-DEFAULT value into column "a"
DETAIL:  Column "a" is an identity column defined as "GENERATED ALWAYS".
HINT:  Use OVERRIDING SYSTEM VALUE to override.
INSERT INTO test_t1 VALUES(DEFAULT, 'xxxx'); -- success
INSERT INTO test_t1 OVERRIDING SYSTEM VALUE VALUES(1111, 'xx'); -- success
INSERT INTO test_t1 OVERRIDING USER VALUE VALUES(1111, 'xxxx');  -- success
INSERT INTO test_t1(a, b) OVERRIDING USER VALUE VALUES(DEFAULT, 'xxxx'); -- success
INSERT INTO test_t1(a, b) OVERRIDING SYSTEM VALUE VALUES(1, 'xxxx'); -- success
INSERT INTO test_t1(a, b) select 1, 'xxxxx'; -- error
ERROR:  cannot insert a non-DEFAULT value into column "a"
DETAIL:  Column "a" is an identity column defined as "GENERATED ALWAYS".
HINT:  Use OVERRIDING SYSTEM VALUE to override.
INSERT INTO test_t1(a, b) OVERRIDING USER VALUE select 1, 'xxxxx'; -- success
INSERT INTO test_t1(a, b) OVERRIDING SYSTEM VALUE select 12222, 'xxxxx'; -- success
SELECT * FROM test_t1 ORDER BY a;
   a   |   b   
-------+-------
     1 | xxxx
     1 | xxxx
     2 | xxxx
     3 | xxxx
     4 | xxxx
     5 | xxxxx
  1111 | xx
 12222 | xxxxx
(8 rows)

CREATE TABLE test_t2 (a int GENERATED BY DEFAULT AS IDENTITY, b text);
NOTICE:  CREATE TABLE will create implicit sequence "test_t2_a_seq" for serial column "test_t2.a"
INSERT INTO test_t2 VALUES('xxxx'); -- error
ERROR:  invalid input syntax for integer: "xxxx"
LINE 1: INSERT INTO test_t2 VALUES('xxxx');
                                   ^
CONTEXT:  referenced column: a
INSERT INTO test_t2(b) VALUES('xxxx'); -- success
INSERT INTO test_t2(a, b) VALUES(1, 'xxxx'); -- success
INSERT INTO test_t2 VALUES(1, 'xxxx'); -- success
INSERT INTO test_t2 VALUES(DEFAULT, 'xxxx'); -- success
INSERT INTO test_t2 OVERRIDING SYSTEM VALUE VALUES(1111, 'xx'); -- success
INSERT INTO test_t2 OVERRIDING USER VALUE VALUES(1111, 'xxxx');  -- success
INSERT INTO test_t2(a, b) OVERRIDING USER VALUE VALUES(DEFAULT, 'xxxx'); -- success
INSERT INTO test_t2(a, b) OVERRIDING SYSTEM VALUE VALUES(1, 'xxxx'); -- success
INSERT INTO test_t2(a, b) select 1, 'xxxxx'; -- success
INSERT INTO test_t2(a, b) OVERRIDING USER VALUE select 1, 'xxxxx'; -- success
INSERT INTO test_t2(a, b) OVERRIDING SYSTEM VALUE select 12222, 'xxxxx'; -- success
SELECT * FROM test_t2 ORDER BY a;
   a   |   b   
-------+-------
     1 | xxxx
     1 | xxxx
     1 | xxxx
     1 | xxxxx
     1 | xxxx
     2 | xxxx
     3 | xxxx
     4 | xxxx
     5 | xxxxx
  1111 | xx
 12222 | xxxxx
(11 rows)

DROP TABLE test_t1, test_t2;
--## inline view tests
CREATE TABLE test_t1 (a int GENERATED ALWAYS AS IDENTITY, b text, c int);
NOTICE:  CREATE TABLE will create implicit sequence "test_t1_a_seq" for serial column "test_t1.a"
CREATE TABLE test_t2 (a int GENERATED ALWAYS AS IDENTITY, b text, c int);
NOTICE:  CREATE TABLE will create implicit sequence "test_t2_a_seq" for serial column "test_t2.a"
INSERT INTO test_t1 DEFAULT VALUES;
INSERT INTO test_t2 DEFAULT VALUES;
-- insert
INSERT INTO (SELECT a, b FROM test_t1 WHERE a = 1) sup
    SELECT 2, 'inline view'; -- error
ERROR:  cannot insert a non-DEFAULT value into column "a"
DETAIL:  Column "a" is an identity column defined as "GENERATED ALWAYS".
HINT:  Use OVERRIDING SYSTEM VALUE to override.
INSERT INTO (SELECT a, b FROM test_t1 WHERE a = 1) sup
    OVERRIDING SYSTEM VALUE SELECT 22, 'inline view'; -- success
INSERT INTO (SELECT a, b FROM test_t1 WHERE a = 1) sup
    OVERRIDING USER VALUE SELECT 12, 'inline view'; -- success
SELECT * FROM test_t1 order by 1, 2;
 a  |      b      | c 
----+-------------+---
  1 |             |  
  2 | inline view |  
 22 | inline view |  
(3 rows)

-- update
UPDATE (SELECT a, b FROM test_t1 WHERE a = 1) sup -- SET TO DEFAULT is not supported for subquery "sup"
    SET sup.a = 2; -- error
ERROR:  column "a" can only be updated to DEFAULT
DETAIL:  Column "a" is an identity column defined as "GENERATED ALWAYS".
UPDATE (SELECT a, b FROM test_t1 WHERE a = 1) sup
    SET sup.a = DEFAULT; -- error
ERROR:  SET TO DEFAULT is not supported for subquery "sup"
UPDATE (SELECT a, b FROM test_t1 WHERE a = 12) sup
    SET sup.a = DEFAULT, b = 'inline view updated'; -- error
ERROR:  SET TO DEFAULT is not supported for subquery "sup"
SELECT * FROM test_t1 order by 1, 2;
 a  |      b      | c 
----+-------------+---
  1 |             |  
  2 | inline view |  
 22 | inline view |  
(3 rows)

UPDATE (SELECT a, b FROM test_t1 WHERE a = 1) sup
    SET sup.a = DEFAULT; -- error
ERROR:  SET TO DEFAULT is not supported for subquery "sup"
UPDATE (SELECT a, b FROM test_t1 WHERE a = 1) sup
    SET sup.b = 'inline view updated'; -- success
SELECT * FROM test_t1 order by 1, 2;
 a  |          b          | c 
----+---------------------+---
  1 | inline view updated |  
  2 | inline view         |  
 22 | inline view         |  
(3 rows)

DROP TABLE test_t1, test_t2;
-- --## multi insert tests
-- CREATE TABLE test_t1 (a int GENERATED ALWAYS AS IDENTITY, b text);
-- CREATE TABLE test_t2 (a int GENERATED BY DEFAULT AS IDENTITY, b text);
-- -- error
-- INSERT ALL
--     INTO test_t1 (a, b) VALUES (val1, val2)
--     INTO test_t2 (a, b) VALUES (val1, val2)
-- SELECT 1 as val1, 'x1' as val2;
-- -- success
-- INSERT ALL
--     INTO test_t1 (a, b) OVERRIDING USER VALUE VALUES (val1, val2)
--     INTO test_t2 (a, b) VALUES (val1, val2)
-- SELECT 2 as val1, 'x1' as val2;
-- -- success
-- INSERT ALL
--     INTO test_t1 (a, b) OVERRIDING SYSTEM VALUE VALUES (val1, val2)
--     INTO test_t2 (a, b) VALUES (val1, val2)
-- SELECT 3 as val1, 'x2' as val2;
-- -- success
-- INSERT ALL
--     INTO test_t1 (a, b) OVERRIDING SYSTEM VALUE VALUES (DEFAULT, val2)
--     INTO test_t2 (a, b) VALUES (val1, val2)
-- SELECT 4 as val1, 'x3' as val2;
-- -- success
-- INSERT ALL
--     INTO test_t1 (a, b) VALUES (DEFAULT, val2)
--     INTO test_t2 (a, b) VALUES (DEFAULT, val2)
-- SELECT 5 as val1, 'x4' as val2;
-- -- success
-- INSERT ALL
--     INTO test_t1 (a, b) VALUES (DEFAULT, val2)
--     INTO test_t2 (a, b) OVERRIDING USER VALUE VALUES (999, val2)
-- SELECT 6 as val1, 'x5' as val2;
-- -- success
-- INSERT ALL
--     INTO test_t1 (b) VALUES (DEFAULT, val2)
--     INTO test_t2 (b) VALUES (DEFAULT, val2)
-- SELECT 7 as val1, 'x6' as val2;
-- SELECT * FROM test_t1 ORDER BY b;
-- SELECT * FROM test_t2 ORDER BY b;
-- DROP TABLE test_t1, test_t2;
--## upserts tests
CREATE TABLE test_t1 (a int PRIMARY KEY GENERATED ALWAYS AS IDENTITY , b text);
NOTICE:  CREATE TABLE will create implicit sequence "test_t1_a_seq" for serial column "test_t1.a"
NOTICE:  CREATE TABLE / PRIMARY KEY will create implicit index "test_t1_pkey" for table "test_t1"
INSERT INTO test_t1 VALUES (DEFAULT, default);
SELECT * FROM test_t1;
 a | b 
---+---
 1 | 
(1 row)

INSERT INTO test_t1 OVERRIDING SYSTEM VALUE VALUES(1, 'xxxx'); -- error
ERROR:  duplicate key value violates unique constraint "test_t1_pkey"
DETAIL:  Key (a)=(1) already exists.
INSERT INTO test_t1 OVERRIDING SYSTEM VALUE VALUES(1, 'setb') ON DUPLICATE KEY UPDATE b = 'setb'; -- success
INSERT INTO test_t1 OVERRIDING SYSTEM VALUE VALUES(1, 'nothing') ON DUPLICATE KEY UPDATE NOTHING; -- success
SELECT * FROM test_t1 order by 1, 2; -- 1, setb
 a |  b   
---+------
 1 | setb
(1 row)

INSERT INTO test_t1 OVERRIDING SYSTEM VALUE VALUES(1, 'nothing') ON DUPLICATE KEY UPDATE a = 2; -- error
ERROR:  INSERT ON DUPLICATE KEY UPDATE don't allow update on primary key or unique key.
INSERT INTO test_t1 OVERRIDING SYSTEM VALUE VALUES(1, 'seta') ON DUPLICATE KEY UPDATE b = 'seta';  -- success
SELECT * FROM test_t1 order by 1, 2; -- 1, seta
 a |  b   
---+------
 1 | seta
(1 row)

INSERT INTO test_t1 OVERRIDING SYSTEM VALUE VALUES(1, 'seta') ON DUPLICATE KEY UPDATE b = 'setc', a = DEFAULT; -- error
ERROR:  INSERT ON DUPLICATE KEY UPDATE don't allow update on primary key or unique key.
SELECT * FROM test_t1 order by 1, 2; -- 1, seta
 a |  b   
---+------
 1 | seta
(1 row)

INSERT INTO test_t1 OVERRIDING SYSTEM VALUE VALUES(2, 'test1'); -- success
INSERT INTO test_t1 OVERRIDING USER VALUE VALUES(1111, 'test1'); -- error
ERROR:  duplicate key value violates unique constraint "test_t1_pkey"
DETAIL:  Key (a)=(2) already exists.
INSERT INTO test_t1 OVERRIDING SYSTEM VALUE VALUES(3, 'test1'); -- success
INSERT INTO test_t1 OVERRIDING USER VALUE VALUES(1111, 'test1') ON DUPLICATE KEY UPDATE b = 'w3' WHERE a = 3; -- success
INSERT INTO test_t1 OVERRIDING SYSTEM VALUE VALUES(4, 'test1'); -- success
INSERT INTO test_t1 OVERRIDING USER VALUE VALUES(1111, 'test1') ON DUPLICATE KEY UPDATE a = 5 WHERE a = 4; -- error, 未自增
ERROR:  INSERT ON DUPLICATE KEY UPDATE don't allow update on primary key or unique key.
SELECT * FROM test_t1 order by 1, 2;
 a |   b   
---+-------
 1 | seta
 2 | test1
 3 | w3
 4 | test1
(4 rows)

INSERT INTO test_t1 OVERRIDING SYSTEM VALUE VALUES(5, 'test1'); -- success
INSERT INTO test_t1 OVERRIDING USER VALUE VALUES(1111, 'test1') ON DUPLICATE KEY UPDATE b = 'w5', a = DEFAULT WHERE a = 5; -- error, 未自增
ERROR:  INSERT ON DUPLICATE KEY UPDATE don't allow update on primary key or unique key.
INSERT INTO test_t1 OVERRIDING SYSTEM VALUE VALUES(6, 'test1'); -- success
INSERT INTO test_t1 OVERRIDING USER VALUE VALUES(1111, 'test1') ON DUPLICATE KEY UPDATE b = 'w6' WHERE a = 4; -- success
SELECT * FROM test_t1 order by 1, 2;
 a |   b   
---+-------
 1 | seta
 2 | test1
 3 | w3
 4 | w6
 5 | test1
 6 | test1
(6 rows)

CREATE TABLE test_t2 (a int GENERATED BY DEFAULT AS IDENTITY PRIMARY KEY, b text);
NOTICE:  CREATE TABLE will create implicit sequence "test_t2_a_seq" for serial column "test_t2.a"
NOTICE:  CREATE TABLE / PRIMARY KEY will create implicit index "test_t2_pkey" for table "test_t2"
INSERT INTO test_t2 DEFAULT VALUES;
SELECT * FROM test_t2;
 a | b 
---+---
 1 | 
(1 row)

INSERT INTO test_t2 OVERRIDING SYSTEM VALUE VALUES(1, 'xxxx'); -- error
ERROR:  duplicate key value violates unique constraint "test_t2_pkey"
DETAIL:  Key (a)=(1) already exists.
INSERT INTO test_t2 OVERRIDING SYSTEM VALUE VALUES(1, 'setb') ON DUPLICATE KEY UPDATE b = 'setb'; -- success
SELECT * FROM test_t2 order by 1, 2;
 a |  b   
---+------
 1 | setb
(1 row)

INSERT INTO test_t2 OVERRIDING SYSTEM VALUE VALUES(1, 'setc') ON DUPLICATE KEY UPDATE a = 2; -- error
ERROR:  INSERT ON DUPLICATE KEY UPDATE don't allow update on primary key or unique key.
INSERT INTO test_t2 OVERRIDING SYSTEM VALUE VALUES(1, 'setc') ON DUPLICATE KEY UPDATE a = DEFAULT, b = 'setc'; -- error
ERROR:  INSERT ON DUPLICATE KEY UPDATE don't allow update on primary key or unique key.
SELECT * FROM test_t2 order by 1, 2; -- 1, setb
 a |  b   
---+------
 1 | setb
(1 row)

INSERT INTO test_t2 OVERRIDING USER VALUE VALUES(2, 'test1'); -- success
INSERT INTO test_t2 OVERRIDING USER VALUE VALUES(2, 'test2') ON DUPLICATE KEY UPDATE b = 'test3'; -- success
SELECT * FROM test_t2 order by 1, 2; -- 
 a |   b   
---+-------
 1 | setb
 2 | test1
 3 | test2
(3 rows)

INSERT INTO test_t2 OVERRIDING SYSTEM VALUE VALUES(1, 'test2') ON DUPLICATE KEY UPDATE a = 3; -- error
ERROR:  INSERT ON DUPLICATE KEY UPDATE don't allow update on primary key or unique key.
INSERT INTO test_t2 OVERRIDING SYSTEM VALUE VALUES(1, 'test2') ON DUPLICATE KEY UPDATE a = DEFAULT, b = 'test2'; -- error
ERROR:  INSERT ON DUPLICATE KEY UPDATE don't allow update on primary key or unique key.
SELECT * FROM test_t2 order by 1, 2;
 a |   b   
---+-------
 1 | setb
 2 | test1
 3 | test2
(3 rows)

DROP TABLE test_t1, test_t2;
--## returning tests
CREATE TABLE test_t1 (a int GENERATED ALWAYS AS IDENTITY(START WITH 10) PRIMARY KEY, b text);
NOTICE:  CREATE TABLE will create implicit sequence "test_t1_a_seq" for serial column "test_t1.a"
NOTICE:  CREATE TABLE / PRIMARY KEY will create implicit index "test_t1_pkey" for table "test_t1"
CREATE TABLE test_t2 (a int GENERATED BY DEFAULT AS IDENTITY(START WITH 12) PRIMARY KEY, b text);
NOTICE:  CREATE TABLE will create implicit sequence "test_t2_a_seq" for serial column "test_t2.a"
NOTICE:  CREATE TABLE / PRIMARY KEY will create implicit index "test_t2_pkey" for table "test_t2"
INSERT INTO test_t1 DEFAULT VALUES RETURNING a;
 a  
----
 10
(1 row)

INSERT INTO test_t2 DEFAULT VALUES RETURNING a;
 a  
----
 12
(1 row)

DROP TABLE test_t1, test_t2;
--## UPDATE tests
UPDATE itest1 SET a = 101 WHERE a = 1;
UPDATE itest1 SET a = DEFAULT WHERE a = 2;
UPDATE itest1 SET b = 'test' where a=101;
SELECT * FROM itest1 order by 1, 2;
  a  |  b   
-----+------
   3 | xyz
   4 | 
  10 | xyz
 101 | test
(4 rows)

UPDATE itest2 SET a = 101 WHERE a = 1; -- error
ERROR:  column "a" can only be updated to DEFAULT
DETAIL:  Column "a" is an identity column defined as "GENERATED ALWAYS".
UPDATE itest2 SET a = DEFAULT WHERE a = 2;
UPDATE itest2 SET b = 'test' where a=101;
SELECT * FROM itest2 order by 1, 2;
 a  |  b  
----+-----
  1 | 
  3 | 
 10 | xyz
(3 rows)

--## merge tests
-- when not matched insert
create table target_table (
    id int GENERATED ALWAYS AS IDENTITY PRIMARY KEY,
    name varchar(50),
    age int
);
NOTICE:  CREATE TABLE will create implicit sequence "target_table_id_seq" for serial column "target_table.id"
NOTICE:  CREATE TABLE / PRIMARY KEY will create implicit index "target_table_pkey" for table "target_table"
create table source_table (id int, name varchar(50), age int);
insert into source_table values (10, 'zliu', 28), (11, 'sqi', 30);
-- expected: success. let id generated by system.
merge into target_table AS t using source_table AS s ON t.id = s.id
when not matched then
    insert (name, age) values (s.name, s.age);
-- expected: error
merge into target_table AS t using source_table AS s ON t.id = s.id
when not matched then
    insert (id, name, age) values (1, 'error', 21);
ERROR:  cannot insert a non-DEFAULT value into column "id"
DETAIL:  Column "id" is an identity column defined as "GENERATED ALWAYS".
HINT:  Use OVERRIDING SYSTEM VALUE to override
-- expected: success
merge into target_table AS t using source_table AS s ON t.id = s.id
when not matched then
    insert (id, name, age) OVERRIDING USER VALUE values (1, 'success', 22); -- 3
-- expected: error
merge into target_table AS t using source_table AS s ON t.id = s.id
when not matched then
    insert (id, name, age) OVERRIDING SYSTEM VALUE values (2, 'error', 23);
ERROR:  duplicate key value violates unique constraint "target_table_pkey"
DETAIL:  Key (id)=(2) already exists.
-- expected: error
merge into target_table AS t using source_table AS s ON t.id = s.id
when not matched then
    insert (id, name, age) OVERRIDING SYSTEM VALUE values (3, 'error', 24);
ERROR:  duplicate key value violates unique constraint "target_table_pkey"
DETAIL:  Key (id)=(3) already exists.
-- expected: success
merge into target_table AS t using source_table AS s ON t.id = s.id
when not matched then
    insert (id, name, age) OVERRIDING USER VALUE values (3, 'success', 25);
-- expected: success
merge into target_table AS t using source_table AS s ON t.id = s.id
when not matched then
    insert (id, name, age) OVERRIDING SYSTEM VALUE values (DEFAULT, 'success', 26);
-- expected: success
merge into target_table AS t using source_table AS s ON t.id = s.id
when not matched then
    insert (id, name, age) OVERRIDING USER VALUE values (DEFAULT, 'success', 27);
SELECT * from target_table order by id;
 id |  name   | age 
----+---------+-----
  1 | zliu    |  28
  2 | sqi     |  30
  3 | success |  22
  4 | success |  22
  5 | success |  25
  6 | success |  25
  7 | success |  26
  8 | success |  26
  9 | success |  27
 10 | success |  27
(10 rows)

DROP TABLE target_table, source_table;
-- when matched update
create table target_table (
    id int  GENERATED ALWAYS AS IDENTITY PRIMARY KEY,
    name varchar(50), 
    age int
);
NOTICE:  CREATE TABLE will create implicit sequence "target_table_id_seq" for serial column "target_table.id"
NOTICE:  CREATE TABLE / PRIMARY KEY will create implicit index "target_table_pkey" for table "target_table"
create table source_table (id int, name varchar(50), age int);
insert into source_table values (1, 'zliu', 28), (2, 'sqi', 30);
-- success
insert into target_table default values;
merge into target_table AS t using source_table AS s ON t.id = s.id
WHEN MATCHED THEN
  UPDATE SET name = s.name, age = s.age + 1;
-- error
insert into target_table default values;
merge into target_table AS t using source_table AS s ON t.id = s.id
WHEN MATCHED THEN
  UPDATE SET id = s.id + 1;
ERROR:  Columns referenced in the ON Clause cannot be updated: "target_table"."id"
-- error
merge into target_table AS t using source_table AS s ON t.id = s.id
WHEN MATCHED THEN
  UPDATE SET id = DEFAULT, name = s.name, age = s.age + 1;
ERROR:  Columns referenced in the ON Clause cannot be updated: "target_table"."id"
SELECT * from target_table;
 id | name | age 
----+------+-----
  1 | zliu |  29
  2 |      |    
(2 rows)

DROP TABLE target_table, source_table;
-- CTE with modifying clause
CREATE TABLE test_t1 (a int GENERATED ALWAYS AS IDENTITY(START WITH 10) PRIMARY KEY, b text);
NOTICE:  CREATE TABLE will create implicit sequence "test_t1_a_seq" for serial column "test_t1.a"
NOTICE:  CREATE TABLE / PRIMARY KEY will create implicit index "test_t1_pkey" for table "test_t1"
CREATE TABLE test_t2 (a int GENERATED BY DEFAULT AS IDENTITY(START WITH 12) PRIMARY KEY, b text);
NOTICE:  CREATE TABLE will create implicit sequence "test_t2_a_seq" for serial column "test_t2.a"
NOTICE:  CREATE TABLE / PRIMARY KEY will create implicit index "test_t2_pkey" for table "test_t2"
-- error
WITH xxx AS (
    INSERT INTO test_t1(a, b) VALUES(1, 'xxxx') RETURNING a
) select * from xxx;
ERROR:  cannot insert a non-DEFAULT value into column "a"
DETAIL:  Column "a" is an identity column defined as "GENERATED ALWAYS".
HINT:  Use OVERRIDING SYSTEM VALUE to override.
-- success
WITH xxx AS (
    INSERT INTO test_t2(a, b) VALUES(1, 'x1') RETURNING a, b
) select * from xxx;
 a | b  
---+----
 1 | x1
(1 row)

-- success
WITH xxx AS (
    INSERT INTO test_t1(a, b) OVERRIDING SYSTEM VALUE VALUES(1, 'x1') RETURNING a, b
) select * from xxx;
 a | b  
---+----
 1 | x1
(1 row)

-- success
WITH xxx AS (
    INSERT INTO test_t1(a, b) OVERRIDING USER VALUE VALUES(3, 'x2') RETURNING a, b
) select * from xxx; -- should be 2
 a  | b  
----+----
 10 | x2
(1 row)

-- error
WITH xxx AS (
    UPDATE test_t1 SET a = 3 RETURNING a, b
) select * from xxx;
ERROR:  column "a" can only be updated to DEFAULT
DETAIL:  Column "a" is an identity column defined as "GENERATED ALWAYS".
-- error
WITH xxx AS (
    UPDATE test_t2 SET a = 3 RETURNING a, b
) select * from xxx;
 a | b  
---+----
 3 | x1
(1 row)

-- success
WITH xxx AS (
    UPDATE test_t1 SET a = DEFAULT, b = 't1_updated' RETURNING a, b
) select * from xxx;
 a  |     b      
----+------------
 11 | t1_updated
 12 | t1_updated
(2 rows)

-- success
WITH xxx AS (
    UPDATE test_t2 SET a = DEFAULT, b = 't2_updated' RETURNING a, b
) select * from xxx;
 a  |     b      
----+------------
 12 | t2_updated
(1 row)

DROP TABLE test_t1, test_t2;
--## alter table
CREATE TABLE itest4 (a int, b text);
ALTER TABLE itest4 ALTER COLUMN a ADD GENERATED ALWAYS AS IDENTITY;  -- error, requires NOT NULL
NOTICE:  ALTER TABLE will create implicit sequence "itest4_a_seq" for serial column "itest4.a"
ERROR:  column "a" of relation "itest4" must be declared NOT NULL before identity can be added
ALTER TABLE itest4 ALTER COLUMN a SET NOT NULL;
ALTER TABLE itest4 ALTER COLUMN a ADD GENERATED ALWAYS AS IDENTITY;  -- ok
NOTICE:  ALTER TABLE will create implicit sequence "itest4_a_seq" for serial column "itest4.a"
\d+ itest4
                                      Table "public.itest4"
 Column |  Type   |               Modifiers               | Storage  | Stats target | Description 
--------+---------+---------------------------------------+----------+--------------+-------------
 a      | integer | not null generated always as identity | plain    |              | 
 b      | text    |                                       | extended |              | 
Has OIDs: no
Options: orientation=row, compression=no

ALTER TABLE itest4 ALTER COLUMN a DROP NOT NULL;  -- error, disallowed
ERROR:  column "a" of relation "itest4" is an identity column
ALTER TABLE itest4 ALTER COLUMN a ADD GENERATED ALWAYS AS IDENTITY;  -- error, already set
NOTICE:  ALTER TABLE will create implicit sequence "itest4_a_seq1" for serial column "itest4.a"
ERROR:  column "a" of relation "itest4" is already an identity column
ALTER TABLE itest4 ALTER COLUMN b ADD GENERATED ALWAYS AS IDENTITY;  -- error, wrong data type
ERROR:  Identity column 'b' data type invalid.
INSERT INTO itest4 DEFAULT VALUES;
INSERT INTO itest4 DEFAULT VALUES;
SELECT * FROM itest4;
 a | b 
---+---
 1 | 
 2 | 
(2 rows)

-- alter add column
CREATE TABLE itest4_1 (a int, b text);
ALTER TABLE itest4_1 ADD COLUMN c text GENERATED ALWAYS AS IDENTITY; -- error
ERROR:  Identity column 'c' data type invalid.
ALTER TABLE itest4_1 ADD COLUMN c int GENERATED ALWAYS AS IDENTITY; -- success
NOTICE:  ALTER TABLE will create implicit sequence "itest4_1_c_seq" for serial column "itest4_1.c"
\d+ itest4_1
                                     Table "public.itest4_1"
 Column |  Type   |               Modifiers               | Storage  | Stats target | Description 
--------+---------+---------------------------------------+----------+--------------+-------------
 a      | integer |                                       | plain    |              | 
 b      | text    |                                       | extended |              | 
 c      | integer | not null generated always as identity | plain    |              | 
Has OIDs: no
Options: orientation=row, compression=no

INSERT INTO itest4_1 DEFAULT VALUES;
INSERT INTO itest4_1 (c, a, b) VALUES(1, 2, 'x1'); -- error
ERROR:  cannot insert a non-DEFAULT value into column "c"
DETAIL:  Column "c" is an identity column defined as "GENERATED ALWAYS".
HINT:  Use OVERRIDING SYSTEM VALUE to override.
INSERT INTO itest4_1 (c, a, b) OVERRIDING SYSTEM VALUE VALUES(111, 2, 'x2'); -- success
INSERT INTO itest4_1 (c, a, b) VALUES(DEFAULT, 2, 'x3'); -- success
SELECT c, a, b FROM itest4_1 order by c, b, a;
  c  | a | b  
-----+---+----
   1 |   | 
   2 | 2 | x3
 111 | 2 | x2
(3 rows)

CREATE TABLE itest4_2 (a int, b text);
ALTER TABLE itest4_2 ADD COLUMN c text GENERATED BY DEFAULT AS IDENTITY; -- error
ERROR:  Identity column 'c' data type invalid.
ALTER TABLE itest4_2 ADD COLUMN c int GENERATED BY DEFAULT AS IDENTITY; -- success
NOTICE:  ALTER TABLE will create implicit sequence "itest4_2_c_seq" for serial column "itest4_2.c"
ALTER TABLE itest4_2 ALTER COLUMN a ADD GENERATED BY DEFAULT AS IDENTITY;
NOTICE:  ALTER TABLE will create implicit sequence "itest4_2_a_seq" for serial column "itest4_2.a"
ERROR:  column "a" of relation "itest4_2" must be declared NOT NULL before identity can be added
\d+ itest4_2
                                       Table "public.itest4_2"
 Column |  Type   |                 Modifiers                 | Storage  | Stats target | Description 
--------+---------+-------------------------------------------+----------+--------------+-------------
 a      | integer |                                           | plain    |              | 
 b      | text    |                                           | extended |              | 
 c      | integer | not null generated by default as identity | plain    |              | 
Has OIDs: no
Options: orientation=row, compression=no

INSERT INTO itest4_2 DEFAULT VALUES;
INSERT INTO itest4_2 (c, a, b) VALUES(1, 2, 'x1'); -- success
INSERT INTO itest4_2 (c, a, b) OVERRIDING SYSTEM VALUE VALUES(111, 2, 'x2'); -- success
INSERT INTO itest4_2 (c, a, b) VALUES(DEFAULT, 2, 'x3'); -- success
SELECT c, a, b FROM itest4_2 order by c, b, a;
  c  | a | b  
-----+---+----
   1 | 2 | x1
   1 |   | 
   2 | 2 | x3
 111 | 2 | x2
(4 rows)

DROP TABLE itest4_1, itest4_2;
-- for later
ALTER TABLE itest4 ALTER COLUMN b SET DEFAULT '';
-- DROP IDENTITY tests
ALTER TABLE itest4 ALTER COLUMN b DROP IDENTITY;  -- error
ERROR:  column "b" of relation "itest4" is not an identity column
ALTER TABLE itest4 ALTER COLUMN a DROP IDENTITY;
INSERT INTO itest4 VALUES (NULL, 'nullable');
ERROR:  null value in column "a" violates not-null constraint
DETAIL:  Failing row contains (null, nullable).
ALTER TABLE itest4 ALTER COLUMN a DROP IDENTITY IF EXISTS;  -- noop
NOTICE:  column "a" of relation "itest4" is not an identity column, skipping
INSERT INTO itest4 DEFAULT VALUES;  -- fails because NOT NULL is not dropped
ERROR:  null value in column "a" violates not-null constraint
DETAIL:  Failing row contains (null, null).
ALTER TABLE itest4 ALTER COLUMN a DROP NOT NULL;
INSERT INTO itest4 DEFAULT VALUES;
SELECT * FROM itest4;
 a | b 
---+---
 1 | 
 2 | 
   | 
(3 rows)

-- check that sequence is removed
SELECT sequence_name FROM itest4_a_seq;
ERROR:  relation "itest4_a_seq" does not exist on datanode1
LINE 1: SELECT sequence_name FROM itest4_a_seq;
                                  ^
-- fail, not allowed for identity columns
ALTER TABLE itest1 ALTER COLUMN a SET DEFAULT 1;
ERROR:  column "a" of relation "itest1" is an identity column
ALTER TABLE itest1 ALTER COLUMN a DROP DEFAULT;
ERROR:  column "a" of relation "itest1" is an identity column
HINT:  Use ALTER TABLE ... ALTER COLUMN ... DROP IDENTITY instead.
-- fail, not allowed, already has a default
CREATE TABLE itest5 (a serial, b text);
NOTICE:  CREATE TABLE will create implicit sequence "itest5_a_seq" for serial column "itest5.a"
ALTER TABLE itest5 ALTER COLUMN a ADD GENERATED ALWAYS AS IDENTITY;
NOTICE:  ALTER TABLE will create implicit sequence "itest5_a_seq1" for serial column "itest5.a"
ERROR:  column "a" of relation "itest5" already has a default value
--success
ALTER TABLE itest5 DROP COLUMN a;
SELECT sequence_name FROM itest5_a_seq;
ERROR:  relation "itest5_a_seq" does not exist on datanode1
LINE 1: SELECT sequence_name FROM itest5_a_seq;
                                  ^
DROP TABLE itest5;
-- not supported
\d+ itest3
                                         Table "public.itest3"
 Column |   Type   |                 Modifiers                 | Storage  | Stats target | Description 
--------+----------+-------------------------------------------+----------+--------------+-------------
 a      | smallint | not null generated by default as identity | plain    |              | 
 b      | text     |                                           | extended |              | 
Has OIDs: no
Options: orientation=row, compression=no

ALTER TABLE itest3 ALTER COLUMN a TYPE int;
ERROR:  Not supported alter identity column a type
ALTER TABLE itest3 ALTER COLUMN a TYPE text;
ERROR:  Not supported alter identity column a type
-- ALTER COLUMN ... SET
CREATE TABLE itest6 (a int GENERATED ALWAYS AS IDENTITY, b text);
NOTICE:  CREATE TABLE will create implicit sequence "itest6_a_seq" for serial column "itest6.a"
\d+ itest6
                                      Table "public.itest6"
 Column |  Type   |               Modifiers               | Storage  | Stats target | Description 
--------+---------+---------------------------------------+----------+--------------+-------------
 a      | integer | not null generated always as identity | plain    |              | 
 b      | text    |                                       | extended |              | 
Has OIDs: no
Options: orientation=row, compression=no

\d+ itest6_a_seq
             Sequence "public.itest6_a_seq"
    Column     |  Type   |        Value        | Storage 
---------------+---------+---------------------+---------
 sequence_name | name    | itest6_a_seq        | plain
 last_value    | bigint  | 1                   | plain
 start_value   | bigint  | 1                   | plain
 increment_by  | bigint  | 1                   | plain
 max_value     | bigint  | 9223372036854775807 | plain
 min_value     | bigint  | 1                   | plain
 cache_value   | bigint  | 1                   | plain
 log_cnt       | bigint  | 0                   | plain
 is_cycled     | boolean | f                   | plain
 is_called     | boolean | f                   | plain
 uuid          | bigint  | 0                   | plain
 is_global     | boolean | f                   | plain
Sequence for identity column: public.itest6.a

INSERT INTO itest6 DEFAULT VALUES;
INSERT INTO itest6 DEFAULT VALUES;
SELECT * FROM itest6;
 a | b 
---+---
 1 | 
 2 | 
(2 rows)

ALTER TABLE itest6 ALTER COLUMN a SET GENERATED BY DEFAULT SET INCREMENT BY 2 SET START WITH 100 RESTART;
\d+ itest6
                                        Table "public.itest6"
 Column |  Type   |                 Modifiers                 | Storage  | Stats target | Description 
--------+---------+-------------------------------------------+----------+--------------+-------------
 a      | integer | not null generated by default as identity | plain    |              | 
 b      | text    |                                           | extended |              | 
Has OIDs: no
Options: orientation=row, compression=no

\d+ itest6_a_seq
             Sequence "public.itest6_a_seq"
    Column     |  Type   |        Value        | Storage 
---------------+---------+---------------------+---------
 sequence_name | name    | itest6_a_seq        | plain
 last_value    | bigint  | 100                 | plain
 start_value   | bigint  | 100                 | plain
 increment_by  | bigint  | 2                   | plain
 max_value     | bigint  | 9223372036854775807 | plain
 min_value     | bigint  | 1                   | plain
 cache_value   | bigint  | 1                   | plain
 log_cnt       | bigint  | 0                   | plain
 is_cycled     | boolean | f                   | plain
 is_called     | boolean | f                   | plain
 uuid          | bigint  | 0                   | plain
 is_global     | boolean | f                   | plain
Sequence for identity column: public.itest6.a

INSERT INTO itest6 DEFAULT VALUES;
INSERT INTO itest6 DEFAULT VALUES;
SELECT * FROM itest6;
  a  | b 
-----+---
   1 | 
   2 | 
 100 | 
 102 | 
(4 rows)

SELECT table_name, column_name, is_identity, identity_generation FROM information_schema.columns WHERE table_name = 'itest6' order by 1,2,3,4;
 table_name | column_name | is_identity | identity_generation 
------------+-------------+-------------+---------------------
 itest6     | a           | YES         | BY DEFAULT
 itest6     | b           | NO          | 
(2 rows)

ALTER TABLE itest6 ALTER COLUMN b SET INCREMENT BY 2;  -- fail, not identity
ERROR:  column "b" of relation "itest6" is not an identity column
-- --## multiple steps in ALTER TABLE
-- cuase transformAlterTableStmt will analysis AT_Column and AT_AddIdentity
-- at same time, when AT_AddIdentity, new column has not been created yet.
-- CREATE TABLE itest5 (a int, b text);
-- ALTER TABLE itest5
--   ADD COLUMN f21 int NULL,
--   ALTER COLUMN f21 ADD GENERATED ALWAYS AS IDENTITY;
-- ALTER TABLE itest5
--   ADD COLUMN f22 int NOT NULL,
--   ALTER COLUMN f22 ADD GENERATED ALWAYS AS IDENTITY;
--## sequence
-- prohibited direct modification of sequence
ALTER SEQUENCE itest6_a_seq OWNED BY NONE;
ERROR:  cannot change ownership of identity sequence
DETAIL:  Sequence "itest6_a_seq" is linked to table "itest6".
CREATE SEQUENCE sequence_testx OWNED BY pg_class_oid_index.oid;  -- not a table
ERROR:  referenced relation "pg_class_oid_index" is not a table
CREATE SEQUENCE my_int_seq;
-- not supported 'AS' option
CREATE SEQUENCE my_int_seq AS INTEGER;
ERROR:  syntax error at or near "AS"
LINE 1: CREATE SEQUENCE my_int_seq AS INTEGER;
                                   ^
-- not supported 'SEQUENCE NAME' option
ALTER SEQUENCE my_int_seq SEQUENCE NAME my_int_seq_1;
ERROR:  invalid sequence option SEQUENCE NAME
-- alter sequence set schame
create schame seq1;
ERROR:  syntax error at or near "schame"
LINE 1: create schame seq1;
               ^
create sequence s1;
-- error
alter sequence s1 set schame seq1;
ERROR:  syntax error at or near "schame"
LINE 1: alter sequence s1 set schame seq1;
                              ^
alter table seq1 set schame seq1;
ERROR:  syntax error at or near "schame"
LINE 1: alter table seq1 set schame seq1;
                             ^
--## truncate
CREATE TABLE truncate_b (id int GENERATED ALWAYS AS IDENTITY (START WITH 44));
NOTICE:  CREATE TABLE will create implicit sequence "truncate_b_id_seq" for serial column "truncate_b.id"
INSERT INTO truncate_b DEFAULT VALUES;
INSERT INTO truncate_b DEFAULT VALUES;
SELECT * FROM truncate_b;
 id 
----
 44
 45
(2 rows)

TRUNCATE truncate_b;
INSERT INTO truncate_b DEFAULT VALUES;
INSERT INTO truncate_b DEFAULT VALUES;
SELECT * FROM truncate_b;
 id 
----
 46
 47
(2 rows)

TRUNCATE truncate_b RESTART IDENTITY;
--## create table like
CREATE TABLE test_like_id_1 (a int GENERATED ALWAYS AS IDENTITY, b text);
NOTICE:  CREATE TABLE will create implicit sequence "test_like_id_1_a_seq" for serial column "test_like_id_1.a"
\d test_like_id_1
              Table "public.test_like_id_1"
 Column |  Type   |               Modifiers               
--------+---------+---------------------------------------
 a      | integer | not null generated always as identity
 b      | text    | 

INSERT INTO test_like_id_1 (b) VALUES ('b1');
SELECT * FROM test_like_id_1;
 a | b  
---+----
 1 | b1
(1 row)

CREATE TABLE test_like_id_2 (LIKE test_like_id_1);
\d test_like_id_2
Table "public.test_like_id_2"
 Column |  Type   | Modifiers 
--------+---------+-----------
 a      | integer | not null
 b      | text    | 

INSERT INTO test_like_id_2 (b) VALUES ('b2');
ERROR:  null value in column "a" violates not-null constraint
DETAIL:  Failing row contains (null, b2).
SELECT * FROM test_like_id_2;  -- identity was not copied
 a | b 
---+---
(0 rows)

CREATE TABLE test_like_id_3 (LIKE test_like_id_1 INCLUDING IDENTITY);
NOTICE:  CREATE TABLE will create implicit sequence "test_like_id_3_a_seq" for serial column "test_like_id_3.a"
\d test_like_id_3
              Table "public.test_like_id_3"
 Column |  Type   |               Modifiers               
--------+---------+---------------------------------------
 a      | integer | not null generated always as identity
 b      | text    | 

INSERT INTO test_like_id_3 (b) VALUES ('b3');
SELECT * FROM test_like_id_3;  -- identity was copied and applied
 a | b  
---+----
 1 | b3
(1 row)

CREATE TABLE test_like_id_4 (like test_like_id_1 INCLUDING DEFAULTS INCLUDING IDENTITY);
NOTICE:  CREATE TABLE will create implicit sequence "test_like_id_4_a_seq" for serial column "test_like_id_4.a"
\d test_like_id_4
              Table "public.test_like_id_4"
 Column |  Type   |               Modifiers               
--------+---------+---------------------------------------
 a      | integer | not null generated always as identity
 b      | text    | 

INSERT INTO test_like_id_4 (b) VALUES ('b3');
SELECT * FROM test_like_id_4;  -- identity was copied and applied
 a | b  
---+----
 1 | b3
(1 row)

-- not copy, because no identity column
CREATE TABLE par_row_t1 (a int, b text) partition by range (a)
(
    partition par_row_t1_p0 values less than(10),
    partition par_row_t1_p3 values less than (maxvalue)
);
CREATE TABLE test_lik3_v (LIKE par_row_t1 INCLUDING IDENTITY);
DROP TABLE test_like_id_2, test_like_id_3, test_like_id_4, par_row_t1, test_lik3_v;
--## select into
-- not copy identity
SELECT a, b into test_like_id_5 from test_like_id_1;
\d test_like_id_5
Table "public.test_like_id_5"
 Column |  Type   | Modifiers 
--------+---------+-----------
 a      | integer | 
 b      | text    | 

INSERT INTO test_like_id_5 (b) VALUES ('b3');
SELECT * FROM test_like_id_5 order by 1, 2;
 a | b  
---+----
 1 | b1
   | b3
(2 rows)

DROP TABLE test_like_id_1, test_like_id_5;
--## test views
CREATE TABLE itest10 (a int generated by default as identity, b text);
NOTICE:  CREATE TABLE will create implicit sequence "itest10_a_seq" for serial column "itest10.a"
CREATE TABLE itest11 (a int generated always as identity, b text);
NOTICE:  CREATE TABLE will create implicit sequence "itest11_a_seq" for serial column "itest11.a"
CREATE VIEW itestv10 AS SELECT * FROM itest10;
CREATE VIEW itestv11 AS SELECT * FROM itest11;
INSERT INTO itestv10 DEFAULT VALUES;
INSERT INTO itestv10 DEFAULT VALUES;
INSERT INTO itestv11 DEFAULT VALUES;
INSERT INTO itestv11 DEFAULT VALUES;
SELECT * FROM itestv10;
 a | b 
---+---
 1 | 
 2 | 
(2 rows)

SELECT * FROM itestv11;
 a | b 
---+---
 1 | 
 2 | 
(2 rows)

INSERT INTO itestv10 VALUES (10, 'xyz');
INSERT INTO itestv10 OVERRIDING USER VALUE VALUES (11, 'xyz');
SELECT * FROM itestv10 order by 1, 2;
 a  |  b  
----+-----
  1 | 
  2 | 
  3 | xyz
 10 | xyz
(4 rows)

INSERT INTO itestv11 VALUES (10, 'xyz');
ERROR:  cannot insert a non-DEFAULT value into column "a"
DETAIL:  Column "a" is an identity column defined as "GENERATED ALWAYS".
HINT:  Use OVERRIDING SYSTEM VALUE to override.
INSERT INTO itestv11 OVERRIDING SYSTEM VALUE VALUES (11, 'xyz');
SELECT * FROM itestv11 order by 1, 2;
 a  |  b  
----+-----
  1 | 
  2 | 
 11 | xyz
(3 rows)

CREATE TABLE itest12 (a int NOT NULL, b text);
CREATE VIEW itestv12 AS SELECT * FROM itest12;
ALTER VIEW itestv12 alter column a add generated by default as identity; -- error
NOTICE:  ALTER TABLE will create implicit sequence "itestv12_a_seq" for serial column "itestv12.a"
ERROR:  column "a" of relation "itestv12" must be declared NOT NULL before identity can be added
ALTER VIEW itestv12 alter column a SET NOT NULL; -- error
ERROR:  "itestv12" is not a table or foreign table
ALTER VIEW itestv12 alter column a RESTART; -- error
ERROR:  column "a" of relation "itestv12" is not an identity column
ALTER VIEW itestv12 alter column a drop identity; -- error
ERROR:  column "a" of relation "itestv12" is not an identity column
\d+ itestv12;
                View "public.itestv12"
 Column |  Type   | Modifiers | Storage  | Description 
--------+---------+-----------+----------+-------------
 a      | integer |           | plain    | 
 b      | text    |           | extended | 
View definition:
 SELECT  *
   FROM itest12;

DROP VIEW itestv12;
DROP TABLE itest12;
--## ALTER xxx alter column add/set/drop identity
create sequence saaa;
ALTER SEQUENCE saaa alter column max_value add generated always as identity; -- error
NOTICE:  ALTER TABLE will create implicit sequence "saaa_max_value_seq" for serial column "saaa.max_value"
ERROR:  "saaa" is of the wrong type
create table test_t1 (a int);
create materialized view mv as select * from test_t1;
ALTER MATERIALIZED VIEW mv alter column a add generated by default as identity; -- error
NOTICE:  ALTER TABLE will create implicit sequence "mv_a_seq" for serial column "mv.a"
ERROR:  ALTER MATERIALIZED VIEW is not yet supported.
DROP TABLE test_t1;
DROP sequence saaa;
DROP MATERIALIZED VIEW mv;
--## inheritance
CREATE TABLE itest7 (a int GENERATED ALWAYS AS IDENTITY (maxvalue 100));
NOTICE:  CREATE TABLE will create implicit sequence "itest7_a_seq" for serial column "itest7.a"
INSERT INTO itest7 DEFAULT VALUES;
SELECT * FROM itest7;
 a 
---
 1
(1 row)

-- identity property is not inherited
CREATE TABLE itest7a (b text) INHERITS (itest7);
\d+ itest7a
                        Table "public.itest7a"
 Column |  Type   | Modifiers | Storage  | Stats target | Description 
--------+---------+-----------+----------+--------------+-------------
 a      | integer | not null  | plain    |              | 
 b      | text    |           | extended |              | 
Inherits: itest7
Has OIDs: no
Options: orientation=row, compression=no

-- make column identity in child table
CREATE TABLE itest7b (a int);
CREATE TABLE itest7c (a int GENERATED ALWAYS AS IDENTITY) INHERITS (itest7b);
NOTICE:  CREATE TABLE will create implicit sequence "itest7c_a_seq" for serial column "itest7c.a"
NOTICE:  merging column "a" with inherited definition
INSERT INTO itest7c DEFAULT VALUES;
SELECT * FROM itest7c;
 a 
---
 1
(1 row)

CREATE TABLE itest7d (a int not null);
CREATE TABLE itest7e () INHERITS (itest7d);
ALTER TABLE itest7d ALTER COLUMN a ADD GENERATED ALWAYS AS IDENTITY;
NOTICE:  ALTER TABLE will create implicit sequence "itest7d_a_seq" for serial column "itest7d.a"
ALTER TABLE itest7d ADD COLUMN b int GENERATED ALWAYS AS IDENTITY;  -- error
NOTICE:  ALTER TABLE will create implicit sequence "itest7d_b_seq" for serial column "itest7d.b"
ERROR:  cannot recursively add identity column to table that has child tables
SELECT table_name, column_name, is_nullable, is_identity, identity_generation FROM information_schema.columns WHERE table_name LIKE 'itest7%' ORDER BY 1, 2;
 table_name | column_name | is_nullable | is_identity | identity_generation 
------------+-------------+-------------+-------------+---------------------
 itest7     | a           | NO          | YES         | ALWAYS
 itest7a    | a           | NO          | NO          | 
 itest7a    | b           | YES         | NO          | 
 itest7b    | a           | YES         | NO          | 
 itest7c    | a           | NO          | YES         | ALWAYS
 itest7d    | a           | NO          | YES         | ALWAYS
 itest7e    | a           | NO          | NO          | 
(7 rows)

-- These ALTER TABLE variants will not recurse.
ALTER TABLE itest7 ALTER COLUMN a SET GENERATED BY DEFAULT;
ALTER TABLE itest7 ALTER COLUMN a RESTART;
ALTER TABLE itest7 ALTER COLUMN a DROP IDENTITY;
--## pbe
CREATE TABLE test_t1 (a int PRIMARY KEY GENERATED ALWAYS AS IDENTITY , b text);
NOTICE:  CREATE TABLE will create implicit sequence "test_t1_a_seq" for serial column "test_t1.a"
NOTICE:  CREATE TABLE / PRIMARY KEY will create implicit index "test_t1_pkey" for table "test_t1"
INSERT INTO test_t1 VALUES (DEFAULT, default);
PREPARE p1 AS INSERT INTO test_t1 OVERRIDING SYSTEM VALUE VALUES($1, $2); -- error
PREPARE p2 AS INSERT INTO test_t1 OVERRIDING SYSTEM VALUE VALUES($1, $2) ON DUPLICATE KEY UPDATE b = $3; -- success
EXECUTE p1 (1, 'xxxx');
ERROR:  duplicate key value violates unique constraint "test_t1_pkey"
DETAIL:  Key (a)=(1) already exists.
EXECUTE p2 (1, 'setb', 'setb');
DEALLOCATE p1;
DEALLOCATE p2;
select * from test_t1 order by 1, 2;
 a |  b   
---+------
 1 | setb
(1 row)

DROP TABLE test_t1;
--## partitoned table
CREATE TABLE par_row_t1 (a int, b text) partition by range (a)
(
    partition par_row_t1_p0 values less than(10),
    partition par_row_t1_p3 values less than (maxvalue)
);
ALTER TABLE par_row_t1 ALTER COLUMN a ADD GENERATED ALWAYS AS IDENTITY; -- error
NOTICE:  ALTER TABLE will create implicit sequence "par_row_t1_a_seq" for serial column "par_row_t1.a"
ERROR:  cannot add identity to partitioned table "par_row_t1"
ALTER TABLE par_row_t1 ALTER COLUMN a SET GENERATED BY DEFAULT; -- error
ERROR:  cannot set identity to partitioned table "par_row_t1"
ALTER TABLE par_row_t1 ALTER COLUMN a DROP IDENTITY; -- error
ERROR:  cannot drop identity of partitioned table "par_row_t1"
ALTER TABLE par_row_t1 ALTER COLUMN a DROP IDENTITY IF EXISTS; -- error
ERROR:  cannot drop identity of partitioned table "par_row_t1"
ALTER TABLE par_row_t1 ADD COLUMN c int GENERATED ALWAYS AS IDENTITY; -- error
NOTICE:  ALTER TABLE will create implicit sequence "par_row_t1_c_seq" for serial column "par_row_t1.c"
DROP TABLE par_row_t1;
--## NUMERIC test
CREATE TABLE test_t1 (a NUMERIC(12, 0) PRIMARY KEY GENERATED ALWAYS AS IDENTITY(START WITH 1010101010101), b text); -- error
NOTICE:  CREATE TABLE will create implicit sequence "test_t1_a_seq" for serial column "test_t1.a"
ERROR:  START value (1010101010101) cannot be greater than MAXVALUE (999999999999)
CREATE TABLE test_t1 (a NUMERIC(12, 0) PRIMARY KEY GENERATED ALWAYS AS IDENTITY(START WITH 101010101010), b text);
NOTICE:  CREATE TABLE will create implicit sequence "test_t1_a_seq" for serial column "test_t1.a"
NOTICE:  CREATE TABLE / PRIMARY KEY will create implicit index "test_t1_pkey" for table "test_t1"
INSERT INTO test_t1 DEFAULT VALUES; -- success
INSERT INTO test_t1 VALUES(101010101010, 'xxxx'); -- error
ERROR:  cannot insert a non-DEFAULT value into column "a"
DETAIL:  Column "a" is an identity column defined as "GENERATED ALWAYS".
HINT:  Use OVERRIDING SYSTEM VALUE to override.
INSERT INTO test_t1 OVERRIDING SYSTEM VALUE VALUES(10, 'xxxx'); -- success
INSERT INTO test_t1 OVERRIDING USER VALUE VALUES(10, 'xxxx'); -- success
SELECT * from test_t1 order by 1, 2;
      a       |  b   
--------------+------
           10 | xxxx
 101010101010 | 
 101010101011 | xxxx
(3 rows)

create table test_t2(id numeric(25, 0) GENERATED ALWAYS AS IDENTITY(START WITH 987654321098765432100000 INCREMENT 2), id1 serial, name varchar(10)); -- success
NOTICE:  CREATE TABLE will create implicit sequence "test_t2_id_seq" for serial column "test_t2.id"
NOTICE:  CREATE TABLE will create implicit sequence "test_t2_id1_seq" for serial column "test_t2.id1"
\d+ test_t2
                                                     Table "public.test_t2"
 Column |         Type          |                       Modifiers                       | Storage  | Stats target | Description 
--------+-----------------------+-------------------------------------------------------+----------+--------------+-------------
 id     | numeric(25,0)         | not null generated always as identity                 | main     |              | 
 id1    | integer               | not null default nextval('test_t2_id1_seq'::regclass) | plain    |              | 
 name   | character varying(10) |                                                       | extended |              | 
Has OIDs: no
Options: orientation=row, compression=no

DROP TABLE test_t1, test_t2;
--## ALTER SET IDENTITY tests
CREATE TABLE test_t1 (a int GENERATED ALWAYS AS IDENTITY(START WITH 4) , b text);
NOTICE:  CREATE TABLE will create implicit sequence "test_t1_a_seq" for serial column "test_t1.a"
\d+ test_t1_a_seq;
             Sequence "public.test_t1_a_seq"
    Column     |  Type   |        Value        | Storage 
---------------+---------+---------------------+---------
 sequence_name | name    | test_t1_a_seq       | plain
 last_value    | bigint  | 4                   | plain
 start_value   | bigint  | 4                   | plain
 increment_by  | bigint  | 1                   | plain
 max_value     | bigint  | 9223372036854775807 | plain
 min_value     | bigint  | 1                   | plain
 cache_value   | bigint  | 1                   | plain
 log_cnt       | bigint  | 0                   | plain
 is_cycled     | boolean | f                   | plain
 is_called     | boolean | f                   | plain
 uuid          | bigint  | 0                   | plain
 is_global     | boolean | f                   | plain
Sequence for identity column: public.test_t1.a

ALTER TABLE test_t1 ALTER COLUMN a SET START WITH 10; -- success
ALTER TABLE test_t1 ALTER COLUMN a SET INCREMENT BY 2; -- success
\d+ test_t1_a_seq;
             Sequence "public.test_t1_a_seq"
    Column     |  Type   |        Value        | Storage 
---------------+---------+---------------------+---------
 sequence_name | name    | test_t1_a_seq       | plain
 last_value    | bigint  | 4                   | plain
 start_value   | bigint  | 10                  | plain
 increment_by  | bigint  | 2                   | plain
 max_value     | bigint  | 9223372036854775807 | plain
 min_value     | bigint  | 1                   | plain
 cache_value   | bigint  | 1                   | plain
 log_cnt       | bigint  | 0                   | plain
 is_cycled     | boolean | f                   | plain
 is_called     | boolean | f                   | plain
 uuid          | bigint  | 0                   | plain
 is_global     | boolean | f                   | plain
Sequence for identity column: public.test_t1.a

ALTER TABLE test_t1 ALTER COLUMN a SET MAXVALUE 3; -- error
ERROR:  START value (10) cannot be greater than MAXVALUE (3)
ALTER TABLE test_t1 ALTER COLUMN a SET MAXVALUE 20; -- success
ALTER TABLE test_t1 ALTER COLUMN a SET MINVALUE 9; -- error
ERROR:  RESTART value (4) cannot be less than MINVALUE (9)
ALTER TABLE test_t1 ALTER COLUMN a SET MINVALUE 2; -- success
ALTER TABLE test_t1 ALTER COLUMN a SET RESTART; -- error
ERROR:  sequence option "restart" not supported here
LINE 1: ALTER TABLE test_t1 ALTER COLUMN a SET RESTART;
                                               ^
ALTER TABLE test_t1 ALTER COLUMN a SET NOCYCLE; -- success
ALTER TABLE test_t1 ALTER COLUMN a SET CACHE 10; -- success
\d+ test_t1_a_seq;
          Sequence "public.test_t1_a_seq"
    Column     |  Type   |     Value     | Storage 
---------------+---------+---------------+---------
 sequence_name | name    | test_t1_a_seq | plain
 last_value    | bigint  | 4             | plain
 start_value   | bigint  | 10            | plain
 increment_by  | bigint  | 2             | plain
 max_value     | bigint  | 20            | plain
 min_value     | bigint  | 2             | plain
 cache_value   | bigint  | 10            | plain
 log_cnt       | bigint  | 0             | plain
 is_cycled     | boolean | f             | plain
 is_called     | boolean | f             | plain
 uuid          | bigint  | 0             | plain
 is_global     | boolean | f             | plain
Sequence for identity column: public.test_t1.a

INSERT INTO test_t1 DEFAULT VALUES;
INSERT INTO test_t1 DEFAULT VALUES;
SELECT * FROM test_t1 order by 1, 2;
 a | b 
---+---
 4 | 
 6 | 
(2 rows)

ALTER TABLE test_t1 ALTER COLUMN a SET NOMAXVALUE; -- success
ALTER TABLE test_t1 ALTER COLUMN a SET NOMINVALUE; -- success
ALTER TABLE test_t1 ALTER COLUMN a RESTART WITH 10; -- success
ALTER TABLE test_t1 ALTER COLUMN a RESTART 11111; -- success
ALTER TABLE test_t1 ALTER COLUMN a SET RESTART 11; -- error
ERROR:  sequence option "restart" not supported here
LINE 1: ALTER TABLE test_t1 ALTER COLUMN a SET RESTART 11;
                                               ^
\d+ test_t1_a_seq;
             Sequence "public.test_t1_a_seq"
    Column     |  Type   |        Value        | Storage 
---------------+---------+---------------------+---------
 sequence_name | name    | test_t1_a_seq       | plain
 last_value    | bigint  | 11111               | plain
 start_value   | bigint  | 10                  | plain
 increment_by  | bigint  | 2                   | plain
 max_value     | bigint  | 9223372036854775807 | plain
 min_value     | bigint  | 1                   | plain
 cache_value   | bigint  | 10                  | plain
 log_cnt       | bigint  | 0                   | plain
 is_cycled     | boolean | f                   | plain
 is_called     | boolean | f                   | plain
 uuid          | bigint  | 0                   | plain
 is_global     | boolean | f                   | plain
Sequence for identity column: public.test_t1.a

INSERT INTO test_t1 DEFAULT VALUES;
INSERT INTO test_t1 DEFAULT VALUES;
SELECT * FROM test_t1 order by 1, 2;
   a   | b 
-------+---
     4 | 
     6 | 
 11111 | 
 11113 | 
(4 rows)

-- numeric/large sequence
create table test_t2 (a int generated always as identity, b int);
NOTICE:  CREATE TABLE will create implicit sequence "test_t2_a_seq" for serial column "test_t2.a"
alter table test_t2 add column c numeric(20, 0) generated by default as identity;
NOTICE:  ALTER TABLE will create implicit sequence "test_t2_c_seq" for serial column "test_t2.c"
alter table test_t2 alter column c set generated always set start with 10;
\d+ test_t2
                                        Table "public.test_t2"
 Column |     Type      |               Modifiers               | Storage | Stats target | Description 
--------+---------------+---------------------------------------+---------+--------------+-------------
 a      | integer       | not null generated always as identity | plain   |              | 
 b      | integer       |                                       | plain   |              | 
 c      | numeric(20,0) | not null generated always as identity | main    |              | 
Has OIDs: no
Options: orientation=row, compression=no

DROP sequence test_t1_a_seq; -- error
ERROR:  cannot drop sequence test_t1_a_seq because table test_t1 column a requires it
HINT:  You can drop table test_t1 column a instead.
DROP TABLE test_t1, test_t2;
--## privileges
CREATE USER regress_user1 WITH PASSWORD 'Gauss@123';
CREATE TABLE itest8 (a int GENERATED ALWAYS AS IDENTITY, b text);
NOTICE:  CREATE TABLE will create implicit sequence "itest8_a_seq" for serial column "itest8.a"
GRANT SELECT, INSERT ON itest8 TO regress_user1;
SET ROLE regress_user1 PASSWORD 'Gauss@123';
INSERT INTO itest8 DEFAULT VALUES;
SELECT * FROM itest8;
 a | b 
---+---
 1 | 
(1 row)

RESET ROLE;
DROP TABLE itest8;
DROP USER regress_user1;
--## gs_catalog_attribute_records
SELECT attidentity, attnum FROM gs_catalog_attribute_records(1249) ORDER BY attnum LIMIT 1;
 attidentity | attnum 
-------------+--------
             |      1
(1 row)

--## B format tests
create database test_pg_identity_B dbcompatibility 'B';
\c test_pg_identity_B
-- error
CREATE TABLE test_t1 (a int GENERATED ALWAYS AS IDENTITY ON UPDATE CURRENT_TIMESTAMP, b text);
NOTICE:  CREATE TABLE will create implicit sequence "test_t1_a_seq" for serial column "test_t1.a"
ERROR:  column "a" is of type integer but default expression is of type timestamp with time zone
HINT:  You will need to rewrite or cast the expression.
--## multi update tests, B/D format
CREATE TABLE test_t1 (a int GENERATED ALWAYS AS IDENTITY PRIMARY KEY, b text);
NOTICE:  CREATE TABLE will create implicit sequence "test_t1_a_seq" for serial column "test_t1.a"
NOTICE:  CREATE TABLE / PRIMARY KEY will create implicit index "test_t1_pkey" for table "test_t1"
CREATE TABLE test_t2 (a int GENERATED BY DEFAULT AS IDENTITY PRIMARY KEY, b text);
NOTICE:  CREATE TABLE will create implicit sequence "test_t2_a_seq" for serial column "test_t2.a"
NOTICE:  CREATE TABLE / PRIMARY KEY will create implicit index "test_t2_pkey" for table "test_t2"
INSERT INTO test_t1 DEFAULT VALUES;
INSERT INTO test_t2 DEFAULT VALUES;
UPDATE test_t1, test_t2 SET test_t1.b = 't1', test_t2.b = 't2'; --success
UPDATE test_t1, test_t2 SET test_t1.a = 2, test_t2.b = 't2'; --error
ERROR:  column "a" can only be updated to DEFAULT
DETAIL:  Column "a" is an identity column defined as "GENERATED ALWAYS".
UPDATE test_t1, test_t2 SET test_t1.b = 't1', test_t2.a = 2; --success
UPDATE test_t1, test_t2 SET test_t1.a = DEFAULT, test_t2.b = 't2'; --success
UPDATE test_t1, test_t2 SET test_t1.b = 't1', test_t2.a = DEFAULT; --success
SELECT * FROM test_t1 order by 1, 2;
 a | b  
---+----
 2 | t1
(1 row)

SELECT * FROM test_t2 order by 1, 2;
 a | b  
---+----
 2 | t2
(1 row)

DROP TABLE test_t1, test_t2;
-- multi update
CREATE TABLE test_t1 (a int GENERATED ALWAYS AS IDENTITY PRIMARY KEY, b text);
NOTICE:  CREATE TABLE will create implicit sequence "test_t1_a_seq" for serial column "test_t1.a"
NOTICE:  CREATE TABLE / PRIMARY KEY will create implicit index "test_t1_pkey" for table "test_t1"
CREATE TABLE test_t2 (a int GENERATED BY DEFAULT AS IDENTITY PRIMARY KEY, b text);
NOTICE:  CREATE TABLE will create implicit sequence "test_t2_a_seq" for serial column "test_t2.a"
NOTICE:  CREATE TABLE / PRIMARY KEY will create implicit index "test_t2_pkey" for table "test_t2"
INSERT INTO test_t1 DEFAULT VALUES;
INSERT INTO test_t2 DEFAULT VALUES;
UPDATE test_t2, (SELECT a, b FROM test_t1 WHERE a = 1) sup
    SET test_t2.a = DEFAULT, sup.a = DEFAULT;
ERROR:  UPDATE/DELETE/INSERT through subquery is only supported in A-format database
UPDATE (SELECT a, b FROM test_t1 WHERE a = 1) sup,
        (SELECT a, b FROM test_t1 WHERE a = 1) sup1
    SET sup1.a = DEFAULT, sup.a = DEFAULT;
ERROR:  UPDATE/DELETE/INSERT through subquery is only supported in A-format database
UPDATE (SELECT a, b FROM test_t1 WHERE a = 1) sup, test_t2
    SET test_t2.a = DEFAULT, sup.a = DEFAULT;
ERROR:  UPDATE/DELETE/INSERT through subquery is only supported in A-format database
create table test1 (a int, b int);
create table test2 (a int, b int);
INSERT INTO test1 DEFAULT VALUES;
INSERT INTO test2 DEFAULT VALUES;
update test1, test2 set test1.a = 1, test2.b = 1;
DROP TABLE test_t1, test_t2;
--## modify column syntax
CREATE TABLE test_at_ref(a int primary key);
NOTICE:  CREATE TABLE / PRIMARY KEY will create implicit index "test_at_ref_pkey" for table "test_at_ref"
CREATE TABLE test_t1(a int, b int GENERATED ALWAYS AS IDENTITY, c text, d int);
NOTICE:  CREATE TABLE will create implicit sequence "test_t1_b_seq" for serial column "test_t1.b"
CREATE TABLE par_row_t1 (a int, b text, c int) partition by range (a)
(
    partition par_row_t1_p0 values less than(10),
    partition par_row_t1_p3 values less than (maxvalue)
);
ALTER TABLE test_t1 MODIFY c int;
ALTER TABLE test_t1 MODIFY a int GENERATED BY DEFAULT AS IDENTITY; -- error
NOTICE:  ALTER TABLE will create implicit sequence "test_t1_a_seq" for serial column "test_t1.a"
ERROR:  Unsupported modify column operation
HINT:  Use ALTER TABLE ... ALTER COLUMN ... ADD IDENTITY instead.
ALTER TABLE test_t1 MODIFY b int GENERATED BY DEFAULT AS IDENTITY; -- error
NOTICE:  ALTER TABLE will create implicit sequence "test_t1_b_seq1" for serial column "test_t1.b"
ERROR:  Unsupported modify column operation
HINT:  Use ALTER TABLE ... ALTER COLUMN ... instead.
ALTER TABLE test_t1 MODIFY b int NULL; -- error
ERROR:  Unsupported modify column operation
HINT:  Use ALTER TABLE ... ALTER COLUMN ... instead.
ALTER TABLE test_t1 MODIFY b int DEFAULT 10; -- error
ERROR:  Unsupported modify column operation
HINT:  Use ALTER TABLE ... ALTER COLUMN ... instead.
ALTER TABLE test_t1 MODIFY b timestamptz on update current_timestamp; -- error
ERROR:  column "b" cannot be cast automatically to type timestamp with time zone
HINT:  Specify a USING expression to perform the conversion.
ALTER TABLE test_t1 MODIFY b int CONSTRAINT t_at_m_check CHECK (b < 3); -- error
ERROR:  Unsupported modify column operation
HINT:  Use ALTER TABLE ... ALTER COLUMN ... instead.
ALTER TABLE test_t1 MODIFY b int NOT NULL REFERENCES test_at_ref (a); 
ERROR:  Invalid modify column operation
DETAIL:  modify or change column REFERENCES constraint is not supported
ALTER TABLE test_t1 MODIFY b serial; -- error
ERROR:  Not supported alter identity column b type
ALTER TABLE test_t1 MODIFY b int AUTO_INCREMENT UNIQUE KEY; -- error
NOTICE:  ALTER TABLE will create implicit sequence "test_t1_b_seq1" for serial column "test_t1.b"
ERROR:  Unsupported modify column operation
HINT:  Use ALTER TABLE ... ALTER COLUMN ... instead.
ALTER TABLE test_t1 MODIFY COLUMN b int GENERATED ALWAYS AS (d+100) STORED; -- error
ERROR:  Unsupported modify column operation
HINT:  Use ALTER TABLE ... ALTER COLUMN ... instead.
ALTER TABLE test_t1 MODIFY b NULL; -- error
ERROR:  column "b" of relation "test_t1" is an identity column
ALTER TABLE test_t1 MODIFY b CONSTRAINT xxxx NULL; -- error
ERROR:  column "b" of relation "test_t1" is an identity column
ALTER TABLE test_t1 MODIFY b NOT NULL; -- success
ALTER TABLE par_row_t1 MODIFY c int GENERATED BY DEFAULT AS IDENTITY; -- error
NOTICE:  ALTER TABLE will create implicit sequence "par_row_t1_c_seq" for serial column "par_row_t1.c"
ERROR:  Unsupported modify column operation
HINT:  Use ALTER TABLE ... ALTER COLUMN ... ADD IDENTITY instead.
-- CHANGE column
ALTER TABLE test_t1 CHANGE a a text; -- success
ALTER TABLE test_t1 CHANGE a c text; -- error
ERROR:  column "c" of relation "test_t1" already exists
ALTER TABLE test_t1 CHANGE a a int GENERATED BY DEFAULT AS IDENTITY; -- error
NOTICE:  ALTER TABLE will create implicit sequence "test_t1_a_seq" for serial column "test_t1.a"
ERROR:  Unsupported modify column operation
HINT:  Use ALTER TABLE ... ALTER COLUMN ... ADD IDENTITY instead.
ALTER TABLE test_t1 CHANGE b b int GENERATED BY DEFAULT AS IDENTITY; -- error
NOTICE:  ALTER TABLE will create implicit sequence "test_t1_b_seq1" for serial column "test_t1.b"
ERROR:  Unsupported modify column operation
HINT:  Use ALTER TABLE ... ALTER COLUMN ... instead.
ALTER TABLE test_t1 CHANGE b b int NULL; -- error
ERROR:  Unsupported modify column operation
HINT:  Use ALTER TABLE ... ALTER COLUMN ... instead.
ALTER TABLE test_t1 CHANGE b b int DEFAULT 10; -- error
ERROR:  Unsupported modify column operation
HINT:  Use ALTER TABLE ... ALTER COLUMN ... instead.
ALTER TABLE test_t1 CHANGE b b timestamptz on update current_timestamp; -- error
ERROR:  column "b" cannot be cast automatically to type timestamp with time zone
HINT:  Specify a USING expression to perform the conversion.
ALTER TABLE test_t1 CHANGE b b int CONSTRAINT t_at_m_check CHECK (b < 3); -- error
ERROR:  Unsupported modify column operation
HINT:  Use ALTER TABLE ... ALTER COLUMN ... instead.
ALTER TABLE test_t1 CHANGE b b int NOT NULL REFERENCES test_at_ref (a); 
ERROR:  Invalid modify column operation
DETAIL:  modify or change column REFERENCES constraint is not supported
ALTER TABLE test_t1 CHANGE b b serial; -- error
ERROR:  Invalid modify column operation
DETAIL:  cannot modify or change column to type 'serial'
ALTER TABLE test_t1 CHANGE b b int AUTO_INCREMENT UNIQUE KEY; -- error
NOTICE:  ALTER TABLE will create implicit sequence "test_t1_b_seq1" for serial column "test_t1.b"
ERROR:  Unsupported modify column operation
HINT:  Use ALTER TABLE ... ALTER COLUMN ... instead.
ALTER TABLE test_t1 CHANGE COLUMN b b int GENERATED ALWAYS AS (d+100) STORED; -- error
ERROR:  Unsupported modify column operation
HINT:  Use ALTER TABLE ... ALTER COLUMN ... instead.
ALTER TABLE par_row_t1 CHANGE c c int GENERATED BY DEFAULT AS IDENTITY; -- error
NOTICE:  ALTER TABLE will create implicit sequence "par_row_t1_c_seq" for serial column "par_row_t1.c"
ERROR:  Unsupported modify column operation
HINT:  Use ALTER TABLE ... ALTER COLUMN ... ADD IDENTITY instead.
\d+ test_t1;
                                      Table "public.test_t1"
 Column |  Type   |               Modifiers               | Storage  | Stats target | Description 
--------+---------+---------------------------------------+----------+--------------+-------------
 a      | text    |                                       | extended |              | 
 b      | integer | not null generated always as identity | plain    |              | 
 c      | integer |                                       | plain    |              | 
 d      | integer |                                       | plain    |              | 
Has OIDs: no
Options: orientation=row, compression=no

INSERT INTO test_t1 DEFAULT VALUES;
INSERT INTO test_t1 DEFAULT VALUES;
SELECT * FROM test_t1 order by 1, 2;
 a | b | c | d 
---+---+---+---
   | 1 |   |  
   | 2 |   |  
(2 rows)

DROP TABLE test_t1, test_at_ref, par_row_t1;
CREATE TABLE test_t1 (a int GENERATED ALWAYS AS IDENTITY, b text, c int);
NOTICE:  CREATE TABLE will create implicit sequence "test_t1_a_seq" for serial column "test_t1.a"
CREATE TABLE test_t2 (a int GENERATED ALWAYS AS IDENTITY, b text, c int);
NOTICE:  CREATE TABLE will create implicit sequence "test_t2_a_seq" for serial column "test_t2.a"
INSERT INTO test_t1 DEFAULT VALUES;
INSERT INTO test_t2 DEFAULT VALUES;
UPDATE test_t2, (SELECT a, b FROM test_t1 WHERE a = 1) sup(a, b)
    SET sup.b = 'inline view updated', test_t2.b = 'inline view updated'; -- success
ERROR:  UPDATE/DELETE/INSERT through subquery is only supported in A-format database
SELECT * FROM test_t1 order by 1, 2;
 a | b | c 
---+---+---
 1 |   |  
(1 row)

SELECT * FROM test_t2 order by 1, 2;
 a | b | c 
---+---+---
 1 |   |  
(1 row)

DROP TABLE test_t1, test_t2;
-- REPLACE INTO
CREATE TABLE test_t1 (a int GENERATED ALWAYS AS IDENTITY, b text, c int);
NOTICE:  CREATE TABLE will create implicit sequence "test_t1_a_seq" for serial column "test_t1.a"
REPLACE INTO test_t1 (a, b, c) VALUES (1, 'alice', 25); -- error
ERROR:  cannot insert a non-DEFAULT value into column "a"
DETAIL:  Column "a" is an identity column defined as "GENERATED ALWAYS".
HINT:  Use OVERRIDING SYSTEM VALUE to override.
-- error REPLACE can not work on sequence!
REPLACE INTO test_t1 (a, b, c) OVERRIDING SYSTEM VALUE VALUES (1, 'alice', 25);
ERROR:  REPLACE can not work on sequence!
\c regression
DROP DATABASE test_pg_identity;
DROP DATABASE test_pg_identity_B;
