/*
################################################################################
# TESTCASE NAME : plpgsql_savepoint
# COMPONENT(S)  : plpgsql savepoint
################################################################################
*/
CREATE TABLE pl_txn_t(tc1 INT, tc2 INT);
-- normal case 1
CREATE OR REPLACE PROCEDURE sp_normal_1 IS
  BEGIN
    INSERT INTO pl_txn_t VALUES(1, 1);
    SAVEPOINT SAVE_A;

    INSERT INTO pl_txn_t VALUES(2, 2);
    SAVEPOINT SAVE_B;

    INSERT INTO pl_txn_t VALUES(3, 3);
    SAVEPOINT SAVE_C;

    INSERT INTO pl_txn_t VALUES(4, 4);
    INSERT INTO pl_txn_t VALUES(5, 5);
    ROLLBACK TO SAVEPOINT SAVE_C;

    INSERT INTO pl_txn_t VALUES(6, 6);
    ROLLBACK TO SAVEPOINT SAVE_B;

    INSERT INTO pl_txn_t VALUES(2, 2);
    ROLLBACK TO SAVEPOINT SAVE_A;
  END;
  /
SELECT sp_normal_1();
 sp_normal_1 
-------------
 
(1 row)

COMMIT;
WARNING:  there is no transaction in progress
SELECT sp_normal_1(), sp_normal_1();
 sp_normal_1 | sp_normal_1 
-------------+-------------
             | 
(1 row)

DROP PROCEDURE sp_normal_1;
-- normal case 2
CREATE OR REPLACE PROCEDURE sp_normal_2 IS
  BEGIN
    SAVEPOINT
          SAVE_A;
    INSERT INTO pl_txn_t VALUES(1, 1);
    ROLLBACK TO SAVEPOINT
          SAVE_A;
    SAVEPOINT B;
  END;
  /
SELECT sp_normal_2();
 sp_normal_2 
-------------
 
(1 row)

BEGIN;
SELECT sp_normal_2();
 sp_normal_2 
-------------
 
(1 row)

SELECT sp_normal_2();  -- 执行失败，暂不支持语句外部SAVEPOINT
 sp_normal_2 
-------------
 
(1 row)

COMMIT;
DROP PROCEDURE sp_normal_2;
-- savepoint name as variable in PL
CREATE OR REPLACE PROCEDURE sp_name_variable IS
    sp_name NVARCHAR2(100) := 'SAVE_A';
  BEGIN
    SAVEPOINT sp_name;
    ROLLBACK TO sp_name;
  END;
  /
CALL sp_name_variable();
 sp_name_variable 
------------------
 
(1 row)

CREATE OR REPLACE PROCEDURE sp_name_variable IS
    sp_name NVARCHAR2(100) := 'SAVE_A';
  BEGIN
    SAVEPOINT sp_name;
    ROLLBACK TO SAVE_A;   -- no such savepoint
  END;
  /
CALL sp_name_variable();
ERROR:  no such savepoint
CONTEXT:  PL/pgSQL function sp_name_variable() line 4 at ROLLBACK TO SAVEPOINT
DROP PROCEDURE sp_name_variable;
-- length of savepoint name is too big.
CREATE OR REPLACE PROCEDURE sp_name_length IS
  BEGIN
    SAVEPOINT sp_name_xxxxxxxxxxxxxxxxxxxxxxxxxxxxxxxxxxxxxxxxxxxxxxxxxxxxxxxxxxxxxxxxxxxxxxxxx;
    ROLLBACK TO sp_name_xxxxxxxxxxxxxxxxxxxxxxxxxxxxxxxxxxxxxxxxxxxxxxxxxxxxxxxxxxxxxxxxxxxxxxxxx;
  END;
  /
NOTICE:  identifier "sp_name_xxxxxxxxxxxxxxxxxxxxxxxxxxxxxxxxxxxxxxxxxxxxxxxxxxxxxxxxxxxxxxxxxxxxxxxxx" will be truncated to "sp_name_xxxxxxxxxxxxxxxxxxxxxxxxxxxxxxxxxxxxxxxxxxxxxxxxxxxxxxx"
NOTICE:  identifier "sp_name_xxxxxxxxxxxxxxxxxxxxxxxxxxxxxxxxxxxxxxxxxxxxxxxxxxxxxxxxxxxxxxxxxxxxxxxxx" will be truncated to "sp_name_xxxxxxxxxxxxxxxxxxxxxxxxxxxxxxxxxxxxxxxxxxxxxxxxxxxxxxx"
NOTICE:  identifier "sp_name_xxxxxxxxxxxxxxxxxxxxxxxxxxxxxxxxxxxxxxxxxxxxxxxxxxxxxxxxxxxxxxxxxxxxxxxxx" will be truncated to "sp_name_xxxxxxxxxxxxxxxxxxxxxxxxxxxxxxxxxxxxxxxxxxxxxxxxxxxxxxx"
CONTEXT:  compilation of PL/pgSQL function "sp_name_length" near line 1
NOTICE:  identifier "sp_name_xxxxxxxxxxxxxxxxxxxxxxxxxxxxxxxxxxxxxxxxxxxxxxxxxxxxxxxxxxxxxxxxxxxxxxxxx" will be truncated to "sp_name_xxxxxxxxxxxxxxxxxxxxxxxxxxxxxxxxxxxxxxxxxxxxxxxxxxxxxxx"
CONTEXT:  compilation of PL/pgSQL function "sp_name_length" near line 2
CALL sp_name_length();
 sp_name_length 
----------------
 
(1 row)

-- no savepoint outside statement
CREATE OR REPLACE PROCEDURE sp_no_outside IS
  BEGIN
    INSERT INTO pl_txn_t VALUES(1, 1);
    COMMIT;
    ROLLBACK TO SAVEPOINT SAVE_A;
  END;
  /
CALL sp_no_outside();
ERROR:  no such savepoint
CONTEXT:  PL/pgSQL function sp_no_outside() line 4 at ROLLBACK TO SAVEPOINT
BEGIN;
SAVEPOINT SAVE_A;
ROLLBACK TO SAVEPOINT SAVE_A;
SELECT sp_no_outside();
ERROR:  commit/rollback is not allowed in outer sub transaction block.
CONTEXT:  PL/pgSQL function sp_no_outside() line 3 at COMMIT
referenced column: sp_no_outside
ROLLBACK;
BEGIN;
SAVEPOINT SAVE_A;
RELEASE SAVEPOINT SAVE_A;
CALL sp_no_outside();
ERROR:  no such savepoint
CONTEXT:  PL/pgSQL function sp_no_outside() line 4 at ROLLBACK TO SAVEPOINT
ROLLBACK;
DROP PROCEDURE sp_no_outside;
-- savepoint + commit / rollback
CREATE OR REPLACE PROCEDURE sp_commit_rollback(p INT) IS
  BEGIN
    INSERT INTO pl_txn_t VALUES(1, 1);
    SAVEPOINT SAVE_A;
    IF p%2 = 0 then
      ROLLBACK;
    ELSE
      COMMIT;
    END IF;
  END;
  /
SELECT sp_commit_rollback(0);
 sp_commit_rollback 
--------------------
 
(1 row)

SELECT sp_commit_rollback(1);
 sp_commit_rollback 
--------------------
 
(1 row)

CREATE OR REPLACE PROCEDURE sp_commit_rollback IS
  BEGIN
    SAVEPOINT save_a;
    INSERT INTO pl_txn_t VALUES(1, 1);
    ROLLBACK TO save_a;
    COMMIT;
  END;
  /
CALL sp_commit_rollback();
 sp_commit_rollback 
--------------------
 
(1 row)

DROP PROCEDURE sp_commit_rollback;
CREATE OR REPLACE PROCEDURE pl_commit IS
  BEGIN
    INSERT INTO pl_txn_t VALUES(1, 1);
    COMMIT;
  END;
  /
SELECT pl_commit();
 pl_commit 
-----------
 
(1 row)

DROP PROCEDURE pl_commit;
CREATE OR REPLACE PROCEDURE commit_drop_sp IS
  BEGIN
    INSERT INTO pl_txn_t VALUES(1, 1);
    SAVEPOINT SAVE_1;
    INSERT INTO pl_txn_t VALUES(2, 2);
    SAVEPOINT SAVE_2;
    COMMIT;
    INSERT INTO pl_txn_t VALUES(4, 4);
    ROLLBACK TO SAVEPOINT SAVE_1;  --commit已删除了SAVE_1
  END;
  /
SELECT commit_drop_sp();  -- no such savepoint
ERROR:  no such savepoint
CONTEXT:  PL/pgSQL function commit_drop_sp() line 8 at ROLLBACK TO SAVEPOINT
referenced column: commit_drop_sp
DROP PROCEDURE commit_drop_sp;
-- savepoint in cursor
CREATE OR REPLACE FUNCTION sp_inner RETURN INTEGER
AS
  BEGIN
    SAVEPOINT save_a;
    COMMIT;
    SAVEPOINT save_a;
    RETURN 1;
  END;
  /
CREATE OR REPLACE PROCEDURE sp_in_cursor IS
    CURSOR c1 FOR SELECT sp_inner() FROM pl_txn_t;
    val INT;
  BEGIN
    SAVEPOINT save_a;
    OPEN c1;
    FETCH c1 INTO val;
    CLOSE c1;
  EXCEPTION
    WHEN OTHERS THEN
       RAISE NOTICE 'wrong 1'; 
  END;
  /
SELECT sp_in_cursor(); 
NOTICE:  wrong 1
CONTEXT:  referenced column: sp_in_cursor
 sp_in_cursor 
--------------
 
(1 row)

DROP PROCEDURE sp_in_cursor;
DROP PROCEDURE sp_inner;
CREATE OR REPLACE FUNCTION sp_inner  RETURN INTEGER
AS
  BEGIN
    ROLLBACK TO save_axxxxxxxxxxxxxxxxxxxxxxxxxxxxxxxxxxxxxxxxxxxxxxxxxxxxxxxxxxxxxxxxxxxxxxxxxx;
    RETURN 1;
  END;
  /
NOTICE:  identifier "save_axxxxxxxxxxxxxxxxxxxxxxxxxxxxxxxxxxxxxxxxxxxxxxxxxxxxxxxxxxxxxxxxxxxxxxxxxx" will be truncated to "save_axxxxxxxxxxxxxxxxxxxxxxxxxxxxxxxxxxxxxxxxxxxxxxxxxxxxxxxxx"
NOTICE:  identifier "save_axxxxxxxxxxxxxxxxxxxxxxxxxxxxxxxxxxxxxxxxxxxxxxxxxxxxxxxxxxxxxxxxxxxxxxxxxx" will be truncated to "save_axxxxxxxxxxxxxxxxxxxxxxxxxxxxxxxxxxxxxxxxxxxxxxxxxxxxxxxxx"
CONTEXT:  compilation of PL/pgSQL function "sp_inner" near line 1
CREATE OR REPLACE PROCEDURE sp_in_cursor is
    CURSOR c1 FOR SELECT sp_inner() FROM pl_txn_t;
    val INT;
  BEGIN
    SAVEPOINT save_a;
    OPEN c1;
    FETCH c1 INTO val;
    CLOSE c1;
  END;
  /
CALL sp_in_cursor();
ERROR:  transaction statement in store procedure used as cursor is not supported
CONTEXT:  PL/pgSQL function sp_inner() line 2 at ROLLBACK TO SAVEPOINT
referenced column: sp_inner
PL/pgSQL function sp_in_cursor() line 6 at FETCH
DROP PROCEDURE sp_in_cursor;
DROP PROCEDURE sp_inner;
-- savepoint in subroutine
CREATE OR REPLACE PROCEDURE sp_subroutine IS
  BEGIN
    SAVEPOINT save_0;
    INSERT INTO pl_txn_t VALUES(1, 1);
    ROLLBACK TO save_0;
    SAVEPOINT save_2;
    SAVEPOINT save_3;
  END;
  /
CREATE OR REPLACE PROCEDURE sp_in_subroutine IS
  BEGIN
    SAVEPOINT save_1;
    sp_subroutine();
    INSERT INTO pl_txn_t VALUES(1, 1);
    ROLLBACK TO save_1;
    INSERT INTO pl_txn_t VALUES(2, 2);
  END;
  /
SELECT sp_in_subroutine();
 sp_in_subroutine 
------------------
 
(1 row)

SELECT sp_in_subroutine();
 sp_in_subroutine 
------------------
 
(1 row)

CREATE OR REPLACE PROCEDURE sp_in_subroutine IS
  BEGIN
    sp_subroutine();
    sp_subroutine();
  END;
  /
SELECT sp_in_subroutine();
 sp_in_subroutine 
------------------
 
(1 row)

DROP PROCEDURE sp_in_subroutine;
DROP PROCEDURE sp_subroutine;
-- duplicate name
CREATE OR REPLACE PROCEDURE sp_duplicate_name IS
  BEGIN
    INSERT INTO pl_txn_t VALUES(1, 1);
    SAVEPOINT SAVE_A;
    ROLLBACK TO SAVEPOINT SAVE_A;
    SAVEPOINT SAVE_A;
    ROLLBACK TO SAVEPOINT SAVE_A;
  END;
  /
SELECT sp_duplicate_name();
 sp_duplicate_name 
-------------------
 
(1 row)

DROP PROCEDURE sp_duplicate_name;
-- savepoint in SPI executor context
CREATE OR REPLACE PROCEDURE pl_subroutine IS
  BEGIN
    INSERT INTO pl_txn_t VALUES(1, 1);
    ROLLBACK;   -- 该行会销毁PopOverrideSearchPath，导致不匹配
  END;
  /
CREATE OR REPLACE PROCEDURE sp_spi_rollback IS
  BEGIN
    SAVEPOINT save_1;
    pl_subroutine();
  END;
  /
SELECT sp_spi_rollback();
 sp_spi_rollback 
-----------------
 
(1 row)

DROP PROCEDURE sp_spi_rollback;
DROP PROCEDURE pl_subroutine;
CREATE OR REPLACE PROCEDURE pl_subroutine IS
  BEGIN
    INSERT INTO pl_txn_t VALUES(1, 1);
    ROLLBACK TO save_1;  -- 该行会销毁SavepointTest0的调用上下文
  END;
  /
CREATE OR REPLACE PROCEDURE sp_spi_rollbackto IS
  BEGIN
    SAVEPOINT save_1;
    --ROLLBACK;
    pl_subroutine();
    INSERT INTO pl_txn_t VALUES(2, 2);
    ROLLBACK TO save_1;
    INSERT INTO pl_txn_t VALUES(3, 3);
  END;
  /
SELECT sp_spi_rollbackto();
 sp_spi_rollbackto 
-------------------
 
(1 row)

SELECT sp_spi_rollbackto();
 sp_spi_rollbackto 
-------------------
 
(1 row)

DROP PROCEDURE sp_spi_rollbackto;
DROP PROCEDURE pl_subroutine;
-- savepoint + subroutine's commit/rollback
CREATE OR REPLACE PROCEDURE pl_commit IS
  BEGIN
    COMMIT;        -- snapshot destoryed when substransaction finishes.
  END;
  /
CREATE OR REPLACE PROCEDURE sp_inner_commit IS
  BEGIN
    SAVEPOINT SAVE_A0;
    pl_commit();
  END;
  /
SELECT sp_inner_commit();
 sp_inner_commit 
-----------------
 
(1 row)

DROP PROCEDURE sp_inner_commit;
DROP PROCEDURE pl_commit;
CREATE OR REPLACE PROCEDURE pl_rollback IS
  BEGIN
    ROLLBACK;        -- snapshot destoryed when substransaction finishes.
  END;
  /
CREATE OR REPLACE PROCEDURE sp_inner_rollback IS
  BEGIN
    SAVEPOINT SAVE_A0;
    pl_rollback();
  END;
  /
CALL sp_inner_rollback();
 sp_inner_rollback 
-------------------
 
(1 row)

DROP PROCEDURE sp_inner_rollback;
DROP PROCEDURE pl_rollback;
-- savepoint + exception
CREATE OR REPLACE PROCEDURE SavepointTest IS
    exc_1 EXCEPTION;
  BEGIN
    COMMIT;
    SAVEPOINT SAVE_A;
    RAISE exc_1;
  EXCEPTION
    WHEN OTHERS THEN
       RAISE NOTICE 'wrong 1'; 
  END;
  /
CREATE OR REPLACE PROCEDURE SavepointTest0 IS
  BEGIN
    SavepointTest();
  EXCEPTION
    WHEN OTHERS THEN
       ROLLBACK TO SAVE_A;
       RAISE NOTICE 'wrong 2'; 
  END;
  /
SELECT SavepointTest();
NOTICE:  wrong 1
CONTEXT:  referenced column: savepointtest
 savepointtest 
---------------
 
(1 row)

SELECT SavepointTest0();
NOTICE:  wrong 1
CONTEXT:  SQL statement "CALL savepointtest()"
PL/pgSQL function savepointtest0() line 2 at PERFORM
referenced column: savepointtest0
 savepointtest0 
----------------
 
(1 row)

CREATE OR REPLACE PROCEDURE SavepointTest IS
  exc_1 EXCEPTION;
  BEGIN
    INSERT INTO pl_txn_t VALUES(1, 1);
    SAVEPOINT SAVE_A;
    INSERT INTO pl_txn_t VALUES(2, 2);
    ROLLBACK TO SAVEPOINT SAVE_B;
  EXCEPTION
    WHEN exc_1 THEN
      ROLLBACK TO SAVEPOINT SAVE_A;
      RAISE NOTICE 'wrong 1';
    WHEN OTHERS THEN
      RAISE NOTICE 'wrong 2';
      ROLLBACK TO SAVEPOINT SAVE_B;
      INSERT INTO pl_txn_t VALUES(3,3);
  END;
  /
SELECT SavepointTest();
NOTICE:  wrong 2
CONTEXT:  referenced column: savepointtest
ERROR:  no such savepoint
CONTEXT:  PL/pgSQL function savepointtest() line 13 at ROLLBACK TO SAVEPOINT
referenced column: savepointtest
CREATE OR REPLACE PROCEDURE SavepointTest IS
  exc_1 EXCEPTION;
  BEGIN
    INSERT INTO pl_txn_t VALUES(1, 1);
    SAVEPOINT SAVE_A;
    INSERT INTO pl_txn_t VALUES(2, 2);
    RAISE exc_1;
  EXCEPTION
    WHEN exc_1 THEN
      ROLLBACK TO SAVEPOINT SAVE_A;
      RAISE NOTICE 'wrong 1';
    WHEN OTHERS THEN
      RAISE NOTICE 'wrong 2';
      ROLLBACK TO SAVEPOINT SAVE_B;
      INSERT INTO pl_txn_t VALUES(3,3);
  END;
  /
SELECT SavepointTest();
NOTICE:  wrong 1
CONTEXT:  referenced column: savepointtest
 savepointtest 
---------------
 
(1 row)

DROP PROCEDURE SavepointTest;
DROP PROCEDURE SavepointTest0;
-- savepoint + cursor hold
CREATE OR REPLACE PROCEDURE SavepointTest IS
    CURSOR c1 IS SELECT tc1 FROM pl_txn_t;
    val INT;
    val1 INT;
  BEGIN
    INSERT INTO pl_txn_t VALUES(1,1);
    INSERT INTO pl_txn_t VALUES(2,2);
    OPEN c1;
    SAVEPOINT save_a;
    FETCH c1 INTO val;
    ROLLBACK TO save_a;
    FETCH c1 INTO val1;
    CLOSE c1;
  END;
  /
SELECT SavepointTest();
 savepointtest 
---------------
 
(1 row)

CREATE OR REPLACE PROCEDURE SavepointTest IS
    CURSOR c1 IS SELECT tc1 FROM pl_txn_t;
    val INT;
    val1 INT;
  BEGIN
    INSERT INTO pl_txn_t values(1,1);
    INSERT INTO pl_txn_t values(2,2);
    SAVEPOINT save_a;
    OPEN c1;
    FETCH c1 INTO val;
    ROLLBACK to save_a;
    FETCH c1 INTO val1;   --fetch out of sequence
    CLOSE c1;
  END;
  /
SELECT SavepointTest();
ERROR:  cursor "<unnamed portal 4>" does not exist in FETCH statement.
CONTEXT:  PL/pgSQL function savepointtest() line 11 at FETCH
referenced column: savepointtest
CREATE OR REPLACE PROCEDURE SavepointTest IS
    CURSOR c1 IS SELECT tc1 FROM pl_txn_t;
    val INT;
    val1 INT;
  BEGIN
    INSERT INTO pl_txn_t values(1,1);
    INSERT INTO pl_txn_t values(2,2);
    SAVEPOINT save_a;
    OPEN c1;
    FETCH c1 INTO val;
    COMMIT;
    FETCH c1 INTO val1;
    CLOSE c1;
  END;
  /
SELECT SavepointTest();
 savepointtest 
---------------
 
(1 row)

DROP PROCEDURE SavepointTest;
-- spi connect
CREATE OR REPLACE PROCEDURE SavepointTest0 IS
  CURSOR c1 IS SELECT tc1 FROM pl_txn_t;
  val INT;
  val1 INT;
  BEGIN
    ROLLBACK TO SAVEPOINT SAVE_A0;
    --INSERT INTO pl_txn_t VALUES(1, 1);
    --INSERT INTO pl_txn_t VALUES(2, 2);
    SAVEPOINT SAVE_A1;
    OPEN c1;
    FETCH c1 INTO val;
    COMMIT;
    FETCH c1 INTO val;
    CLOSE c1;
  END;
  /
CREATE OR REPLACE PROCEDURE SavepointTest IS
  BEGIN
    SAVEPOINT SAVE_A0;
    --INSERT INTO pl_txn_t VALUES(1, 1);
    --INSERT INTO pl_txn_t VALUES(2, 2);
    --SAVEPOINT SAVE_A1;
    SavepointTest0();
  END;
  /
SELECT SavepointTest();
 savepointtest 
---------------
 
(1 row)

DROP PROCEDURE SavepointTest0;
DROP PROCEDURE SavepointTest;
-- savepoint in exception, don't destory exception's subtransaction
CREATE OR REPLACE PROCEDURE SavepointTest0 IS
  exc_1 EXCEPTION;
  BEGIN
    INSERT INTO pl_txn_t VALUES(2, 2);
    COMMIT;
    INSERT INTO pl_txn_t VALUES(3, 3);
    SAVEPOINT save_b;
    INSERT INTO pl_txn_t VALUES(4, 4);
  EXCEPTION
    WHEN exc_1 THEN
      ROLLBACK TO SAVEPOINT save_a;
      RAISE NOTICE 'wrong 1';
    WHEN OTHERS THEN
      RAISE NOTICE 'wrong 2';
      ROLLBACK TO SAVEPOINT save_a;
      INSERT INTO pl_txn_t VALUES(5, 5);
  END;
  /
CREATE OR REPLACE PROCEDURE SavepointTest IS
  exc_1 EXCEPTION;
  BEGIN
    INSERT INTO pl_txn_t VALUES(1, 1);
    SAVEPOINT save_a;
    SavepointTest0();
    ROLLBACK TO save_b;
  END;
  /
TRUNCATE pl_txn_t;
SELECT SavepointTest();
 savepointtest 
---------------
 
(1 row)

SELECT * FROM pl_txn_t ORDER BY 1, 2;
 tc1 | tc2 
-----+-----
   1 |   1
   2 |   2
   3 |   3
(3 rows)

-- exception's subtransaction id changes.
CREATE OR REPLACE PROCEDURE SavepointTest0 IS
  exc_1 EXCEPTION;
  BEGIN
    -- exception's subtransaction id is 3
    INSERT INTO pl_txn_t VALUES(2, 2);
    COMMIT;   -- exception's subtransaction id changes to 2.
    INSERT INTO pl_txn_t VALUES(3, 3);
  EXCEPTION
    WHEN exc_1 THEN
      ROLLBACK TO SAVEPOINT SAVE_A;
      RAISE NOTICE 'wrong 1';
    WHEN OTHERS THEN
      RAISE NOTICE 'wrong 2';
      ROLLBACK TO SAVEPOINT SAVE_A;
      INSERT INTO pl_txn_t VALUES(5, 5);
  END;
  /
CREATE OR REPLACE PROCEDURE SavepointTest IS
  exc_1 EXCEPTION;
  BEGIN
    INSERT INTO pl_txn_t VALUES(1, 1);
    SAVEPOINT save_a;   -- subtransaction id = 2
    SavepointTest0();
  END;
  /
TRUNCATE pl_txn_t;
SELECT SavepointTest();
 savepointtest 
---------------
 
(1 row)

SELECT * FROM pl_txn_t ORDER BY 1, 2;
 tc1 | tc2 
-----+-----
   1 |   1
   2 |   2
   3 |   3
(3 rows)

-- automatic rollback to the last savepoint:save_b in exception
CREATE OR REPLACE PROCEDURE SavepointTest0 IS
  exc_1 EXCEPTION;
  BEGIN
    -- exception's subtransaction id is 3
    INSERT INTO pl_txn_t VALUES(2, 2);
    COMMIT;   -- destory save_a automatically
    INSERT INTO pl_txn_t VALUES(3, 3);
    SAVEPOINT save_b;
    INSERT INTO pl_txn_t VALUES(4, 4);
    RAISE exc_1;
  EXCEPTION
    -- auto rollback to save_b
    WHEN exc_1 THEN
      RAISE NOTICE 'wrong 1';
    WHEN OTHERS THEN
      RAISE NOTICE 'wrong 2';
      INSERT INTO pl_txn_t VALUES(5, 5);
  END;
  /
CREATE OR REPLACE PROCEDURE SavepointTest IS
  exc_1 EXCEPTION;
  BEGIN
    INSERT INTO pl_txn_t VALUES(1, 1);
    SAVEPOINT save_a;
    SavepointTest0();
  END;
  /
TRUNCATE pl_txn_t;
SELECT SavepointTest();
NOTICE:  wrong 1
CONTEXT:  SQL statement "CALL savepointtest0()"
PL/pgSQL function savepointtest() line 5 at PERFORM
referenced column: savepointtest
 savepointtest 
---------------
 
(1 row)

SELECT * FROM pl_txn_t ORDER BY 1, 2;
 tc1 | tc2 
-----+-----
   1 |   1
   2 |   2
   3 |   3
(3 rows)

-- rollback to in exception
CREATE OR REPLACE PROCEDURE SavepointTest0 IS
  exc_1 EXCEPTION;
  BEGIN
    -- exception's subtransaction id is 3
    INSERT INTO pl_txn_t VALUES(2, 2);
    COMMIT;   -- destory save_a automatically
    INSERT INTO pl_txn_t VALUES(3, 3);
    SAVEPOINT save_b;
    INSERT INTO pl_txn_t VALUES(4, 4);
    SAVEPOINT save_c;
    ROLLBACK TO save_none;  -- no such savepoint
  EXCEPTION
    -- auto rollback to save_c
    WHEN exc_1 THEN
      RAISE NOTICE 'wrong 1';
    WHEN OTHERS THEN
      RAISE NOTICE 'wrong 2';
      ROLLBACK TO SAVEPOINT SAVE_b;
      INSERT INTO pl_txn_t VALUES(5, 5);
  END;
  /
CREATE OR REPLACE PROCEDURE SavepointTest IS
  exc_1 EXCEPTION;
  BEGIN
    INSERT INTO pl_txn_t VALUES(1, 1);
    SAVEPOINT save_a;
    SavepointTest0();
  END;
  /
TRUNCATE pl_txn_t;
SELECT SavepointTest();
NOTICE:  wrong 2
CONTEXT:  SQL statement "CALL savepointtest0()"
PL/pgSQL function savepointtest() line 5 at PERFORM
referenced column: savepointtest
 savepointtest 
---------------
 
(1 row)

SELECT * FROM pl_txn_t ORDER BY 1, 2;
 tc1 | tc2 
-----+-----
   1 |   1
   2 |   2
   3 |   3
   5 |   5
(4 rows)

-- destory SPI connect while abort subtransaction
CREATE OR REPLACE PROCEDURE SavepointTest0 IS
  exc_1 EXCEPTION;
  var1 INT;
  BEGIN
    SAVEPOINT save_c;
    ROLLBACK TO SAVEPOINT save_a;
    SELECT sum(t1.tc1 + t2.tc2) INTO var1 FROM pl_txn_t t1, pl_txn_t t2 WHERE T1.TC2 + 1 = T2.TC2 + 4;
    CREATE TABLE pl_txn_t(tc1 INT, tc2 INT);
  END;
  /
CREATE OR REPLACE PROCEDURE SavepointTest IS
  exc_1 EXCEPTION;
  BEGIN
    INSERT INTO pl_txn_t VALUES(1, 1);
    SAVEPOINT save_a;
    SAVEPOINT save_b;
    SavepointTest0();
  END;
  /
SELECT SavepointTest();
ERROR:  relation "pl_txn_t" already exists in schema "public"
DETAIL:  creating new table with existing name in the same schema
CONTEXT:  SQL statement "CREATE TABLE pl_txn_t(tc1 INT, tc2 INT)"
PL/pgSQL function savepointtest0() line 7 at SQL statement
SQL statement "CALL savepointtest0()"
PL/pgSQL function savepointtest() line 6 at PERFORM
referenced column: savepointtest
-- savepoint outside STP
create or replace procedure SavepointTest is
  exc_1 exception;
  BEGIN
    INSERT INTO pl_txn_t VALUES(1, 1);
    SAVEPOINT save_a;
    ROLLBACK TO save_out;
    SAVEPOINT save_b;
  END;
  /
BEGIN;
INSERT INTO pl_txn_t VALUES(0, 0);
SAVEPOINT save_out;
SELECT SavepointTest();
 savepointtest 
---------------
 
(1 row)

SELECT SavepointTest();
 savepointtest 
---------------
 
(1 row)

ROLLBACK TO save_b;
COMMIT;
CREATE OR REPLACE PROCEDURE SavepointTest IS
  exc_1 EXCEPTION;
  BEGIN
    INSERT INTO pl_txn_t VALUES(2, 2);
    INSERT INTO pl_txn_t VALUES(3, 3);
    SAVEPOINT save_a;
    INSERT INTO pl_txn_t VALUES(4, 4);
    RAISE exc_1;
  EXCEPTION
    WHEN exc_1 THEN
      ROLLBACK TO SAVEPOINT save_out;
      RAISE NOTICE 'wrong 1';
    WHEN OTHERS THEN
      RAISE NOTICE 'wrong 2';
      ROLLBACK TO SAVEPOINT save_a;
      INSERT INTO pl_txn_t VALUES(5, 5);
  END;
  /
BEGIN;
SAVEPOINT save_out;
SELECT SavepointTest();
NOTICE:  wrong 1
CONTEXT:  referenced column: savepointtest
 savepointtest 
---------------
 
(1 row)

SELECT SavepointTest();
NOTICE:  wrong 1
CONTEXT:  referenced column: savepointtest
 savepointtest 
---------------
 
(1 row)

ROLLBACK TO save_out;
END;
-- don't switch to top portal's resourceowner since it is invalid.
CREATE OR REPLACE PROCEDURE SavepointTest0 IS
  exc_1 EXCEPTION;
  BEGIN
    INSERT INTO pl_txn_t VALUES(2, 2);
    INSERT INTO pl_txn_t VALUES(3, 3);
    ROLLBACK TO SAVEPOINT save_out;
  END;
  /
CREATE OR REPLACE PROCEDURE SavepointTest IS
  exc_1 EXCEPTION;
  BEGIN
    SavepointTest0();
    INSERT INTO pl_txn_t VALUES(1, 1);
    RAISE exc_1;
  EXCEPTION
    WHEN exc_1 THEN
      INSERT INTO pl_txn_t VALUES(4, 4);
    WHEN OTHERS THEN
      INSERT INTO pl_txn_t VALUES(6, 6);
  END;
  /
TRUNCATE pl_txn_t;
BEGIN;
SAVEPOINT save_out;
SELECT SavepointTest();
 savepointtest 
---------------
 
(1 row)

SELECT * from pl_txn_t order by 1, 2;
 tc1 | tc2 
-----+-----
   4 |   4
(1 row)

END;
-- exception's subtransaction is destoryed by rollbackiing to outside savepoint
CREATE OR REPLACE PROCEDURE SavepointTest0 IS
  exc_1 EXCEPTION;
  BEGIN
    INSERT INTO pl_txn_t VALUES(2, 2);
    INSERT INTO pl_txn_t VALUES(3, 3);
    SAVEPOINT save_a;
    INSERT INTO pl_txn_t VALUES(4, 4);
    RAISE exc_1;
  EXCEPTION
    WHEN exc_1 THEN
      ROLLBACK TO SAVEPOINT save_out;
      RAISE NOTICE 'wrong 1';
    WHEN OTHERS THEN
      RAISE NOTICE 'wrong 2';
      ROLLBACK TO SAVEPOINT save_a;
      INSERT INTO pl_txn_t VALUES(5, 5);
  END;
  /
CREATE OR REPLACE PROCEDURE SavepointTest IS
  exc_1 EXCEPTION;
  BEGIN
    SavepointTest0();
    INSERT INTO pl_txn_t VALUES(1, 1);
    RAISE exc_1;
  EXCEPTION
    WHEN exc_1 THEN
      INSERT INTO pl_txn_t VALUES(4, 4);
    WHEN OTHERS THEN
      INSERT INTO pl_txn_t VALUES(6, 6);
  END;
  /
BEGIN;
SAVEPOINT save_out;
SELECT SavepointTest();
NOTICE:  wrong 1
CONTEXT:  SQL statement "CALL savepointtest0()"
PL/pgSQL function savepointtest() line 3 at PERFORM
referenced column: savepointtest
 savepointtest 
---------------
 
(1 row)

SELECT SavepointTest();
NOTICE:  wrong 1
CONTEXT:  SQL statement "CALL savepointtest0()"
PL/pgSQL function savepointtest() line 3 at PERFORM
referenced column: savepointtest
 savepointtest 
---------------
 
(1 row)

END;
DROP PROCEDURE SavepointTest0;
DROP PROCEDURE SavepointTest;
-- switch to stmt top portal memory context
CREATE OR REPLACE PROCEDURE SavepointTest IS
  val VARCHAR(10) := '0';
  BEGIN
    INSERT INTO pl_txn_t VALUES(1, 1);
    SAVEPOINT save_a;
    val := val || '1';
    ROLLBACK TO SAVEPOINT save_a;
    val :=  val || '2';
  END;
  /
SELECT SavepointTest();
 savepointtest 
---------------
 
(1 row)

SELECT SavepointTest();
 savepointtest 
---------------
 
(1 row)

DROP PROCEDURE SavepointTest;
-- don't support execute immedidate savepoint
CREATE OR REPLACE PROCEDURE SavepointTest IS
  BEGIN
    INSERT INTO pl_txn_t VALUES(1, 1);
    SAVEPOINT SAVE_A;

    INSERT INTO pl_txn_t VALUES(2, 2);
    execute immediate 'rollback to ' || 'save_a';

    INSERT INTO pl_txn_t VALUES(2, 2);
    ROLLBACK TO SAVEPOINT SAVE_A;
  END;
  /
select SavepointTest();
ERROR:  cannot call transaction statements in EXECUTE IMMEDIATE statement.
CONTEXT:  PL/pgSQL function savepointtest() line 6 at EXECUTE statement
referenced column: savepointtest
DROP PROCEDURE SavepointTest;
-- wrong during execut stage
CREATE OR REPLACE PROCEDURE sp_inner1 IS
  BEGIN
    SAVEPOINT save_a;
    INSERT INTO pl_txn_t VALUES(2,2);
    INSERT INTO pl_txn_t VALUES(2,2); --wrong
  END;
  /
CREATE OR REPLACE PROCEDURE sp_test is
  BEGIN
    INSERT INTO pl_txn_t VALUES(1,1);
    sp_inner1();
  EXCEPTION
      WHEN OTHERS THEN
        RAISE INFO 'wrong1';
  END;
  /
SET behavior_compat_options = 'plstmt_implicit_savepoint';
TRUNCATE TABLE pl_txn_t;
CREATE UNIQUE INDEX idx_unique_tc1_tc2 ON pl_txn_t(tc1, tc2);
CALL sp_test();
INFO:  wrong1
 sp_test 
---------
 
(1 row)

SELECT * FROM pl_txn_t ORDER BY 1, 2;
 tc1 | tc2 
-----+-----
   1 |   1
   2 |   2
(2 rows)

SET behavior_compat_options = '';
TRUNCATE TABLE pl_txn_t;
CALL sp_test();
INFO:  wrong1
 sp_test 
---------
 
(1 row)

SELECT * FROM pl_txn_t ORDER BY 1, 2;
 tc1 | tc2 
-----+-----
   1 |   1
(1 row)

DROP INDEX idx_unique_tc1_tc2;
-- wrong during plan stage
CREATE OR REPLACE PROCEDURE sp_inner1 IS
  BEGIN
    SAVEPOINT save_a;
    INSERT INTO pl_txn_t VALUES(2,2);
    INSERT INTO pl_txn_t VALUES(2,2,2); --wrong
  END;
  /
CREATE OR REPLACE PROCEDURE sp_test is
  BEGIN
    INSERT INTO pl_txn_t VALUES(1,1);
    sp_inner1();
  EXCEPTION
      WHEN OTHERS THEN
        RAISE INFO 'wrong1';
  END;
  /
SET behavior_compat_options = 'plstmt_implicit_savepoint';
TRUNCATE TABLE pl_txn_t;
CALL sp_test();
INFO:  wrong1
 sp_test 
---------
 
(1 row)

SELECT * FROM pl_txn_t ORDER BY 1, 2;
 tc1 | tc2 
-----+-----
   1 |   1
   2 |   2
(2 rows)

SET behavior_compat_options = '';
TRUNCATE TABLE pl_txn_t;
CALL sp_test();
INFO:  wrong1
 sp_test 
---------
 
(1 row)

SELECT * FROM pl_txn_t ORDER BY 1, 2;
 tc1 | tc2 
-----+-----
   1 |   1
(1 row)

-- wrong during pl others
CREATE OR REPLACE PROCEDURE sp_inner1 IS
  exc_1 EXCEPTION;
  BEGIN
    SAVEPOINT save_a;
    INSERT INTO pl_txn_t VALUES(2,2);
    RAISE exc_1;
  END;
  /
CREATE OR REPLACE PROCEDURE sp_test is
  BEGIN
    INSERT INTO pl_txn_t VALUES(1,1);
    sp_inner1();
  EXCEPTION
      WHEN OTHERS THEN
        RAISE INFO 'wrong1';
  END;
  /
SET behavior_compat_options = 'plstmt_implicit_savepoint';
TRUNCATE TABLE pl_txn_t;
CALL sp_test();
INFO:  wrong1
 sp_test 
---------
 
(1 row)

SELECT * FROM pl_txn_t ORDER BY 1, 2;
 tc1 | tc2 
-----+-----
   1 |   1
   2 |   2
(2 rows)

SET behavior_compat_options = '';
TRUNCATE TABLE pl_txn_t;
CALL sp_test();
INFO:  wrong1
 sp_test 
---------
 
(1 row)

SELECT * FROM pl_txn_t ORDER BY 1, 2;
 tc1 | tc2 
-----+-----
   1 |   1
(1 row)

DROP PROCEDURE sp_test;
DROP PROCEDURE sp_inner1;
-- don't rollback exception's subtxn
CREATE OR REPLACE PROCEDURE sp_test is
    exc_1 EXCEPTION;
  BEGIN
    INSERT INTO pl_txn_t VALUES(1,1);
    RAISE exc_1;
  EXCEPTION
      WHEN OTHERS THEN
        RAISE INFO 'wrong1';
  END;
  /
SET behavior_compat_options = 'plstmt_implicit_savepoint';
TRUNCATE TABLE pl_txn_t;
CALL sp_test();
INFO:  wrong1
 sp_test 
---------
 
(1 row)

SELECT * FROM pl_txn_t ORDER BY 1, 2;
 tc1 | tc2 
-----+-----
   1 |   1
(1 row)

SET behavior_compat_options = '';
TRUNCATE TABLE pl_txn_t;
CALL sp_test();
INFO:  wrong1
 sp_test 
---------
 
(1 row)

SELECT * FROM pl_txn_t ORDER BY 1, 2;
 tc1 | tc2 
-----+-----
(0 rows)

DROP PROCEDURE sp_test;
-- release savepoint
CREATE OR REPLACE PROCEDURE sp_test is
    exc_1 EXCEPTION;
  BEGIN
    SAVEPOINT s1;
    INSERT INTO pl_txn_t VALUES(1,1);
    RELEASE s1;
    INSERT INTO pl_txn_t VALUES(2,2);
    ROLLBACK TO s1;
  EXCEPTION
      WHEN OTHERS THEN
        RAISE INFO 'wrong1';
  END;
  /
SET behavior_compat_options = 'plstmt_implicit_savepoint';
TRUNCATE TABLE pl_txn_t;
CALL sp_test();
INFO:  wrong1
 sp_test 
---------
 
(1 row)

SELECT * FROM pl_txn_t ORDER BY 1, 2;
 tc1 | tc2 
-----+-----
   1 |   1
   2 |   2
(2 rows)

SET behavior_compat_options = '';
TRUNCATE TABLE pl_txn_t;
CALL sp_test();
INFO:  wrong1
 sp_test 
---------
 
(1 row)

SELECT * FROM pl_txn_t ORDER BY 1, 2;
 tc1 | tc2 
-----+-----
(0 rows)

-- rollback to savepoint before released one
CREATE OR REPLACE PROCEDURE sp_test is
    exc_1 EXCEPTION;
  BEGIN
    INSERT INTO pl_txn_t VALUES(0,0);
    SAVEPOINT s1;
    INSERT INTO pl_txn_t VALUES(1,1);
    SAVEPOINT s2;
    INSERT INTO pl_txn_t VALUES(2,2);
    RELEASE s2;
    INSERT INTO pl_txn_t VALUES(3,3);
    ROLLBACK TO s1;
    INSERT INTO pl_txn_t VALUES(4,4);
    RAISE exc_1;
  EXCEPTION
      WHEN OTHERS THEN
        RAISE INFO 'wrong1';
  END;
  /
SET behavior_compat_options = 'plstmt_implicit_savepoint';
TRUNCATE TABLE pl_txn_t;
CALL sp_test();
INFO:  wrong1
 sp_test 
---------
 
(1 row)

SELECT * FROM pl_txn_t ORDER BY 1, 2;
 tc1 | tc2 
-----+-----
   0 |   0
   4 |   4
(2 rows)

SET behavior_compat_options = '';
TRUNCATE TABLE pl_txn_t;
CALL sp_test();
INFO:  wrong1
 sp_test 
---------
 
(1 row)

SELECT * FROM pl_txn_t ORDER BY 1, 2;
 tc1 | tc2 
-----+-----
   0 |   0
(1 row)

DROP PROCEDURE sp_test;
-- wrong during plan stage without savepoint
CREATE OR REPLACE PROCEDURE sp_test is
    exc_1 EXCEPTION;
  BEGIN
    INSERT INTO pl_txn_t VALUES(1,1);
    -- cast wrong with hold some resource
    INSERT INTO pl_txn_t VALUES(1,1,1);  --wrong execute
    UPDATE pl_txn_t SET tc2 = 'null'::numeric; --wrong no execute
    INSERT INTO pl_txn_t VALUES(2,2); -- no execute
  EXCEPTION
      WHEN OTHERS THEN
        RAISE INFO 'wrong1';
  END;
  /
SET behavior_compat_options = 'plstmt_implicit_savepoint';
TRUNCATE TABLE pl_txn_t;
CALL sp_test();
INFO:  wrong1
 sp_test 
---------
 
(1 row)

SELECT * FROM pl_txn_t ORDER BY 1, 2;
 tc1 | tc2 
-----+-----
   1 |   1
(1 row)

SET behavior_compat_options = '';
TRUNCATE TABLE pl_txn_t;
CALL sp_test();
INFO:  wrong1
 sp_test 
---------
 
(1 row)

SELECT * FROM pl_txn_t ORDER BY 1, 2;
 tc1 | tc2 
-----+-----
(0 rows)

-- wrong during execute stage without savepoint
CREATE OR REPLACE PROCEDURE sp_test is
    exc_1 EXCEPTION;
  BEGIN
    INSERT INTO pl_txn_t VALUES(1,1);
    -- cast wrong with hold some resource
    UPDATE pl_txn_t SET tc2 = 0 WHERE tc1 / (tc2 - 1) = 1;
    SELECT COUNT(1) FROM pl_txn_t WHERE tc1 / (tc2 - 1) = 1;
    INSERT INTO pl_txn_t VALUES(2,2); -- no execute
  EXCEPTION
      WHEN OTHERS THEN
        RAISE INFO 'wrong1';
  END;
  /
CREATE OR REPLACE PROCEDURE sp_test1 is
    exc_1 EXCEPTION;
  BEGIN
    INSERT INTO pl_txn_t VALUES(1,1);
    -- cast wrong with hold some resource
    SELECT COUNT(1) FROM pl_txn_t WHERE tc1 / (tc2 - 1) = 1;
    INSERT INTO pl_txn_t VALUES(2,2); -- no execute
  EXCEPTION
      WHEN OTHERS THEN
        RAISE INFO 'wrong1';
  END;
  /
SET behavior_compat_options = 'plstmt_implicit_savepoint';
TRUNCATE TABLE pl_txn_t;
CALL sp_test();
INFO:  wrong1
 sp_test 
---------
 
(1 row)

SELECT * FROM pl_txn_t ORDER BY 1, 2;
 tc1 | tc2 
-----+-----
   1 |   1
(1 row)

TRUNCATE TABLE pl_txn_t;
CALL sp_test1();
INFO:  wrong1
 sp_test1 
----------
 
(1 row)

SELECT * FROM pl_txn_t ORDER BY 1, 2;
 tc1 | tc2 
-----+-----
   1 |   1
(1 row)

SET behavior_compat_options = '';
TRUNCATE TABLE pl_txn_t;
CALL sp_test();
INFO:  wrong1
 sp_test 
---------
 
(1 row)

SELECT * FROM pl_txn_t ORDER BY 1, 2;
 tc1 | tc2 
-----+-----
(0 rows)

TRUNCATE TABLE pl_txn_t;
CALL sp_test1();
INFO:  wrong1
 sp_test1 
----------
 
(1 row)

SELECT * FROM pl_txn_t ORDER BY 1, 2;
 tc1 | tc2 
-----+-----
(0 rows)

DROP PROCEDURE sp_test;
DROP PROCEDURE sp_test1;
DROP TABLE pl_txn_t;
