--
-- VACUUM
--
CREATE TABLE vactst (i INT);
INSERT INTO vactst VALUES (1);
INSERT INTO vactst SELECT * FROM vactst;
INSERT INTO vactst SELECT * FROM vactst;
INSERT INTO vactst SELECT * FROM vactst;
INSERT INTO vactst SELECT * FROM vactst;
INSERT INTO vactst SELECT * FROM vactst;
INSERT INTO vactst SELECT * FROM vactst;
INSERT INTO vactst SELECT * FROM vactst;
INSERT INTO vactst SELECT * FROM vactst;
INSERT INTO vactst SELECT * FROM vactst;
INSERT INTO vactst SELECT * FROM vactst;
INSERT INTO vactst SELECT * FROM vactst;
INSERT INTO vactst VALUES (0);
SELECT count(*) FROM vactst;
 count 
-------
  2049
(1 row)

DELETE FROM vactst WHERE i != 0;
SELECT * FROM vactst;
 i 
---
 0
(1 row)

VACUUM FULL vactst;
UPDATE vactst SET i = i + 1;
INSERT INTO vactst SELECT * FROM vactst;
INSERT INTO vactst SELECT * FROM vactst;
INSERT INTO vactst SELECT * FROM vactst;
INSERT INTO vactst SELECT * FROM vactst;
INSERT INTO vactst SELECT * FROM vactst;
INSERT INTO vactst SELECT * FROM vactst;
INSERT INTO vactst SELECT * FROM vactst;
INSERT INTO vactst SELECT * FROM vactst;
INSERT INTO vactst SELECT * FROM vactst;
INSERT INTO vactst SELECT * FROM vactst;
INSERT INTO vactst SELECT * FROM vactst;
INSERT INTO vactst VALUES (0);
SELECT count(*) FROM vactst;
 count 
-------
  2049
(1 row)

DELETE FROM vactst WHERE i != 0;
VACUUM (FULL) vactst;
DELETE FROM vactst;
SELECT * FROM vactst;
 i 
---
(0 rows)

VACUUM (FULL, FREEZE) vactst;
VACUUM (ANALYZE, FULL) vactst;
CREATE TABLE vaccluster (i INT PRIMARY KEY);
NOTICE:  CREATE TABLE / PRIMARY KEY will create implicit index "vaccluster_pkey" for table "vaccluster"
ALTER TABLE vaccluster CLUSTER ON vaccluster_pkey;
CLUSTER vaccluster;
CREATE FUNCTION do_analyze() RETURNS VOID VOLATILE LANGUAGE SQL
	AS 'ANALYZE pg_am';
CREATE FUNCTION wrap_do_analyze(c INT) RETURNS INT IMMUTABLE LANGUAGE SQL
	AS 'SELECT $1 FROM do_analyze()';
CREATE INDEX ON vaccluster(wrap_do_analyze(i));
INSERT INTO vaccluster VALUES (1), (2);
ERROR:  ANALYZE cannot be executed from a function or multi-command string
CONTEXT:  SQL function "do_analyze" statement 1
SQL function "wrap_do_analyze" statement 1
ANALYZE vaccluster;
set xc_maintenance_mode = on;
VACUUM FULL pg_am;
VACUUM FULL pg_class;
VACUUM FULL pg_database;
set xc_maintenance_mode = off;
VACUUM FULL vaccluster;
VACUUM FULL vactst;
-- check behavior with duplicate column mentions
VACUUM ANALYZE vaccluster(i,i);
ANALYZE vaccluster(i,i);
DROP TABLE vaccluster;
DROP TABLE vactst;
CREATE TABLE vacuum_truncate_test(i INT NOT NULL, j text)
    WITH (vacuum_truncate=false,
    toast.vacuum_truncate=false,
    autovacuum_enabled=false);
SELECT reloptions FROM pg_class WHERE oid = 'vacuum_truncate_test'::regclass;
                                   reloptions                                    
---------------------------------------------------------------------------------
 {orientation=row,vacuum_truncate=false,autovacuum_enabled=false,compression=no}
(1 row)

INSERT INTO vacuum_truncate_test VALUES (1, NULL), (NULL, NULL);
ERROR:  null value in column "i" violates not-null constraint
DETAIL:  Failing row contains (null, null).
VACUUM (FREEZE) vacuum_truncate_test;
SELECT pg_relation_size('vacuum_truncate_test') > 0;
 ?column? 
----------
 t
(1 row)

SELECT reloptions FROM pg_class WHERE oid =
    (SELECT reltoastrelid FROM pg_class
    WHERE oid = 'vacuum_truncate_test'::regclass);
       reloptions        
-------------------------
 {vacuum_truncate=false}
(1 row)

ALTER TABLE vacuum_truncate_test RESET (vacuum_truncate);
SELECT reloptions FROM pg_class WHERE oid = 'vacuum_truncate_test'::regclass;
                        reloptions                         
-----------------------------------------------------------
 {orientation=row,autovacuum_enabled=false,compression=no}
(1 row)

INSERT INTO vacuum_truncate_test VALUES (1, NULL), (NULL, NULL);
ERROR:  null value in column "i" violates not-null constraint
DETAIL:  Failing row contains (null, null).
VACUUM (FREEZE) vacuum_truncate_test;
SELECT pg_relation_size('vacuum_truncate_test') = 0;
 ?column? 
----------
 t
(1 row)

INSERT INTO vacuum_truncate_test VALUES (1, NULL), (NULL, NULL);
ERROR:  null value in column "i" violates not-null constraint
DETAIL:  Failing row contains (null, null).
SET vacuum_truncate = false;
VACUUM (FREEZE) vacuum_truncate_test;
SELECT pg_relation_size('vacuum_truncate_test') > 0;
 ?column? 
----------
 t
(1 row)

RESET vacuum_truncate;
VACUUM (FREEZE) vacuum_truncate_test;
SELECT pg_relation_size('vacuum_truncate_test') = 0;
 ?column? 
----------
 t
(1 row)

ALTER TABLE vacuum_truncate_test SET (vacuum_truncate=true);
INSERT INTO vacuum_truncate_test VALUES (1, NULL), (NULL, NULL);
ERROR:  null value in column "i" violates not-null constraint
DETAIL:  Failing row contains (null, null).
SET vacuum_truncate = false;
VACUUM (FREEZE) vacuum_truncate_test;
SELECT pg_relation_size('vacuum_truncate_test') = 0;
 ?column? 
----------
 t
(1 row)

CREATE TABLE vacuum_truncate_not_support_type(a int) WITH (vacuum_truncate=true, orientation=column);
ERROR:  Un-support feature
DETAIL:  Forbid to set option "vacuum_truncate" for column relation
CREATE TABLE vacuum_truncate_not_support_type(a int) WITH (vacuum_truncate=true, storage_type=ustore);
ERROR:  Un-support feature
DETAIL:  Forbid to set option "vacuum_truncate" for ustore relation
CREATE TABLE vacuum_truncate_not_support_type(a int) WITH (vacuum_truncate=true, segment=on);
ERROR:  Un-support feature
DETAIL:  Forbid to set option "vacuum_truncate" for segment relation
CREATE TABLE vacuum_truncate_col(a int) WITH (orientation=column);
CREATE TABLE vacuum_truncate_ustore(a int) WITH (storage_type=ustore);
CREATE TABLE vacuum_truncate_seg(a int) WITH (segment=on);
ALTER TABLE vacuum_truncate_col SET (vacuum_truncate=true);
ERROR:  Un-support feature
DETAIL:  Forbid to set option "vacuum_truncate" for column relation
ALTER TABLE vacuum_truncate_ustore SET (vacuum_truncate=true);
ERROR:  Un-support feature
DETAIL:  Forbid to set option "vacuum_truncate" for ustore relation
ALTER TABLE vacuum_truncate_seg SET (vacuum_truncate=true);
ERROR:  Un-support feature
DETAIL:  Forbid to set option "vacuum_truncate" for segment relation
drop table vacuum_truncate_col;
drop table vacuum_truncate_ustore;
drop table vacuum_truncate_seg;
drop table vacuum_truncate_test;
