--
-- Test Statistics Collector
--
CREATE SCHEMA sch_stats;
SET search_path = sch_stats;
CREATE TABLE t_stats (
  unique1 int4,
  unique2 int4,
  two int4,
  four  int4,
  ten int4,
  twenty  int4,
  hundred int4,
  thousand  int4,
  twothousand int4,
  fivethous int4,
  tenthous int4,
  odd int4,
  even  int4,
  stringu1  name,
  stringu2  name,
  string4 name
) with(autovacuum_enabled = off);
CREATE INDEX i_t_stats ON t_stats USING btree(unique1 int4_ops);
insert into t_stats select a,a,a,a,a,a,a,a,a,a,a,a,a,a,a,a from generate_series(1,100,1) as t(a);
-- conditio sine qua non
SHOW track_counts;  -- must be on
 track_counts 
--------------
 on
(1 row)

-- ensure that both seqscan and indexscan plans are allowed
SET enable_seqscan TO on;
SET enable_indexscan TO on;
-- for the moment, we don't want index-only scans here
SET enable_indexonlyscan TO off;
-- wait to let any prior tests finish dumping out stats;
-- else our messages might get lost due to contention
SELECT pg_sleep(1.0);
 pg_sleep 
----------
 
(1 row)

-- reset counters
SELECT pg_stat_reset_single_table_counters('t_stats'::regclass);
 pg_stat_reset_single_table_counters 
-------------------------------------
 
(1 row)

SELECT pg_stat_reset_single_table_counters('i_t_stats'::regclass);
 pg_stat_reset_single_table_counters 
-------------------------------------
 
(1 row)

SELECT pg_sleep(2.0);
 pg_sleep 
----------
 
(1 row)

-- save counters
CREATE TEMP TABLE prevstats AS
SELECT t.seq_scan, t.seq_tup_read, t.idx_scan, t.idx_tup_fetch,
       (b.heap_blks_read + b.heap_blks_hit) AS heap_blks,
       (b.idx_blks_read + b.idx_blks_hit) AS idx_blks
  FROM pg_catalog.pg_stat_user_tables AS t,
       pg_catalog.pg_statio_user_tables AS b
 WHERE t.relid='t_stats'::regclass AND b.relid='t_stats'::regclass;
SELECT * from prevstats;
 seq_scan | seq_tup_read | idx_scan | idx_tup_fetch | heap_blks | idx_blks 
----------+--------------+----------+---------------+-----------+----------
        0 |            0 |        0 |             0 |         0 |        0
(1 row)

-- function to wait for counters to advance
create function wait_for_stats() returns void as $$
declare
  start_time timestamptz := clock_timestamp();
  updated bool;
begin
  -- we don't want to wait forever; loop will exit after 10 seconds
  for i in 1 .. 100 loop

    -- check to see if indexscan has been sensed
    SELECT (st.idx_scan >= pr.idx_scan + 1) INTO updated
      FROM pg_stat_user_tables AS st, pg_class AS cl, prevstats AS pr
     WHERE st.relid='t_stats'::regclass AND cl.oid='t_stats'::regclass;

    exit when updated;

    -- wait a little
    perform pg_sleep(0.1);

    -- reset stats snapshot so we can test again
    perform pg_stat_clear_snapshot();

  end loop;

  -- report time waited in postmaster log (where it won't change test output)
  raise log 'wait_for_stats delayed % seconds',
    extract(epoch from clock_timestamp() - start_time);
end
$$ language plpgsql;
-- do a seqscan
SELECT count(*) FROM t_stats;
 count 
-------
   100
(1 row)

-- do an indexscan
-- make sure it is not a bitmap scan, which might skip fetching heap tuples
SET enable_bitmapscan TO off;
SELECT count(*) FROM t_stats WHERE unique1 = 1;
 count 
-------
     1
(1 row)

RESET enable_bitmapscan;
-- force the rate-limiting logic in pgstat_report_tabstat() to time out
-- and send a message
SELECT pg_sleep(1.0);
 pg_sleep 
----------
 
(1 row)

-- wait for stats collector to update
SELECT wait_for_stats();
 wait_for_stats 
----------------
 
(1 row)

-- check effects
SELECT st.seq_scan >= pr.seq_scan + 1,
       st.seq_tup_read >= pr.seq_tup_read + cl.reltuples,
       st.idx_scan >= pr.idx_scan + 1,
       st.idx_tup_fetch >= pr.idx_tup_fetch + 1
  FROM pg_stat_user_tables AS st, pg_class AS cl, prevstats AS pr
 WHERE st.relid='t_stats'::regclass AND cl.oid='t_stats'::regclass;
 ?column? | ?column? | ?column? | ?column? 
----------+----------+----------+----------
 t        | t        | t        | t
(1 row)

SELECT st.heap_blks_read + st.heap_blks_hit >= pr.heap_blks + cl.relpages,
       st.idx_blks_read + st.idx_blks_hit >= pr.idx_blks + 1
  FROM pg_statio_user_tables AS st, pg_class AS cl, prevstats AS pr
 WHERE st.relid='t_stats'::regclass AND cl.oid='t_stats'::regclass;
 ?column? | ?column? 
----------+----------
 t        | t
(1 row)

-- check estimation on a whole var
EXPLAIN (COSTS OFF) SELECT count(*) FROM (SELECT t_stats, unique2 FROM t_stats ORDER BY unique2) t1, t_stats t2 WHERE t1.unique2=t2.unique1 AND t1=(1,1,1,1,1,1,1,1,1,1,1,1,1,'abc','abc','abc',1);
                                                      QUERY PLAN                                                      
----------------------------------------------------------------------------------------------------------------------
 Aggregate
   ->  Nested Loop
         ->  Seq Scan on t_stats
               Filter: (ROW(t_stats.*, unique2) = ROW(1, 1, 1, 1, 1, 1, 1, 1, 1, 1, 1, 1, 1, 'abc', 'abc', 'abc', 1))
         ->  Index Scan using i_t_stats on t_stats t2
               Index Cond: (unique1 = t_stats.unique2)
(6 rows)

-- pg_stat_get_lastscan, pg_stat_force_next_flush
SELECT proname,pronamespace,proowner,prolang,procost,prorows,provariadic,prokind,prosecdef,
  proleakproof,proisstrict,proretset,provolatile,pronargs,pronargdefaults,prorettype,proargtypes,
  proallargtypes,proargmodes,proargnames,proargdefaults,prosrc,probin,proconfig,proacl
FROM pg_proc WHERE proname='pg_stat_get_lastscan' OR proname='pg_stat_force_next_flush'
ORDER BY proname;
         proname          | pronamespace | proowner | prolang | procost | prorows | provariadic | prokind | prosecdef | proleakproof | proisstrict | proretset | provolatile | pronargs | pronargdefaults | prorettype | proargtypes | proallargtypes | proargmodes | proargnames | proargdefaults |          prosrc          | probin | proconfig | proacl 
--------------------------+--------------+----------+---------+---------+---------+-------------+---------+-----------+--------------+-------------+-----------+-------------+----------+-----------------+------------+-------------+----------------+-------------+-------------+----------------+--------------------------+--------+-----------+--------
 pg_stat_force_next_flush |           11 |       10 |      12 |       1 |       0 |           0 | f       | f         | f            | f           | f         | v           |        0 |               0 |       2278 |             |                |             |             |                | pg_stat_force_next_flush |        |           | 
 pg_stat_get_lastscan     |           11 |       10 |      12 |       1 |       0 |           0 | f       | f         | f            | t           | f         | s           |        1 |               0 |       1184 | 26          |                |             |             |                | pg_stat_get_lastscan     |        |           | 
(2 rows)

-----
-- Test that last_seq_scan, last_idx_scan are correctly maintained
--
-- Perform test using a temporary table. That way autovacuum etc won't
-- interfere. To be able to check that timestamps increase, we sleep for 100ms
-- between tests, assuming that there aren't systems with a coarser timestamp
-- granularity.
-----
CREATE TEMPORARY TABLE test_check(id Oid, test_last_seq timestamptz, test_last_idx timestamptz);
BEGIN;
CREATE TEMPORARY TABLE test_last_scan(idx_col int primary key, noidx_col int);
NOTICE:  CREATE TABLE / PRIMARY KEY will create implicit index "test_last_scan_pkey" for table "test_last_scan"
INSERT INTO test_last_scan(idx_col, noidx_col) VALUES(1, 1);
-- partition table
CREATE TABLE test_last_scan_part(idx_col int primary key, noidx_col int)
PARTITION BY RANGE (idx_col)
(PARTITION p1 values less than (10), PARTITION p2 values less than (20));
NOTICE:  CREATE TABLE / PRIMARY KEY will create implicit index "test_last_scan_part_pkey" for table "test_last_scan_part"
INSERT INTO test_last_scan_part(idx_col, noidx_col) VALUES(1, 1);
INSERT INTO test_last_scan_part(idx_col, noidx_col) VALUES(12, 12);
-- subpartition table
CREATE TABLE test_last_scan_subpart(idx_col int primary key, noidx_col int)
PARTITION BY RANGE (idx_col) SUBPARTITION BY LIST (idx_col)
(PARTITION p1 values less than (10) (SUBPARTITION sp1 VALUES (1), SUBPARTITION sp2 VALUES (default)),
PARTITION p2 values less than (20) (SUBPARTITION sp3 VALUES (10, 11), SUBPARTITION sp4 VALUES (default)));
NOTICE:  CREATE TABLE / PRIMARY KEY will create implicit index "test_last_scan_subpart_pkey" for table "test_last_scan_subpart"
INSERT INTO test_last_scan_subpart(idx_col, noidx_col) VALUES(1, 1);
INSERT INTO test_last_scan_subpart(idx_col, noidx_col) VALUES(2, 2);
INSERT INTO test_last_scan_subpart(idx_col, noidx_col) VALUES(11, 11);
INSERT INTO test_last_scan_subpart(idx_col, noidx_col) VALUES(12, 12);
SELECT pg_stat_force_next_flush();
 pg_stat_force_next_flush 
--------------------------
 
(1 row)

SELECT last_seq_scan, last_idx_scan FROM pg_stat_all_tables WHERE relid = 'test_last_scan'::regclass;
 last_seq_scan | last_idx_scan 
---------------+---------------
               | 
(1 row)

SELECT last_seq_scan, last_idx_scan FROM pg_stat_all_tables WHERE relid = 'test_last_scan_part'::regclass;
 last_seq_scan | last_idx_scan 
---------------+---------------
               | 
(1 row)

SELECT last_seq_scan, last_idx_scan FROM pg_stat_all_tables WHERE relid = 'test_last_scan_subpart'::regclass;
 last_seq_scan | last_idx_scan 
---------------+---------------
               | 
(1 row)

COMMIT;
SELECT pg_stat_reset_single_table_counters('test_last_scan'::regclass);
 pg_stat_reset_single_table_counters 
-------------------------------------
 
(1 row)

SELECT pg_stat_reset_single_table_counters('test_last_scan_part'::regclass);
 pg_stat_reset_single_table_counters 
-------------------------------------
 
(1 row)

SELECT pg_stat_reset_single_table_counters('test_last_scan_subpart'::regclass);
 pg_stat_reset_single_table_counters 
-------------------------------------
 
(1 row)

SELECT pg_sleep(1);
 pg_sleep 
----------
 
(1 row)

SELECT seq_scan, idx_scan FROM pg_stat_all_tables WHERE relid = 'test_last_scan'::regclass;
 seq_scan | idx_scan 
----------+----------
        0 |        0
(1 row)

SELECT seq_scan, idx_scan FROM pg_stat_all_tables WHERE relid = 'test_last_scan_part'::regclass;
 seq_scan | idx_scan 
----------+----------
        0 |        0
(1 row)

SELECT seq_scan, idx_scan FROM pg_stat_all_tables WHERE relid = 'test_last_scan_subpart'::regclass;
 seq_scan | idx_scan 
----------+----------
        0 |        0
(1 row)

-- ensure we start out with exactly one index and sequential scan
BEGIN;
SET LOCAL enable_seqscan TO on;
SET LOCAL enable_indexscan TO on;
SET LOCAL enable_bitmapscan TO off;
EXPLAIN (COSTS off) SELECT count(*) FROM test_last_scan WHERE noidx_col = 1;
            QUERY PLAN            
----------------------------------
 Aggregate
   ->  Seq Scan on test_last_scan
         Filter: (noidx_col = 1)
(3 rows)

SELECT count(*) FROM test_last_scan WHERE noidx_col = 1;
 count 
-------
     1
(1 row)

SET LOCAL enable_seqscan TO off;
EXPLAIN (COSTS off) SELECT count(*) FROM test_last_scan WHERE idx_col = 1;
                          QUERY PLAN                          
--------------------------------------------------------------
 Aggregate
   ->  Index Scan using test_last_scan_pkey on test_last_scan
         Index Cond: (idx_col = 1)
(3 rows)

SELECT count(*) FROM test_last_scan WHERE idx_col = 1;
 count 
-------
     1
(1 row)

SET LOCAL enable_seqscan TO on;
EXPLAIN (COSTS off) SELECT count(*) FROM test_last_scan_part WHERE noidx_col = 1 or noidx_col = 12;
                         QUERY PLAN                          
-------------------------------------------------------------
 Aggregate
   ->  Partition Iterator
         Iterations: 2
         ->  Partitioned Seq Scan on test_last_scan_part
               Filter: ((noidx_col = 1) OR (noidx_col = 12))
               Selected Partitions:  1..2
(6 rows)

SELECT count(*) FROM test_last_scan_part WHERE noidx_col = 1 or noidx_col = 12;
 count 
-------
     2
(1 row)

SET LOCAL enable_seqscan TO off;
EXPLAIN (COSTS off) SELECT count(*) FROM test_last_scan_part WHERE idx_col = 1;
                                     QUERY PLAN                                     
------------------------------------------------------------------------------------
 Aggregate
   ->  Partitioned Index Scan using test_last_scan_part_pkey on test_last_scan_part
         Index Cond: (idx_col = 1)
         Selected Partitions:  1
(4 rows)

SELECT count(*) FROM test_last_scan_part WHERE idx_col = 1;
 count 
-------
     1
(1 row)

EXPLAIN (COSTS off) SELECT count(*) FROM test_last_scan_part WHERE idx_col = 12;
                                     QUERY PLAN                                     
------------------------------------------------------------------------------------
 Aggregate
   ->  Partitioned Index Scan using test_last_scan_part_pkey on test_last_scan_part
         Index Cond: (idx_col = 12)
         Selected Partitions:  2
(4 rows)

SELECT count(*) FROM test_last_scan_part WHERE idx_col = 12;
 count 
-------
     1
(1 row)

SET LOCAL enable_seqscan TO on;
EXPLAIN (COSTS off) SELECT count(*) FROM test_last_scan_subpart WHERE noidx_col = 1 or noidx_col = 12;
                         QUERY PLAN                          
-------------------------------------------------------------
 Aggregate
   ->  Partition Iterator
         Iterations: 2, Sub Iterations: 4
         ->  Partitioned Seq Scan on test_last_scan_subpart
               Filter: ((noidx_col = 1) OR (noidx_col = 12))
               Selected Partitions:  1..2
               Selected Subpartitions:  ALL
(7 rows)

SELECT count(*) FROM test_last_scan_subpart WHERE noidx_col = 1 or noidx_col = 12;
 count 
-------
     2
(1 row)

SET LOCAL enable_seqscan TO off;
EXPLAIN (COSTS off) SELECT count(*) FROM test_last_scan_subpart WHERE idx_col = 1;
                                           QUERY PLAN                                           
------------------------------------------------------------------------------------------------
 Aggregate
   ->  Partition Iterator
         Iterations: 1, Sub Iterations: 1
         ->  Partitioned Index Scan using test_last_scan_subpart_pkey on test_last_scan_subpart
               Index Cond: (idx_col = 1)
               Selected Partitions:  1
               Selected Subpartitions:  1:1
(7 rows)

SELECT count(*) FROM test_last_scan_subpart WHERE idx_col = 1;
 count 
-------
     1
(1 row)

SELECT count(*) FROM test_last_scan_subpart WHERE idx_col = 2;
 count 
-------
     1
(1 row)

EXPLAIN (COSTS off) SELECT count(*) FROM test_last_scan_subpart WHERE idx_col = 12;
                                           QUERY PLAN                                           
------------------------------------------------------------------------------------------------
 Aggregate
   ->  Partition Iterator
         Iterations: 1, Sub Iterations: 1
         ->  Partitioned Index Scan using test_last_scan_subpart_pkey on test_last_scan_subpart
               Index Cond: (idx_col = 12)
               Selected Partitions:  2
               Selected Subpartitions:  2:1
(7 rows)

SELECT count(*) FROM test_last_scan_subpart WHERE idx_col = 12;
 count 
-------
     1
(1 row)

SELECT count(*) FROM test_last_scan_subpart WHERE idx_col = 11;
 count 
-------
     1
(1 row)

SELECT pg_stat_force_next_flush();
 pg_stat_force_next_flush 
--------------------------
 
(1 row)

COMMIT;
SELECT pg_sleep(1);
 pg_sleep 
----------
 
(1 row)

SELECT seq_scan, idx_scan FROM pg_stat_all_tables WHERE relid = 'test_last_scan'::regclass;
 seq_scan | idx_scan 
----------+----------
        2 |        1
(1 row)

SELECT seq_scan, idx_scan FROM pg_stat_all_tables WHERE relid = 'test_last_scan_part'::regclass;
 seq_scan | idx_scan 
----------+----------
        4 |        2
(1 row)

SELECT seq_scan, idx_scan FROM pg_stat_all_tables WHERE relid = 'test_last_scan_subpart'::regclass;
 seq_scan | idx_scan 
----------+----------
        4 |        4
(1 row)

-- fetch timestamps from before the next test
INSERT INTO test_check SELECT relid, last_seq_scan, last_idx_scan
FROM pg_stat_all_tables WHERE relid in ('test_last_scan'::regclass, 'test_last_scan_part'::regclass, 'test_last_scan_subpart'::regclass);
SELECT pg_sleep(0.1); -- assume a minimum timestamp granularity of 100ms
 pg_sleep 
----------
 
(1 row)

-- cause one sequential scan
BEGIN;
SET LOCAL enable_seqscan TO on;
SET LOCAL enable_indexscan TO off;
SET LOCAL enable_bitmapscan TO off;
EXPLAIN (COSTS off) SELECT count(*) FROM test_last_scan WHERE noidx_col = 1;
            QUERY PLAN            
----------------------------------
 Aggregate
   ->  Seq Scan on test_last_scan
         Filter: (noidx_col = 1)
(3 rows)

SELECT count(*) FROM test_last_scan WHERE noidx_col = 1;
 count 
-------
     1
(1 row)

-- scan one partition
EXPLAIN (COSTS off) SELECT count(*) FROM test_last_scan_part partition (p1) WHERE noidx_col = 1;
                    QUERY PLAN                     
---------------------------------------------------
 Aggregate
   ->  Partitioned Seq Scan on test_last_scan_part
         Filter: (noidx_col = 1)
         Selected Partitions:  1
(4 rows)

SELECT count(*) FROM test_last_scan_part partition (p1) WHERE noidx_col = 1;
 count 
-------
     1
(1 row)

-- scan one subpartition
EXPLAIN (COSTS off) SELECT count(*) FROM test_last_scan_subpart subpartition (sp4) WHERE noidx_col = 12;
                         QUERY PLAN                         
------------------------------------------------------------
 Aggregate
   ->  Partition Iterator
         Iterations: 1, Sub Iterations: 1
         ->  Partitioned Seq Scan on test_last_scan_subpart
               Filter: (noidx_col = 12)
               Selected Partitions:  2
               Selected Subpartitions:  2:1
(7 rows)

SELECT count(*) FROM test_last_scan_subpart subpartition (sp4) WHERE noidx_col = 12;
 count 
-------
     1
(1 row)

SELECT pg_stat_force_next_flush();
 pg_stat_force_next_flush 
--------------------------
 
(1 row)

COMMIT;
SELECT pg_sleep(1);
 pg_sleep 
----------
 
(1 row)

-- check that just sequential scan stats were incremented
SELECT relname, seq_scan, test_last_seq < last_seq_scan AS seq_ok, idx_scan, test_last_idx = last_idx_scan AS idx_ok
FROM test_check left join pg_stat_all_tables on id=relid ORDER BY relname;
        relname         | seq_scan | seq_ok | idx_scan | idx_ok 
------------------------+----------+--------+----------+--------
 test_last_scan         |        4 | t      |        1 | t
 test_last_scan_part    |        6 | t      |        2 | t
 test_last_scan_subpart |        5 | t      |        4 | t
(3 rows)

-- fetch timestamps from before the next test
DELETE FROM test_check;
INSERT INTO test_check SELECT relid, last_seq_scan, last_idx_scan
FROM pg_stat_all_tables WHERE relid in ('test_last_scan'::regclass, 'test_last_scan_part'::regclass, 'test_last_scan_subpart'::regclass);
SELECT pg_sleep(0.1);
 pg_sleep 
----------
 
(1 row)

-- cause one index scan
BEGIN;
SET LOCAL enable_seqscan TO off;
SET LOCAL enable_indexscan TO on;
SET LOCAL enable_bitmapscan TO off;
EXPLAIN (COSTS off) SELECT count(*) FROM test_last_scan WHERE idx_col = 1;
                          QUERY PLAN                          
--------------------------------------------------------------
 Aggregate
   ->  Index Scan using test_last_scan_pkey on test_last_scan
         Index Cond: (idx_col = 1)
(3 rows)

SELECT count(*) FROM test_last_scan WHERE idx_col = 1;
 count 
-------
     1
(1 row)

-- scan one partition
EXPLAIN (COSTS off) SELECT count(*) FROM test_last_scan_part WHERE idx_col = 12;
                                     QUERY PLAN                                     
------------------------------------------------------------------------------------
 Aggregate
   ->  Partitioned Index Scan using test_last_scan_part_pkey on test_last_scan_part
         Index Cond: (idx_col = 12)
         Selected Partitions:  2
(4 rows)

SELECT count(*) FROM test_last_scan_part WHERE idx_col = 12;
 count 
-------
     1
(1 row)

-- scan one subpartition
EXPLAIN (COSTS off) SELECT count(*) FROM test_last_scan_subpart WHERE idx_col = 2;
                                           QUERY PLAN                                           
------------------------------------------------------------------------------------------------
 Aggregate
   ->  Partition Iterator
         Iterations: 1, Sub Iterations: 1
         ->  Partitioned Index Scan using test_last_scan_subpart_pkey on test_last_scan_subpart
               Index Cond: (idx_col = 2)
               Selected Partitions:  1
               Selected Subpartitions:  1:1
(7 rows)

SELECT count(*) FROM test_last_scan_subpart WHERE idx_col = 2;
 count 
-------
     1
(1 row)

SELECT pg_stat_force_next_flush();
 pg_stat_force_next_flush 
--------------------------
 
(1 row)

COMMIT;
SELECT pg_sleep(1);
 pg_sleep 
----------
 
(1 row)

-- check that just index scan stats were incremented
SELECT relname, seq_scan, test_last_seq = last_seq_scan AS seq_ok, idx_scan, test_last_idx < last_idx_scan AS idx_ok
FROM test_check left join pg_stat_all_tables on id=relid ORDER BY relname;
        relname         | seq_scan | seq_ok | idx_scan | idx_ok 
------------------------+----------+--------+----------+--------
 test_last_scan         |        4 | t      |        2 | t
 test_last_scan_part    |        6 | t      |        3 | t
 test_last_scan_subpart |        5 | t      |        5 | t
(3 rows)

-- fetch timestamps from before the next test
DELETE FROM test_check;
INSERT INTO test_check SELECT relid, last_seq_scan, last_idx_scan
FROM pg_stat_all_tables WHERE relid in ('test_last_scan'::regclass, 'test_last_scan_part'::regclass, 'test_last_scan_subpart'::regclass);
SELECT pg_sleep(0.1);
 pg_sleep 
----------
 
(1 row)

-- cause one bitmap index scan
BEGIN;
SET LOCAL enable_seqscan TO off;
SET LOCAL enable_indexscan TO off;
SET LOCAL enable_bitmapscan TO on;
EXPLAIN (COSTS off) SELECT count(*) FROM test_last_scan WHERE idx_col = 1;
                      QUERY PLAN                      
------------------------------------------------------
 Aggregate
   ->  Bitmap Heap Scan on test_last_scan
         Recheck Cond: (idx_col = 1)
         ->  Bitmap Index Scan on test_last_scan_pkey
               Index Cond: (idx_col = 1)
(5 rows)

SELECT count(*) FROM test_last_scan WHERE idx_col = 1;
 count 
-------
     1
(1 row)

-- scan all partition
EXPLAIN (COSTS off) SELECT count(*) FROM test_last_scan_part WHERE idx_col = 1 or idx_col = 12;
                                    QUERY PLAN                                     
-----------------------------------------------------------------------------------
 Aggregate
   ->  Partition Iterator
         Iterations: 2
         ->  Partitioned Bitmap Heap Scan on test_last_scan_part
               Recheck Cond: ((idx_col = 1) OR (idx_col = 12))
               Selected Partitions:  1..2
               ->  BitmapOr
                     ->  Partitioned Bitmap Index Scan on test_last_scan_part_pkey
                           Index Cond: (idx_col = 1)
                           Selected Partitions:  1..2
                     ->  Partitioned Bitmap Index Scan on test_last_scan_part_pkey
                           Index Cond: (idx_col = 12)
                           Selected Partitions:  1..2
(13 rows)

SELECT count(*) FROM test_last_scan_part WHERE idx_col = 1 or idx_col = 12;
 count 
-------
     2
(1 row)

-- scan one partition
EXPLAIN (COSTS off) SELECT count(*) FROM test_last_scan_subpart WHERE idx_col = 1 or idx_col = 2;
                                      QUERY PLAN                                      
--------------------------------------------------------------------------------------
 Aggregate
   ->  Partition Iterator
         Iterations: 1, Sub Iterations: 2
         ->  Partitioned Bitmap Heap Scan on test_last_scan_subpart
               Recheck Cond: ((idx_col = 1) OR (idx_col = 2))
               Selected Partitions:  1
               Selected Subpartitions:  ALL
               ->  BitmapOr
                     ->  Partitioned Bitmap Index Scan on test_last_scan_subpart_pkey
                           Index Cond: (idx_col = 1)
                           Selected Partitions:  1
                           Selected Subpartitions:  ALL
                     ->  Partitioned Bitmap Index Scan on test_last_scan_subpart_pkey
                           Index Cond: (idx_col = 2)
                           Selected Partitions:  1
                           Selected Subpartitions:  ALL
(16 rows)

SELECT count(*) FROM test_last_scan_subpart WHERE idx_col = 1 or idx_col = 2;
 count 
-------
     2
(1 row)

SELECT pg_stat_force_next_flush();
 pg_stat_force_next_flush 
--------------------------
 
(1 row)

COMMIT;
SELECT pg_sleep(1);
 pg_sleep 
----------
 
(1 row)

-- check that just index scan stats were incremented
SELECT relname, seq_scan, test_last_seq = last_seq_scan AS seq_ok, idx_scan, test_last_idx < last_idx_scan AS idx_ok
FROM test_check left join pg_stat_all_tables on id=relid ORDER BY relname;
        relname         | seq_scan | seq_ok | idx_scan | idx_ok 
------------------------+----------+--------+----------+--------
 test_last_scan         |        4 | t      |        3 | t
 test_last_scan_part    |        6 | t      |        7 | t
 test_last_scan_subpart |        5 | t      |        9 | t
(3 rows)

-- End of Stats Test
reset search_path;
set client_min_messages = error;
drop schema sch_stats cascade;
