-- for concurrent delete
-- testcase: rollback, delete same records
drop table if exists z1;
NOTICE:  table "z1" does not exist, skipping
create table z1 (c1 int) with (storage_type=USTORE);
insert into z1 values (1);
insert into z1 values (2);
insert into z1 values (3);
insert into z1 values (4);
insert into z1 values (5);
insert into z1 values (6);
select * from z1 order by c1;
 c1 
----
  1
  2
  3
  4
  5
  6
(6 rows)

\parallel on 2
declare
	cnt int;
begin
	delete from z1 where c1=1;
	perform pg_sleep(1);
	delete from z1 where c1=2;
	select count(*) into cnt from z1;
	if cnt != 4 then
		raise notice 'ERROR: worker 1 expect cnt = %, but %', 4, cnt;
	end if;
	perform pg_sleep(1);
	RAISE EXCEPTION '';
end;
/
declare
	cnt int;
begin
	perform pg_sleep(3);
	delete from z1 where c1=1;
	perform pg_sleep(1);
	delete from z1 where c1=2;
	select count(*) into cnt from z1;
	if cnt != 4 then
		raise notice 'ERROR: worker 2 expect cnt = %, but %', 4, cnt;
	end if;
	RAISE EXCEPTION '';
end;
/
\parallel off
ERROR:  
ERROR:  
select * from z1 order by c1; -- should be 1, 2, 3, 4, 5, 6
 c1 
----
  1
  2
  3
  4
  5
  6
(6 rows)

drop table z1;
-- testcase: rollback, delete different records
create table z1 (c1 int) with (storage_type=USTORE);
insert into z1 values (1);
insert into z1 values (2);
insert into z1 values (3);
insert into z1 values (4);
insert into z1 values (5);
insert into z1 values (6);
\parallel on 2
declare
	cnt int;
begin
	delete from z1 where c1=1;
	perform pg_sleep(1);
	delete from z1 where c1=2;
	select count(*) into cnt from z1;
	if cnt != 4 then
		raise notice 'ERROR: worker 1 expect cnt = %, but %', 4, cnt;
	end if;
	perform pg_sleep(1);
	RAISE EXCEPTION '';
end;
/
declare
	cnt int;
begin
	perform pg_sleep(1);
	delete from z1 where c1=3;
	perform pg_sleep(2);
	delete from z1 where c1=4;
	select count(*) into cnt from z1;
	if cnt != 4 then
		raise notice 'ERROR: worker 2 expect cnt = %, but %', 4, cnt;
	end if;
	RAISE EXCEPTION '';
end;
/
\parallel off
ERROR:  
ERROR:  
select * from z1 order by c1; -- should be 1, 2, 3, 4, 5, 6
 c1 
----
  1
  2
  3
  4
  5
  6
(6 rows)

drop table z1;
