create table t1 (c1 int) with (storage_type=ustore);
insert into t1 values (0);
/* protect from updating */
\parallel on 2
begin
    perform * from t1 for share;
    pg_sleep(1.5);
    raise notice 'subtxn1 select-for-share';
exception
    when others then
        raise notice 'error';
end;
/
begin
    pg_sleep(0.5);
    update t1 set c1 = c1 + 1;
    raise notice 'txn2 update';
end;
/
\parallel off
WARNING:  UHeapUpdate returned 5
CONTEXT:  SQL statement "update t1 set c1 = c1 + 1"
PL/pgSQL function inline_code_block line 3 at SQL statement
NOTICE:  subtxn1 select-for-share
NOTICE:  txn2 update
select * from t1; -- expected as (1)
 c1 
----
  1
(1 row)

/* protect from deleting */
\parallel on 2
begin
    perform * from t1 for share;
    pg_sleep(1.5);
    raise notice 'subtxn1 select-for-share';
exception
    when others then
        raise notice 'error';
end;
/
declare
    cnt int;
begin
    pg_sleep(0.5);
    delete from t1;
    select count(*) into cnt from t1;
    raise notice 'txn2 delete, cnt %', cnt;
    raise exception '';
end;
/
\parallel off
WARNING:  UHeapDelete returned 5
CONTEXT:  SQL statement "delete from t1"
PL/pgSQL function inline_code_block line 4 at SQL statement
NOTICE:  subtxn1 select-for-share
NOTICE:  txn2 delete, cnt 0
ERROR:  
select * from t1; -- expected as (1)
 c1 
----
  1
(1 row)

/* protect from select-for-update */
\parallel on 2
begin
    perform * from t1 for share;
    pg_sleep(1.5);
    raise notice 'subtxn1 select-for-share';
exception
    when others then
        raise notice 'error';
end;
/
begin
    pg_sleep(0.5);
    perform * from t1 for update;
    update t1 set c1 = c1 + 1;
    raise notice 'txn2 select-for-update';     
end;
/
\parallel off
WARNING:  UHeapLockTuple returned 5
CONTEXT:  SQL statement "SELECT * from t1 for update"
PL/pgSQL function inline_code_block line 3 at PERFORM
NOTICE:  subtxn1 select-for-share
WARNING:  UHeapUpdate returned 5
CONTEXT:  SQL statement "update t1 set c1 = c1 + 1"
PL/pgSQL function inline_code_block line 4 at SQL statement
NOTICE:  txn2 select-for-update
select * from t1; -- expected as (2)
 c1 
----
  2
(1 row)

drop table t1;
