-- test update
drop table if exists t1;
NOTICE:  table "t1" does not exist, skipping
create table t1(c1 integer, c2 integer default 200) with (storage_type=USTORE);
start transaction;
insert into t1 values(10, 20);
insert into t1 values(20, 30);
insert into t1 values(30, 40);
insert into t1 values(40, 50);
insert into t1 values(50, 60);
insert into t1 values(60, 70);
insert into t1 values(70, 80);
insert into t1 values(80, 90);
commit;
select * from t1;
 c1 | c2 
----+----
 10 | 20
 20 | 30
 30 | 40
 40 | 50
 50 | 60
 60 | 70
 70 | 80
 80 | 90
(8 rows)

start transaction;
update t1 set c2 = 100 where c1 > 60;
commit;
select * from t1;
 c1 | c2  
----+-----
 10 |  20
 20 |  30
 30 |  40
 40 |  50
 50 |  60
 60 |  70
 70 | 100
 80 | 100
(8 rows)

start transaction;
update t1 set c2 = DEFAULT where c1 > 60;
commit;
select * from t1;
 c1 | c2  
----+-----
 10 |  20
 20 |  30
 30 |  40
 40 |  50
 50 |  60
 60 |  70
 70 | 200
 80 | 200
(8 rows)

-- Try with a larger column value. Pruning logic will shuffle all the rows to make space for the larger rows
drop table if exists t2;
NOTICE:  table "t2" does not exist, skipping
create table t2(c1 integer, c2 varchar(64)) with (storage_type=USTORE);
start transaction;
insert into t2 values(10, 'abc');
insert into t2 values(20, 'bbc');
insert into t2 values(30, 'cbc');
insert into t2 values(40, 'dbc');
insert into t2 values(50, 'ebc');
insert into t2 values(60, 'fbc');
insert into t2 values(70, 'gbc');
insert into t2 values(80, 'hbc');
insert into t2 values(90, 'ibc');
insert into t2 values(100, 'jbc');
commit;
select * from t2;
 c1  | c2  
-----+-----
  10 | abc
  20 | bbc
  30 | cbc
  40 | dbc
  50 | ebc
  60 | fbc
  70 | gbc
  80 | hbc
  90 | ibc
 100 | jbc
(10 rows)

start transaction;
update t2 set c2 = 'abcabcabc' where c1 > 60;
commit;
select * from t2;
 c1  |    c2     
-----+-----------
  10 | abc
  20 | bbc
  30 | cbc
  40 | dbc
  50 | ebc
  60 | fbc
  70 | abcabcabc
  80 | abcabcabc
  90 | abcabcabc
 100 | abcabcabc
(10 rows)

-- Rollback of inplace update
drop table if exists t3;
NOTICE:  table "t3" does not exist, skipping
create table t3(c1 integer, c2 integer) with (storage_type=USTORE);
start transaction;
insert into t3 values(1, 2);
insert into t3 values(3, 4);
insert into t3 values(5, 6);
insert into t3 values(7, 8);
insert into t3 values(9, 10);
commit;
select * from t3;
 c1 | c2 
----+----
  1 |  2
  3 |  4
  5 |  6
  7 |  8
  9 | 10
(5 rows)

start transaction;
update t3 set c2 = 20 where c1 = 5;
update t3 set c2 = 30 where c1 = 7;
select * from t3;
 c1 | c2 
----+----
  1 |  2
  3 |  4
  5 | 20
  7 | 30
  9 | 10
(5 rows)

rollback;
select * from t3;
 c1 | c2 
----+----
  1 |  2
  3 |  4
  5 |  6
  7 |  8
  9 | 10
(5 rows)

-- Rollback of non-inplace update
-- Note that the first update statement causes 
-- page to be pruned and re-arranged so the update is done inplace.
-- The second update is done as a pure non-inplace update because 
-- we do not prune a data page with open transaction on a tuple. 
drop table if exists t4;
NOTICE:  table "t4" does not exist, skipping
create table t4(c1 integer, c2 varchar(128)) with (storage_type=USTORE);
start transaction;
insert into t4 values(1, 'abc');
insert into t4 values(2, 'bcd');
insert into t4 values(3, 'cde');
insert into t4 values(4, 'def');
insert into t4 values(5, 'efg');
commit;
select * from t4 order by c1;
 c1 | c2  
----+-----
  1 | abc
  2 | bcd
  3 | cde
  4 | def
  5 | efg
(5 rows)

start transaction;
update t4 set c2 = 'aaaabbbbccccdddd' where c1 = 3;
update t4 set c2 = 'aaaabbbbccccdddd' where c1 = 2;
select * from t4 order by c1;
 c1 |        c2        
----+------------------
  1 | abc
  2 | aaaabbbbccccdddd
  3 | aaaabbbbccccdddd
  4 | def
  5 | efg
(5 rows)

rollback;
select * from t4 order by c1;
 c1 | c2  
----+-----
  1 | abc
  2 | bcd
  3 | cde
  4 | def
  5 | efg
(5 rows)

-- Test updates involving mixed table types
drop table if exists t5;
NOTICE:  table "t5" does not exist, skipping
drop table if exists t6;
NOTICE:  table "t6" does not exist, skipping
create table t5(a integer, b integer) with (orientation = column);
create table t6(a integer, b integer) with (storage_type=USTORE);
insert into t5 values(generate_series(1,10,1) , generate_series(1,10,1));
insert into t6 values(generate_series(1,10,1) , generate_series(1,10,1));
update t5 set b = 999 from t6 where t5.a=t6.a;
select count(*) from t5 where b = 999;
 count 
-------
    10
(1 row)

drop table t1;
drop table t2;
drop table t3;
drop table t4;
drop table t5;
drop table t6;
