-- test update
CREATE SCHEMA test_ustore_update;
SET current_schema = test_ustore_update;
drop table if exists t1;
NOTICE:  table "t1" does not exist, skipping
create table t1(c1 integer, c2 integer default 200) with (storage_type=USTORE);
create index idx1 on t1(c1);
start transaction;
insert into t1 values(10, 20);
insert into t1 values(20, 30);
insert into t1 values(30, 40);
insert into t1 values(40, 50);
insert into t1 values(50, 60);
insert into t1 values(60, 70);
insert into t1 values(70, 80);
insert into t1 values(80, 90);
update t1 set c2 = 100 where c1 > 60;
commit;
select * from t1;
 c1 | c2  
----+-----
 10 |  20
 20 |  30
 30 |  40
 40 |  50
 50 |  60
 60 |  70
 70 | 100
 80 | 100
(8 rows)

select /*+ indexonlyscan(t1) */ sum(c1), count(*) from t1 union select /*+ tablescan(t1) */ sum(c1),count(*) from t1;
 sum | count 
-----+-------
 360 |     8
(1 row)

start transaction;
update t1 set c2 = 100 where c1 > 60;
commit;
select * from t1 order by c1;
 c1 | c2  
----+-----
 10 |  20
 20 |  30
 30 |  40
 40 |  50
 50 |  60
 60 |  70
 70 | 100
 80 | 100
(8 rows)

select /*+ indexonlyscan(t1) */ sum(c1), count(*) from t1 union select /*+ tablescan(t1) */ sum(c1),count(*) from t1;
 sum | count 
-----+-------
 360 |     8
(1 row)

-- Rollback of inplace update
drop table if exists t3;
NOTICE:  table "t3" does not exist, skipping
create table t3(c1 integer, c2 integer) with (storage_type=USTORE);
start transaction;
insert into t3 values(1, 2);
insert into t3 values(3, 4);
insert into t3 values(5, 6);
insert into t3 values(7, 8);
insert into t3 values(9, 10);
commit;
create index idx3 on t3(c1);
select * from t3 order by c1;
 c1 | c2 
----+----
  1 |  2
  3 |  4
  5 |  6
  7 |  8
  9 | 10
(5 rows)

select /*+ indexonlyscan(t3) */ sum(c1), count(*) from t3 union select /*+ tablescan(t3) */ sum(c1),count(*) from t3;
 sum | count 
-----+-------
  25 |     5
(1 row)

start transaction;
update t3 set c2 = 20 where c1 = 5;
update t3 set c2 = 30 where c1 = 7;
select * from t3 order by c1;
 c1 | c2 
----+----
  1 |  2
  3 |  4
  5 | 20
  7 | 30
  9 | 10
(5 rows)

rollback;
select * from t3 order by c1;
 c1 | c2 
----+----
  1 |  2
  3 |  4
  5 |  6
  7 |  8
  9 | 10
(5 rows)

select /*+ indexonlyscan(t3) */ sum(c1), count(*) from t3 union select /*+ tablescan(t3) */ sum(c1),count(*) from t3;
 sum | count 
-----+-------
  25 |     5
(1 row)

-- Rollback of non-inplace update
-- Note that the first update statement causes 
-- page to be pruned and re-arranged so the update is done inplace.
-- The second update is done as a pure non-inplace update because 
-- we do not prune a data page with open transaction on a tuple. 
drop table if exists t4;
NOTICE:  table "t4" does not exist, skipping
create table t4(c1 integer primary key, c2 varchar(128)) with (storage_type=USTORE);
NOTICE:  CREATE TABLE / PRIMARY KEY will create implicit index "t4_pkey" for table "t4"
start transaction;
insert into t4 values(1, 'abc');
insert into t4 values(2, 'bcd');
insert into t4 values(3, 'cde');
insert into t4 values(generate_series(4, 500), 'defdewjhdlsahdlsa');
update t4 set c2 = 'aaaabbbb' where c1 < 10;
update t4 set c2 = 'aaaabbbbhjhjjhjhjhjhjhjhjhj' where c1 < 10;
commit;
create index idx4 on t4(c1);
select * from t4 order by c1 limit 10;
 c1 |             c2              
----+-----------------------------
  1 | aaaabbbbhjhjjhjhjhjhjhjhjhj
  2 | aaaabbbbhjhjjhjhjhjhjhjhjhj
  3 | aaaabbbbhjhjjhjhjhjhjhjhjhj
  4 | aaaabbbbhjhjjhjhjhjhjhjhjhj
  5 | aaaabbbbhjhjjhjhjhjhjhjhjhj
  6 | aaaabbbbhjhjjhjhjhjhjhjhjhj
  7 | aaaabbbbhjhjjhjhjhjhjhjhjhj
  8 | aaaabbbbhjhjjhjhjhjhjhjhjhj
  9 | aaaabbbbhjhjjhjhjhjhjhjhjhj
 10 | defdewjhdlsahdlsa
(10 rows)

select /*+ indexonlyscan(t4) */ sum(c1), count(*) from t4 union select /*+ tablescan(t4) */ sum(c1),count(*) from t4;
  sum   | count 
--------+-------
 125250 |   500
(1 row)

start transaction;
update t4 set c2 = 'aaaabbbbccccdddd' where c1 = 3;
update t4 set c2 = 'aa';
update t4 set c2 = 'aaaaa';
update t4 set c2 = 'aaaaaaaaaaaaaaaahdkjdsd';
select /*+ indexonlyscan(t4) */ sum(c1), count(*) from t4 union select /*+ tablescan(t4) */ sum(c1),count(*) from t4;
  sum   | count 
--------+-------
 125250 |   500
(1 row)

rollback;
select * from t4 order by c1 limit 10;
 c1 |             c2              
----+-----------------------------
  1 | aaaabbbbhjhjjhjhjhjhjhjhjhj
  2 | aaaabbbbhjhjjhjhjhjhjhjhjhj
  3 | aaaabbbbhjhjjhjhjhjhjhjhjhj
  4 | aaaabbbbhjhjjhjhjhjhjhjhjhj
  5 | aaaabbbbhjhjjhjhjhjhjhjhjhj
  6 | aaaabbbbhjhjjhjhjhjhjhjhjhj
  7 | aaaabbbbhjhjjhjhjhjhjhjhjhj
  8 | aaaabbbbhjhjjhjhjhjhjhjhjhj
  9 | aaaabbbbhjhjjhjhjhjhjhjhjhj
 10 | defdewjhdlsahdlsa
(10 rows)

select /*+ indexonlyscan(t4) */ sum(c1), count(*) from t4 union select /*+ tablescan(t4) */ sum(c1),count(*) from t4;
  sum   | count 
--------+-------
 125250 |   500
(1 row)

start transaction;
update t4 set c2 = 'aa';
update t4 set c2 = 'aaaaa';
update t4 set c2 = 'aaaaaaaaaaaaaaaahdkjdsd';
commit;
select * from t4 order by c1 limit 10;
 c1 |           c2            
----+-------------------------
  1 | aaaaaaaaaaaaaaaahdkjdsd
  2 | aaaaaaaaaaaaaaaahdkjdsd
  3 | aaaaaaaaaaaaaaaahdkjdsd
  4 | aaaaaaaaaaaaaaaahdkjdsd
  5 | aaaaaaaaaaaaaaaahdkjdsd
  6 | aaaaaaaaaaaaaaaahdkjdsd
  7 | aaaaaaaaaaaaaaaahdkjdsd
  8 | aaaaaaaaaaaaaaaahdkjdsd
  9 | aaaaaaaaaaaaaaaahdkjdsd
 10 | aaaaaaaaaaaaaaaahdkjdsd
(10 rows)

select /*+ indexonlyscan(t4) */ sum(c1), count(*) from t4 union select /*+ tablescan(t4) */ sum(c1),count(*) from t4;
  sum   | count 
--------+-------
 125250 |   500
(1 row)

-- Test updates involving mixed table types
drop table if exists t5;
NOTICE:  table "t5" does not exist, skipping
drop table if exists t6;
NOTICE:  table "t6" does not exist, skipping
create table t5(a integer, b integer) with (orientation = column);
create table t6(a integer, b integer) with (storage_type=USTORE);
insert into t5 values(generate_series(1,10,1) , generate_series(1,10,1));
insert into t6 values(generate_series(1,10,1) , generate_series(1,10,1));
update t5 set b = 999 from t6 where t5.a=t6.a;
select count(*) from t5 where b = 999;
 count 
-------
    10
(1 row)

drop table t1;
drop table t3;
drop table t4;
drop table t5;
drop table t6;
-- end
DROP SCHEMA test_ustore_update cascade;
