-- ustore concurrency whitebox testing
-- testing the following functions returning TM_Result 3-7:
-- UHeapLockTuple
-- UHeapDelete
-- UHeapUpdate
-- TM_Result reference:
-- TM_Ok=0              no concurrency
-- TM_Invisible=1       should never happen
-- TM_SelfModified=2
-- TM_Updated=3         update happens before target statmenet
-- TM_Deleted=4         delete happens before target statement
-- TM_BeingModified=5   select for share/update happens before target statement
-- TM_SelfCreated=6     tuple is created/modified in the same statement
-- TM_SelfUpdated=7     tuple is created/modified in the same statement
------------------------------
-- UHeapLockTuple returning 3 (TM_Updated)
------------------------------
create table t_lock (c1 int) with (storage_type=USTORE);
insert into t_lock values (1);
-- update happens before select foe update
\parallel on 2
begin
    perform pg_sleep(1);
    perform c1 from t_lock for update;
end;
/
begin
    update t_lock set c1 = 2;
    perform pg_sleep(2);
end;
/
\parallel off
WARNING:  UHeapLockTuple returned 5
CONTEXT:  SQL statement "SELECT c1 from t_lock for update"
PL/pgSQL function inline_code_block line 3 at PERFORM
WARNING:  UHeapLockTuple returned 3
CONTEXT:  SQL statement "SELECT c1 from t_lock for update"
PL/pgSQL function inline_code_block line 3 at PERFORM
WARNING:  UHeapLockTuple returned 3
CONTEXT:  SQL statement "SELECT c1 from t_lock for update"
PL/pgSQL function inline_code_block line 3 at PERFORM
drop table t_lock;
------------------------------
-- UHeapLockTuple returning 4 (TM_Deleted)
------------------------------
create table t_lock (c1 int) with (storage_type=USTORE);
insert into t_lock values (1);
-- delete happens before select for update
\parallel on 2
begin
    perform pg_sleep(1);
    perform c1 from t_lock for update;
end;
/
begin
    delete from t_lock;
    perform pg_sleep(2);
end;
/
\parallel off
WARNING:  UHeapLockTuple returned 5
CONTEXT:  SQL statement "SELECT c1 from t_lock for update"
PL/pgSQL function inline_code_block line 3 at PERFORM
WARNING:  UHeapLockTuple returned 4
CONTEXT:  SQL statement "SELECT c1 from t_lock for update"
PL/pgSQL function inline_code_block line 3 at PERFORM
drop table t_lock;
------------------------------
-- UHeapLockTuple returning 5 (TM_BeingModified)
------------------------------
create table t_lock (c1 int) with (storage_type=USTORE);
insert into t_lock values (1);
-- select for share happens before select foe update
\parallel on 2
begin
    perform pg_sleep(1);
    perform c1 from t_lock for update;
end;
/
begin
    perform c1 from t_lock for share;
    perform pg_sleep(2);
end;
/
\parallel off
WARNING:  UHeapLockTuple returned 5
CONTEXT:  SQL statement "SELECT c1 from t_lock for update"
PL/pgSQL function inline_code_block line 3 at PERFORM
drop table t_lock;
------------------------------
-- prepare for below 2 cases
------------------------------
CREATE TABLE t1_lock (
    c1 INT
) with(storage_type=ustore);
INSERT INTO t1_lock VALUES (1);
INSERT INTO t1_lock VALUES (1);
SELECT * FROM t1_lock;
 c1 
----
  1
  1
(2 rows)

CREATE TABLE t2_lock (
    c1 INT PRIMARY KEY,
    c2 INT DEFAULT 1
) with(storage_type=ustore);
NOTICE:  CREATE TABLE / PRIMARY KEY will create implicit index "t2_lock_pkey" for table "t2_lock"
------------------------------
-- UHeapLockTuple returning 6 (TM_SelfCreated)
------------------------------
explain (costs off)
INSERT INTO t2_lock (c1)
    SELECT c1 FROM t1_lock
    ON DUPLICATE KEY UPDATE c2 = c2 + 1;
                QUERY PLAN                
------------------------------------------
 Insert on t2_lock
   Conflict Resolution: UPDATE
   Conflict Arbiter Indexes: t2_lock_pkey
   ->  Seq Scan on t1_lock
(4 rows)

INSERT INTO t2_lock (c1)
    SELECT c1 FROM t1_lock
    ON DUPLICATE KEY UPDATE c2 = c2 + 1;
WARNING:  UHeapLockTuple returned 6
WARNING:  UHeapUpdate returned 5
select * from t2_lock;
 c1 | c2 
----+----
  1 |  2
(1 row)

delete from t2_lock;
INSERT INTO t2_lock (c1)
    SELECT c1 FROM t1_lock
    ON DUPLICATE KEY UPDATE c2 = c2 + 1;
WARNING:  UHeapLockTuple returned 6
WARNING:  UHeapUpdate returned 5
select * from t2_lock;
 c1 | c2 
----+----
  1 |  2
(1 row)

------------------------------
-- UHeapLockTuple returning 7 (TM_SelfUpdated)
------------------------------
INSERT INTO t2_lock (c1)
    SELECT c1 FROM t1_lock
    ON DUPLICATE KEY UPDATE c2 = c2 + 1;
WARNING:  UHeapUpdate returned 5
WARNING:  UHeapLockTuple returned 7
WARNING:  UHeapUpdate returned 5
select * from t2_lock;
 c1 | c2 
----+----
  1 |  4
(1 row)

INSERT INTO t2_lock (c1)
    SELECT c1 FROM t1_lock
    ON DUPLICATE KEY UPDATE c2 = c2 + 1;
WARNING:  UHeapUpdate returned 5
WARNING:  UHeapLockTuple returned 6
WARNING:  UHeapUpdate returned 5
select * from t2_lock;
 c1 | c2 
----+----
  1 |  6
(1 row)

------------------------------
-- cleanup for above 2 cases
------------------------------
drop table t1_lock;
drop table t2_lock;
------------------------------
-- UHeapDelete returning 3 (TM_Updated)
------------------------------
create table t_delete (c1 int) with (storage_type=USTORE);
insert into t_delete values (1);
-- update happens before delete
\parallel on 2
begin
    perform pg_sleep(1);
    delete from t_delete;
end;
/
begin
    update t_delete set c1 = 2;
    perform pg_sleep(2);
end;
/
\parallel off
WARNING:  UHeapDelete returned 5
CONTEXT:  SQL statement "delete from t_delete"
PL/pgSQL function inline_code_block line 3 at SQL statement
WARNING:  UHeapDelete returned 3
CONTEXT:  SQL statement "delete from t_delete"
PL/pgSQL function inline_code_block line 3 at SQL statement
WARNING:  UHeapLockTuple returned 3
CONTEXT:  SQL statement "delete from t_delete"
PL/pgSQL function inline_code_block line 3 at SQL statement
WARNING:  UHeapDelete returned 5
CONTEXT:  SQL statement "delete from t_delete"
PL/pgSQL function inline_code_block line 3 at SQL statement
drop table t_delete;
------------------------------
-- UHeapDelete returning 4 (TM_Deleted)
------------------------------
create table t_delete (c1 int) with (storage_type=USTORE);
insert into t_delete values (1);
-- delete 2 happens before delete 1
\parallel on 2
begin
    perform pg_sleep(1);
    delete from t_delete;
end;
/
begin
    delete from t_delete;
    perform pg_sleep(2);
end;
/
\parallel off
WARNING:  UHeapDelete returned 5
CONTEXT:  SQL statement "delete from t_delete"
PL/pgSQL function inline_code_block line 3 at SQL statement
WARNING:  UHeapDelete returned 4
CONTEXT:  SQL statement "delete from t_delete"
PL/pgSQL function inline_code_block line 3 at SQL statement
drop table t_delete;
------------------------------
-- UHeapDelete returning 5 (TM_BeingModified)
------------------------------
create table t_delete (c1 int) with (storage_type=USTORE);
insert into t_delete values (1);
-- select for update happens before delete
\parallel on 2
begin
    perform pg_sleep(1);
    delete from t_delete;
end;
/
begin
    perform c1 from t_delete for update;
    perform pg_sleep(2);
end;
/
\parallel off
WARNING:  UHeapDelete returned 5
CONTEXT:  SQL statement "delete from t_delete"
PL/pgSQL function inline_code_block line 3 at SQL statement
drop table t_delete;
------------------------------
-- UHeapDelete returning 6 (TM_SelfCreated)
------------------------------
------------------------------
-- UHeapDelete returning 7 (TM_SelfUpdated)
------------------------------
------------------------------
-- UHeapUpdate returning 3 (TM_Updated)
------------------------------
create table t_update (c1 int) with (storage_type=USTORE);
insert into t_update values (1);
-- update 2 happens before update 1
\parallel on 2
begin
    perform pg_sleep(1);
    update t_update set c1 = 2;
end;
/
begin
    update t_update set c1 = 2;
    perform pg_sleep(2);
end;
/
\parallel off
WARNING:  UHeapUpdate returned 5
CONTEXT:  SQL statement "update t_update set c1 = 2"
PL/pgSQL function inline_code_block line 3 at SQL statement
WARNING:  UHeapUpdate returned 3
CONTEXT:  SQL statement "update t_update set c1 = 2"
PL/pgSQL function inline_code_block line 3 at SQL statement
WARNING:  UHeapLockTuple returned 3
CONTEXT:  SQL statement "update t_update set c1 = 2"
PL/pgSQL function inline_code_block line 3 at SQL statement
WARNING:  UHeapUpdate returned 5
CONTEXT:  SQL statement "update t_update set c1 = 2"
PL/pgSQL function inline_code_block line 3 at SQL statement
drop table t_update;
------------------------------
-- UHeapUpdate returning 4 (TM_Deleted)
------------------------------
create table t_update (c1 int) with (storage_type=USTORE);
insert into t_update values (1);
-- delete happens before update
\parallel on 2
begin
    perform pg_sleep(1);
    update t_update set c1 = 2;
end;
/
begin
    delete from t_update;
    perform pg_sleep(2);
end;
/
\parallel off
WARNING:  UHeapUpdate returned 5
CONTEXT:  SQL statement "update t_update set c1 = 2"
PL/pgSQL function inline_code_block line 3 at SQL statement
WARNING:  UHeapUpdate returned 4
CONTEXT:  SQL statement "update t_update set c1 = 2"
PL/pgSQL function inline_code_block line 3 at SQL statement
drop table t_update;
------------------------------
-- UHeapUpdate returning 5 (TM_BeingModified)
------------------------------
create table t_update (c1 int) with (storage_type=USTORE);
insert into t_update values (1);
-- select for update happens before update
\parallel on 2
begin
    perform pg_sleep(1);
    update t_update set c1 = 2;
end;
/
begin
    perform c1 from t_update for update;
    perform pg_sleep(2);
end;
/
\parallel off
WARNING:  UHeapUpdate returned 5
CONTEXT:  SQL statement "update t_update set c1 = 2"
PL/pgSQL function inline_code_block line 3 at SQL statement
drop table t_update;
------------------------------
-- UHeapUpdate returning 6 (TM_SelfCreated)
------------------------------
------------------------------
-- UHeapUpdate returning 7 (TM_SelfUpdated)
------------------------------
create table t(a int, b double precision) with (storage_type=USTORE);
create index ta on t(a);
create index tb on t(b);
insert into t values(generate_series(1, 1000), generate_series(1, 1000));
explain (costs off)
update t set a = a + 1 where a >= 1 and a <= 1000;
                      QUERY PLAN                      
------------------------------------------------------
 Update on t
   ->  Bitmap Heap Scan on t
         Recheck Cond: ((a >= 1) AND (a <= 1000))
         ->  Bitmap Index Scan on ta
               Index Cond: ((a >= 1) AND (a <= 1000))
(5 rows)

explain (costs off)
update t set b = b + 1.0 where b <= 1000;
                       QUERY PLAN                        
---------------------------------------------------------
 Update on t
   ->  Bitmap Heap Scan on t
         Recheck Cond: (b <= 1000::double precision)
         ->  Bitmap Index Scan on tb
               Index Cond: (b <= 1000::double precision)
(5 rows)

set enable_seqscan to false;
set enable_bitmapscan to false;
explain (costs off)
update t set a = a + 1 where a >= 1 and a <= 1000;
                   QUERY PLAN                   
------------------------------------------------
 [Bypass]
 Update on t
   ->  Index Scan using ta on t
         Index Cond: ((a >= 1) AND (a <= 1000))
(4 rows)

explain (costs off)
update t set b = b + 1.0 where b <= 1000;
                    QUERY PLAN                     
---------------------------------------------------
 [Bypass]
 Update on t
   ->  Index Scan using tb on t
         Index Cond: (b <= 1000::double precision)
(4 rows)

update t set a = a + 1 where a >= 1 and a <= 1000;
WARNING:  UHeapUpdate returned 7
WARNING:  UHeapUpdate returned 7
WARNING:  UHeapUpdate returned 7
update t set b = b + 1.0 where b <= 1000;
WARNING:  UHeapUpdate returned 7
WARNING:  UHeapUpdate returned 7
WARNING:  UHeapUpdate returned 7
select count(*) from t where a > 0 and a < 100;
 count 
-------
    98
(1 row)

select a from t where a >= 48 and a <= 52;
 a  
----
 48
 49
 50
 51
 52
(5 rows)

select b from t where b = 1.0;
 b 
---
(0 rows)

drop index ta;
drop index tb;
drop table t;
set enable_seqscan to true;
set enable_bitmapscan to true;
