create table toasttest (col1 int4 primary key, col2 int4 NOT NULL, col3 text default 'testing', col4 text, b integer GENERATED ALWAYS AS (length(col3)) STORED) with (storage_type=USTORE);
NOTICE:  CREATE TABLE / PRIMARY KEY will create implicit index "toasttest_pkey" for table "toasttest"
-- test insert
-- insert short row
insert into toasttest values(30, 50, repeat('x', 10), 'XXXXX');
select col1, col2, length(col3), col4 from toasttest;
 col1 | col2 | length | col4  
------+------+--------+-------
   30 |   50 |     10 | XXXXX
(1 row)

-- insert toast row
insert into toasttest values(40, 60, repeat('y', 1000000), 'ZZZZZZZZZZ');
begin;
insert into toasttest values(generate_series(0, 9), 60, repeat('y', 300000), 'ZZZZZZZZZZ');
insert into toasttest values(generate_series(10, 20), 50, repeat('x', 100), 'XXXXX');
end;
create index idx1 on toasttest(col2);
select col1, col2, length(col3), col4 from toasttest where col1 = 40;
 col1 | col2 | length  |    col4    
------+------+---------+------------
   40 |   60 | 1000000 | ZZZZZZZZZZ
(1 row)

select /*+ indexonlyscan(toasttest) */ sum(col1), count(*) from toasttest union select /*+ tablescan(toasttest) */ sum(col1),count(*) from toasttest;
 sum | count 
-----+-------
 280 |    23
(1 row)

select /*+ indexonlyscan(toasttest) */ sum(col2), count(*) from toasttest union select /*+ tablescan(toasttest) */ sum(col2),count(*) from toasttest;
 sum  | count 
------+-------
 1260 |    23
(1 row)

select b, length(col3), ctid from toasttest where b != length(col3) ;
 b | length | ctid 
---+--------+------
(0 rows)

begin;
update toasttest set col3 = col3 || col3;
rollback;
select /*+ indexonlyscan(toasttest) */ sum(col1), count(*) from toasttest union select /*+ tablescan(toasttest) */ sum(col1),count(*) from toasttest;
 sum | count 
-----+-------
 280 |    23
(1 row)

select /*+ indexonlyscan(toasttest) */ sum(col2), count(*) from toasttest union select /*+ tablescan(toasttest) */ sum(col2),count(*) from toasttest;
 sum  | count 
------+-------
 1260 |    23
(1 row)

select b, length(col3), ctid from toasttest where b != length(col3) ;
 b | length | ctid 
---+--------+------
(0 rows)

begin;
update toasttest set col3 = col3 || col3;
end;
select /*+ indexonlyscan(toasttest) */ sum(col1), count(*) from toasttest union select /*+ tablescan(toasttest) */ sum(col1),count(*) from toasttest;
 sum | count 
-----+-------
 280 |    23
(1 row)

select /*+ indexonlyscan(toasttest) */ sum(col2), count(*) from toasttest union select /*+ tablescan(toasttest) */ sum(col2),count(*) from toasttest;
 sum  | count 
------+-------
 1260 |    23
(1 row)

select b, length(col3), ctid from toasttest where b != length(col3) ;
 b | length | ctid 
---+--------+------
(0 rows)

-- test update
-- update short row to toast row
update toasttest set col3 = repeat('x', 2000000) where col1 = 30;
select col1, col2, length(col3), col4 from toasttest where col1 = 30;
 col1 | col2 | length  | col4  
------+------+---------+-------
   30 |   50 | 2000000 | XXXXX
(1 row)

-- update toast row
update toasttest set col3 = col3 ||col3 where col1 = 40;
select col1, col2, length(col3), col4 from toasttest where col1 = 40;
 col1 | col2 | length  |    col4    
------+------+---------+------------
   40 |   60 | 4000000 | ZZZZZZZZZZ
(1 row)

update toasttest set col4 = repeat('z', 10000) where col1 = 40;
select col1, col2, length(col3), length(col4) from toasttest where col1 = 40;
 col1 | col2 | length  | length 
------+------+---------+--------
   40 |   60 | 4000000 |  10000
(1 row)

update toasttest set col4 = col4 || '123' where col1 = 40;
select col1, col2, length(col3), length(col4) from toasttest where col1 = 40;
 col1 | col2 | length  | length 
------+------+---------+--------
   40 |   60 | 4000000 |  10003
(1 row)

-- insert toast row with 2 long fields
insert into toasttest values(70, 80, repeat('a', 200000), repeat('B', 200000));
select col1, col2, length(col3), length(col4) from toasttest where col1 = 70;
 col1 | col2 | length | length 
------+------+--------+--------
   70 |   80 | 200000 | 200000
(1 row)

-- test delete
delete from toasttest where col1 = 30;
select col1, col2,  length(col3), length(col4) from toasttest order by col1;
 col1 | col2 | length  | length 
------+------+---------+--------
    0 |   60 |  600000 |     10
    1 |   60 |  600000 |     10
    2 |   60 |  600000 |     10
    3 |   60 |  600000 |     10
    4 |   60 |  600000 |     10
    5 |   60 |  600000 |     10
    6 |   60 |  600000 |     10
    7 |   60 |  600000 |     10
    8 |   60 |  600000 |     10
    9 |   60 |  600000 |     10
   10 |   50 |     200 |      5
   11 |   50 |     200 |      5
   12 |   50 |     200 |      5
   13 |   50 |     200 |      5
   14 |   50 |     200 |      5
   15 |   50 |     200 |      5
   16 |   50 |     200 |      5
   17 |   50 |     200 |      5
   18 |   50 |     200 |      5
   19 |   50 |     200 |      5
   20 |   50 |     200 |      5
   40 |   60 | 4000000 |  10003
   70 |   80 |  200000 | 200000
(23 rows)

insert into toasttest values(90, 100, 'cccccccccc', repeat('D', 1000000));
select col1, col2, length(col3), length(col4) from toasttest where col1 = 90;
 col1 | col2 | length | length  
------+------+--------+---------
   90 |  100 |     10 | 1000000
(1 row)

delete from toasttest where col1 = 40;
delete from toasttest where col1 = 70;
update toasttest set col3 = repeat('x', 2000000) where col1 = 30;
update toasttest set col3 = repeat('x', 2000) where col1 < 20;
select /*+ indexonlyscan(toasttest) */ sum(col1), count(*) from toasttest union select /*+ tablescan(toasttest) */ sum(col1),count(*) from toasttest;
 sum | count 
-----+-------
 300 |    22
(1 row)

select /*+ indexonlyscan(toasttest) */ sum(col2), count(*) from toasttest union select /*+ tablescan(toasttest) */ sum(col2),count(*) from toasttest;
 sum  | count 
------+-------
 1250 |    22
(1 row)

select b, length(col3), ctid from toasttest where b != length(col3) ;
 b | length | ctid 
---+--------+------
(0 rows)

drop table toasttest;
