--unsupported feature: sequence functions.
CREATE TABLE SEQ_CURRVAL_TABLE_009(COL_NAME VARCHAR2(20),COL_NUM INTEGER) ;
ALTER TABLE SEQ_CURRVAL_TABLE_009 ADD PRIMARY KEY(COL_NUM);
NOTICE:  ALTER TABLE / ADD PRIMARY KEY will create implicit index "seq_currval_table_009_pkey" for table "seq_currval_table_009"
CREATE SEQUENCE CURRVAL_SEQUENCE_009 INCREMENT BY 100 START WITH 1;
explain (costs off) INSERT INTO SEQ_CURRVAL_TABLE_009 VALUES('nextval',nextval('CURRVAL_SEQUENCE_009'));
           QUERY PLAN            
---------------------------------
 [Bypass]
 Insert on seq_currval_table_009
   ->  Result
(3 rows)

INSERT INTO SEQ_CURRVAL_TABLE_009 VALUES('nextval',nextval('CURRVAL_SEQUENCE_009'));
INSERT INTO SEQ_CURRVAL_TABLE_009 VALUES('nextval',nextval('CURRVAL_SEQUENCE_009'));
SELECT * FROM SEQ_CURRVAL_TABLE_009 ORDER BY COL_NAME,COL_NUM;
 col_name | col_num 
----------+---------
 nextval  |       1
 nextval  |     101
(2 rows)

explain (costs off) UPDATE  SEQ_CURRVAL_TABLE_009 SET COL_NAME='new' WHERE COL_NUM=currval('CURRVAL_SEQUENCE_009');
                                    QUERY PLAN                                    
----------------------------------------------------------------------------------
 Update on seq_currval_table_009
   ->  Seq Scan on seq_currval_table_009
         Filter: ((col_num)::numeric = currval('currval_sequence_009'::regclass))
(3 rows)

UPDATE  SEQ_CURRVAL_TABLE_009 SET COL_NAME='new' WHERE COL_NUM=currval('CURRVAL_SEQUENCE_009');
SELECT * FROM SEQ_CURRVAL_TABLE_009 ORDER BY COL_NUM,COL_NAME;
 col_name | col_num 
----------+---------
 nextval  |       1
 new      |     101
(2 rows)

explain (costs off) UPDATE SEQ_CURRVAL_TABLE_009 SET COL_NUM=nextval('CURRVAL_SEQUENCE_009');
               QUERY PLAN                
-----------------------------------------
 Update on seq_currval_table_009
   ->  Seq Scan on seq_currval_table_009
(2 rows)

UPDATE SEQ_CURRVAL_TABLE_009 SET COL_NUM=nextval('CURRVAL_SEQUENCE_009');
SELECT * FROM SEQ_CURRVAL_TABLE_009 ORDER BY COL_NUM,COL_NAME;
 col_name | col_num 
----------+---------
 nextval  |     201
 new      |     301
(2 rows)

-- unsupported feature: cannot broadcast hashed results for inner plan of semi join when outer plan is replicated now.
create schema uschema2_ix;
create table uschema2_ix.offers_20050701
(
    PROMO_ID VARCHAR(10) NOT NULL ,
    PARTY_ID VARCHAR(10) NULL,
    LOCATION_ID INTEGER NULL ,
    PARTY_FIRSTNAME VARCHAR(20) NULL ,
    PARTY_LASTNAME VARCHAR(20) NULL ,
    VISITS INTEGER NULL ,
    CLUB_LEVEL CHAR(7) NULL 
)
;
create table uschema2_ix.item_price_history
(
    ITEM_ID INTEGER NOT NULL ,
    ITEM_PRICE_START_DT DATE NOT NULL ,
    PRICE_CHANGE_REASON_CD VARCHAR(50) NULL ,
    ITEM_PRICE_AMT DECIMAL(18,2) NULL ,
    CURRENT_INDICATOR CHAR(1) NULL ,
    LOCATION_ID INTEGER NULL 
)
;
create table uschema2_ix.associate
(
    ASSOCIATE_PARTY_ID INTEGER NOT NULL ,
    MANAGER_ASSOCIATE_ID INTEGER NULL ,
    POSITION_ID NUMBER(10) NULL ,
    LOCATION_ID INTEGER NULL ,
    ASSOC_HR_NUM VARCHAR(50) NULL ,
    ASSOC_HIRE_DT DATE NULL ,
    ASSOC_TERMINATION_DT DATE NULL ,
    ASSOC_INTERN_DURATION interval  
)
;
create table uschema2_ix.associate_benefit_expense
(
    period_end_dt date not null ,
    associate_expns_type_cd varchar(50) not null ,
    associate_party_id integer not null ,
    benefit_hours_qty decimal(18,4) ,
    benefit_cost_amt number(18,4) 
)
;
create table uschema2_ix.associate_position
(
    position_id integer not null ,
    position_desc varchar(250) null ,
    wage_rate_amt real not null ,
    overtime_rate_pct float ,
    position_grade_cd varchar(50) null ,
    position_type_cd varchar(50) null ,
    job_classification_cd varchar(50) null,
    postion_duration timestamp
)
;
create table uschema2_ix.position_type
(
    position_type_cd varchar(50) not null ,
    position_type_desc varchar(250) null
)
;
explain (costs off) 
select t1.ITEM_PRICE_START_DT,
t0.PARTY_ID
from uschema2_ix.OFFERS_20050701 t0
left join uschema2_ix.ITEM_PRICE_HISTORY t1
	on t0.PROMO_ID < t1.ITEM_ID
and t1.ITEM_ID in ( select t0.LOcation_ID from uschema2_ix.ASSOCIATE t0 
                        inner join uschema2_ix.ASSOCIATE_BENEFIT_EXPENSE t1
                        on t0.ASSOCIATE_PARTY_ID = t1.ASSOCIATE_PARTY_ID
                        where t0.POSITION_ID in (select t1.POSITION_ID 
                                                      from uschema2_ix.ASSOCIATE_POSITION t1 
                                                      left join uschema2_ix.POSITION_TYPE t2
                                                      on t1.POSITION_TYPE_CD = t2.POSITION_TYPE_CD
                                                      ));
                                                     QUERY PLAN                                                     
--------------------------------------------------------------------------------------------------------------------
 Nested Loop Left Join
   Join Filter: ((t0.promo_id)::bigint < t1.item_id)
   ->  Seq Scan on offers_20050701 t0
   ->  Materialize
         ->  Hash Right Semi Join
               Hash Cond: (t0.location_id = t1.item_id)
               ->  Hash Join
                     Hash Cond: (t1.associate_party_id = t0.associate_party_id)
                     ->  Seq Scan on associate_benefit_expense t1
                     ->  Hash
                           ->  Hash Semi Join
                                 Hash Cond: (t0.position_id = (t1.position_id)::numeric)
                                 ->  Seq Scan on associate t0
                                 ->  Hash
                                       ->  Hash Right Join
                                             Hash Cond: ((t2.position_type_cd)::text = (t1.position_type_cd)::text)
                                             ->  Seq Scan on position_type t2
                                             ->  Hash
                                                   ->  Seq Scan on associate_position t1
               ->  Hash
                     ->  Seq Scan on item_price_history t1
(21 rows)

-- can't push down rowexpr
explain (costs off, verbose on)
select position_type_desc, count(*) from uschema2_ix.position_type
group by case when length(position_type_cd)>5 then (length(position_type_desc)-20, length(position_type_cd)+1)
else (length(position_type_desc)-10, length(position_type_cd)+2) end, 1;
                                                                                                                                                                                QUERY PLAN                                                                                                                                                                                
--------------------------------------------------------------------------------------------------------------------------------------------------------------------------------------------------------------------------------------------------------------------------------------------------------------------------------------------------------------------------
 GroupAggregate
   Output: position_type_desc, count(*), (CASE WHEN (length((position_type_cd)::text) > 5) THEN ROW((length((position_type_desc)::text) - 20), (length((position_type_cd)::text) + 1)) ELSE ROW((length((position_type_desc)::text) - 10), (length((position_type_cd)::text) + 2)) END)
   Group By Key: (CASE WHEN (length((position_type.position_type_cd)::text) > 5) THEN ROW((length((position_type.position_type_desc)::text) - 20), (length((position_type.position_type_cd)::text) + 1)) ELSE ROW((length((position_type.position_type_desc)::text) - 10), (length((position_type.position_type_cd)::text) + 2)) END), position_type.position_type_desc
   ->  Sort
         Output: position_type_desc, (CASE WHEN (length((position_type_cd)::text) > 5) THEN ROW((length((position_type_desc)::text) - 20), (length((position_type_cd)::text) + 1)) ELSE ROW((length((position_type_desc)::text) - 10), (length((position_type_cd)::text) + 2)) END)
         Sort Key: (CASE WHEN (length((position_type.position_type_cd)::text) > 5) THEN ROW((length((position_type.position_type_desc)::text) - 20), (length((position_type.position_type_cd)::text) + 1)) ELSE ROW((length((position_type.position_type_desc)::text) - 10), (length((position_type.position_type_cd)::text) + 2)) END), position_type.position_type_desc
         ->  Seq Scan on uschema2_ix.position_type
               Output: position_type_desc, CASE WHEN (length((position_type_cd)::text) > 5) THEN ROW((length((position_type_desc)::text) - 20), (length((position_type_cd)::text) + 1)) ELSE ROW((length((position_type_desc)::text) - 10), (length((position_type_cd)::text) + 2)) END
(8 rows)

drop schema uschema2_ix cascade;
NOTICE:  drop cascades to 6 other objects
DETAIL:  drop cascades to table uschema2_ix.offers_20050701
drop cascades to table uschema2_ix.item_price_history
drop cascades to table uschema2_ix.associate
drop cascades to table uschema2_ix.associate_benefit_expense
drop cascades to table uschema2_ix.associate_position
drop cascades to table uschema2_ix.position_type
create schema create_resource;
set current_schema='create_resource';
create table tab(a text);
create resource label name;
ERROR:  syntax error at or near ";"
LINE 1: create resource label name;
                                  ^
alter resource label name add column(tab.a);
ERROR:  name no such label found
drop table tab;
reset current_schema;
drop schema create_resource CASCADE;
-- roach function
select gs_roach_stop_backup('test');
ERROR:  Un-supported feature
DETAIL:  unsupported function: gs_roach_stop_backup
CONTEXT:  referenced column: gs_roach_stop_backup
select gs_roach_switch_xlog(false);
ERROR:  Un-supported feature
DETAIL:  unsupported function: gs_roach_switch_xlog
CONTEXT:  referenced column: gs_roach_switch_xlog
select gs_roach_enable_delay_ddl_recycle('test');
ERROR:  Un-supported feature
DETAIL:  unsupported function: gs_roach_enable_delay_ddl_recycle
CONTEXT:  referenced column: gs_roach_enable_delay_ddl_recycle
select gs_roach_disable_delay_ddl_recycle('test');
ERROR:  Un-supported feature
DETAIL:  unsupported function: gs_roach_disable_delay_ddl_recycle
CONTEXT:  referenced column: gs_roach_disable_delay_ddl_recycle
