--
-- UPDATE syntax tests
--
CREATE TABLE update_test (
    a   INT DEFAULT 10,
    b   INT,
    c   TEXT
);
INSERT INTO update_test VALUES (5, 10, 'foo');
INSERT INTO update_test(b, a) VALUES (15, 10);
SELECT * FROM update_test ORDER BY a, b, c;
 a  | b  |  c  
----+----+-----
  5 | 10 | foo
 10 | 15 | 
(2 rows)

UPDATE update_test SET a = DEFAULT, b = DEFAULT;
SELECT * FROM update_test  ORDER BY a, b, c;
 a  | b |  c  
----+---+-----
 10 |   | foo
 10 |   | 
(2 rows)

-- aliases for the UPDATE target table
UPDATE update_test AS t SET b = 10 WHERE t.a = 10;
SELECT * FROM update_test  ORDER BY a, b, c;
 a  | b  |  c  
----+----+-----
 10 | 10 | foo
 10 | 10 | 
(2 rows)

UPDATE update_test t SET b = t.b + 10 WHERE t.a = 10;
SELECT * FROM update_test  ORDER BY a, b, c;
 a  | b  |  c  
----+----+-----
 10 | 20 | foo
 10 | 20 | 
(2 rows)

--
-- Test VALUES in FROM
--
UPDATE update_test SET a=v.i FROM (VALUES(100, 20)) AS v(i, j)
  WHERE update_test.b = v.j;
SELECT * FROM update_test  ORDER BY a, b, c;
  a  | b  |  c  
-----+----+-----
 100 | 20 | foo
 100 | 20 | 
(2 rows)

--
-- Test multiple-set-clause syntax
--
UPDATE update_test SET (c,b,a) = ('bugle', b+11, DEFAULT) WHERE c = 'foo';
SELECT * FROM update_test  ORDER BY a, b, c;
  a  | b  |   c   
-----+----+-------
  10 | 31 | bugle
 100 | 20 | 
(2 rows)

UPDATE update_test SET (c,b) = ('car', a+b), a = a + 1 WHERE a = 10;
SELECT * FROM update_test  ORDER BY a, b, c;
  a  | b  |  c  
-----+----+-----
  11 | 41 | car
 100 | 20 | 
(2 rows)

-- fail, multi assignment to same column:
UPDATE update_test SET (c,b) = ('car', a+b), b = a + 1 WHERE a = 10;
ERROR:  multiple assignments to same column "b"
-- XXX this should work, but doesn't yet:
UPDATE update_test SET (a,b) = (select a,b FROM update_test where c = 'foo')
  WHERE a = 10;
-- if an alias for the target table is specified, don't allow references
-- to the original table name
UPDATE update_test AS t SET b = update_test.b + 10 WHERE t.a = 10;
ERROR:  invalid reference to FROM-clause entry for table "update_test"
LINE 1: UPDATE update_test AS t SET b = update_test.b + 10 WHERE t.a...
                                        ^
HINT:  Perhaps you meant to reference the table alias "t".
CONTEXT:  referenced column: b
-- Make sure that we can update to a TOASTed value.
UPDATE update_test SET c = repeat('x', 10000) WHERE c = 'car';
SELECT a, b, char_length(c) FROM update_test ORDER BY a;
  a  | b  | char_length 
-----+----+-------------
  11 | 41 |       10000
 100 | 20 |            
(2 rows)

DROP TABLE update_test;
--test "update tablename AS aliasname SET aliasname.colname = colvalue;"
CREATE TABLE update_test_c(
    a    INT DEFAULT 10
);
CREATE TABLE update_test_d(
    a    INT DEFAULT 10,
    b    INT
);
INSERT INTO update_test_c (a) VALUES (1);
SELECT * FROM update_test_c;
 a 
---
 1
(1 row)

UPDATE update_test_c AS test_c SET test_c.a = 2;
SELECT * FROM update_test_c;
 a 
---
 2
(1 row)

UPDATE update_test_c AS test_c SET test_c.a = 3 WHERE test_c.a = 2;
SELECT * FROM update_test_c;
 a 
---
 3
(1 row)

UPDATE update_test_c test_c SET test_c.a = 4;
SELECT * FROM update_test_c;
 a 
---
 4
(1 row)

UPDATE update_test_c AS test_c SET test_c.a = 5 WHERE test_c.a = 4;
SELECT * FROM update_test_c;
 a 
---
 5
(1 row)

UPDATE update_test_c AS test_c SET test_a.a = 6;
ERROR:  column "test_a.a" of relation "update_test_c" does not exist
LINE 1: UPDATE update_test_c AS test_c SET test_a.a = 6;
                                           ^
SELECT * FROM update_test_c;
 a 
---
 5
(1 row)

UPDATE update_test_c test_c SET test_a.a = 7;
ERROR:  column "test_a.a" of relation "update_test_c" does not exist
LINE 1: UPDATE update_test_c test_c SET test_a.a = 7;
                                        ^
SELECT * FROM update_test_c;
 a 
---
 5
(1 row)

INSERT INTO update_test_d (a,b) VALUES (1,2);
SELECT * FROM update_test_d;
 a | b 
---+---
 1 | 2
(1 row)

UPDATE update_test_d AS test_d SET test_d.a = 3, test_d.b = 4;
SELECT * FROM update_test_d;
 a | b 
---+---
 3 | 4
(1 row)

UPDATE update_test_d AS test_d SET test_d.a = 5, test_d.b = 6 WHERE test_d.a = 3 AND test_d.b = 4;
SELECT * FROM update_test_d;
 a | b 
---+---
 5 | 6
(1 row)

UPDATE update_test_d test_d SET test_d.a = 7, test_d.b = 8;
SELECT * FROM update_test_d;
 a | b 
---+---
 7 | 8
(1 row)

UPDATE update_test_d test_d SET test_d.a = 9, test_d.b = 10  WHERE test_d.a = 7 AND test_d.b = 8;
SELECT * FROM update_test_d;
 a | b  
---+----
 9 | 10
(1 row)

UPDATE update_test_d AS test_d SET test_d.a = 11, test_b.b = 12;
ERROR:  column "test_b.b" of relation "update_test_d" does not exist
LINE 1: UPDATE update_test_d AS test_d SET test_d.a = 11, test_b.b =...
                                                          ^
SELECT * FROM update_test_d;
 a | b  
---+----
 9 | 10
(1 row)

UPDATE update_test_d test_d SET test_d.a = 11, test_b.b = 12;
ERROR:  column "test_b.b" of relation "update_test_d" does not exist
LINE 1: UPDATE update_test_d test_d SET test_d.a = 11, test_b.b = 12...
                                                       ^
SELECT * FROM update_test_d;
 a | b  
---+----
 9 | 10
(1 row)

DROP TABLE update_test_c;
DROP TABLE update_test_d;
DROP TABLE update_test_d;
ERROR:  table "update_test_d" does not exist
create table tbl_update(a1 int,a2 varchar2(100));
ALTER TABLE tbl_update ADD PRIMARY KEY(a1);
NOTICE:  ALTER TABLE / ADD PRIMARY KEY will create implicit index "tbl_update_pkey" for table "tbl_update"
delete from tbl_update;
insert into tbl_update values(1,'a');
insert into tbl_update values(2,'b');
insert into tbl_update values(3,'c');
insert into tbl_update values(4,'d');
insert into tbl_update values(11,'aa');
select * from tbl_update order by a1;
 a1 | a2 
----+----
  1 | a
  2 | b
  3 | c
  4 | d
 11 | aa
(5 rows)

create table sub_tab(t1 int,t2 varchar2(100));
insert into sub_tab values(11,'aa');
select * from sub_tab;
 t1 | t2 
----+----
 11 | aa
(1 row)

update tbl_update a set (a1,a2)=(100,'hello') from sub_tab t where t.t1=a.a1;
select * from tbl_update order by a1;
 a1  |  a2   
-----+-------
   1 | a
   2 | b
   3 | c
   4 | d
 100 | hello
(5 rows)

update tbl_update a1 set (a1,a2)=(101,'hello world') from sub_tab t where t.t1=a1.a1;
select * from tbl_update order by a1;
 a1  |  a2   
-----+-------
   1 | a
   2 | b
   3 | c
   4 | d
 100 | hello
(5 rows)

drop table tbl_update;
drop table sub_tab;
create table test_tbl_a(a int);
insert into test_tbl_a values(1);
select * from test_tbl_a;
 a 
---
 1
(1 row)

update test_tbl_a a set a=2;
select * from test_tbl_a;
 a 
---
 2
(1 row)

update test_tbl_a a set a=3 where a.a=2;
select * from test_tbl_a;
 a 
---
 3
(1 row)

drop table test_tbl_a;
create table test_tbl_b(a int, b int);
insert into test_tbl_b values(1,2);
select * from test_tbl_b;
 a | b 
---+---
 1 | 2
(1 row)

update test_tbl_b as a set (a,b)=(3,4);
update test_tbl_b set c = 100;
ERROR:  column "c" of relation "test_tbl_b" does not exist
LINE 1: update test_tbl_b set c = 100;
                              ^
select * from test_tbl_b;
 a | b 
---+---
 3 | 4
(1 row)

update test_tbl_b as a set (a,b)=(5,6) where a.a=3 and a.b=4;
select * from test_tbl_b;
 a | b 
---+---
 5 | 6
(1 row)

update test_tbl_b as a set (a.a, a.b)=(7,8) where a.a=5 and a.b=6;
select * from test_tbl_b;
 a | b 
---+---
 7 | 8
(1 row)

drop table test_tbl_b;
CREATE TYPE complex AS (b int,c int);
CREATE TYPE complex AS (b int,c int);
ERROR:  type "complex" already exists
create table test_tbl_c(a complex);
ALTER TABLE test_tbl_c ADD PRIMARY KEY(a);
NOTICE:  ALTER TABLE / ADD PRIMARY KEY will create implicit index "test_tbl_c_pkey" for table "test_tbl_c"
insert into test_tbl_c values((1,2));
select * from test_tbl_c;
   a   
-------
 (1,2)
(1 row)

update test_tbl_c col set col.a.b=(100);
select * from test_tbl_c;
    a    
---------
 (100,2)
(1 row)

drop table test_tbl_c;
drop type complex;
-- test multiple column set with GROUP BY of UPDATE
CREATE TABLE update_multiple_set_01(a INT, b INT, c INT);
CREATE TABLE update_multiple_set_02(a INT, b INT, c INT);
UPDATE update_multiple_set_02 t2 SET (b, c) = (SELECT b, c FROM update_multiple_set_01 t1 WHERE t1.a=t2.a GROUP BY 1, 2);
DROP TABLE update_multiple_set_01;
DROP TABLE update_multiple_set_02;
-- test multiple column set with GROUP BY alias of UPDATE
drop table usview08t;
ERROR:  table "usview08t" does not exist
drop table offers_20050701;
ERROR:  table "offers_20050701" does not exist
create table usview08t(location_id int, on_hand_unit_qty int, on_order_qty int);
create table offers_20050701(location_id int null, visits int null);
insert into usview08t values(1,3,5);
insert into offers_20050701 values(2,4);
UPDATE usview08t Table_008 SET (on_hand_unit_qty,on_order_qty) = (SELECT AVG(VISITS),154 c2 FROM offers_20050701 GROUP BY c2);
select * from usview08t;
 location_id | on_hand_unit_qty | on_order_qty 
-------------+------------------+--------------
           1 |                4 |          154
(1 row)

UPDATE usview08t t2 SET (t2.on_hand_unit_qty, t2.on_order_qty) = (SELECT AVG(VISITS),154 FROM offers_20050701);
UPDATE usview08t Table_008 SET (on_hand_unit_qty,on_hand_unit_qty) = (SELECT AVG(VISITS),154 c2 FROM offers_20050701 GROUP BY c2);
ERROR:  multiple assignments to same column "on_hand_unit_qty"
drop table usview08t;
drop table offers_20050701;
--test table name reference or alias reference
create table test (b int, a int);
insert into test values(1,2);
update test set test.a=10;
update test t set t.b=20;
select * from test;
 b  | a  
----+----
 20 | 10
(1 row)

drop table test;
create table test(a int[3],b int);
insert into test values('{1,2,3}',4);
update test set test.a='{10,20,30}';
select * from test;
     a      | b 
------------+---
 {10,20,30} | 4
(1 row)

update test t set t.a='{11,21,31}';
select * from test;
     a      | b 
------------+---
 {11,21,31} | 4
(1 row)

update test set a='{12,22,32}';
select * from test;
     a      | b 
------------+---
 {12,22,32} | 4
(1 row)

update test set a[1,2]='{13,23}';
select * from test;
     a      | b 
------------+---
 {13,23,32} | 4
(1 row)

--must compatible with previous features, though not perfect
update test set test.a[1,2]='{14,24}';
select * from test;
     a      | b 
------------+---
 {14,24,32} | 4
(1 row)

update test t set t.a[1,2]='{15,25}';
select * from test;
     a      | b 
------------+---
 {15,25,32} | 4
(1 row)

drop table test;
create type newtype as(a int, b int);
create table test(a newtype,b int);
insert into test values(ROW(1,2),3);
update test set test.a=ROW(10,20);
select * from test;
    a    | b 
---------+---
 (10,20) | 3
(1 row)

update test t set t.a=ROW(11,21);
select * from test;
    a    | b 
---------+---
 (11,21) | 3
(1 row)

--Ambiguous scene
--update field a of column a rather than column a of table a
update test a set a.a=12;
NOTICE:  update field 'a' of column 'a', though it's ambiguous.
--update field b of column a rather than column b of table a
update test a set a.b=22;
NOTICE:  update field 'b' of column 'a', though it's ambiguous.
select * from test;
    a    | b 
---------+---
 (12,22) | 3
(1 row)

--fail
update test a set a.a=ROW(13,23);
NOTICE:  update field 'a' of column 'a', though it's ambiguous.
ERROR:  subfield "a" is of type integer but expression is of type record
LINE 1: update test a set a.a=ROW(13,23);
                          ^
HINT:  You will need to rewrite or cast the expression.
CONTEXT:  referenced column: a
update test a set a.c=10;
NOTICE:  update field 'c' of column 'a', though it's ambiguous.
ERROR:  cannot assign to field "c" of column "a" because there is no such column in data type newtype
LINE 1: update test a set a.c=10;
                          ^
CONTEXT:  referenced column: a
update test b set b.c=10;
ERROR:  column "c" of relation "test" does not exist
LINE 1: update test b set b.c=10;
                          ^
--must compatible with previous features, though not perfect
update test a set a.a.a=12;
select * from test;
    a    | b 
---------+---
 (12,22) | 3
(1 row)

drop table test;
drop type newtype;
--test update in merge into
create table test_d (a int, b int);
create table test_s (a int, b int);
insert into test_d values(generate_series(6,10),1);
insert into test_s values(generate_series(1,10),2);
merge into test_d using test_s on(test_d.a=test_s.a) when matched then update set test_d.b=test_s.b;
select * from test_d order by a;
 a  | b 
----+---
  6 | 2
  7 | 2
  8 | 2
  9 | 2
 10 | 2
(5 rows)

truncate table test_s;
insert into test_s values(generate_series(1,10),20);
merge into test_d d using test_s on(d.a=test_s.a) when matched then update set d.b=test_s.b;
select * from test_d order by a;
 a  | b  
----+----
  6 | 20
  7 | 20
  8 | 20
  9 | 20
 10 | 20
(5 rows)

drop table test_d;
drop table test_s;
create table test_d(a int[3],b int);
create table test_s(a int[3],b int);
insert into test_d values('{1,2,3}',4);
insert into test_s values('{10,20,30}',4);
merge into test_d using test_s on(test_d.b=test_s.b) when matched then update set test_d.a=test_s.a;
select * from test_d;
     a      | b 
------------+---
 {10,20,30} | 4
(1 row)

truncate table test_s;
insert into test_s values('{11,21,31}',4);
merge into test_d d using test_s on(d.b=test_s.b) when matched then update set d.a=test_s.a;
select * from test_d;
     a      | b 
------------+---
 {11,21,31} | 4
(1 row)

--must compatible with previous features, though not perfect
merge into test_d using test_s on(test_d.b=test_s.b) when matched then update set test_d.a[1,3]=test_s.a[1,3];
select * from test_d;
     a      | b 
------------+---
 {11,21,31} | 4
(1 row)

merge into test_d d using test_s on(d.b=test_s.b) when matched then update set d.a[1,3]=test_s.a[1,3];
select * from test_d;
     a      | b 
------------+---
 {11,21,31} | 4
(1 row)

drop table test_d;
drop table test_s;
create type newtype as(a int,b int);
create table test_d(a newtype, b int);
create table test_s(a newtype, b int);
insert into test_d values(ROW(1,2),3);
insert into test_s values(ROW(10,20),3);
merge into test_d using test_s on(test_d.b=test_s.b) when matched then update set test_d.a=test_s.a;
select * from test_d;
    a    | b 
---------+---
 (10,20) | 3
(1 row)

truncate table test_s;
insert into test_s values(ROW(11,12),3);
merge into test_d d using test_s on(d.b=test_s.b) when matched then update set d.a=test_s.a;
select * from test_d;
    a    | b 
---------+---
 (11,12) | 3
(1 row)

truncate table test_s;
insert into test_s values(ROW(22,22),3);
merge into test_d a using test_s on(a.b=test_s.b) when matched then update set a.a=21;
NOTICE:  update field 'a' of column 'a', though it's ambiguous.
merge into test_d a using test_s on(a.b=test_s.b) when matched then update set a.b=22;
NOTICE:  update field 'b' of column 'a', though it's ambiguous.
select * from test_d;
    a    | b 
---------+---
 (21,22) | 3
(1 row)

--fail
merge into test_d a using test_s on(a.b=test_s.b) when matched then update set a.a=test_s.a;
NOTICE:  update field 'a' of column 'a', though it's ambiguous.
ERROR:  subfield "a" is of type integer but expression is of type newtype
LINE 1: ...t_s on(a.b=test_s.b) when matched then update set a.a=test_s...
                                                             ^
HINT:  You will need to rewrite or cast the expression.
CONTEXT:  referenced column: a
--must compatible with previous features, though not perfect
merge into test_d using test_s on(test_d.b=test_s.b) when matched then update set test_d.a.a=test_s.b;
select * from test_d;
   a    | b 
--------+---
 (3,22) | 3
(1 row)

merge into test_d d using test_s on(d.b=test_s.b) when matched then update set d.a.a=test_s.b;
select * from test_d;
   a    | b 
--------+---
 (3,22) | 3
(1 row)

drop table test_s;
drop table test_d;
drop type newtype;
-- test update multiple entries for the same column with subselect
create table test (a int[2], b int);
insert into test values('{1,2}',3);
update test set (a[1],a[2])=(select 10,20);
select * from test;
    a    | b 
---------+---
 {10,20} | 3
(1 row)

drop table test;
create type nt as(a int,b int);
create table test(a nt,b nt,c int);
insert into test values(row(1,2),row(3,4),5);
update test set (a.b,b.b)=(select 20,40);
select * from test;
   a    |   b    | c 
--------+--------+---
 (1,20) | (3,40) | 5
(1 row)

drop table test;
drop type nt;
-- test comment in subselect of update
create table test(a int,b int);
insert into test values(1,2);
update test set (a)=(select /*comment*/10);
select * from test;
 a  | b 
----+---
 10 | 2
(1 row)

update test set (a)=(select /*+comment*/20);
select * from test;
 a  | b 
----+---
 20 | 2
(1 row)

drop table test;
--test update multiple fields of column which using composite type at once
create type nt as(a int,b int);
create table aa (a nt, b int,c char);
explain (verbose on, costs off) insert into aa values(ROW(1,2),3,'4');
                   QUERY PLAN                    
-------------------------------------------------
 Insert on public.aa
   ->  Result
         Output: ROW(1, 2), 3, '4'::character(1)
(3 rows)

insert into aa values(ROW(1,2),3,'4');
explain (verbose on, costs off) update aa set a.a=10,a.b=20 where c='4';
               QUERY PLAN                
-----------------------------------------
 Update on public.aa
   ->  Seq Scan on public.aa
         Output: ROW(10, 20), b, c, ctid
         Filter: (aa.c = '4'::bpchar)
(4 rows)

update aa set a.a=10,a.b=20 where c='4';
select * from aa;
    a    | b | c 
---------+---+---
 (10,20) | 3 | 4
(1 row)

drop table aa;
drop type nt;
--test update multiple values of of an array at once
create table test (a int[2], b int,c char);
insert into test values('{1,2}',3,'4');
explain (verbose on, costs off) update test set a[1]=100,a[2]=200 where c='4';
                     QUERY PLAN                      
-----------------------------------------------------
 Update on public.test
   ->  Seq Scan on public.test
         Output: (a[1] := 100)[2] := 200, b, c, ctid
         Filter: (test.c = '4'::bpchar)
(4 rows)

update test set a[1]=100,a[2]=200 where c='4';
select * from test;
     a     | b | c 
-----------+---+---
 {100,200} | 3 | 4
(1 row)

explain (verbose on, costs off) update test set a[1,2]='{101,201}' where c='4';
                          QUERY PLAN                          
--------------------------------------------------------------
 Update on public.test
   ->  Seq Scan on public.test
         Output: a[1:2] := '{101,201}'::integer[], b, c, ctid
         Filter: (test.c = '4'::bpchar)
(4 rows)

update test set a[1,2]='{101,201}' where c='4';
select * from test;
     a     | b | c 
-----------+---+---
 {101,201} | 3 | 4
(1 row)

explain (verbose on, costs off) insert into test  (a[1,2],b,c) values('{113,114}',4,'5');
                                       QUERY PLAN                                       
----------------------------------------------------------------------------------------
 Insert on public.test
   ->  Result
         Output: (NULL::integer[])[1:2] := '{113,114}'::integer[], 4, '5'::character(1)
(3 rows)

insert into test  (a[1,2],b,c) values('{113,114}',4,'5');
select * from test order by 3;
     a     | b | c 
-----------+---+---
 {101,201} | 3 | 4
 {113,114} | 4 | 5
(2 rows)

select a[1,2] from test where c='4';
     a     
-----------
 {101,201}
(1 row)

explain (verbose on, costs off) insert into test (a[1],a[2],b,c)values(1,2,3,'6');
                                QUERY PLAN                                 
---------------------------------------------------------------------------
 Insert on public.test
   ->  Result
         Output: ((NULL::integer[])[1] := 1)[2] := 2, 3, '6'::character(1)
(3 rows)

insert into test (a[1],a[2],b,c)values(1,2,3,'6');
select * from test order by 3;
     a     | b | c 
-----------+---+---
 {101,201} | 3 | 4
 {113,114} | 4 | 5
 {1,2}     | 3 | 6
(3 rows)

explain (verbose on, costs off) insert into test (a[1:2],b,c)values('{1,2}',3,'7');
                                     QUERY PLAN                                     
------------------------------------------------------------------------------------
 Insert on public.test
   ->  Result
         Output: (NULL::integer[])[1:2] := '{1,2}'::integer[], 3, '7'::character(1)
(3 rows)

insert into test (a[1:2],b,c)values('{1,2}',3,'7');
select * from test order by 3;
     a     | b | c 
-----------+---+---
 {101,201} | 3 | 4
 {113,114} | 4 | 5
 {1,2}     | 3 | 6
 {1,2}     | 3 | 7
(4 rows)

explain (verbose on, costs off) update test set a[1:2]='{10,20}' where c='7';
                         QUERY PLAN                         
------------------------------------------------------------
 Update on public.test
   ->  Seq Scan on public.test
         Output: a[1:2] := '{10,20}'::integer[], b, c, ctid
         Filter: (test.c = '7'::bpchar)
(4 rows)

update test set a[1:2]='{10,20}' where c='7';
select * from test order by 3;
     a     | b | c 
-----------+---+---
 {101,201} | 3 | 4
 {113,114} | 4 | 5
 {1,2}     | 3 | 6
 {10,20}   | 3 | 7
(4 rows)

drop table test;
--multiple update, report error except B format;
create table t_t_mutil_t1(col1 int,col2 int);
ERROR:  relation "t_t_mutil_t1" already exists in schema "public"
DETAIL:  creating new table with existing name in the same schema
create table t_t_mutil_t2(col1 int,col2 int);
ERROR:  relation "t_t_mutil_t2" already exists in schema "public"
DETAIL:  creating new table with existing name in the same schema
update t_t_mutil_t1 a,t_t_mutil_t2 b set b.col2=5,a.col2=4 where a.col1=b.col1;
ERROR:  multi-relation update only support in B-format database
--ustore update
set ustore_attr to 'enable_candidate_buf_usage_count=true;enable_ustore_partial_seqscan=true';
drop table if exists ustore_t1;
NOTICE:  table "ustore_t1" does not exist, skipping
create table ustore_t1(id int, name varchar(10)) with (storage_type = ustore);
insert into ustore_t1 values(1, 'a');
update ustore_t1 set ustore_t1.name = 'b' where ustore_t1.id = 1;
drop table ustore_t1;
