drop table if exists t;
NOTICE:  table "t" does not exist, skipping
drop table if exists table_before_row_insert;
NOTICE:  table "table_before_row_insert" does not exist, skipping
drop table if exists table_after_row_insert;
NOTICE:  table "table_after_row_insert" does not exist, skipping
drop table if exists table_before_statement_insert;
NOTICE:  table "table_before_statement_insert" does not exist, skipping
drop table if exists table_after_statement_insert;
NOTICE:  table "table_after_statement_insert" does not exist, skipping
drop table if exists table_before_row_delete;
NOTICE:  table "table_before_row_delete" does not exist, skipping
drop table if exists table_after_row_delete;
NOTICE:  table "table_after_row_delete" does not exist, skipping
drop table if exists table_before_statement_delete;
NOTICE:  table "table_before_statement_delete" does not exist, skipping
drop table if exists table_after_statement_delete;
NOTICE:  table "table_after_statement_delete" does not exist, skipping
drop table if exists table_before_row_update;
NOTICE:  table "table_before_row_update" does not exist, skipping
drop table if exists table_after_row_update;
NOTICE:  table "table_after_row_update" does not exist, skipping
drop table if exists table_before_statement_update;
NOTICE:  table "table_before_statement_update" does not exist, skipping
drop table if exists table_after_statement_update;
NOTICE:  table "table_after_statement_update" does not exist, skipping
drop table if exists table_before_statement_truncate;
NOTICE:  table "table_before_statement_truncate" does not exist, skipping
drop table if exists table_after_statement_truncate;
NOTICE:  table "table_after_statement_truncate" does not exist, skipping
create table t(a int, b int, c int, d int)with(storage_type=ustore);
create table table_before_row_insert(a int, b int);
create table table_after_row_insert(a int, b int);
create table table_before_statement_insert(a varchar(20), b timestamp);
create table table_after_statement_insert(a varchar(20), b timestamp);
create table table_before_row_delete(a int, b int, c timestamp);
create table table_after_row_delete(a int, b int, c timestamp);
create table table_before_statement_delete(a varchar(20), b timestamp);
create table table_after_statement_delete(a varchar(20), b timestamp);
create table table_before_row_update(a int, b int, c timestamp);
create table table_after_row_update(a int, b int, c timestamp);
create table table_before_statement_update(a varchar(20), b timestamp);
create table table_after_statement_update(a varchar(20), b timestamp);
create table table_before_statement_truncate(a varchar(20), b timestamp);
create table table_after_statement_truncate(a varchar(20), b timestamp);
--- before statement truncate
CREATE OR REPLACE FUNCTION function_before_statement_truncate()
  RETURNS trigger AS
$$
BEGIN
    INSERT INTO table_before_statement_truncate VALUES('before', now());
    return NULL;
END;
$$
LANGUAGE 'plpgsql';
CREATE  TRIGGER trigger_before_statement_truncate
before truncate
ON t
FOR EACH statement
EXECUTE PROCEDURE function_before_statement_truncate();
--- after statement truncate
CREATE OR REPLACE FUNCTION function_after_statement_truncate()
  RETURNS trigger AS
$$
BEGIN
    INSERT INTO table_after_statement_truncate VALUES('after', now());
    return NULL;
END;
$$
LANGUAGE 'plpgsql';
CREATE  TRIGGER trigger_after_statement_truncate
after truncate
ON t
FOR EACH statement
EXECUTE PROCEDURE function_after_statement_truncate();
--- before row insert
CREATE OR REPLACE FUNCTION function_before_row_insert()
  RETURNS trigger AS
$$
BEGIN
IF NEW.c IS NULL THEN
            NEW.c = 100;
        END IF;
IF NEW.d IS NULL THEN
            NEW.d = new.a + new.b;
        END IF;
    NEW.b = NEW.b * NEW.b;
    INSERT INTO table_before_row_insert VALUES(new.b, new.a);
    RETURN NEW;
END;
$$
LANGUAGE 'plpgsql';
CREATE  TRIGGER trigger_before_row_insert
before insert
ON t
FOR EACH ROW
EXECUTE PROCEDURE function_before_row_insert();
--- after row insert
CREATE OR REPLACE FUNCTION function_after_row_insert()
  RETURNS trigger AS
$$
BEGIN
IF NEW.c IS NULL THEN
            NEW.c = 100;
        END IF;
IF NEW.d IS NULL THEN
            NEW.d = new.a + new.b;
        END IF;
    NEW.b = NEW.b * NEW.b;
    INSERT INTO table_after_row_insert VALUES(new.c, new.d);
    RETURN NEW;
END;
$$
LANGUAGE 'plpgsql';
CREATE  TRIGGER trigger_after_row_insert
after insert
ON t
FOR EACH ROW
EXECUTE PROCEDURE function_after_row_insert();
--- before statement insert
CREATE OR REPLACE FUNCTION function_before_statement_insert()
  RETURNS trigger AS
$$
BEGIN
    INSERT INTO table_before_statement_insert VALUES('before', now());
    return NULL;
END;
$$
LANGUAGE 'plpgsql';
CREATE  TRIGGER trigger_before_statement_insert
before insert
ON t
FOR EACH statement
EXECUTE PROCEDURE function_before_statement_insert();
--- after statement insert
CREATE OR REPLACE FUNCTION function_after_statement_insert()
  RETURNS trigger AS
$$
BEGIN
    INSERT INTO table_after_statement_insert VALUES('after', now());
    return NULL;
END;
$$
LANGUAGE 'plpgsql';
CREATE  TRIGGER trigger_after_statement_insert
after insert
ON t
FOR EACH statement
EXECUTE PROCEDURE function_after_statement_insert();
--- before row update
CREATE OR REPLACE FUNCTION function_before_row_update()
  RETURNS trigger AS
$$
BEGIN
IF NEW.c IS NULL THEN
            NEW.c = 100;
        END IF;
IF NEW.d IS NULL THEN
            NEW.d = new.a + new.b;
        END IF;
    NEW.b = NEW.b * NEW.b;
    INSERT INTO table_before_row_update VALUES(old.a, new.b, now());
    RETURN NEW;
END;
$$
LANGUAGE 'plpgsql';
CREATE  TRIGGER trigger_before_row_update
before update
ON t
FOR EACH ROW
EXECUTE PROCEDURE function_before_row_update();
--- after row update
CREATE OR REPLACE FUNCTION function_after_row_update()
  RETURNS trigger AS
$$
BEGIN
IF NEW.c IS NULL THEN
            NEW.c = 100;
        END IF;
IF NEW.d IS NULL THEN
            NEW.d = new.a + new.b;
        END IF;
    NEW.b = NEW.b * NEW.b;
    INSERT INTO table_after_row_update VALUES(old.a, new.b, now());
    RETURN NEW;
END;
$$
LANGUAGE 'plpgsql';
CREATE  TRIGGER trigger_after_row_update
after update
ON t
FOR EACH ROW
EXECUTE PROCEDURE function_after_row_update();
--- before statement update
CREATE OR REPLACE FUNCTION function_before_statement_update()
  RETURNS trigger AS
$$
BEGIN
    INSERT INTO table_before_statement_update VALUES('before', now());
    return NULL;
END;
$$
LANGUAGE 'plpgsql';
CREATE  TRIGGER trigger_before_statement_update
before update
ON t
FOR EACH statement
EXECUTE PROCEDURE function_before_statement_update();
--- after statement update
CREATE OR REPLACE FUNCTION function_after_statement_update()
  RETURNS trigger AS
$$
BEGIN
    INSERT INTO table_after_statement_update VALUES('after', now());
    return NULL;
END;
$$
LANGUAGE 'plpgsql';
CREATE  TRIGGER trigger_after_statement_update
after update
ON t
FOR EACH statement
EXECUTE PROCEDURE function_after_statement_update();
--- before row delete
CREATE OR REPLACE FUNCTION function_before_row_delete()
  RETURNS trigger AS
$$
BEGIN
    INSERT INTO table_before_row_delete VALUES(old.a, old.b, now());
    RETURN old;
END;
$$
LANGUAGE 'plpgsql';
CREATE  TRIGGER trigger_before_row_delete
before delete
ON t
FOR EACH ROW
EXECUTE PROCEDURE function_before_row_delete();
--- after row delete
CREATE OR REPLACE FUNCTION function_after_row_delete()
  RETURNS trigger AS
$$
BEGIN
    INSERT INTO table_after_row_delete VALUES(old.a, old.c, now());
    RETURN NEW;
END;
$$
LANGUAGE 'plpgsql';
CREATE  TRIGGER trigger_after_row_delete
after delete
ON t
FOR EACH ROW
EXECUTE PROCEDURE function_after_row_delete();
--- before statement delete
CREATE OR REPLACE FUNCTION function_before_statement_delete()
  RETURNS trigger AS
$$
BEGIN
    INSERT INTO table_before_statement_delete VALUES('before', now());
    return NULL;
END;
$$
LANGUAGE 'plpgsql';
CREATE  TRIGGER trigger_before_statement_delete
before delete
ON t
FOR EACH statement
EXECUTE PROCEDURE function_before_statement_delete();
--- after statement delete
CREATE OR REPLACE FUNCTION function_after_statement_delete()
  RETURNS trigger AS
$$
BEGIN
    INSERT INTO table_after_statement_delete VALUES('after', now());
    return NULL;
END;
$$
LANGUAGE 'plpgsql';
CREATE  TRIGGER trigger_after_statement_delete
after delete
ON t
FOR EACH statement
EXECUTE PROCEDURE function_after_statement_delete();
insert into t values(1,1);
select * from t;
 a | b |  c  | d 
---+---+-----+---
 1 | 1 | 100 | 2
(1 row)

select * from table_before_row_insert;
 a | b 
---+---
 1 | 1
(1 row)

select * from table_after_row_insert;
  a  | b 
-----+---
 100 | 2
(1 row)

select * from table_before_statement_insert;
--?.*
--?.*
--? before | .*
(1 row)

select * from table_after_statement_insert;
--?.*
--?.*
--? after |.*
(1 row)

update t set a=2, b = 2;
WARNING:  UHeapUpdate returned 5
select * from t;
 a | b |  c  | d 
---+---+-----+---
 2 | 4 | 100 | 2
(1 row)

select * from table_before_row_update;
--?.*
--?.*
--? 1 | 4 |.*
(1 row)

select * from table_after_row_update;
--?.*
--?.*
--? 1 | 16 |.*
(1 row)

select * from table_before_statement_update;
--?.*
--?.*
--? before |.*
(1 row)

select * from table_after_statement_update;
--?.*
--?.*
--? after |.*
(1 row)

delete from t;
WARNING:  UHeapDelete returned 5
select * from t;
 a | b | c | d 
---+---+---+---
(0 rows)

select * from table_before_row_delete;
--?.*
--?.*
--? 2 | 4 |.*
(1 row)

select * from table_after_row_delete;
--?.*
--?.*
--? 2 | 100 |.*
(1 row)

select * from table_before_statement_delete;
--?.*
--?.*
--? before | .*
(1 row)

select * from table_after_statement_delete;
--?.*
--?.*
--? after | .*
(1 row)

truncate table t;
select * from table_before_statement_truncate;
--?.*
--?.*
--? before |.*
(1 row)

select * from table_after_statement_truncate;
--?.*
--?.*
--? after | .*
(1 row)

drop table t                               cascade;
drop table table_after_row_delete          cascade;
drop table table_after_row_insert          cascade;
drop table table_after_row_update          cascade;
drop table table_after_statement_delete    cascade;
drop table table_after_statement_insert    cascade;
drop table table_after_statement_truncate  cascade;
drop table table_after_statement_update    cascade;
drop table table_before_row_delete         cascade;
drop table table_before_row_insert         cascade;
drop table table_before_row_update         cascade;
drop table table_before_statement_delete   cascade;
drop table table_before_statement_insert   cascade;
drop table table_before_statement_truncate cascade;
drop table table_before_statement_update   cascade;
