set enable_trigger_shipping = off;
create schema xc_trigship;
set search_path to xc_trigship,public;
\set EXP 'EXPLAIN  (verbose, num_costs off)'
\set CHECK_LOG 'select trigdata, node_type from xc_auditlog, pgxc_node where lower(nodename) = lower(node_name) order by trigdata collate "POSIX"'
\set CHECK_TABLE 'select * from xctrigemp1 order by id'
\set RUN_UPDATE 'update xctrigemp1 set empsal = empsal + 1000 where empname != $$Dummy$$';
\set RUN_DELETE 'delete from xctrigemp1 where empname || now() = $$Dummy$$ || now()';
\set TRUNC 'truncate table xc_auditlog, xctrigemp1';
\set RUN_INSERT 'insert into xctrigemp1 values (1, $$Akash$$, 1000, $$AkashAddress$$), (2, $$Prakash$$, 1500, $$PrakashAddress$$), (3, $$Vikas$$, NULL, $$VikasAddress$$), (4, $$Samar$$, -9999, $$SamarAddress$$), (5, $$Sanika$$, 2000, $$SanikaAddress$$), (-1, $$Dummy$$, 9999, $$DummyAddress$$)'
-- Create Objects
-----------------
-- Base table on which the DML operations would be fired.
create table xctrigemp1 (id int unique, empname varchar unique, empsal float, empadd varchar, trigop varchar) distribute by replication;
NOTICE:  CREATE TABLE / UNIQUE will create implicit index "xctrigemp1_id_key" for table "xctrigemp1"
NOTICE:  CREATE TABLE / UNIQUE will create implicit index "xctrigemp1_empname_key" for table "xctrigemp1"
alter table xctrigemp1 alter column id set not null;
alter table xctrigemp1 alter column empname set not null;
-- Table where all the logs of DML operations would be dumped.
create table xc_auditlog (trigdata varchar, nodename varchar) distribute by replication;
alter table xc_auditlog add primary key(trigdata, nodename);
NOTICE:  ALTER TABLE / ADD PRIMARY KEY will create implicit index "xc_auditlog_pkey" for table "xc_auditlog"
-- Convenience function to be used by all the trigger functions to dump all the trigger
-- information including name, operation etc into the xc_auditlog table.
CREATE FUNCTION xc_auditlog_func (tg_name name, tg_op text, tg_level text, tg_when text,
	                         oldrow text, newrow text, nodename name) returns void as $$
DECLARE
	trigdata varchar;
BEGIN
	trigdata := left(tg_level, 1) || left(tg_op, 1) || left(tg_when, 1) || ' ' || tg_name;
	if (tg_level = 'ROW') then
		if (oldrow is not null) then
			trigdata := trigdata || ' ' || oldrow;
		end if;
		if (newrow is not null) then
			trigdata := trigdata || ' ' || newrow;
		end if;
	end if;
	insert into xc_auditlog values (trigdata, nodename::varchar);
END
$$ language plpgsql;
-- STATEMENT trigger function. This also dumps everything except the row.
CREATE FUNCTION xc_stmttrig_func() RETURNS TRIGGER AS $$
BEGIN
	perform xc_auditlog_func(TG_NAME, TG_OP, TG_LEVEL, TG_WHEN, NULL, NULL, pgxc_node_str());
	RETURN NULL;
END $$ immutable LANGUAGE 'plpgsql';
-- A few statement triggers.
CREATE TRIGGER xc_stmttrig1 BEFORE INSERT OR UPDATE OR DELETE ON xctrigemp1
	FOR EACH STATEMENT EXECUTE PROCEDURE xc_stmttrig_func();
CREATE TRIGGER xc_stmttrig2 AFTER INSERT OR UPDATE OR DELETE ON xctrigemp1
	FOR EACH STATEMENT EXECUTE PROCEDURE xc_stmttrig_func();
-- Main trigger function to be used by triggers. It skips the DML operation if
-- salary is invalid. And it inserts a 'default' salary amount if it is NULL.
create function xc_brt_func() returns trigger as
$$
begin
	IF (TG_OP = 'DELETE') then
		OLD.trigop = OLD.trigop || '_' || left(TG_OP, 1) || left(TG_WHEN, 1) || '_' || TG_NAME;
		perform xc_auditlog_func(TG_NAME, TG_OP, TG_LEVEL, TG_WHEN, OLD::text, NULL, pgxc_node_str());
		return OLD;

	ELSE
		if NEW.trigop is NULL then
			NEW.trigop = '';
		end if;

		IF (TG_OP = 'INSERT') then
			IF NEW.empsal IS NULL THEN
				NEW.empsal := 9999;
			END IF;
		END IF;

		NEW.trigop = NEW.trigop || '_' || left(TG_OP, 1) || left(TG_WHEN, 1) || '_' || TG_NAME;
		perform xc_auditlog_func(TG_NAME, TG_OP, TG_LEVEL, TG_WHEN, NULL, NEW::text, pgxc_node_str());

	END IF;

	IF NEW.empsal < 0 THEN
		return NULL;
	ELSE
		return NEW;
	END IF;

end
$$ immutable language plpgsql;
-- Additional trigger function so that we can have a mix of shippable and non-shippable
-- triggers. Turn on or off the volatility of this function as required.
create function xc_brt_vol_func() returns trigger as
$$
begin
	IF (TG_OP = 'DELETE') then
		OLD.trigop = OLD.trigop || '_' || left(TG_OP, 1) || left(TG_WHEN, 1) || '_' || TG_NAME;
		perform xc_auditlog_func(TG_NAME, TG_OP, TG_LEVEL, TG_WHEN, OLD::text, NULL, pgxc_node_str());
		return OLD;
	ELSE
		NEW.trigop = NEW.trigop || '_' || left(TG_OP, 1) || left(TG_WHEN, 1) || '_' || TG_NAME;
		perform xc_auditlog_func(TG_NAME, TG_OP, TG_LEVEL, TG_WHEN, NULL, NEW::text, pgxc_node_str());
	END IF;
	return NEW;
end
$$ immutable language plpgsql; -- Declare this initially immutable, to be changed later.
-- A few BEFORE ROW triggers to start with
CREATE TRIGGER brtrig2 BEFORE INSERT ON xctrigemp1
	FOR EACH ROW EXECUTE PROCEDURE xc_brt_vol_func();
CREATE TRIGGER brtrig3 BEFORE INSERT OR UPDATE OR DELETE ON xctrigemp1
	FOR EACH ROW EXECUTE PROCEDURE xc_brt_func();
CREATE TRIGGER brtrig1 BEFORE INSERT OR UPDATE OR DELETE ON xctrigemp1
	FOR EACH ROW EXECUTE PROCEDURE xc_brt_func();
\set QUIET false
-- Setup is now ready to test shippability with BR triggers.
-- All functions are immutable, so all the queries should be shippable or should
-- invoke all of the row triggers on datanode if the query is not shippable.
-- Statement triggers are always executed on coordinator.
:RUN_INSERT;
INSERT 0 5
:EXP :RUN_UPDATE;
                                                           QUERY PLAN                                                            
---------------------------------------------------------------------------------------------------------------------------------
 Data Node Scan on "__REMOTE_FQS_QUERY__"
   Remote query: UPDATE xc_trigship.xctrigemp1 SET empsal = empsal + 1000::double precision WHERE empname::text <> 'Dummy'::text
(2 rows)

:RUN_UPDATE;
UPDATE 4
:RUN_DELETE;
DELETE 1
:CHECK_LOG;
                                              trigdata                                               | node_type 
-----------------------------------------------------------------------------------------------------+-----------
 RDB brtrig1 (-1,Dummy,9999,DummyAddress,_IB_brtrig1_IB_brtrig2_IB_brtrig3_DB_brtrig1)               | D
 RDB brtrig3 (-1,Dummy,9999,DummyAddress,_IB_brtrig1_IB_brtrig2_IB_brtrig3_DB_brtrig3)               | D
 RIB brtrig1 (-1,Dummy,9999,DummyAddress,_IB_brtrig1)                                                | D
 RIB brtrig1 (1,Akash,1000,AkashAddress,_IB_brtrig1)                                                 | D
 RIB brtrig1 (2,Prakash,1500,PrakashAddress,_IB_brtrig1)                                             | D
 RIB brtrig1 (3,Vikas,9999,VikasAddress,_IB_brtrig1)                                                 | D
 RIB brtrig1 (4,Samar,-9999,SamarAddress,_IB_brtrig1)                                                | D
 RIB brtrig1 (5,Sanika,2000,SanikaAddress,_IB_brtrig1)                                               | D
 RIB brtrig2 (-1,Dummy,9999,DummyAddress,_IB_brtrig1_IB_brtrig2)                                     | D
 RIB brtrig2 (1,Akash,1000,AkashAddress,_IB_brtrig1_IB_brtrig2)                                      | D
 RIB brtrig2 (2,Prakash,1500,PrakashAddress,_IB_brtrig1_IB_brtrig2)                                  | D
 RIB brtrig2 (3,Vikas,9999,VikasAddress,_IB_brtrig1_IB_brtrig2)                                      | D
 RIB brtrig2 (5,Sanika,2000,SanikaAddress,_IB_brtrig1_IB_brtrig2)                                    | D
 RIB brtrig3 (-1,Dummy,9999,DummyAddress,_IB_brtrig1_IB_brtrig2_IB_brtrig3)                          | D
 RIB brtrig3 (1,Akash,1000,AkashAddress,_IB_brtrig1_IB_brtrig2_IB_brtrig3)                           | D
 RIB brtrig3 (2,Prakash,1500,PrakashAddress,_IB_brtrig1_IB_brtrig2_IB_brtrig3)                       | D
 RIB brtrig3 (3,Vikas,9999,VikasAddress,_IB_brtrig1_IB_brtrig2_IB_brtrig3)                           | D
 RIB brtrig3 (5,Sanika,2000,SanikaAddress,_IB_brtrig1_IB_brtrig2_IB_brtrig3)                         | D
 RUB brtrig1 (1,Akash,2000,AkashAddress,_IB_brtrig1_IB_brtrig2_IB_brtrig3_UB_brtrig1)                | D
 RUB brtrig1 (2,Prakash,2500,PrakashAddress,_IB_brtrig1_IB_brtrig2_IB_brtrig3_UB_brtrig1)            | D
 RUB brtrig1 (3,Vikas,10999,VikasAddress,_IB_brtrig1_IB_brtrig2_IB_brtrig3_UB_brtrig1)               | D
 RUB brtrig1 (5,Sanika,3000,SanikaAddress,_IB_brtrig1_IB_brtrig2_IB_brtrig3_UB_brtrig1)              | D
 RUB brtrig3 (1,Akash,2000,AkashAddress,_IB_brtrig1_IB_brtrig2_IB_brtrig3_UB_brtrig1_UB_brtrig3)     | D
 RUB brtrig3 (2,Prakash,2500,PrakashAddress,_IB_brtrig1_IB_brtrig2_IB_brtrig3_UB_brtrig1_UB_brtrig3) | D
 RUB brtrig3 (3,Vikas,10999,VikasAddress,_IB_brtrig1_IB_brtrig2_IB_brtrig3_UB_brtrig1_UB_brtrig3)    | D
 RUB brtrig3 (5,Sanika,3000,SanikaAddress,_IB_brtrig1_IB_brtrig2_IB_brtrig3_UB_brtrig1_UB_brtrig3)   | D
 SDA xc_stmttrig2                                                                                    | C
 SDB xc_stmttrig1                                                                                    | C
 SIA xc_stmttrig2                                                                                    | C
 SIB xc_stmttrig1                                                                                    | C
 SUA xc_stmttrig2                                                                                    | C
 SUB xc_stmttrig1                                                                                    | C
(32 rows)

:CHECK_TABLE;
 id | empname | empsal |     empadd     |                         trigop                          
----+---------+--------+----------------+---------------------------------------------------------
  1 | Akash   |   2000 | AkashAddress   | _IB_brtrig1_IB_brtrig2_IB_brtrig3_UB_brtrig1_UB_brtrig3
  2 | Prakash |   2500 | PrakashAddress | _IB_brtrig1_IB_brtrig2_IB_brtrig3_UB_brtrig1_UB_brtrig3
  3 | Vikas   |  10999 | VikasAddress   | _IB_brtrig1_IB_brtrig2_IB_brtrig3_UB_brtrig1_UB_brtrig3
  5 | Sanika  |   3000 | SanikaAddress  | _IB_brtrig1_IB_brtrig2_IB_brtrig3_UB_brtrig1_UB_brtrig3
(4 rows)

-- Make the statement trigger non-shippable. Even with this, the statement
-- should be shippable. Statement triggers are anyway invoked separately for
-- FQS query.
alter function xc_stmttrig_func() volatile;
ALTER FUNCTION
:TRUNC;
TRUNCATE TABLE
:RUN_INSERT;
INSERT 0 5
:EXP :RUN_UPDATE;
                                                           QUERY PLAN                                                            
---------------------------------------------------------------------------------------------------------------------------------
 Data Node Scan on "__REMOTE_FQS_QUERY__"
   Remote query: UPDATE xc_trigship.xctrigemp1 SET empsal = empsal + 1000::double precision WHERE empname::text <> 'Dummy'::text
(2 rows)

:RUN_UPDATE;
UPDATE 4
:RUN_DELETE;
DELETE 1
:CHECK_LOG;
                                              trigdata                                               | node_type 
-----------------------------------------------------------------------------------------------------+-----------
 RDB brtrig1 (-1,Dummy,9999,DummyAddress,_IB_brtrig1_IB_brtrig2_IB_brtrig3_DB_brtrig1)               | D
 RDB brtrig3 (-1,Dummy,9999,DummyAddress,_IB_brtrig1_IB_brtrig2_IB_brtrig3_DB_brtrig3)               | D
 RIB brtrig1 (-1,Dummy,9999,DummyAddress,_IB_brtrig1)                                                | D
 RIB brtrig1 (1,Akash,1000,AkashAddress,_IB_brtrig1)                                                 | D
 RIB brtrig1 (2,Prakash,1500,PrakashAddress,_IB_brtrig1)                                             | D
 RIB brtrig1 (3,Vikas,9999,VikasAddress,_IB_brtrig1)                                                 | D
 RIB brtrig1 (4,Samar,-9999,SamarAddress,_IB_brtrig1)                                                | D
 RIB brtrig1 (5,Sanika,2000,SanikaAddress,_IB_brtrig1)                                               | D
 RIB brtrig2 (-1,Dummy,9999,DummyAddress,_IB_brtrig1_IB_brtrig2)                                     | D
 RIB brtrig2 (1,Akash,1000,AkashAddress,_IB_brtrig1_IB_brtrig2)                                      | D
 RIB brtrig2 (2,Prakash,1500,PrakashAddress,_IB_brtrig1_IB_brtrig2)                                  | D
 RIB brtrig2 (3,Vikas,9999,VikasAddress,_IB_brtrig1_IB_brtrig2)                                      | D
 RIB brtrig2 (5,Sanika,2000,SanikaAddress,_IB_brtrig1_IB_brtrig2)                                    | D
 RIB brtrig3 (-1,Dummy,9999,DummyAddress,_IB_brtrig1_IB_brtrig2_IB_brtrig3)                          | D
 RIB brtrig3 (1,Akash,1000,AkashAddress,_IB_brtrig1_IB_brtrig2_IB_brtrig3)                           | D
 RIB brtrig3 (2,Prakash,1500,PrakashAddress,_IB_brtrig1_IB_brtrig2_IB_brtrig3)                       | D
 RIB brtrig3 (3,Vikas,9999,VikasAddress,_IB_brtrig1_IB_brtrig2_IB_brtrig3)                           | D
 RIB brtrig3 (5,Sanika,2000,SanikaAddress,_IB_brtrig1_IB_brtrig2_IB_brtrig3)                         | D
 RUB brtrig1 (1,Akash,2000,AkashAddress,_IB_brtrig1_IB_brtrig2_IB_brtrig3_UB_brtrig1)                | D
 RUB brtrig1 (2,Prakash,2500,PrakashAddress,_IB_brtrig1_IB_brtrig2_IB_brtrig3_UB_brtrig1)            | D
 RUB brtrig1 (3,Vikas,10999,VikasAddress,_IB_brtrig1_IB_brtrig2_IB_brtrig3_UB_brtrig1)               | D
 RUB brtrig1 (5,Sanika,3000,SanikaAddress,_IB_brtrig1_IB_brtrig2_IB_brtrig3_UB_brtrig1)              | D
 RUB brtrig3 (1,Akash,2000,AkashAddress,_IB_brtrig1_IB_brtrig2_IB_brtrig3_UB_brtrig1_UB_brtrig3)     | D
 RUB brtrig3 (2,Prakash,2500,PrakashAddress,_IB_brtrig1_IB_brtrig2_IB_brtrig3_UB_brtrig1_UB_brtrig3) | D
 RUB brtrig3 (3,Vikas,10999,VikasAddress,_IB_brtrig1_IB_brtrig2_IB_brtrig3_UB_brtrig1_UB_brtrig3)    | D
 RUB brtrig3 (5,Sanika,3000,SanikaAddress,_IB_brtrig1_IB_brtrig2_IB_brtrig3_UB_brtrig1_UB_brtrig3)   | D
 SDA xc_stmttrig2                                                                                    | C
 SDB xc_stmttrig1                                                                                    | C
 SIA xc_stmttrig2                                                                                    | C
 SIB xc_stmttrig1                                                                                    | C
 SUA xc_stmttrig2                                                                                    | C
 SUB xc_stmttrig1                                                                                    | C
(32 rows)

:CHECK_TABLE;
 id | empname | empsal |     empadd     |                         trigop                          
----+---------+--------+----------------+---------------------------------------------------------
  1 | Akash   |   2000 | AkashAddress   | _IB_brtrig1_IB_brtrig2_IB_brtrig3_UB_brtrig1_UB_brtrig3
  2 | Prakash |   2500 | PrakashAddress | _IB_brtrig1_IB_brtrig2_IB_brtrig3_UB_brtrig1_UB_brtrig3
  3 | Vikas   |  10999 | VikasAddress   | _IB_brtrig1_IB_brtrig2_IB_brtrig3_UB_brtrig1_UB_brtrig3
  5 | Sanika  |   3000 | SanikaAddress  | _IB_brtrig1_IB_brtrig2_IB_brtrig3_UB_brtrig1_UB_brtrig3
(4 rows)

-- Make trigger brtrig2 non-shippable.
-- Now, the INSERTs should execute *all* of the ROW triggers on coordinator.
-- Also, the brtrig2 trigger being non-shippable should not affect the
-- shippability of DELETEs or UPDATEs. They should still invoke triggers on datanodes.
-- This is because brtrig2 is defined only for INSERT.
alter function xc_stmttrig_func() immutable; -- (Turn stmt trigger back to shippable)
ALTER FUNCTION
alter function xc_brt_vol_func() volatile;
ALTER FUNCTION
:TRUNC;
TRUNCATE TABLE
:RUN_INSERT;
INSERT 0 5
:RUN_UPDATE;
UPDATE 4
:RUN_DELETE;
DELETE 1
:CHECK_LOG;
                                              trigdata                                               | node_type 
-----------------------------------------------------------------------------------------------------+-----------
 RDB brtrig1 (-1,Dummy,9999,DummyAddress,_IB_brtrig1_IB_brtrig2_IB_brtrig3_DB_brtrig1)               | D
 RDB brtrig3 (-1,Dummy,9999,DummyAddress,_IB_brtrig1_IB_brtrig2_IB_brtrig3_DB_brtrig3)               | D
 RIB brtrig1 (-1,Dummy,9999,DummyAddress,_IB_brtrig1)                                                | C
 RIB brtrig1 (1,Akash,1000,AkashAddress,_IB_brtrig1)                                                 | C
 RIB brtrig1 (2,Prakash,1500,PrakashAddress,_IB_brtrig1)                                             | C
 RIB brtrig1 (3,Vikas,9999,VikasAddress,_IB_brtrig1)                                                 | C
 RIB brtrig1 (4,Samar,-9999,SamarAddress,_IB_brtrig1)                                                | C
 RIB brtrig1 (5,Sanika,2000,SanikaAddress,_IB_brtrig1)                                               | C
 RIB brtrig2 (-1,Dummy,9999,DummyAddress,_IB_brtrig1_IB_brtrig2)                                     | C
 RIB brtrig2 (1,Akash,1000,AkashAddress,_IB_brtrig1_IB_brtrig2)                                      | C
 RIB brtrig2 (2,Prakash,1500,PrakashAddress,_IB_brtrig1_IB_brtrig2)                                  | C
 RIB brtrig2 (3,Vikas,9999,VikasAddress,_IB_brtrig1_IB_brtrig2)                                      | C
 RIB brtrig2 (5,Sanika,2000,SanikaAddress,_IB_brtrig1_IB_brtrig2)                                    | C
 RIB brtrig3 (-1,Dummy,9999,DummyAddress,_IB_brtrig1_IB_brtrig2_IB_brtrig3)                          | C
 RIB brtrig3 (1,Akash,1000,AkashAddress,_IB_brtrig1_IB_brtrig2_IB_brtrig3)                           | C
 RIB brtrig3 (2,Prakash,1500,PrakashAddress,_IB_brtrig1_IB_brtrig2_IB_brtrig3)                       | C
 RIB brtrig3 (3,Vikas,9999,VikasAddress,_IB_brtrig1_IB_brtrig2_IB_brtrig3)                           | C
 RIB brtrig3 (5,Sanika,2000,SanikaAddress,_IB_brtrig1_IB_brtrig2_IB_brtrig3)                         | C
 RUB brtrig1 (1,Akash,2000,AkashAddress,_IB_brtrig1_IB_brtrig2_IB_brtrig3_UB_brtrig1)                | D
 RUB brtrig1 (2,Prakash,2500,PrakashAddress,_IB_brtrig1_IB_brtrig2_IB_brtrig3_UB_brtrig1)            | D
 RUB brtrig1 (3,Vikas,10999,VikasAddress,_IB_brtrig1_IB_brtrig2_IB_brtrig3_UB_brtrig1)               | D
 RUB brtrig1 (5,Sanika,3000,SanikaAddress,_IB_brtrig1_IB_brtrig2_IB_brtrig3_UB_brtrig1)              | D
 RUB brtrig3 (1,Akash,2000,AkashAddress,_IB_brtrig1_IB_brtrig2_IB_brtrig3_UB_brtrig1_UB_brtrig3)     | D
 RUB brtrig3 (2,Prakash,2500,PrakashAddress,_IB_brtrig1_IB_brtrig2_IB_brtrig3_UB_brtrig1_UB_brtrig3) | D
 RUB brtrig3 (3,Vikas,10999,VikasAddress,_IB_brtrig1_IB_brtrig2_IB_brtrig3_UB_brtrig1_UB_brtrig3)    | D
 RUB brtrig3 (5,Sanika,3000,SanikaAddress,_IB_brtrig1_IB_brtrig2_IB_brtrig3_UB_brtrig1_UB_brtrig3)   | D
 SDA xc_stmttrig2                                                                                    | C
 SDB xc_stmttrig1                                                                                    | C
 SIA xc_stmttrig2                                                                                    | C
 SIB xc_stmttrig1                                                                                    | C
 SUA xc_stmttrig2                                                                                    | C
 SUB xc_stmttrig1                                                                                    | C
(32 rows)

:CHECK_TABLE;
 id | empname | empsal |     empadd     |                         trigop                          
----+---------+--------+----------------+---------------------------------------------------------
  1 | Akash   |   2000 | AkashAddress   | _IB_brtrig1_IB_brtrig2_IB_brtrig3_UB_brtrig1_UB_brtrig3
  2 | Prakash |   2500 | PrakashAddress | _IB_brtrig1_IB_brtrig2_IB_brtrig3_UB_brtrig1_UB_brtrig3
  3 | Vikas   |  10999 | VikasAddress   | _IB_brtrig1_IB_brtrig2_IB_brtrig3_UB_brtrig1_UB_brtrig3
  5 | Sanika  |   3000 | SanikaAddress  | _IB_brtrig1_IB_brtrig2_IB_brtrig3_UB_brtrig1_UB_brtrig3
(4 rows)

-- Now include UPDATE in the brtrig2 trigger definition, and verify
-- that the UPDATE is now invoking triggers on coordinator. DELETEs should
-- continue running on datanodes.
DROP TRIGGER brtrig2 on xctrigemp1;
DROP TRIGGER
CREATE TRIGGER brtrig2 BEFORE INSERT OR UPDATE ON xctrigemp1
	FOR EACH ROW EXECUTE PROCEDURE xc_brt_vol_func();
CREATE TRIGGER
:TRUNC;
TRUNCATE TABLE
:RUN_INSERT;
INSERT 0 5
:RUN_UPDATE;
UPDATE 4
:RUN_DELETE;
DELETE 1
:CHECK_LOG;
                                                    trigdata                                                    | node_type 
----------------------------------------------------------------------------------------------------------------+-----------
 RDB brtrig1 (-1,Dummy,9999,DummyAddress,_IB_brtrig1_IB_brtrig2_IB_brtrig3_DB_brtrig1)                          | D
 RDB brtrig3 (-1,Dummy,9999,DummyAddress,_IB_brtrig1_IB_brtrig2_IB_brtrig3_DB_brtrig3)                          | D
 RIB brtrig1 (-1,Dummy,9999,DummyAddress,_IB_brtrig1)                                                           | C
 RIB brtrig1 (1,Akash,1000,AkashAddress,_IB_brtrig1)                                                            | C
 RIB brtrig1 (2,Prakash,1500,PrakashAddress,_IB_brtrig1)                                                        | C
 RIB brtrig1 (3,Vikas,9999,VikasAddress,_IB_brtrig1)                                                            | C
 RIB brtrig1 (4,Samar,-9999,SamarAddress,_IB_brtrig1)                                                           | C
 RIB brtrig1 (5,Sanika,2000,SanikaAddress,_IB_brtrig1)                                                          | C
 RIB brtrig2 (-1,Dummy,9999,DummyAddress,_IB_brtrig1_IB_brtrig2)                                                | C
 RIB brtrig2 (1,Akash,1000,AkashAddress,_IB_brtrig1_IB_brtrig2)                                                 | C
 RIB brtrig2 (2,Prakash,1500,PrakashAddress,_IB_brtrig1_IB_brtrig2)                                             | C
 RIB brtrig2 (3,Vikas,9999,VikasAddress,_IB_brtrig1_IB_brtrig2)                                                 | C
 RIB brtrig2 (5,Sanika,2000,SanikaAddress,_IB_brtrig1_IB_brtrig2)                                               | C
 RIB brtrig3 (-1,Dummy,9999,DummyAddress,_IB_brtrig1_IB_brtrig2_IB_brtrig3)                                     | C
 RIB brtrig3 (1,Akash,1000,AkashAddress,_IB_brtrig1_IB_brtrig2_IB_brtrig3)                                      | C
 RIB brtrig3 (2,Prakash,1500,PrakashAddress,_IB_brtrig1_IB_brtrig2_IB_brtrig3)                                  | C
 RIB brtrig3 (3,Vikas,9999,VikasAddress,_IB_brtrig1_IB_brtrig2_IB_brtrig3)                                      | C
 RIB brtrig3 (5,Sanika,2000,SanikaAddress,_IB_brtrig1_IB_brtrig2_IB_brtrig3)                                    | C
 RUB brtrig1 (1,Akash,2000,AkashAddress,_IB_brtrig1_IB_brtrig2_IB_brtrig3_UB_brtrig1)                           | C
 RUB brtrig1 (2,Prakash,2500,PrakashAddress,_IB_brtrig1_IB_brtrig2_IB_brtrig3_UB_brtrig1)                       | C
 RUB brtrig1 (3,Vikas,10999,VikasAddress,_IB_brtrig1_IB_brtrig2_IB_brtrig3_UB_brtrig1)                          | C
 RUB brtrig1 (5,Sanika,3000,SanikaAddress,_IB_brtrig1_IB_brtrig2_IB_brtrig3_UB_brtrig1)                         | C
 RUB brtrig2 (1,Akash,2000,AkashAddress,_IB_brtrig1_IB_brtrig2_IB_brtrig3_UB_brtrig1_UB_brtrig2)                | C
 RUB brtrig2 (2,Prakash,2500,PrakashAddress,_IB_brtrig1_IB_brtrig2_IB_brtrig3_UB_brtrig1_UB_brtrig2)            | C
 RUB brtrig2 (3,Vikas,10999,VikasAddress,_IB_brtrig1_IB_brtrig2_IB_brtrig3_UB_brtrig1_UB_brtrig2)               | C
 RUB brtrig2 (5,Sanika,3000,SanikaAddress,_IB_brtrig1_IB_brtrig2_IB_brtrig3_UB_brtrig1_UB_brtrig2)              | C
 RUB brtrig3 (1,Akash,2000,AkashAddress,_IB_brtrig1_IB_brtrig2_IB_brtrig3_UB_brtrig1_UB_brtrig2_UB_brtrig3)     | C
 RUB brtrig3 (2,Prakash,2500,PrakashAddress,_IB_brtrig1_IB_brtrig2_IB_brtrig3_UB_brtrig1_UB_brtrig2_UB_brtrig3) | C
 RUB brtrig3 (3,Vikas,10999,VikasAddress,_IB_brtrig1_IB_brtrig2_IB_brtrig3_UB_brtrig1_UB_brtrig2_UB_brtrig3)    | C
 RUB brtrig3 (5,Sanika,3000,SanikaAddress,_IB_brtrig1_IB_brtrig2_IB_brtrig3_UB_brtrig1_UB_brtrig2_UB_brtrig3)   | C
 SDA xc_stmttrig2                                                                                               | C
 SDB xc_stmttrig1                                                                                               | C
 SIA xc_stmttrig2                                                                                               | C
 SIB xc_stmttrig1                                                                                               | C
 SUA xc_stmttrig2                                                                                               | C
 SUB xc_stmttrig1                                                                                               | C
(36 rows)

:CHECK_TABLE;
 id | empname | empsal |     empadd     |                               trigop                               
----+---------+--------+----------------+--------------------------------------------------------------------
  1 | Akash   |   2000 | AkashAddress   | _IB_brtrig1_IB_brtrig2_IB_brtrig3_UB_brtrig1_UB_brtrig2_UB_brtrig3
  2 | Prakash |   2500 | PrakashAddress | _IB_brtrig1_IB_brtrig2_IB_brtrig3_UB_brtrig1_UB_brtrig2_UB_brtrig3
  3 | Vikas   |  10999 | VikasAddress   | _IB_brtrig1_IB_brtrig2_IB_brtrig3_UB_brtrig1_UB_brtrig2_UB_brtrig3
  5 | Sanika  |   3000 | SanikaAddress  | _IB_brtrig1_IB_brtrig2_IB_brtrig3_UB_brtrig1_UB_brtrig2_UB_brtrig3
(4 rows)

-- Keep 2 shippable BR triggers, and 1 non-shippable AR trigger.
-- Since there are non-shippable AR triggers, the BR triggers also should be
-- executed on coordinator even when they are all shippable.
DROP TRIGGER brtrig1 on xctrigemp1;
DROP TRIGGER
DROP TRIGGER brtrig2 on xctrigemp1;
DROP TRIGGER
DROP TRIGGER brtrig3 on xctrigemp1;
DROP TRIGGER
CREATE TRIGGER brtrig3 BEFORE INSERT OR UPDATE OR DELETE ON xctrigemp1
	FOR EACH ROW EXECUTE PROCEDURE xc_brt_func();
CREATE TRIGGER
CREATE TRIGGER brtrig1 BEFORE INSERT OR UPDATE OR DELETE ON xctrigemp1
	FOR EACH ROW EXECUTE PROCEDURE xc_brt_func();
CREATE TRIGGER
CREATE TRIGGER artrig AFTER INSERT OR UPDATE OR DELETE ON xctrigemp1
	FOR EACH ROW EXECUTE PROCEDURE xc_brt_vol_func();
CREATE TRIGGER
alter function xc_brt_func() immutable;
ALTER FUNCTION
alter function xc_brt_vol_func() volatile;
ALTER FUNCTION
:TRUNC;
TRUNCATE TABLE
:RUN_INSERT;
INSERT 0 5
:RUN_INSERT; -- This should invoke the constraint triggers.
ERROR:  duplicate key value violates unique constraint "xc_auditlog_pkey"
DETAIL:  Key (trigdata, nodename)=(SIB xc_stmttrig1, coordinator1) already exists.
CONTEXT:  SQL statement "insert into xc_auditlog values (trigdata, nodename::varchar)"
PL/pgSQL function xc_auditlog_func(name,text,text,text,text,text,name) line 14 at SQL statement
referenced column: xc_auditlog_func
SQL statement "SELECT xc_auditlog_func(TG_NAME, TG_OP, TG_LEVEL, TG_WHEN, NULL, NULL, pgxc_node_str())"
PL/pgSQL function xc_stmttrig_func() line 3 at PERFORM
:RUN_UPDATE;
UPDATE 4
update xctrigemp1 set empname = 'Akash' where empname != $$Dummy$$; -- Constraint triggers
ERROR:  duplicate key value violates unique constraint "xc_auditlog_pkey"
DETAIL:  Key (trigdata, nodename)=(SUB xc_stmttrig1, coordinator1) already exists.
CONTEXT:  SQL statement "insert into xc_auditlog values (trigdata, nodename::varchar)"
PL/pgSQL function xc_auditlog_func(name,text,text,text,text,text,name) line 14 at SQL statement
referenced column: xc_auditlog_func
SQL statement "SELECT xc_auditlog_func(TG_NAME, TG_OP, TG_LEVEL, TG_WHEN, NULL, NULL, pgxc_node_str())"
PL/pgSQL function xc_stmttrig_func() line 3 at PERFORM
:RUN_DELETE;
DELETE 1
:CHECK_LOG;
                                             trigdata                                              | node_type 
---------------------------------------------------------------------------------------------------+-----------
 RDA artrig (-1,Dummy,9999,DummyAddress,_IB_brtrig1_IB_brtrig3_DA_artrig)                          | C
 RDB brtrig1 (-1,Dummy,9999,DummyAddress,_IB_brtrig1_IB_brtrig3_DB_brtrig1)                        | C
 RDB brtrig3 (-1,Dummy,9999,DummyAddress,_IB_brtrig1_IB_brtrig3_DB_brtrig3)                        | C
 RIA artrig (-1,Dummy,9999,DummyAddress,_IB_brtrig1_IB_brtrig3_IA_artrig)                          | C
 RIA artrig (1,Akash,1000,AkashAddress,_IB_brtrig1_IB_brtrig3_IA_artrig)                           | C
 RIA artrig (2,Prakash,1500,PrakashAddress,_IB_brtrig1_IB_brtrig3_IA_artrig)                       | C
 RIA artrig (3,Vikas,9999,VikasAddress,_IB_brtrig1_IB_brtrig3_IA_artrig)                           | C
 RIA artrig (5,Sanika,2000,SanikaAddress,_IB_brtrig1_IB_brtrig3_IA_artrig)                         | C
 RIB brtrig1 (-1,Dummy,9999,DummyAddress,_IB_brtrig1)                                              | C
 RIB brtrig1 (1,Akash,1000,AkashAddress,_IB_brtrig1)                                               | C
 RIB brtrig1 (2,Prakash,1500,PrakashAddress,_IB_brtrig1)                                           | C
 RIB brtrig1 (3,Vikas,9999,VikasAddress,_IB_brtrig1)                                               | C
 RIB brtrig1 (4,Samar,-9999,SamarAddress,_IB_brtrig1)                                              | C
 RIB brtrig1 (5,Sanika,2000,SanikaAddress,_IB_brtrig1)                                             | C
 RIB brtrig3 (-1,Dummy,9999,DummyAddress,_IB_brtrig1_IB_brtrig3)                                   | C
 RIB brtrig3 (1,Akash,1000,AkashAddress,_IB_brtrig1_IB_brtrig3)                                    | C
 RIB brtrig3 (2,Prakash,1500,PrakashAddress,_IB_brtrig1_IB_brtrig3)                                | C
 RIB brtrig3 (3,Vikas,9999,VikasAddress,_IB_brtrig1_IB_brtrig3)                                    | C
 RIB brtrig3 (5,Sanika,2000,SanikaAddress,_IB_brtrig1_IB_brtrig3)                                  | C
 RUA artrig (1,Akash,2000,AkashAddress,_IB_brtrig1_IB_brtrig3_UB_brtrig1_UB_brtrig3_UA_artrig)     | C
 RUA artrig (2,Prakash,2500,PrakashAddress,_IB_brtrig1_IB_brtrig3_UB_brtrig1_UB_brtrig3_UA_artrig) | C
 RUA artrig (3,Vikas,10999,VikasAddress,_IB_brtrig1_IB_brtrig3_UB_brtrig1_UB_brtrig3_UA_artrig)    | C
 RUA artrig (5,Sanika,3000,SanikaAddress,_IB_brtrig1_IB_brtrig3_UB_brtrig1_UB_brtrig3_UA_artrig)   | C
 RUB brtrig1 (1,Akash,2000,AkashAddress,_IB_brtrig1_IB_brtrig3_UB_brtrig1)                         | C
 RUB brtrig1 (2,Prakash,2500,PrakashAddress,_IB_brtrig1_IB_brtrig3_UB_brtrig1)                     | C
 RUB brtrig1 (3,Vikas,10999,VikasAddress,_IB_brtrig1_IB_brtrig3_UB_brtrig1)                        | C
 RUB brtrig1 (5,Sanika,3000,SanikaAddress,_IB_brtrig1_IB_brtrig3_UB_brtrig1)                       | C
 RUB brtrig3 (1,Akash,2000,AkashAddress,_IB_brtrig1_IB_brtrig3_UB_brtrig1_UB_brtrig3)              | C
 RUB brtrig3 (2,Prakash,2500,PrakashAddress,_IB_brtrig1_IB_brtrig3_UB_brtrig1_UB_brtrig3)          | C
 RUB brtrig3 (3,Vikas,10999,VikasAddress,_IB_brtrig1_IB_brtrig3_UB_brtrig1_UB_brtrig3)             | C
 RUB brtrig3 (5,Sanika,3000,SanikaAddress,_IB_brtrig1_IB_brtrig3_UB_brtrig1_UB_brtrig3)            | C
 SDA xc_stmttrig2                                                                                  | C
 SDB xc_stmttrig1                                                                                  | C
 SIA xc_stmttrig2                                                                                  | C
 SIB xc_stmttrig1                                                                                  | C
 SUA xc_stmttrig2                                                                                  | C
 SUB xc_stmttrig1                                                                                  | C
(37 rows)

:CHECK_TABLE;
 id | empname | empsal |     empadd     |                    trigop                    
----+---------+--------+----------------+----------------------------------------------
  1 | Akash   |   2000 | AkashAddress   | _IB_brtrig1_IB_brtrig3_UB_brtrig1_UB_brtrig3
  2 | Prakash |   2500 | PrakashAddress | _IB_brtrig1_IB_brtrig3_UB_brtrig1_UB_brtrig3
  3 | Vikas   |  10999 | VikasAddress   | _IB_brtrig1_IB_brtrig3_UB_brtrig1_UB_brtrig3
  5 | Sanika  |   3000 | SanikaAddress  | _IB_brtrig1_IB_brtrig3_UB_brtrig1_UB_brtrig3
(4 rows)

-- Make the above AR trigger shippable. This will cause both AR and BR triggers
-- to run on datanode.
alter function xc_brt_vol_func() immutable;
ALTER FUNCTION
:TRUNC;
TRUNCATE TABLE
:RUN_INSERT;
INSERT 0 5
:RUN_UPDATE;
UPDATE 4
:RUN_DELETE;
DELETE 1
:CHECK_LOG;
                                             trigdata                                              | node_type 
---------------------------------------------------------------------------------------------------+-----------
 RDA artrig (-1,Dummy,9999,DummyAddress,_IB_brtrig1_IB_brtrig3_DA_artrig)                          | D
 RDB brtrig1 (-1,Dummy,9999,DummyAddress,_IB_brtrig1_IB_brtrig3_DB_brtrig1)                        | D
 RDB brtrig3 (-1,Dummy,9999,DummyAddress,_IB_brtrig1_IB_brtrig3_DB_brtrig3)                        | D
 RIA artrig (-1,Dummy,9999,DummyAddress,_IB_brtrig1_IB_brtrig3_IA_artrig)                          | D
 RIA artrig (1,Akash,1000,AkashAddress,_IB_brtrig1_IB_brtrig3_IA_artrig)                           | D
 RIA artrig (2,Prakash,1500,PrakashAddress,_IB_brtrig1_IB_brtrig3_IA_artrig)                       | D
 RIA artrig (3,Vikas,9999,VikasAddress,_IB_brtrig1_IB_brtrig3_IA_artrig)                           | D
 RIA artrig (5,Sanika,2000,SanikaAddress,_IB_brtrig1_IB_brtrig3_IA_artrig)                         | D
 RIB brtrig1 (-1,Dummy,9999,DummyAddress,_IB_brtrig1)                                              | D
 RIB brtrig1 (1,Akash,1000,AkashAddress,_IB_brtrig1)                                               | D
 RIB brtrig1 (2,Prakash,1500,PrakashAddress,_IB_brtrig1)                                           | D
 RIB brtrig1 (3,Vikas,9999,VikasAddress,_IB_brtrig1)                                               | D
 RIB brtrig1 (4,Samar,-9999,SamarAddress,_IB_brtrig1)                                              | D
 RIB brtrig1 (5,Sanika,2000,SanikaAddress,_IB_brtrig1)                                             | D
 RIB brtrig3 (-1,Dummy,9999,DummyAddress,_IB_brtrig1_IB_brtrig3)                                   | D
 RIB brtrig3 (1,Akash,1000,AkashAddress,_IB_brtrig1_IB_brtrig3)                                    | D
 RIB brtrig3 (2,Prakash,1500,PrakashAddress,_IB_brtrig1_IB_brtrig3)                                | D
 RIB brtrig3 (3,Vikas,9999,VikasAddress,_IB_brtrig1_IB_brtrig3)                                    | D
 RIB brtrig3 (5,Sanika,2000,SanikaAddress,_IB_brtrig1_IB_brtrig3)                                  | D
 RUA artrig (1,Akash,2000,AkashAddress,_IB_brtrig1_IB_brtrig3_UB_brtrig1_UB_brtrig3_UA_artrig)     | D
 RUA artrig (2,Prakash,2500,PrakashAddress,_IB_brtrig1_IB_brtrig3_UB_brtrig1_UB_brtrig3_UA_artrig) | D
 RUA artrig (3,Vikas,10999,VikasAddress,_IB_brtrig1_IB_brtrig3_UB_brtrig1_UB_brtrig3_UA_artrig)    | D
 RUA artrig (5,Sanika,3000,SanikaAddress,_IB_brtrig1_IB_brtrig3_UB_brtrig1_UB_brtrig3_UA_artrig)   | D
 RUB brtrig1 (1,Akash,2000,AkashAddress,_IB_brtrig1_IB_brtrig3_UB_brtrig1)                         | D
 RUB brtrig1 (2,Prakash,2500,PrakashAddress,_IB_brtrig1_IB_brtrig3_UB_brtrig1)                     | D
 RUB brtrig1 (3,Vikas,10999,VikasAddress,_IB_brtrig1_IB_brtrig3_UB_brtrig1)                        | D
 RUB brtrig1 (5,Sanika,3000,SanikaAddress,_IB_brtrig1_IB_brtrig3_UB_brtrig1)                       | D
 RUB brtrig3 (1,Akash,2000,AkashAddress,_IB_brtrig1_IB_brtrig3_UB_brtrig1_UB_brtrig3)              | D
 RUB brtrig3 (2,Prakash,2500,PrakashAddress,_IB_brtrig1_IB_brtrig3_UB_brtrig1_UB_brtrig3)          | D
 RUB brtrig3 (3,Vikas,10999,VikasAddress,_IB_brtrig1_IB_brtrig3_UB_brtrig1_UB_brtrig3)             | D
 RUB brtrig3 (5,Sanika,3000,SanikaAddress,_IB_brtrig1_IB_brtrig3_UB_brtrig1_UB_brtrig3)            | D
 SDA xc_stmttrig2                                                                                  | C
 SDB xc_stmttrig1                                                                                  | C
 SIA xc_stmttrig2                                                                                  | C
 SIB xc_stmttrig1                                                                                  | C
 SUA xc_stmttrig2                                                                                  | C
 SUB xc_stmttrig1                                                                                  | C
(37 rows)

:CHECK_TABLE;
 id | empname | empsal |     empadd     |                    trigop                    
----+---------+--------+----------------+----------------------------------------------
  1 | Akash   |   2000 | AkashAddress   | _IB_brtrig1_IB_brtrig3_UB_brtrig1_UB_brtrig3
  2 | Prakash |   2500 | PrakashAddress | _IB_brtrig1_IB_brtrig3_UB_brtrig1_UB_brtrig3
  3 | Vikas   |  10999 | VikasAddress   | _IB_brtrig1_IB_brtrig3_UB_brtrig1_UB_brtrig3
  5 | Sanika  |   3000 | SanikaAddress  | _IB_brtrig1_IB_brtrig3_UB_brtrig1_UB_brtrig3
(4 rows)

-- Make one of the BR triggers non-shippable. This should not affect AR triggers.
-- They should continue to run on datanode.
alter function xc_brt_func() volatile;
ALTER FUNCTION
:TRUNC;
TRUNCATE TABLE
:RUN_INSERT;
INSERT 0 5
:RUN_UPDATE;
UPDATE 4
:RUN_DELETE;
DELETE 1
:CHECK_LOG;
                                             trigdata                                              | node_type 
---------------------------------------------------------------------------------------------------+-----------
 RDA artrig (-1,Dummy,9999,DummyAddress,_IB_brtrig1_IB_brtrig3_DA_artrig)                          | D
 RDB brtrig1 (-1,Dummy,9999,DummyAddress,_IB_brtrig1_IB_brtrig3_DB_brtrig1)                        | C
 RDB brtrig3 (-1,Dummy,9999,DummyAddress,_IB_brtrig1_IB_brtrig3_DB_brtrig3)                        | C
 RIA artrig (-1,Dummy,9999,DummyAddress,_IB_brtrig1_IB_brtrig3_IA_artrig)                          | D
 RIA artrig (1,Akash,1000,AkashAddress,_IB_brtrig1_IB_brtrig3_IA_artrig)                           | D
 RIA artrig (2,Prakash,1500,PrakashAddress,_IB_brtrig1_IB_brtrig3_IA_artrig)                       | D
 RIA artrig (3,Vikas,9999,VikasAddress,_IB_brtrig1_IB_brtrig3_IA_artrig)                           | D
 RIA artrig (5,Sanika,2000,SanikaAddress,_IB_brtrig1_IB_brtrig3_IA_artrig)                         | D
 RIB brtrig1 (-1,Dummy,9999,DummyAddress,_IB_brtrig1)                                              | C
 RIB brtrig1 (1,Akash,1000,AkashAddress,_IB_brtrig1)                                               | C
 RIB brtrig1 (2,Prakash,1500,PrakashAddress,_IB_brtrig1)                                           | C
 RIB brtrig1 (3,Vikas,9999,VikasAddress,_IB_brtrig1)                                               | C
 RIB brtrig1 (4,Samar,-9999,SamarAddress,_IB_brtrig1)                                              | C
 RIB brtrig1 (5,Sanika,2000,SanikaAddress,_IB_brtrig1)                                             | C
 RIB brtrig3 (-1,Dummy,9999,DummyAddress,_IB_brtrig1_IB_brtrig3)                                   | C
 RIB brtrig3 (1,Akash,1000,AkashAddress,_IB_brtrig1_IB_brtrig3)                                    | C
 RIB brtrig3 (2,Prakash,1500,PrakashAddress,_IB_brtrig1_IB_brtrig3)                                | C
 RIB brtrig3 (3,Vikas,9999,VikasAddress,_IB_brtrig1_IB_brtrig3)                                    | C
 RIB brtrig3 (5,Sanika,2000,SanikaAddress,_IB_brtrig1_IB_brtrig3)                                  | C
 RUA artrig (1,Akash,2000,AkashAddress,_IB_brtrig1_IB_brtrig3_UB_brtrig1_UB_brtrig3_UA_artrig)     | D
 RUA artrig (2,Prakash,2500,PrakashAddress,_IB_brtrig1_IB_brtrig3_UB_brtrig1_UB_brtrig3_UA_artrig) | D
 RUA artrig (3,Vikas,10999,VikasAddress,_IB_brtrig1_IB_brtrig3_UB_brtrig1_UB_brtrig3_UA_artrig)    | D
 RUA artrig (5,Sanika,3000,SanikaAddress,_IB_brtrig1_IB_brtrig3_UB_brtrig1_UB_brtrig3_UA_artrig)   | D
 RUB brtrig1 (1,Akash,2000,AkashAddress,_IB_brtrig1_IB_brtrig3_UB_brtrig1)                         | C
 RUB brtrig1 (2,Prakash,2500,PrakashAddress,_IB_brtrig1_IB_brtrig3_UB_brtrig1)                     | C
 RUB brtrig1 (3,Vikas,10999,VikasAddress,_IB_brtrig1_IB_brtrig3_UB_brtrig1)                        | C
 RUB brtrig1 (5,Sanika,3000,SanikaAddress,_IB_brtrig1_IB_brtrig3_UB_brtrig1)                       | C
 RUB brtrig3 (1,Akash,2000,AkashAddress,_IB_brtrig1_IB_brtrig3_UB_brtrig1_UB_brtrig3)              | C
 RUB brtrig3 (2,Prakash,2500,PrakashAddress,_IB_brtrig1_IB_brtrig3_UB_brtrig1_UB_brtrig3)          | C
 RUB brtrig3 (3,Vikas,10999,VikasAddress,_IB_brtrig1_IB_brtrig3_UB_brtrig1_UB_brtrig3)             | C
 RUB brtrig3 (5,Sanika,3000,SanikaAddress,_IB_brtrig1_IB_brtrig3_UB_brtrig1_UB_brtrig3)            | C
 SDA xc_stmttrig2                                                                                  | C
 SDB xc_stmttrig1                                                                                  | C
 SIA xc_stmttrig2                                                                                  | C
 SIB xc_stmttrig1                                                                                  | C
 SUA xc_stmttrig2                                                                                  | C
 SUB xc_stmttrig1                                                                                  | C
(37 rows)

:CHECK_TABLE;
 id | empname | empsal |     empadd     |                    trigop                    
----+---------+--------+----------------+----------------------------------------------
  1 | Akash   |   2000 | AkashAddress   | _IB_brtrig1_IB_brtrig3_UB_brtrig1_UB_brtrig3
  2 | Prakash |   2500 | PrakashAddress | _IB_brtrig1_IB_brtrig3_UB_brtrig1_UB_brtrig3
  3 | Vikas   |  10999 | VikasAddress   | _IB_brtrig1_IB_brtrig3_UB_brtrig1_UB_brtrig3
  5 | Sanika  |   3000 | SanikaAddress  | _IB_brtrig1_IB_brtrig3_UB_brtrig1_UB_brtrig3
(4 rows)

-- Drop all BR triggers. We have only AR triggers and they are shippable. So the query should be FQSed.
DROP TRIGGER brtrig1 on xctrigemp1;
DROP TRIGGER
DROP TRIGGER brtrig3 on xctrigemp1;
DROP TRIGGER
:TRUNC;
TRUNCATE TABLE
:RUN_INSERT;
INSERT 0 6
:EXP :RUN_UPDATE;
                                                           QUERY PLAN                                                            
---------------------------------------------------------------------------------------------------------------------------------
 Data Node Scan on "__REMOTE_FQS_QUERY__"
   Remote query: UPDATE xc_trigship.xctrigemp1 SET empsal = empsal + 1000::double precision WHERE empname::text <> 'Dummy'::text
(2 rows)

:RUN_UPDATE;
UPDATE 5
:RUN_DELETE;
DELETE 1
:CHECK_LOG;
                       trigdata                        | node_type 
-------------------------------------------------------+-----------
 RDA artrig (-1,Dummy,9999,DummyAddress,_DA_artrig)    | D
 RIA artrig (-1,Dummy,9999,DummyAddress,_IA_artrig)    | D
 RIA artrig (1,Akash,1000,AkashAddress,_IA_artrig)     | D
 RIA artrig (2,Prakash,1500,PrakashAddress,_IA_artrig) | D
 RIA artrig (3,Vikas,,VikasAddress,_IA_artrig)         | D
 RIA artrig (4,Samar,-9999,SamarAddress,_IA_artrig)    | D
 RIA artrig (5,Sanika,2000,SanikaAddress,_IA_artrig)   | D
 RUA artrig (1,Akash,2000,AkashAddress,_UA_artrig)     | D
 RUA artrig (2,Prakash,2500,PrakashAddress,_UA_artrig) | D
 RUA artrig (3,Vikas,,VikasAddress,_UA_artrig)         | D
 RUA artrig (4,Samar,-8999,SamarAddress,_UA_artrig)    | D
 RUA artrig (5,Sanika,3000,SanikaAddress,_UA_artrig)   | D
 SDA xc_stmttrig2                                      | C
 SDB xc_stmttrig1                                      | C
 SIA xc_stmttrig2                                      | C
 SIB xc_stmttrig1                                      | C
 SUA xc_stmttrig2                                      | C
 SUB xc_stmttrig1                                      | C
(18 rows)

:CHECK_TABLE;
 id | empname | empsal |     empadd     | trigop 
----+---------+--------+----------------+--------
  1 | Akash   |   2000 | AkashAddress   | 
  2 | Prakash |   2500 | PrakashAddress | 
  3 | Vikas   |        | VikasAddress   | 
  4 | Samar   |  -8999 | SamarAddress   | 
  5 | Sanika  |   3000 | SanikaAddress  | 
(5 rows)

-- When non-shippable AR triggers are present, we do execute BR triggers also on coordinator,
-- and so in the remote UPDATE stmt, we update *all* the columns. But when we do
-- not have BR triggers in the first place, this should revert back the remote
-- UPDATE statement to the normal behaviour where it updates only the user-supplied
-- columns.
-- Make the AR trigger function non-shippable.
alter function xc_brt_vol_func() volatile;
ALTER FUNCTION
:TRUNC;
TRUNCATE TABLE
:RUN_INSERT;
INSERT 0 6
:EXP :RUN_UPDATE;
WARNING:  Statistics in some tables or columns(xc_trigship.xctrigemp1.empname) are not collected.
HINT:  Do analyze for them in order to generate optimized plan.
                                                                                               QUERY PLAN                                                                                                
---------------------------------------------------------------------------------------------------------------------------------------------------------------------------------------------------------
 Update on xc_trigship.xctrigemp1
   Remote query: UPDATE ONLY xc_trigship.xctrigemp1 SET empsal = $3 WHERE xctrigemp1.id = $6
   ->  Data Node Scan on xctrigemp1 "_REMOTE_TABLE_QUERY_"
         Output: xctrigemp1.id, xctrigemp1.empname, (xctrigemp1.empsal + 1000::double precision), xctrigemp1.empadd, xctrigemp1.trigop, xctrigemp1.empname, xctrigemp1.id, xctrigemp1.ctid, xctrigemp1.*
         Remote query: SELECT id, empname, empsal, empadd, trigop, ctid, xctrigemp1.*::xc_trigship.xctrigemp1 FROM ONLY xc_trigship.xctrigemp1 WHERE empname::text <> 'Dummy'::text
(5 rows)

:RUN_UPDATE;
UPDATE 5
:RUN_DELETE;
DELETE 1
:CHECK_LOG;
                       trigdata                        | node_type 
-------------------------------------------------------+-----------
 RDA artrig (-1,Dummy,9999,DummyAddress,_DA_artrig)    | C
 RIA artrig (-1,Dummy,9999,DummyAddress,_IA_artrig)    | C
 RIA artrig (1,Akash,1000,AkashAddress,_IA_artrig)     | C
 RIA artrig (2,Prakash,1500,PrakashAddress,_IA_artrig) | C
 RIA artrig (3,Vikas,,VikasAddress,_IA_artrig)         | C
 RIA artrig (4,Samar,-9999,SamarAddress,_IA_artrig)    | C
 RIA artrig (5,Sanika,2000,SanikaAddress,_IA_artrig)   | C
 RUA artrig (1,Akash,2000,AkashAddress,_UA_artrig)     | C
 RUA artrig (2,Prakash,2500,PrakashAddress,_UA_artrig) | C
 RUA artrig (3,Vikas,,VikasAddress,_UA_artrig)         | C
 RUA artrig (4,Samar,-8999,SamarAddress,_UA_artrig)    | C
 RUA artrig (5,Sanika,3000,SanikaAddress,_UA_artrig)   | C
 SDA xc_stmttrig2                                      | C
 SDB xc_stmttrig1                                      | C
 SIA xc_stmttrig2                                      | C
 SIB xc_stmttrig1                                      | C
 SUA xc_stmttrig2                                      | C
 SUB xc_stmttrig1                                      | C
(18 rows)

:CHECK_TABLE;
 id | empname | empsal |     empadd     | trigop 
----+---------+--------+----------------+--------
  1 | Akash   |   2000 | AkashAddress   | 
  2 | Prakash |   2500 | PrakashAddress | 
  3 | Vikas   |        | VikasAddress   | 
  4 | Samar   |  -8999 | SamarAddress   | 
  5 | Sanika  |   3000 | SanikaAddress  | 
(5 rows)

drop schema xc_trigship cascade;
NOTICE:  drop cascades to 6 other objects
DETAIL:  drop cascades to table xctrigemp1
drop cascades to table xc_auditlog
drop cascades to function xc_auditlog_func(name,text,text,text,text,text,name)
drop cascades to function xc_stmttrig_func()
drop cascades to function xc_brt_func()
drop cascades to function xc_brt_vol_func()
DROP SCHEMA
--self add
--test insert/update/delete ship trigger
--1. create table
create table test_trigger_src_tbl(id1 int, id2 int, id3 int);
CREATE TABLE
create table test_trigger_des_tbl(id1 int, id2 int, id3 int);
CREATE TABLE
--2. create trigger function
create or replace function tri_insert_func() returns trigger as
$$
declare
begin
        insert into test_trigger_des_tbl values(new.id1, new.id2, new.id3);  --can ship
        --insert into test_trigger_des_tbl values(1,2,3);  --can not ship
        --insert into test_trigger_des_tbl(id2,id3) values(new.id2, new.id3);  --can not ship
        return new;
end
$$ language plpgsql;
CREATE FUNCTION
create or replace function tri_update_func() returns trigger as
$$
declare
begin
        update test_trigger_des_tbl set id3 = new.id3 where id1=old.id1 and id1>50 and id1<350;  --can ship
        update test_trigger_des_tbl set id3 = new.id3 where id1=200 and id1=old.id1 and id1<250;  --can ship
        update test_trigger_des_tbl set id3 = new.id3 where id1>200 and id1=old.id1;  --can ship
        update test_trigger_des_tbl set id3 = new.id3 where id1=old.id1 and id1>50;  --can ship
        update test_trigger_des_tbl set id3 = new.id3 where id1=old.id1;  --can ship

        --update test_trigger_des_tbl set id3 = new.id3 where id1=old.id1 or id1>50;  --can not ship
        --update test_trigger_des_tbl set id3 = new.id3 where id1=old.id1 and id1=100 or id1>50 or id1<350;  --can not ship
        --update test_trigger_des_tbl set id3 = new.id3 where id1=old.id1 or id1>50 or id1<350;  --can not ship

        --update test_trigger_des_tbl set id3 = new.id3 where id1>old.id1 and id1=old.id1;  --can not ship
        --update test_trigger_des_tbl set id3 = new.id3 where id1>old.id1 and id1=50;  --can not ship
        --update test_trigger_des_tbl set id3 = new.id3 where id2>old.id2 and id2=50;  --can not ship
        --update test_trigger_des_tbl set id3 = new.id3 where id2=old.id2 and id1=50;  --can not ship
        --update test_trigger_des_tbl set id3 = new.id3 where id2=old.id2;  --can not ship

        return new;
end
$$ language plpgsql;
CREATE FUNCTION
create or replace function tri_delete_func() returns trigger as
$$
declare
begin
        delete from test_trigger_des_tbl where id1=old.id1;
        return old;
end
$$ language plpgsql;
CREATE FUNCTION
create trigger insert_trigger
  before insert on test_trigger_src_tbl
  for each row
  execute procedure tri_insert_func();
CREATE TRIGGER
create trigger update_trigger
  after update on test_trigger_src_tbl
  for each row
  execute procedure tri_update_func();
CREATE TRIGGER
create trigger delete_trigger
  before delete on test_trigger_src_tbl
  for each row
  execute procedure tri_delete_func();
CREATE TRIGGER
set enable_trigger_shipping = off;
SET
PREPARE insert1_call_trigger (int, int, int) AS INSERT INTO test_trigger_src_tbl VALUES($1, $2, $3);
PREPARE
EXECUTE insert1_call_trigger(100, 100, 100);
INSERT 0 1
set enable_trigger_shipping = on;
SET
PREPARE insert2_call_trigger (int, int, int) AS INSERT INTO test_trigger_src_tbl VALUES($1, $2, $3);
PREPARE
EXECUTE insert2_call_trigger(200, 200, 200);
INSERT 0 1
select * from test_trigger_src_tbl order by id1;
 id1 | id2 | id3 
-----+-----+-----
 100 | 100 | 100
 200 | 200 | 200
(2 rows)

select * from test_trigger_des_tbl order by id1;
 id1 | id2 | id3 
-----+-----+-----
 100 | 100 | 100
 200 | 200 | 200
(2 rows)

set enable_trigger_shipping = off;
SET
explain performance update test_trigger_src_tbl set id3=1000 where id3=100;
--?.*
--?.*
--?.*
--?.*
   Node expr: test_trigger_src_tbl.id1
   Remote query: UPDATE ONLY public.test_trigger_src_tbl SET id3 = $3 WHERE test_trigger_src_tbl.ctid = $4 AND test_trigger_src_tbl.xc_node_id = $5
--?.*
--?.*
--?.*
         Output: test_trigger_src_tbl.id1, test_trigger_src_tbl.id2, 1000, test_trigger_src_tbl.id3, test_trigger_src_tbl.ctid, test_trigger_src_tbl.xc_node_id, test_trigger_src_tbl.*
         Node/s: All datanodes
         Remote query: SELECT id1, id2, id3, ctid, xc_node_id, test_trigger_src_tbl.*::public.test_trigger_src_tbl FROM ONLY public.test_trigger_src_tbl WHERE id3 = 100
--?.*
--?.*
--?.*
--?.*
(14 rows)

set enable_trigger_shipping = on;
SET
explain performance update test_trigger_src_tbl set id3=2000 where id3=200;
--?.*
--?.*
--?.*
   Node/s: All datanodes
   Remote query: UPDATE public.test_trigger_src_tbl SET id3 = 2000 WHERE id3 = 200
--?.*
--?.*
(5 rows)

select * from test_trigger_src_tbl order by id1;
 id1 | id2 | id3  
-----+-----+------
 100 | 100 | 1000
 200 | 200 | 2000
(2 rows)

select * from test_trigger_des_tbl order by id1;
 id1 | id2 | id3  
-----+-----+------
 100 | 100 | 1000
 200 | 200 | 2000
(2 rows)

set enable_trigger_shipping = off;
SET
explain performance delete from test_trigger_src_tbl where id2=100;
--?.*
--?.*
--?.*
   Node/s: All datanodes
   Remote query: DELETE FROM ONLY public.test_trigger_src_tbl WHERE test_trigger_src_tbl.ctid = $1 AND test_trigger_src_tbl.xc_node_id = $2
--?.*
--?.*
--?.*
         Output: test_trigger_src_tbl.id2, test_trigger_src_tbl.ctid, test_trigger_src_tbl.xc_node_id, test_trigger_src_tbl.*
         Node/s: All datanodes
         Remote query: SELECT id2, ctid, xc_node_id, test_trigger_src_tbl.*::public.test_trigger_src_tbl FROM ONLY public.test_trigger_src_tbl WHERE id2 = 100
--?.*
--?.*
--?.*
(12 rows)

set enable_trigger_shipping = on;
SET
explain performance delete from test_trigger_src_tbl where id2=200;
--?.*
--?.*
--?.*
   Node/s: All datanodes
   Remote query: DELETE FROM public.test_trigger_src_tbl WHERE id2 = 200
--?.*
--?.*
(5 rows)

select * from test_trigger_src_tbl order by id1;
 id1 | id2 | id3 
-----+-----+-----
(0 rows)

select * from test_trigger_des_tbl order by id1;
 id1 | id2 | id3 
-----+-----+-----
(0 rows)

drop table if exists test_trigger_src_tbl;
DROP TABLE
drop table if exists test_trigger_des_tbl;
DROP TABLE
