\df xmltype
                                             List of functions
   Schema   |  Name   | Result data type | Argument data types |  Type  | fencedmode | propackage | prokind 
------------+---------+------------------+---------------------+--------+------------+------------+---------
 pg_catalog | xmltype | xmltype          | xmlvalue text       | normal | f          | f          | f
(1 row)

\sf xmltype
CREATE OR REPLACE FUNCTION pg_catalog.xmltype(xmlvalue text)
 RETURNS xmltype
 LANGUAGE plpgsql
 NOT FENCED NOT SHIPPABLE
AS $function$
declare
    dbcom text;
begin
    show sql_compatibility into dbcom;
    if dbcom != 'A' THEN
        raise exception 'Functions for type xmltype is only support in database which dbcompatibility = ''A''.';
    end if;
    return xml(xmlvalue)::xmltype;
end;
$function$;
\sf xmltype.createxml
CREATE OR REPLACE FUNCTION xmltype.createxml(xmldata character varying)
 RETURNS xmltype
 LANGUAGE sql
 IMMUTABLE STRICT NOT FENCED NOT SHIPPABLE
AS $function$ select xmltype($1); $function$;
select * from pg_type where typname = 'xmltype';
 typname | typnamespace | typowner | typlen | typbyval | typtype | typcategory | typispreferred | typisdefined | typdelim | typrelid | typelem | typarray | typinput  | typoutput | typreceive  | typsend  | typmodin | typmodout | typanalyze | typalign | typstorage | typnotnull | typbasetype | typtypmod | typndims | typcollation | typdefaultbin | typdefault | typacl 
---------+--------------+----------+--------+----------+---------+-------------+----------------+--------------+----------+----------+---------+----------+-----------+-----------+-------------+----------+----------+-----------+------------+----------+------------+------------+-------------+-----------+----------+--------------+---------------+------------+--------
 xmltype |           11 |       10 |     -1 | f        | d       | U           | f              | t            | ,        |        0 |       0 |        0 | domain_in | xml_out   | domain_recv | xml_send | -        | -         | -          | i        | x          | f          |         142 |        -1 |        0 |            0 |               |            | 
(1 row)

create table t_xmltype(xml xmltype);
\d t_xmltype
   Table "public.t_xmltype"
 Column |  Type   | Modifiers 
--------+---------+-----------
 xml    | xmltype | 

-- 使用xmltype函数生成数据
select XMLTYPE('<Config id="5">XML</Config>');
           xmltype           
-----------------------------
 <Config id="5">XML</Config>
(1 row)

select xmltype('<Config id="5">XML</Config>');
           xmltype           
-----------------------------
 <Config id="5">XML</Config>
(1 row)

insert into t_xmltype values(XMLTYPE('<Config id="5">XML</Config>'));
insert into t_xmltype values(xmltype('<Config id="5">XML</Config>'));
select * from t_xmltype;
             xml             
-----------------------------
 <Config id="5">XML</Config>
 <Config id="5">XML</Config>
(2 rows)

drop table t_xmltype;
-- test xmltype functions
create table test_xmltype (
    id int,
    name varchar2(4000),
    data xmltype
);
-- 插入正确xmltype
Insert INTO test_xmltype
VALUES (1,'test xml doc','<?xml version="1.0" encoding="UTF-8" ?>
<collection xmlns="">
<record>
<leader>-----nam0-22-----^^^450-</leader>
<datafield tag="200" ind1="1" ind2=" ">
<subfield code="a">抗震救灾</subfield>
<subfield code="f">奥运会</subfield>
</datafield>
<datafield tag="209" ind1=" " ind2=" ">
<subfield code="a">经济学</subfield>
<subfield code="b">计算机</subfield>
<subfield code="c">10001</subfield>
<subfield code="d">2005-07-09</subfield>
</datafield>
<datafield tag="610" ind1="0" ind2=" ">
<subfield code="a">计算机</subfield>
<subfield code="a">笔记本</subfield>
</datafield>
</record>
</collection>') ;
-- 使用createXML函数插入
Insert INTO test_xmltype
VALUES (2,'test xml doc',xmlType.createXML('<?xml version="1.0" encoding="UTF-8" ?>
<collection xmlns="">
<record>
<leader>-----nam0-22-----^^^450-</leader>
<datafield tag="200" ind1="1" ind2=" ">
<subfield code="a">抗震救灾</subfield>
<subfield code="f">奥运会</subfield>
</datafield>
<datafield tag="209" ind1=" " ind2=" ">
<subfield code="a">经济学</subfield>
<subfield code="b">计算机</subfield>
<subfield code="c">10001</subfield>
<subfield code="d">2005-07-09</subfield>
</datafield>
<datafield tag="610" ind1="0" ind2=" ">
<subfield code="a">计算机</subfield>
<subfield code="a">笔记本</subfield>
</datafield>
</record>
</collection>')) ;
-- 使用xmltype插入
Insert INTO test_xmltype
VALUES (3,'test xml doc',xmltype('<?xml version="1.0" encoding="UTF-8" ?>
<collection xmlns="">
<record>
<leader>-----nam0-22-----^^^450-</leader>
<datafield tag="209" ind1=" " ind2=" ">
<subfield code="a">经济学</subfield>
<subfield code="b">计算机</subfield>
<subfield code="c">10001</subfield>
<subfield code="d">2005-07-09</subfield>
</datafield>
</record>
</collection>')) ;
select *from test_xmltype;
 id |     name     |                   data                    
----+--------------+-------------------------------------------
  1 | test xml doc | <collection xmlns="">                    +
    |              | <record>                                 +
    |              | <leader>-----nam0-22-----^^^450-</leader>+
    |              | <datafield tag="200" ind1="1" ind2=" ">  +
    |              | <subfield code="a">抗震救灾</subfield>   +
    |              | <subfield code="f">奥运会</subfield>     +
    |              | </datafield>                             +
    |              | <datafield tag="209" ind1=" " ind2=" ">  +
    |              | <subfield code="a">经济学</subfield>     +
    |              | <subfield code="b">计算机</subfield>     +
    |              | <subfield code="c">10001</subfield>      +
    |              | <subfield code="d">2005-07-09</subfield> +
    |              | </datafield>                             +
    |              | <datafield tag="610" ind1="0" ind2=" ">  +
    |              | <subfield code="a">计算机</subfield>     +
    |              | <subfield code="a">笔记本</subfield>     +
    |              | </datafield>                             +
    |              | </record>                                +
    |              | </collection>
  2 | test xml doc | <collection xmlns="">                    +
    |              | <record>                                 +
    |              | <leader>-----nam0-22-----^^^450-</leader>+
    |              | <datafield tag="200" ind1="1" ind2=" ">  +
    |              | <subfield code="a">抗震救灾</subfield>   +
    |              | <subfield code="f">奥运会</subfield>     +
    |              | </datafield>                             +
    |              | <datafield tag="209" ind1=" " ind2=" ">  +
    |              | <subfield code="a">经济学</subfield>     +
    |              | <subfield code="b">计算机</subfield>     +
    |              | <subfield code="c">10001</subfield>      +
    |              | <subfield code="d">2005-07-09</subfield> +
    |              | </datafield>                             +
    |              | <datafield tag="610" ind1="0" ind2=" ">  +
    |              | <subfield code="a">计算机</subfield>     +
    |              | <subfield code="a">笔记本</subfield>     +
    |              | </datafield>                             +
    |              | </record>                                +
    |              | </collection>
  3 | test xml doc | <collection xmlns="">                    +
    |              | <record>                                 +
    |              | <leader>-----nam0-22-----^^^450-</leader>+
    |              | <datafield tag="209" ind1=" " ind2=" ">  +
    |              | <subfield code="a">经济学</subfield>     +
    |              | <subfield code="b">计算机</subfield>     +
    |              | <subfield code="c">10001</subfield>      +
    |              | <subfield code="d">2005-07-09</subfield> +
    |              | </datafield>                             +
    |              | </record>                                +
    |              | </collection>
(3 rows)

-- xmltype functions 
-- extract
select extract(x.data,'/collection/record/datafield/subfield') xmlseq from test_xmltype x;
                  xmlseq                  
------------------------------------------
 <subfield code="a">抗震救灾</subfield>  +
 <subfield code="f">奥运会</subfield>    +
 <subfield code="a">经济学</subfield>    +
 <subfield code="b">计算机</subfield>    +
 <subfield code="c">10001</subfield>     +
 <subfield code="d">2005-07-09</subfield>+
 <subfield code="a">计算机</subfield>    +
 <subfield code="a">笔记本</subfield>
 <subfield code="a">抗震救灾</subfield>  +
 <subfield code="f">奥运会</subfield>    +
 <subfield code="a">经济学</subfield>    +
 <subfield code="b">计算机</subfield>    +
 <subfield code="c">10001</subfield>     +
 <subfield code="d">2005-07-09</subfield>+
 <subfield code="a">计算机</subfield>    +
 <subfield code="a">笔记本</subfield>
 <subfield code="a">经济学</subfield>    +
 <subfield code="b">计算机</subfield>    +
 <subfield code="c">10001</subfield>     +
 <subfield code="d">2005-07-09</subfield>
(3 rows)

select extract(x.data,'/collection/record/datafield') xmlseq from test_xmltype x;
                  xmlseq                  
------------------------------------------
 <datafield tag="200" ind1="1" ind2=" "> +
 <subfield code="a">抗震救灾</subfield>  +
 <subfield code="f">奥运会</subfield>    +
 </datafield>                            +
 <datafield tag="209" ind1=" " ind2=" "> +
 <subfield code="a">经济学</subfield>    +
 <subfield code="b">计算机</subfield>    +
 <subfield code="c">10001</subfield>     +
 <subfield code="d">2005-07-09</subfield>+
 </datafield>                            +
 <datafield tag="610" ind1="0" ind2=" "> +
 <subfield code="a">计算机</subfield>    +
 <subfield code="a">笔记本</subfield>    +
 </datafield>
 <datafield tag="200" ind1="1" ind2=" "> +
 <subfield code="a">抗震救灾</subfield>  +
 <subfield code="f">奥运会</subfield>    +
 </datafield>                            +
 <datafield tag="209" ind1=" " ind2=" "> +
 <subfield code="a">经济学</subfield>    +
 <subfield code="b">计算机</subfield>    +
 <subfield code="c">10001</subfield>     +
 <subfield code="d">2005-07-09</subfield>+
 </datafield>                            +
 <datafield tag="610" ind1="0" ind2=" "> +
 <subfield code="a">计算机</subfield>    +
 <subfield code="a">笔记本</subfield>    +
 </datafield>
 <datafield tag="209" ind1=" " ind2=" "> +
 <subfield code="a">经济学</subfield>    +
 <subfield code="b">计算机</subfield>    +
 <subfield code="c">10001</subfield>     +
 <subfield code="d">2005-07-09</subfield>+
 </datafield>
(3 rows)

-- 传入空字符串
select extract(x.data,'') xmlseq from test_xmltype x;
ERROR:  Invalid XPATH expression
CONTEXT:  referenced column: xmlseq
-- 返回空集合
select extract(x.data,'/collection/records') xmlseq from test_xmltype x;
 xmlseq 
--------
 
 
 
(3 rows)

-- XMLSequence
select XMLSequence(extract(x.data,'/collection/record/datafield')) xmlseq from test_xmltype x;
                            xmlseq                            
--------------------------------------------------------------
 {"<datafield tag=\"200\" ind1=\"1\" ind2=\" \">             +
 <subfield code=\"a\">抗震救灾</subfield>                    +
 <subfield code=\"f\">奥运会</subfield>                      +
 </datafield>","<datafield tag=\"209\" ind1=\" \" ind2=\" \">+
 <subfield code=\"a\">经济学</subfield>                      +
 <subfield code=\"b\">计算机</subfield>                      +
 <subfield code=\"c\">10001</subfield>                       +
 <subfield code=\"d\">2005-07-09</subfield>                  +
 </datafield>","<datafield tag=\"610\" ind1=\"0\" ind2=\" \">+
 <subfield code=\"a\">计算机</subfield>                      +
 <subfield code=\"a\">笔记本</subfield>                      +
 </datafield>"}
 {"<datafield tag=\"200\" ind1=\"1\" ind2=\" \">             +
 <subfield code=\"a\">抗震救灾</subfield>                    +
 <subfield code=\"f\">奥运会</subfield>                      +
 </datafield>","<datafield tag=\"209\" ind1=\" \" ind2=\" \">+
 <subfield code=\"a\">经济学</subfield>                      +
 <subfield code=\"b\">计算机</subfield>                      +
 <subfield code=\"c\">10001</subfield>                       +
 <subfield code=\"d\">2005-07-09</subfield>                  +
 </datafield>","<datafield tag=\"610\" ind1=\"0\" ind2=\" \">+
 <subfield code=\"a\">计算机</subfield>                      +
 <subfield code=\"a\">笔记本</subfield>                      +
 </datafield>"}
 {"<datafield tag=\"209\" ind1=\" \" ind2=\" \">             +
 <subfield code=\"a\">经济学</subfield>                      +
 <subfield code=\"b\">计算机</subfield>                      +
 <subfield code=\"c\">10001</subfield>                       +
 <subfield code=\"d\">2005-07-09</subfield>                  +
 </datafield>"}
(3 rows)

select unnest(XMLSequence(extract(x.data,'/collection/record/datafield/subfield'))) xmlseq from test_xmltype x;
                  xmlseq                  
------------------------------------------
 <subfield code="a">抗震救灾</subfield>
 <subfield code="f">奥运会</subfield>
 <subfield code="a">经济学</subfield>
 <subfield code="b">计算机</subfield>
 <subfield code="c">10001</subfield>
 <subfield code="d">2005-07-09</subfield>
 <subfield code="a">计算机</subfield>
 <subfield code="a">笔记本</subfield>
 <subfield code="a">抗震救灾</subfield>
 <subfield code="f">奥运会</subfield>
 <subfield code="a">经济学</subfield>
 <subfield code="b">计算机</subfield>
 <subfield code="c">10001</subfield>
 <subfield code="d">2005-07-09</subfield>
 <subfield code="a">计算机</subfield>
 <subfield code="a">笔记本</subfield>
 <subfield code="a">经济学</subfield>
 <subfield code="b">计算机</subfield>
 <subfield code="c">10001</subfield>
 <subfield code="d">2005-07-09</subfield>
(20 rows)

-- extractvalue
select extractvalue(x.data,'/collection/record/leader') as A from test_xmltype x;
            a             
--------------------------
 -----nam0-22-----^^^450-
 -----nam0-22-----^^^450-
 -----nam0-22-----^^^450-
(3 rows)

select extractvalue(x.data,'/collection/record/datafield[@tag="209"]/subfield[@code="a"]') as A from test_xmltype x;
   a    
--------
 经济学
 经济学
 经济学
(3 rows)

-- 多节点报错
select extractvalue(x.data,'/collection/record/datafield/subfield') as A from test_xmltype x;
ERROR:  EXTRACTVALUE returns value of only one node.
CONTEXT:  referenced column: a
-- getStringVal
select getStringVal(extract(x.data,'/collection/record/datafield/subfield')) a from test_xmltype x;
                    a                     
------------------------------------------
 <subfield code="a">抗震救灾</subfield>  +
 <subfield code="f">奥运会</subfield>    +
 <subfield code="a">经济学</subfield>    +
 <subfield code="b">计算机</subfield>    +
 <subfield code="c">10001</subfield>     +
 <subfield code="d">2005-07-09</subfield>+
 <subfield code="a">计算机</subfield>    +
 <subfield code="a">笔记本</subfield>
 <subfield code="a">抗震救灾</subfield>  +
 <subfield code="f">奥运会</subfield>    +
 <subfield code="a">经济学</subfield>    +
 <subfield code="b">计算机</subfield>    +
 <subfield code="c">10001</subfield>     +
 <subfield code="d">2005-07-09</subfield>+
 <subfield code="a">计算机</subfield>    +
 <subfield code="a">笔记本</subfield>
 <subfield code="a">经济学</subfield>    +
 <subfield code="b">计算机</subfield>    +
 <subfield code="c">10001</subfield>     +
 <subfield code="d">2005-07-09</subfield>
(3 rows)

select getStringVal(extract(x.data,'/collection/record/datafield')) a from test_xmltype x;
                    a                     
------------------------------------------
 <datafield tag="200" ind1="1" ind2=" "> +
 <subfield code="a">抗震救灾</subfield>  +
 <subfield code="f">奥运会</subfield>    +
 </datafield>                            +
 <datafield tag="209" ind1=" " ind2=" "> +
 <subfield code="a">经济学</subfield>    +
 <subfield code="b">计算机</subfield>    +
 <subfield code="c">10001</subfield>     +
 <subfield code="d">2005-07-09</subfield>+
 </datafield>                            +
 <datafield tag="610" ind1="0" ind2=" "> +
 <subfield code="a">计算机</subfield>    +
 <subfield code="a">笔记本</subfield>    +
 </datafield>
 <datafield tag="200" ind1="1" ind2=" "> +
 <subfield code="a">抗震救灾</subfield>  +
 <subfield code="f">奥运会</subfield>    +
 </datafield>                            +
 <datafield tag="209" ind1=" " ind2=" "> +
 <subfield code="a">经济学</subfield>    +
 <subfield code="b">计算机</subfield>    +
 <subfield code="c">10001</subfield>     +
 <subfield code="d">2005-07-09</subfield>+
 </datafield>                            +
 <datafield tag="610" ind1="0" ind2=" "> +
 <subfield code="a">计算机</subfield>    +
 <subfield code="a">笔记本</subfield>    +
 </datafield>
 <datafield tag="209" ind1=" " ind2=" "> +
 <subfield code="a">经济学</subfield>    +
 <subfield code="b">计算机</subfield>    +
 <subfield code="c">10001</subfield>     +
 <subfield code="d">2005-07-09</subfield>+
 </datafield>
(3 rows)

-- existsnode
select existsnode(x.data,'/collection/record/datafield[@tag="209"]/subfield[@code="f"]') as a from test_xmltype x;
 a 
---
 0
 0
 0
(3 rows)

select existsnode(x.data,'/collection/record/datafield[@tag="209"]/subfield[@code="a"]') as a from test_xmltype x;
 a 
---
 1
 1
 1
(3 rows)

-- appendchildxml 函数
-- 在record节点后新增一个record节点
select getStringVal( extract(data,'/collection')) as data from test_xmltype;
                   data                    
-------------------------------------------
 <collection xmlns="">                    +
 <record>                                 +
 <leader>-----nam0-22-----^^^450-</leader>+
 <datafield tag="200" ind1="1" ind2=" ">  +
 <subfield code="a">抗震救灾</subfield>   +
 <subfield code="f">奥运会</subfield>     +
 </datafield>                             +
 <datafield tag="209" ind1=" " ind2=" ">  +
 <subfield code="a">经济学</subfield>     +
 <subfield code="b">计算机</subfield>     +
 <subfield code="c">10001</subfield>      +
 <subfield code="d">2005-07-09</subfield> +
 </datafield>                             +
 <datafield tag="610" ind1="0" ind2=" ">  +
 <subfield code="a">计算机</subfield>     +
 <subfield code="a">笔记本</subfield>     +
 </datafield>                             +
 </record>                                +
 </collection>
 <collection xmlns="">                    +
 <record>                                 +
 <leader>-----nam0-22-----^^^450-</leader>+
 <datafield tag="200" ind1="1" ind2=" ">  +
 <subfield code="a">抗震救灾</subfield>   +
 <subfield code="f">奥运会</subfield>     +
 </datafield>                             +
 <datafield tag="209" ind1=" " ind2=" ">  +
 <subfield code="a">经济学</subfield>     +
 <subfield code="b">计算机</subfield>     +
 <subfield code="c">10001</subfield>      +
 <subfield code="d">2005-07-09</subfield> +
 </datafield>                             +
 <datafield tag="610" ind1="0" ind2=" ">  +
 <subfield code="a">计算机</subfield>     +
 <subfield code="a">笔记本</subfield>     +
 </datafield>                             +
 </record>                                +
 </collection>
 <collection xmlns="">                    +
 <record>                                 +
 <leader>-----nam0-22-----^^^450-</leader>+
 <datafield tag="209" ind1=" " ind2=" ">  +
 <subfield code="a">经济学</subfield>     +
 <subfield code="b">计算机</subfield>     +
 <subfield code="c">10001</subfield>      +
 <subfield code="d">2005-07-09</subfield> +
 </datafield>                             +
 </record>                                +
 </collection>
(3 rows)

update test_xmltype set data=appendchildxml(data,'/collection',xmltype('<record>
<leader>-----nam0-23-----^^^500-</leader>
<datafield tag="300" ind1="1" ind2=" ">
<subfield code="b">抗震救灾</subfield>
<subfield code="h">奥运会</subfield>
</datafield>
<datafield tag="301" ind1=" " ind2=" ">
<subfield code="a">英语</subfield>
<subfield code="b">数学</subfield>
<subfield code="c">10001</subfield>
<subfield code="d">2022-11-02</subfield>
</datafield>
<datafield tag="302" ind1="0" ind2=" ">
<subfield code="a">计算机科学</subfield>
<subfield code="a">电脑</subfield>
</datafield>
</record>'));
-- 查看是否插入成功
select getStringVal( extract(data,'/collection')) as data from test_xmltype;
                      data                      
------------------------------------------------
 <collection xmlns="">                         +
   <record>                                    +
     <leader>-----nam0-22-----^^^450-</leader> +
     <datafield tag="200" ind1="1" ind2=" ">   +
       <subfield code="a">抗震救灾</subfield>  +
       <subfield code="f">奥运会</subfield>    +
     </datafield>                              +
     <datafield tag="209" ind1=" " ind2=" ">   +
       <subfield code="a">经济学</subfield>    +
       <subfield code="b">计算机</subfield>    +
       <subfield code="c">10001</subfield>     +
       <subfield code="d">2005-07-09</subfield>+
     </datafield>                              +
     <datafield tag="610" ind1="0" ind2=" ">   +
       <subfield code="a">计算机</subfield>    +
       <subfield code="a">笔记本</subfield>    +
     </datafield>                              +
   </record>                                   +
   <record>                                    +
     <leader>-----nam0-23-----^^^500-</leader> +
     <datafield tag="300" ind1="1" ind2=" ">   +
       <subfield code="b">抗震救灾</subfield>  +
       <subfield code="h">奥运会</subfield>    +
     </datafield>                              +
     <datafield tag="301" ind1=" " ind2=" ">   +
       <subfield code="a">英语</subfield>      +
       <subfield code="b">数学</subfield>      +
       <subfield code="c">10001</subfield>     +
       <subfield code="d">2022-11-02</subfield>+
     </datafield>                              +
     <datafield tag="302" ind1="0" ind2=" ">   +
       <subfield code="a">计算机科学</subfield>+
       <subfield code="a">电脑</subfield>      +
     </datafield>                              +
   </record>                                   +
 </collection>
 <collection xmlns="">                         +
   <record>                                    +
     <leader>-----nam0-22-----^^^450-</leader> +
     <datafield tag="200" ind1="1" ind2=" ">   +
       <subfield code="a">抗震救灾</subfield>  +
       <subfield code="f">奥运会</subfield>    +
     </datafield>                              +
     <datafield tag="209" ind1=" " ind2=" ">   +
       <subfield code="a">经济学</subfield>    +
       <subfield code="b">计算机</subfield>    +
       <subfield code="c">10001</subfield>     +
       <subfield code="d">2005-07-09</subfield>+
     </datafield>                              +
     <datafield tag="610" ind1="0" ind2=" ">   +
       <subfield code="a">计算机</subfield>    +
       <subfield code="a">笔记本</subfield>    +
     </datafield>                              +
   </record>                                   +
   <record>                                    +
     <leader>-----nam0-23-----^^^500-</leader> +
     <datafield tag="300" ind1="1" ind2=" ">   +
       <subfield code="b">抗震救灾</subfield>  +
       <subfield code="h">奥运会</subfield>    +
     </datafield>                              +
     <datafield tag="301" ind1=" " ind2=" ">   +
       <subfield code="a">英语</subfield>      +
       <subfield code="b">数学</subfield>      +
       <subfield code="c">10001</subfield>     +
       <subfield code="d">2022-11-02</subfield>+
     </datafield>                              +
     <datafield tag="302" ind1="0" ind2=" ">   +
       <subfield code="a">计算机科学</subfield>+
       <subfield code="a">电脑</subfield>      +
     </datafield>                              +
   </record>                                   +
 </collection>
 <collection xmlns="">                         +
   <record>                                    +
     <leader>-----nam0-22-----^^^450-</leader> +
     <datafield tag="209" ind1=" " ind2=" ">   +
       <subfield code="a">经济学</subfield>    +
       <subfield code="b">计算机</subfield>    +
       <subfield code="c">10001</subfield>     +
       <subfield code="d">2005-07-09</subfield>+
     </datafield>                              +
   </record>                                   +
   <record>                                    +
     <leader>-----nam0-23-----^^^500-</leader> +
     <datafield tag="300" ind1="1" ind2=" ">   +
       <subfield code="b">抗震救灾</subfield>  +
       <subfield code="h">奥运会</subfield>    +
     </datafield>                              +
     <datafield tag="301" ind1=" " ind2=" ">   +
       <subfield code="a">英语</subfield>      +
       <subfield code="b">数学</subfield>      +
       <subfield code="c">10001</subfield>     +
       <subfield code="d">2022-11-02</subfield>+
     </datafield>                              +
     <datafield tag="302" ind1="0" ind2=" ">   +
       <subfield code="a">计算机科学</subfield>+
       <subfield code="a">电脑</subfield>      +
     </datafield>                              +
   </record>                                   +
 </collection>
(3 rows)

DELETE from test_xmltype;
insert into test_xmltype values(1,'test xml',
xmlType('<?xml version="1.0" encoding="utf-8" ?>
<!--this is a booklist-->
<booklist type="C语言">
 <book category="computer">
  <title>learning computer</title>
  <author>July</author>
  <pageNumber>600</pageNumber>
 </book>
</booklist>'));
select * from test_xmltype;
 id |   name   |                data                
----+----------+------------------------------------
  1 | test xml | <!--this is a booklist-->         +
    |          | <booklist type="C语言">           +
    |          |  <book category="computer">       +
    |          |   <title>learning computer</title>+
    |          |   <author>July</author>           +
    |          |   <pageNumber>600</pageNumber>    +
    |          |  </book>                          +
    |          | </booklist>
(1 row)

-- 在book节点下新增一个元素
update test_xmltype set data=appendchildxml(data,'/booklist/book',XMLType('<price>82</price>'));
select getStringVal( extract(data,'/booklist')) as data from test_xmltype;
                 data                 
--------------------------------------
 <booklist type="C语言">             +
   <book category="computer">        +
     <title>learning computer</title>+
     <author>July</author>           +
     <pageNumber>600</pageNumber>    +
     <price>82</price>               +
   </book>                           +
 </booklist>
(1 row)

--在book节点下新增一个时间类型
update test_xmltype set data=appendchildxml(data,'/booklist/book',XMLType('<publication>2010-12-10 14:30:00</publication>'));
select getStringVal( extract(data,'/booklist')) as data from  test_xmltype;
                        data                        
----------------------------------------------------
 <booklist type="C语言">                           +
   <book category="computer">                      +
     <title>learning computer</title>              +
     <author>July</author>                         +
     <pageNumber>600</pageNumber>                  +
     <price>82</price>                             +
     <publication>2010-12-10 14:30:00</publication>+
   </book>                                         +
 </booklist>
(1 row)

--在book节点下新增一个浮点类型
update test_xmltype set data=appendchildxml(data,'/booklist/book',XMLType('<price>100.23</price>'));
select getStringVal( extract(data,'/booklist')) as data from  test_xmltype;
                        data                        
----------------------------------------------------
 <booklist type="C语言">                           +
   <book category="computer">                      +
     <title>learning computer</title>              +
     <author>July</author>                         +
     <pageNumber>600</pageNumber>                  +
     <price>82</price>                             +
     <publication>2010-12-10 14:30:00</publication>+
     <price>100.23</price>                         +
   </book>                                         +
 </booklist>
(1 row)

--在book节点下新增一个字符类型
update test_xmltype set data=appendchildxml(data,'/booklist/book',XMLType('<press>人民出版社</press>'));
select getStringVal( extract(data,'/booklist')) as data from  test_xmltype;
                        data                        
----------------------------------------------------
 <booklist type="C语言">                           +
   <book category="computer">                      +
     <title>learning computer</title>              +
     <author>July</author>                         +
     <pageNumber>600</pageNumber>                  +
     <price>82</price>                             +
     <publication>2010-12-10 14:30:00</publication>+
     <price>100.23</price>                         +
     <press>人民出版社</press>                     +
   </book>                                         +
 </booklist>
(1 row)

select extractvalue(data,'/booklist/book/press') from  test_xmltype;
 extractvalue 
--------------
 人民出版社
(1 row)

--在book节点下新增一个空
update test_xmltype set data=appendchildxml(data,'/booklist/book',XMLType('<testa>null</testa>'));
update test_xmltype set data=appendchildxml(data,'/booklist/book',XMLType('<test>''</test>'));
update test_xmltype set data=appendchildxml(data,'/booklist/book',XMLType('<press></press>'));
select getStringVal( extract(data,'/booklist')) as data from  test_xmltype;
                        data                        
----------------------------------------------------
 <booklist type="C语言">                           +
   <book category="computer">                      +
     <title>learning computer</title>              +
     <author>July</author>                         +
     <pageNumber>600</pageNumber>                  +
     <price>82</price>                             +
     <publication>2010-12-10 14:30:00</publication>+
     <price>100.23</price>                         +
     <press>人民出版社</press>                     +
     <testa>null</testa>                           +
     <test>'</test>                                +
     <press/>                                      +
   </book>                                         +
 </booklist>
(1 row)

-- namespace合法
update test_xmltype set data=appendchildxml(data,'/Book',xmltype('<Pagenumber>100</Pagenumber>'),array[array['lib','http://www.library.com']] );
select getStringVal( extract(data,'/Book')) as data from  test_xmltype;
 data 
------
 
(1 row)

-- namespace不合法
--为空
update test_xmltype set data=appendchildxml(data,'/Book',xmltype('<Pagenumber>100</Pagenumber>'),'');
update test_xmltype set data=appendchildxml(data,'/Book',xmltype('<Pagenumber>100</Pagenumber>'),null);
--为其他字符
update test_xmltype set data=appendchildxml(data,'/Book',xmltype('<Pagenumber>100</Pagenumber>'),'test');
ERROR:  array value must start with "{" or dimension information
LINE 1: ...ata,'/Book',xmltype('<Pagenumber>100</Pagenumber>'),'test');
                                                               ^
CONTEXT:  referenced column: data
--命名空间格式有误
update test_xmltype set data=appendchildxml(data,'/Book',xmltype('<Pagenumber>100</Pagenumber>'),array['lib','http://www.library.com'] );
ERROR:  invalid array for XML namespace mapping
DETAIL:  The array mast be two-dimensional with the length of second axis equal to 2.
CONTEXT:  referenced column: data
-- 强制转换为XML
update test_xmltype set data=appendchildxml(data,'/menu/beers','<name>Car</name>'::xml) where id=1;
update test_xmltype set data=appendchildxml(data,'/Book','<Pagenumber>100</Pagenumber>'::xml,array[array['lib','http://www.library.com']] ) where id=3;
select * from test_xmltype where id=1;
 id |   name   |                        data                        
----+----------+----------------------------------------------------
  1 | test xml | <!--this is a booklist-->                         +
    |          | <booklist type="C语言">                           +
    |          |   <book category="computer">                      +
    |          |     <title>learning computer</title>              +
    |          |     <author>July</author>                         +
    |          |     <pageNumber>600</pageNumber>                  +
    |          |     <price>82</price>                             +
    |          |     <publication>2010-12-10 14:30:00</publication>+
    |          |     <price>100.23</price>                         +
    |          |     <press>人民出版社</press>                     +
    |          |     <testa>null</testa>                           +
    |          |     <test>'</test>                                +
    |          |     <press/>                                      +
    |          |   </book>                                         +
    |          | </booklist>                                       +
    |          | 
(1 row)

select * from test_xmltype where id=3;
 id | name | data 
----+------+------
(0 rows)

-- 中文测试
drop table IF EXISTS  test_xmltype;
create table test_xmltype(
id int,
name text,
date_time date,
data xmltype);
--插入数据
insert into test_xmltype values(1,'test xml',sysdate,
xmlType('<?xml version="1.0" encoding="UTF-8" standalone="yes"?>
<资料 xmlns:IT="http://www.lenovo.com" xmlns:建筑="myURN:中联">
   <设备 IT:编号="联想6515b" 建筑:编号="中联F001">
      <IT:设备名>笔记本</IT:设备名>
      <IT:生产商>联想集团</IT:生产商>
      <IT:地址>北京市中关村127号</IT:地址>
      <建筑:设备名>起重机</建筑:设备名>
      <建筑:生产商>中联重科</建筑:生产商>
      <建筑:地址>湖南省长沙市新开铺113号</建筑:地址>
   </设备>
</资料>'));
update test_xmltype set data=appendchildxml(data,'/资料/设备',XMLType('<生厂商联系方式>010-234567</生厂商联系方式>'));
--查看是否追加成功
select getStringVal( extract(data,'/资料')) as data from  test_xmltype;
                              data                               
-----------------------------------------------------------------
 <资料 xmlns:IT="http://www.lenovo.com" xmlns:建筑="myURN:中联">+
   <设备 IT:编号="联想6515b" 建筑:编号="中联F001">              +
     <IT:设备名>笔记本</IT:设备名>                              +
     <IT:生产商>联想集团</IT:生产商>                            +
     <IT:地址>北京市中关村127号</IT:地址>                       +
     <建筑:设备名>起重机</建筑:设备名>                          +
     <建筑:生产商>中联重科</建筑:生产商>                        +
     <建筑:地址>湖南省长沙市新开铺113号</建筑:地址>             +
     <生厂商联系方式>010-234567</生厂商联系方式>                +
   </设备>                                                      +
 </资料>
(1 row)

drop table test_xmltype;
-- 其他兼容性测试，PG模式
create database db_postgres dbcompatibility = 'PG';
\c db_postgres
create table test_xmltype(
id int,
name text,
data xmltype);
Insert INTO test_xmltype
VALUES (1,'test xml doc','<?xml version="1.0" encoding="UTF-8" ?>
<collection xmlns="">
<record>
<leader>-----nam0-22-----^^^450-</leader>
<datafield tag="200" ind1="1" ind2=" ">
<subfield code="a">抗震救灾</subfield>
<subfield code="f">奥运会</subfield>
</datafield>
<datafield tag="209" ind1=" " ind2=" ">
<subfield code="a">经济学</subfield>
<subfield code="b">计算机</subfield>
<subfield code="c">10001</subfield>
<subfield code="d">2005-07-09</subfield>
</datafield>
<datafield tag="610" ind1="0" ind2=" ">
<subfield code="a">计算机</subfield>
<subfield code="a">笔记本</subfield>
</datafield>
</record>
</collection>') ;
select extract(x.data,'/collection/record/datafield/subfield') xmlseq from test_xmltype x;
ERROR:  Functions for xmltype are only supported in database which dbcompatibility = 'A'.
CONTEXT:  referenced column: xmlseq
select XMLSequence(extract(x.data,'/collection/record/datafield/subfield')) xmlseq from test_xmltype x;
ERROR:  Functions for xmltype are only supported in database which dbcompatibility = 'A'.
CONTEXT:  referenced column: xmlseq
select extractvalue(x.data,'/collection/record/leader') as A from test_xmltype x;
ERROR:  Functions for xmltype are only supported in database which dbcompatibility = 'A'.
CONTEXT:  referenced column: a
select getStringVal(extract(x.data,'/collection/record/datafield/subfield')) a from test_xmltype x;
ERROR:  Functions for xmltype are only supported in database which dbcompatibility = 'A'.
CONTEXT:  referenced column: a
select existsnode(x.data,'/collection/record/datafield[@tag="209"]/subfield[@code="a"]') as a from test_xmltype x;
ERROR:  Functions for xmltype are only supported in database which dbcompatibility = 'A'.
CONTEXT:  referenced column: a
drop table test_xmltype;
\c regression
drop database db_postgres;
-- 其他兼容性测试，C模式
DROP DATABASE IF EXISTS test_1087929sql;
NOTICE:  database "test_1087929sql" does not exist, skipping
CREATE DATABASE test_1087929sql DBCOMPATIBILITY 'C';
\c test_1087929sql
show sql_compatibility;
 sql_compatibility 
-------------------
 C
(1 row)

drop table IF EXISTS test_xmltype_1087929;
NOTICE:  table "test_xmltype_1087929" does not exist, skipping
create table test_xmltype_1087929(
ID int,
name varchar2(259),
data xmltype
);
Insert INTO test_xmltype_1087929
VALUES (1,'test xml doc','<?xml version="1.0" encoding="UTF-8" ?>
<collection xmlns="">
<record>
<leader>-----nam0-22-----^^^450-</leader>
<datafield tag="200" ind1="1" ind2=" ">
<subfield code="a">抗震救灾</subfield>
<subfield code="f">奥运会</subfield>
</datafield>
<datafield tag="209" ind1=" " ind2=" ">
<subfield code="a">经济学</subfield>
<subfield code="b">计算机</subfield>
<subfield code="c">10001</subfield>
<subfield code="d">2005-07-09</subfield>
</datafield>
<datafield tag="610" ind1="0" ind2=" ">
<subfield code="a">计算机</subfield>
<subfield code="a">笔记本</subfield>
</datafield>
</record>
</collection>') ;
--使用xmltype类型函数
select extract(x.data,'/collection/record/datafield/subfield') xmlseq from test_xmltype_1087929 x;
ERROR:  Functions for xmltype are only supported in database which dbcompatibility = 'A'.
CONTEXT:  referenced column: xmlseq
select XMLSequence(extract(x.data,'/collection/record/datafield/subfield')) xmlseq from test_xmltype_1087929 x;
ERROR:  Functions for xmltype are only supported in database which dbcompatibility = 'A'.
CONTEXT:  referenced column: xmlseq
select extractvalue(x.data,'/collection/record/leader') as A from test_xmltype_1087929 x;
ERROR:  Functions for xmltype are only supported in database which dbcompatibility = 'A'.
CONTEXT:  referenced column: a
select getStringVal(extract(x.data,'/collection/record/datafield/subfield')) a from test_xmltype_1087929 x;
ERROR:  Functions for xmltype are only supported in database which dbcompatibility = 'A'.
CONTEXT:  referenced column: a
select existsnode(x.data,'/collection/record/datafield[@tag="209"]/subfield[@code="a"]') as a from test_xmltype_1087929 x;
ERROR:  Functions for xmltype are only supported in database which dbcompatibility = 'A'.
CONTEXT:  referenced column: a
drop table test_xmltype_1087929;
\c regression
drop database test_1087929sql;
